category,brand,product_text,product_name,price_text,sale_price,per_unit_price_text,is_sale,store,per_unit_price2,unit_type,price2
bakery,,"Bagels, Cinnamon Raisin 6 Pack","Bagels, Cinnamon Raisin 6 Pack648 g",$4.29ea,,$3.97/ 100g,False,valu_mart,0.0397,g,4.29
bakery,,"Bagels, Everything 6 Pack","Bagels, Everything 6 Pack108 g",$4.29ea,,$3.97/ 100g,False,valu_mart,0.0397,g,4.29
bakery,Farmer's Market,"Loaf Cake, Banana","Farmer's MarketLoaf Cake, Banana390 g",$5.49ea,,$1.41/ 100g,False,valu_mart,0.0141,g,5.49
bakery,Farmer's Market,Bumbleberry Crumble Pie,Farmer's MarketBumbleberry Crumble Pie1 kg,$10.99ea,,$1.10/ 100g,False,valu_mart,0.011000000000000001,g,10.99
bakery,PC Organics,Organic Everything Bagel,PC OrganicsOrganic Everything Bagel450 g,$4.29ea,,$0.95/ 100g,False,valu_mart,0.0095,g,4.29
bakery,DItaliano,Sausage Buns,DItalianoSausage Buns456 g,$4.29ea,,$0.94/ 100g,False,valu_mart,0.009399999999999999,g,4.29
bakery,Promise Gluten Free, Soft White Loaf,Promise Gluten Free Soft White Loaf480 g,$7.99ea,,$1.66/ 100g,False,valu_mart,0.0166,g,7.99
bakery,Rudolphs,Light Rye Bread,RudolphsLight Rye Bread680 g,$4.29ea,,$0.63/ 100g,False,valu_mart,0.0063,g,4.29
bakery,Old Mill,Hot Dog Buns,Old MillHot Dog Buns344 g,$3.09ea,,$0.90/ 100g,False,valu_mart,0.009000000000000001,g,3.09
bakery,Country Harvest,14 Grain Bagels,Country Harvest14 Grain Bagels450 g,$4.29ea,,$0.95/ 100g,False,valu_mart,0.0095,g,4.29
bakery,Furlani,Frozen Texas Toast Parmesan Garlic,FurlaniFrozen Texas Toast Parmesan Garlic16x40.0 g,$5.29ea,,$0.83/ 100g,False,valu_mart,0.0083,g,5.29
bakery,Dimpflmeier,Sonnenblumenkerne Bread,DimpflmeierSonnenblumenkerne Bread454 g,$4.09ea,,$0.90/ 100g,False,valu_mart,0.009000000000000001,g,4.09
bakery,President's Choice,Yukon Gold Potato Loaf,President's ChoiceYukon Gold Potato Loaf480 g,$3.99ea,,$0.83/ 100g,False,valu_mart,0.0083,g,3.99
bakery,ACE,Ciabatta Pezzetti Duo,ACECiabatta Pezzetti Duo840 g,$6.79ea,,$0.81/ 100g,False,valu_mart,0.008100000000000001,g,6.79
bakery,ACE,Pane Rustico,ACEPane Rustico600 g,$5.79ea,,$0.97/ 100g,False,valu_mart,0.0097,g,5.79
bakery,No Name,Whole Wheat Dinner Roll,No NameWhole Wheat Dinner Roll420 g,$3.79ea,,$0.90/ 100g,False,valu_mart,0.009000000000000001,g,3.79
bakery,President's Choice,Multigrain Rye Loaf Bread,President's ChoiceMultigrain Rye Loaf Bread480 g,$3.99ea,,$0.83/ 100g,False,valu_mart,0.0083,g,3.99
bakery,Dimpflmeier,Bread Prebiotic Multi-Grain,DimpflmeierBread Prebiotic Multi-Grain454 g,$3.79ea,,$0.83/ 100g,False,valu_mart,0.0083,g,3.79
bakery,Wonder,"6 Pack English Muffin Breakfast Sandwich Bun, White","Wonder6 Pack English Muffin Breakfast Sandwich Bun, White342 g",$3.79ea,,$1.11/ 100g,False,valu_mart,0.0111,g,3.79
bakery,,Savoury Butter Rolls,Savoury Butter Rolls340 g,$4.49ea,,$1.32/ 100g,False,valu_mart,0.0132,g,4.49
bakery,Country Harvest,"Bagels, Raisin Cinnamon with Whole Wheat","Country HarvestBagels, Raisin Cinnamon with Whole Wheat450 g",$4.29ea,,$0.95/ 100g,False,valu_mart,0.0095,g,4.29
bakery,LA FOURNEE DOREE,Milk Brioche Rolls,LA FOURNEE DOREEMilk Brioche Rolls350 g,$6.49ea,,$1.85/ 100g,False,valu_mart,0.018500000000000003,g,6.49
bakery,Rudolphs,Bavarian Premium Sandwich Bread,RudolphsBavarian Premium Sandwich Bread500 g,$4.29ea,,$0.86/ 100g,False,valu_mart,0.0086,g,4.29
bakery,President's Choice,Cannoli Kit,President's ChoiceCannoli Kit300 g,$9.99ea,,$3.33/ 100g,False,valu_mart,0.0333,g,9.99
bakery,President's Choice,Gluten Free Millet & Quinoa,President's ChoiceGluten Free Millet & Quinoa454 g,$4.29ea,,$0.94/ 100g,False,valu_mart,0.009399999999999999,g,4.29
bakery,President's Choice,Crumpets,President's ChoiceCrumpets284 g,$2.99ea,,$1.05/ 100g,False,valu_mart,0.0105,g,2.99
bakery,Wonder,100% Whole Wheat Bread Thin Sliced,Wonder100% Whole Wheat Bread Thin Sliced675 g,$3.79ea,,$0.56/ 100g,False,valu_mart,0.005600000000000001,g,3.79
bakery,Dempster,100% Whole Grains 12 Grain Bread,Dempster100% Whole Grains 12 Grain Bread600 g,$4.19ea,,$0.70/ 100g,False,valu_mart,0.006999999999999999,g,4.19
bakery,Old Mill,Hamburger Buns,Old MillHamburger Buns360 g,$3.09ea,,$0.86/ 100g,False,valu_mart,0.0086,g,3.09
bakery,No Name,Bagel Sesame 6 Pack,No NameBagel Sesame 6 Pack510 g,$2.89ea,,$0.57/ 100g,False,valu_mart,0.005699999999999999,g,2.89
bakery,Dimpflmeier,Bread Original Swedish Style Light Rye,DimpflmeierBread Original Swedish Style Light Rye680 g,$5.29ea,,$0.78/ 100g,False,valu_mart,0.0078000000000000005,g,5.29
bakery,President's Choice,Tortillas Original ,President's ChoiceTortillas Original 340 g,$3.79ea,,$1.11/ 100g,False,valu_mart,0.0111,g,3.79
bakery,President's Choice,Traditional Naan Club Size ,President's ChoiceTraditional Naan Club Size 750 g,$5.59ea,,$0.75/ 100g,False,valu_mart,0.0075,g,5.59
bakery,,ProteinUp Tortilla Wrap with Sea Salt & Pepper,ProteinUp Tortilla Wrap with Sea Salt & Pepper284 g,$4.29ea,,$1.51/ 100g,False,valu_mart,0.0151,g,4.29
bakery,President's Choice,À L’Européenne Light Rye Loaf,President's ChoiceÀ L’Européenne Light Rye Loaf480 g,$3.99ea,,$0.83/ 100g,False,valu_mart,0.0083,g,3.99
bakery,No Name,Whole Wheat Mini Pitas,No NameWhole Wheat Mini Pitas170 g,$1.99ea,,$1.17/ 100g,False,valu_mart,0.011699999999999999,g,1.99
bakery,President's Choice,Traditional Naan Rounds,President's ChoiceTraditional Naan Rounds480 g,$4.59ea,,$0.96/ 100g,False,valu_mart,0.0096,g,4.59
bakery,Rubschlager,Bavarian Rye Loaf,RubschlagerBavarian Rye Loaf454 g,$3.49ea,,$0.77/ 100g,False,valu_mart,0.0077,g,3.49
bakery,Rubschlager,Pumpernickel Loaf,RubschlagerPumpernickel Loaf454 g,$3.49ea,,$0.77/ 100g,False,valu_mart,0.0077,g,3.49
bakery,Paneriso,Chocolate Chip Cookies,PanerisoChocolate Chip Cookies350 g,$8.49ea,,$2.43/ 100g,False,valu_mart,0.024300000000000002,g,8.49
bakery,Farmer's Market,Nanaimo Square,Farmer's MarketNanaimo Square400 g,$6.99ea,,$1.75/ 100g,False,valu_mart,0.0175,g,6.99
bakery,,Bread Cinnamon Raisin Sliced,Bread Cinnamon Raisin Sliced550 g,$4.49ea,,$0.82/ 100g,False,valu_mart,0.008199999999999999,g,4.49
bakery,Farmer's Market,Chocolate Chip Cookies,Farmer's MarketChocolate Chip Cookies456 g,$5.99ea,,$1.31/ 100g,False,valu_mart,0.0131,g,5.99
bakery,ACE,Multigrain Ciabatta Demi,ACEMultigrain Ciabatta Demi275 g,$2.99ea,,$1.09/ 100g,False,valu_mart,0.0109,g,2.99
bakery,President's Choice,Carrot Nut Rustic Cake,President's ChoiceCarrot Nut Rustic Cake610 g,$7.99ea,,$1.31/ 100g,False,valu_mart,0.0131,g,7.99
bakery,Farmer's Market,Cookies Oatmeal,Farmer's MarketCookies Oatmeal456 g,$5.99ea,,$1.31/ 100g,False,valu_mart,0.0131,g,5.99
bakery,Farmer's Market,Fudge Square,Farmer's MarketFudge Square400 g,$6.99ea,,$1.75/ 100g,False,valu_mart,0.0175,g,6.99
bakery,,Bread Cheese Sliced,Bread Cheese Sliced470 g,$6.29ea,,$1.34/ 100g,False,valu_mart,0.0134,g,6.29
bakery,President's Choice,Meringue Nests,President's ChoiceMeringue Nests100 g,$3.99ea,,$3.99/ 100g,False,valu_mart,0.039900000000000005,g,3.99
bakery,Farmer's Market,Brownies,Farmer's MarketBrownies265 g,$4.99ea,,$1.88/ 100g,False,valu_mart,0.018799999999999997,g,4.99
bakery,,Old Fashioned Lemon Pie ,Old Fashioned Lemon Pie 114 g,$1.79ea,,$1.57/ 100g,False,valu_mart,0.015700000000000002,g,1.79
bakery,,Hawaiian Sprinkle Donutss 2 Pack,Hawaiian Sprinkle Donutss 2 Pack2x200.0 g,$3.49ea,,$1.75/ 100g,False,valu_mart,0.0175,g,3.49
bakery,Farmer's Market,Marble Coffee Cake,Farmer's MarketMarble Coffee Cake500 g,$6.00ea,,$1.20/ 100g,False,valu_mart,0.012,g,6.00
bakery,Farmer's Market,Chocolate Ganache Coffee Cake,Farmer's MarketChocolate Ganache Coffee Cake500 g,$6.00ea,,$1.20/ 100g,False,valu_mart,0.012,g,6.00
bakery,Farmer's Market,Vanilla Cake,Farmer's MarketVanilla Cake490 g,$6.99ea,,$1.43/ 100g,False,valu_mart,0.0143,g,6.99
bakery,Dimpflmeier,Vollkornbrot Bread,DimpflmeierVollkornbrot Bread454 g,$3.79ea,,$0.83/ 100g,False,valu_mart,0.0083,g,3.79
bakery,Farmer's Market,Cookies Oatmeal,Farmer's MarketCookies Oatmeal456 g,$5.99ea,,$1.31/ 100g,False,valu_mart,0.0131,g,5.99
bakery,Farmer's Market,Fudge Square,Farmer's MarketFudge Square400 g,$6.99ea,,$1.75/ 100g,False,valu_mart,0.0175,g,6.99
bakery,,Texas Hot Dog Buns,Texas Hot Dog Buns520 g,$3.79ea,,$0.73/ 100g,False,valu_mart,0.0073,g,3.79
bakery,,"Pumpkin Pie, 8 Inch","Pumpkin Pie, 8 Inch680 g",$6.79ea,,$1.00/ 100g,False,valu_mart,0.01,g,6.79
bakery,,Old Fashioned Wild Blueberry Pie,Old Fashioned Wild Blueberry Pie114 g,$1.79ea,,$1.57/ 100g,False,valu_mart,0.015700000000000002,g,1.79
bakery,Farmer's Market,Red Velvet Cake,Farmer's MarketRed Velvet Cake490 g,$6.99ea,,$1.43/ 100g,False,valu_mart,0.0143,g,6.99
bakery,Sha Sha,Shasha Cocoa Snaps,Sha ShaShasha Cocoa Snaps300x300.0 g,$7.49ea,,$2.50/ 100g,False,valu_mart,0.025,g,7.49
bakery,,"Cherry Pie, 8 Inch","Cherry Pie, 8 Inch680 g",$6.79ea,,$1.00/ 100g,False,valu_mart,0.01,g,6.79
bakery,Paneriso,Blueberry Muffins,PanerisoBlueberry Muffins372 g,$8.49ea,,$2.28/ 100g,False,valu_mart,0.022799999999999997,g,8.49
bakery,,"Bagel, Herb N' Cheese","Bagel, Herb N' Cheese108 g",$4.29ea,,$3.97/ 100g,False,valu_mart,0.0397,g,4.29
bakery,Farmer's Market,"Sliced Loaf Cake, Banana","Farmer's MarketSliced Loaf Cake, Banana420 g",$5.49ea,,$1.31/ 100g,False,valu_mart,0.0131,g,5.49
bakery,Farmer's Market,Lemon Squares,Farmer's MarketLemon Squares400 g,$6.99ea,,$1.75/ 100g,False,valu_mart,0.0175,g,6.99
bakery,Farmer's Market,Black Forest Cake,Farmer's MarketBlack Forest Cake750 g,$15.99ea,,$2.13/ 100g,False,valu_mart,0.0213,g,15.99
bakery,Farmer's Market,"Sliced Loaf Cake, Vanilla","Farmer's MarketSliced Loaf Cake, Vanilla420 g",$5.49ea,,$1.31/ 100g,False,valu_mart,0.0131,g,5.49
bakery,Farmer's Market,Oatmeal Raisin Cookies,Farmer's MarketOatmeal Raisin Cookies456 g,$5.99ea,,$1.31/ 100g,False,valu_mart,0.0131,g,5.99
bakery,Farmer's Market,Macaroons,Farmer's MarketMacaroons350 g,$6.49ea,,$1.85/ 100g,False,valu_mart,0.018500000000000003,g,6.49
bakery,Elite,"6"" Triple Chocolate Mousse","Elite6"" Triple Chocolate Mousse900 g",$17.49ea,,$1.94/ 100g,False,valu_mart,0.0194,g,17.49
bakery,,White Buns Dinner Rolls,White Buns Dinner Rolls12x1.0 ea,$4.29ea,,$0.36/ 1ea,False,valu_mart,0.36,,4.29
bakery,,"Apple Pie, 8 Inch","Apple Pie, 8 Inch750 g",$6.79ea,,$0.91/ 100g,False,valu_mart,0.0091,g,6.79
bakery,La Baguetterie,Roasted Garlic Oval,La BaguetterieRoasted Garlic Oval398 g,$2.79ea,,$0.70/ 100g,False,valu_mart,0.006999999999999999,g,2.79
bakery,Baxters,Swiss Rolls Strawberry Shortcake,BaxtersSwiss Rolls Strawberry Shortcake402 g,$5.49ea,,$1.37/ 100g,False,valu_mart,0.0137,g,5.49
bakery,President's Choice,Meringue Nests,President's ChoiceMeringue Nests100 g,$3.99ea,,$3.99/ 100g,False,valu_mart,0.039900000000000005,g,3.99
bakery,Promise Gluten Free, Multigrain Loaf,Promise Gluten Free Multigrain Loaf480 g,$7.99ea,,$1.66/ 100g,False,valu_mart,0.0166,g,7.99
bakery,Frontier Bakery,Thick Pouch Whole Wheat Pitas,Frontier BakeryThick Pouch Whole Wheat Pitas425 g,$1.59ea,,$0.37/ 100g,False,valu_mart,0.0037,g,1.59
bakery,Lanthier,Croissant Mini'S ,LanthierCroissant Mini'S 14x210.0 g,$5.49ea,,$2.61/ 100g,False,valu_mart,0.026099999999999998,g,5.49
bakery,Weston,"Texas Toast Bread, 100% Whole Wheat","WestonTexas Toast Bread, 100% Whole Wheat675 g",$3.79ea,,$0.56/ 100g,False,valu_mart,0.005600000000000001,g,3.79
bakery,LA FOURNEE DOREE,Mini Brioches,LA FOURNEE DOREEMini Brioches480 g,$4.79ea,,$1.00/ 100g,False,valu_mart,0.01,g,4.79
bakery,Country Harvest,Sourdough Bagel,Country HarvestSourdough Bagel450 g,$4.29ea,,$0.95/ 100g,False,valu_mart,0.0095,g,4.29
bakery,,"Crusty Bread, French Sliced","Crusty Bread, French Sliced450 g",$2.99ea,,$0.66/ 100g,False,valu_mart,0.0066,g,2.99
bakery,Country Harvest,Sunflower Flax Bread,Country HarvestSunflower Flax Bread600 g,$4.29ea,,$0.72/ 100g,False,valu_mart,0.0072,g,4.29
bakery,Wonder,"Whole Wheat 10"" Wraps","WonderWhole Wheat 10"" Wraps640 g",$4.79ea,,$0.75/ 100g,False,valu_mart,0.0075,g,4.79
bakery,PC Blue Menu,100% Whole Wheat Loaf,PC Blue Menu100% Whole Wheat Loaf450 g,$5.19ea,,$1.15/ 100g,False,valu_mart,0.0115,g,5.19
bakery,President's Choice,Original Mini Bagel,President's ChoiceOriginal Mini Bagel380 g,$3.49ea,,$0.92/ 100g,False,valu_mart,0.0092,g,3.49
bakery,President's Choice,Extra Thick Sliced Cinnamon Bread with Raisins,President's ChoiceExtra Thick Sliced Cinnamon Bread with Raisins675 g,$4.99ea,,$0.74/ 100g,False,valu_mart,0.0074,g,4.99
bakery,Frontier Bakery,White Bread Greek Pitas,Frontier BakeryWhite Bread Greek Pitas425 g,$1.59ea,,$0.37/ 100g,False,valu_mart,0.0037,g,1.59
bakery,President's Choice,Mini Tortilllas Original ,President's ChoiceMini Tortilllas Original 192 g,$3.39ea,,$1.77/ 100g,False,valu_mart,0.0177,g,3.39
bakery,,Flame-Baked Naan Original,Flame-Baked Naan Original400 g,$3.99ea,,$1.00/ 100g,False,valu_mart,0.01,g,3.99
bakery,ACE,Brioche Gourmet Hamburger Bun,ACEBrioche Gourmet Hamburger Bun260 g,$3.99ea,,$1.53/ 100g,False,valu_mart,0.015300000000000001,g,3.99
bakery,ACE,Brioche Bagel,ACEBrioche Bagel272 g,$4.19ea,,$1.54/ 100g,False,valu_mart,0.0154,g,4.19
bakery,DItaliano,Brioche-Style Sausage Buns,DItalianoBrioche-Style Sausage Buns420 g,$4.29ea,,$1.02/ 100g,False,valu_mart,0.0102,g,4.29
bakery,Rubschlager,Bavarian Multigrain Loaf,RubschlagerBavarian Multigrain Loaf454 g,$3.49ea,,$0.77/ 100g,False,valu_mart,0.0077,g,3.49
bakery,Casa Mendosa,Large Spinach Tortillas,Casa MendosaLarge Spinach Tortillas384 g,$4.79ea,,$1.25/ 100g,False,valu_mart,0.0125,g,4.79
bakery,Wonder,Flour Tortillas White 10 Medium ,WonderFlour Tortillas White 10 Medium 340 g,$4.29ea,,$1.26/ 100g,False,valu_mart,0.0126,g,4.29
bakery,President's Choice, Khubz Middle Eastern-Style Pita,President's Choice Khubz Middle Eastern-Style Pita400 g,$3.49ea,,$0.87/ 100g,False,valu_mart,0.0087,g,3.49
bakery,,Red Pepper Breads,Red Pepper Breads284 g,$4.29ea,,$1.73/ 100g,False,valu_mart,0.0173,g,4.29
bakery,Farmer's Market,Cake Black Forest,Farmer's MarketCake Black Forest1.2 kg,$22.99ea,,$1.92/ 100g,False,valu_mart,0.0192,g,22.99
bakery,Sha Sha,Coconut Chia Snaps ,Sha ShaCoconut Chia Snaps 300 g,$6.99ea,,$2.33/ 100g,False,valu_mart,0.0233,g,6.99
bakery,Farmer's Market,Cake Cookies And Crème,Farmer's MarketCake Cookies And Crème1.2 kg,$22.99ea,,$1.92/ 100g,False,valu_mart,0.0192,g,22.99
bakery,Farmer's Market,Mini Cinnamon Rolls,Farmer's MarketMini Cinnamon Rolls9x30.0 g,$6.29ea,,$2.33/ 100g,False,valu_mart,0.0233,g,6.29
bakery,,"Celebration Cupcakes, White","Celebration Cupcakes, White6x300.0 g",$6.49ea,,$0.36/ 100g,False,valu_mart,0.0036,g,6.49
bakery,,Texas Hamburger Buns- White,Texas Hamburger Buns- White520 g,$3.79ea,,$0.73/ 100g,False,valu_mart,0.0073,g,3.79
bakery,,"Flax Bread, Sliced","Flax Bread, Sliced450 g",$3.99ea,,$0.89/ 100g,False,valu_mart,0.0089,g,3.99
bakery,,"Caramel Apple Pie, 8 Inch","Caramel Apple Pie, 8 Inch680 g",$6.79ea,,$1.00/ 100g,False,valu_mart,0.01,g,6.79
bakery,,Amazing Grain Bread Sliced,Amazing Grain Bread Sliced450 g,$4.49ea,,$1.00/ 100g,False,valu_mart,0.01,g,4.49
bakery,Paneriso,Lemon Loaf Cake,PanerisoLemon Loaf Cake454 g,$8.49ea,,$1.87/ 100g,False,valu_mart,0.0187,g,8.49
bakery,ACE,Roasted Garlic Oval,ACERoasted Garlic Oval454 g,$5.99ea,,$1.32/ 100g,False,valu_mart,0.0132,g,5.99
bakery,ACE,Toasted Sesame Mini Crisps,ACEToasted Sesame Mini Crisps180 g,$6.29ea,,$3.49/ 100g,False,valu_mart,0.0349,g,6.29
bakery,,Corn Popped Grains,Corn Popped Grains120 g,$5.29ea,,$4.41/ 100g,False,valu_mart,0.0441,g,5.29
bakery,ACE,Cranberry Focaccia ,ACECranberry Focaccia 320 g,$6.59ea,,$2.06/ 100g,False,valu_mart,0.0206,g,6.59
bakery,La Baguetterie,Ciabatta Rolls ,La BaguetterieCiabatta Rolls 400 g,$2.79ea,,$0.70/ 100g,False,valu_mart,0.006999999999999999,g,2.79
bakery,two-bite,Lunar New Year Cupcakes,two-biteLunar New Year Cupcakes300 g,$4.99ea,,$1.66/ 100g,False,valu_mart,0.0166,g,4.99
bakery,ACE,Three Cheese Oval,ACEThree Cheese Oval454 g,$5.99ea,,$1.32/ 100g,False,valu_mart,0.0132,g,5.99
bakery,Farmer's Market,Apple Pie 10 Inch,Farmer's MarketApple Pie 10 Inch1 kg,$10.99ea,,$1.10/ 100g,False,valu_mart,0.011000000000000001,g,10.99
bakery,,"Sesame Egg Bread, Sliced","Sesame Egg Bread, Sliced450 g",$3.89ea,,$0.86/ 100g,False,valu_mart,0.0086,g,3.89
bakery,Farmer's Market,"Tea Biscuits, Raisin","Farmer's MarketTea Biscuits, Raisin315 g",$6.29ea,,$2.00/ 100g,False,valu_mart,0.02,g,6.29
bakery,,"6"" Chocolate Brownie Cheesecake","6"" Chocolate Brownie Cheesecake600 g",$18.99ea,,$3.17/ 100g,False,valu_mart,0.0317,g,18.99
bakery,Farmer's Market,Assorted Mini Tarts,Farmer's MarketAssorted Mini Tarts300 g,$7.99ea,,$2.66/ 100g,False,valu_mart,0.026600000000000002,g,7.99
bakery,,Chocolate Dip Donut 2 Pack,Chocolate Dip Donut 2 Pack2x170.0 g,$3.49ea,,$2.05/ 100g,False,valu_mart,0.020499999999999997,g,3.49
bakery,Farmer's Market,Apple Crumble Pie,Farmer's MarketApple Crumble Pie1 kg,$10.99ea,,$1.10/ 100g,False,valu_mart,0.011000000000000001,g,10.99
bakery,,"Bagel, Blueberry","Bagel, Blueberry108 g",$4.29ea,,$3.97/ 100g,False,valu_mart,0.0397,g,4.29
bakery,,"Bagels, Sesame","Bagels, Sesame108 g",$4.29ea,,$3.97/ 100g,False,valu_mart,0.0397,g,4.29
bakery,Farmer's Market,Lemon Cranberry Muffins,Farmer's MarketLemon Cranberry Muffins600 g,$6.99ea,,$1.17/ 100g,False,valu_mart,0.011699999999999999,g,6.99
bakery,Farmer's Market,"Loaf Cake, Cinnamon Swirl","Farmer's MarketLoaf Cake, Cinnamon Swirl390 g",$5.49ea,,$1.41/ 100g,False,valu_mart,0.0141,g,5.49
bakery,Vachon,Jos Louis The Original Cakes,VachonJos Louis The Original Cakes324 g,$4.89ea,,$1.51/ 100g,False,valu_mart,0.0151,g,4.89
bakery,,Pumpernickel Sesame Bagels,Pumpernickel Sesame Bagels600 g,$4.29ea,,$0.72/ 100g,False,valu_mart,0.0072,g,4.29
bakery,Rudolphs,Bavarian Multi-grain Bread,RudolphsBavarian Multi-grain Bread500 g,$4.29ea,,$0.86/ 100g,False,valu_mart,0.0086,g,4.29
bakery,Dimpflmeier,Pumpernickel Bread,DimpflmeierPumpernickel Bread454 g,$3.79ea,,$0.83/ 100g,False,valu_mart,0.0083,g,3.79
bakery,Frontier Bakery,Whole Wheat Greek Pitas,Frontier BakeryWhole Wheat Greek Pitas425 g,$1.59ea,,$0.37/ 100g,False,valu_mart,0.0037,g,1.59
bakery,No Name,White Dinner Roll,No NameWhite Dinner Roll420 g,$3.79ea,,$0.90/ 100g,False,valu_mart,0.009000000000000001,g,3.79
bakery,PC Blue Menu,Everything Bagels 6 Bagels,PC Blue MenuEverything Bagels 6 Bagels336 g,$4.49ea,,$1.23/ 100g,False,valu_mart,0.0123,g,4.49
bakery,DItaliano,Hamburger Buns Brizzolio Extra Soft,DItalianoHamburger Buns Brizzolio Extra Soft528 g,$4.29ea,,$0.81/ 100g,False,valu_mart,0.008100000000000001,g,4.29
bakery,DItaliano,Crustini Buns,DItalianoCrustini Buns568 g,$4.29ea,,$0.76/ 100g,False,valu_mart,0.0076,g,4.29
bakery,President's Choice,Everything Naan Dippers Club Size,President's ChoiceEverything Naan Dippers Club Size410 g,$6.99ea,,$1.70/ 100g,False,valu_mart,0.017,g,6.99
bakery,Dimpflmeier,Rye Bread With Sunflower Seeds,DimpflmeierRye Bread With Sunflower Seeds454 g,$4.99ea,,$1.10/ 100g,False,valu_mart,0.011000000000000001,g,4.99
bakery,DItaliano,Thick Slice Bread 100% Whole Wheat ,DItalianoThick Slice Bread 100% Whole Wheat 675 g,$4.29ea,,$0.64/ 100g,False,valu_mart,0.0064,g,4.29
bakery,School Safe,Muffin Bars Birthday Cake,School SafeMuffin Bars Birthday Cake296 g,$3.99ea,,$1.35/ 100g,False,valu_mart,0.013500000000000002,g,3.99
bakery,President's Choice,Gluten Free Plain Bread Crumbs,President's ChoiceGluten Free Plain Bread Crumbs275 g,$4.09ea,,$1.49/ 100g,False,valu_mart,0.0149,g,4.09
bakery,Old Mill,Cracked Wheat Bread,Old MillCracked Wheat Bread675 g,$2.79ea,,$0.41/ 100g,False,valu_mart,0.0040999999999999995,g,2.79
bakery,President's Choice,European Multi Grain Bread,President's ChoiceEuropean Multi Grain Bread500 g,$3.99ea,,$0.80/ 100g,False,valu_mart,0.008,g,3.99
bakery,President's Choice,Brioche Hot Dog Buns,President's ChoiceBrioche Hot Dog Buns270 g,$4.99ea,,$1.85/ 100g,False,valu_mart,0.018500000000000003,g,4.99
bakery,President's Choice,Gluten Free White Bread,President's ChoiceGluten Free White Bread454 g,$4.29ea,,$0.94/ 100g,False,valu_mart,0.009399999999999999,g,4.29
bakery,ACE,Everything Baguette Bagel,ACEEverything Baguette Bagel360 g,$4.19ea,,$1.16/ 100g,False,valu_mart,0.0116,g,4.19
bakery,ACE,White Gourmet Sausage Bun,ACEWhite Gourmet Sausage Bun340 g,$3.99ea,,$1.17/ 100g,False,valu_mart,0.011699999999999999,g,3.99
bakery,ACE,White Baguette Bagel,ACEWhite Baguette Bagel300 g,$4.19ea,,$1.40/ 100g,False,valu_mart,0.013999999999999999,g,4.19
bakery,ACE,White Gourmet Sausage Bun,ACEWhite Gourmet Sausage Bun340 g,$3.99ea,,$1.17/ 100g,False,valu_mart,0.011699999999999999,g,3.99
bakery,ACE,Organic Granary Sliced Loaf,ACEOrganic Granary Sliced Loaf525 g,$6.19ea,,$1.18/ 100g,False,valu_mart,0.0118,g,6.19
bakery,President's Choice,Original Pizza Crusts,President's ChoiceOriginal Pizza Crusts440 g,$4.49ea,,$0.98/ 100g,False,valu_mart,0.0098,g,4.49
bakery,President's Choice,Protein Tortillas,President's ChoiceProtein Tortillas342 g,$4.29ea,,$1.25/ 100g,False,valu_mart,0.0125,g,4.29
bakery,No Name,Original Mini Pitas,No NameOriginal Mini Pitas170 g,$1.99ea,,$1.17/ 100g,False,valu_mart,0.011699999999999999,g,1.99
bakery,President's Choice,Multigrain Pizza Crusts,President's ChoiceMultigrain Pizza Crusts440 g,$4.49ea,,$0.98/ 100g,False,valu_mart,0.0098,g,4.49
bakery,President's Choice,Appetizer Flatbreads,President's ChoiceAppetizer Flatbreads220 g,$3.29ea,,$1.50/ 100g,False,valu_mart,0.015,g,3.29
bakery,Charlottes,Real Chocolate Brownie Bites,CharlottesReal Chocolate Brownie Bites290 g,$4.99ea,,$1.72/ 100g,False,valu_mart,0.0172,g,4.99
bakery,President's Choice,Mini Naan Traditional 4 Flatbreads,President's ChoiceMini Naan Traditional 4 Flatbreads180 g,$3.49ea,,$1.94/ 100g,False,valu_mart,0.0194,g,3.49
bakery,Wonder,Wrap Me White Flour Tortillas Large ,WonderWrap Me White Flour Tortillas Large 640 g,$4.79ea,,$0.75/ 100g,False,valu_mart,0.0075,g,4.79
bakery,President's Choice,"Flatbread, Original","President's ChoiceFlatbread, Original300 g",$3.29ea,,$1.10/ 100g,False,valu_mart,0.011000000000000001,g,3.29
meat,PC Blue Menu,"Chicken Breast, Boneless Skinless, 3 Pack","PC Blue MenuChicken Breast, Boneless Skinless, 3 Pack1 ea",$12.00ea,,$12.00/ 1ea,False,valu_mart,12.0,,12.00
meat,,Pork Tenderloin Pack of 2,Pork Tenderloin Pack of 2,$14.00(est.)ea,,$13.21/ 1kg,False,valu_mart,0.013210000000000001,g,14.00
meat,PC Blue Menu,"Boneless Skinless Chicken Breasts, 4 Pack","PC Blue MenuBoneless Skinless Chicken Breasts, 4 Pack1 ea",$15.00ea,,$15.00/ 1ea,False,valu_mart,15.0,,15.00
meat,President's Choice,"Pub Recipe Chicken Strips, Fully Cooked","President's ChoicePub Recipe Chicken Strips, Fully Cooked700 g",$5.99ea,,$0.86/ 100g,False,valu_mart,0.0086,g,5.99
meat,,"Beef Striploin Grilling Steak, Club Pack","Beef Striploin Grilling Steak, Club Pack",$35.77(est.)ea,,$37.46/ 1kg,False,valu_mart,0.03746,g,35.77
meat,Schneider,Hickory Smoked Classic Cut Bacon,SchneiderHickory Smoked Classic Cut Bacon375 g,$8.49ea,,$2.26/ 100g,False,valu_mart,0.0226,g,8.49
meat,President's Choice,"Free From Chicken Breast, Boneless, Skinless, Club Pack","President's ChoiceFree From Chicken Breast, Boneless, Skinless, Club Pack",$24.28(est.)ea,,$22.91/ 1kg,False,valu_mart,0.02291,g,24.28
meat,Janes,"Pub Style Chicken Strips, Fully Cooked","JanesPub Style Chicken Strips, Fully Cooked700 g",$12.99ea,,$1.86/ 100g,False,valu_mart,0.018600000000000002,g,12.99
meat,No Name,Mild Sugar-Cured Bacon,No NameMild Sugar-Cured Bacon500 g,$7.49ea,,$1.50/ 100g,False,valu_mart,0.015,g,7.49
meat,,"Beef Ground Medium, Club Pack","Beef Ground Medium, Club Pack",$14.72(est.)ea,,$11.00/ 1kg,False,valu_mart,0.011,g,14.72
meat,PC Blue Menu,Chicken Thighs  boneless Skinless  8 Pack,PC Blue MenuChicken Thighs  boneless Skinless  8 Pack1 ea,$12.00ea,,$12.00/ 1ea,False,valu_mart,12.0,,12.00
meat,President's Choice,"Free From Chicken Breast, Boneless, Skinless","President's ChoiceFree From Chicken Breast, Boneless, Skinless",$12.14(est.)ea,,$23.35/ 1kg,False,valu_mart,0.023350000000000003,g,12.14
meat,,Lean Ground Beef,Lean Ground Beef,$7.27(est.)ea,,$15.41/ 1kg,False,valu_mart,0.01541,g,7.27
meat,PC Blue Menu,Ground Chicken,PC Blue MenuGround Chicken454 g,$7.00ea,,$1.54/ 100g,False,valu_mart,0.0154,g,7.00
meat,Janes,"Pub Style Chicken Nugget, Fully Cooked","JanesPub Style Chicken Nugget, Fully Cooked700 g",$12.99ea,,$1.86/ 100g,False,valu_mart,0.018600000000000002,g,12.99
meat,Maple Leaf,Original Natural Bacon,Maple LeafOriginal Natural Bacon375 g,$8.49ea,,$2.26/ 100g,False,valu_mart,0.0226,g,8.49
meat,No Name,Original Hot Dogs    ,No NameOriginal Hot Dogs    450 g,$4.49ea,,$1.00/ 100g,False,valu_mart,0.01,g,4.49
meat,No Name,Chicken Hot Dogs,No NameChicken Hot Dogs450 g,$2.79ea,,$0.62/ 100g,False,valu_mart,0.0062,g,2.79
meat,No Name,"Bacon, Mild Sugar Cured with Reduced Salt, Uncooked","No NameBacon, Mild Sugar Cured with Reduced Salt, Uncooked500 g",$7.49ea,,$1.50/ 100g,False,valu_mart,0.015,g,7.49
meat,President's Choice,Free From Mild Italian Pork Sausages,President's ChoiceFree From Mild Italian Pork Sausages500 g,$7.49ea,,$1.50/ 100g,False,valu_mart,0.015,g,7.49
meat,President's Choice,"Air Chilled Chicken, Whole","President's ChoiceAir Chilled Chicken, Whole",$9.88(est.)ea,,$5.49/ 1kg,False,valu_mart,0.00549,g,9.88
meat,,"Chicken Leg (Back Attached) , Club Pack","Chicken Leg (Back Attached) , Club Pack",$10.47(est.)ea,,$8.80/ 1kg,False,valu_mart,0.0088,g,10.47
meat,Maple Leaf,Natural Top Dogs Original Hot Dogs,Maple LeafNatural Top Dogs Original Hot Dogs375 g,$6.99ea,,$1.86/ 100g,False,valu_mart,0.018600000000000002,g,6.99
meat,Janes,"Pub Style Chicken Burger, Fully Cooked","JanesPub Style Chicken Burger, Fully Cooked700 g",$12.99ea,,$1.86/ 100g,False,valu_mart,0.018600000000000002,g,12.99
meat,,Beef Striploin Steak,Beef Striploin Steak,$15.75(est.)ea,,$39.66/ 1kg,False,valu_mart,0.039659999999999994,g,15.75
meat,,Beef Ground Lean Club Pack,Beef Ground Lean Club Pack,$15.38(est.)ea,,$13.21/ 1kg,False,valu_mart,0.013210000000000001,g,15.38
meat,,"Pork Loin Chop, Bone In Center Cut","Pork Loin Chop, Bone In Center Cut",$6.05(est.)ea,,$12.10/ 1kg,False,valu_mart,0.0121,g,6.05
