category,brand,product_text,product_name,price_text,sale_price,per_unit_price_text,is_sale,store,per_unit_price2,unit_type,price2
produce,PC Organics,Organic Beefsteak Red Tomato,PC OrganicsOrganic Beefsteak Red Tomato,$3.57(est.)ea,,$13.21/ 1kg,False,valu_mart,0.013210000000000001,g,3.57
produce,PC Organics,Organic Fuji Apples,PC OrganicsOrganic Fuji Apples3 lb bag,$9.99ea,,$0.73/ 100g,False,valu_mart,0.0073,g,9.99
produce,Bolthouse,Strawberry Banana,BolthouseStrawberry Banana450 ml,$5.49ea,,$1.22/ 100ml,False,valu_mart,0.012199999999999999,ml,5.49
produce,Greenhouse,Organic Shake Vanilla Almond Brekky,GreenhouseOrganic Shake Vanilla Almond Brekky300 ml,$7.99ea,,$2.66/ 100g,False,valu_mart,0.026600000000000002,g,7.99
produce,,Carrots & Cucumber ,Carrots & Cucumber 255 g,$4.00ea,,$1.57/ 100g,False,valu_mart,0.015700000000000002,g,4.00
produce,Dole,Chop Chop Kit Tropical Thai,DoleChop Chop Kit Tropical Thai258 g,$6.99ea,,$2.61/ 100g,False,valu_mart,0.026099999999999998,g,6.99
produce,PC Organics,Honeycrisp Apples 3Lb Bag,PC OrganicsHoneycrisp Apples 3Lb Bag1.36 kg,$12.99ea,,$0.96/ 100g,False,valu_mart,0.0096,g,12.99
produce,Farmer's Market,Spartan Apples,Farmer's MarketSpartan Apples4 lb bag,$7.99ea,,$0.44/ 100g,False,valu_mart,0.0044,g,7.99
produce,,"Chanterelle Mushrooms, Dried","Chanterelle Mushrooms, Dried14 g",$5.49ea,,$39.21/ 100g,False,valu_mart,0.3921,g,5.49
produce,,Fresh Coconut Young,Fresh Coconut Young1 ea,$4.99ea,,$4.99/ 1ea,False,valu_mart,4.99,,4.99
produce,,Golden Delicious Apples,Golden Delicious Apples,$1.45(est.)ea,,$6.59/ 1kg,False,valu_mart,0.0065899999999999995,g,1.45
produce,,Carrots & Cucumber ,Carrots & Cucumber 255 g,$4.00ea,,$1.57/ 100g,False,valu_mart,0.015700000000000002,g,4.00
produce,No Name,"Roasted Peanuts, No Salt","No NameRoasted Peanuts, No Salt907 g",$6.99ea,,$0.77/ 100g,False,valu_mart,0.0077,g,6.99
produce,,Jazz Apples,Jazz Apples,$1.61(est.)ea,,$7.69/ 1kg,False,valu_mart,0.007690000000000001,g,1.61
produce,,"Wonderful Pistachios, Shelled","Wonderful Pistachios, Shelled170 g",$8.99ea,,$5.29/ 100g,False,valu_mart,0.0529,g,8.99
produce,Taylor Farms,"Chopped Salad Kit, Steakhouse","Taylor FarmsChopped Salad Kit, Steakhouse365 g",$6.99ea,,$1.92/ 100g,False,valu_mart,0.0192,g,6.99
produce,Farmer's Market,Honeycrisp Apples,Farmer's MarketHoneycrisp Apples4 lb bag,$12.99ea,,$0.72/ 100g,False,valu_mart,0.0072,g,12.99
produce,,Gold Cored Pineapple,Gold Cored Pineapple0.6 kg,$5.99ea,,$1.00/ 100g,False,valu_mart,0.01,g,5.99
produce,President's Choice,Salted California Pistachios,President's ChoiceSalted California Pistachios454 g,$10.99ea,,$2.42/ 100g,False,valu_mart,0.0242,g,10.99
produce,,Black Figs,Black Figs1 ea,$1.99ea,,$1.99/ 1ea,False,valu_mart,1.99,,1.99
produce,,Mini Greek Salad,Mini Greek Salad155 g,$5.00ea,,$3.23/ 100g,False,valu_mart,0.0323,g,5.00
produce,,Hami Melons,Hami Melons,$16.03(est.)ea,,$5.49/ 1kg,False,valu_mart,0.00549,g,16.03
produce,PC Organics,Organic Yellow Potatoes,PC OrganicsOrganic Yellow Potatoes3 lb bag,$4.99ea,,$0.37/ 100g,False,valu_mart,0.0037,g,4.99
produce,PC Organics,Organic Russet Potatoes,PC OrganicsOrganic Russet Potatoes3 lb bag,$4.99ea,,$0.37/ 100g,False,valu_mart,0.0037,g,4.99
produce,,Santa Claus Melons,Santa Claus Melons,$10.44(est.)ea,,$5.49/ 1kg,False,valu_mart,0.00549,g,10.44
produce,President's Choice,"Live Lettuce Red/Green, 2-pack","President's ChoiceLive Lettuce Red/Green, 2-pack1 ea",$5.49ea,,$5.49/ 1ea,False,valu_mart,5.49,,5.49
produce,,Red Seedless Watermelon,Red Seedless Watermelon1 ea,$12.99ea,,$12.99/ 1ea,False,valu_mart,12.99,,12.99
produce,President's Choice,Savory,President's ChoiceSavory28 g,$2.99ea,,,False,valu_mart,2.99,,2.99
produce,,Premium Baby Spinach With Chicken,Premium Baby Spinach With Chicken294 g,$9.00ea,,$2.95/ 100g,False,valu_mart,0.029500000000000002,g,9.00
produce,Farmer's Market,Red Onions,Farmer's MarketRed Onions3 lb bag,$4.99ea,,$0.37/ 100g,False,valu_mart,0.0037,g,4.99
produce,Farmer's Market,Yellow Potato 10lb Bag,Farmer's MarketYellow Potato 10lb Bag10 lb bag,$6.99ea,,$0.15/ 100g,False,valu_mart,0.0015,g,6.99
produce,,"Snack Cup, Veggies & Dip","Snack Cup, Veggies & Dip200 g",$5.00ea,,$2.35/ 100g,False,valu_mart,0.0235,g,5.00
produce,,Organic Dried Apricots,Organic Dried Apricots250 g,$5.99ea,,$2.40/ 100g,False,valu_mart,0.024,g,5.99
produce,Farmer's Market,Mango Red 3Ct,Farmer's MarketMango Red 3Ct3 ea,$5.49ea,,$1.83/ 1ea,False,valu_mart,1.83,,5.49
produce,,Chestnuts,Chestnuts454 g,$8.99ea,,$1.98/ 100g,False,valu_mart,0.019799999999999998,g,8.99
produce,Paramount,Pistachios No Shells Honey Roasted,ParamountPistachios No Shells Honey Roasted155 g,$8.99ea,,$5.80/ 100g,False,valu_mart,0.057999999999999996,g,8.99
produce,,Jamaican Ginger,Jamaican Ginger,$4.05(est.)ea,,$17.61/ 1kg,False,valu_mart,0.01761,g,4.05
produce,,"Garlic, Peeled","Garlic, Peeled250 g",$3.49ea,,$1.40/ 100g,False,valu_mart,0.013999999999999999,g,3.49
produce,President's Choice,Dill,President's ChoiceDill28 g,$2.99ea,,,False,valu_mart,2.99,,2.99
produce,,Greek Yogurt Parfait,Greek Yogurt Parfait290 g,$5.00ea,,$1.72/ 100g,False,valu_mart,0.0172,g,5.00
produce,Bolthouse,Strawberry Banana,BolthouseStrawberry Banana450 ml,$5.49ea,,$1.22/ 100ml,False,valu_mart,0.012199999999999999,ml,5.49
produce,President's Choice,"Meyer Lemon, 1lb","President's ChoiceMeyer Lemon, 1lb454 g",$5.99ea,,$1.32/ 100g,False,valu_mart,0.0132,g,5.99
produce,President's Choice,Tarragon,President's ChoiceTarragon28 g,$2.99ea,,,False,valu_mart,2.99,,2.99
produce,President's Choice,Finger Hot Hot Peppers,President's ChoiceFinger Hot Hot Peppers226 g,$5.99ea,,$2.65/ 100g,False,valu_mart,0.0265,g,5.99
produce,,Berry Berry Small,Berry Berry Small295 g,$6.00ea,,$0.60/ 100g,False,valu_mart,0.006,g,6.00
produce,Farmer's Market,Spartan Apples,Farmer's MarketSpartan Apples4 lb bag,$7.99ea,,$0.44/ 100g,False,valu_mart,0.0044,g,7.99
produce,Gourmet Garden,Italian Herbs Stir-In Paste,Gourmet GardenItalian Herbs Stir-In Paste115 g,$5.99ea,,$5.21/ 100g,False,valu_mart,0.0521,g,5.99
produce,,Small Cubed Cantaloupe,Small Cubed Cantaloupe300 g,$6.00ea,,$2.00/ 100g,False,valu_mart,0.02,g,6.00
produce,Greenhouse,Ginger Tumeric Kombucha,GreenhouseGinger Tumeric Kombucha340 ml,$4.99ea,,$1.47/ 100ml,False,valu_mart,0.0147,ml,4.99
produce,,Sweet Potato Crinkle Fries,Sweet Potato Crinkle Fries500 g,$6.00ea,,$1.20/ 100g,False,valu_mart,0.012,g,6.00
produce,PC Organics,Organic Cremini Mushrooms,PC OrganicsOrganic Cremini Mushrooms680 g,$8.49ea,,$1.25/ 100g,False,valu_mart,0.0125,g,8.49
produce,President's Choice,Oregano,President's ChoiceOregano28 g,$2.99ea,,,False,valu_mart,2.99,,2.99
produce,President's Choice,"Live Lettuce Trio, 2-pack","President's ChoiceLive Lettuce Trio, 2-pack1 ea",$5.49ea,,$5.49/ 1ea,False,valu_mart,5.49,,5.49
produce,,Apple Pazazz,Apple Pazazz1.814 kg,$8.99ea,,$0.50/ 100g,False,valu_mart,0.005,g,8.99
produce,,Fruit Salad Large,Fruit Salad Large750 g,$10.00ea,,$1.33/ 100g,False,valu_mart,0.013300000000000001,g,10.00
produce,President's Choice,"Live Lettuce Green, 2-pack","President's ChoiceLive Lettuce Green, 2-pack1 ea",$5.49ea,,$5.49/ 1ea,False,valu_mart,5.49,,5.49
produce,Tiffany Gates,Chickpea Kale Salad,Tiffany GatesChickpea Kale Salad,$9.86(est.)ea,,$2.19/ 100g,False,valu_mart,0.0219,g,9.86
produce,President's Choice,Garden Salad,President's ChoiceGarden Salad0.34 kg,$4.49ea,,$1.32/ 100g,False,valu_mart,0.0132,g,4.49
produce,Marzetti,"Veggie Dip, Light Ranch","MarzettiVeggie Dip, Light Ranch340 g",$5.99ea,,$1.76/ 100g,False,valu_mart,0.0176,g,5.99
produce,Marzetti,"Veggie Dip, Spinach","MarzettiVeggie Dip, Spinach340 g",$5.99ea,,$1.76/ 100g,False,valu_mart,0.0176,g,5.99
produce,Greenhouse, Fiery Ginger,Greenhouse Fiery Ginger60 ml,$3.99ea,,$6.65/ 100ml,False,valu_mart,0.0665,ml,3.99
produce,Greenhouse,"Raw, Organic Juice Farma-C","GreenhouseRaw, Organic Juice Farma-C300 ml",$7.99ea,,$2.66/ 100ml,False,valu_mart,0.026600000000000002,ml,7.99
produce,Fresh Attitude,Spring Mix Salad with Toppings Single Sized,Fresh AttitudeSpring Mix Salad with Toppings Single Sized155 g,$5.99ea,,$3.86/ 100g,False,valu_mart,0.038599999999999995,g,5.99
produce,Greenhouse,"Raw, Organic Juice Gatsby","GreenhouseRaw, Organic Juice Gatsby300 ml",$7.99ea,,$2.66/ 100ml,False,valu_mart,0.026600000000000002,ml,7.99
produce,Wholly Guacamole,Minis,Wholly GuacamoleMinis227 g,$6.99ea,,$3.08/ 100g,False,valu_mart,0.0308,g,6.99
produce,PC Organics,Baby Arugula,PC OrganicsBaby Arugula142 g,$5.99ea,,$4.22/ 100g,False,valu_mart,0.042199999999999994,g,5.99
produce,Bolthouse,Berry Boost,BolthouseBerry Boost946 ml,$6.99ea,,$0.74/ 100ml,False,valu_mart,0.0074,ml,6.99
produce,Well,Cold Pressed Juice Be Well  ,WellCold Pressed Juice Be Well  333 ml,$5.99ea,,$1.80/ 100ml,False,valu_mart,0.018000000000000002,ml,5.99
produce,Renees,Ranch Refrigerated Dip,ReneesRanch Refrigerated Dip283 g,$5.99ea,,$2.12/ 100g,False,valu_mart,0.0212,g,5.99
produce,Bolthouse,Amazing Mango,BolthouseAmazing Mango946 ml,$6.99ea,,$0.74/ 100ml,False,valu_mart,0.0074,ml,6.99
produce,PC Organics,Gala Apples 3Lb Bag,PC OrganicsGala Apples 3Lb Bag3 lb bag,$10.49ea,$9.99ea,$0.73/ 100g,True,valu_mart,0.0073,g,9.99
produce,,Butternut Squash,Butternut Squash,$9.90(est.)ea,,$6.15/ 1kg,False,valu_mart,0.00615,g,9.90
produce,,Honeydew Melon,Honeydew Melon1 ea,$8.99ea,,$8.99/ 1ea,False,valu_mart,8.99,,8.99
produce,,French Bean,French Bean680 g,$8.99ea,,$1.32/ 100g,False,valu_mart,0.0132,g,8.99
produce,President's Choice,Apple Cider Vin Pouch 45 Ml,President's ChoiceApple Cider Vin Pouch 45 Ml45 ml,$0.49ea,,$1.09/ 100ml,False,valu_mart,0.0109,ml,0.49
produce,PC Organics,Anjou Pears,PC OrganicsAnjou Pears3 lb bag,$9.99ea,,$0.73/ 100g,False,valu_mart,0.0073,g,9.99
produce,,Dates Medjool,Dates Medjool907 g,$14.99ea,,$1.65/ 100g,False,valu_mart,0.0165,g,14.99
produce,Paramount,Pistachios No Shells Roasted Light Salt,ParamountPistachios No Shells Roasted Light Salt170 g,$8.99ea,,$5.29/ 100g,False,valu_mart,0.0529,g,8.99
produce,Greenhouse,"Raw, Organic Juice Deep Roots","GreenhouseRaw, Organic Juice Deep Roots300 ml",$7.99ea,,$2.66/ 100ml,False,valu_mart,0.026600000000000002,ml,7.99
produce,,Cortland Apples,Cortland Apples,$1.38(est.)ea,,$6.59/ 1kg,False,valu_mart,0.0065899999999999995,g,1.38
produce,,Organic Cilantro Bunched,Organic Cilantro Bunched1 ea,$4.99ea,,$4.99/ 1ea,False,valu_mart,4.99,,4.99
produce,,Decadent Strawberry Parfait,Decadent Strawberry Parfait290 g,$5.00ea,,$1.72/ 100g,False,valu_mart,0.0172,g,5.00
produce,,Caribbean Avocado,Caribbean Avocado1 ea,$4.49ea,,$4.49/ 1ea,False,valu_mart,4.49,,4.49
produce,President's Choice,Fresh Poultry Herb Blend,President's ChoiceFresh Poultry Herb Blend28 g,$2.99ea,,,False,valu_mart,2.99,,2.99
produce,,Broccolini,Broccolini1 bunch,$3.99ea,,$3.99/ 1ea,False,valu_mart,3.99,,3.99
produce,,Sweet Nantes Carrots,Sweet Nantes Carrots467 g,$3.49ea,,$0.75/ 100g,False,valu_mart,0.0075,g,3.49
produce,President's Choice,Red Potatoes,President's ChoiceRed Potatoes5 lb bag,$5.99ea,,$0.26/ 100g,False,valu_mart,0.0026,g,5.99
produce,,California Salad,California Salad330 g,$9.00ea,,$2.73/ 100g,False,valu_mart,0.0273,g,9.00
produce,Gourmet Garden,Basil Stir-In Paste,Gourmet GardenBasil Stir-In Paste115 g,$5.99ea,,$5.21/ 100g,False,valu_mart,0.0521,g,5.99
produce,,Organic Green Grapes,Organic Green Grapes1 ea,$9.99ea,,$2.21/ 100g,False,valu_mart,0.022099999999999998,g,9.99
produce,,Grilled Chicken Caesar Salad,Grilled Chicken Caesar Salad,$13.14(est.)ea,,$21.90/ 1kg,False,valu_mart,0.0219,g,13.14
produce,,Honeydew Cubed Small,Honeydew Cubed Small320 g,$6.00ea,,$0.60/ 100g,False,valu_mart,0.006,g,6.00
produce,,Strawberry Parfait,Strawberry Parfait290 g,$5.00ea,,$1.92/ 100g,False,valu_mart,0.0192,g,5.00
produce,,"Spinach, Bunched","Spinach, Bunched1 ea",$3.29ea,,$3.29/ 1ea,False,valu_mart,3.29,,3.29
produce,Love Beets,Organic Cooked Beets,Love BeetsOrganic Cooked Beets250 ea,$5.99ea,,$2.40/ 100g,False,valu_mart,0.024,g,5.99
produce,,"Southwestern Chicken Salad, Family Size","Southwestern Chicken Salad, Family Size1.47 kg",$17.00ea,,$1.23/ 100g,False,valu_mart,0.0123,g,17.00
produce,PC Organics,Organics Baby Cut Carrots,PC OrganicsOrganics Baby Cut Carrots2 lb,$5.99ea,,$0.66/ 100g,False,valu_mart,0.0066,g,5.99
produce,PC Organics,Organics Baby Spinach,PC OrganicsOrganics Baby Spinach312 g,$7.99ea,,$2.56/ 100g,False,valu_mart,0.0256,g,7.99
produce,,Envy Apples,Envy Apples,$1.76(est.)ea,,$8.80/ 1kg,False,valu_mart,0.0088,g,1.76
produce,,Key Limes,Key Limes1 lb bag,$5.99ea,,$1.32/ 100g,False,valu_mart,0.0132,g,5.99
produce,,Cobb with Cheddar Salad Mini,Cobb with Cheddar Salad Mini165 g,$5.00ea,,$3.03/ 100g,False,valu_mart,0.030299999999999997,g,5.00
produce,,Premium Baby Spinach With Fruit & Nuts,Premium Baby Spinach With Fruit & Nuts296 g,$9.00ea,,$3.04/ 100g,False,valu_mart,0.0304,g,9.00
produce,,Organic Kiwi,Organic Kiwi454 g,$5.99ea,,$1.32/ 100g,False,valu_mart,0.0132,g,5.99
produce,President's Choice,Russet Potatoes ,President's ChoiceRusset Potatoes 5 lb bag,$4.99ea,,$0.22/ 100g,False,valu_mart,0.0022,g,4.99
produce,Gourmet Garden,Lightly Dried Cilantro,Gourmet GardenLightly Dried Cilantro10 g,$5.99ea,,$59.90/ 100g,False,valu_mart,0.599,g,5.99
produce,President's Choice,Mini Sweet Peppers,President's ChoiceMini Sweet Peppers454 g,$5.99ea,,$1.32/ 100g,False,valu_mart,0.0132,g,5.99
produce,,Medjool Dates,Medjool Dates454 g,$9.49ea,,$2.09/ 100g,False,valu_mart,0.0209,g,9.49
produce,President's Choice,Poppyseed Pouch 44Ml,President's ChoicePoppyseed Pouch 44Ml44 ml,$0.59ea,,$1.34/ 100ml,False,valu_mart,0.0134,ml,0.59
produce,Farmer's Market,Red Delicious Apples,Farmer's MarketRed Delicious Apples4 lb bag,$7.99ea,,$0.44/ 100g,False,valu_mart,0.0044,g,7.99
produce,Gourmet Garden,Lightly Dried Cilantro,Gourmet GardenLightly Dried Cilantro10 g,$5.99ea,,$59.90/ 100g,False,valu_mart,0.599,g,5.99
produce,,Mixed Melon Cubed Large,Mixed Melon Cubed Large1 kg,$9.00ea,,$1.67/ 100g,False,valu_mart,0.0167,g,9.00
produce,,Premium Baby Spinach With Fruit & Nuts,Premium Baby Spinach With Fruit & Nuts296 g,$9.00ea,,$3.04/ 100g,False,valu_mart,0.0304,g,9.00
produce,President's Choice,Kaki Persimmons,President's ChoiceKaki Persimmons1 ea,$2.99ea,,$2.99/ 1ea,False,valu_mart,2.99,,2.99
produce,Wholly Guacamole,Chunky Bowl ,Wholly GuacamoleChunky Bowl 213 g,$5.99ea,,$2.81/ 100g,False,valu_mart,0.0281,g,5.99
produce,,Grapes Mixed,Grapes Mixed300 g,$5.00ea,,$0.50/ 100g,False,valu_mart,0.005,g,5.00
produce,PC Organics,Organics Baby Cut Carrots,PC OrganicsOrganics Baby Cut Carrots2 lb,$5.99ea,,$0.66/ 100g,False,valu_mart,0.0066,g,5.99
produce,President's Choice,Southwest Salad Kit,President's ChoiceSouthwest Salad Kit369 g,$6.99ea,,$1.89/ 100g,False,valu_mart,0.0189,g,6.99
produce,,Grilled Chicken Caesar Salad,Grilled Chicken Caesar Salad,$13.14(est.)ea,,$21.90/ 1kg,False,valu_mart,0.0219,g,13.14
produce,,Honeydew Cubed Small,Honeydew Cubed Small320 g,$6.00ea,,$0.60/ 100g,False,valu_mart,0.006,g,6.00
produce,,Strawberry Parfait,Strawberry Parfait290 g,$5.00ea,,$1.92/ 100g,False,valu_mart,0.0192,g,5.00
produce,,Organic Orange,Organic Orange907 g,$7.99ea,,$0.88/ 100g,False,valu_mart,0.0088,g,7.99
produce,President's Choice,Russet Potatoes ,President's ChoiceRusset Potatoes 5 lb bag,$4.99ea,,$0.22/ 100g,False,valu_mart,0.0022,g,4.99
produce,,Envy Apples,Envy Apples,$1.76(est.)ea,,$8.80/ 1kg,False,valu_mart,0.0088,g,1.76
produce,,Cobb with Cheddar Salad Mini,Cobb with Cheddar Salad Mini165 g,$5.00ea,,$3.03/ 100g,False,valu_mart,0.030299999999999997,g,5.00
produce,,Carrots & Snap Peas ,Carrots & Snap Peas 250 g,$4.00ea,,$1.60/ 100g,False,valu_mart,0.016,g,4.00
produce,,Red Prince Apple,Red Prince Apple,$1.32(est.)ea,,$6.59/ 1kg,False,valu_mart,0.0065899999999999995,g,1.32
produce,Farmer's Market,Yellow Onions,Farmer's MarketYellow Onions10 lb bag,$7.99ea,,$0.18/ 100g,False,valu_mart,0.0018,g,7.99
produce,President's Choice,Ambrosia Apples,President's ChoiceAmbrosia Apples,$1.69(est.)ea,,$7.69/ 1kg,False,valu_mart,0.007690000000000001,g,1.69
produce,,"Steak and Blue Cheese Salad, Large","Steak and Blue Cheese Salad, Large547 g",$13.00ea,,$2.38/ 100g,False,valu_mart,0.023799999999999998,g,13.00
produce,,Pineapple/Straws Large,Pineapple/Straws Large600 g,$10.00ea,,$1.67/ 100g,False,valu_mart,0.0167,g,10.00
produce,,Yellow Potatoes,Yellow Potatoes,$1.65(est.)ea,,$5.49/ 1kg,False,valu_mart,0.00549,g,1.65
produce,,Shallots,Shallots750 g,$6.49ea,,$0.87/ 100g,False,valu_mart,0.0087,g,6.49
produce,,Organic Green Grapes,Organic Green Grapes1 ea,$9.99ea,,$2.21/ 100g,False,valu_mart,0.022099999999999998,g,9.99
produce,The Little Potato Company,Oven BBQ Ready Garlic Herb Potatoes,The Little Potato CompanyOven BBQ Ready Garlic Herb Potatoes454 g,$4.99ea,,$1.10/ 100g,False,valu_mart,0.011000000000000001,g,4.99
produce,,Snow Peas,Snow Peas200 g,$4.99ea,,$2.50/ 100g,False,valu_mart,0.025,g,4.99
produce,,"Spinach, Kale, Celery Juice","Spinach, Kale, Celery Juice1 ea",$13.00ea,,$13.00/ 1ea,False,valu_mart,13.0,,13.00
produce,Gourmet Garden,Basil Stir-In Paste,Gourmet GardenBasil Stir-In Paste115 g,$5.99ea,,$5.21/ 100g,False,valu_mart,0.0521,g,5.99
produce,,"Morel Mushrooms, Dried","Morel Mushrooms, Dried14 g",$12.99ea,,$92.79/ 100g,False,valu_mart,0.9279000000000001,g,12.99
produce,PC Organics,Organic Green Onions,PC OrganicsOrganic Green Onions1 bunch,$2.29ea,,$2.29/ 1ea,False,valu_mart,2.29,,2.29
produce,,Red Beets,Red Beets2 lb bag,$3.99ea,,$0.44/ 100g,False,valu_mart,0.0044,g,3.99
produce,,Carrots,Carrots,$0.57(est.)ea,,$4.39/ 1kg,False,valu_mart,0.00439,g,0.57
produce,President's Choice,Salted Virginia Peanuts,President's ChoiceSalted Virginia Peanuts454 g,$3.99ea,,$0.88/ 100g,False,valu_mart,0.0088,g,3.99
produce,PC Organics,Organic Lemons,PC OrganicsOrganic Lemons2 lb bag,$8.99ea,,$0.99/ 100g,False,valu_mart,0.009899999999999999,g,8.99
produce,,Packaged Yellow Nectarine,Packaged Yellow Nectarine907 g,$6.99ea,,$0.77/ 100g,False,valu_mart,0.0077,g,6.99
produce,,Cortland Apples,Cortland Apples,$1.38(est.)ea,,$6.59/ 1kg,False,valu_mart,0.0065899999999999995,g,1.38
produce,,California Salad,California Salad330 g,$9.00ea,,$2.73/ 100g,False,valu_mart,0.0273,g,9.00
produce,,"Portobello Mushrooms, Bulk","Portobello Mushrooms, Bulk",$1.85(est.)ea,,$15.41/ 1kg,False,valu_mart,0.01541,g,1.85
produce,The Little Potato Company,Oven BBQ Ready Onion Chive Potatoes,The Little Potato CompanyOven BBQ Ready Onion Chive Potatoes454 g,$4.99ea,,$1.10/ 100g,False,valu_mart,0.011000000000000001,g,4.99
produce,,Mini Garden Cheddar Salad,Mini Garden Cheddar Salad185 g,$5.00ea,,$2.70/ 100g,False,valu_mart,0.027000000000000003,g,5.00
produce,,Yellow Asian Pears,Yellow Asian Pears,$2.82(est.)ea,,$8.80/ 1kg,False,valu_mart,0.0088,g,2.82
produce,No Name,Naturally Imperfect Potatoes 15lb,No NameNaturally Imperfect Potatoes 15lb6804 g,$5.99ea,,$0.09/ 100g,False,valu_mart,0.0009,g,5.99
produce,No Name,Carrots,No NameCarrots2270 g,$3.99ea,,$0.18/ 100g,False,valu_mart,0.0018,g,3.99
produce,,Chicken BLT Salad Mini,Chicken BLT Salad Mini145 g,$5.00ea,,$3.45/ 100g,False,valu_mart,0.0345,g,5.00
produce,Marzetti,Caramel Dip,MarzettiCaramel Dip227 g,$5.99ea,,$2.64/ 100g,False,valu_mart,0.0264,g,5.99
produce,,Yellow Asian Pears,Yellow Asian Pears,$2.82(est.)ea,,$8.80/ 1kg,False,valu_mart,0.0088,g,2.82
produce,President's Choice,Romaine Salad,President's ChoiceRomaine Salad0.255 kg,$4.49ea,,$1.76/ 100g,False,valu_mart,0.0176,g,4.49
produce,Greenhouse,Fiery Ginger Juice,GreenhouseFiery Ginger Juice240 ml,$14.99ea,,$6.25/ 100ml,False,valu_mart,0.0625,ml,14.99
produce,President's Choice,Kale Slaw,President's ChoiceKale Slaw340 g,$4.49ea,,$1.32/ 100g,False,valu_mart,0.0132,g,4.49
produce,POM Wonderful,100% Pomegranate Juice,POM Wonderful100% Pomegranate Juice473 ml,$6.99ea,,$1.48/ 100ml,False,valu_mart,0.0148,ml,6.99
produce,President's Choice,Adora Seedless® Black Grapes,President's ChoiceAdora Seedless® Black Grapes,$15.07(est.)ea,,$11.00/ 1kg,False,valu_mart,0.011,g,15.07
produce,Marzetti,Caramel Dip Snack,MarzettiCaramel Dip Snack6x340.0 g,$6.49ea,,$13.52/ 100g,False,valu_mart,0.1352,g,6.49
produce,Bolthouse,100% Carrot,Bolthouse100% Carrot946 ml,$6.99ea,,$0.74/ 100ml,False,valu_mart,0.0074,ml,6.99
produce,Greenhouse,Plant-Based Collagen Booster Glow,GreenhousePlant-Based Collagen Booster Glow60 ml,$3.99ea,,$6.65/ 100ml,False,valu_mart,0.0665,ml,3.99
produce,Litehouse,Dip Organic Ranch,LitehouseDip Organic Ranch283 g,$5.49ea,,$1.94/ 100g,False,valu_mart,0.0194,g,5.49
produce,Remedy,Kombucha Lemon Lime & Mint  ,RemedyKombucha Lemon Lime & Mint  700 ml,$4.99ea,,$0.71/ 100ml,False,valu_mart,0.0070999999999999995,ml,4.99
produce,Bolthouse,Daily Greens,BolthouseDaily Greens946 ml,$6.99ea,,$0.74/ 100ml,False,valu_mart,0.0074,ml,6.99
produce,Greenhouse,Collagen Booster Glow Multipack,GreenhouseCollagen Booster Glow Multipack4x60.0 ml,$14.99ea,,$6.25/ 100ml,False,valu_mart,0.0625,ml,14.99
produce,Renees,French Onion Refrigerated Dip,ReneesFrench Onion Refrigerated Dip283 g,$5.99ea,,$2.12/ 100g,False,valu_mart,0.0212,g,5.99
produce,PC Organics,Organic Field Greens & Baby Spinach - Salad Mix,PC OrganicsOrganic Field Greens & Baby Spinach - Salad Mix312 g,$7.99ea,,$2.56/ 100g,False,valu_mart,0.0256,g,7.99
produce,,White Onion,White Onion,$2.44(est.)ea,,$6.59/ 1kg,False,valu_mart,0.0065899999999999995,g,2.44
produce,,Baby Spinach,Baby Spinach,$7.05(est.)ea,,$17.62/ 1kg,False,valu_mart,0.01762,g,7.05
produce,,Pineapple,Pineapple1 ea,$4.99ea,,$4.99/ 1ea,False,valu_mart,4.99,,4.99
produce,Sunrich,Sun Rich Sliced Red Apples,SunrichSun Rich Sliced Red Apples595 g,$6.00ea,,$1.01/ 100g,False,valu_mart,0.0101,g,6.00
produce,,Bosc Pears,Bosc Pears,$1.94(est.)ea,,$8.80/ 1kg,False,valu_mart,0.0088,g,1.94
produce,,Snap Peas,Snap Peas200 g,$4.99ea,,$2.50/ 100g,False,valu_mart,0.025,g,4.99
produce,Greenhouse,Ginger Turmeric Organic Kombucha,GreenhouseGinger Turmeric Organic Kombucha1000 ml,$9.99ea,,$1.00/ 100ml,False,valu_mart,0.01,ml,9.99
produce,,Mixed Cut Peppers ,Mixed Cut Peppers 1 kg,$6.00ea,,$1.50/ 100g,False,valu_mart,0.015,g,6.00
produce,,Cheddar & Bacon Potato Salad,Cheddar & Bacon Potato Salad,$8.76(est.)ea,,$21.90/ 1kg,False,valu_mart,0.0219,g,8.76
produce,PC Organics,Organic Mini Carrots 1lb Bag,PC OrganicsOrganic Mini Carrots 1lb Bag1 lb bag,$3.99ea,,$0.88/ 100g,False,valu_mart,0.0088,g,3.99
produce,President's Choice,Sweet Potato,President's ChoiceSweet Potato454 g,$5.49ea,,$1.21/ 100g,False,valu_mart,0.0121,g,5.49
produce,Paramount,"Pistachios, Roasted & Unsalted","ParamountPistachios, Roasted & Unsalted225 g",$6.49ea,,$2.88/ 100g,False,valu_mart,0.0288,g,6.49
produce,PC Blue Menu,Unsalted California Pistachios ,PC Blue MenuUnsalted California Pistachios 225 g,$5.99ea,,$2.66/ 100g,False,valu_mart,0.026600000000000002,g,5.99
produce,President's Choice,Kent Mango,President's ChoiceKent Mango1 ea,$2.99ea,,$2.99/ 1ea,False,valu_mart,2.99,,2.99
produce,,"Green Figs, Case (Case)","Green Figs, Case (Case)1 ea",$15.49c01,,$15.49/ 1ea,False,valu_mart,15.49,,15.49
produce,,Watermelon Cubed Small 300G,Watermelon Cubed Small 300G1 kg,$6.00ea,,$0.60/ 100g,False,valu_mart,0.006,g,6.00
produce,,Apple Cosmic Crisp,Apple Cosmic Crisp,$2.11(est.)ea,,$8.80/ 1kg,False,valu_mart,0.0088,g,2.11
produce,,Cubed Rutabagas,Cubed Rutabagas600 g,$5.00ea,,$0.83/ 100g,False,valu_mart,0.0083,g,5.00
produce,Paramount,Pistachios No Shells Chili Roasted,ParamountPistachios No Shells Chili Roasted155 g,$8.99ea,,$5.80/ 100g,False,valu_mart,0.057999999999999996,g,8.99
produce,POM Wonderful,Fresh Pomegranate Arils,POM WonderfulFresh Pomegranate Arils454 g,$15.99ea,,$3.52/ 100g,False,valu_mart,0.0352,g,15.99
produce,,Organic Iceberg Lettuce,Organic Iceberg Lettuce1 ea,$5.99ea,,$5.99/ 1ea,False,valu_mart,5.99,,5.99
produce,,Brown Asian Pears,Brown Asian Pears,$3.70(est.)ea,,$8.80/ 1kg,False,valu_mart,0.0088,g,3.70
produce,President's Choice,Yellow Hot Hot Peppers,President's ChoiceYellow Hot Hot Peppers226 g,$5.99ea,,$2.65/ 100g,False,valu_mart,0.0265,g,5.99
produce,,Watermelon Cubed Large,Watermelon Cubed Large550 g,$9.00ea,,$1.64/ 100g,False,valu_mart,0.016399999999999998,g,9.00
produce,President's Choice,Blood Oranges,President's ChoiceBlood Oranges907 g,$8.99ea,,$0.99/ 100g,False,valu_mart,0.009899999999999999,g,8.99
produce,President's Choice,Fingerling Potatoes,President's ChoiceFingerling Potatoes680 g,$4.99ea,,$0.73/ 100g,False,valu_mart,0.0073,g,4.99
produce,,Organic Medjool Dates,Organic Medjool Dates454 g,$11.99ea,,$2.64/ 100g,False,valu_mart,0.0264,g,11.99
produce,President's Choice,"Ready Veggie, Kale Blend","President's ChoiceReady Veggie, Kale Blend340 g",$5.99ea,,$1.76/ 100g,False,valu_mart,0.0176,g,5.99
produce,,Sweet Kale Salad Family Size,Sweet Kale Salad Family Size1 ea,$17.00ea,,$17.00/ 1ea,False,valu_mart,17.0,,17.00
produce,,Large Organic Pineapple,Large Organic Pineapple1 ea,$5.99ea,,$5.99/ 1ea,False,valu_mart,5.99,,5.99
produce,,"Snack Cup, Grapes & Cheese","Snack Cup, Grapes & Cheese200 g",$5.00ea,,$2.50/ 100g,False,valu_mart,0.025,g,5.00
produce,Farmer's Market,Empire Apples,Farmer's MarketEmpire Apples4 lb bag,$7.99ea,,$0.44/ 100g,False,valu_mart,0.0044,g,7.99
produce,Gourmet Garden,"Lightly Dried, Ginger Bowl","Gourmet GardenLightly Dried, Ginger Bowl220 g",$5.99ea,,$27.23/ 100g,False,valu_mart,0.2723,g,5.99
produce,The Little Potato Company,Microwave Ready Garlic Parsley Potatoes,The Little Potato CompanyMicrowave Ready Garlic Parsley Potatoes454 g,$4.99ea,,$1.10/ 100g,False,valu_mart,0.011000000000000001,g,4.99
produce,Gourmet Garden,Lightly Dried Basil,Gourmet GardenLightly Dried Basil12 g,$5.99ea,,$49.92/ 100g,False,valu_mart,0.49920000000000003,g,5.99
produce,Manns,Snap Peas,MannsSnap Peas425 g,$8.99ea,,$2.12/ 100g,False,valu_mart,0.0212,g,8.99
produce,,Shiitake Mushrooms,Shiitake Mushrooms,$0.77/25 g,,$3.08/ 100g,False,valu_mart,0.0308,g,0.77
produce,President's Choice,Red Thai Hot Peppers,President's ChoiceRed Thai Hot Peppers75 g,$5.99ea,,$7.99/ 100g,False,valu_mart,0.0799,g,5.99
