store,category,brand,product,full_product_text,price,sale_price,price_unit,per_unit_price,sale_per_unit_price,units,price_per_1,is_sale,list_price
valu_mart,snacks,Dentyne,Ice Spearmint Gum,DentyneIce Spearmint Gum4 ea,4.99,,each,1.25,,1ea,True,False,4.99
valu_mart,snacks,Dare,Bear Paws Birthday Cake Cookies,DareBear Paws Birthday Cake Cookies337 g,6.99,,each,2.07,,100g,True,False,6.99
valu_mart,snacks,Enjoy Life,"Plentils Lentil Chips, Sea Salt","Enjoy LifePlentils Lentil Chips, Sea Salt113 g",5.49,,each,4.86,,100g,True,False,5.49
valu_mart,snacks,Spitz,"Sunflower Seeds, Salted","SpitzSunflower Seeds, Salted227 g",3.69,,each,1.76,,100g,True,False,3.69
valu_mart,snacks,Fritos,Original Corn Chips 340g,FritosOriginal Corn Chips 340g340 g,4.99,,each,1.47,,100g,True,False,4.99
valu_mart,snacks,Kinder,Bueno Mini T27 Bag,KinderBueno Mini T27 Bag145 g,4.49,,each,3.1,,100g,True,False,4.49
valu_mart,snacks,Voortman,"Turnover Cookie, Strawberry","VoortmanTurnover Cookie, Strawberry300 g",3.79,,each,1.26,,100g,True,False,3.79
valu_mart,snacks,Christie,Wheat Thins  Crackers,ChristieWheat Thins  Crackers300 g,4.49,,each,1.5,,100g,True,False,4.49
valu_mart,snacks,Wrigley,"Spearmint Flavoured Sugar Free Chewing Gum, 12 Pieces, 1 Pack","WrigleySpearmint Flavoured Sugar Free Chewing Gum, 12 Pieces, 1 Pack12 ea",1.99,,each,0.17,,1ea,True,False,1.99
valu_mart,snacks,Ryvita,Snackbread,RyvitaSnackbread125 g,4.49,,each,3.5899999999999994,,100g,True,False,4.49
valu_mart,snacks,Lindt,"Chocolate, 60% Cocoa  Shell with A Delectably Smooth Centre Extra Dark","LindtChocolate, 60% Cocoa  Shell with A Delectably Smooth Centre Extra Dark150 g",9.99,,each,6.66,,100g,True,False,9.99
valu_mart,snacks,Cadbury,Dairy Milk Oreo Chocolate Bar,CadburyDairy Milk Oreo Chocolate Bar38 g,1.99,,each,5.24,,100g,True,False,1.99
valu_mart,snacks,Ryvita,"Snackbread, Multigrain","RyvitaSnackbread, Multigrain125 g",4.49,,each,3.5899999999999994,,100g,True,False,4.49
valu_mart,snacks,Excel,"Winterfresh Flavoured Sugar Free Chewing Gum, 18 Pieces, 3 Packs","ExcelWinterfresh Flavoured Sugar Free Chewing Gum, 18 Pieces, 3 Packs77 g",4.99,,each,6.48,,100g,True,False,4.99
valu_mart,snacks,Whittaker's,Fruit And Nut Creamy Milk Chocolate,Whittaker'sFruit And Nut Creamy Milk Chocolate200 g,5.99,,each,3.0,,100g,True,False,5.99
valu_mart,snacks,No Name,Chewy Chocolate Chip Granola Bars,No NameChewy Chocolate Chip Granola Bars158 g,2.79,,each,1.77,,100g,True,False,2.79
valu_mart,snacks,Mr. Cookies,Mr Mini Cookies,Mr. CookiesMr Mini Cookies150 g,2.99,,each,1.99,,100g,True,False,2.99
valu_mart,snacks,Voortman,"Wafers, Strawberry","VoortmanWafers, Strawberry300 g",2.99,,each,1.0,,100g,True,False,2.99
valu_mart,snacks,Nestle,Smarties Buncha Pouch,NestleSmarties Buncha Pouch180 g,5.99,,each,3.33,,100g,True,False,5.99
valu_mart,snacks,Ferrero,Rocher Heart Shaped Box Chocolate,FerreroRocher Heart Shaped Box Chocolate100 g,7.99,,each,7.99,,100g,True,False,7.99
valu_mart,snacks,President's Choice,Milk Chocolate Covered Raisins,President's ChoiceMilk Chocolate Covered Raisins400 g,5.49,4.99,each,1.375250501002004,1.25,100g,True,True,4.99
valu_mart,snacks,President's Choice,Original Melba Toast,President's ChoiceOriginal Melba Toast200 g,3.49,,each,1.75,,100g,True,False,3.49
valu_mart,snacks,Mentos,"Pure Fresh Cinnamon Mint Gum, Sugar Free","MentosPure Fresh Cinnamon Mint Gum, Sugar Free50 ea",4.29,,each,0.09,,1ea,True,False,4.29
valu_mart,snacks,President's Choice,Extra Butter Flavour Purple Kernel Microwave Popcorn,President's ChoiceExtra Butter Flavour Purple Kernel Microwave Popcorn247 g,3.99,,each,1.62,,100g,True,False,3.99
valu_mart,snacks,Cadbury,Caramilk Original Chocolate Bar,CadburyCaramilk Original Chocolate Bar4x50.0 g,5.99,,each,3.0,,100g,True,False,5.99
valu_mart,snacks,President's Choice,Milk Chocolate Mixed Nuts,President's ChoiceMilk Chocolate Mixed Nuts340 g,5.49,4.99,each,1.6172945891783568,1.47,100g,True,True,4.99
valu_mart,snacks,GoGo squeez,Fruit Sauce 12 Pouches,GoGo squeezFruit Sauce 12 Pouches1.08 kg,8.99,,each,0.83,,100g,True,False,8.99
valu_mart,snacks,Nestle,Kit Kat Classic Wafer Bar,NestleKit Kat Classic Wafer Bar120 g,3.29,,each,2.7400000000000007,,100g,True,False,3.29
valu_mart,snacks,President's Choice,Old Fashioned Butterscotch Ice Cream & Dessert Topping,President's ChoiceOld Fashioned Butterscotch Ice Cream & Dessert Topping355 ml,3.99,,each,1.12,,100ml,True,False,3.99
valu_mart,snacks,Nestle,Buncha Crunch Chocolatey Coated Rice Crisps,NestleBuncha Crunch Chocolatey Coated Rice Crisps160 g,5.99,,each,3.74,,100g,True,False,5.99
valu_mart,snacks,Wrigley,"Strawberry-Flood Flavoured Sugar Free Chewing Gum, 15 Sticks, 3 Packs","WrigleyStrawberry-Flood Flavoured Sugar Free Chewing Gum, 15 Sticks, 3 Packs45 ea",6.49,,each,0.14,,1ea,True,False,6.49
valu_mart,snacks,No Name,Honey Graham Wafers,No NameHoney Graham Wafers400 g,3.99,,each,1.0,,100g,True,False,3.99
valu_mart,snacks,President's Choice,Honey Roasted Peanuts,President's ChoiceHoney Roasted Peanuts700 g,6.99,,each,1.0,,100g,True,False,6.99
valu_mart,snacks,Lindt,LINDOR Strawberries and Cream White Chocolate Truffles,LindtLINDOR Strawberries and Cream White Chocolate Truffles150 g,9.99,,each,6.66,,100g,True,False,9.99
valu_mart,snacks,Tim Hortons,Boston Cream Granola Bar,Tim HortonsBoston Cream Granola Bar150 g,3.29,,each,2.19,,100g,True,False,3.29
valu_mart,snacks,No Name,Barbecue Rice Crackers,No NameBarbecue Rice Crackers100 g,1.99,,each,1.99,,100g,True,False,1.99
valu_mart,snacks,SunRype,Fruit to Go 100% Fruit Snack Variety Pack,SunRypeFruit to Go 100% Fruit Snack Variety Pack24x14.0 g,8.99,,each,2.68,,100g,True,False,8.99
valu_mart,snacks,Dare,Gummies Medley,DareGummies Medley180 g,2.99,,each,1.66,,100g,True,False,2.99
valu_mart,snacks,Pepperidge Farm,Goldfish  Flavour Blasted  Xplosive Pizza Flavoured,Pepperidge FarmGoldfish  Flavour Blasted  Xplosive Pizza Flavoured180 g,3.99,,each,2.22,,100g,True,False,3.99
valu_mart,snacks,Ryvita,Snackbread Cheese Flavour,RyvitaSnackbread Cheese Flavour125 g,4.49,,each,3.5899999999999994,,100g,True,False,4.49
valu_mart,snacks,Christie,"Ritz Chips, Original","ChristieRitz Chips, Original225 g",3.99,,each,1.77,,100g,True,False,3.99
valu_mart,snacks,Oh Henry!,Level Up Single Bar,Oh Henry!Level Up Single Bar42 g,1.99,,each,4.74,,100g,True,False,1.99
valu_mart,snacks,Kozy Shack,"Rice Pudding, Cinnamon Raisin","Kozy ShackRice Pudding, Cinnamon Raisin624 g",4.49,,each,0.72,,100g,True,False,4.49
valu_mart,snacks,Hawkins,Cheezies,HawkinsCheezies210 g,4.49,,each,2.14,,100g,True,False,4.49
valu_mart,snacks,Dare,Realfruit Superfruits,DareRealfruit Superfruits180 g,2.99,,each,1.66,,100g,True,False,2.99
valu_mart,snacks,FERRERO ROCHER,Dark Hazelnut & Salted Caramel Bar,FERRERO ROCHERDark Hazelnut & Salted Caramel Bar90 g,3.99,,each,4.43,,100g,True,False,3.99
valu_mart,snacks,Ritz,Bacon Crackers,RitzBacon Crackers200 g,3.99,,each,2.0,,100g,True,False,3.99
valu_mart,snacks,Humble,Smokey Bbq Flavoured Potato Chips,HumbleSmokey Bbq Flavoured Potato Chips150 g,4.99,,each,3.33,,100g,True,False,4.99
valu_mart,snacks,Carnaby Sweet,Cinnamon Hearts,Carnaby SweetCinnamon Hearts500 g,3.99,,each,0.8,,100g,True,False,3.99
valu_mart,snacks,Carnaby Sweet,Assorted Valentine'S Candy Tub,Carnaby SweetAssorted Valentine'S Candy Tub500 g,3.99,,each,0.8,,100g,True,False,3.99
valu_mart,snacks,Pepperidge Farm,Veggie & Fruit Goldfish Snack,Pepperidge FarmVeggie & Fruit Goldfish Snack180 g,3.99,,each,2.22,,100g,True,False,3.99
valu_mart,snacks,JOLLY RANCHER,Assorted,JOLLY RANCHERAssorted198 g,3.19,,each,1.61,,100g,True,False,3.19
valu_mart,snacks,Sonoma Creamery, Parmesan Crisps,Sonoma Creamery Parmesan Crisps64 g,6.49,,each,10.14,,100g,True,False,6.49
valu_mart,snacks,Christie,Crispers Ranch Crackers,ChristieCrispers Ranch Crackers145 g,3.99,,each,2.75,,100g,True,False,3.99
valu_mart,snacks,Snyders,"Pretzel Pieces, Hot Buffalo Wing","SnydersPretzel Pieces, Hot Buffalo Wing240 g",3.99,,each,1.66,,100g,True,False,3.99
valu_mart,snacks,Whisps,Cheese Crisps Asiago Pepper Jack 60 g,WhispsCheese Crisps Asiago Pepper Jack 60 g60 g,5.99,,each,9.98,,100g,True,False,5.99
valu_mart,snacks,Covered Bridge,Potato Chips Smokin' Sweet Bbq,Covered BridgePotato Chips Smokin' Sweet Bbq60 g,1.99,,each,3.32,,100g,True,False,1.99
valu_mart,snacks,Whisps,Parmesan Cheese Crisps    ,WhispsParmesan Cheese Crisps    60 g,5.99,,each,9.98,,100g,True,False,5.99
valu_mart,snacks,,"Vicky's Artisan Flatbread, Rosemary","Vicky's Artisan Flatbread, Rosemary130 g",6.29,,each,4.84,,100g,True,False,6.29
valu_mart,snacks,SunRype,Wildberry Fruit to Go 100% Fruit Snack,SunRypeWildberry Fruit to Go 100% Fruit Snack14 g,0.49,,each,3.5000000000000004,,100g,True,False,0.49
valu_mart,snacks,From Farm To Table,Popcorn White Cheddar Flavour,From Farm To TablePopcorn White Cheddar Flavour125 g,3.49,,each,2.79,,100g,True,False,3.49
valu_mart,snacks,SunRype,Fruit Source FruitSource Superfruits Blueberry Pomegranate 100% Fruit Bar Snack,SunRypeFruit Source FruitSource Superfruits Blueberry Pomegranate 100% Fruit Bar Snack37 g,0.99,,each,2.68,,100g,True,False,0.99
valu_mart,snacks,Jell-O,Oreo Ready-to-Eat Refrigerated Pudding Cups Snack,Jell-OOreo Ready-to-Eat Refrigerated Pudding Cups Snack4x113.0 g,4.29,,each,0.95,,100g,True,False,4.29
valu_mart,snacks,Dare,Breton Veggie Bites On the Go Packs,DareBreton Veggie Bites On the Go Packs132 g,2.99,,each,2.27,,100g,True,False,2.99
valu_mart,snacks,M&M's,"Milk Chocolate Candies, Sharing Bag","M&M'sMilk Chocolate Candies, Sharing Bag120 g",4.29,,each,3.58,,100g,True,False,4.29
valu_mart,snacks,,"Vicky's Artisan Flatbread, Multigrain","Vicky's Artisan Flatbread, Multigrain130 g",6.29,,each,4.84,,100g,True,False,6.29
valu_mart,snacks,Sarah's Fine Foods,Crostini Garlic Parmesan,Sarah's Fine FoodsCrostini Garlic Parmesan150 g,3.99,,each,2.66,,100g,True,False,3.99
valu_mart,snacks,Lindt,LINDOR Milk and White Chocolate Valentine's Truffles,LindtLINDOR Milk and White Chocolate Valentine's Truffles150 g,9.99,,each,6.66,,100g,True,False,9.99
valu_mart,snacks,Sonoma Creamery,Mild Pepper Jack Crisps,Sonoma CreameryMild Pepper Jack Crisps64 g,6.49,,each,10.14,,100g,True,False,6.49
valu_mart,snacks,Bounty,"Coconut Milk Chocolate Bar, Full Size Bag","BountyCoconut Milk Chocolate Bar, Full Size Bag57 g",1.99,,each,3.49,,100g,True,False,1.99
valu_mart,snacks,Peek Freans,Lifestyle Selections Bran Crunch Biscuits,Peek FreansLifestyle Selections Bran Crunch Biscuits275 g,3.99,,each,1.45,,100g,True,False,3.99
valu_mart,snacks,Covered Bridge,"Potato Chips, Creamy Dill Pickle","Covered BridgePotato Chips, Creamy Dill Pickle170 g",3.99,,each,2.35,,100g,True,False,3.99
valu_mart,snacks,Excel,"Bubblemint Flavoured Sugar Free Chewing Gum, 12 Pieces, 1 Pack","ExcelBubblemint Flavoured Sugar Free Chewing Gum, 12 Pieces, 1 Pack12 ea",1.99,,each,0.17,,1ea,True,False,1.99
valu_mart,snacks,Pringles,Snack Stacks Sour Cream and Onion,PringlesSnack Stacks Sour Cream and Onion228 g,6.49,,each,2.85,,100g,True,False,6.49
valu_mart,snacks,Carnaby Sweet,Gummy Fish,Carnaby SweetGummy Fish125 g,1.0,,each,0.8,,100g,True,False,1.0
valu_mart,snacks,Excel,"Winterfresh Flavoured Sugar Free Chewing Gum, 12 Pieces, 4 Packs","ExcelWinterfresh Flavoured Sugar Free Chewing Gum, 12 Pieces, 4 Packs1 ea",1.99,,each,1.99,,1ea,True,False,1.99
valu_mart,snacks,Peek Freans,Lifestyle Selections Blueberry Brown Sugar Biscuit,Peek FreansLifestyle Selections Blueberry Brown Sugar Biscuit290 g,3.99,,each,1.38,,100g,True,False,3.99
valu_mart,snacks,John Wm. Macy's,CheeseSticks Melting Parmesan,John Wm. Macy'sCheeseSticks Melting Parmesan113 g,5.99,,each,5.3,,100g,True,False,5.99
valu_mart,snacks,Tim Hortons,"Granola Bar, Apple Fritter","Tim HortonsGranola Bar, Apple Fritter5 ea",3.29,,each,,,,True,False,3.29
valu_mart,snacks,Grissol,Melba Canapé 12 Grain,GrissolMelba Canapé 12 Grain150 g,2.99,,each,1.99,,100g,True,False,2.99
valu_mart,snacks,Sunmaid,Fruity Raisin Snacks Sour Mixed Berry,SunmaidFruity Raisin Snacks Sour Mixed Berry7x20.0 g,5.49,3.99,each,3.9214285714285713,2.85,100g,True,True,3.99
valu_mart,snacks,Dare,Bear Paws Veggies + Fruits Carrot Cake Cookies,DareBear Paws Veggies + Fruits Carrot Cake Cookies168 g,4.49,,each,2.67,,100g,True,False,4.49
valu_mart,snacks,President's Choice,Unsalted Roasted Cashews,President's ChoiceUnsalted Roasted Cashews200 g,4.99,,each,2.5,,100g,True,False,4.99
valu_mart,snacks,President's Choice,Peanuts Dry Roasted & Lightly Seasoned,President's ChoicePeanuts Dry Roasted & Lightly Seasoned700 g,6.99,,each,1.0,,100g,True,False,6.99
valu_mart,snacks,President's Choice,Sweet & Salty Kettle Corn ,President's ChoiceSweet & Salty Kettle Corn 220 g,2.99,,each,1.3599999999999999,,100g,True,False,2.99
valu_mart,snacks,Nestle,Turtles Classic Recipe Valentine's Heart Gift Box,NestleTurtles Classic Recipe Valentine's Heart Gift Box183 g,13.99,,each,7.64,,100g,True,False,13.99
valu_mart,snacks,nud,Flax Crackers Everything,nudFlax Crackers Everything66 g,7.99,,each,12.11,,100g,True,False,7.99
valu_mart,snacks,Haribo,Starmix,HariboStarmix175 g,3.49,,each,1.99,,100g,True,False,3.49
valu_mart,snacks,Que Pasa,"Tortilla Chips, Thin & Crispy, Twist of Lime","Que PasaTortilla Chips, Thin & Crispy, Twist of Lime300 g",3.99,,each,1.33,,100g,True,False,3.99
valu_mart,snacks,Betty Crocker,Dunkaroos Vanilla Cookies with Rainbow Sprinkles Frosting,Betty CrockerDunkaroos Vanilla Cookies with Rainbow Sprinkles Frosting42 g,1.99,,each,4.74,,100g,True,False,1.99
valu_mart,snacks,Christie,Dads Oatmeal Cookies,ChristieDads Oatmeal Cookies320 g,4.79,,each,1.5,,100g,True,False,4.79
valu_mart,snacks,President's Choice,Sea Salt Crackers,President's ChoiceSea Salt Crackers185 g,3.79,,each,2.05,,100g,True,False,3.79
valu_mart,snacks,Que Pasa,Taco Shells Yellow Corn Organic,Que PasaTaco Shells Yellow Corn Organic130 g,4.29,,each,3.3,,100g,True,False,4.29
valu_mart,snacks,President's Choice,The Decadent Peanut Butter Chunk Cookies,President's ChoiceThe Decadent Peanut Butter Chunk Cookies300 g,4.49,,each,1.5,,100g,True,False,4.49
valu_mart,snacks,Kozy Shack,Tapioca Pudding Tubs,Kozy ShackTapioca Pudding Tubs624 g,4.49,,each,0.72,,100g,True,False,4.49
valu_mart,snacks,President's Choice,Apple Squeeze Fruit Snacks,President's ChoiceApple Squeeze Fruit Snacks4x90.0 g,2.99,,each,0.83,,100g,True,False,2.99
valu_mart,snacks,President's Choice,Unsweetened Apple Carrot Peach Apple Fruit Blend,President's ChoiceUnsweetened Apple Carrot Peach Apple Fruit Blend6x100.0 ml,2.79,,each,0.47000000000000003,,100ml,True,False,2.79
valu_mart,snacks,President's Choice,Sea Salt and Cracked Pepper Kettle Cooked Chips,President's ChoiceSea Salt and Cracked Pepper Kettle Cooked Chips200 g,3.49,,each,1.75,,100g,True,False,3.49
valu_mart,snacks,Stacy's,Parmesan Garlic & Herb Flavour Pita Chips 227g,Stacy'sParmesan Garlic & Herb Flavour Pita Chips 227g227 g,5.49,,each,2.42,,100g,True,False,5.49
valu_mart,snacks,Hostess,Hostess Original Flavour Potato Sticks 275g,HostessHostess Original Flavour Potato Sticks 275g275 g,5.49,,each,2.0,,100g,True,False,5.49
valu_mart,snacks,No Name,Caramel Coconut Cookies,No NameCaramel Coconut Cookies198 g,3.49,,each,1.76,,100g,True,False,3.49
valu_mart,snacks,President's Choice,The Decadent Soft Baked Chocolate Chip Cookies,President's ChoiceThe Decadent Soft Baked Chocolate Chip Cookies300 g,4.49,,each,1.5,,100g,True,False,4.49
valu_mart,snacks,President's Choice,Apple Cinnamon Apple Sauce ,President's ChoiceApple Cinnamon Apple Sauce 6x100.0 ml,2.99,,each,0.5,,100ml,True,False,2.99
valu_mart,snacks,President's Choice, Dark Chocolate Concerto Biscuits ,President's Choice Dark Chocolate Concerto Biscuits 240 g,3.99,,each,1.66,,100g,True,False,3.99
valu_mart,snacks,Christie,Ritz Crackers Low Sodium,ChristieRitz Crackers Low Sodium200 g,3.99,,each,2.0,,100g,True,False,3.99
valu_mart,snacks,Lay's,Classic potato chips (small bag),Lay'sClassic potato chips (small bag)66 g,1.89,,each,2.86,,100g,True,False,1.89
valu_mart,snacks,Cadbury,Cadbury Chocolate Burnt Almond Chocolate Bar,CadburyCadbury Chocolate Burnt Almond Chocolate Bar100 g,2.99,,each,2.99,,100g,True,False,2.99
valu_mart,snacks,Nature Valley,Sweet & Salty Salted Caramel Chocolate Chewy Granola Bars Special Edition,Nature ValleySweet & Salty Salted Caramel Chocolate Chewy Granola Bars Special Edition210 g,4.49,,each,2.14,,100g,True,False,4.49
valu_mart,snacks,President's Choice,Peanut and Sunflower Seed Popcorn Bars,President's ChoicePeanut and Sunflower Seed Popcorn Bars150 g,3.79,,each,2.53,,100g,True,False,3.79
valu_mart,snacks,President's Choice,Roasted Cashews with Sea Salt ,President's ChoiceRoasted Cashews with Sea Salt 200 g,4.99,,each,2.5,,100g,True,False,4.99
valu_mart,snacks,President's Choice,Crisp & Thin Vegetable Crackers,President's ChoiceCrisp & Thin Vegetable Crackers225 g,3.79,,each,1.68,,100g,True,False,3.79
valu_mart,snacks,Nature Valley,Sweet & Salty Roasted Mixed Nut Chewy Granola Bars,Nature ValleySweet & Salty Roasted Mixed Nut Chewy Granola Bars210 g,4.49,,each,2.14,,100g,True,False,4.49
valu_mart,snacks,PC Blue Menu,Butter Flavour Microwave Popcorn,PC Blue MenuButter Flavour Microwave Popcorn6x80.0 g,5.49,,each,1.14,,100g,True,False,5.49
valu_mart,snacks,Kozy Shack,Rice Pudding Cups,Kozy ShackRice Pudding Cups6x113.0 g,6.49,,each,0.96,,100g,True,False,6.49
valu_mart,snacks,Kinder,Bueno White Chocolate and Hazelnut Cream Candy Bar,KinderBueno White Chocolate and Hazelnut Cream Candy Bar39 g,1.49,,each,3.82,,100g,True,False,1.49
valu_mart,snacks,Humpty Dumpty,Party Mix Snack Mix Cheesy Flavoured Snack,Humpty DumptyParty Mix Snack Mix Cheesy Flavoured Snack250 g,4.99,,each,2.0,,100g,True,False,4.99
valu_mart,snacks,GoGo squeez,Fruit Sauce Apple Pineapple Passion Fruit,GoGo squeezFruit Sauce Apple Pineapple Passion Fruit360 g,4.29,,each,1.19,,100g,True,False,4.29
valu_mart,snacks,President's Choice,Dark Chocolate with Candied Orange Peel,President's ChoiceDark Chocolate with Candied Orange Peel100 g,2.49,,each,2.49,,100g,True,False,2.49
valu_mart,snacks,SunRype,Fruit Source FruitSource Veggie 100% Fruit and Vegetable Bar Snack Variety Pack,SunRypeFruit Source FruitSource Veggie 100% Fruit and Vegetable Bar Snack Variety Pack12x37.0 g,8.99,,each,2.02,,100g,True,False,8.99
valu_mart,snacks,Wrigley,"Peppermint Flavoured Sugar Free Chewing Gum, 12 Pieces, 1 Pack","WrigleyPeppermint Flavoured Sugar Free Chewing Gum, 12 Pieces, 1 Pack12 ea",1.99,,each,0.17,,1ea,True,False,1.99
valu_mart,snacks,Que Pasa,Tortilla Chips Blue Corn,Que PasaTortilla Chips Blue Corn350 g,4.99,3.99,each,1.4257142857142855,1.14,100g,True,True,3.99
valu_mart,snacks,President's Choice,Dipped & Chewy Chocolate Chip Granola Bars,President's ChoiceDipped & Chewy Chocolate Chip Granola Bars1240 g,12.99,,each,1.05,,100g,True,False,12.99
valu_mart,snacks,Popchips,Sea Salt & Vinegar Flavoured Original Popped Potato Snack,PopchipsSea Salt & Vinegar Flavoured Original Popped Potato Snack142 g,3.99,,each,2.81,,100g,True,False,3.99
valu_mart,snacks,President's Choice,Cookie Chips Coconut,President's ChoiceCookie Chips Coconut170 g,3.99,,each,2.35,,100g,True,False,3.99
valu_mart,snacks,Dare,Ultimate Fudge Chocolate Cookies,DareUltimate Fudge Chocolate Cookies290 g,4.49,,each,1.55,,100g,True,False,4.49
valu_mart,snacks,Christie,Fudgee-O Original Cookies,ChristieFudgee-O Original Cookies303 g,4.29,,each,1.42,,100g,True,False,4.29
valu_mart,snacks,President's Choice,Yogurt and Raspberry Popcorn Bars,President's ChoiceYogurt and Raspberry Popcorn Bars150 g,3.79,,each,2.53,,100g,True,False,3.79
valu_mart,snacks,President's Choice,Parmesan Cheese & Garlic Swiss Sticks,President's ChoiceParmesan Cheese & Garlic Swiss Sticks100 g,3.49,,each,3.49,,100g,True,False,3.49
valu_mart,snacks,Betty Crocker,Fruit Gushers Super Sour Gushers,Betty CrockerFruit Gushers Super Sour Gushers138 g,3.99,,each,2.89,,100g,True,False,3.99
valu_mart,snacks,No Name,Hazelnut Crème-Filled Wafers,No NameHazelnut Crème-Filled Wafers175 g,1.49,,each,0.85,,100g,True,False,1.49
valu_mart,snacks,Lindt,Milk Chocolate Sea Salt,LindtMilk Chocolate Sea Salt150 g,9.99,,each,6.66,,100g,True,False,9.99
valu_mart,snacks,Finn Crisp,"Crispbread, Original Rye","Finn CrispCrispbread, Original Rye200 g",4.29,3.99,each,2.150375939849624,2.0,100g,True,True,3.99
valu_mart,snacks,Christie,Chips Ahoy! Caramilk Cookies,ChristieChips Ahoy! Caramilk Cookies453 g,5.99,5.79,each,1.3242141623488775,1.28,100g,True,True,5.79
valu_mart,snacks,President's Choice,Multigrain Melba Toast,President's ChoiceMultigrain Melba Toast200 g,3.49,,each,1.75,,100g,True,False,3.49
valu_mart,snacks,Christie,"Good Thins Rice Crackers, Simply Salt","ChristieGood Thins Rice Crackers, Simply Salt100 g",3.99,,each,3.99,,100g,True,False,3.99
valu_mart,snacks,Grissol,Baguettes Aged Cheddar,GrissolBaguettes Aged Cheddar120 g,2.99,,each,2.49,,100g,True,False,2.99
valu_mart,snacks,Smart Food,Sour Cream & Onion Flavour Seasoned Popcorn 175g,Smart FoodSour Cream & Onion Flavour Seasoned Popcorn 175g175 g,5.49,,each,3.14,,100g,True,False,5.49
valu_mart,snacks,Milano,Biscuits Cookie     ,MilanoBiscuits Cookie     200 g,1.79,,each,0.9,,100g,True,False,1.79
valu_mart,snacks,Christie,Premium Plus Whole Wheat Crackers-Soda,ChristiePremium Plus Whole Wheat Crackers-Soda500 g,4.99,4.79,each,1.0000835073068892,0.96,100g,True,True,4.79
valu_mart,snacks,President's Choice,The Reverse Decadent White Chocolate Chip Cookies,President's ChoiceThe Reverse Decadent White Chocolate Chip Cookies300 g,4.49,,each,1.5,,100g,True,False,4.49
valu_mart,snacks,Hershey's,Candy Cookies 'N' Creme,Hershey'sCandy Cookies 'N' Creme108 g,2.99,,each,2.77,,100g,True,False,2.99
valu_mart,snacks,Tim Hortons,"Granola Bar, Apple Fritter","Tim HortonsGranola Bar, Apple Fritter5 ea",3.29,,each,,,,True,False,3.29
valu_mart,snacks,Grissol,Melba Canapé 12 Grain,GrissolMelba Canapé 12 Grain150 g,2.99,,each,1.99,,100g,True,False,2.99
valu_mart,snacks,Sunmaid,Fruity Raisin Snacks Sour Mixed Berry,SunmaidFruity Raisin Snacks Sour Mixed Berry7x20.0 g,5.49,3.99,each,3.9214285714285713,2.85,100g,True,True,3.99
valu_mart,snacks,Dare,Bear Paws Veggies + Fruits Carrot Cake Cookies,DareBear Paws Veggies + Fruits Carrot Cake Cookies168 g,4.49,,each,2.67,,100g,True,False,4.49
valu_mart,snacks,President's Choice,Unsalted Roasted Cashews,President's ChoiceUnsalted Roasted Cashews200 g,4.99,,each,2.5,,100g,True,False,4.99
valu_mart,snacks,President's Choice,Peanuts Dry Roasted & Lightly Seasoned,President's ChoicePeanuts Dry Roasted & Lightly Seasoned700 g,6.99,,each,1.0,,100g,True,False,6.99
valu_mart,snacks,President's Choice,Sweet & Salty Kettle Corn ,President's ChoiceSweet & Salty Kettle Corn 220 g,2.99,,each,1.3599999999999999,,100g,True,False,2.99
valu_mart,snacks,Nestle,Turtles Classic Recipe Valentine's Heart Gift Box,NestleTurtles Classic Recipe Valentine's Heart Gift Box183 g,13.99,,each,7.64,,100g,True,False,13.99
valu_mart,snacks,Snyders,"Sweet & Salty Pretzel Pieces, Salted Caramel","SnydersSweet & Salty Pretzel Pieces, Salted Caramel240 g",3.99,,each,1.66,,100g,True,False,3.99
valu_mart,snacks,34 Degrees,Natural Crispbread,34 DegreesNatural Crispbread127 g,5.99,,each,4.72,,100g,True,False,5.99
valu_mart,snacks,Uncle Bob,Organic Popcorn,Uncle BobOrganic Popcorn500 g,5.99,,each,1.2,,100g,True,False,5.99
valu_mart,snacks,Covered Bridge,Potato Chips Sea Salt & Vinegar,Covered BridgePotato Chips Sea Salt & Vinegar60 g,1.99,,each,3.32,,100g,True,False,1.99
valu_mart,snacks,Sarah's Fine Foods,Crostini Olive Oil and Sea Salt ,Sarah's Fine FoodsCrostini Olive Oil and Sea Salt 150 g,3.99,,each,2.66,,100g,True,False,3.99
valu_mart,snacks,Christie,"Stoned Wheat Thins, Club Pack","ChristieStoned Wheat Thins, Club Pack600 g",4.99,,each,0.83,,100g,True,False,4.99
valu_mart,snacks,Oreo,"Chocolate Sandwich Cookies, Birthday Cake Flavour ","OreoChocolate Sandwich Cookies, Birthday Cake Flavour 261 g",4.29,,each,1.64,,100g,True,False,4.29
valu_mart,snacks,Quaker,Dipps Salted Butterscotch Crunch Flavour Granola Bars,QuakerDipps Salted Butterscotch Crunch Flavour Granola Bars155 g,3.49,,each,2.25,,100g,True,False,3.49
valu_mart,snacks,New York Style,"Bagel Crisps, Sea Salt","New York StyleBagel Crisps, Sea Salt170 g",4.69,,each,2.76,,100g,True,False,4.69
valu_mart,snacks,President's Choice,Virginia Variety Party Peanuts With Sea Salt,President's ChoiceVirginia Variety Party Peanuts With Sea Salt200 g,2.99,,each,1.5,,100g,True,False,2.99
valu_mart,snacks,President's Choice,Loads Of White Cheddar Cheese Crackers,President's ChoiceLoads Of White Cheddar Cheese Crackers200 g,3.79,,each,1.9,,100g,True,False,3.79
valu_mart,snacks,Ferrero,"Chocolate, Butterfinger Milk  Candy Bar ","FerreroChocolate, Butterfinger Milk  Candy Bar 54 g",1.49,,each,2.76,,100g,True,False,1.49
valu_mart,snacks,Lindt,LINDOR Double Chocolate Truffles Bag,LindtLINDOR Double Chocolate Truffles Bag150 g,9.99,,each,6.66,,100g,True,False,9.99
valu_mart,snacks,Twigz,Fire Roasted Jalapeño Craft Pretzels,TwigzFire Roasted Jalapeño Craft Pretzels130 g,4.99,,each,3.84,,100g,True,False,4.99
valu_mart,snacks,Paris Toasts,Paris Toasts,Paris ToastsParis Toasts80 g,3.49,,each,4.36,,100g,True,False,3.49
valu_mart,snacks,PC Blue Menu,"Oatmeal, Nut Butter & Peanut Bars","PC Blue MenuOatmeal, Nut Butter & Peanut Bars190 g",3.79,,each,1.9900000000000002,,100g,True,False,3.79
valu_mart,snacks,Tic Tac,Breath Freshener,Tic TacBreath Freshener29 g,1.99,,each,6.860000000000001,,100g,True,False,1.99
valu_mart,snacks,PC Black Label,Apricot and Rosemary Artisan Crisps,PC Black LabelApricot and Rosemary Artisan Crisps150 g,6.49,,each,4.33,,100g,True,False,6.49
valu_mart,snacks,President's Choice,Soft-Baked White Chocolatey Macadamia Cookies,President's ChoiceSoft-Baked White Chocolatey Macadamia Cookies240 g,3.99,,each,1.66,,100g,True,False,3.99
valu_mart,snacks,Nestle,Kitkat Chunky Minis Cello,NestleKitkat Chunky Minis Cello160 ea,5.99,,each,3.74,,100ea,True,False,5.99
