category,brand,product_text,product_name,price_text,sale_price,per_unit_price_text,is_sale,ranking,sale_valid_to
dairy_and_eggs,No Name,Cheddar Flavour Processed Cheese Product Slices,No NameCheddar Flavour Processed Cheese Product Slices800 g,$7.99ea,,$1.00/ 100g,False,373.0,
dairy_and_eggs,Becel,Margarine with Avocado Oil,BecelMargarine with Avocado Oil427 g,$4.99ea,$3.99ea,$0.93/ 100g,True,374.0,saleEnds 03/15
dairy_and_eggs,President's Choice,Extra Old White Cheddar,President's ChoiceExtra Old White Cheddar400 g,$6.99ea,,$1.75/ 100g,False,375.0,
dairy_and_eggs,Philadelphia,Light Herb & Garlic Cream Cheese,PhiladelphiaLight Herb & Garlic Cream Cheese227 g,$4.49ea,$4.19ea,$1.85/ 100g,True,376.0,saleEnds 03/15
dairy_and_eggs,No Name,Light Part Skim Mozzarella Cheese,No NameLight Part Skim Mozzarella Cheese400 g,$5.99ea,,$1.50/ 100g,False,377.0,
dairy_and_eggs,Black Diamond,Old Cheddar Cheese + Sea-Salted Roasted Cashews & Cherry Infused Dried Cranberries,Black DiamondOld Cheddar Cheese + Sea-Salted Roasted Cashews & Cherry Infused Dried Cranberries127.6 g,$5.29ea,$4.49ea,$3.52/ 100g,True,378.0,saleEnds 03/15
dairy_and_eggs,Pillsbury,Chocolatey Chip Cookies,PillsburyChocolatey Chip Cookies468 g,$3.49ea,,$0.75/ 100g,False,379.0,
dairy_and_eggs,Pillsbury,Reese Cookie Dough,PillsburyReese Cookie Dough454 g,$4.29ea,,$0.94/ 100g,False,380.0,
dairy_and_eggs,President's Choice,Oatmeal Chocolate Chip Cookie Dough,President's ChoiceOatmeal Chocolate Chip Cookie Dough468 g,$3.69ea,,$0.79/ 100g,False,381.0,
dairy_and_eggs,Nestle,COFFEE-MATE Light Powder,NestleCOFFEE-MATE Light Powder450 g,$6.49ea,,$1.44/ 100g,False,382.0,
dairy_and_eggs,Black Diamond,Cheestrings Marble Lactose Free,Black DiamondCheestrings Marble Lactose Free252 g,$7.99ea,$5.79ea,$2.30/ 100g,True,383.0,saleEnds 03/15
dairy_and_eggs,President's Choice,Lactose Free Nacho Shredded Cheese Blend,President's ChoiceLactose Free Nacho Shredded Cheese Blend320 g,$6.79ea,,$2.12/ 100g,False,384.0,
dairy_and_eggs,Oikos,"Greek Yogurt, Banana Flavour, Blended, 2% Mf, 4X100G","OikosGreek Yogurt, Banana Flavour, Blended, 2% Mf, 4X100G4x100.0 g",$3.99ea,,$1.00/ 100g,False,385.0,
dairy_and_eggs,IOGO,Nanö 1% Lactose Free Apple-Grape Drinkable Yogurt,IOGONanö 1% Lactose Free Apple-Grape Drinkable Yogurt6x93.0 ml,$3.99ea,$3.39ea,$0.61/ 100ml,True,386.0,saleEnds 03/15
dairy_and_eggs,Activia,Yogurt With Probiotics Lemon Flavour,ActiviaYogurt With Probiotics Lemon Flavour650 g,$4.59ea,,$0.71/ 100g,False,387.0,
dairy_and_eggs,PC Organics,Organic Partly Skimmed 2% Milk,PC OrganicsOrganic Partly Skimmed 2% Milk2 l,$7.09ea,,$0.35/ 100ml,False,388.0,
dairy_and_eggs,Activia,"Probiotic Smoothie, Blueberry, Strawberry, & Beet, Drinkable Yogurt","ActiviaProbiotic Smoothie, Blueberry, Strawberry, & Beet, Drinkable Yogurt190 ml",$2.29ea,,$1.21/ 100ml,False,389.0,
dairy_and_eggs,Oikos,"Greek Yogurt, Vanilla Flavour, 2% M.F., Value Tub","OikosGreek Yogurt, Vanilla Flavour, 2% M.F., Value Tub750 g",$5.49ea,,$0.73/ 100g,False,390.0,
dairy_and_eggs,Oikos,"Greek Yogurt, Key Lime Flavour, 2% M.F., Blended","OikosGreek Yogurt, Key Lime Flavour, 2% M.F., Blended4x100.0 g",$3.99ea,,$1.00/ 100g,False,391.0,
dairy_and_eggs,Activia,"Drinkable Yogurt, Mixed Berries, 8 Pack","ActiviaDrinkable Yogurt, Mixed Berries, 8 Pack1520 ml",$15.99ea,,$1.05/ 100ml,False,392.0,
dairy_and_eggs,Oikos,"Drinkable Greek Yogurt With Field Berries, Oats, & Seeds, 9G Protein","OikosDrinkable Greek Yogurt With Field Berries, Oats, & Seeds, 9G Protein190 ml",$2.29ea,,$1.21/ 100ml,False,393.0,
dairy_and_eggs,Yoplait,Yop Drinkable Yogurt Strawberry Flavour ,YoplaitYop Drinkable Yogurt Strawberry Flavour 200 ml,$0.99ea,$0.89ea,$0.45/ 100ml,True,394.0,saleEnds 03/15
dairy_and_eggs,Burnbrae Farms,Naturegg NestlaidOmega 3 Large Size 12 Eggs,Burnbrae FarmsNaturegg NestlaidOmega 3 Large Size 12 Eggs12 ea,$5.99ea,,$5.99/ 1ea,False,395.0,
dairy_and_eggs,Activia,"Probiotic Yogurt, Strawberry/Wildberry/Mango Flavour","ActiviaProbiotic Yogurt, Strawberry/Wildberry/Mango Flavour12x100.0 g",$6.49ea,$5.49ea,$0.46/ 100g,True,396.0,saleEnds 03/15
dairy_and_eggs,President's Choice,Tex Mex Shredded Cheese Blend,President's ChoiceTex Mex Shredded Cheese Blend320 g,$6.79ea,,$2.12/ 100g,False,397.0,
dairy_and_eggs,Danone,"Two Good Greek Yogurt, Vanilla Yogurt 4 Pack, Blended, 2% MF","DanoneTwo Good Greek Yogurt, Vanilla Yogurt 4 Pack, Blended, 2% MF380 g",$3.99ea,,$1.05/ 100g,False,398.0,
dairy_and_eggs,Del Monte,Red Grapefruit In Slightly Sweetened Water 8 Cups (Case),Del MonteRed Grapefruit In Slightly Sweetened Water 8 Cups (Case)8x190.0 ml,$17.99ea,,$1.18/ 100ml,False,399.0,
dairy_and_eggs,No Name,Cheese Sticks Stringable Marble,No NameCheese Sticks Stringable Marble588 g,$10.99ea,,$1.87/ 100g,False,400.0,
dairy_and_eggs,President's Choice,Plain Greek Yogurt 5%,President's ChoicePlain Greek Yogurt 5%650 g,$5.00ea,,$0.77/ 100g,False,401.0,
dairy_and_eggs,Liberte,Vanilla Large Size 9 % M.F. Yogourt,LiberteVanilla Large Size 9 % M.F. Yogourt900 g,$6.99ea,,$0.78/ 100g,False,402.0,
dairy_and_eggs,Yummy Doh,Raw Cookie Dough Chocolate Chunk,Yummy DohRaw Cookie Dough Chocolate Chunk400 g,$5.00ea,,$1.25/ 100g,False,403.0,
dairy_and_eggs,Pillsbury,"Crescents Original Dough, 8 Pieces","PillsburyCrescents Original Dough, 8 Pieces226 g",$1.99ea,,$0.88/ 100g,False,404.0,
dairy_and_eggs,Pillsbury,Reese Cookie Dough,PillsburyReese Cookie Dough454 g,$4.29ea,,$0.94/ 100g,False,405.0,
dairy_and_eggs,President's Choice,Oatmeal Chocolate Chip Cookie Dough,President's ChoiceOatmeal Chocolate Chip Cookie Dough468 g,$3.69ea,,$0.79/ 100g,False,406.0,
dairy_and_eggs,Nestle,COFFEE-MATE Light Powder,NestleCOFFEE-MATE Light Powder450 g,$6.49ea,,$1.44/ 100g,False,407.0,
dairy_and_eggs,Neilson,"Flavoured Milk, Chocolate","NeilsonFlavoured Milk, Chocolate750 ml",$1.25ea,,$0.17/ 100ml,False,408.0,
dairy_and_eggs,No Name,Cream Cheese Product With Jalapeño ,No NameCream Cheese Product With Jalapeño 227 g,$3.19ea,,$1.41/ 100g,False,409.0,
dairy_and_eggs,PC Blue Menu,Blue Menu Margarine with Olive Oil,PC Blue MenuBlue Menu Margarine with Olive Oil907 g,$5.29ea,,$0.58/ 100g,False,410.0,
dairy_and_eggs,Becel,Buttery Taste Margarine,BecelButtery Taste Margarine1.36 kg,$15.49ea,,$1.21/ 100g,False,411.0,
dairy_and_eggs,Neilson,2% Milk,Neilson2% Milk473 ml,$2.49ea,,$0.53/ 100ml,False,412.0,
dairy_and_eggs,Starbucks,Almond And Oat Dairy Free Hazelnut Latte Coffee Enhancer,StarbucksAlmond And Oat Dairy Free Hazelnut Latte Coffee Enhancer828 ml,$7.49ea,,$0.90/ 100ml,False,413.0,
dairy_and_eggs,Lactantia,2% M.F. Partly Skimmed Milk,Lactantia2% M.F. Partly Skimmed Milk2 l,$5.59ea,,$0.28/ 100ml,False,414.0,
dairy_and_eggs,President's Choice,Naturally Lactose-Free Swiss Cheese ,President's ChoiceNaturally Lactose-Free Swiss Cheese 300 g,$6.99ea,,$2.33/ 100g,False,415.0,
dairy_and_eggs,Fairlife,Lactose Free 2% Partly Skimmed Ultrafiltered Milk,FairlifeLactose Free 2% Partly Skimmed Ultrafiltered Milk1.5 l,$5.59ea,,$0.37/ 100ml,False,416.0,
dairy_and_eggs,Cracker Barrel,Sweet Combo,Cracker BarrelSweet Combo129 g,$6.49ea,$4.49ea,$3.48/ 100g,True,417.0,saleEnds 03/15
dairy_and_eggs,Milk 2 Go,Strawberry,Milk 2 GoStrawberry473 ml,$1.75ea,$1.29ea,$0.27/ 100ml,True,418.0,saleEnds 03/15
dairy_and_eggs,Neilson,Trutaste Light Cream,NeilsonTrutaste Light Cream473 ml,$3.19ea,,$0.67/ 100ml,False,419.0,
dairy_and_eggs,Becel,Margarine Salted Plant-Based Sticks,BecelMargarine Salted Plant-Based Sticks454 g,$4.99ea,$3.99ea,$0.88/ 100g,True,420.0,saleEnds 03/15
dairy_and_eggs,No Name,Cream Cheese Spread with Herbs & Roasted Garlic ,No NameCream Cheese Spread with Herbs & Roasted Garlic 227 g,$3.19ea,,$1.41/ 100g,False,421.0,
dairy_and_eggs,Gay Lea,"Nordica Cottage Cheese, Fat Free","Gay LeaNordica Cottage Cheese, Fat Free500 g",$3.89ea,$2.99ea,$0.60/ 100g,True,422.0,saleEnds 03/15
dairy_and_eggs,Black Diamond,Processed Cheddar Cheese Slices Thin,Black DiamondProcessed Cheddar Cheese Slices Thin825 g,$12.49ea,,$1.51/ 100g,False,423.0,
dairy_and_eggs,Gay Lea,"Nordica Cottage Cheese, Creamed 4%","Gay LeaNordica Cottage Cheese, Creamed 4%500 g",$3.89ea,$2.99ea,$0.60/ 100g,True,424.0,saleEnds 03/15
dairy_and_eggs,Neilson,1% Milk,Neilson1% Milk1 l,$3.49ea,,$0.35/ 100ml,False,425.0,
dairy_and_eggs,PC Blue Menu,Blue Menu Original Margarine,PC Blue MenuBlue Menu Original Margarine907 g,$5.29ea,,$0.58/ 100g,False,426.0,
dairy_and_eggs,Milk 2 Go,"Milk, Strawberry Partly Skimmed 1 % M.F.","Milk 2 GoMilk, Strawberry Partly Skimmed 1 % M.F.310 ml",$1.35ea,,$0.44/ 100ml,False,427.0,
dairy_and_eggs,Neilson,Trutaste Lactose Free Skim Milk,NeilsonTrutaste Lactose Free Skim Milk2 l,$6.19ea,,$0.31/ 100ml,False,428.0,
dairy_and_eggs,Woolwich,Homogenized Goat Milk 3.25%MF  ,WoolwichHomogenized Goat Milk 3.25%MF  1 l,$4.59ea,,$0.46/ 100ml,False,429.0,
dairy_and_eggs,Philadelphia,French Onion Dip,PhiladelphiaFrench Onion Dip227 g,$4.19ea,,$1.85/ 100g,False,430.0,
dairy_and_eggs,Lactantia,"My Country Butter Sticks, Unsalted","LactantiaMy Country Butter Sticks, Unsalted4x113.5 g",$8.29ea,,$1.83/ 100g,False,431.0,
dairy_and_eggs,Black Diamond,Cheestrings Marble 18% M.F.,Black DiamondCheestrings Marble 18% M.F.336 g,$7.99ea,$5.79ea,$1.72/ 100g,True,432.0,saleEnds 03/15
dairy_and_eggs,Armstrong,"Cheese, Cheddar with Jalapeño Mexican Fiesta 31 % M.F. 400 g","ArmstrongCheese, Cheddar with Jalapeño Mexican Fiesta 31 % M.F. 400 g400 g",$7.79ea,,$1.95/ 100g,False,433.0,
dairy_and_eggs,Gay Lea,"Sour Cream, Regular 14%","Gay LeaSour Cream, Regular 14%250 ml",$3.29ea,,$1.32/ 100ml,False,434.0,
dairy_and_eggs,President's Choice,Extra Large Free Run Brown Eggs,President's ChoiceExtra Large Free Run Brown Eggs12 eggs,$6.99ea,,$0.58/ 1ea,False,435.0,
dairy_and_eggs,Gay Lea,"Sour Cream, Low Fat 3%","Gay LeaSour Cream, Low Fat 3%500 ml",$3.19ea,,$0.64/ 100ml,False,436.0,
dairy_and_eggs,Armstrong,Marble Cheddar,ArmstrongMarble Cheddar400 g,$7.79ea,,$1.95/ 100g,False,437.0,
dairy_and_eggs,Neilson,"Flavoured Milk, Chocolate","NeilsonFlavoured Milk, Chocolate1 l",$3.29ea,,$0.33/ 100ml,False,438.0,
dairy_and_eggs,Golden Gate,Mirage Margarine,Golden GateMirage Margarine907 g,$5.69ea,,$0.63/ 100g,False,439.0,
dairy_and_eggs,Gay Lea,Real Coconut Whipped Cream,Gay LeaReal Coconut Whipped Cream225 g,$4.69ea,,$2.08/ 100g,False,440.0,
dairy_and_eggs,Kraft,Singles Original Light,KraftSingles Original Light410 g,$5.49ea,,$1.34/ 100g,False,441.0,
dairy_and_eggs,Becel,Salted Plant-Based Margarine Bricks,BecelSalted Plant-Based Margarine Bricks454 g,$5.99ea,$4.44ea,$0.98/ 100g,True,442.0,saleEnds 03/15
dairy_and_eggs,International Delight,Classic French Vanilla Coffee Creamer,International DelightClassic French Vanilla Coffee Creamer1.42 l,$7.79ea,,$0.55/ 100ml,False,443.0,
dairy_and_eggs,Armstrong,Marble Cheddar Light,ArmstrongMarble Cheddar Light400 g,$7.79ea,,$1.95/ 100g,False,444.0,
dairy_and_eggs,No Name,"Vanilla, Blueberry, Strawberry & Raspberry 0% M.F. Stirred Yogurt","No NameVanilla, Blueberry, Strawberry & Raspberry 0% M.F. Stirred Yogurt12x100.0 g",$4.29ea,,$0.36/ 100g,False,445.0,
dairy_and_eggs,No Name,14% M.F. Regular Sour Cream,No Name14% M.F. Regular Sour Cream250 ml,$2.49ea,,$1.00/ 100ml,False,446.0,
dairy_and_eggs,Philadelphia,Strawberry Cream Cheese Product,PhiladelphiaStrawberry Cream Cheese Product227 g,$4.49ea,$4.19ea,$1.85/ 100g,True,447.0,saleEnds 03/15
dairy_and_eggs,Neilson,Homogenized Milk 3.25%,NeilsonHomogenized Milk 3.25%473 ml,$2.49ea,,$0.53/ 100ml,False,448.0,
dairy_and_eggs,International Delight,Classic Hazelnut Coffee Creamer,International DelightClassic Hazelnut Coffee Creamer1.42 l,$7.79ea,,$0.55/ 100ml,False,449.0,
dairy_and_eggs,Gay Lea,Salted Butter,Gay LeaSalted Butter454 g,$7.19ea,$4.44ea,$0.98/ 100g,True,450.0,saleEnds 03/15
dairy_and_eggs,Becel,Margarine Unsalted Plant-Based Sticks,BecelMargarine Unsalted Plant-Based Sticks454 g,$4.99ea,$3.99ea,$0.88/ 100g,True,451.0,saleEnds 03/15
dairy_and_eggs,No Name,Medium Cheddar Cheese,No NameMedium Cheddar Cheese400 g,$5.99ea,,$1.50/ 100g,False,452.0,
dairy_and_eggs,Cracker Barrel,Slice Medium Cheddar,Cracker BarrelSlice Medium Cheddar240 g,$6.29ea,$4.49ea,$1.87/ 100g,True,453.0,saleEnds 03/15
dairy_and_eggs,Gay Lea,Spreadables Butter With Canola Oil,Gay LeaSpreadables Butter With Canola Oil227 g,$5.79ea,,$2.55/ 100g,False,454.0,
dairy_and_eggs,Armstrong,Bar Old Cheddar,ArmstrongBar Old Cheddar400 g,$7.79ea,,$1.95/ 100g,False,455.0,
dairy_and_eggs,Philadelphia,Original Cream Cheese Product,PhiladelphiaOriginal Cream Cheese Product340 g,$6.99ea,,$2.06/ 100g,False,456.0,
dairy_and_eggs,No Name,1% M.F. Fat Free Sour Cream ,No Name1% M.F. Fat Free Sour Cream 500 ml,$2.00ea,,$0.40/ 100ml,False,457.0,
dairy_and_eggs,Armstrong, Pizza Mozz Light 18%,Armstrong Pizza Mozz Light 18%400 g,$7.79ea,,$1.95/ 100g,False,458.0,
dairy_and_eggs,No Name,Swiss Cheese Slices,No NameSwiss Cheese Slices210 g,$4.99ea,,$2.38/ 100g,False,459.0,
dairy_and_eggs,No Name,Cheddar Flavour Processed Cheese Product Slices,No NameCheddar Flavour Processed Cheese Product Slices400 g,$4.29ea,,$1.07/ 100g,False,460.0,
dairy_and_eggs,No Name,"Old Cheddar Cheese, Light","No NameOld Cheddar Cheese, Light400 g",$5.99ea,,$1.50/ 100g,False,461.0,
dairy_and_eggs,Black Diamond,Combo Marble Cubes and Sea Salted Roasted Almonds and Dried Cranberries,Black DiamondCombo Marble Cubes and Sea Salted Roasted Almonds and Dried Cranberries127.6 g,$5.29ea,$4.49ea,$3.52/ 100g,True,462.0,saleEnds 03/15
dairy_and_eggs,No Name,French Onion Sour Cream Dip ,No NameFrench Onion Sour Cream Dip 250 g,$2.00ea,,$0.80/ 100g,False,463.0,
dairy_and_eggs,Philadelphia,Dill Pickle Dip,PhiladelphiaDill Pickle Dip340 g,$7.49ea,,$2.20/ 100g,False,464.0,
dairy_and_eggs,IOGO,"Yogurt, Vanilla 1.5%","IOGOYogurt, Vanilla 1.5%2 kg",$10.79ea,,$0.54/ 100g,False,465.0,
dairy_and_eggs,No Name,Shredded Farmer's Marble Cheese,No NameShredded Farmer's Marble Cheese320 g,$5.49ea,,$1.72/ 100g,False,466.0,
dairy_and_eggs,No Name,Shredded Marble Farmer's Cheese,No NameShredded Marble Farmer's Cheese900 g,$14.99ea,,$1.67/ 100g,False,467.0,
dairy_and_eggs,Oikos,"Greek Yogurt, Blackberry Flavour, Fruit On The Bottom","OikosGreek Yogurt, Blackberry Flavour, Fruit On The Bottom4x100.0 g",$3.99ea,,$1.00/ 100g,False,468.0,
dairy_and_eggs,President's Choice,Pizza Mozzarella and Cheddar Shredded Cheese Blend,President's ChoicePizza Mozzarella and Cheddar Shredded Cheese Blend320 g,$6.79ea,,$2.12/ 100g,False,469.0,
dairy_and_eggs,Astro,"Original Balkan Style Yogurt, Plain 3%    ","AstroOriginal Balkan Style Yogurt, Plain 3%    750 g",$3.47ea,,$0.46/ 100g,False,470.0,
dairy_and_eggs,Cracker Barrel,Cheese Sauce Kit Creamy Alfredo,Cracker BarrelCheese Sauce Kit Creamy Alfredo271 g,$7.99ea,,$2.95/ 100g,False,471.0,
dairy_and_eggs,Pillsbury,Sugar Cookies,PillsburySugar Cookies468 g,$3.29ea,,$0.70/ 100g,False,472.0,
dairy_and_eggs,Oikos,"Fat Free Greek Yogurt, Plain, No Added Sugar Value Tub","OikosFat Free Greek Yogurt, Plain, No Added Sugar Value Tub750 g",$5.49ea,,$0.73/ 100g,False,473.0,
dairy_and_eggs,Yummy Doh,Raw Cookie Dough Strawberry Confetti,Yummy DohRaw Cookie Dough Strawberry Confetti400 g,$5.00ea,,$1.25/ 100g,False,474.0,
dairy_and_eggs,President's Choice,Vanilla 2% M.F. Greek Yogurt,President's ChoiceVanilla 2% M.F. Greek Yogurt4x100.0 g,$4.19ea,,$1.05/ 100g,False,475.0,
dairy_and_eggs,President's Choice,Vanilla Skyr Icelandic Style 0% M.F. Yogurt,President's ChoiceVanilla Skyr Icelandic Style 0% M.F. Yogurt500 g,$4.59ea,,$0.92/ 100g,False,476.0,
dairy_and_eggs,President's Choice,Strawberry Kefir Probiotic Fermented 1% M.F. Milk,President's ChoiceStrawberry Kefir Probiotic Fermented 1% M.F. Milk1 l,$4.99ea,,$0.50/ 100ml,False,477.0,
dairy_and_eggs,Amooza,Pizza Mozzarella Cheese With Mild Cheddar Taste 22 % M.F.,AmoozaPizza Mozzarella Cheese With Mild Cheddar Taste 22 % M.F.228 g,$5.79ea,$4.49ea,$1.97/ 100g,True,478.0,saleEnds 03/15
dairy_and_eggs,Activia,"Immune System, Probiotic Drinkable Yogurt, Vanilla, 8 Bottles","ActiviaImmune System, Probiotic Drinkable Yogurt, Vanilla, 8 Bottles744 ml",$6.99ea,$5.49ea,$0.74/ 100ml,True,479.0,saleEnds 03/15
dairy_and_eggs,Oikos,"Fat Free Greek Yogurt, Peach-Mango Flavour, Fruit On The Bottom, 0% M.F.","OikosFat Free Greek Yogurt, Peach-Mango Flavour, Fruit On The Bottom, 0% M.F.4x100.0 g",$3.99ea,,$1.00/ 100g,False,480.0,
dairy_and_eggs,Cracker Barrel,Sweet Combo,Cracker BarrelSweet Combo129 g,$6.49ea,$4.49ea,$3.48/ 100g,True,481.0,saleEnds 03/15
dairy_and_eggs,Neilson,Trutaste Light Cream,NeilsonTrutaste Light Cream473 ml,$3.19ea,,$0.67/ 100ml,False,482.0,
dairy_and_eggs,Neilson,1% Milk,Neilson1% Milk1 l,$3.49ea,,$0.35/ 100ml,False,483.0,
dairy_and_eggs,No Name,Cream Cheese Product With Jalapeño ,No NameCream Cheese Product With Jalapeño 227 g,$3.19ea,,$1.41/ 100g,False,484.0,
dairy_and_eggs,No Name,Cream Cheese Spread with Herbs & Roasted Garlic ,No NameCream Cheese Spread with Herbs & Roasted Garlic 227 g,$3.19ea,,$1.41/ 100g,False,485.0,
dairy_and_eggs,Neilson,Homogenized Milk 3.25%,NeilsonHomogenized Milk 3.25%473 ml,$2.49ea,,$0.53/ 100ml,False,486.0,
dairy_and_eggs,Milk 2 Go,"Milk, Strawberry Partly Skimmed 1 % M.F.","Milk 2 GoMilk, Strawberry Partly Skimmed 1 % M.F.310 ml",$1.35ea,,$0.44/ 100ml,False,487.0,
dairy_and_eggs,Woolwich,Homogenized Goat Milk 3.25%MF  ,WoolwichHomogenized Goat Milk 3.25%MF  1 l,$4.59ea,,$0.46/ 100ml,False,488.0,
dairy_and_eggs,Black Diamond,Cheestrings Marble 18% M.F.,Black DiamondCheestrings Marble 18% M.F.336 g,$7.99ea,$5.79ea,$1.72/ 100g,True,489.0,saleEnds 03/15
dairy_and_eggs,Gay Lea,"Sour Cream, Regular 14%","Gay LeaSour Cream, Regular 14%250 ml",$3.29ea,,$1.32/ 100ml,False,490.0,
dairy_and_eggs,President's Choice,Extra Large Free Run Brown Eggs,President's ChoiceExtra Large Free Run Brown Eggs12 eggs,$6.99ea,,$0.58/ 1ea,False,491.0,
dairy_and_eggs,Activia,"Immune System, Probiotic Drinkable Yogurt, Vanilla, 8 Bottles","ActiviaImmune System, Probiotic Drinkable Yogurt, Vanilla, 8 Bottles744 ml",$6.99ea,$5.49ea,$0.74/ 100ml,True,492.0,saleEnds 03/15
dairy_and_eggs,Cracker Barrel,Signature Shredded Natural Cheese Extra Old & Mozza 31 % M.F.,Cracker BarrelSignature Shredded Natural Cheese Extra Old & Mozza 31 % M.F.300 g,$6.24ea,$5.49ea,$1.83/ 100g,True,493.0,saleEnds 03/15
dairy_and_eggs,Activia,"Immune System, Probiotic Drinkable Yogurt, Strawberry Banana, 8X","ActiviaImmune System, Probiotic Drinkable Yogurt, Strawberry Banana, 8X8x93.0 ml",$6.99ea,$5.49ea,$0.74/ 100ml,True,494.0,saleEnds 03/15
dairy_and_eggs,No Name,14% M.F. Regular Sour Cream,No Name14% M.F. Regular Sour Cream250 ml,$2.49ea,,$1.00/ 100ml,False,495.0,
dairy_and_eggs,President's Choice,Vanilla Skyr Icelandic Style 0% M.F. Yogurt,President's ChoiceVanilla Skyr Icelandic Style 0% M.F. Yogurt500 g,$4.59ea,,$0.92/ 100g,False,496.0,
dairy_and_eggs,Pillsbury,Crescents - Reduced Fat,PillsburyCrescents - Reduced Fat227 g,$1.99ea,,$0.88/ 100g,False,497.0,
dairy_and_eggs,Liberte,Greek Vanilla 3% MF Yogurt,LiberteGreek Vanilla 3% MF Yogurt750 g,$6.49ea,,$0.87/ 100g,False,498.0,
dairy_and_eggs,Pillsbury,Easy Roll Pie Crust   ,PillsburyEasy Roll Pie Crust   400 g,$3.49ea,,$0.87/ 100g,False,499.0,
dairy_and_eggs,No Name,"Cottage Cheese, 2% M.F.","No NameCottage Cheese, 2% M.F.500 g",$3.49ea,,$0.70/ 100g,False,500.0,
dairy_and_eggs,Kraft,Cheez Whiz Cheese Spread,KraftCheez Whiz Cheese Spread450 g,$6.49ea,,$1.44/ 100g,False,501.0,
dairy_and_eggs,Yoplait,Yop Drinkable Yogurt Blueberry Flavour,YoplaitYop Drinkable Yogurt Blueberry Flavour200 ml,$0.99ea,$0.89ea,$0.45/ 100ml,True,502.0,saleEnds 03/15
dairy_and_eggs,Oikos,"Greek Yogurt, Blueberry Flavour, Fruit On The Bottom, 2% M.F.","OikosGreek Yogurt, Blueberry Flavour, Fruit On The Bottom, 2% M.F.4x100.0 g",$3.99ea,,$1.00/ 100g,False,503.0,
dairy_and_eggs,Yoplait,Tubes Mixed Berry,YoplaitTubes Mixed Berry8x56.0 g,$3.29ea,,$0.73/ 100g,False,504.0,
dairy_and_eggs,Yoplait,Tubes Strawberry Yogurt,YoplaitTubes Strawberry Yogurt8x56.0 g,$3.29ea,,$0.73/ 100g,False,505.0,
dairy_and_eggs,Yoplait,Lactose Free Strawberry/Raspberry Drinkable Yogurt,YoplaitLactose Free Strawberry/Raspberry Drinkable Yogurt200 ml,$0.99ea,$0.89ea,$0.45/ 100ml,True,506.0,saleEnds 03/15
dairy_and_eggs,President's Choice,"Yogurt, Mango Coconut Kefir Probiotic Fermented 1% M.F. Milk","President's ChoiceYogurt, Mango Coconut Kefir Probiotic Fermented 1% M.F. Milk1 l",$4.99ea,,$0.50/ 100ml,False,507.0,
dairy_and_eggs,Cracker Barrel,Cheddar Cheese Old Probiotic 34% M.F.,Cracker BarrelCheddar Cheese Old Probiotic 34% M.F.168 g,$5.79ea,,$3.45/ 100g,False,508.0,
dairy_and_eggs,Black Diamond,Cheestrings Mozzarella 18% M.F.,Black DiamondCheestrings Mozzarella 18% M.F.336 g,$7.99ea,$5.79ea,$1.72/ 100g,True,509.0,saleEnds 03/15
dairy_and_eggs,No Name,Coffee Whitener,No NameCoffee Whitener1 kg,$7.79ea,,$0.78/ 100g,False,510.0,
dairy_and_eggs,Nestle,"Coffee-Mate, Original","NestleCoffee-Mate, Original1.4 kg",$11.49ea,,$0.82/ 100g,False,511.0,
dairy_and_eggs,Liberte,Greek Cherry 2% MF Yogurt,LiberteGreek Cherry 2% MF Yogurt750 g,$6.49ea,,$0.87/ 100g,False,512.0,
dairy_and_eggs,IOGO,3.2% M.F. Yogurt,IOGO3.2% M.F. Yogurt12x100.0 g,$6.99ea,,$0.58/ 100g,False,513.0,
dairy_and_eggs,Astro,"Original Balkan Style Yogurt, Plain 0%","AstroOriginal Balkan Style Yogurt, Plain 0%750 g",$3.47ea,,$0.46/ 100g,False,514.0,
dairy_and_eggs,President's Choice,"Strawberry, Vanilla, Raspberry & Banana Creamy Stirred Yogurt","President's ChoiceStrawberry, Vanilla, Raspberry & Banana Creamy Stirred Yogurt16x100.0 g",$5.49ea,,$0.34/ 100g,False,515.0,
dairy_and_eggs,Activia,"Probiotic Yogurt, Mixed Berries, Drinkable Yogurt, 8 Pack","ActiviaProbiotic Yogurt, Mixed Berries, Drinkable Yogurt, 8 Pack8x93.0 ml",$5.49ea,,$0.74/ 100ml,False,516.0,
dairy_and_eggs,No Name,"Pizza Mozzarella Cheese, 28% MF","No NamePizza Mozzarella Cheese, 28% MF700 g",$9.99ea,,$1.43/ 100g,False,517.0,
dairy_and_eggs,No Name,Farmer's Marble Cheese,No NameFarmer's Marble Cheese700 g,$9.99ea,,$1.43/ 100g,False,518.0,
dairy_and_eggs,Yoplait,Creamy Fieldberry/Strawberry/Cherry/Peach 1.5% MF Yogurt,YoplaitCreamy Fieldberry/Strawberry/Cherry/Peach 1.5% MF Yogurt16x100.0 g,$6.99ea,$5.49ea,$0.34/ 100g,True,519.0,saleEnds 03/15
dairy_and_eggs,Yoplait,Strawberry Banana Yogurt,YoplaitStrawberry Banana Yogurt8x93.0 ml,$6.49ea,,$0.87/ 100ml,False,520.0,
dairy_and_eggs,Yoplait,Source Cherry Yogurt 0% MF,YoplaitSource Cherry Yogurt 0% MF630 g,$3.19ea,,$0.51/ 100g,False,521.0,
dairy_and_eggs,Yoplait,Source Vanilla  Yogurt 0% MF,YoplaitSource Vanilla  Yogurt 0% MF630 g,$3.19ea,,$0.51/ 100g,False,522.0,
dairy_and_eggs,Yoplait,Source Raspberry 0% MF,YoplaitSource Raspberry 0% MF630 g,$3.19ea,,$0.51/ 100g,False,523.0,
dairy_and_eggs,Yoplait,Source Strawberry 0% MF,YoplaitSource Strawberry 0% MF630 g,$3.19ea,,$0.51/ 100g,False,524.0,
dairy_and_eggs,Liberte,Greek Yogourt Black Cherry Raspberry 2% M.F.,LiberteGreek Yogourt Black Cherry Raspberry 2% M.F.650 g,$6.49ea,,$1.00/ 100g,False,525.0,
dairy_and_eggs,Yoplait,Source Dessert Lemon Meringue Pie/Berry Crumble/Key Lime Pie/Strawberries and Cream 0% MF Yogurt,YoplaitSource Dessert Lemon Meringue Pie/Berry Crumble/Key Lime Pie/Strawberries and Cream 0% MF Yogurt16x100.0 g,$6.99ea,$5.49ea,$0.34/ 100g,True,526.0,saleEnds 03/15
dairy_and_eggs,Pillsbury,Grands Cookie Dough Chocolate Chip,PillsburyGrands Cookie Dough Chocolate Chip454 g,$4.49ea,,$0.99/ 100g,False,527.0,
dairy_and_eggs,Liberte,Méditerrannée Strawberry 9% MF Yogurt,LiberteMéditerrannée Strawberry 9% MF Yogurt500 g,$4.19ea,,$0.84/ 100g,False,528.0,
dairy_and_eggs,Yoplait,Source Dessert Lemon Meringue Pie/Berry Crumble/Key Lime Pie/Strawberries and Cream 0% MF Yogurt,YoplaitSource Dessert Lemon Meringue Pie/Berry Crumble/Key Lime Pie/Strawberries and Cream 0% MF Yogurt16x100.0 g,$6.99ea,$5.49ea,$0.34/ 100g,True,529.0,saleEnds 03/15
dairy_and_eggs,Oikos,"Greek Yogurt, Strawberry Flavour, Fruit On The Bottom, 2% M.F.","OikosGreek Yogurt, Strawberry Flavour, Fruit On The Bottom, 2% M.F.4x100.0 g",$3.99ea,,$1.00/ 100g,False,530.0,
dairy_and_eggs,Oikos,"Fat Free Greek Yogurt, Vanilla Flavour, Blended, 0% M.F.","OikosFat Free Greek Yogurt, Vanilla Flavour, Blended, 0% M.F.750 g",$5.49ea,,$0.73/ 100g,False,531.0,
dairy_and_eggs,Oikos,"Greek Yogurt, Plain, No Added Sugar, 2% M.F., 4 Pack","OikosGreek Yogurt, Plain, No Added Sugar, 2% M.F., 4 Pack4x100.0 g",$3.99ea,,$1.00/ 100g,False,532.0,
dairy_and_eggs,Oikos,"Drinkable Greek Yogurt With Banana, Oats, & Seeds, 9G Protein","OikosDrinkable Greek Yogurt With Banana, Oats, & Seeds, 9G Protein190 ml",$2.29ea,,$1.21/ 100ml,False,533.0,
dairy_and_eggs,President's Choice,"Plant Based Cultured Coconut Milk Yogurt Alternative, Plain","President's ChoicePlant Based Cultured Coconut Milk Yogurt Alternative, Plain500 g",$4.19ea,,$0.84/ 100g,False,534.0,
dairy_and_eggs,Califia Farms,Barista Blend,Califia FarmsBarista Blend946 ml,$5.99ea,,$0.63/ 100ml,False,535.0,
dairy_and_eggs,Black Diamond,Marble Cheddar Cheese Sticks,Black DiamondMarble Cheddar Cheese Sticks252 g,$7.99ea,$5.79ea,$2.30/ 100g,True,536.0,saleEnds 03/15
dairy_and_eggs,Danone,"Spiderman Yoghurt Drink with Real Fruit, Raspberry, 6 Bottles","DanoneSpiderman Yoghurt Drink with Real Fruit, Raspberry, 6 Bottles558 ml",$4.99ea,,$0.89/ 100ml,False,537.0,
dairy_and_eggs,Activia,"Yogurt With Probiotics, Peach Flavour Tub","ActiviaYogurt With Probiotics, Peach Flavour Tub650 g",$4.59ea,,$0.71/ 100g,False,538.0,
dairy_and_eggs,Oikos,"Greek Yogurt, Strawberry Raspberry, Fruit On The Bottom, 2% M.F.","OikosGreek Yogurt, Strawberry Raspberry, Fruit On The Bottom, 2% M.F.4x100.0 g",$3.99ea,,$1.00/ 100g,False,539.0,
dairy_and_eggs,IOGO,"Drinkable Yogurt, Banana 1.5%","IOGODrinkable Yogurt, Banana 1.5%6x93.0 ml",$3.99ea,$3.39ea,$0.61/ 100ml,True,540.0,saleEnds 03/15
dairy_and_eggs,Silk,"Soy For Coffee, Original Coffee Creamer","SilkSoy For Coffee, Original Coffee Creamer890 ml",$5.49ea,,$0.62/ 100ml,False,541.0,
