category,brand,product_text,product_name,price_text,sale_price,per_unit_price_text,is_sale,ranking,sale_valid_to
dairy_and_eggs,President's Choice,Peach Mango 2% M.F. Greek Yogurt,President's ChoicePeach Mango 2% M.F. Greek Yogurt4x100.0 g,$4.19ea,,$1.05/ 100g,False,542.0,
dairy_and_eggs,Becel,Margarine with Olive Oil,BecelMargarine with Olive Oil454 g,$4.99ea,$3.99ea,$0.93/ 100g,True,543.0,saleEnds 03/15
dairy_and_eggs,Derlea,Garlic Spread,DerleaGarlic Spread250 g,$2.99ea,,$1.20/ 100g,False,544.0,
dairy_and_eggs,Cracker Barrel,Shreds Tex Mex,Cracker BarrelShreds Tex Mex320 g,$8.29ea,$5.49ea,$1.72/ 100g,True,545.0,saleEnds 03/15
dairy_and_eggs,Activia,"Immune System, Probiotic Drinkable Yogurt, Peach, 8 Bottles","ActiviaImmune System, Probiotic Drinkable Yogurt, Peach, 8 Bottles8x93.0 ml",$6.99ea,$5.49ea,$0.74/ 100ml,True,546.0,saleEnds 03/15
dairy_and_eggs,Yoplait,Source Fieldberry Yogurt 0% MF,YoplaitSource Fieldberry Yogurt 0% MF630 g,$3.19ea,,$0.51/ 100g,False,547.0,
dairy_and_eggs,Liberte,Greek Plain 0% MF Yogurt,LiberteGreek Plain 0% MF Yogurt750 g,$6.99ea,$6.49ea,$0.87/ 100g,True,548.0,saleEnds 03/15
dairy_and_eggs,Lactantia,Chocolate Milk,LactantiaChocolate Milk1.5 l,$5.69ea,,$0.38/ 100ml,False,549.0,
dairy_and_eggs,Liberte,Méditerranée Coconut 9% MF Yogurt,LiberteMéditerranée Coconut 9% MF Yogurt500 g,$4.19ea,,$0.84/ 100g,False,550.0,
dairy_and_eggs,No Name,5% M.F. Light Sour Cream,No Name5% M.F. Light Sour Cream500 ml,$2.00ea,,$0.40/ 100ml,False,551.0,
dairy_and_eggs,Yoplait,Creamy Raspberry/Blueberry/Fieldberry/Strawberry 1.5% MF Yogurt ,YoplaitCreamy Raspberry/Blueberry/Fieldberry/Strawberry 1.5% MF Yogurt 16x100.0 g,$6.99ea,$5.49ea,$0.34/ 100g,True,552.0,saleEnds 03/15
dairy_and_eggs,Liberte,Greek 5% M.F Plain Yogourt,LiberteGreek 5% M.F Plain Yogourt650 g,$6.49ea,,$1.00/ 100g,False,553.0,
dairy_and_eggs,Silk,"Almond For Coffee, Vanilla Flavour, Plant Based Dairy Free Coffee Creamer","SilkAlmond For Coffee, Vanilla Flavour, Plant Based Dairy Free Coffee Creamer890 ml",$5.49ea,,$0.62/ 100ml,False,554.0,
dairy_and_eggs,Danone,"Extra Creamy Greek Yogurt, Vanilla, Blended, 9% M.F.","DanoneExtra Creamy Greek Yogurt, Vanilla, Blended, 9% M.F.650 g",$5.49ea,,$0.84/ 100g,False,555.0,
dairy_and_eggs,Activia,"Probiotic Smoothie, Kiwi, Pineapple & Cucumber, Drinkable Yogurt","ActiviaProbiotic Smoothie, Kiwi, Pineapple & Cucumber, Drinkable Yogurt190 ml",$2.29ea,,$1.21/ 100ml,False,556.0,
dairy_and_eggs,Astro,"Original Balkan Style Yogurt, Strawberry, Raspberry, Black Cherry, Nectarine","AstroOriginal Balkan Style Yogurt, Strawberry, Raspberry, Black Cherry, Nectarine12x100.0 g",$6.29ea,,$0.52/ 100g,False,557.0,
dairy_and_eggs,Danone,"Danino Strawberry-Banana Flavoured Paw Patrol Yogurt Drink For Kids, 6X93","DanoneDanino Strawberry-Banana Flavoured Paw Patrol Yogurt Drink For Kids, 6X93558 ml",$4.99ea,,$0.89/ 100ml,False,558.0,
dairy_and_eggs,Cracker Barrel,Shreds Mozza Cheddar,Cracker BarrelShreds Mozza Cheddar320 g,$8.29ea,$5.49ea,$1.72/ 100g,True,559.0,saleEnds 03/15
dairy_and_eggs,Activia,"Yogurt With Probiotics Lactose Free, Vanilla, Strawberry, Raspberry, Cherry Flavour","ActiviaYogurt With Probiotics Lactose Free, Vanilla, Strawberry, Raspberry, Cherry Flavour12x100.0 g",$6.49ea,$5.49ea,$0.46/ 100g,True,560.0,saleEnds 03/15
dairy_and_eggs,Activia,"Immune System, Probiotic Yogurt Drink, Strawberry Drinkable Yogurt, 8 Pack","ActiviaImmune System, Probiotic Yogurt Drink, Strawberry Drinkable Yogurt, 8 Pack8x93.0 ml",$6.99ea,$5.49ea,$0.74/ 100ml,True,561.0,saleEnds 03/15
dairy_and_eggs,Pillsbury,Chub Chocolate Chunk Cookie   ,PillsburyChub Chocolate Chunk Cookie   468 g,$3.49ea,,$0.75/ 100g,False,562.0,
dairy_and_eggs,Liberte,Yogourt Black Cherry 9 % M.F.,LiberteYogourt Black Cherry 9 % M.F.4x100.0 g,$4.19ea,,$1.05/ 100g,False,563.0,
dairy_and_eggs,Yoplait,Minigo 3% MF Fresh Cheese Strawberry/Strawberry-Vanilla/Strawberry-Banana,YoplaitMinigo 3% MF Fresh Cheese Strawberry/Strawberry-Vanilla/Strawberry-Banana6x60.0 g,$3.29ea,,$0.91/ 100g,False,564.0,
dairy_and_eggs,Pillsbury,Holiday Premium Edition Cookies,PillsburyHoliday Premium Edition Cookies396 g,$4.49ea,,$1.13/ 100g,False,565.0,
dairy_and_eggs,Yoplait,Creamy Duo Raspberry-Vanilla/Blueberry-Vanilla/Mango-Vanilla/Strawberry-Vanilla 1.5% <MF Yogurt,YoplaitCreamy Duo Raspberry-Vanilla/Blueberry-Vanilla/Mango-Vanilla/Strawberry-Vanilla 1.5% <MF Yogurt16x100.0 g,$7.29ea,$5.49ea,$0.34/ 100g,True,566.0,saleEnds 03/15
dairy_and_eggs,Pillsbury,Grands Cinnamon Rolls Regular   ,PillsburyGrands Cinnamon Rolls Regular   496 g,$4.49ea,,$0.91/ 100g,False,567.0,
dairy_and_eggs,Yoplait,Source Peach Yogurt 0% MF,YoplaitSource Peach Yogurt 0% MF630 g,$3.19ea,,$0.51/ 100g,False,568.0,
dairy_and_eggs,Black Diamond,Cheestrings Marble Lactose Free,Black DiamondCheestrings Marble Lactose Free252 g,$7.99ea,$5.79ea,$2.30/ 100g,True,569.0,saleEnds 03/15
dairy_and_eggs,President's Choice,Lactose Free Nacho Shredded Cheese Blend,President's ChoiceLactose Free Nacho Shredded Cheese Blend320 g,$6.79ea,,$2.12/ 100g,False,570.0,
dairy_and_eggs,No Name,Farmer's Marble Cheese ,No NameFarmer's Marble Cheese 200 g,$3.99ea,,$2.00/ 100g,False,571.0,
dairy_and_eggs,Woolwich,Partially Skimmed Goat Milk 2%,WoolwichPartially Skimmed Goat Milk 2%1 l,$4.59ea,,$0.46/ 100ml,False,572.0,
dairy_and_eggs,No Name,Cheddar Flavour Processed Cheese Product Slices,No NameCheddar Flavour Processed Cheese Product Slices800 g,$7.99ea,,$1.00/ 100g,False,573.0,
dairy_and_eggs,Astro,"Biobest Probiotic Yogurt, Plain","AstroBiobest Probiotic Yogurt, Plain750 g",$3.47ea,,$0.46/ 100g,False,574.0,
dairy_and_eggs,Yoplait,"Yogurt Tubes, Strawberry Banana & Fruit Punch","YoplaitYogurt Tubes, Strawberry Banana & Fruit Punch8x56.0 g",$3.29ea,,$0.73/ 100g,False,575.0,
dairy_and_eggs,Astro,"Original Balkan Style Yogurt, Plain 2%","AstroOriginal Balkan Style Yogurt, Plain 2%750 g",$3.47ea,,$0.46/ 100g,False,576.0,
dairy_and_eggs,Yoplait,Vanilla Yogurt,YoplaitVanilla Yogurt200 ml,$0.99ea,$0.89ea,$0.45/ 100ml,True,577.0,saleEnds 03/15
dairy_and_eggs,Liberte,Greek Peach 2% MF Yogurt,LiberteGreek Peach 2% MF Yogurt750 g,$6.49ea,,$0.87/ 100g,False,578.0,
dairy_and_eggs,President's Choice,Plain Kefir Probiotic Fermented 1% M.F. Milk,President's ChoicePlain Kefir Probiotic Fermented 1% M.F. Milk1 l,$4.99ea,,$0.50/ 100ml,False,579.0,
dairy_and_eggs,Yoplait,Yop Drinkable Yogurt Tropical Flavour,YoplaitYop Drinkable Yogurt Tropical Flavour200 ml,$0.99ea,$0.89ea,$0.45/ 100ml,True,580.0,saleEnds 03/15
dairy_and_eggs,Oikos,"Drinkable Greek Yogurt With Vanilla, Apricot, Oats, & Seeds, 9G Protein","OikosDrinkable Greek Yogurt With Vanilla, Apricot, Oats, & Seeds, 9G Protein190 ml",$2.29ea,,$1.21/ 100ml,False,581.0,
dairy_and_eggs,Activia,"Yogurt With Probiotics, Strawberry Flavour","ActiviaYogurt With Probiotics, Strawberry Flavour650 g",$4.59ea,,$0.71/ 100g,False,582.0,
dairy_and_eggs,Activia,"Probiotic Yogurt, Blackberry, Blueberry, Blackcurrent, Berries, 12XG","ActiviaProbiotic Yogurt, Blackberry, Blueberry, Blackcurrent, Berries, 12XG12x100.0 g",$6.49ea,$5.49ea,$0.46/ 100g,True,583.0,saleEnds 03/15
dairy_and_eggs,Danone,"Encanto Yoghurt Drink, Vanilla, 6 Bottles","DanoneEncanto Yoghurt Drink, Vanilla, 6 Bottles558 ml",$4.99ea,,$0.89/ 100ml,False,584.0,
dairy_and_eggs,Liberte,Greek Vanilla Large Size 0 % M.F. Yogourt,LiberteGreek Vanilla Large Size 0 % M.F. Yogourt1 kg,$8.29ea,,$0.83/ 100g,False,585.0,
dairy_and_eggs,Activia,"Yogurt With Probiotics, Fieldberry Flavour Tub","ActiviaYogurt With Probiotics, Fieldberry Flavour Tub650 g",$4.59ea,,$0.71/ 100g,False,586.0,
dairy_and_eggs,Danone,"Danino Strawberry Flavoured Drinkable Yogurt, 6 Bottles","DanoneDanino Strawberry Flavoured Drinkable Yogurt, 6 Bottles558 ml",$4.99ea,,$0.89/ 100ml,False,587.0,
dairy_and_eggs,No Name,Old Cheddar Cheese,No NameOld Cheddar Cheese700 g,$9.99ea,,$1.43/ 100g,False,588.0,
dairy_and_eggs,No Name,Light Marble Cheddar Cheese 19% M.F.,No NameLight Marble Cheddar Cheese 19% M.F.700 g,$9.99ea,,$1.43/ 100g,False,589.0,
dairy_and_eggs,Pillsbury,Flaky Real Apple Turnovers,PillsburyFlaky Real Apple Turnovers383 g,$3.49ea,,$0.91/ 100g,False,590.0,
dairy_and_eggs,Liberte,Greek Lactose Free Plain 0% MF Yogurt,LiberteGreek Lactose Free Plain 0% MF Yogurt750 g,$6.49ea,,$0.87/ 100g,False,591.0,
dairy_and_eggs,Kraft,Singles Original Slices,KraftSingles Original Slices825 g,$10.99ea,,$1.33/ 100g,False,592.0,
dairy_and_eggs,Liberte,Greek Vanilla 0% MF Yogurt,LiberteGreek Vanilla 0% MF Yogurt750 g,$6.49ea,,$0.87/ 100g,False,593.0,
dairy_and_eggs,No Name,Medium Cheddar Cheese,No NameMedium Cheddar Cheese700 g,$9.99ea,,$1.43/ 100g,False,594.0,
dairy_and_eggs,Yoplait,Minigo 3% MF Duo Fresh Cheese Strawberry-Banana/Blueberry-Strawberry/Banana-Blueberry,YoplaitMinigo 3% MF Duo Fresh Cheese Strawberry-Banana/Blueberry-Strawberry/Banana-Blueberry6x60.0 g,$3.29ea,,$0.91/ 100g,False,595.0,
dairy_and_eggs,Pillsbury,"Wiener Wrap, Regular","PillsburyWiener Wrap, Regular200 g",$1.99ea,,$1.00/ 100g,False,596.0,
dairy_and_eggs,Pillsbury,Country Biscuits,PillsburyCountry Biscuits340 g,$3.79ea,,$1.11/ 100g,False,597.0,
dairy_and_eggs,Liberte,Yogourt Wild Blueberry 9 % M.F.,LiberteYogourt Wild Blueberry 9 % M.F.4x100.0 g,$4.19ea,,$1.05/ 100g,False,598.0,
dairy_and_eggs,Yoplait,Source Blueberry/Strawberry/Blackberry/Nectarine  0% MF Yogurt,YoplaitSource Blueberry/Strawberry/Blackberry/Nectarine  0% MF Yogurt16x100.0 g,$7.29ea,$5.49ea,$0.34/ 100g,True,599.0,saleEnds 03/15
dairy_and_eggs,Liberte,Greek Plain 2% MF Yogurt,LiberteGreek Plain 2% MF Yogurt750 g,$6.49ea,,$0.87/ 100g,False,600.0,
dairy_and_eggs,Liberte,Méditerranée Black Cherry 9% MF Yogurt,LiberteMéditerranée Black Cherry 9% MF Yogurt500 g,$4.19ea,,$0.84/ 100g,False,601.0,
dairy_and_eggs,No Name,"Cottage Cheese, 2% M.F.","No NameCottage Cheese, 2% M.F.500 g",$3.49ea,,$0.70/ 100g,False,602.0,
