category,brand,product_text,product_name,price_text,sale_price,per_unit_price_text,is_sale,ranking,sale_valid_to
snacks,M&M's,"Caramel Milk Chocolate Candies, Sharing Bag","M&M'sCaramel Milk Chocolate Candies, Sharing Bag185 g",$4.99ea,,$2.70/ 100g,False,578.0,
snacks,Voortman,Lemon Wafers,VoortmanLemon Wafers300 g,$3.29ea,,$1.10/ 100g,False,579.0,
snacks,Mars,"Peanut Free Chocolate Candy Bar, 10 Fun Size Bars","MarsPeanut Free Chocolate Candy Bar, 10 Fun Size Bars130 g",$2.59ea,,$1.99/ 100g,False,580.0,
snacks,Kinder,"Surprise Chocolate Eggs with Toys, Classic Edition, 3 Pack","KinderSurprise Chocolate Eggs with Toys, Classic Edition, 3 Pack60 g",$3.75ea,$3.49ea,$5.82/ 100g,True,581.0,saleEnds 03/15
snacks,Haldiram,Indian Snacks Khatta Meetha Sour & Sweet Mix,HaldiramIndian Snacks Khatta Meetha Sour & Sweet Mix150 g,$1.99ea,,$1.33/ 100g,False,582.0,
snacks,Nature Valley,Trail Mix Dark Chocolate Chewy Granola Bars,Nature ValleyTrail Mix Dark Chocolate Chewy Granola Bars175 g,$2.99ea,,$1.71/ 100g,False,583.0,
snacks,Reese's,Peanut Butter Bar,Reese'sPeanut Butter Bar120 g,$2.59ea,,$2.16/ 100g,False,584.0,
snacks,Betty Crocker,Fruit By The Foot Strawberry and Berry Tie Dye Family Pack ,Betty CrockerFruit By The Foot Strawberry and Berry Tie Dye Family Pack 340 g,$6.49ea,$5.99ea,$1.76/ 100g,True,585.0,saleEnds 03/15
snacks,Nestle,Caramel Crisp Wafer Bar,NestleCaramel Crisp Wafer Bar120 g,$2.59ea,,$2.16/ 100g,False,586.0,
snacks,Kozy Shack,Rice Pudding Cups No Sugar Added,Kozy ShackRice Pudding Cups No Sugar Added4x113.0 g,$4.00ea,,$0.88/ 100g,False,587.0,
snacks,Christie,Oreo Chocolate Peanut Butter Pie Cookies,ChristieOreo Chocolate Peanut Butter Pie Cookies482 g,$4.99ea,,$1.04/ 100g,False,588.0,
snacks,Quaker,Crispy Minis BBQ flavour brown rice chips,QuakerCrispy Minis BBQ flavour brown rice chips100 g,$2.79ea,,$2.79/ 100g,False,589.0,
snacks,Cadbury,Dairy Milk Hazelnut Chocolate Bar,CadburyDairy Milk Hazelnut Chocolate Bar100 g,$2.49ea,,$2.49/ 100g,False,590.0,
snacks,Milano,Giant Lady Finger Bis   ,MilanoGiant Lady Finger Bis   150 g,$1.29ea,,$0.86/ 100g,False,591.0,
snacks,Voortman,"Cookies, Bakery Wafers Chocolate & Raspberry","VoortmanCookies, Bakery Wafers Chocolate & Raspberry300 g",$3.29ea,,$1.10/ 100g,False,592.0,
snacks,Tim Hortons,Boston Cream Granola Bar,Tim HortonsBoston Cream Granola Bar150 g,$2.99ea,,$1.99/ 100g,False,593.0,
snacks,Haldiram,Moong Dal,HaldiramMoong Dal150 g,$1.99ea,,$1.33/ 100g,False,594.0,
snacks,Voortman,"Wafers, Strawberry","VoortmanWafers, Strawberry300 g",$3.29ea,,$1.10/ 100g,False,595.0,
snacks,President's Choice,Dark Chocolate Bar With Almonds,President's ChoiceDark Chocolate Bar With Almonds300 g,$5.00ea,,$1.67/ 100g,False,596.0,
snacks,Tic Tac,"Mints, Breath Freshener, Orange, 60 pills per pack, 3 Count Multipack","Tic TacMints, Breath Freshener, Orange, 60 pills per pack, 3 Count Multipack87 g",$3.69ea,,$4.24/ 100g,False,597.0,
snacks,Voortman,"Wafers, Vanilla No Sugar Added","VoortmanWafers, Vanilla No Sugar Added250 g",$3.29ea,,$1.32/ 100g,False,598.0,
snacks,President's Choice,Mint Slamscuits,President's ChoiceMint Slamscuits240 g,$3.99ea,,$1.66/ 100g,False,599.0,
snacks,Dare,Bear Paws Sandwich Cookies Vanilla,DareBear Paws Sandwich Cookies Vanilla168 g,$2.99ea,,$1.78/ 100g,False,600.0,
snacks,JOLLY RANCHER,Assorted,JOLLY RANCHERAssorted198 g,$3.29ea,,$1.66/ 100g,False,601.0,
snacks,Carnaby Sweet,Sour Gummy Rings,Carnaby SweetSour Gummy Rings125 g,$1.00ea,,$0.80/ 100g,False,602.0,
snacks,Kelloggs,"Nutri-Grain Cereal Bars, Apple Cinnamon 8 Bars","KelloggsNutri-Grain Cereal Bars, Apple Cinnamon 8 Bars295 g",$3.49ea,,$1.18/ 100g,False,603.0,
snacks,Mr. Cookies,Mr Mini Cookies,Mr. CookiesMr Mini Cookies150 g,$2.29ea,,$1.53/ 100g,False,604.0,
snacks,LIFESAVERS,Mints Wint-O-Green      ,LIFESAVERSMints Wint-O-Green      150 g,$3.29ea,,$2.19/ 100g,False,605.0,
snacks,Kelloggs,Homestyle Rice Krispies Squares Original,KelloggsHomestyle Rice Krispies Squares Original198 g,$3.49ea,,$1.76/ 100g,False,606.0,
snacks,Dare,Gummies Medley,DareGummies Medley180 g,$3.19ea,,$1.77/ 100g,False,607.0,
snacks,Quaker,Chewy Granola Bars - Chocolatey Chip,QuakerChewy Granola Bars - Chocolatey Chip120 g,$2.49ea,$1.79ea,$1.49/ 100g,True,608.0,saleEnds 03/15
snacks,Betty Crocker,Fruit By The Foot Variety Pack,Betty CrockerFruit By The Foot Variety Pack128 g,$2.99ea,,$2.34/ 100g,False,609.0,
snacks,Excel,"Peppermint Flavoured Sugar Free Chewing Gum, 18 Pieces, 3 Packs","ExcelPeppermint Flavoured Sugar Free Chewing Gum, 18 Pieces, 3 Packs77 g",$4.29ea,,$5.57/ 100g,False,610.0,
snacks,No Name,Honey Graham Wafers,No NameHoney Graham Wafers400 g,$4.00ea,,$1.00/ 100g,False,611.0,
snacks,No Name,Chocolately Chip Cookies,No NameChocolately Chip Cookies907 g,$3.00ea,,$0.33/ 100g,False,612.0,
snacks,Reese's,Candy Peanut Butter Cups,Reese'sCandy Peanut Butter Cups184 g,$5.79ea,,$3.15/ 100g,False,613.0,
snacks,Dentyne,Ice Spearmint Gum,DentyneIce Spearmint Gum4 ea,$4.29ea,,$1.07/ 1ea,False,614.0,
snacks,Snackpack,Juicy Gels Strawberry/Orange Reduced Sugar,SnackpackJuicy Gels Strawberry/Orange Reduced Sugar4x99.0 g,$1.99ea,,$0.50/ 100g,False,615.0,
snacks,Kelloggs,Special K Nourish Dark Chocolate Chunks & Almonds Bar,KelloggsSpecial K Nourish Dark Chocolate Chunks & Almonds Bar165 g,$4.29ea,,$2.60/ 100g,False,616.0,
snacks,Kelloggs,"Nutri-Grain Cereal Bars, Raspberry 8 Bars","KelloggsNutri-Grain Cereal Bars, Raspberry 8 Bars295 g",$3.49ea,,$1.18/ 100g,False,617.0,
snacks,Carnaby Sweet,Mixed Gummies,Carnaby SweetMixed Gummies500 g,$3.99ea,,$0.80/ 100g,False,618.0,
snacks,Nestle,Kit Kat Classic Wafer Bar,NestleKit Kat Classic Wafer Bar120 g,$2.59ea,,$2.16/ 100g,False,619.0,
snacks,Wrigley,"Peppermint Flavoured Sugar Free Chewing Gum, 60 Pieces, 1 Bottle","WrigleyPeppermint Flavoured Sugar Free Chewing Gum, 60 Pieces, 1 Bottle1 ea",$4.79ea,,$4.79/ 1ea,False,620.0,
snacks,President's Choice,Milk Chocolate Concreto Biscuits ,President's ChoiceMilk Chocolate Concreto Biscuits 240 g,$3.79ea,,$1.58/ 100g,False,621.0,
snacks,President's Choice,Milk Chocolate Covered Raisins,President's ChoiceMilk Chocolate Covered Raisins400 g,$6.00ea,,$1.50/ 100g,False,622.0,
snacks,Hershey's,Birthday Cake Candy Bar,Hershey'sBirthday Cake Candy Bar95 g,$2.59ea,,$2.73/ 100g,False,623.0,
snacks,Hardbite,Handcrafted-Style Chips Wasabi Ranch,HardbiteHandcrafted-Style Chips Wasabi Ranch128 g,$4.49ea,,$3.51/ 100g,False,624.0,
snacks,No Name,Chewy Chocolate Chip Granola Bars,No NameChewy Chocolate Chip Granola Bars158 g,$1.79ea,,$1.13/ 100g,False,625.0,
snacks,Reese's,Miniatures PEANUT BUTTER CUPS Candy,Reese'sMiniatures PEANUT BUTTER CUPS Candy230 g,$5.49ea,,$2.39/ 100g,False,626.0,
snacks,FERRERO ROCHER,"Premium Chocolate Bar, Milk Chocolate Hazelnut Bar","FERRERO ROCHERPremium Chocolate Bar, Milk Chocolate Hazelnut Bar90 g",$3.99ea,,$4.43/ 100g,False,627.0,
snacks,Jell-O,"Refrigerated Pudding Snacks, Strawberry Cheesecake","Jell-ORefrigerated Pudding Snacks, Strawberry Cheesecake4x99.0 g",$3.99ea,,$1.01/ 100g,False,628.0,
snacks,Hardbite,Handcrafted-Style Chips Spicy Ketchup Potato Chips,HardbiteHandcrafted-Style Chips Spicy Ketchup Potato Chips150 g,$4.99ea,,$3.33/ 100g,False,629.0,
snacks,Paqui,"Tortilla Chips, Nacho Cheese   ","PaquiTortilla Chips, Nacho Cheese   155 g",$5.49ea,,$3.54/ 100g,False,630.0,
snacks,President's Choice,Honey Roasted Peanuts,President's ChoiceHoney Roasted Peanuts700 g,$5.99ea,,$0.86/ 100g,False,631.0,
snacks,Regal,Bunny  Hollow Chocolate,RegalBunny  Hollow Chocolate300 g,$12.99ea,,$4.33/ 100g,False,632.0,
snacks,Miss Vickies,Spicy Dill Pickle flavour kettle cooked potato chips 200g,Miss VickiesSpicy Dill Pickle flavour kettle cooked potato chips 200g200 g,$4.49ea,,$2.25/ 100g,False,633.0,
snacks,Chester's,Popcorn Cheese Flavour Popcorn,Chester'sPopcorn Cheese Flavour Popcorn150 g,$2.25ea,,$1.50/ 100g,False,634.0,
snacks,Christie,Triscuit Roasted Garlic Crackers,ChristieTriscuit Roasted Garlic Crackers200 g,$2.49ea,,$1.25/ 100g,False,635.0,
snacks,Christie,Wheat Thins Original Crackers,ChristieWheat Thins Original Crackers200 g,$2.49ea,,$1.25/ 100g,False,636.0,
snacks,Wheat Thins,"Vegetable Thins Crackers, Original","Wheat ThinsVegetable Thins Crackers, Original200 g",$2.49ea,,$1.25/ 100g,False,637.0,
snacks,Triscuit,Thin Crisps Jalapeno Crackers,TriscuitThin Crisps Jalapeno Crackers200 g,$2.49ea,,$1.25/ 100g,False,638.0,
snacks,Christie,Triscuit Balsamic & Basil Crackers,ChristieTriscuit Balsamic & Basil Crackers200 g,$2.49ea,,$1.25/ 100g,False,639.0,
snacks,Christie,Triscuit Original Crackers,ChristieTriscuit Original Crackers200 g,$2.49ea,,$1.25/ 100g,False,640.0,
snacks,Christie,Triscuit Smoked Gouda Crackers,ChristieTriscuit Smoked Gouda Crackers200 g,$2.49ea,,$1.25/ 100g,False,641.0,
snacks,Lindt,LINDOR Milk Chocolate Eggs Trio,LindtLINDOR Milk Chocolate Eggs Trio54 g,$2.99ea,,$5.54/ 100g,False,642.0,
snacks,Pepperidge Farm,Goldfish  Cheddar made with Whole Grain,Pepperidge FarmGoldfish  Cheddar made with Whole Grain180 g,$2.99ea,,$1.66/ 100g,False,643.0,
snacks,Nestle,Smarties Candy Coated Milk Chocolate Carton,NestleSmarties Candy Coated Milk Chocolate Carton45 g,$0.89ea,,$1.98/ 100g,False,644.0,
snacks,Pepperidge Farm,Mega Bites Cheddar Jalapeno,Pepperidge FarmMega Bites Cheddar Jalapeno167 g,$2.99ea,,$1.79/ 100g,False,645.0,
snacks,Pepperidge Farm,Goldfish  Original,Pepperidge FarmGoldfish  Original200 g,$2.99ea,,$1.50/ 100g,False,646.0,
snacks,Nestle,Coffee Crisp Minis,NestleCoffee Crisp Minis180 g,$4.59ea,,$2.55/ 100g,False,647.0,
snacks,Pepperidge Farm,Goldfish  Flavour Blasted  Xtreme Cheddar,Pepperidge FarmGoldfish  Flavour Blasted  Xtreme Cheddar180 g,$2.99ea,,$1.66/ 100g,False,648.0,
snacks,No Name,Peanut Butter Sandwich Crackers,No NamePeanut Butter Sandwich Crackers180 g,$3.29ea,,$1.83/ 100g,False,649.0,
snacks,Nestle,Coffee Crisp Original Chocolate Wafer Bar,NestleCoffee Crisp Original Chocolate Wafer Bar50 g,$0.89ea,,$1.78/ 100g,False,650.0,
snacks,Pepperidge Farm,Goldfish  Flavour Blasted  Xplosive Pizza Flavoured,Pepperidge FarmGoldfish  Flavour Blasted  Xplosive Pizza Flavoured180 g,$2.99ea,,$1.66/ 100g,False,651.0,
snacks,Cheetos,Crunchy Cheese Flavoured Snacks,CheetosCrunchy Cheese Flavoured Snacks285 g,$3.99ea,,$1.40/ 100g,False,652.0,
snacks,Tostitos,Rounds Tortilla Chips 295g,TostitosRounds Tortilla Chips 295g295 g,$3.99ea,,$1.35/ 100g,False,653.0,
snacks,Christie,"Oreo Thins, Original","ChristieOreo Thins, Original287 g",$2.49ea,,$0.87/ 100g,False,654.0,
snacks,Cheetos,Crunchy Flamin' Hot Cheese Flavoured Snacks,CheetosCrunchy Flamin' Hot Cheese Flavoured Snacks285 g,$3.99ea,,$1.40/ 100g,False,655.0,
snacks,Peek Freans,Lifestyle Cranberry Citrus Oat Crunch,Peek FreansLifestyle Cranberry Citrus Oat Crunch290 g,$4.29ea,,$1.48/ 100g,False,656.0,
snacks,Cheez-It,Baked Original Snack Crackers   ,Cheez-ItBaked Original Snack Crackers   200 g,$2.75ea,$2.49ea,$1.25/ 100g,True,657.0,saleEnds 03/15
snacks,Lay's,Lightly Salted potato chips,Lay'sLightly Salted potato chips235 g,$3.99ea,,$1.70/ 100g,False,658.0,
snacks,Hershey's,Chocolate Iconic Kisses Milk,Hershey'sChocolate Iconic Kisses Milk200 g,$5.49ea,,$2.75/ 100g,False,659.0,
snacks,Jell-O,Oreo Ready-to-Eat Refrigerated Pudding Cups Snack,Jell-OOreo Ready-to-Eat Refrigerated Pudding Cups Snack4x113.0 g,$3.99ea,,$0.88/ 100g,False,660.0,
snacks,Que Pasa,Tortilla Chips Salted,Que PasaTortilla Chips Salted350 g,$4.99ea,,$1.43/ 100g,False,661.0,
snacks,Quaker,Crispy Minis Cheddar flavour brown rice chips,QuakerCrispy Minis Cheddar flavour brown rice chips100 g,$2.79ea,,$2.79/ 100g,False,662.0,
snacks,TRIDENT,"Layers, Strawberry Citrus","TRIDENTLayers, Strawberry Citrus3 ea",$4.29ea,,$1.43/ 1ea,False,663.0,
snacks,Haldiram,Alu Bhujia,HaldiramAlu Bhujia150 g,$1.99ea,,$1.33/ 100g,False,664.0,
snacks,RiceWorks,"Gourmet Brown Rice Crisps, Sweet Chili","RiceWorksGourmet Brown Rice Crisps, Sweet Chili156 g",$3.99ea,,$2.57/ 100g,False,665.0,
snacks,Leclerc,"Celebration Wafers, Vanilla","LeclercCelebration Wafers, Vanilla240 g",$2.99ea,,$1.25/ 100g,False,666.0,
snacks,Que Pasa,Tortilla Chips Blue Corn,Que PasaTortilla Chips Blue Corn350 g,$4.99ea,,$1.43/ 100g,False,667.0,
snacks,President's Choice,Ranch Purple Kernel Corn Crisps,President's ChoiceRanch Purple Kernel Corn Crisps110 g,$2.49ea,,$2.26/ 100g,False,668.0,
snacks,President's Choice,Roasted Cashews with Sea Salt ,President's ChoiceRoasted Cashews with Sea Salt 200 g,$6.49ea,,$3.25/ 100g,False,669.0,
snacks,No Name,Social Tea Biscuits,No NameSocial Tea Biscuits350 g,$3.69ea,,$1.05/ 100g,False,670.0,
snacks,Christie,Chips Ahoy! Caramilk Cookies,ChristieChips Ahoy! Caramilk Cookies453 g,$4.99ea,,$1.10/ 100g,False,671.0,
snacks,Maynards,Sour Patch Kids Kids Soft Candy,MaynardsSour Patch Kids Kids Soft Candy185 g,$2.49ea,,$1.35/ 100g,False,672.0,
snacks,Fibre 1,"Brownies, Chocolatey Fudge","Fibre 1Brownies, Chocolatey Fudge125 g",$3.49ea,,$2.79/ 100g,False,673.0,
snacks,Capn Crunch,Treats Cereal Bars Peanut Butter,Capn CrunchTreats Cereal Bars Peanut Butter110 g,$3.79ea,,$3.45/ 100g,False,674.0,
snacks,Voortman,"Wafers, Chocolate","VoortmanWafers, Chocolate300 g",$3.29ea,,$1.10/ 100g,False,675.0,
snacks,Leclerc,"Go Pure Fruit and Oat Bars, Raspberry","LeclercGo Pure Fruit and Oat Bars, Raspberry140 g",$2.99ea,$2.79ea,$1.99/ 100g,True,676.0,saleEnds 03/15
snacks,Exclusive Brands,Sesame Bars With Honey,Exclusive BrandsSesame Bars With Honey30 g,$0.79ea,,$2.63/ 100g,False,677.0,
snacks,Quaker,Crispy Minis Crunchy Dill flavour brown rice chips,QuakerCrispy Minis Crunchy Dill flavour brown rice chips100 g,$2.79ea,,$2.79/ 100g,False,678.0,
snacks,Nature Valley,Sweet & Salty Roasted Mixed Nut Chewy Granola Bars,Nature ValleySweet & Salty Roasted Mixed Nut Chewy Granola Bars210 g,$3.49ea,,$1.66/ 100g,False,679.0,
snacks,No Name,Sweet & Salty Almond Chewy Nut Bars,No NameSweet & Salty Almond Chewy Nut Bars175 g,$1.79ea,,$1.02/ 100g,False,680.0,
snacks,Nature Valley,Sweet And Salty Minis Dark Chocolate Nut Granola Bars (20 Minis),Nature ValleySweet And Salty Minis Dark Chocolate Nut Granola Bars (20 Minis)425 g,$6.49ea,$5.99ea,$1.41/ 100g,True,681.0,saleEnds 03/15
snacks,Oh Henry!,Candy bar,Oh Henry!Candy bar232 g,$5.79ea,,$2.50/ 100g,False,682.0,
snacks,Mott's,"Fruitsations + Veggie Fruit Flavoured Snacks, Berry","Mott'sFruitsations + Veggie Fruit Flavoured Snacks, Berry226 g",$2.99ea,,$1.32/ 100g,False,683.0,
snacks,Betty Crocker,Fruit Gushers Variety Pack ,Betty CrockerFruit Gushers Variety Pack 138 g,$2.99ea,,$2.17/ 100g,False,684.0,
snacks,Sensible Portions,Garden Veggie Chips BBQ Vegetable and Potato Snack,Sensible PortionsGarden Veggie Chips BBQ Vegetable and Potato Snack141 g,$3.99ea,,$2.83/ 100g,False,685.0,
snacks,Betty Crocker,"Fruit By The Foot, Rippin' Berry Berry","Betty CrockerFruit By The Foot, Rippin' Berry Berry128 g",$2.99ea,,$2.34/ 100g,False,686.0,
snacks,Kettle,Potato Chips Yogurt & Green Onion,KettlePotato Chips Yogurt & Green Onion198 g,$4.49ea,,$2.27/ 100g,False,687.0,
snacks,Kettle,Potato Chips Sea Salt & Vinegar,KettlePotato Chips Sea Salt & Vinegar198 g,$4.49ea,,$2.27/ 100g,False,688.0,
snacks,Frito-lay,Flavour Mix 484g,Frito-layFlavour Mix 484g484 g,$9.49ea,,$1.96/ 100g,False,689.0,
snacks,Cadbury,Creme Egg Cream Filled Chocolate Egg,CadburyCreme Egg Cream Filled Chocolate Egg34 g,$1.49ea,,$4.38/ 100g,False,690.0,
snacks,No Name,Diced Clingstone Peaches in Light Syrup,No NameDiced Clingstone Peaches in Light Syrup4x107.0 ml,$2.29ea,,$0.54/ 100ml,False,691.0,
snacks,President's Choice,Apple Cinnamon Apple Sauce ,President's ChoiceApple Cinnamon Apple Sauce 6x100.0 ml,$2.29ea,,$0.38/ 100ml,False,692.0,
snacks,Carnaby Sweet,Gummy Fish,Carnaby SweetGummy Fish125 g,$1.00ea,,$0.80/ 100g,False,693.0,
snacks,Cadbury,Cadbury Chocolate Burnt Almond Chocolate Bar,CadburyCadbury Chocolate Burnt Almond Chocolate Bar100 g,$2.49ea,,$2.49/ 100g,False,694.0,
snacks,President's Choice, Dark Chocolate Concerto Biscuits ,President's Choice Dark Chocolate Concerto Biscuits 240 g,$3.79ea,,$1.58/ 100g,False,695.0,
snacks,President's Choice,Parmesan Cheese & Garlic Swiss Sticks,President's ChoiceParmesan Cheese & Garlic Swiss Sticks100 g,$2.49ea,,$2.49/ 100g,False,696.0,
snacks,Betty Crocker,"Fruit Snacks, Animated Edition","Betty CrockerFruit Snacks, Animated Edition226 g",$2.99ea,,$1.32/ 100g,False,697.0,
snacks,Wrigley,"Spearmint-Rain Flavoured Sugar Free Chewing Gum, 15 Sticks, 3 Packs","WrigleySpearmint-Rain Flavoured Sugar Free Chewing Gum, 15 Sticks, 3 Packs3 ea",$4.99ea,,$1.66/ 1ea,False,698.0,
snacks,No Name,Milk Chocolate Bar,No NameMilk Chocolate Bar100 g,$1.00ea,,$1.00/ 100g,False,699.0,
snacks,Starburst,Original      ,StarburstOriginal      191 g,$3.49ea,,$1.83/ 100g,False,700.0,
snacks,Cadbury,Mr Big Original Chocolate Bar-Minis,CadburyMr Big Original Chocolate Bar-Minis110 g,$2.49ea,,$2.26/ 100g,False,701.0,
snacks,Maynards,Swedish Berries Berry Soft Candy,MaynardsSwedish Berries Berry Soft Candy185 g,$2.49ea,,$1.35/ 100g,False,702.0,
snacks,Surati,Cheddar Jalapeno Tubes,SuratiCheddar Jalapeno Tubes80 g,$1.49ea,,$1.86/ 100g,False,703.0,
snacks,Dare,Bear Paws Banana Bread Cookies,DareBear Paws Banana Bread Cookies240 g,$2.99ea,,$1.25/ 100g,False,704.0,
snacks,Dare,Wagon Wheels Original Cookies,DareWagon Wheels Original Cookies315 g,$2.99ea,,$0.95/ 100g,False,705.0,
snacks,No Name,Salted Blanched Peanuts,No NameSalted Blanched Peanuts500 g,$3.49ea,,$0.70/ 100g,False,706.0,
snacks,President's Choice,Milk Chocolate Crêpes,President's ChoiceMilk Chocolate Crêpes100 g,$3.29ea,,$3.29/ 100g,False,707.0,
snacks,Werther's,"Soft Caramel, Chocolate Filling","Werther'sSoft Caramel, Chocolate Filling116 g",$2.79ea,,$2.41/ 100g,False,708.0,
snacks,Hershey's," Creamy Milk Chocolate With Whole Almonds, Full Size Bar","Hershey's Creamy Milk Chocolate With Whole Almonds, Full Size Bar43 g",$1.49ea,,$3.47/ 100g,False,709.0,
snacks,No Name,Dill Pickle Potato Chips,No NameDill Pickle Potato Chips200 g,$1.49ea,,$0.75/ 100g,False,710.0,
snacks,President's Choice,Sweet & Salty Kettle Corn ,President's ChoiceSweet & Salty Kettle Corn 220 g,$3.99ea,,$1.81/ 100g,False,711.0,
snacks,No Name,Salt & Vinegar Potato Chips,No NameSalt & Vinegar Potato Chips200 g,$1.49ea,,$0.75/ 100g,False,712.0,
snacks,Tostitos,Hint of Roasted Garlic flavour tortilla chips 275g,TostitosHint of Roasted Garlic flavour tortilla chips 275g275 g,$3.99ea,,$1.45/ 100g,False,713.0,
snacks,President's Choice,World of Flavours Chicken Flavour Filipino Adobo Rippled Chips,President's ChoiceWorld of Flavours Chicken Flavour Filipino Adobo Rippled Chips200 g,$2.79ea,,$1.40/ 100g,False,714.0,
snacks,Smart Food,White Cheddar flavour seasoned popcorn 200g,Smart FoodWhite Cheddar flavour seasoned popcorn 200g200 g,$4.29ea,,$2.15/ 100g,False,715.0,
snacks,Hostess,Hostess Original Flavour Potato Sticks 275g,HostessHostess Original Flavour Potato Sticks 275g275 g,$4.39ea,,$1.60/ 100g,False,716.0,
snacks,Milano,Biscuits Cookie     ,MilanoBiscuits Cookie     200 g,$1.79ea,,$0.90/ 100g,False,717.0,
snacks,Kelloggs,Rice Krispies Bars Rainbow,KelloggsRice Krispies Bars Rainbow176 g,$3.49ea,,$1.98/ 100g,False,718.0,
snacks,Carnaby Sweet,Mixed Gummies,Carnaby SweetMixed Gummies125 g,$1.00ea,,$0.80/ 100g,False,719.0,
snacks,President's Choice,The Decadent Soft Baked Chocolate Chip Cookies,President's ChoiceThe Decadent Soft Baked Chocolate Chip Cookies300 g,$2.99ea,,$1.00/ 100g,False,720.0,
snacks,Hardbite,"Handcrafted-Style Chips, Rock Salt & Vinegar","HardbiteHandcrafted-Style Chips, Rock Salt & Vinegar150 g",$4.99ea,,$3.33/ 100g,False,721.0,
snacks,No Name,Pretzel Twists,No NamePretzel Twists200 g,$1.50ea,,$0.75/ 100g,False,722.0,
snacks,SkinnyPop Popcorn,Pure Popped Perfection Popcorn Family Size,SkinnyPop PopcornPure Popped Perfection Popcorn Family Size227 g,$8.99ea,,$3.96/ 100g,False,723.0,
snacks,President's Choice,Dipped & Chewy Chocolate Chip Granola Bars,President's ChoiceDipped & Chewy Chocolate Chip Granola Bars156 g,$2.29ea,,$1.47/ 100g,False,724.0,
snacks,Frito-lay,Flavour Mix 484g,Frito-layFlavour Mix 484g484 g,$9.49ea,,$1.96/ 100g,False,725.0,
snacks,Wrigley,"Peppermint Flavoured Sugar Free Chewing Gum, 12 Pieces, 1 Pack","WrigleyPeppermint Flavoured Sugar Free Chewing Gum, 12 Pieces, 1 Pack12 ea",$1.00ea,$0.89ea,$0.07/ 1ea,True,726.0,saleEnds 04/05
snacks,Tic Tac,"Mints, Breath Freshener, Orange, 60 pills","Tic TacMints, Breath Freshener, Orange, 60 pills29 g",$1.89ea,,$6.52/ 100g,False,727.0,
snacks,Lindt,SWISS CLASSIC White Chocolate Bar,LindtSWISS CLASSIC White Chocolate Bar100 g,$3.29ea,,$3.29/ 100g,False,728.0,
snacks,Dare,Viva Puffs Raspberry Cookies,DareViva Puffs Raspberry Cookies300 g,$2.99ea,,$1.00/ 100g,False,729.0,
snacks,President's Choice,Peanuts Dry Roasted & Lightly Seasoned,President's ChoicePeanuts Dry Roasted & Lightly Seasoned700 g,$5.99ea,,$0.86/ 100g,False,730.0,
snacks,Kurkure,Chilli Chatka Flavoured Snacks 115g,KurkureChilli Chatka Flavoured Snacks 115g115 g,$2.19ea,,$1.90/ 100g,False,731.0,
snacks,Munchos,Potato Crisps,MunchosPotato Crisps130 g,$2.25ea,,$1.73/ 100g,False,732.0,
snacks,Christie,Wheat Thins Multigrain Crackers,ChristieWheat Thins Multigrain Crackers200 g,$2.49ea,,$1.25/ 100g,False,733.0,
snacks,Chester's,Corn Twists Snacks,Chester'sCorn Twists Snacks150 g,$2.25ea,,$1.50/ 100g,False,734.0,
snacks,Christie,Ritz Crackers,ChristieRitz Crackers304 g,$2.49ea,,$0.82/ 100g,False,735.0,
snacks,Christie,Ritz Crackers Low Sodium,ChristieRitz Crackers Low Sodium200 g,$2.49ea,,$1.25/ 100g,False,736.0,
snacks,Christie,Ritz Cheese Crackers,ChristieRitz Cheese Crackers200 g,$2.49ea,,$1.25/ 100g,False,737.0,
snacks,Ritz,Cheese Nibs Crackers,RitzCheese Nibs Crackers200 g,$2.49ea,,$1.25/ 100g,False,738.0,
snacks,Lindt,SWISS CLASSIC Milk Chocolate Bar,LindtSWISS CLASSIC Milk Chocolate Bar100 g,$3.29ea,,$3.29/ 100g,False,739.0,
snacks,Pepperidge Farm,Goldfish  Colours,Pepperidge FarmGoldfish  Colours180 g,$2.99ea,,$1.66/ 100g,False,740.0,
snacks,Nestle,KitKat Chunky Milk Chocolate Wafer Bars Multipack,NestleKitKat Chunky Milk Chocolate Wafer Bars Multipack196 g,$4.59ea,,$2.34/ 100g,False,741.0,
snacks,Carnaby Sweet,Real Milk Chocolate Solid Bunny,Carnaby SweetReal Milk Chocolate Solid Bunny100 g,$1.99ea,,$1.99/ 100g,False,742.0,
snacks,Nestle,Kit Kat Minis Classic Wafer Bars Pouch,NestleKit Kat Minis Classic Wafer Bars Pouch180 g,$4.59ea,,$2.55/ 100g,False,743.0,
snacks,Nestle,Smarties Candy Coated Milk Chocolate Multipack,NestleSmarties Candy Coated Milk Chocolate Multipack180 g,$4.59ea,,$2.55/ 100g,False,744.0,
snacks,Nestle,"Aero Milk Chocolate Bar, Original","NestleAero Milk Chocolate Bar, Original42 g",$0.89ea,,$2.12/ 100g,False,745.0,
snacks,Christie,Fudgee-O Original Cookies,ChristieFudgee-O Original Cookies303 g,$2.49ea,,$0.82/ 100g,False,746.0,
snacks,Christie,Chips Ahoy! Snak Pak Cookies,ChristieChips Ahoy! Snak Pak Cookies180 g,$3.29ea,,$1.83/ 100g,False,747.0,
snacks,Christie,Chips Ahoy! Original Cookies,ChristieChips Ahoy! Original Cookies258 g,$2.49ea,,$0.97/ 100g,False,748.0,
snacks,Ruffles,Regular Potato Chips,RufflesRegular Potato Chips200 g,$4.49ea,$3.99ea,$2.00/ 100g,True,749.0,saleEnds 03/22
snacks,Nature Valley,Sweet & Salty Salted Caramel Chocolate Chewy Granola Bars Special Edition,Nature ValleySweet & Salty Salted Caramel Chocolate Chewy Granola Bars Special Edition210 g,$3.49ea,,$1.66/ 100g,False,750.0,
snacks,Oreo,Oreo Original Cookies,OreoOreo Original Cookies270 g,$2.49ea,,$0.92/ 100g,False,751.0,
snacks,Oreo,Oreo Golden Cookies,OreoOreo Golden Cookies270 g,$2.49ea,,$0.92/ 100g,False,752.0,
snacks,Christie,Ritz Bits Cheese Cracker Sandwiches,ChristieRitz Bits Cheese Cracker Sandwiches180 g,$2.49ea,,$1.38/ 100g,False,753.0,
snacks,Christie,"Good Thins Rice Crackers, Simply Salt","ChristieGood Thins Rice Crackers, Simply Salt100 g",$3.49ea,,$3.49/ 100g,False,754.0,
snacks,Lay's,Poppables Sea Salt flavoured potato snacks,Lay'sPoppables Sea Salt flavoured potato snacks130 g,$3.99ea,,$3.07/ 100g,False,755.0,
snacks,Lay's,Ketchup flavoured potato chips,Lay'sKetchup flavoured potato chips235 g,$3.99ea,,$1.70/ 100g,False,756.0,
snacks,Lindt,EXCELLENCE Sea Salt Dark Chocolate Bar,LindtEXCELLENCE Sea Salt Dark Chocolate Bar100 g,$4.49ea,,$4.49/ 100g,False,757.0,
snacks,Lay's,Wavy Lightly Salted potato chips,Lay'sWavy Lightly Salted potato chips235 g,$3.99ea,,$1.70/ 100g,False,758.0,
snacks,Orville,"Popcorn, Buttery","OrvillePopcorn, Buttery10x82.0 g",$8.99ea,,$1.10/ 100g,False,759.0,
snacks,Cheetos,Puffs Cheese Flavoured Snacks,CheetosPuffs Cheese Flavoured Snacks260 g,$3.99ea,,$1.53/ 100g,False,760.0,
snacks,Lay's,Potato Chips All Dressed 235g,Lay'sPotato Chips All Dressed 235g235 g,$3.99ea,,$1.70/ 100g,False,761.0,
snacks,Mars,"Peanut Free Chocolate Candy Bites, Sharing Bag","MarsPeanut Free Chocolate Candy Bites, Sharing Bag193 g",$4.99ea,,$2.59/ 100g,False,762.0,
snacks,Quaker,Chewy Fruity Fun Value Pack,QuakerChewy Fruity Fun Value Pack960 g,$12.49ea,,$1.30/ 100g,False,763.0,
snacks,President's Choice,Red Chili Pepper Crackers ,President's ChoiceRed Chili Pepper Crackers 185 g,$3.49ea,,$1.89/ 100g,False,764.0,
snacks,Pringles,Mega Can Original Flavour,PringlesMega Can Original Flavour194 g,$3.29ea,,$1.70/ 100g,False,765.0,
snacks,Kettle,Potato Chips Cheddar,KettlePotato Chips Cheddar198 g,$4.49ea,,$2.27/ 100g,False,766.0,
snacks,Tic Tac,"Mints, Breath Freshener, Fresh Mint, 60 pills","Tic TacMints, Breath Freshener, Fresh Mint, 60 pills29 g",$1.89ea,,$6.52/ 100g,False,767.0,
snacks,Harvest Snaps,"Snapea Crisps, Original","Harvest SnapsSnapea Crisps, Original93 g",$3.49ea,,$3.75/ 100g,False,768.0,
snacks,Hardbite,"Handcrafted-Style Chips, Ketchup","HardbiteHandcrafted-Style Chips, Ketchup150 g",$4.99ea,,$3.33/ 100g,False,769.0,
snacks,Doritos,Simply White Cheddar Flavoured Tortilla Chips 213g,DoritosSimply White Cheddar Flavoured Tortilla Chips 213g213 g,$4.99ea,,$2.34/ 100g,False,770.0,
