category,brand,product_text,product_name,price_text,sale_price,per_unit_price_text,is_sale,ranking,sale_valid_to
snacks,No Name,Regular Ripple Cut Potato Chips,No NameRegular Ripple Cut Potato Chips200 g,$1.49ea,,$0.75/ 100g,False,1.0,
snacks,No Name, Lightly Salted Rippled Potato Chips ,No Name Lightly Salted Rippled Potato Chips 200 g,$1.49ea,,$0.75/ 100g,False,2.0,
snacks,No Name,Regular Potato Chips ,No NameRegular Potato Chips 200 g,$1.49ea,,$0.75/ 100g,False,3.0,
snacks,No Name,Ketchup Potato Chips,No NameKetchup Potato Chips200 g,$1.49ea,,$0.75/ 100g,False,4.0,
snacks,No Name,Sesame Rice Crackers,No NameSesame Rice Crackers100 g,$1.25ea,$1.00ea,$1.00/ 100g,True,5.0,saleEnds 03/15
snacks,President's Choice,Unsweetened Apple Sauce,President's ChoiceUnsweetened Apple Sauce6x100.0 ml,$2.29ea,,$0.38/ 100ml,False,6.0,
snacks,Doritos,Sweet Chili Heat! flavoured tortilla chips,DoritosSweet Chili Heat! flavoured tortilla chips235 g,$4.29ea,,$1.83/ 100g,False,7.0,
snacks,Tostitos,Multigrain Rounds Tortilla Chips 270g,TostitosMultigrain Rounds Tortilla Chips 270g270 g,$3.99ea,,$1.48/ 100g,False,8.0,
snacks,Ruffles,Sour Cream 'n Onion Flavoured Potato Chips,RufflesSour Cream 'n Onion Flavoured Potato Chips200 g,$4.49ea,$3.99ea,$2.00/ 100g,True,9.0,saleEnds 03/22
snacks,No Name,Cheese Rice Crackers,No NameCheese Rice Crackers100 g,$1.25ea,$1.00ea,$1.00/ 100g,True,10.0,saleEnds 03/15
snacks,Vicenzi,Millefoglie Mini Snack,VicenziMillefoglie Mini Snack125 g,$2.99ea,,$2.39/ 100g,False,11.0,
snacks,Crispers,Bits & Bites Original Snacks,CrispersBits & Bites Original Snacks145 g,$2.69ea,,$1.86/ 100g,False,12.0,
snacks,President's Choice,Tropical Fruits Squeeze Fruit Snacks,President's ChoiceTropical Fruits Squeeze Fruit Snacks4x90.0 g,$2.49ea,,$0.69/ 100g,False,13.0,
snacks,President's Choice,Garlic Crackers,President's ChoiceGarlic Crackers185 g,$3.49ea,,$1.89/ 100g,False,14.0,
snacks,No Name,Cheese Sandwich Crackers,No NameCheese Sandwich Crackers180 g,$3.29ea,,$1.83/ 100g,False,15.0,
snacks,No Name,Vanilla Pudding Cups 4 Pack,No NameVanilla Pudding Cups 4 Pack4x99.0 g,$1.39ea,,$0.35/ 100g,False,16.0,
snacks,LA IDA,Large Sugar Taralli,LA IDALarge Sugar Taralli360 g,$3.79ea,,$1.05/ 100g,False,17.0,
snacks,Maynards,Sour Patch Kids  Soft Candy,MaynardsSour Patch Kids  Soft Candy185 g,$2.49ea,,$1.35/ 100g,False,18.0,
snacks,Snyders,"Pretzel Pieces, Honey Mustard & Onion","SnydersPretzel Pieces, Honey Mustard & Onion240 g",$3.99ea,,$1.66/ 100g,False,19.0,
snacks,Cadbury,Mini Eggs Assorted Chocolate Eggs Mini,CadburyMini Eggs Assorted Chocolate Eggs Mini33 g,$1.49ea,,$4.52/ 100g,False,20.0,
snacks,Hershey's,Eggies Milk Chocolate,Hershey'sEggies Milk Chocolate400 g,$8.99ea,,$2.25/ 100g,False,21.0,
snacks,T&T,Ready-to-Eat Organic Chestnuts,T&TReady-to-Eat Organic Chestnuts100 g,$1.29ea,,$1.29/ 100g,False,22.0,
snacks,GoGo squeez, Fruit Sauce 16 Pouches,GoGo squeez Fruit Sauce 16 Pouches16x90.0 g,$12.99ea,,$0.90/ 100g,False,23.0,
snacks,FERRERO ROCHER,"Hollow Hazelnut Milk Chocolate Squirrel, Easter Gift","FERRERO ROCHERHollow Hazelnut Milk Chocolate Squirrel, Easter Gift90 g",$5.99ea,,$6.66/ 100g,False,24.0,
snacks,No Name,Microwave Butter Flavour Popcorn,No NameMicrowave Butter Flavour Popcorn493 g,$3.29ea,,$0.67/ 100g,False,25.0,
snacks,Christie,Ritz Original Crackers,ChristieRitz Original Crackers900 g,$9.49ea,,$1.05/ 100g,False,26.0,
snacks,No Name,Regular Potato Crisps,No NameRegular Potato Crisps150 g,$1.49ea,,$0.99/ 100g,False,27.0,
snacks,Podravka,Cokolino Cereal,PodravkaCokolino Cereal200 g,$3.29ea,,$1.65/ 100g,False,28.0,
snacks,Cineplex, Butter Microwave Popcorn - 3 Pack,Cineplex Butter Microwave Popcorn - 3 Pack255 g,$3.19ea,,$1.25/ 100g,False,29.0,
snacks,Reese's, Peanut Butter Cups Candy,Reese's Peanut Butter Cups Candy46 g,$1.49ea,,$3.24/ 100g,False,30.0,
snacks,Voortman,Coconut Cookies,VoortmanCoconut Cookies350 g,$3.29ea,,$0.94/ 100g,False,31.0,
snacks,Finn Crisp,"Crispbread, Multigrain","Finn CrispCrispbread, Multigrain175 g",$3.89ea,,$2.22/ 100g,False,32.0,
snacks,Pringles,Cheddar & Sour Cream Flavour Potato Chips,PringlesCheddar & Sour Cream Flavour Potato Chips156 g,$2.99ea,,$1.92/ 100g,False,33.0,
snacks,Tremarie, Milk Chocolate And Almonds Cream Filled Wafers,Tremarie Milk Chocolate And Almonds Cream Filled Wafers140 g,$2.99ea,,$2.14/ 100g,False,34.0,
snacks,SS Frutas,Spicy Plantain Crunchy Crisps,SS FrutasSpicy Plantain Crunchy Crisps85 g,$1.79ea,,$2.11/ 100g,False,35.0,
snacks,Predilecta,Creamy Guava Paste,PredilectaCreamy Guava Paste320 g,$3.29ea,,$1.03/ 100g,False,36.0,
snacks,Salzburg,Hazelnut Mignon,SalzburgHazelnut Mignon350 g,$4.79ea,,$1.37/ 100g,False,37.0,
snacks,Skittles,"Original Chewy Candy, Bowl Size Bag","SkittlesOriginal Chewy Candy, Bowl Size Bag320 g",$5.79ea,,$1.81/ 100g,False,38.0,
snacks,GoGo squeez,"Squeeze, Apple Blueberry","GoGo squeezSqueeze, Apple Blueberry90 g",$3.99ea,,$1.11/ 100g,False,39.0,
snacks,Predilecta,Guava Paste,PredilectaGuava Paste300 g,$1.99ea,,$0.66/ 100g,False,40.0,
snacks,Colussi,Caffélatte Biscuits,ColussiCaffélatte Biscuits500 g,$5.79ea,,$1.16/ 100g,False,41.0,
snacks,Dare,Breaktime Oatmeal Cookies,DareBreaktime Oatmeal Cookies250 g,$1.49ea,,$0.60/ 100g,False,42.0,
snacks,Balocco,Cruschelle Cookies,BaloccoCruschelle Cookies700 g,$6.99ea,,$1.00/ 100g,False,43.0,
snacks,GoGo squeez,Fruit Sauce 16 Pouches,GoGo squeezFruit Sauce 16 Pouches16x90.0 g,$12.99ea,,$0.90/ 100g,False,44.0,
snacks,Mott's,"Fruitsations, Unsweetened Strawberry Kiwi","Mott'sFruitsations, Unsweetened Strawberry Kiwi6x111.0 g",$2.99ea,,$0.45/ 100g,False,45.0,
snacks,No Name,Fruit Salad with Cherries in Light Syrup,No NameFruit Salad with Cherries in Light Syrup4x107.0 ml,$2.29ea,,$0.54/ 100ml,False,46.0,
snacks,Haitai,Honey Butter Chip Sweet Honey Flavour,HaitaiHoney Butter Chip Sweet Honey Flavour60 g,$3.49ea,,$5.82/ 100g,False,47.0,
snacks,Nong Shim,Onion Rings,Nong ShimOnion Rings50 g,$1.49ea,,$2.98/ 100g,False,48.0,
snacks,Ryvita,Thins Three Cheese Flatbreads,RyvitaThins Three Cheese Flatbreads125 g,$4.99ea,,$3.99/ 100g,False,49.0,
snacks,Christie,Premium Plus Salted Crackers,ChristiePremium Plus Salted Crackers900 g,$7.99ea,,$0.89/ 100g,False,50.0,
snacks,No Name,Mandarin Oranges in Light Syrup,No NameMandarin Oranges in Light Syrup4x107.0 ml,$2.29ea,,$0.54/ 100ml,False,51.0,
snacks,Mott's,"Fruitsations + Veggies, Unsweetened Peach Apple Carrot","Mott'sFruitsations + Veggies, Unsweetened Peach Apple Carrot6x111.0 g",$2.99ea,,$0.45/ 100g,False,52.0,
snacks,President's Choice,Sugar Cones ,President's ChoiceSugar Cones 142 g,$3.00ea,,$2.11/ 100g,False,53.0,
snacks,Dare,Bold ‘n Baked Sweet Chili,DareBold ‘n Baked Sweet Chili150 g,$3.49ea,,$2.33/ 100g,False,54.0,
snacks,No Name,Cheese Flavoured Crunchy Snacks,No NameCheese Flavoured Crunchy Snacks200 g,$2.29ea,,$1.15/ 100g,False,55.0,
snacks,Lay's,Cucumber Flavoured Potato Chips,Lay'sCucumber Flavoured Potato Chips165 g,$3.29ea,$2.49ea,$1.51/ 100g,True,56.0,saleEnds 03/15
snacks,Wrigley,"Fresh Mint Flavoured Mints, 4 Packs","WrigleyFresh Mint Flavoured Mints, 4 Packs4 ea",$4.79ea,,$1.20/ 1ea,False,57.0,
snacks,TRIDENT,Splash Strawberry Kiwi,TRIDENTSplash Strawberry Kiwi3 pack,$4.29ea,,$1.43/ 1pk,False,58.0,
snacks,Starburst,Gummies Original     ,StarburstGummies Original     164 g,$3.49ea,,$2.13/ 100g,False,59.0,
snacks,Jack Links,Steak Strips,Jack LinksSteak Strips74 g,$6.99ea,,$9.45/ 100g,False,60.0,
snacks,Werther's,Original Creamy Caramel Filled Hard Candy,Werther'sOriginal Creamy Caramel Filled Hard Candy135 g,$2.79ea,,$2.07/ 100g,False,61.0,
snacks,Carnaby Sweet,Mixed Berries,Carnaby SweetMixed Berries500 g,$3.99ea,,$0.80/ 100g,False,62.0,
snacks,Quaker,Chewy Granola Cereal Or Fruit Bars Strawberry Fruit Crumble,QuakerChewy Granola Cereal Or Fruit Bars Strawberry Fruit Crumble120 g,$2.49ea,$1.79ea,$1.49/ 100g,True,63.0,saleEnds 03/15
snacks,Kelloggs,"Special K Fruit Crisps, Strawberry Flavour, 10 Bars","KelloggsSpecial K Fruit Crisps, Strawberry Flavour, 10 Bars125 g",$3.49ea,,$2.79/ 100g,False,64.0,
snacks,Haldiram,Indian Snacks Pani Puri Water Balls,HaldiramIndian Snacks Pani Puri Water Balls275 g,$6.49ea,,$2.36/ 100g,False,65.0,
snacks,President's Choice,The World's Best Shortbread Cookies,President's ChoiceThe World's Best Shortbread Cookies200 g,$4.99ea,,$2.50/ 100g,False,66.0,
snacks,Nature Valley,"Crunchy Granola Bars, Roasted Almond","Nature ValleyCrunchy Granola Bars, Roasted Almond230 g",$2.99ea,,$1.30/ 100g,False,67.0,
snacks,Freeyumm,Cheezy Cracker Bites,FreeyummCheezy Cracker Bites120 g,$5.49ea,,$4.58/ 100g,False,68.0,
snacks,Twizzler,Strawberry Twists Candy,TwizzlerStrawberry Twists Candy454 g,$4.49ea,,$0.99/ 100g,False,69.0,
snacks,Leclerc,Go Pure Oatmeal Bars Brown Sugar & Maple,LeclercGo Pure Oatmeal Bars Brown Sugar & Maple5x175.0 g,$2.79ea,,$0.32/ 100g,False,70.0,
snacks,Nestle,KitKat Snack Size,NestleKitKat Snack Size112 g,$2.59ea,,$2.31/ 100g,False,71.0,
snacks,Kinder,"Surprise Chocolate Eggs with Toys, Pink Edition, 3 Pack","KinderSurprise Chocolate Eggs with Toys, Pink Edition, 3 Pack60 g",$3.49ea,,$5.82/ 100g,False,72.0,
snacks,President's Choice,Raisins Almonds Cashews Cranberries Trail Mix,President's ChoiceRaisins Almonds Cashews Cranberries Trail Mix700 g,$13.99ea,,$2.00/ 100g,False,73.0,
snacks,Kozy Shack,Rice Pudding Tubs,Kozy ShackRice Pudding Tubs624 g,$4.00ea,,$0.64/ 100g,False,74.0,
snacks,President's Choice,Creme Filled Salted Caramel Sandwich Cookies,President's ChoiceCreme Filled Salted Caramel Sandwich Cookies300 g,$3.99ea,,$1.33/ 100g,False,75.0,
snacks,Excel,"Bubblemint Flavoured Sugar Free Chewing Gum, 18 Pieces, 3 Packs","ExcelBubblemint Flavoured Sugar Free Chewing Gum, 18 Pieces, 3 Packs77 g",$4.29ea,,$5.57/ 100g,False,76.0,
snacks,Skittles,"Wild Berry Gummy Candy, Bag","SkittlesWild Berry Gummy Candy, Bag165 g",$3.49ea,,$2.12/ 100g,False,77.0,
snacks,Mott's,Fruitsations + Veggie Assorted Fruit,Mott'sFruitsations + Veggie Assorted Fruit226 g,$2.99ea,,$1.32/ 100g,False,78.0,
snacks,No Name,Original Trail Mix,No NameOriginal Trail Mix1 kg,$10.49ea,,$1.05/ 100g,False,79.0,
snacks,Kuehne,Sauerkraut,KuehneSauerkraut796 ml,$4.99ea,,$0.63/ 100ml,False,80.0,
snacks,Dare,Ultimate Maple Crème Cookies,DareUltimate Maple Crème Cookies300 g,$2.99ea,,$1.00/ 100g,False,81.0,
snacks,Blue Diamond,"Almonds, Smokehouse","Blue DiamondAlmonds, Smokehouse170 g",$6.49ea,,$3.82/ 100g,False,82.0,
snacks,Werther's,Original Caramel Hard Candy,Werther'sOriginal Caramel Hard Candy135 g,$2.79ea,,$2.07/ 100g,False,83.0,
snacks,Nature Valley,Lunchbox Caramel Chocolate Granola Bar,Nature ValleyLunchbox Caramel Chocolate Granola Bar130 g,$2.99ea,,$2.30/ 100g,False,84.0,
snacks,Lotus,Biscoff Biscuit,LotusBiscoff Biscuit250 g,$3.99ea,,$1.60/ 100g,False,85.0,
snacks,Kelloggs,Special K Cereal Bars 2 Flavours,KelloggsSpecial K Cereal Bars 2 Flavours500 g,$9.99ea,,$2.00/ 100g,False,86.0,
snacks,Betty Crocker,Paw Patrol Special Edition Fruit Flavoured Snacks,Betty CrockerPaw Patrol Special Edition Fruit Flavoured Snacks226 g,$2.99ea,,$1.32/ 100g,False,87.0,
snacks,Cadbury,Cadbury Chocolate Premium Dark Chocolate Bar,CadburyCadbury Chocolate Premium Dark Chocolate Bar100 g,$2.49ea,,$2.49/ 100g,False,88.0,
snacks,Wrigley,"Peppermint-Cobalt Flavoured Sugar Free Chewing Gum, 15 Sticks, 3 Packs","WrigleyPeppermint-Cobalt Flavoured Sugar Free Chewing Gum, 15 Sticks, 3 Packs3 ea",$4.99ea,,$1.66/ 1ea,False,89.0,
snacks,Cadbury,Dairy Milk Milk Chocolate Chocolate Bar,CadburyDairy Milk Milk Chocolate Chocolate Bar100 g,$2.49ea,,$2.49/ 100g,False,90.0,
snacks,President's Choice,Unsalted Peanuts,President's ChoiceUnsalted Peanuts700 g,$5.99ea,,$0.86/ 100g,False,91.0,
snacks,Dare,Ultimate Lemon Crème Cookies,DareUltimate Lemon Crème Cookies290 g,$2.99ea,,$1.03/ 100g,False,92.0,
snacks,Christie,Chips Ahoy! Original Cookies,ChristieChips Ahoy! Original Cookies460 g,$4.99ea,,$1.08/ 100g,False,93.0,
snacks,Dentyne,Fire Cinnamon Gum,DentyneFire Cinnamon Gum4 ea,$4.29ea,,$1.07/ 1ea,False,94.0,
snacks,Nature Valley,Biscuits with Peanut Butter,Nature ValleyBiscuits with Peanut Butter190 g,$3.49ea,,$1.84/ 100g,False,95.0,
snacks,Loacker,"Wafer, Vanilla","LoackerWafer, Vanilla175 g",$3.79ea,,$2.17/ 100g,False,96.0,
snacks,Nestle,Kitkat Gooey Salted Caramel Bar,NestleKitkat Gooey Salted Caramel Bar112 g,$2.59ea,,$2.31/ 100g,False,97.0,
snacks,No Name,Mandarin Oranges in Light Syrup,No NameMandarin Oranges in Light Syrup4x107.0 ml,$2.29ea,,$0.54/ 100ml,False,98.0,
snacks,Nature Valley,Lunchbox Caramel Chocolate Granola Bar,Nature ValleyLunchbox Caramel Chocolate Granola Bar130 g,$2.99ea,,$2.30/ 100g,False,99.0,
snacks,Werther's,Original Caramel Hard Candy,Werther'sOriginal Caramel Hard Candy135 g,$2.79ea,,$2.07/ 100g,False,100.0,
snacks,Lotus,Biscoff Biscuit,LotusBiscoff Biscuit250 g,$3.99ea,,$1.60/ 100g,False,101.0,
snacks,Kelloggs,Special K Cereal Bars 2 Flavours,KelloggsSpecial K Cereal Bars 2 Flavours500 g,$9.99ea,,$2.00/ 100g,False,102.0,
snacks,Betty Crocker,Paw Patrol Special Edition Fruit Flavoured Snacks,Betty CrockerPaw Patrol Special Edition Fruit Flavoured Snacks226 g,$2.99ea,,$1.32/ 100g,False,103.0,
snacks,Cadbury,Cadbury Chocolate Premium Dark Chocolate Bar,CadburyCadbury Chocolate Premium Dark Chocolate Bar100 g,$2.49ea,,$2.49/ 100g,False,104.0,
snacks,Wrigley,"Peppermint-Cobalt Flavoured Sugar Free Chewing Gum, 15 Sticks, 3 Packs","WrigleyPeppermint-Cobalt Flavoured Sugar Free Chewing Gum, 15 Sticks, 3 Packs3 ea",$4.99ea,,$1.66/ 1ea,False,105.0,
snacks,Cadbury,Dairy Milk Milk Chocolate Chocolate Bar,CadburyDairy Milk Milk Chocolate Chocolate Bar100 g,$2.49ea,,$2.49/ 100g,False,106.0,
snacks,President's Choice,Unsalted Peanuts,President's ChoiceUnsalted Peanuts700 g,$5.99ea,,$0.86/ 100g,False,107.0,
snacks,Dare,Ultimate Lemon Crème Cookies,DareUltimate Lemon Crème Cookies290 g,$2.99ea,,$1.03/ 100g,False,108.0,
snacks,Christie,Chips Ahoy! Original Cookies,ChristieChips Ahoy! Original Cookies460 g,$4.99ea,,$1.08/ 100g,False,109.0,
snacks,Dentyne,Fire Cinnamon Gum,DentyneFire Cinnamon Gum4 ea,$4.29ea,,$1.07/ 1ea,False,110.0,
snacks,Nature Valley,Biscuits with Peanut Butter,Nature ValleyBiscuits with Peanut Butter190 g,$3.49ea,,$1.84/ 100g,False,111.0,
snacks,Loacker,"Wafer, Vanilla","LoackerWafer, Vanilla175 g",$3.79ea,,$2.17/ 100g,False,112.0,
snacks,President's Choice,Sweet Chili Purple Kernel Corn Crisps,President's ChoiceSweet Chili Purple Kernel Corn Crisps110 g,$2.49ea,,$2.26/ 100g,False,113.0,
snacks,Excel,"Spearmint Flavoured Sugar Free Chewing Gum, 18 Pieces, 3 Packs","ExcelSpearmint Flavoured Sugar Free Chewing Gum, 18 Pieces, 3 Packs77 g",$4.29ea,,$5.57/ 100g,False,114.0,
snacks,Tostitos,Simply Yellow Corn Tortilla Chips 240g,TostitosSimply Yellow Corn Tortilla Chips 240g240 g,$4.99ea,,$2.08/ 100g,False,115.0,
snacks,Mr. Cookies,Mr. Mini Vanilla Flavoured Cookies with Chocolate Drizzle,Mr. CookiesMr. Mini Vanilla Flavoured Cookies with Chocolate Drizzle150 g,$2.29ea,,$1.53/ 100g,False,116.0,
snacks,Christie,Oreo Mega Stuff Cookies,ChristieOreo Mega Stuff Cookies374 g,$4.99ea,,$1.33/ 100g,False,117.0,
snacks,Nature Valley,Lunchbox - Double Chocolate Flavour,Nature ValleyLunchbox - Double Chocolate Flavour130 g,$2.99ea,,$2.30/ 100g,False,118.0,
snacks,Nature Valley,Sweet & Salty Peanut,Nature ValleySweet & Salty Peanut525 g,$5.99ea,,$1.14/ 100g,False,119.0,
snacks,The Snack Factory,"Pretzel Crisps, Garlic Parmesan    ","The Snack FactoryPretzel Crisps, Garlic Parmesan    200 g",$5.99ea,,$3.00/ 100g,False,120.0,
snacks,President's Choice,Extra Butter Flavour Purple Kernel Microwave Popcorn,President's ChoiceExtra Butter Flavour Purple Kernel Microwave Popcorn247 g,$3.79ea,,$1.53/ 100g,False,121.0,
snacks,President's Choice,Loads of Sour Cream & Onion Rippled Potato Chips,President's ChoiceLoads of Sour Cream & Onion Rippled Potato Chips200 g,$2.79ea,,$1.40/ 100g,False,122.0,
snacks,Old Dutch,Popcorn Twists,Old DutchPopcorn Twists175 g,$3.49ea,,$1.99/ 100g,False,123.0,
snacks,Christie,Crispers Ketchup Crackers,ChristieCrispers Ketchup Crackers145 g,$2.59ea,,$1.79/ 100g,False,124.0,
snacks,Surati,Spicy Chilli Crunch Tubes   ,SuratiSpicy Chilli Crunch Tubes   80 g,$1.49ea,,$1.86/ 100g,False,125.0,
snacks,Aero,Nestlé Dark Mint Chocolate,AeroNestlé Dark Mint Chocolate95 g,$2.59ea,,$2.73/ 100g,False,126.0,
snacks,Christie,Premium Plus Unsalted Crackers,ChristiePremium Plus Unsalted Crackers900 g,$7.99ea,,$0.89/ 100g,False,127.0,
snacks,Dare,Real Hoppy Marshmallow Rabbits,DareReal Hoppy Marshmallow Rabbits220 g,$2.99ea,,$1.36/ 100g,False,128.0,
snacks,President's Choice,Water Crackers,President's ChoiceWater Crackers125 g,$3.49ea,,$2.79/ 100g,False,129.0,
snacks,Kinder,"Bueno Mini Chocolate and Hazelnut Cream Candy Bars, 27 Individually Wrapped Chocolates Per Bag","KinderBueno Mini Chocolate and Hazelnut Cream Candy Bars, 27 Individually Wrapped Chocolates Per Bag145 g",$3.75ea,$3.49ea,$2.41/ 100g,True,130.0,saleEnds 03/15
snacks,Wrigley,"Polar Ice Flavoured Sugar Free Chewing Gum, 12 Pieces, 1 Pack","WrigleyPolar Ice Flavoured Sugar Free Chewing Gum, 12 Pieces, 1 Pack12 ea",$1.29ea,$0.89ea,$0.07/ 1ea,True,131.0,saleEnds 04/05
snacks,Wrigley,"Spearmint Flavoured Sugar Free Chewing Gum, 12 Pieces, 1 Pack","WrigleySpearmint Flavoured Sugar Free Chewing Gum, 12 Pieces, 1 Pack12 ea",$1.29ea,$0.89ea,$0.07/ 1ea,True,132.0,saleEnds 04/05
snacks,Keebler,Town House Oven Baked Crackers Light and Buttery Flavour Original,KeeblerTown House Oven Baked Crackers Light and Buttery Flavour Original391 g,$3.99ea,,$1.02/ 100g,False,133.0,
snacks,President's Choice,Apple Strawberry Squeeze Fruit Snacks,President's ChoiceApple Strawberry Squeeze Fruit Snacks4x90.0 g,$2.49ea,,$0.69/ 100g,False,134.0,
snacks,Dare,Veggie Crisps Zesty Ranch,DareVeggie Crisps Zesty Ranch100 g,$2.49ea,,$2.49/ 100g,False,135.0,
snacks,President's Choice,Extra Cheesy Little Penguins Snack Crackers,President's ChoiceExtra Cheesy Little Penguins Snack Crackers840 g,$13.99ea,,$1.67/ 100g,False,136.0,
snacks,No Name,Salted Tops Soda Crackers,No NameSalted Tops Soda Crackers454 g,$3.29ea,,$0.72/ 100g,False,137.0,
snacks,President's Choice,Loads Of All Dressed Rippled Potato Chips,President's ChoiceLoads Of All Dressed Rippled Potato Chips200 g,$2.79ea,,$1.40/ 100g,False,138.0,
snacks,President's Choice,Barbecue Flavour Kettle Cooked Chips,President's ChoiceBarbecue Flavour Kettle Cooked Chips200 g,$2.49ea,,$1.25/ 100g,False,139.0,
snacks,President's Choice,Original Melba Toast,President's ChoiceOriginal Melba Toast200 g,$2.49ea,,$1.25/ 100g,False,140.0,
snacks,Dole,"Fruit Bowls Pears, Diced","DoleFruit Bowls Pears, Diced4x107.0 ml",$3.29ea,,$0.77/ 100ml,False,141.0,
snacks,Dare,Breton Morning Toasts Everything,DareBreton Morning Toasts Everything225 g,$3.49ea,,$1.55/ 100g,False,142.0,
snacks,Doritos,Sweet & Tangy BBQ Tortilla Chips,DoritosSweet & Tangy BBQ Tortilla Chips210 g,$4.29ea,,$2.04/ 100g,False,143.0,
snacks,Leclerc,Go Pure Oatmeal Bars Banana Bread Chocolate Chip,LeclercGo Pure Oatmeal Bars Banana Bread Chocolate Chip175 g,$3.29ea,$2.79ea,$1.59/ 100g,True,144.0,saleEnds 03/15
snacks,Voortman,"Turnover Cookie, Strawberry","VoortmanTurnover Cookie, Strawberry300 g",$4.29ea,,$1.43/ 100g,False,145.0,
snacks,Grace,Plantain Chips Sweet Chili Flavoured,GracePlantain Chips Sweet Chili Flavoured85 g,$1.29ea,,$1.52/ 100g,False,146.0,
snacks,Cheez-It,"Crunch, Sharp White Cheddar, Baked Snack Crackers","Cheez-ItCrunch, Sharp White Cheddar, Baked Snack Crackers191 g",$2.75ea,$2.49ea,$1.30/ 100g,True,147.0,saleEnds 03/15
snacks,Christie,Crispers Ranch Crackers,ChristieCrispers Ranch Crackers145 g,$2.59ea,,$1.79/ 100g,False,148.0,
snacks,Mentos,Fruit,MentosFruit4 ea,$3.59ea,,$0.90/ 1ea,False,149.0,
snacks,PC Blue Menu," Natural Flavour Microwave Popcorn, Mini Bags","PC Blue Menu Natural Flavour Microwave Popcorn, Mini Bags8x32.0 g",$4.49ea,,$1.75/ 100g,False,150.0,
snacks,No Name,Ice Cream Cups,No NameIce Cream Cups1 ea,$2.00ea,,$2.50/ 100g,False,151.0,
snacks,SunRype,Apple Strawberry 100% Fruit Snack,SunRypeApple Strawberry 100% Fruit Snack14 g,$0.39ea,,$2.79/ 100g,False,152.0,
snacks,Quaker,"Chewy Harvest Granola Bars, Yogourt - 3 Flavour 30 bar - Variety pack","QuakerChewy Harvest Granola Bars, Yogourt - 3 Flavour 30 bar - Variety pack1.05 kg",$14.99ea,,$1.43/ 100g,False,153.0,
snacks,President's Choice,Extra Cheesy Little Penguins Snack Crackers,President's ChoiceExtra Cheesy Little Penguins Snack Crackers840 g,$13.99ea,,$1.67/ 100g,False,154.0,
snacks,President's Choice,Original Melba Toast,President's ChoiceOriginal Melba Toast200 g,$2.49ea,,$1.25/ 100g,False,155.0,
snacks,Dole,"Fruit Bowls Pears, Diced","DoleFruit Bowls Pears, Diced4x107.0 ml",$3.29ea,,$0.77/ 100ml,False,156.0,
snacks,Dare,Breton Morning Toasts Everything,DareBreton Morning Toasts Everything225 g,$3.49ea,,$1.55/ 100g,False,157.0,
snacks,Doritos,Sweet & Tangy BBQ Tortilla Chips,DoritosSweet & Tangy BBQ Tortilla Chips210 g,$4.29ea,,$2.04/ 100g,False,158.0,
snacks,Ritz,Cheese Nibs Cheddar/Jalapeno Crackers,RitzCheese Nibs Cheddar/Jalapeno Crackers200 g,$5.49ea,,$2.75/ 100g,False,159.0,
snacks,No Name,Salted Tops Soda Crackers,No NameSalted Tops Soda Crackers454 g,$3.29ea,,$0.72/ 100g,False,160.0,
snacks,President's Choice,Loads Of All Dressed Rippled Potato Chips,President's ChoiceLoads Of All Dressed Rippled Potato Chips200 g,$2.79ea,,$1.40/ 100g,False,161.0,
snacks,President's Choice,Barbecue Flavour Kettle Cooked Chips,President's ChoiceBarbecue Flavour Kettle Cooked Chips200 g,$2.49ea,,$1.25/ 100g,False,162.0,
snacks,President's Choice,Extra Butter Flavour Purple Kernel Microwave Popcorn,President's ChoiceExtra Butter Flavour Purple Kernel Microwave Popcorn247 g,$3.79ea,,$1.53/ 100g,False,163.0,
snacks,President's Choice,Loads of Sour Cream & Onion Rippled Potato Chips,President's ChoiceLoads of Sour Cream & Onion Rippled Potato Chips200 g,$2.79ea,,$1.40/ 100g,False,164.0,
snacks,Christie,Premium Plus Unsalted Crackers,ChristiePremium Plus Unsalted Crackers900 g,$7.99ea,,$0.89/ 100g,False,165.0,
snacks,Spitz,"Sunflower Seeds, Salted","SpitzSunflower Seeds, Salted227 g",$3.19ea,,$1.52/ 100g,False,166.0,
snacks,Trophy,Almonds Roasted with Sea Salt,TrophyAlmonds Roasted with Sea Salt200 g,$4.99ea,,$2.50/ 100g,False,167.0,
snacks,GoGo squeez,Fruit Sauce Apple Mango Guava,GoGo squeezFruit Sauce Apple Mango Guava360 g,$3.99ea,,$1.11/ 100g,False,168.0,
snacks,Lindt,GOLD BUNNY Hazelnut Milk Chocolate Easter Bunny,LindtGOLD BUNNY Hazelnut Milk Chocolate Easter Bunny100 g,$5.99ea,,$5.99/ 100g,False,169.0,
snacks,Leclerc,Go Pure Oatmeal Bars Banana Bread Chocolate Chip,LeclercGo Pure Oatmeal Bars Banana Bread Chocolate Chip175 g,$3.29ea,$2.79ea,$1.59/ 100g,True,170.0,saleEnds 03/15
snacks,President's Choice,Mini Crisp & Thin Vegetable Crackers,President's ChoiceMini Crisp & Thin Vegetable Crackers200 g,$3.49ea,,$1.75/ 100g,False,171.0,
snacks,Snackpack,Fanta Orange Snack Pack,SnackpackFanta Orange Snack Pack594 g,$3.49ea,,$0.59/ 100g,False,172.0,
snacks,Humpty Dumpty,Potato Snack Bbq Flavoured,Humpty DumptyPotato Snack Bbq Flavoured280 g,$3.99ea,,$1.43/ 100g,False,173.0,
snacks,Dare,Veggie Crisps Zesty Ranch,DareVeggie Crisps Zesty Ranch100 g,$2.49ea,,$2.49/ 100g,False,174.0,
snacks,Christie,Crispers Ketchup Crackers,ChristieCrispers Ketchup Crackers145 g,$2.59ea,,$1.79/ 100g,False,175.0,
snacks,Neilson,Jersey Milk,NeilsonJersey Milk180 g,$4.79ea,,$2.66/ 100g,False,176.0,
snacks,Excel,"Winterfresh Flavoured Sugar Free Chewing Gum, 18 Pieces, 3 Packs","ExcelWinterfresh Flavoured Sugar Free Chewing Gum, 18 Pieces, 3 Packs77 g",$4.29ea,,$5.57/ 100g,False,177.0,
snacks,Smart Food,Jalapeño & Cheddar Flavour Seasoned Popcorn 180g,Smart FoodJalapeño & Cheddar Flavour Seasoned Popcorn 180g180 g,$4.29ea,,$2.38/ 100g,False,178.0,
snacks,President's Choice,Peanut Butter Filled Pretzels ,President's ChoicePeanut Butter Filled Pretzels 680 g,$8.99ea,,$1.32/ 100g,False,179.0,
snacks,Nestle,"Aero Miniature Milk Chocolate Bars, 9 Pack","NestleAero Miniature Milk Chocolate Bars, 9 Pack66 g",$2.59ea,,$3.92/ 100g,False,180.0,
snacks,Hawkins,Cheezies,HawkinsCheezies210 g,$3.79ea,,$1.80/ 100g,False,181.0,
snacks,Fritos,Original Corn Chips 340g,FritosOriginal Corn Chips 340g340 g,$4.19ea,,$1.23/ 100g,False,182.0,
snacks,Tostitos,Multigrain Rounds Chips    ,TostitosMultigrain Rounds Chips    430 g,$5.49ea,,$1.28/ 100g,False,183.0,
snacks,President's Choice,Original Thick Cut Rippled Potato Chips ,President's ChoiceOriginal Thick Cut Rippled Potato Chips 200 g,$2.79ea,,$1.40/ 100g,False,184.0,
snacks,Tostitos,Hint of Jalapeño flavour tortilla chips 275g,TostitosHint of Jalapeño flavour tortilla chips 275g275 g,$3.99ea,,$1.45/ 100g,False,185.0,
snacks,Ruffles,Sour Cream 'n Bacon Flavoured Potato Chips,RufflesSour Cream 'n Bacon Flavoured Potato Chips200 g,$4.49ea,$3.99ea,$2.00/ 100g,True,186.0,saleEnds 03/22
snacks,No Name,Corn Chips,No NameCorn Chips200 g,$1.99ea,,$1.00/ 100g,False,187.0,
snacks,JUICY FRUIT,"Fruit Flavoured Chewing Gum, 18 Pieces, 3 Packs","JUICY FRUITFruit Flavoured Chewing Gum, 18 Pieces, 3 Packs77 g",$4.29ea,,$5.57/ 100g,False,188.0,
snacks,M&M's,"Caramel Milk Chocolate Candies, Sharing Bag","M&M'sCaramel Milk Chocolate Candies, Sharing Bag185 g",$4.99ea,,$2.70/ 100g,False,189.0,
snacks,Nature Valley,Trail Mix Dark Chocolate Chewy Granola Bars,Nature ValleyTrail Mix Dark Chocolate Chewy Granola Bars175 g,$2.99ea,,$1.71/ 100g,False,190.0,
snacks,Reese's,Peanut Butter Bar,Reese'sPeanut Butter Bar120 g,$2.59ea,,$2.16/ 100g,False,191.0,
snacks,Betty Crocker,Fruit By The Foot Strawberry and Berry Tie Dye Family Pack ,Betty CrockerFruit By The Foot Strawberry and Berry Tie Dye Family Pack 340 g,$6.49ea,$5.99ea,$1.76/ 100g,True,192.0,saleEnds 03/15
snacks,Dare,Realfruit Superfruits,DareRealfruit Superfruits180 g,$3.19ea,,$1.77/ 100g,False,193.0,
snacks,No Name,Salted Blanched Peanuts,No NameSalted Blanched Peanuts2 kg,$12.49ea,,$0.62/ 100g,False,194.0,
