category,brand,product_text,product_name,price_text,sale_price,per_unit_price_text,is_sale,ranking,sale_valid_to
bakery,,White Baguette,White Baguette255 g,$1.69ea,,$0.66/ 100g,False,1.0,
bakery,President's Choice,Tortillas Original ,President's ChoiceTortillas Original 650 g,$4.29ea,,$0.66/ 100g,False,2.0,
bakery,Farmer's Market,Butter Croissant,Farmer's MarketButter Croissant270 g,$6.29ea,,$2.33/ 100g,False,3.0,
bakery,Wonder,"Bread, Sliced White","WonderBread, Sliced White675 g",$3.99ea,,$0.59/ 100g,False,4.0,
bakery,President's Choice,Original English Muffins,President's ChoiceOriginal English Muffins342 g,$3.29ea,,$0.96/ 100g,False,5.0,
bakery,ACE,White Baguette,ACEWhite Baguette350 g,$3.99ea,,$1.14/ 100g,False,6.0,
bakery,Farmer's Market,Banana Chocolate Chunk Muffins,Farmer's MarketBanana Chocolate Chunk Muffins600 g,$6.99ea,,$1.17/ 100g,False,7.0,
bakery,Farmer's Market,Chocolate Chip Muffins,Farmer's MarketChocolate Chip Muffins600 g,$6.99ea,,$1.17/ 100g,False,8.0,
bakery,Casa Mendosa,Large Whole Wheat Tortillas,Casa MendosaLarge Whole Wheat Tortillas640 g,$4.79ea,,$0.75/ 100g,False,9.0,
bakery,Farmer's Market,Blueberry Muffins,Farmer's MarketBlueberry Muffins570 g,$6.99ea,,$1.23/ 100g,False,10.0,
bakery,No Name,Everything Bagels,No NameEverything Bagels510 g,$2.99ea,,$0.59/ 100g,False,11.0,
bakery,DItaliano,Brioche-Style Hamburger Buns,DItalianoBrioche-Style Hamburger Buns560 g,$3.99ea,,$0.71/ 100g,False,12.0,
bakery,Wonder,White Bread with Fibre,WonderWhite Bread with Fibre675 g,$3.99ea,,$0.59/ 100g,False,13.0,
bakery,No Name,"Bagel Plain, 6 Pack","No NameBagel Plain, 6 Pack510 g",$2.99ea,,$0.59/ 100g,False,14.0,
bakery,DItaliano,Thick Sliced Bread 100% Whole Wheat ,DItalianoThick Sliced Bread 100% Whole Wheat 675 g,$3.99ea,,$0.59/ 100g,False,15.0,
bakery,Country Harvest,Everything Bagel,Country HarvestEverything Bagel450 g,$4.49ea,,$1.00/ 100g,False,16.0,
bakery,Wonder,White Hotdog Buns,WonderWhite Hotdog Buns8x44.5 g,$3.99ea,,$1.12/ 100g,False,17.0,
bakery,President's Choice,Chocolate Chip Mini Muffins,President's ChoiceChocolate Chip Mini Muffins336 g,$6.29ea,,$1.87/ 100g,False,18.0,
bakery,Farmer's Market,Carrot Muffins,Farmer's MarketCarrot Muffins600 g,$6.99ea,,$1.17/ 100g,False,19.0,
bakery,Country Harvest,Cinnamon Raisin Bread,Country HarvestCinnamon Raisin Bread600 g,$4.49ea,,$0.75/ 100g,False,20.0,
bakery,Wonder,White Bread White Texas,WonderWhite Bread White Texas675 g,$3.99ea,,$0.59/ 100g,False,21.0,
bakery,Country Harvest,Quinoa Flax Bread,Country HarvestQuinoa Flax Bread600 g,$4.49ea,,$0.75/ 100g,False,22.0,
bakery,Casa Mendosa,"10 Medium Tortillas, Original","Casa Mendosa10 Medium Tortillas, Original340 g",$4.29ea,,$1.26/ 100g,False,23.0,
bakery,Country Harvest,Protein Bread,Country HarvestProtein Bread600 g,$4.49ea,,$0.75/ 100g,False,24.0,
bakery,Paneriso,Banana Loaf Cake,PanerisoBanana Loaf Cake454 g,$8.49ea,,$1.87/ 100g,False,25.0,
bakery,La Tortilla Factory,Tortillas Ancient Grain Ivory Teff Wraps,La Tortilla FactoryTortillas Ancient Grain Ivory Teff Wraps396 g,$7.49ea,,$1.89/ 100g,False,26.0,
bakery,Rubschlager,Sesame Multigrain Loaf,RubschlagerSesame Multigrain Loaf454 g,$3.99ea,,$0.88/ 100g,False,27.0,
bakery,Poppers,Wheat Popped Grains,PoppersWheat Popped Grains120 g,$5.49ea,,$4.58/ 100g,False,28.0,
bakery,Ozery's,Broiche Buns Bakery Soft and Fluffy Pre-Sliced Thin Buns,Ozery'sBroiche Buns Bakery Soft and Fluffy Pre-Sliced Thin Buns6x378.0 g,$4.49ea,,$1.19/ 100g,False,29.0,
bakery,Cadbury,Caramilk Dome Cake,CadburyCaramilk Dome Cake1.2 kg,$18.99ea,,$2.71/ 100g,False,30.0,
bakery,,All Butter Almondine Rolls,All Butter Almondine Rolls255 g,$4.99ea,,$1.45/ 100g,False,31.0,
bakery,,Submarine Buns 4 Pack,Submarine Buns 4 Pack464 g,$3.29ea,,$2.53/ 100g,False,32.0,
bakery,,Bagels,Bagels113 g,$0.89ea,,$0.79/ 100g,False,33.0,
bakery,,8' Black Forest Cake,8' Black Forest Cake1100 g,$27.99ea,,$2.54/ 100g,False,34.0,
bakery,Baxters,Swiss Roll Chocolate,BaxtersSwiss Roll Chocolate6x67.0 g,$5.49ea,,$1.37/ 100g,False,35.0,
bakery,,Elite Sweets Milky Way Cake,Elite Sweets Milky Way Cake900 g,$18.99ea,,$2.11/ 100g,False,36.0,
bakery,,"Small Cannoli, 6 Pack","Small Cannoli, 6 Pack6x30.0 g",$5.99ea,,$3.33/ 100g,False,37.0,
bakery,Dimpflmeier,7 Grains Bread,Dimpflmeier7 Grains Bread454 g,$4.99ea,$4.59ea,$1.01/ 100g,True,38.0,saleEnds 03/22
bakery,,"Sub Roll, Sesame Seed 4 pack","Sub Roll, Sesame Seed 4 pack420 g",$3.29ea,,$0.78/ 100g,False,39.0,
bakery,,"White Celebration Cake, 5 in","White Celebration Cake, 5 in0.65 kg",$12.99ea,,$2.00/ 100g,False,40.0,
bakery,President's Choice,Sourdough Loaf,President's ChoiceSourdough Loaf500 g,$3.99ea,,$0.80/ 100g,False,41.0,
bakery,Stonemill,Wholesome Bread Loaf Quinoa & Flax  ,StonemillWholesome Bread Loaf Quinoa & Flax  600 g,$5.69ea,,$0.95/ 100g,False,42.0,
bakery,Farmer's Market,Cinnamon Swirl Iced Loaf Cake,Farmer's MarketCinnamon Swirl Iced Loaf Cake400 g,$6.29ea,,$1.57/ 100g,False,43.0,
bakery,,"Pumpernickel Bread, Unsliced","Pumpernickel Bread, Unsliced675 g",$4.79ea,,$0.71/ 100g,False,44.0,
bakery,,Cheese Swirl Buns 4 Pack,Cheese Swirl Buns 4 Pack400 g,$5.79ea,,$1.45/ 100g,False,45.0,
bakery,,Croissant Cheese Mini 10 Pack,Croissant Cheese Mini 10 Pack280 g,$4.29ea,,$1.53/ 100g,False,46.0,
bakery,President's Choice,Mini Naan Garlic 4 Flatbreads,President's ChoiceMini Naan Garlic 4 Flatbreads180 g,$3.49ea,,$1.94/ 100g,False,47.0,
bakery,,PC Dinner Rolls 60% Whole Wheat,PC Dinner Rolls 60% Whole Wheat12x1.0 ea,$4.29ea,,$0.36/ 1ea,False,48.0,
bakery,,Croissant Cheese Mini 10 Pack,Croissant Cheese Mini 10 Pack280 g,$4.29ea,,$1.53/ 100g,False,49.0,
bakery,Paneriso,Banana Loaf Cake,PanerisoBanana Loaf Cake454 g,$8.49ea,,$1.87/ 100g,False,50.0,
bakery,La Tortilla Factory,Tortillas Ancient Grain Ivory Teff Wraps,La Tortilla FactoryTortillas Ancient Grain Ivory Teff Wraps396 g,$7.49ea,,$1.89/ 100g,False,51.0,
bakery,Rubschlager,Sesame Multigrain Loaf,RubschlagerSesame Multigrain Loaf454 g,$3.99ea,,$0.88/ 100g,False,52.0,
bakery,Farmer's Market,"Tea Biscuits, Cheddar Cheese","Farmer's MarketTea Biscuits, Cheddar Cheese315 g",$6.29ea,,$2.00/ 100g,False,53.0,
bakery,,"Cookie and Cream Cake, 8 in","Cookie and Cream Cake, 8 in1.5 kg",$20.99ea,,$1.40/ 100g,False,54.0,
bakery,Farmer's Market,Lemon Curd Cake,Farmer's MarketLemon Curd Cake475 g,$6.99ea,,$1.47/ 100g,False,55.0,
bakery,President's Choice,Multigrain Flatbread,President's ChoiceMultigrain Flatbread300 g,$3.09ea,,$1.03/ 100g,False,56.0,
bakery,Poppers,Wheat Popped Grains,PoppersWheat Popped Grains120 g,$5.49ea,,$4.58/ 100g,False,57.0,
bakery,Ozery's,Broiche Buns Bakery Soft and Fluffy Pre-Sliced Thin Buns,Ozery'sBroiche Buns Bakery Soft and Fluffy Pre-Sliced Thin Buns6x378.0 g,$4.49ea,,$1.19/ 100g,False,58.0,
bakery,,"Sub Roll, Sesame Seed 4 pack","Sub Roll, Sesame Seed 4 pack420 g",$3.29ea,,$0.78/ 100g,False,59.0,
bakery,,"White Celebration Cake, 5 in","White Celebration Cake, 5 in0.65 kg",$12.99ea,,$2.00/ 100g,False,60.0,
bakery,President's Choice,Sourdough Loaf,President's ChoiceSourdough Loaf500 g,$3.99ea,,$0.80/ 100g,False,61.0,
bakery,Stonemill,Wholesome Bread Loaf Quinoa & Flax  ,StonemillWholesome Bread Loaf Quinoa & Flax  600 g,$5.69ea,,$0.95/ 100g,False,62.0,
bakery,,Cheese Swirl Buns 4 Pack,Cheese Swirl Buns 4 Pack400 g,$5.79ea,,$1.45/ 100g,False,63.0,
bakery,,8' Black Forest Cake,8' Black Forest Cake1100 g,$27.99ea,,$2.54/ 100g,False,64.0,
bakery,President's Choice,Thick Pizza Crust,President's ChoiceThick Pizza Crust300 g,$3.79ea,,$1.26/ 100g,False,65.0,
bakery,Farmer's Market,Pecan Butter Tarts,Farmer's MarketPecan Butter Tarts6x85.0 g,$7.99ea,$6.99ea,$1.37/ 100g,True,66.0,saleEnds 03/15
bakery,Rudolphs,Rye Bread,RudolphsRye Bread907 g,$5.99ea,,$0.66/ 100g,False,67.0,
bakery,,Macarons Assorted Pk 6,Macarons Assorted Pk 696 g,$12.99ea,,$13.53/ 100g,False,68.0,
bakery,Rudolphs,Five Grain Bread,RudolphsFive Grain Bread680 g,$4.99ea,,$0.73/ 100g,False,69.0,
bakery,,"7 Grain Bread, Sliced","7 Grain Bread, Sliced570 g",$3.99ea,,$0.89/ 100g,False,70.0,
bakery,Casa Mendosa,"6 Large Tortillas, Tomato Salsa","Casa Mendosa6 Large Tortillas, Tomato Salsa384 g",$4.79ea,,$1.25/ 100g,False,71.0,
bakery,,"Mixed Fruit Custard Tart, 4 in","Mixed Fruit Custard Tart, 4 in190 g",$2.59ea,,$1.36/ 100g,False,72.0,
bakery,,Long John Donuts,Long John Donuts6x50.0 g,$7.99ea,,$2.66/ 100g,False,73.0,
bakery,,"Kaiser, 60% Whole Wheat","Kaiser, 60% Whole Wheat800 g",$6.99ea,,$0.87/ 100g,False,74.0,
bakery,Sha Sha,Ginger Snap Cookies,Sha ShaGinger Snap Cookies300x300.0 g,$6.99ea,,$2.33/ 100g,False,75.0,
bakery,,Chocolate Fudge Cake Slice,Chocolate Fudge Cake Slice200 g,$4.00ea,,$2.00/ 100g,False,76.0,
bakery,,Panini Rolls 6 Pack,Panini Rolls 6 Pack320 g,$4.49ea,,$1.40/ 100g,False,77.0,
bakery,ACE,Olive Oil & Sea Salt Mini Crisps ,ACEOlive Oil & Sea Salt Mini Crisps 180 g,$6.49ea,,$3.61/ 100g,False,78.0,
bakery,,Honey Glazed Donuts 6 pack,Honey Glazed Donuts 6 pack480 g,$7.99ea,,$1.66/ 100g,False,79.0,
bakery,,Cookies & Cream Cheesecake,Cookies & Cream Cheesecake200 g,$4.00ea,,$2.00/ 100g,False,80.0,
bakery,Frontier Bakery,Lebanese Style Whole Wheat Pita,Frontier BakeryLebanese Style Whole Wheat Pita330 g,$1.69ea,,$0.51/ 100g,False,81.0,
bakery,,"Blueberry Pie, 8 Inch","Blueberry Pie, 8 Inch680 g",$6.79ea,,$1.00/ 100g,False,82.0,
bakery,,"Monster Cookies, 18 Pack","Monster Cookies, 18 Pack720 g",$6.99ea,,$0.97/ 100g,False,83.0,
bakery,,Artisan Rolls,Artisan Rolls65 g,$0.95ea,,$1.46/ 100g,False,84.0,
bakery,Schar,Gluten-free Hot Dog Rolls,ScharGluten-free Hot Dog Rolls228 g,$7.99ea,,$3.50/ 100g,False,85.0,
bakery,,"5"" Raspberry Crème Cheese Cake","5"" Raspberry Crème Cheese Cake650 g",$12.99ea,,$2.00/ 100g,False,86.0,
bakery,,"Cookies & Cream Cheesecake, 8 Inch","Cookies & Cream Cheesecake, 8 Inch1300 g",$29.99ea,,$2.31/ 100g,False,87.0,
bakery,PC Blue Menu,100% Whole Grain Tortillas,PC Blue Menu100% Whole Grain Tortillas6x65.0 g,$4.29ea,,$1.10/ 100g,False,88.0,
bakery,,"Strawberry Rhubarb Pie, 8 Inch","Strawberry Rhubarb Pie, 8 Inch680 g",$6.79ea,,$1.00/ 100g,False,89.0,
bakery,Baxters,Quinn's Vanilla Raspberry Cream,BaxtersQuinn's Vanilla Raspberry Cream6x67.0 g,$5.49ea,,$1.37/ 100g,False,90.0,
bakery,Rudolphs,Rye Bread,RudolphsRye Bread907 g,$5.99ea,,$0.66/ 100g,False,91.0,
bakery,Farmer's Market,Carrot Cake,Farmer's MarketCarrot Cake875 g,$15.99ea,,$1.83/ 100g,False,92.0,
bakery,Old Mill,"12"" Thin Pizza Starter Kit","Old Mill12"" Thin Pizza Starter Kit700 g",$4.99ea,,$0.71/ 100g,False,93.0,
bakery,,Mini Donuts,Mini Donuts204 g,$4.99ea,,$2.45/ 100g,False,94.0,
bakery,President's Choice,Gluten Free Hot Dog Buns,President's ChoiceGluten Free Hot Dog Buns65 g,$5.29ea,,$2.03/ 100g,False,95.0,
bakery,,Old Fashioned Cherry Pie,Old Fashioned Cherry Pie114 g,$1.79ea,,$1.57/ 100g,False,96.0,
bakery,Hostess,Twinkies Cakes,HostessTwinkies Cakes202 g,$3.19ea,,$1.58/ 100g,False,97.0,
bakery,Villa Di Manno,Stuffing Croutons,Villa Di MannoStuffing Croutons567 g,$4.99ea,,$0.88/ 100g,False,98.0,
bakery,Poppers,Popped Grains Corn Minis,PoppersPopped Grains Corn Minis45 g,$4.49ea,,$9.98/ 100g,False,99.0,
bakery,President's Choice,Thick Pizza Crust,President's ChoiceThick Pizza Crust300 g,$3.79ea,,$1.26/ 100g,False,100.0,
bakery,Farmer's Market,Pecan Butter Tarts,Farmer's MarketPecan Butter Tarts6x85.0 g,$7.99ea,$6.99ea,$1.37/ 100g,True,101.0,saleEnds 03/15
bakery,President's Choice,Traditional Naan,President's ChoiceTraditional Naan250 g,$3.69ea,,$1.48/ 100g,False,102.0,
bakery,President's Choice,White Crustless Bread Tramezzini,President's ChoiceWhite Crustless Bread Tramezzini250 g,$3.99ea,,$1.60/ 100g,False,103.0,
bakery,President's Choice,Brioche Mini Rolls,President's ChoiceBrioche Mini Rolls400 g,$5.49ea,,$1.37/ 100g,False,104.0,
bakery,LA FOURNEE DOREE,Brioche Hot Dog Rolls,LA FOURNEE DOREEBrioche Hot Dog Rolls16x385.0 g,$4.49ea,,$1.17/ 100g,False,105.0,
bakery,Dimpflmeier,Bread Original Swedish Style Light Rye,DimpflmeierBread Original Swedish Style Light Rye454 g,$4.49ea,$4.19ea,$0.92/ 100g,True,106.0,saleEnds 03/22
bakery,LA FOURNEE DOREE,Sesame Brioche Burger Buns,LA FOURNEE DOREESesame Brioche Burger Buns200 g,$4.29ea,,$2.15/ 100g,False,107.0,
bakery,DItaliano,Thick Sliced Brioche-Style Loaf,DItalianoThick Sliced Brioche-Style Loaf620 g,$3.99ea,,$0.64/ 100g,False,108.0,
bakery,President's Choice,Plain Barbari Flatbread,President's ChoicePlain Barbari Flatbread250 g,$3.49ea,,$1.40/ 100g,False,109.0,
bakery,Dempster,Fresh White Bread,DempsterFresh White Bread675 g,$3.99ea,,$0.59/ 100g,False,110.0,
bakery,Dempster,100% Whole Wheat Bread,Dempster100% Whole Wheat Bread675 g,$4.29ea,,$0.64/ 100g,False,111.0,
bakery,Farmer's Market,Carrot Cake,Farmer's MarketCarrot Cake875 g,$15.99ea,,$1.83/ 100g,False,112.0,
bakery,Promise Gluten Free,Hamburger Buns Authentic Brioche,Promise Gluten FreeHamburger Buns Authentic Brioche260 g,$7.99ea,,$3.07/ 100g,False,113.0,
bakery,No Name,"Bagel Cinnamon Raisin, 6 pack","No NameBagel Cinnamon Raisin, 6 pack510 g",$2.99ea,,$0.59/ 100g,False,114.0,
bakery,No Name,Sesame Seed Bagels,No NameSesame Seed Bagels510 g,$2.99ea,,$0.59/ 100g,False,115.0,
bakery,Rudolphs,Five Grain Bread,RudolphsFive Grain Bread680 g,$4.99ea,,$0.73/ 100g,False,116.0,
bakery,,"7 Grain Bread, Sliced","7 Grain Bread, Sliced570 g",$3.99ea,,$0.89/ 100g,False,117.0,
bakery,,Oatmeal Chocolate Chip Cookie 18Pk,Oatmeal Chocolate Chip Cookie 18Pk774 g,$6.99ea,,$0.90/ 100g,False,118.0,
bakery,Molinaro's,"Pizza Starter Kit, Deep Dish","Molinaro'sPizza Starter Kit, Deep Dish890 g",$5.99ea,,$0.67/ 100g,False,119.0,
bakery,Farmer's Market,"Loaf Cake, Golden","Farmer's MarketLoaf Cake, Golden390 g",$6.29ea,,$1.61/ 100g,False,120.0,
bakery,Farmer's Market,Lemon Coffee Cake,Farmer's MarketLemon Coffee Cake500 g,$6.00ea,,$1.20/ 100g,False,121.0,
bakery,,"8"" Lemon Meringue Pie","8"" Lemon Meringue Pie635 g",$6.79ea,,$1.07/ 100g,False,122.0,
bakery,,"Cheesecake, Fruit Topped 6""","Cheesecake, Fruit Topped 6""900 g",$15.99ea,,$1.78/ 100g,False,123.0,
bakery,,"Celebration Cake, Chocolate","Celebration Cake, Chocolate500 g",$7.99ea,,$1.60/ 100g,False,124.0,
bakery,,"Red Velvet Cake 8""","Red Velvet Cake 8""1300 g",$29.99ea,,$2.31/ 100g,False,125.0,
bakery,,Croissant 2 Pack,Croissant 2 Pack124 g,$1.59ea,,$1.28/ 100g,False,126.0,
bakery,,"100% Whole Wheat Bread, Sliced","100% Whole Wheat Bread, Sliced450 g",$3.29ea,,$0.73/ 100g,False,127.0,
bakery,,"Italian Bread, Multi-grain  Sliced","Italian Bread, Multi-grain  Sliced450 g",$2.79ea,,$0.62/ 100g,False,128.0,
bakery,Weight Watchers,100% Whole Wheat Loaf,Weight Watchers100% Whole Wheat Loaf450 g,$4.79ea,$4.49ea,$1.00/ 100g,True,129.0,saleEnds 03/22
bakery,,Dutie Donuts 6 pack ,Dutie Donuts 6 pack 750 g,$7.99ea,,$1.07/ 100g,False,130.0,
bakery,Apple Valley,"Apple Pie, No Sugar Added 8""","Apple ValleyApple Pie, No Sugar Added 8""620 g",$6.99ea,,$1.13/ 100g,False,131.0,
bakery,,Truffle Royale,Truffle Royale600 g,$20.99ea,,$3.50/ 100g,False,132.0,
bakery,President's Choice,Banana Chocolate Chip Mini Muffins,President's ChoiceBanana Chocolate Chip Mini Muffins336 g,$5.69ea,,$1.69/ 100g,False,133.0,
bakery,Hostess,Cupcakes Cakes Cotton Candy Flavour Limited Edition,HostessCupcakes Cakes Cotton Candy Flavour Limited Edition206 g,$3.19ea,,$1.55/ 100g,False,134.0,
bakery,ACE,Classic Gourmet Hamburger Bun,ACEClassic Gourmet Hamburger Bun260 g,$3.99ea,,$1.53/ 100g,False,135.0,
bakery,,Chocolate Chip Cookie 18 Pk,Chocolate Chip Cookie 18 Pk774 g,$6.99ea,,$0.90/ 100g,False,136.0,
bakery,Farmer's Market,Vanilla Cake,Farmer's MarketVanilla Cake850 g,$15.99ea,,$1.88/ 100g,False,137.0,
bakery,Farmer's Market,Chocolate Cake,Farmer's MarketChocolate Cake850 g,$15.99ea,,$1.88/ 100g,False,138.0,
bakery,ACE,Ciabatta Lunga,ACECiabatta Lunga390 g,$3.99ea,,$1.02/ 100g,False,139.0,
bakery,,"Panini Rolls, White Sesame","Panini Rolls, White Sesame340 g",$4.49ea,,$1.32/ 100g,False,140.0,
bakery,Farmer's Market,Angel Food Cake,Farmer's MarketAngel Food Cake283 g,$5.99ea,,$2.12/ 100g,False,141.0,
bakery,Stonemill,Authentic Sourdough Rye Bread Bavarian Light,StonemillAuthentic Sourdough Rye Bread Bavarian Light550 g,$4.69ea,,$0.85/ 100g,False,142.0,
bakery,,Old Fashioned Apple Pie,Old Fashioned Apple Pie114 g,$1.79ea,,$1.57/ 100g,False,143.0,
bakery,,Red Velvet Cake,Red Velvet Cake200 g,$4.00ea,,$2.00/ 100g,False,144.0,
bakery,La Rocca,"Cookie Dough Cake, 8""","La RoccaCookie Dough Cake, 8""1.5 kg",$29.99ea,,$2.00/ 100g,False,145.0,
bakery,,Portuguese Tarts,Portuguese Tarts4x75.0 g,$5.99ea,,$2.00/ 100g,False,146.0,
bakery,,Chocolate Chunk Brownies,Chocolate Chunk Brownies175 g,$2.99ea,,$2.72/ 100g,False,147.0,
bakery,,Core 12 Grain Breads,Core 12 Grain Breads284 g,$4.29ea,,$1.51/ 100g,False,148.0,
bakery,PC Organics,Organic Original Tortilla 10,PC OrganicsOrganic Original Tortilla 10390 g,$4.29ea,,$1.10/ 100g,False,149.0,
bakery,Schar,Artisan Bread,ScharArtisan Bread400 g,$7.99ea,,$2.00/ 100g,False,150.0,
bakery,,"Sourdough Bread, Unsliced","Sourdough Bread, Unsliced675 g",$4.79ea,,$0.71/ 100g,False,151.0,
bakery,,"6"" Mixed Berry Custard Flan","6"" Mixed Berry Custard Flan400 g",$12.99ea,,$3.25/ 100g,False,152.0,
bakery,President's Choice,Carrot Mini Muffins,President's ChoiceCarrot Mini Muffins336 g,$5.69ea,,$1.69/ 100g,False,153.0,
bakery,Paneriso,Brownies,PanerisoBrownies228 g,$5.99ea,,$2.63/ 100g,False,154.0,
bakery,President's Choice,Gluten Free Hamburger Buns,President's ChoiceGluten Free Hamburger Buns80 g,$5.29ea,,$1.65/ 100g,False,155.0,
bakery,,Croissant Chocolatine 4 Pack,Croissant Chocolatine 4 Pack324 g,$3.99ea,,$1.23/ 100g,False,156.0,
bakery,,"Black Forest Strudel, 4 pack","Black Forest Strudel, 4 pack372 g",$4.99ea,,$1.34/ 100g,False,157.0,
bakery,Schar,Ciabatta Rolls,ScharCiabatta Rolls200 g,$7.99ea,,$4.00/ 100g,False,158.0,
bakery,,Chocolate Covered Berries,Chocolate Covered Berries1 ea,$2.09ea,,$2.09/ 1ea,False,159.0,
bakery,,Maple Pecan Braided Danish,Maple Pecan Braided Danish300 g,$4.99ea,,$1.66/ 100g,False,160.0,
bakery,,"Jamocha Almond Fudge Cake, 8 Inch","Jamocha Almond Fudge Cake, 8 Inch1250 g",$29.99ea,,$2.40/ 100g,False,161.0,
bakery,,Popppy Seed Bagel 6 Pack,Popppy Seed Bagel 6 Pack678 g,$4.49ea,,$0.66/ 100g,False,162.0,
bakery,,"Sourdough Bread, Sliced","Sourdough Bread, Sliced675 g",$4.79ea,,$0.71/ 100g,False,163.0,
bakery,PC Blue Menu,Whole Wheat English Muffins,PC Blue MenuWhole Wheat English Muffins342 g,$3.29ea,,$0.96/ 100g,False,164.0,
bakery,,Croissant Plain Mini 10 Pack,Croissant Plain Mini 10 Pack300 g,$4.29ea,,$1.43/ 100g,False,165.0,
bakery,Rudolphs,Light Rye Bread,RudolphsLight Rye Bread907 g,$5.99ea,,$0.66/ 100g,False,166.0,
bakery,,Baguette Crisps,Baguette Crisps200 g,$3.39ea,,$1.70/ 100g,False,167.0,
bakery,President's Choice,Gigantico Burger Buns ,President's ChoiceGigantico Burger Buns 8x71.0 g,$4.29ea,,$0.76/ 100g,False,168.0,
bakery,,German Chocolate Cake,German Chocolate Cake700 g,$12.99ea,,$1.86/ 100g,False,169.0,
bakery,ACE,Rustic Italian Oval,ACERustic Italian Oval350 g,$4.79ea,,$1.37/ 100g,False,170.0,
bakery,,PC Kaiser Crsty 12,PC Kaiser Crsty 12700 g,$6.99ea,,$1.00/ 100g,False,171.0,
bakery,,Light Rye Bread,Light Rye Bread0.375 g,$3.19ea,,$0.85/ 100g,False,172.0,
bakery,,"Cake, Round Chocolate","Cake, Round Chocolate800 g",$19.99ea,,$2.50/ 100g,False,173.0,
bakery,Weight Watchers,White Bread,Weight WatchersWhite Bread450 g,$4.79ea,$4.49ea,$1.00/ 100g,True,174.0,saleEnds 03/22
bakery,ACE,Harvest Grain Oval,ACEHarvest Grain Oval454 g,$4.99ea,,$1.10/ 100g,False,175.0,
bakery,La Baguetterie,Ciabatta Demi ,La BaguetterieCiabatta Demi 450 g,$3.79ea,,$0.84/ 100g,False,176.0,
bakery,,PC Multigrain Kaiser 6S,PC Multigrain Kaiser 6S400 g,$4.49ea,,$1.12/ 100g,False,177.0,
bakery,,"Truffle Royale Cake 8""","Truffle Royale Cake 8""1100 g",$29.99ea,,$2.73/ 100g,False,178.0,
bakery,Farmer's Market,Oatmeal & Chocolate Cookies,Farmer's MarketOatmeal & Chocolate Cookies456 g,$5.99ea,,$1.31/ 100g,False,179.0,
bakery,Stonemill,Honest Wellness Sprouted 3 Grains Bread,StonemillHonest Wellness Sprouted 3 Grains Bread454 g,$5.69ea,,$1.25/ 100g,False,180.0,
bakery,two-bite,"Two Bite Maple Tarts, 9 Pack","two-biteTwo Bite Maple Tarts, 9 Pack261 g",$4.49ea,,$1.72/ 100g,False,181.0,
bakery,Stonemill,Honest  Bread Wellness Sprouted Rye & 12 Grains ,StonemillHonest  Bread Wellness Sprouted Rye & 12 Grains 425 g,$5.69ea,,$1.34/ 100g,False,182.0,
bakery,,"Cake, Round White","Cake, Round White800 g",$19.99ea,,$2.50/ 100g,False,183.0,
bakery,,Amazing Grain Raisin Bread Sliced,Amazing Grain Raisin Bread Sliced450 g,$4.59ea,,$1.02/ 100g,False,184.0,
bakery,ACE,Potato Focaccia,ACEPotato Focaccia480 g,$6.29ea,,$1.31/ 100g,False,185.0,
bakery,Dempster,Malt Bread,DempsterMalt Bread340 g,$4.79ea,,$1.41/ 100g,False,186.0,
bakery,La Rocca,Milk Chocolate Caramel Cake    ,La RoccaMilk Chocolate Caramel Cake    1.4 kg,$29.99ea,,$2.73/ 100g,False,187.0,
bakery,,"Sourdough Loaf, Sliced","Sourdough Loaf, Sliced450 g",$3.29ea,,$0.73/ 100g,False,188.0,
bakery,,"Cherry New York Cheesecake, 8 Inch","Cherry New York Cheesecake, 8 Inch1600 g",$29.99ea,,$1.87/ 100g,False,189.0,
bakery,President's Choice,Gluten Free Strawberry Cake ,President's ChoiceGluten Free Strawberry Cake 553 g,$11.99ea,,$2.17/ 100g,False,190.0,
bakery,Suraj,"Naan Original Flatbreads, 10 pack","SurajNaan Original Flatbreads, 10 pack1 ea",$5.49ea,,$5.49/ 1ea,False,191.0,
bakery,Dimpflmeier,Marble Rye Bread,DimpflmeierMarble Rye Bread500 g,$3.99ea,,$0.80/ 100g,False,192.0,
bakery,Paneriso,Oatmeal Raisin Cookies,PanerisoOatmeal Raisin Cookies350 g,$8.49ea,,$2.43/ 100g,False,193.0,
bakery,DItaliano,Thick Sliced Sesame Bread,DItalianoThick Sliced Sesame Bread675 g,$3.99ea,,$0.59/ 100g,False,194.0,
bakery,Dimpflmeier,Pumpernickel Bread,DimpflmeierPumpernickel Bread454 g,$4.99ea,,$1.10/ 100g,False,195.0,
bakery,School Safe,Muffin Bars Banana Chocolate Chip,School SafeMuffin Bars Banana Chocolate Chip296 g,$4.29ea,,$1.45/ 100g,False,196.0,
bakery,,White Chocolate Raspberry Cake,White Chocolate Raspberry Cake700 g,$12.99ea,,$1.86/ 100g,False,197.0,
bakery,Vachon,Flaky Pastries Apple-Raspberry,VachonFlaky Pastries Apple-Raspberry305 g,$4.49ea,$4.19ea,$1.37/ 100g,True,198.0,saleEnds 03/15
bakery,Hostess,King Dons Cakes,HostessKing Dons Cakes225 g,$3.19ea,,$1.42/ 100g,False,199.0,
bakery,Vachon,Vanilla Flavour Cakes 1/2 Lune Moon ,VachonVanilla Flavour Cakes 1/2 Lune Moon 282 g,$4.49ea,$4.19ea,$1.49/ 100g,True,200.0,saleEnds 03/15
bakery,Hostess,Cupcakes Cakes Vanilla Fun Pack,HostessCupcakes Cakes Vanilla Fun Pack232 g,$3.19ea,,$1.38/ 100g,False,201.0,
bakery,Sara Lee,Party Cake Muffins ,Sara LeeParty Cake Muffins 234 g,$4.04ea,$3.89ea,$1.66/ 100g,True,202.0,saleEnds 03/15
bakery,Sara Lee,Little Bites Blueberry Muffins,Sara LeeLittle Bites Blueberry Muffins234 g,$4.04ea,$3.89ea,$1.66/ 100g,True,203.0,saleEnds 03/15
bakery,President's Choice,Garlic Naan ,President's ChoiceGarlic Naan 250 g,$3.69ea,,$1.48/ 100g,False,204.0,
bakery,Country Harvest,Everything Bread,Country HarvestEverything Bread600 g,$4.49ea,,$0.75/ 100g,False,205.0,
bakery,Wonder,"English Muffins, Whole Wheat","WonderEnglish Muffins, Whole Wheat342 g",$3.79ea,,$1.11/ 100g,False,206.0,
bakery,Wonder,Whole Wheat Hamburger Buns,WonderWhole Wheat Hamburger Buns8x56.0 g,$3.99ea,,$0.89/ 100g,False,207.0,
bakery,Country Harvest,Cranberry & Oats Bagel,Country HarvestCranberry & Oats Bagel450 g,$4.49ea,,$1.00/ 100g,False,208.0,
bakery,No Name,Cracked Wheat Bread,No NameCracked Wheat Bread675 g,$2.79ea,,$0.41/ 100g,False,209.0,
bakery,President's Choice,Extra Raisins Hot Cross Buns,President's ChoiceExtra Raisins Hot Cross Buns8x70.6 g,$4.99ea,,$0.88/ 100g,False,210.0,
bakery,Farmer's Market,Rhubarb Strawberry Pie 10 Inch,Farmer's MarketRhubarb Strawberry Pie 10 Inch1 kg,$11.99ea,,$1.20/ 100g,False,211.0,
bakery,Wonder,Whole Wheat Hot Dog Rolls,WonderWhole Wheat Hot Dog Rolls8x60.0 g,$3.99ea,,$0.83/ 100g,False,212.0,
bakery,School Safe,Brownie Bars ,School SafeBrownie Bars 296 g,$4.29ea,,$1.45/ 100g,False,213.0,
bakery,Dimpflmeier,Bread Prebiotic Multi-Grain,DimpflmeierBread Prebiotic Multi-Grain454 g,$3.79ea,,$0.83/ 100g,False,214.0,
bakery,Gestion Touche,"Sponge Flan, 8""","Gestion ToucheSponge Flan, 8""200 g",$4.29ea,,$2.15/ 100g,False,215.0,
bakery,Farmer's Market,Raisin Bran Muffins,Farmer's MarketRaisin Bran Muffins600 g,$6.99ea,,$1.17/ 100g,False,216.0,
bakery,President's Choice,Gluten Free Millet & Quinoa,President's ChoiceGluten Free Millet & Quinoa454 g,$4.99ea,,$1.10/ 100g,False,217.0,
bakery,,"Pull-Apart Chocolate Cupcakes, Package of 24","Pull-Apart Chocolate Cupcakes, Package of 242000 g",$27.99ea,,$1.40/ 100g,False,218.0,
bakery,Farmer's Market,"Loaf Cake, Banana","Farmer's MarketLoaf Cake, Banana390 g",$6.29ea,,$1.61/ 100g,False,219.0,
bakery,two-bite,Mini Vanilla Cupcakes 12 Pack,two-biteMini Vanilla Cupcakes 12 Pack284 g,$5.29ea,,$1.86/ 100g,False,220.0,
bakery,,Pizza Dough,Pizza Dough650 g,$2.79ea,,$0.43/ 100g,False,221.0,
bakery,,"Celebration Cupcakes, Chocolate","Celebration Cupcakes, Chocolate300 g",$6.49ea,,$2.16/ 100g,False,222.0,
bakery,Farmer's Market,Cookies and Creme Cake,Farmer's MarketCookies and Creme Cake825 g,$15.99ea,,$1.94/ 100g,False,223.0,
bakery,Sha Sha,Ginger Snaps,Sha ShaGinger Snaps300x300.0 g,$6.99ea,,$2.33/ 100g,False,224.0,
bakery,Pita Break,"Snacking Rounds, Apple Cinnamon","Pita BreakSnacking Rounds, Apple Cinnamon312 g",$4.29ea,,$1.38/ 100g,False,225.0,
bakery,Ozery's,Blueberry Morning Rounds,Ozery'sBlueberry Morning Rounds450 g,$4.29ea,,$0.95/ 100g,False,226.0,
bakery,,"Crusty Bread, Unsliced","Crusty Bread, Unsliced450 g",$2.99ea,,$0.66/ 100g,False,227.0,
bakery,,Savoury Roll,Savoury Roll85 g,$1.49ea,,$1.75/ 100g,False,228.0,
bakery,,"60% Whole Wheat Bread, Sliced","60% Whole Wheat Bread, Sliced450 g",$3.29ea,,$0.73/ 100g,False,229.0,
bakery,PC Organics,Organic Everything Bagel,PC OrganicsOrganic Everything Bagel450 g,$4.69ea,,$1.04/ 100g,False,230.0,
