category,brand,product_text,product_name,price_text,sale_price,per_unit_price_text,is_sale,ranking,sale_valid_to
bakery,Ozery's,Brioche Bites (Rolls),Ozery'sBrioche Bites (Rolls)12x324.0 g,$4.49ea,,$1.39/ 100g,False,231.0,
bakery,,Cheese Pizza Buns 4 Pack,Cheese Pizza Buns 4 Pack460 g,$5.79ea,,$1.26/ 100g,False,232.0,
bakery,ACE,Aged Mini Cheddar Crisps,ACEAged Mini Cheddar Crisps150 g,$6.49ea,,$4.33/ 100g,False,233.0,
bakery,,ProteinUp Tortilla Wrap with Sea Salt & Pepper,ProteinUp Tortilla Wrap with Sea Salt & Pepper284 g,$4.29ea,,$1.51/ 100g,False,234.0,
bakery,La Rocca,Lemon Mousse Cake 6 inch,La RoccaLemon Mousse Cake 6 inch85 g,$21.99ea,,$25.87/ 100g,False,235.0,
bakery,Farmer's Market,Berry Medley Muffins,Farmer's MarketBerry Medley Muffins570 g,$6.99ea,,$1.23/ 100g,False,236.0,
bakery,,Garlic Bread with Cheese,Garlic Bread with Cheese260 g,$3.49ea,,$1.34/ 100g,False,237.0,
bakery,,"12 Grain Bread, Sliced","12 Grain Bread, Sliced450 g",$3.99ea,,$0.89/ 100g,False,238.0,
bakery,,Macadamia Cookies 8-pack,Macadamia Cookies 8-pack336 g,$5.00ea,,$1.49/ 100g,False,239.0,
bakery,Pita Break,"Mini Pitas, Whole Grain Wheat","Pita BreakMini Pitas, Whole Grain Wheat480 g",$3.89ea,,$0.81/ 100g,False,240.0,
bakery,Pita Break,"Mini Pitas, Whole Grain Wheat","Pita BreakMini Pitas, Whole Grain Wheat480 g",$3.89ea,,$0.81/ 100g,False,241.0,
bakery,Rudolphs,Light Rye Bread,RudolphsLight Rye Bread680 g,$4.29ea,,$0.63/ 100g,False,242.0,
bakery,Ready Bake,Garlic Bread,Ready BakeGarlic Bread330 g,$3.99ea,,$1.21/ 100g,False,243.0,
bakery,two-bite,Mini Chocolate Cupcakes 12 Pack,two-biteMini Chocolate Cupcakes 12 Pack284 g,$5.29ea,,$1.86/ 100g,False,244.0,
bakery,,Sesame Kaiser Roll 6 Pack,Sesame Kaiser Roll 6 Pack330 g,$4.49ea,,$1.36/ 100g,False,245.0,
bakery,Furlani,Parmesan Garlic Knots,FurlaniParmesan Garlic Knots296 g,$4.79ea,,$1.62/ 100g,False,246.0,
bakery,Farmer's Market,Bumbleberry Crumble Pie,Farmer's MarketBumbleberry Crumble Pie1 kg,$11.99ea,,$1.20/ 100g,False,247.0,
bakery,Rubschlager,Pumpernickel Loaf,RubschlagerPumpernickel Loaf454 g,$3.99ea,,$0.88/ 100g,False,248.0,
bakery,Farmer's Market,Date Square,Farmer's MarketDate Square450 g,$6.99ea,,$1.55/ 100g,False,249.0,
bakery,Farmer's Market,Muffins Double Chocolate    ,Farmer's MarketMuffins Double Chocolate    570 g,$6.99ea,,$1.23/ 100g,False,250.0,
bakery,Dimpflmeier,Power Slice     ,DimpflmeierPower Slice     400 g,$8.99ea,$7.79ea,$1.95/ 100g,True,251.0,saleEnds 03/22
bakery,,Italian Multigrain Unsliced Bread,Italian Multigrain Unsliced Bread450 g,$3.49ea,,$0.78/ 100g,False,252.0,
bakery,,"Celebration Cake, White","Celebration Cake, White500 g",$7.99ea,,$1.60/ 100g,False,253.0,
bakery,,"Baguette, Garlic","Baguette, Garlic200 g",$1.99ea,,$1.00/ 100g,False,254.0,
bakery,President's Choice,Traditional Naan Club Size ,President's ChoiceTraditional Naan Club Size 750 g,$5.59ea,,$0.75/ 100g,False,255.0,
bakery,,Strawberry Custard Tart,Strawberry Custard Tart190 g,$2.49ea,,$1.31/ 100g,False,256.0,
bakery,Dimpflmeier,Sonnenblumenkerne Bread,DimpflmeierSonnenblumenkerne Bread454 g,$4.49ea,,$0.99/ 100g,False,257.0,
bakery,,Kaiser Rolls Whole Wheat 6 Pack,Kaiser Rolls Whole Wheat 6 Pack400 g,$4.49ea,,$1.12/ 100g,False,258.0,
bakery,,Chocolate Boston Donuts 6 pack,Chocolate Boston Donuts 6 pack720 g,$7.99ea,,$1.11/ 100g,False,259.0,
bakery,Schar,Ten Grain Seeds Bread,ScharTen Grain Seeds Bread400 g,$7.99ea,,$2.00/ 100g,False,260.0,
bakery,,Exotic Fruit Cluster Flan,Exotic Fruit Cluster Flan1.3 kg,$19.99ea,,$1.54/ 100g,False,261.0,
bakery,ACE,Roasted Garlic Mini Crisps,ACERoasted Garlic Mini Crisps180 g,$6.49ea,,$3.61/ 100g,False,262.0,
bakery,,"Pumpernickel Bread, Sliced","Pumpernickel Bread, Sliced450 g",$3.29ea,,$0.73/ 100g,False,263.0,
bakery,Wonder,100% Whole Wheat Bread Thin Sliced,Wonder100% Whole Wheat Bread Thin Sliced675 g,$3.99ea,,$0.59/ 100g,False,264.0,
bakery,,"Premium Cupcakes, Small","Premium Cupcakes, Small80 g",$2.29ea,,$2.86/ 100g,False,265.0,
bakery,Poppers, Popped Grains Wheat Minis,Poppers Popped Grains Wheat Minis45 g,$4.49ea,,$9.98/ 100g,False,266.0,
bakery,,"Chia Bread, Sliced","Chia Bread, Sliced450 g",$4.29ea,,$0.95/ 100g,False,267.0,
bakery,Farmer's Market,Morning Glory Muffins,Farmer's MarketMorning Glory Muffins600 g,$6.99ea,,$1.17/ 100g,False,268.0,
bakery,,"Cream Horns, Large","Cream Horns, Large50 g",$1.99ea,,$3.98/ 100g,False,269.0,
bakery,,Bread Challah,Bread Challah450 g,$3.99ea,,$0.89/ 100g,False,270.0,
bakery,La Baguetterie,White Oval,La BaguetterieWhite Oval454 g,$3.79ea,,$0.83/ 100g,False,271.0,
bakery,,"Apple Strudel Braids, 4-pack","Apple Strudel Braids, 4-pack372 g",$4.99ea,,$1.34/ 100g,False,272.0,
bakery,Farmer's Market,Cinnamon Mini Coffee Cakes,Farmer's MarketCinnamon Mini Coffee Cakes324 g,$4.99ea,,$1.54/ 100g,False,273.0,
bakery,Moms,Golden Pound Cake,MomsGolden Pound Cake450 g,$5.49ea,,$1.22/ 100g,False,274.0,
bakery,ACE,"Sliced Miche, Sourdough","ACESliced Miche, Sourdough700 g",$6.99ea,,$1.00/ 100g,False,275.0,
bakery,,"Boston Cake, Fruit Topped","Boston Cake, Fruit Topped900 g",$21.99ea,,$2.44/ 100g,False,276.0,
bakery,Farmer's Market,"Cookies, Peanut Butter, 12 Pack","Farmer's MarketCookies, Peanut Butter, 12 Pack456 g",$5.99ea,,$1.31/ 100g,False,277.0,
bakery,,"Chocolate Celebration Cake, 5 in","Chocolate Celebration Cake, 5 in0.66 kg",$12.99ea,,$1.97/ 100g,False,278.0,
bakery,,Raised Hawaiian Donuts 6 Pack,Raised Hawaiian Donuts 6 Pack600 g,$7.99ea,,$1.33/ 100g,False,279.0,
bakery,Weight Watchers,100% Whole Wheat Bagels ,Weight Watchers100% Whole Wheat Bagels 378 g,$5.39ea,$5.09ea,$1.35/ 100g,True,280.0,saleEnds 03/22
bakery,,"9"" Mixed Berry Custard Tart","9"" Mixed Berry Custard Tart700 g",$19.99ea,,$2.86/ 100g,False,281.0,
bakery,Farmer's Market,Raisin Butter Tarts,Farmer's MarketRaisin Butter Tarts6x85.0 g,$7.99ea,$6.99ea,$1.37/ 100g,True,282.0,saleEnds 03/15
bakery,,"Instore Made Cinnamon Raisin Buns, Glaze 4 pack","Instore Made Cinnamon Raisin Buns, Glaze 4 pack552 g",$5.49ea,,$0.99/ 100g,False,283.0,
bakery,ACE,Sesame Gourmet Hamburger Buns,ACESesame Gourmet Hamburger Buns260 g,$3.99ea,,$1.53/ 100g,False,284.0,
bakery,,"Bagels, Cinnamon Raisin 6 Pack","Bagels, Cinnamon Raisin 6 Pack648 g",$4.49ea,,$4.16/ 100g,False,285.0,
bakery,,Harvest Wheat Baguette,Harvest Wheat Baguette255 g,$1.69ea,,$0.66/ 100g,False,286.0,
bakery,,"Truffle Royale Cake, Slice","Truffle Royale Cake, Slice137 g",$4.00ea,,$2.92/ 100g,False,287.0,
bakery,,Chocolate Tpped Long John Donut 6 pack,Chocolate Tpped Long John Donut 6 pack780 g,$7.99ea,,$1.02/ 100g,False,288.0,
bakery,,Boston Cream Pie,Boston Cream Pie900 g,$20.99ea,,$2.33/ 100g,False,289.0,
bakery,Farmer's Market,Blueberry Pie 10 Inch,Farmer's MarketBlueberry Pie 10 Inch1 kg,$11.99ea,,$1.20/ 100g,False,290.0,
bakery,Pita Break,"Morning Rounds, Apple Cinnamon","Pita BreakMorning Rounds, Apple Cinnamon450 g",$4.69ea,,$1.04/ 100g,False,291.0,
bakery,President's Choice,Multigrain Rye Loaf Bread,President's ChoiceMultigrain Rye Loaf Bread480 g,$3.99ea,,$0.83/ 100g,False,292.0,
bakery,Vachon,Ah Caramel,VachonAh Caramel336 g,$4.49ea,$4.19ea,$1.25/ 100g,True,293.0,saleEnds 03/15
bakery,Oroweat,22 Grains & Seeds Thin Sliced Loaf,Oroweat22 Grains & Seeds Thin Sliced Loaf510 g,$6.49ea,,$1.27/ 100g,False,294.0,
bakery,,Strawberry Mascarpone Cake,Strawberry Mascarpone Cake1.86 kg,$26.99ea,,$1.45/ 100g,False,295.0,
bakery,two-bite,Chocolate Cupcakes St.Patrick,two-biteChocolate Cupcakes St.Patrick284 g,$5.29ea,,$1.86/ 100g,False,296.0,
bakery,Ready Bake,Garlic Bread,Ready BakeGarlic Bread330 g,$3.99ea,,$1.21/ 100g,False,297.0,
bakery,La Baguetterie,White Oval,La BaguetterieWhite Oval454 g,$3.79ea,,$0.83/ 100g,False,298.0,
bakery,Schar,Deli Sourdough Bread,ScharDeli Sourdough Bread240 g,$8.79ea,,$3.66/ 100g,False,299.0,
bakery,,"12 Grain Bread, Sliced","12 Grain Bread, Sliced450 g",$3.99ea,,$0.89/ 100g,False,300.0,
bakery,,"Cream Horns, Large","Cream Horns, Large50 g",$1.99ea,,$3.98/ 100g,False,301.0,
bakery,,Bread Challah,Bread Challah450 g,$3.99ea,,$0.89/ 100g,False,302.0,
bakery,,Macadamia Cookies 8-pack,Macadamia Cookies 8-pack336 g,$5.00ea,,$1.49/ 100g,False,303.0,
bakery,Pita Break,"Mini Pitas, Whole Grain Wheat","Pita BreakMini Pitas, Whole Grain Wheat480 g",$3.89ea,,$0.81/ 100g,False,304.0,
bakery,Rudolphs,Light Rye Bread,RudolphsLight Rye Bread680 g,$4.29ea,,$0.63/ 100g,False,305.0,
bakery,Suraj,Naan Garlic Flatbreads,SurajNaan Garlic Flatbreads1 kg,$5.49ea,,$0.55/ 100g,False,306.0,
bakery,Rubschlager,Bavarian Rye Loaf,RubschlagerBavarian Rye Loaf454 g,$3.99ea,,$0.88/ 100g,False,307.0,
bakery,Dempster,100% Whole Grains 12 Grain Bread,Dempster100% Whole Grains 12 Grain Bread600 g,$4.19ea,,$0.70/ 100g,False,308.0,
bakery,Dempster,Signature Four Cheese Bagels,DempsterSignature Four Cheese Bagels375 g,$4.49ea,,$1.20/ 100g,False,309.0,
bakery,,"Cake Slice, Chocolate Fudge","Cake Slice, Chocolate Fudge200 g",$4.00ea,,$2.00/ 100g,False,310.0,
bakery,,"Brownie Chocolate Cheesecake, 8 Inch","Brownie Chocolate Cheesecake, 8 Inch1400 g",$29.99ea,,$2.14/ 100g,False,311.0,
bakery,Farmer's Market,Chocolate Ganache Coffee Cake,Farmer's MarketChocolate Ganache Coffee Cake500 g,$6.00ea,,$1.20/ 100g,False,312.0,
bakery,,Bruschetta,Bruschetta370 g,$4.49ea,,$1.21/ 100g,False,313.0,
bakery,Farmer's Market,Cherry Pie 10 Inch,Farmer's MarketCherry Pie 10 Inch1 kg,$11.99ea,,$1.20/ 100g,False,314.0,
bakery,,Lemon Swirl Cake,Lemon Swirl Cake650 g,$12.99ea,,$2.00/ 100g,False,315.0,
bakery,,"8"" Raspberry Crème Cheese Cake","8"" Raspberry Crème Cheese Cake800 g",$20.99ea,,$2.62/ 100g,False,316.0,
bakery,Farmer's Market,T&S Shortbread Cookies Pk 12  ,Farmer's MarketT&S Shortbread Cookies Pk 12  372 g,$5.99ea,,$1.61/ 100g,False,317.0,
bakery,,Oatmeal Cookies 18 Pk,Oatmeal Cookies 18 Pk756 g,$6.99ea,,$0.92/ 100g,False,318.0,
bakery,,Bread Cheese Sliced,Bread Cheese Sliced470 g,$6.29ea,,$1.34/ 100g,False,319.0,
bakery,Farmer's Market,Waffles,Farmer's MarketWaffles420 g,$6.99ea,,$1.66/ 100g,False,320.0,
bakery,Farmer's Market,Cookies Oatmeal,Farmer's MarketCookies Oatmeal456 g,$5.99ea,,$1.31/ 100g,False,321.0,
bakery,Farmer's Market,Mini Angel Food Cakes,Farmer's MarketMini Angel Food Cakes270 g,$5.99ea,,$2.22/ 100g,False,322.0,
bakery,,1/4 Slab Vanilla Shadow Cake *MINIMUM 24 HOURS NOTICED REQUIRED*,1/4 Slab Vanilla Shadow Cake *MINIMUM 24 HOURS NOTICED REQUIRED*1.76 kg,$27.99ea,,$1.59/ 100g,False,323.0,
bakery,ACE,Olive Oil & Sea Salt Crisps,ACEOlive Oil & Sea Salt Crisps180 g,$6.49ea,,$3.61/ 100g,False,324.0,
bakery,,Sesame Egg Bread,Sesame Egg Bread450 g,$3.99ea,,$0.89/ 100g,False,325.0,
bakery,,White Buns Dinner Rolls,White Buns Dinner Rolls12x1.0 ea,$4.29ea,,$0.36/ 1ea,False,326.0,
bakery,Farmer's Market,Pecan Pie 9 Inch,Farmer's MarketPecan Pie 9 Inch580 g,$11.99ea,,$2.07/ 100g,False,327.0,
bakery,,Bread Cinnamon Raisin Sliced,Bread Cinnamon Raisin Sliced550 g,$4.49ea,,$0.82/ 100g,False,328.0,
bakery,Frontier Bakery,Thick Pouch Whole Wheat Pitas,Frontier BakeryThick Pouch Whole Wheat Pitas425 g,$1.59ea,,$0.37/ 100g,False,329.0,
bakery,Farmer's Market,Brownies,Farmer's MarketBrownies265 g,$4.99ea,,$1.88/ 100g,False,330.0,
bakery,Baxters,Swiss Rolls Strawberry Shortcake,BaxtersSwiss Rolls Strawberry Shortcake402 g,$5.49ea,,$1.37/ 100g,False,331.0,
bakery,ACE,Brioche Bagel,ACEBrioche Bagel272 g,$4.49ea,,$1.65/ 100g,False,332.0,
bakery,Kimberley's Bakeshoppe,"Frosted Sugar Cookies, Maple","Kimberley's BakeshoppeFrosted Sugar Cookies, Maple383 g",$4.99ea,,$1.30/ 100g,False,333.0,
bakery,Farmer's Market,Macaroons,Farmer's MarketMacaroons350 g,$6.49ea,,$1.85/ 100g,False,334.0,
bakery,Farmer's Market,Nanaimo Square,Farmer's MarketNanaimo Square400 g,$6.99ea,,$1.75/ 100g,False,335.0,
bakery,ACE,Sourdough Baguette,ACESourdough Baguette380 g,$3.99ea,,$1.05/ 100g,False,336.0,
bakery,Farmer's Market,Macaroons,Farmer's MarketMacaroons350 g,$6.49ea,,$1.85/ 100g,False,337.0,
bakery,Farmer's Market,Butter Tarts,Farmer's MarketButter Tarts765 g,$8.99ea,,$1.18/ 100g,False,338.0,
bakery,ACE,Multigrain Ciabatta Demi,ACEMultigrain Ciabatta Demi275 g,$2.99ea,,$1.09/ 100g,False,339.0,
bakery,La Baguetterie,Roasted Garlic Oval,La BaguetterieRoasted Garlic Oval398 g,$3.79ea,,$0.95/ 100g,False,340.0,
bakery,PC Blue Menu,100% Whole Wheat Loaf,PC Blue Menu100% Whole Wheat Loaf450 g,$5.19ea,,$1.15/ 100g,False,341.0,
bakery,,Single Macaron,Single Macaron26 g,$2.99ea,,$11.50/ 100g,False,342.0,
bakery,Sha Sha,Shasha Cocoa Snaps,Sha ShaShasha Cocoa Snaps300x300.0 g,$6.99ea,,$2.33/ 100g,False,343.0,
bakery,Farmer's Market,Lemon Squares,Farmer's MarketLemon Squares400 g,$6.99ea,,$1.75/ 100g,False,344.0,
bakery,,"Pumpkin Pie, 8 Inch","Pumpkin Pie, 8 Inch680 g",$6.79ea,,$1.00/ 100g,False,345.0,
bakery,,"Lemon Mousse Cake, 8 Inch","Lemon Mousse Cake, 8 Inch1250 g",$29.99ea,,$2.40/ 100g,False,346.0,
bakery,Farmer's Market,Vanilla Cake,Farmer's MarketVanilla Cake490 g,$6.99ea,,$1.43/ 100g,False,347.0,
bakery,Dimpflmeier,Munich Style Rye Bread,DimpflmeierMunich Style Rye Bread500 g,$4.49ea,,$0.90/ 100g,False,348.0,
bakery,,"6"" Grand Maman Marie Sponge Flan","6"" Grand Maman Marie Sponge Flan100 g",$3.29ea,,$3.29/ 100g,False,349.0,
bakery,La Tortilla Factory,Tortillas Whole Wheat,La Tortilla FactoryTortillas Whole Wheat496 g,$7.49ea,,$1.51/ 100g,False,350.0,
bakery,Schar,Deli Seeded Bread,ScharDeli Seeded Bread240 g,$8.79ea,,$3.66/ 100g,False,351.0,
bakery,,Old Fashioned Lemon Pie ,Old Fashioned Lemon Pie 114 g,$1.79ea,,$1.57/ 100g,False,352.0,
bakery,Farmer's Market,Brownies,Farmer's MarketBrownies265 g,$4.99ea,,$1.88/ 100g,False,353.0,
bakery,ACE,Brioche Bagel,ACEBrioche Bagel272 g,$4.49ea,,$1.65/ 100g,False,354.0,
bakery,Kimberley's Bakeshoppe,"Frosted Sugar Cookies, Maple","Kimberley's BakeshoppeFrosted Sugar Cookies, Maple383 g",$4.99ea,,$1.30/ 100g,False,355.0,
bakery,Farmer's Market,Nanaimo Square,Farmer's MarketNanaimo Square400 g,$6.99ea,,$1.75/ 100g,False,356.0,
bakery,Baxters,Swiss Rolls Strawberry Shortcake,BaxtersSwiss Rolls Strawberry Shortcake402 g,$5.49ea,,$1.37/ 100g,False,357.0,
bakery,,White Buns Dinner Rolls,White Buns Dinner Rolls12x1.0 ea,$4.29ea,,$0.36/ 1ea,False,358.0,
bakery,Farmer's Market,Chocolate Ganache Coffee Cake,Farmer's MarketChocolate Ganache Coffee Cake500 g,$6.00ea,,$1.20/ 100g,False,359.0,
bakery,,Bruschetta,Bruschetta370 g,$4.49ea,,$1.21/ 100g,False,360.0,
bakery,Farmer's Market,Cherry Pie 10 Inch,Farmer's MarketCherry Pie 10 Inch1 kg,$11.99ea,,$1.20/ 100g,False,361.0,
bakery,,Lemon Swirl Cake,Lemon Swirl Cake650 g,$12.99ea,,$2.00/ 100g,False,362.0,
bakery,,"8"" Raspberry Crème Cheese Cake","8"" Raspberry Crème Cheese Cake800 g",$20.99ea,,$2.62/ 100g,False,363.0,
bakery,Farmer's Market,T&S Shortbread Cookies Pk 12  ,Farmer's MarketT&S Shortbread Cookies Pk 12  372 g,$5.99ea,,$1.61/ 100g,False,364.0,
bakery,,Bread Cheese Sliced,Bread Cheese Sliced470 g,$6.29ea,,$1.34/ 100g,False,365.0,
bakery,Farmer's Market,Waffles,Farmer's MarketWaffles420 g,$6.99ea,,$1.66/ 100g,False,366.0,
bakery,,Oatmeal Cookies 18 Pk,Oatmeal Cookies 18 Pk756 g,$6.99ea,,$0.92/ 100g,False,367.0,
bakery,,"Cake Slice, Chocolate Fudge","Cake Slice, Chocolate Fudge200 g",$4.00ea,,$2.00/ 100g,False,368.0,
bakery,,"Brownie Chocolate Cheesecake, 8 Inch","Brownie Chocolate Cheesecake, 8 Inch1400 g",$29.99ea,,$2.14/ 100g,False,369.0,
bakery,,Glazed Croissant Donut 6 pack,Glazed Croissant Donut 6 pack450 g,$7.99ea,,$1.78/ 100g,False,370.0,
bakery,Frontier Bakery,Thick Pouch Whole Wheat Pitas,Frontier BakeryThick Pouch Whole Wheat Pitas425 g,$1.59ea,,$0.37/ 100g,False,371.0,
bakery,,Bread Cinnamon Raisin Sliced,Bread Cinnamon Raisin Sliced550 g,$4.49ea,,$0.82/ 100g,False,372.0,
bakery,Farmer's Market,Cookies Oatmeal,Farmer's MarketCookies Oatmeal456 g,$5.99ea,,$1.31/ 100g,False,373.0,
bakery,Farmer's Market,Mini Angel Food Cakes,Farmer's MarketMini Angel Food Cakes270 g,$5.99ea,,$2.22/ 100g,False,374.0,
bakery,,1/4 Slab Vanilla Shadow Cake *MINIMUM 24 HOURS NOTICED REQUIRED*,1/4 Slab Vanilla Shadow Cake *MINIMUM 24 HOURS NOTICED REQUIRED*1.76 kg,$27.99ea,,$1.59/ 100g,False,375.0,
bakery,ACE,Olive Oil & Sea Salt Crisps,ACEOlive Oil & Sea Salt Crisps180 g,$6.49ea,,$3.61/ 100g,False,376.0,
bakery,,Sesame Egg Bread,Sesame Egg Bread450 g,$3.99ea,,$0.89/ 100g,False,377.0,
bakery,ACE,Sesame Baguette,ACESesame Baguette325 g,$3.99ea,,$1.23/ 100g,False,378.0,
bakery,Farmer's Market,Black Forest Cake,Farmer's MarketBlack Forest Cake750 g,$15.99ea,,$2.13/ 100g,False,379.0,
bakery,,"Apple Pie, 8 Inch","Apple Pie, 8 Inch750 g",$6.79ea,,$0.91/ 100g,False,380.0,
bakery,ACE,Sourdough Baguette,ACESourdough Baguette380 g,$3.99ea,,$1.05/ 100g,False,381.0,
bakery,,"Crusty Bread, French Sliced","Crusty Bread, French Sliced450 g",$2.99ea,,$0.66/ 100g,False,382.0,
bakery,Rudolphs,Bavarian Dark Caraway Bread,RudolphsBavarian Dark Caraway Bread500 g,$4.29ea,,$0.86/ 100g,False,383.0,
bakery,Stonemill,Bread Honest Wellness Cranberry Pumpkin Seed ,StonemillBread Honest Wellness Cranberry Pumpkin Seed 454 g,$5.69ea,,$1.25/ 100g,False,384.0,
bakery,ACE,Sesame Baguette,ACESesame Baguette325 g,$3.99ea,,$1.23/ 100g,False,385.0,
bakery,Farmer's Market,Black Forest Cake,Farmer's MarketBlack Forest Cake750 g,$15.99ea,,$2.13/ 100g,False,386.0,
bakery,Stonemill,Bread Honest Wellness Cranberry Pumpkin Seed ,StonemillBread Honest Wellness Cranberry Pumpkin Seed 454 g,$5.69ea,,$1.25/ 100g,False,387.0,
bakery,,"Apple Pie, 8 Inch","Apple Pie, 8 Inch750 g",$6.79ea,,$0.91/ 100g,False,388.0,
bakery,,Apple Turnover 4-pack,Apple Turnover 4-pack280 g,$4.99ea,,$1.78/ 100g,False,389.0,
bakery,Frontier Bakery,White Bread Greek Pitas,Frontier BakeryWhite Bread Greek Pitas425 g,$1.59ea,,$0.37/ 100g,False,390.0,
bakery,ACE,Olive Ciabatta,ACEOlive Ciabatta225 g,$3.29ea,,$1.46/ 100g,False,391.0,
bakery,Farmer's Market,Lemon Squares,Farmer's MarketLemon Squares400 g,$6.99ea,,$1.75/ 100g,False,392.0,
bakery,Farmer's Market,Fudge Square,Farmer's MarketFudge Square400 g,$6.99ea,,$1.75/ 100g,False,393.0,
bakery,Rubschlager,Bavarian Multigrain Loaf,RubschlagerBavarian Multigrain Loaf454 g,$3.99ea,,$0.88/ 100g,False,394.0,
bakery,President's Choice,Whole Wheat Naan Rounds Buns,President's ChoiceWhole Wheat Naan Rounds Buns480 g,$4.59ea,$4.39ea,$0.91/ 100g,True,395.0,saleEnds 03/22
bakery,President's Choice,Extra Thick Sliced Cinnamon Bread with Raisins,President's ChoiceExtra Thick Sliced Cinnamon Bread with Raisins675 g,$4.99ea,,$0.74/ 100g,False,396.0,
bakery,Country Harvest,Sourdough Bagel,Country HarvestSourdough Bagel450 g,$4.49ea,,$1.00/ 100g,False,397.0,
bakery,DItaliano,Brizzolio Hamburger Buns,DItalianoBrizzolio Hamburger Buns528 g,$3.99ea,,$0.76/ 100g,False,398.0,
bakery,DItaliano,Brioche-Style Sausage Buns,DItalianoBrioche-Style Sausage Buns420 g,$3.99ea,,$0.95/ 100g,False,399.0,
bakery,Lanthier,Croissant Mini'S ,LanthierCroissant Mini'S 14x210.0 g,$5.49ea,,$2.61/ 100g,False,400.0,
bakery,President's Choice,Original Mini Bagel,President's ChoiceOriginal Mini Bagel380 g,$3.49ea,,$0.92/ 100g,False,401.0,
bakery,Casa Mendosa,Large Spinach Tortillas,Casa MendosaLarge Spinach Tortillas384 g,$4.79ea,,$1.25/ 100g,False,402.0,
bakery,Country Harvest,No Sugar Whole Wheat,Country HarvestNo Sugar Whole Wheat600 g,$4.49ea,,$0.75/ 100g,False,403.0,
bakery,Farmer's Market,Pumpkin Pie 10 Inch,Farmer's MarketPumpkin Pie 10 Inch900 g,$11.99ea,,$1.33/ 100g,False,404.0,
bakery,Weston,"Texas Toast Bread, 100% Whole Wheat","WestonTexas Toast Bread, 100% Whole Wheat675 g",$3.99ea,,$0.59/ 100g,False,405.0,
bakery,President's Choice,Gigantico Sausage Buns,President's ChoiceGigantico Sausage Buns432 g,$4.29ea,,$0.99/ 100g,False,406.0,
bakery,Rudolphs,Bavarian Poppy Seed & Bran Bread,RudolphsBavarian Poppy Seed & Bran Bread500 g,$4.29ea,,$0.86/ 100g,False,407.0,
bakery,Farmer's Market,"Loaf Cake, Cinnamon Swirl","Farmer's MarketLoaf Cake, Cinnamon Swirl390 g",$6.29ea,,$1.61/ 100g,False,408.0,
bakery,Molinaro's,"Pizza Starter Kit, Thin Crust","Molinaro'sPizza Starter Kit, Thin Crust620 g",$5.99ea,,$0.97/ 100g,False,409.0,
bakery,Stonemill,Wholesome Bread Loaf 21 Grains ,StonemillWholesome Bread Loaf 21 Grains 454 g,$5.69ea,,$1.25/ 100g,False,410.0,
bakery,Charlottes,Real Chocolate Brownie Bites,CharlottesReal Chocolate Brownie Bites290 g,$4.99ea,,$1.72/ 100g,False,411.0,
bakery,ACE,Cranberry Focaccia ,ACECranberry Focaccia 320 g,$6.99ea,,$2.18/ 100g,False,412.0,
bakery,,"Cake Slice, Chocolate Truffle","Cake Slice, Chocolate Truffle120 g",$4.00ea,,$3.33/ 100g,False,413.0,
bakery,Farmer's Market,Lemon Cranberry Muffins,Farmer's MarketLemon Cranberry Muffins600 g,$6.99ea,,$1.17/ 100g,False,414.0,
bakery,ACE,ACE White Demi Baguette,ACEACE White Demi Baguette200 g,$2.99ea,,$1.50/ 100g,False,415.0,
bakery,,"Sesame Egg Bread, Sliced","Sesame Egg Bread, Sliced450 g",$3.99ea,,$0.89/ 100g,False,416.0,
bakery,Farmer's Market,Assorted Mini Tarts,Farmer's MarketAssorted Mini Tarts300 g,$7.99ea,$6.99ea,$2.33/ 100g,True,417.0,saleEnds 03/15
bakery,ACE,Parmesan Crostino,ACEParmesan Crostino125 g,$5.49ea,,$4.39/ 100g,False,418.0,
bakery,,Cinnamon Twist Donut 6 pack,Cinnamon Twist Donut 6 pack690 g,$7.99ea,,$1.16/ 100g,False,419.0,
bakery,ACE,White Baguette Bagel,ACEWhite Baguette Bagel300 g,$4.49ea,,$1.50/ 100g,False,420.0,
bakery,,Corn Popped Grains,Corn Popped Grains120 g,$5.49ea,,$4.58/ 100g,False,421.0,
bakery,,"Mini Danish, Assorted - 8 pack","Mini Danish, Assorted - 8 pack412 g",$5.49ea,,$1.33/ 100g,False,422.0,
bakery,Schar,Gluten-free Hamburger Buns,ScharGluten-free Hamburger Buns300 g,$7.99ea,,$2.66/ 100g,False,423.0,
bakery,PC Blue Menu,Multigrain Loaf With Quinoa,PC Blue MenuMultigrain Loaf With Quinoa450 g,$5.19ea,,$1.15/ 100g,False,424.0,
bakery,President's Choice,"Flatbread, Original","President's ChoiceFlatbread, Original300 g",$3.09ea,,$1.03/ 100g,False,425.0,
bakery,Dimpflmeier,Rye Bread With Sunflower Seeds,DimpflmeierRye Bread With Sunflower Seeds454 g,$4.99ea,,$1.10/ 100g,False,426.0,
bakery,Dempster,Bread,DempsterBread600 g,$4.19ea,,$0.70/ 100g,False,427.0,
bakery,,Mini Cheese Cake  with Fruit Top,Mini Cheese Cake  with Fruit Top90 g,$1.99ea,,$2.21/ 100g,False,428.0,
bakery,,Cherry Turnover 4-Pack,Cherry Turnover 4-Pack280 g,$4.99ea,,$1.78/ 100g,False,429.0,
bakery,,"6"" Chocolate Brownie Cheesecake","6"" Chocolate Brownie Cheesecake600 g",$20.99ea,,$3.50/ 100g,False,430.0,
bakery,,"Flax Bread, Sliced","Flax Bread, Sliced450 g",$3.99ea,,$0.89/ 100g,False,431.0,
bakery,Gestion Touche,Vanilla Sunny Shell Cakes,Gestion ToucheVanilla Sunny Shell Cakes23.67 g,$3.29ea,,$2.32/ 100g,False,432.0,
bakery,,Cookies and Cream 8inch Cake,Cookies and Cream 8inch Cake1.2 kg,$27.99ea,,$2.33/ 100g,False,433.0,
bakery,Stonemill,Naturally Fermented Slow Crafted Wholesome Bread Loaf Plant-Based Protein,StonemillNaturally Fermented Slow Crafted Wholesome Bread Loaf Plant-Based Protein454 g,$5.69ea,,$1.25/ 100g,False,434.0,
bakery,President's Choice,Protein Tortillas,President's ChoiceProtein Tortillas342 g,$4.29ea,,$1.25/ 100g,False,435.0,
bakery,,"Flax Bread, Sliced","Flax Bread, Sliced450 g",$3.99ea,,$0.89/ 100g,False,436.0,
bakery,,"Cake Slice, Chocolate Truffle","Cake Slice, Chocolate Truffle120 g",$4.00ea,,$3.33/ 100g,False,437.0,
bakery,,"Chocolate Fudge Cake 8""","Chocolate Fudge Cake 8""1500 g",$29.99ea,,$2.00/ 100g,False,438.0,
bakery,Paneriso,Banana Chocolate Chip Muffins,PanerisoBanana Chocolate Chip Muffins372 g,$8.49ea,,$2.28/ 100g,False,439.0,
bakery,,"Carrot Cake, 8 Inch","Carrot Cake, 8 Inch1700 g",$29.99ea,,$1.76/ 100g,False,440.0,
bakery,La Baguetterie,White Baguette,La BaguetterieWhite Baguette326 g,$3.79ea,,$1.16/ 100g,False,441.0,
bakery,Pita Break,"Mini Pitas, Regular","Pita BreakMini Pitas, Regular450 g",$3.89ea,,$0.86/ 100g,False,442.0,
bakery,President's Choice,Multigrain Pizza Crusts,President's ChoiceMultigrain Pizza Crusts440 g,$4.29ea,,$0.93/ 100g,False,443.0,
bakery,Farmer's Market,"Tea Biscuits, Original","Farmer's MarketTea Biscuits, Original315 g",$6.29ea,,$2.00/ 100g,False,444.0,
bakery,ACE,Roasted Garlic Oval,ACERoasted Garlic Oval454 g,$5.99ea,,$1.32/ 100g,False,445.0,
bakery,,"Caramel Apple Pie, 8 Inch","Caramel Apple Pie, 8 Inch680 g",$6.79ea,,$1.00/ 100g,False,446.0,
bakery,,Bread Bruschetta,Bread Bruschetta360 g,$3.49ea,,$0.97/ 100g,False,447.0,
bakery,,"Bread, Farmers Crusty French , Sliced","Bread, Farmers Crusty French , Sliced450 g",$2.79ea,,$0.62/ 100g,False,448.0,
bakery,ACE,Everything Baguette Bagel,ACEEverything Baguette Bagel360 g,$4.49ea,,$1.25/ 100g,False,449.0,
bakery,President's Choice,Blueberry Mini Muffins,President's ChoiceBlueberry Mini Muffins336 g,$5.69ea,,$1.69/ 100g,False,450.0,
bakery,Farmer's Market,Mini Cinnamon Rolls,Farmer's MarketMini Cinnamon Rolls9x30.0 g,$6.29ea,,$2.33/ 100g,False,451.0,
bakery,President's Choice,European Multi Grain Rustic Bread,President's ChoiceEuropean Multi Grain Rustic Bread500 g,$3.99ea,,$0.80/ 100g,False,452.0,
bakery,Country Harvest,Whole Grains Bread No Sugar Added,Country HarvestWhole Grains Bread No Sugar Added600 g,$4.49ea,,$0.75/ 100g,False,453.0,
bakery,Vachon,Jos Louis The Original Cakes,VachonJos Louis The Original Cakes324 g,$4.49ea,$4.19ea,$1.29/ 100g,True,454.0,saleEnds 03/15
bakery,School Safe,Muffin Bars Birthday Cake,School SafeMuffin Bars Birthday Cake296 g,$4.29ea,,$1.45/ 100g,False,455.0,
bakery,Vachon,Jelly Log Rolled Sponge Cakes,VachonJelly Log Rolled Sponge Cakes288 g,$4.49ea,$4.19ea,$1.45/ 100g,True,456.0,saleEnds 03/15
bakery,Sara Lee,Little Bites Chocolate Chip Muffins,Sara LeeLittle Bites Chocolate Chip Muffins234 g,$4.04ea,$3.89ea,$1.66/ 100g,True,457.0,saleEnds 03/15
bakery,Wonder,Wrap Me White Flour Tortillas Large ,WonderWrap Me White Flour Tortillas Large 640 g,$4.79ea,,$0.75/ 100g,False,458.0,
bakery,DItaliano,Sausage Buns Brizzolio Extra Soft,DItalianoSausage Buns Brizzolio Extra Soft420 g,$3.99ea,,$0.95/ 100g,False,459.0,
bakery,PC Blue Menu,Multigrain English Muffins,PC Blue MenuMultigrain English Muffins342 g,$3.29ea,,$0.96/ 100g,False,460.0,
