category,brand,product_text,product_name,price_text,sale_price,per_unit_price_text,is_sale,sale_valid_to
dairy_and_eggs,Activia,"Yogurt With Probiotics, Blueberry Flavour","ActiviaYogurt With Probiotics, Blueberry Flavour650 g",$3.99ea,,$0.61/ 100g,False,
dairy_and_eggs,Silk,"Plant Based Dairy Free Coconut Yogurt, Vanilla Flavour, 4 pack","SilkPlant Based Dairy Free Coconut Yogurt, Vanilla Flavour, 4 pack100 g",$4.29ea,$3.99ea,$3.99/ 100g,True,saleEnds 03/08
dairy_and_eggs,Activia,"Yogurt With Probiotics, Strawberry, Raspberry, Vanilla, Blueberry Flavour, 24XG","ActiviaYogurt With Probiotics, Strawberry, Raspberry, Vanilla, Blueberry Flavour, 24XG24x100.0 g",$13.99ea,,$0.58/ 100g,False,
dairy_and_eggs,Activia,"Yogurt With Probiotics, Strawberry Flavour","ActiviaYogurt With Probiotics, Strawberry Flavour12x100.0 g",$8.49ea,,$0.71/ 100g,False,
dairy_and_eggs,Lactantia,Partly Skimmed Milk Organic 1% M.F.,LactantiaPartly Skimmed Milk Organic 1% M.F.1.5 l,$6.29ea,,$0.42/ 100ml,False,
dairy_and_eggs,PC Organics,Organics Stirred Yogurt Plain 10 % M.F. ,PC OrganicsOrganics Stirred Yogurt Plain 10 % M.F. 500 g,$4.99ea,,$1.00/ 100g,False,
dairy_and_eggs,International Delight,"Zero Sugar Hazelnut Coffee Creamer,","International DelightZero Sugar Hazelnut Coffee Creamer,946 ml",$5.99ea,,$0.63/ 100ml,False,
dairy_and_eggs,Philadelphia,Herb & Garlic Cream Cheese Product,PhiladelphiaHerb & Garlic Cream Cheese Product340 g,$7.99ea,,$2.35/ 100g,False,
dairy_and_eggs,Gay Lea,"Real Whipped Cream, Light","Gay LeaReal Whipped Cream, Light225 g",$4.49ea,,$2.00/ 100g,False,
dairy_and_eggs,Starbucks,Caramel Macchiato Liquid Coffee Enhancer,StarbucksCaramel Macchiato Liquid Coffee Enhancer828 ml,$7.99ea,,$0.96/ 100ml,False,
dairy_and_eggs,Neilson,Trutaste Homogenized Milk,NeilsonTrutaste Homogenized Milk4 l,$6.99ea,$6.69ea,$0.17/ 100ml,True,saleEnds 03/22
dairy_and_eggs,International Delight,"Caramel Waffle Cookie Coffee Enhancer, Limited Edition","International DelightCaramel Waffle Cookie Coffee Enhancer, Limited Edition946 ml",$5.99ea,,$0.63/ 100ml,False,
dairy_and_eggs,Neilson,Homogenized Milk 3.25%,NeilsonHomogenized Milk 3.25%4 l,$6.89ea,,$0.17/ 100ml,False,
dairy_and_eggs,Neilson,Table Cream,NeilsonTable Cream1 l,$7.19ea,,$0.72/ 100ml,False,
dairy_and_eggs,Natrel,Lactose Free Fat Free Skim 0% Dairy Product (2L),NatrelLactose Free Fat Free Skim 0% Dairy Product (2L)2 l,$6.89ea,,$0.34/ 100ml,False,
dairy_and_eggs,No Name,Pasteurized Light Cream Cheese Spread,No NamePasteurized Light Cream Cheese Spread250 g,$3.99ea,,$1.60/ 100g,False,
dairy_and_eggs,President's Choice,Cheddar Cheese with Habanero,President's ChoiceCheddar Cheese with Habanero400 g,$6.49ea,,$1.62/ 100g,False,
dairy_and_eggs,Milk 2 Go,Chocolate,Milk 2 GoChocolate473 ml,$2.69ea,$1.79ea,$0.38/ 100ml,True,saleEnds 03/08
dairy_and_eggs,Neilson,2% Milk,Neilson2% Milk1 l,$3.49ea,,$0.35/ 100ml,False,
dairy_and_eggs,Danone,Strawberry Flavoured Paw Patrol Yogurt Drink For Kids,DanoneStrawberry Flavoured Paw Patrol Yogurt Drink For Kids8x93.0 ml,$5.99ea,,$0.81/ 100ml,False,
dairy_and_eggs,President's Choice,Raspberry Skyr Icelandic Style 4% M.F. Yogurt,President's ChoiceRaspberry Skyr Icelandic Style 4% M.F. Yogurt500 g,$6.29ea,,$1.26/ 100g,False,
dairy_and_eggs,Starbucks,Almond And Oat Dairy Free Caramel Macchiato Coffee Enhancer,StarbucksAlmond And Oat Dairy Free Caramel Macchiato Coffee Enhancer828 ml,$7.99ea,,$0.96/ 100ml,False,
dairy_and_eggs,Imperial,Margarine Club Pack,ImperialMargarine Club Pack1.36 kg,$8.99ea,,$0.71/ 100g,False,
dairy_and_eggs,Philadelphia,Original Cream Cheese Product,PhiladelphiaOriginal Cream Cheese Product227 g,$5.49ea,,$2.42/ 100g,False,
dairy_and_eggs,PC Blue Menu,Original Margarine,PC Blue MenuOriginal Margarine1.81 kg,$11.99ea,,$0.66/ 100g,False,
dairy_and_eggs,PC Organics,Organic Partly Skimmed 1% Milk,PC OrganicsOrganic Partly Skimmed 1% Milk2 l,$7.09ea,,$0.35/ 100ml,False,
dairy_and_eggs,Neilson,TruTaste Skim Milk,NeilsonTruTaste Skim Milk4 l,$6.29ea,,$0.16/ 100ml,False,
dairy_and_eggs,Lactantia,"Butter Sticks, Salted","LactantiaButter Sticks, Salted4x113.0 g",$8.99ea,,$1.99/ 100g,False,
dairy_and_eggs,President's Choice,Berries & Cherries Skyr Icelandic Style 0% M.F. Yogurt,President's ChoiceBerries & Cherries Skyr Icelandic Style 0% M.F. Yogurt500 g,$6.29ea,,$1.26/ 100g,False,
dairy_and_eggs,President's Choice,Black Cherry Skyr Icelandic Style 4% M.F. Yogurt,President's ChoiceBlack Cherry Skyr Icelandic Style 4% M.F. Yogurt500 g,$6.29ea,,$1.26/ 100g,False,
dairy_and_eggs,Neilson,Partly Skimmed Milk 1% MF,NeilsonPartly Skimmed Milk 1% MF4 l,$5.89ea,,$0.15/ 100ml,False,
dairy_and_eggs,Becel,Margarine Vegan,BecelMargarine Vegan454 g,$5.49ea,,$1.29/ 100g,False,
dairy_and_eggs,PC Blue Menu,Blue Menu Original Margarine,PC Blue MenuBlue Menu Original Margarine454 g,$4.79ea,$3.99ea,$0.88/ 100g,True,saleEnds 03/01
dairy_and_eggs,Neilson,TruTaste 1% Milk,NeilsonTruTaste 1% Milk1 l,$4.19ea,,$0.42/ 100ml,False,
dairy_and_eggs,International Delight,Irish Creme Coffee Creamer,International DelightIrish Creme Coffee Creamer946 ml,$5.99ea,,$0.63/ 100ml,False,
dairy_and_eggs,Philadelphia,Light Cream Cheese,PhiladelphiaLight Cream Cheese450 g,$9.49ea,,$2.11/ 100g,False,
dairy_and_eggs,Becel,Margarine Vegan,BecelMargarine Vegan850 g,$9.29ea,$6.99ea,$0.82/ 100g,True,saleEnds 03/01
dairy_and_eggs,International Delight,"French Vanilla Flavoured Fat Free Coffee Creamer, 63 Servings","International DelightFrench Vanilla Flavoured Fat Free Coffee Creamer, 63 Servings946 ml",$5.99ea,,$0.63/ 100ml,False,
dairy_and_eggs,Fairlife,Lactose Free Skim Ultrafiltered Milk,FairlifeLactose Free Skim Ultrafiltered Milk1.5 l,$5.79ea,,$0.39/ 100ml,False,
dairy_and_eggs,Becel,Margarine Original,BecelMargarine Original1.7 kg,$16.99ea,,$1.00/ 100g,False,
dairy_and_eggs,Neilson,"Chocolate Milk, 25% Less Sugar","NeilsonChocolate Milk, 25% Less Sugar1 l",$3.49ea,$1.99ea,$0.20/ 100ml,True,saleEnds 03/08
dairy_and_eggs,Oikos,"Greek Yogurtimited Edition, Vanilla Chai Flavour, 4X100G","OikosGreek Yogurtimited Edition, Vanilla Chai Flavour, 4X100G4x100.0 g",$4.79ea,,$1.20/ 100g,False,
dairy_and_eggs,Oikos,"Greek Yogurt, Raspberry-Pomegramate Flavour, Fruit On Bottom, 2% M.F.,","OikosGreek Yogurt, Raspberry-Pomegramate Flavour, Fruit On Bottom, 2% M.F.,4x100.0 g",$4.79ea,,$1.20/ 100g,False,
dairy_and_eggs,IOGO,Yogurt Maple Syrup 3.2% M.F.,IOGOYogurt Maple Syrup 3.2% M.F.650 g,$3.49ea,,$0.54/ 100g,False,
dairy_and_eggs,Oikos,"Extra Creamy Greek Yogurt, Cappuccino On The Bottom, 9% M.F.","OikosExtra Creamy Greek Yogurt, Cappuccino On The Bottom, 9% M.F.4x95.0 g",$4.79ea,,$1.26/ 100g,False,
dairy_and_eggs,President's Choice,Plain 2% M.F. Greek Yogurt,President's ChoicePlain 2% M.F. Greek Yogurt500 g,$6.49ea,,$1.30/ 100g,False,
dairy_and_eggs,Oikos,"Extra Creamy Greek Yogurt, Black Cherry, Fruit On The Bottom, 9% M.F.","OikosExtra Creamy Greek Yogurt, Black Cherry, Fruit On The Bottom, 9% M.F.4x95.0 g",$4.79ea,,$1.26/ 100g,False,
dairy_and_eggs,No Name,Pizza Mozzarella Cheese with 28% M.F.,No NamePizza Mozzarella Cheese with 28% M.F.400 g,$5.99ea,,$1.50/ 100g,False,
dairy_and_eggs,Miyoko's,Butter Cultured Vegan    ,Miyoko'sButter Cultured Vegan    227 g,$7.99ea,,$3.52/ 100g,False,
dairy_and_eggs,Activia,"Probiotic Smoothie, Blueberry, Strawberry, & Beet, Drinkable Yogurt","ActiviaProbiotic Smoothie, Blueberry, Strawberry, & Beet, Drinkable Yogurt190 ml",$2.29ea,,$1.21/ 100ml,False,
dairy_and_eggs,Activia,"Probiotic Yogurt, Strawberry/Wildberry/Mango Flavour","ActiviaProbiotic Yogurt, Strawberry/Wildberry/Mango Flavour12x100.0 g",$8.49ea,,$0.71/ 100g,False,
dairy_and_eggs,Yoplait,Vanilla Yogurt,YoplaitVanilla Yogurt200 ml,$1.69ea,,$0.85/ 100ml,False,
dairy_and_eggs,Yoplait,"Yogurt Tubes, Strawberry Banana & Fruit Punch","YoplaitYogurt Tubes, Strawberry Banana & Fruit Punch8x56.0 g",$4.79ea,,$1.07/ 100g,False,
dairy_and_eggs,Earth Balance,Original Buttery Spread,Earth BalanceOriginal Buttery Spread425 g,$5.99ea,,$1.41/ 100g,False,
dairy_and_eggs,PC Organics,Organic Partly Skimmed 2% Milk,PC OrganicsOrganic Partly Skimmed 2% Milk4 l,$10.69ea,,$0.27/ 100ml,False,
dairy_and_eggs,Yoplait,Yop Drinkable Yogurt Tropical Flavour,YoplaitYop Drinkable Yogurt Tropical Flavour200 ml,$1.69ea,,$0.85/ 100ml,False,
dairy_and_eggs,PC Organics,Organic Mozzarella,PC OrganicsOrganic Mozzarella200 g,$6.49ea,,$3.25/ 100g,False,
dairy_and_eggs,Lactantia,Organic 2% M.F.,LactantiaOrganic 2% M.F.1.5 l,$6.29ea,,$0.42/ 100ml,False,
dairy_and_eggs,Oikos,"Drinkable Greek Yogurt With Vanilla, Apricot, Oats, & Seeds, 9G Protein","OikosDrinkable Greek Yogurt With Vanilla, Apricot, Oats, & Seeds, 9G Protein190 ml",$2.29ea,,$1.21/ 100ml,False,
dairy_and_eggs,Liberte,Greek Vanilla Large Size 0 % M.F. Yogourt,LiberteGreek Vanilla Large Size 0 % M.F. Yogourt1 kg,$9.79ea,,$0.98/ 100g,False,
dairy_and_eggs,President's Choice,"Plant Based Cultured Coconut Milk Yogurt Alternative, Blueberry","President's ChoicePlant Based Cultured Coconut Milk Yogurt Alternative, Blueberry500 g",$4.79ea,,$0.96/ 100g,False,
dairy_and_eggs,Vegenaise,Original,VegenaiseOriginal473 ml,$6.99ea,,$1.48/ 100ml,False,
dairy_and_eggs,Danone,"Two Good Greek Yogurt, Strawberry Yogurt 4 Pack, Blended, 2% MF","DanoneTwo Good Greek Yogurt, Strawberry Yogurt 4 Pack, Blended, 2% MF380 g",$3.99ea,,$1.05/ 100g,False,
dairy_and_eggs,JUST Egg,Plant Based Egg,JUST EggPlant Based Egg355 ml,$7.49ea,,$2.20/ 100ml,False,
dairy_and_eggs,Activia,"Yogurt With Probiotics, Fieldberry Flavour Tub","ActiviaYogurt With Probiotics, Fieldberry Flavour Tub650 g",$3.99ea,,$0.61/ 100g,False,
dairy_and_eggs,Astro,"Biobest Probiotic Yogurt, Plain","AstroBiobest Probiotic Yogurt, Plain750 g",$4.79ea,$3.99ea,$0.53/ 100g,True,saleEnds 03/01
dairy_and_eggs,PC Organics,Dairy-Free Coconut Milk Kefir,PC OrganicsDairy-Free Coconut Milk Kefir1000 ml,$5.49ea,,$0.55/ 100ml,False,
dairy_and_eggs,Liberte,Greek Lactose Free Vanilla 0% MF Yogurt,LiberteGreek Lactose Free Vanilla 0% MF Yogurt750 g,$6.49ea,,$0.87/ 100g,False,
dairy_and_eggs,Danone,"Two Good Greek Yogurt, Vanilla Yogurt 4 Pack, Blended, 2% MF","DanoneTwo Good Greek Yogurt, Vanilla Yogurt 4 Pack, Blended, 2% MF380 g",$3.99ea,,$1.05/ 100g,False,
dairy_and_eggs,Yoplait,Yop Drinkable Yogurt Strawberry Flavour ,YoplaitYop Drinkable Yogurt Strawberry Flavour 200 ml,$1.69ea,,$0.85/ 100ml,False,
dairy_and_eggs,IOGO,Nanö 1% Lactose Free Apple-Grape Drinkable Yogurt,IOGONanö 1% Lactose Free Apple-Grape Drinkable Yogurt6x93.0 ml,$3.99ea,,$0.72/ 100ml,False,
dairy_and_eggs,Activia,"Yogurt With Probioticsactose Free, Strawberry, Blueberry, Peach, Mango Flavour, 12XG","ActiviaYogurt With Probioticsactose Free, Strawberry, Blueberry, Peach, Mango Flavour, 12XG12x100.0 g",$8.49ea,,$0.71/ 100g,False,
dairy_and_eggs,Oikos,"High Protein Greek Yogurt, Zesty Lemon & Lime Flavour, Blended, Value Tub","OikosHigh Protein Greek Yogurt, Zesty Lemon & Lime Flavour, Blended, Value Tub650 g",$6.99ea,,$1.08/ 100g,False,
dairy_and_eggs,Danone,"Two Good Greek Yogurt, Vanilla Yogurt Tub, Blended, 2% MF","DanoneTwo Good Greek Yogurt, Vanilla Yogurt Tub, Blended, 2% MF625 g",$5.49ea,,$0.88/ 100g,False,
dairy_and_eggs,Midday Squares,Functional Chocolate Bar Almond Crunch,Midday SquaresFunctional Chocolate Bar Almond Crunch33 g,$2.99ea,,$9.06/ 100g,False,
dairy_and_eggs,Liberte,Greek Lactose Free Plain 0% MF Yogurt,LiberteGreek Lactose Free Plain 0% MF Yogurt750 g,$6.49ea,,$0.87/ 100g,False,
dairy_and_eggs,Yoplait,Tubes Peach Blueberry Yogurt,YoplaitTubes Peach Blueberry Yogurt8x56.0 g,$4.79ea,,$1.07/ 100g,False,
dairy_and_eggs,siggi's,Simple Ingredient Skyr Black Cherry 2% M.F.,siggi'sSimple Ingredient Skyr Black Cherry 2% M.F.650 g,$7.79ea,,$1.20/ 100g,False,
dairy_and_eggs,Astro,"Original Balkan Style Yogurt, Plain 2%","AstroOriginal Balkan Style Yogurt, Plain 2%750 g",$4.49ea,$3.99ea,$0.53/ 100g,True,saleEnds 03/01
dairy_and_eggs,siggi's,Coffee Creamy Skyr 3.25% M.F.,siggi'sCoffee Creamy Skyr 3.25% M.F.650 g,$7.79ea,,$1.20/ 100g,False,
dairy_and_eggs,Violife,Mature Cheddar Style Slices,ViolifeMature Cheddar Style Slices200 g,$6.99ea,,$3.50/ 100g,False,
dairy_and_eggs,Midday Squares,Functional Chocolate Bar Peanut Butta,Midday SquaresFunctional Chocolate Bar Peanut Butta33 g,$2.99ea,,$9.06/ 100g,False,
dairy_and_eggs,Liberte,Yogourt Wild Blueberry 9 % M.F.,LiberteYogourt Wild Blueberry 9 % M.F.4x100.0 g,$4.99ea,,$1.25/ 100g,False,
dairy_and_eggs,Activia,Yogurt With Probioticsemon Pineapple Flavour,ActiviaYogurt With Probioticsemon Pineapple Flavour8x100.0 g,$5.99ea,$5.49ea,$0.69/ 100g,True,saleEnds 03/01
dairy_and_eggs,Danone,"Raspberry Greek Yogurt, 2g Sugar, 8g Protein","DanoneRaspberry Greek Yogurt, 2g Sugar, 8g Protein380 g",$3.99ea,,$1.05/ 100g,False,
dairy_and_eggs,Oikos,"Drinkable Greek Yogurt With Field Berries, Oats, & Seeds, 9G Protein","OikosDrinkable Greek Yogurt With Field Berries, Oats, & Seeds, 9G Protein190 ml",$2.29ea,,$1.21/ 100ml,False,
dairy_and_eggs,President's Choice,Marble Cheddar Cheese,President's ChoiceMarble Cheddar Cheese400 g,$6.49ea,,$1.62/ 100g,False,
dairy_and_eggs,Liberte,Méditerranée Lemon 9% MF Yogurt,LiberteMéditerranée Lemon 9% MF Yogurt500 g,$5.79ea,,$1.16/ 100g,False,
dairy_and_eggs,President's Choice,Plain Kefir Probiotic Fermented 1% M.F. Milk,President's ChoicePlain Kefir Probiotic Fermented 1% M.F. Milk1 l,$4.79ea,,$0.48/ 100ml,False,
dairy_and_eggs,Yoplait,Source Blueberry/Strawberry/Blackberry/Nectarine  0% MF Yogurt,YoplaitSource Blueberry/Strawberry/Blackberry/Nectarine  0% MF Yogurt16x100.0 g,$6.49ea,,$0.41/ 100g,False,
dairy_and_eggs,Liberte,Kéfir 1% MF Strawberry,LiberteKéfir 1% MF Strawberry1000 ml,$5.50ea,$4.99ea,$0.50/ 100ml,True,saleEnds 03/01
dairy_and_eggs,Activia,Yogurt With Probiotics Lemon Flavour,ActiviaYogurt With Probiotics Lemon Flavour650 g,$3.99ea,,$0.61/ 100g,False,
dairy_and_eggs,Liberte,Greek Vanilla 0% MF Yogurt,LiberteGreek Vanilla 0% MF Yogurt750 g,$6.49ea,,$0.87/ 100g,False,
dairy_and_eggs,Oikos,"Greek Yogurt, Vanilla Flavour, 2% M.F., Value Tub","OikosGreek Yogurt, Vanilla Flavour, 2% M.F., Value Tub750 g",$6.99ea,,$0.93/ 100g,False,
dairy_and_eggs,Oikos,"Extra Creamy Greek Yogurt, Extra Creamy Plain 11%","OikosExtra Creamy Greek Yogurt, Extra Creamy Plain 11%750 g",$6.99ea,,$0.93/ 100g,False,
dairy_and_eggs,PC Organics,Organic Skim Milk,PC OrganicsOrganic Skim Milk4 l,$10.69ea,,$0.27/ 100ml,False,
dairy_and_eggs,Silk,"Dairy Free Plant Based Almond Yogurt, Vanilla Flavour","SilkDairy Free Plant Based Almond Yogurt, Vanilla Flavour640 g",$7.49ea,,$1.17/ 100g,False,
dairy_and_eggs,Organic Meadow,"Organic Cheese, Medium Cheddar","Organic MeadowOrganic Cheese, Medium Cheddar340 g",$12.99ea,,$3.82/ 100g,False,
dairy_and_eggs,Liberte,Méditerranée Apple Pie 9%MF Yogurt,LiberteMéditerranée Apple Pie 9%MF Yogurt500 g,$5.79ea,,$1.16/ 100g,False,
dairy_and_eggs,Activia,"Yogurt With Probiotics, Strawberry Flavour","ActiviaYogurt With Probiotics, Strawberry Flavour650 g",$3.99ea,,$0.61/ 100g,False,
dairy_and_eggs,Beatrice,"Sour Cream, Regular 14%","BeatriceSour Cream, Regular 14%500 ml",$4.29ea,,$0.86/ 100ml,False,
dairy_and_eggs,Neilson,"Flavoured Milk, Strawberry","NeilsonFlavoured Milk, Strawberry1 l",$3.49ea,$1.99ea,$0.20/ 100ml,True,saleEnds 03/08
dairy_and_eggs,Neilson,TruTaste Milk 1% M.F. Lactose Free,NeilsonTruTaste Milk 1% M.F. Lactose Free1 l,$4.59ea,,$0.46/ 100ml,False,
dairy_and_eggs,Milk 2 Go,Banana,Milk 2 GoBanana473 ml,$2.69ea,$1.79ea,$0.38/ 100ml,True,saleEnds 03/08
dairy_and_eggs,Becel,Margarine Original,BecelMargarine Original427 g,$5.49ea,,$1.29/ 100g,False,
dairy_and_eggs,Becel,Unsalted Plant-Based Margarine Bricks,BecelUnsalted Plant-Based Margarine Bricks454 g,$5.89ea,,$1.30/ 100g,False,
dairy_and_eggs,No Name,Cream Cheese Spread ,No NameCream Cheese Spread 227 g,$3.99ea,,$1.76/ 100g,False,
dairy_and_eggs,No Name,Pasteurized Cream Cheese,No NamePasteurized Cream Cheese250 g,$3.99ea,,$1.60/ 100g,False,
dairy_and_eggs,International Delight,"French Vanilla Flavoured Coffee Creamer, 63 Servings","International DelightFrench Vanilla Flavoured Coffee Creamer, 63 Servings946 ml",$5.99ea,,$0.63/ 100ml,False,
dairy_and_eggs,PC Organics,Organic Fresh Skim Milk,PC OrganicsOrganic Fresh Skim Milk2 l,$7.09ea,,$0.35/ 100ml,False,
dairy_and_eggs,Neilson,Trutaste Lactose Free Cream Half & Half 10% M.F.,NeilsonTrutaste Lactose Free Cream Half & Half 10% M.F.1 l,$3.99ea,,$0.40/ 100ml,False,
dairy_and_eggs,Becel,Margarine Original,BecelMargarine Original850 g,$9.29ea,$6.99ea,$0.82/ 100g,True,saleEnds 03/01
dairy_and_eggs,Neilson,TruTaste Homogenized Milk,NeilsonTruTaste Homogenized Milk2 l,$6.19ea,,$0.31/ 100ml,False,
dairy_and_eggs,Philadelphia,Original Cream Cheese,PhiladelphiaOriginal Cream Cheese227 g,$6.49ea,,$2.86/ 100g,False,
dairy_and_eggs,Pillsbury,Reese Cookie Dough,PillsburyReese Cookie Dough454 g,$4.49ea,,$0.99/ 100g,False,
dairy_and_eggs,Neilson,2% Milk,Neilson2% Milk2 l,$5.19ea,,$0.26/ 100ml,False,
dairy_and_eggs,Philadelphia,Herb & Garlic Cream Cheese Product,PhiladelphiaHerb & Garlic Cream Cheese Product227 g,$5.49ea,,$2.42/ 100g,False,
dairy_and_eggs,Nestle,Coffee Crisp Milkshake,NestleCoffee Crisp Milkshake473 ml,$3.15ea,$1.79ea,$0.38/ 100ml,True,saleEnds 03/08
dairy_and_eggs,Black Diamond,"Cheese Mozzarella, 27% M.F.","Black DiamondCheese Mozzarella, 27% M.F.400 g",$8.49ea,,$2.12/ 100g,False,
dairy_and_eggs,Cracker Barrel,Bar Old Cheddar Light,Cracker BarrelBar Old Cheddar Light400 g,$9.79ea,,$2.45/ 100g,False,
dairy_and_eggs,Milk 2 Go,"Milk, Chocolate Partly Skimmed 1 % M.F.","Milk 2 GoMilk, Chocolate Partly Skimmed 1 % M.F.310 ml",$1.29ea,,$0.42/ 100ml,False,
dairy_and_eggs,Fairlife,Lactose Free 1% Partly Skimmed Ultrafiltered Milk,FairlifeLactose Free 1% Partly Skimmed Ultrafiltered Milk1.5 l,$5.79ea,,$0.39/ 100ml,False,
dairy_and_eggs,Kraft,Velveeta Original Thin Slices,KraftVelveeta Original Thin Slices410 g,$6.29ea,,$1.53/ 100g,False,
dairy_and_eggs,Neilson,1% Partly Skimmed Milk,Neilson1% Partly Skimmed Milk2 l,$5.19ea,,$0.26/ 100ml,False,
dairy_and_eggs,Nestle,Rolo Milkshake,NestleRolo Milkshake473 ml,$3.15ea,$1.79ea,$0.38/ 100ml,True,saleEnds 03/08
dairy_and_eggs,Woolwich,Partially Skimmed Goat Milk 2%,WoolwichPartially Skimmed Goat Milk 2%1 l,$4.59ea,,$0.46/ 100ml,False,
dairy_and_eggs,Lactantia,"Lactose Free Butter, Salted","LactantiaLactose Free Butter, Salted250 g",$6.79ea,,$2.72/ 100g,False,
dairy_and_eggs,PC Organics,Organic Partly Skimmed 2% Milk,PC OrganicsOrganic Partly Skimmed 2% Milk2 l,$7.09ea,,$0.35/ 100ml,False,
dairy_and_eggs,Philadelphia,Smoked Salmon Cream Cheese Product,PhiladelphiaSmoked Salmon Cream Cheese Product227 g,$5.49ea,,$2.42/ 100g,False,
dairy_and_eggs,Becel,Margarine with Avocado Oil,BecelMargarine with Avocado Oil427 g,$5.49ea,,$1.29/ 100g,False,
dairy_and_eggs,Lactantia,Unsalted Butter,LactantiaUnsalted Butter454 g,$9.29ea,,$2.05/ 100g,False,
dairy_and_eggs,Philadelphia,Whipped Original Cream Cheese Product,PhiladelphiaWhipped Original Cream Cheese Product227 g,$5.49ea,,$2.42/ 100g,False,
dairy_and_eggs,No Name,Salted Butter,No NameSalted Butter454 g,$6.49ea,,$1.43/ 100g,False,
dairy_and_eggs,Fairlife,Lactose Free Whole Ultrafiltered Milk,FairlifeLactose Free Whole Ultrafiltered Milk1.5 l,$5.79ea,,$0.39/ 100ml,False,
dairy_and_eggs,Neilson,Trutaste Chocolate Partly Skimmed Milk 1% M.F.,NeilsonTrutaste Chocolate Partly Skimmed Milk 1% M.F.2 l,$7.29ea,,$0.36/ 100ml,False,
dairy_and_eggs,Neilson,"Flavoured Milk, Chocolate","NeilsonFlavoured Milk, Chocolate4 l",$8.19ea,,$0.20/ 100ml,False,
dairy_and_eggs,Neilson,Trutaste No Lactose 3.25% Milk,NeilsonTrutaste No Lactose 3.25% Milk2 l,$7.09ea,,$0.35/ 100ml,False,
dairy_and_eggs,International Delight,Caramel Macchiato,International DelightCaramel Macchiato946 ml,$5.99ea,,$0.63/ 100ml,False,
dairy_and_eggs,No Name,Unsalted Butter,No NameUnsalted Butter454 g,$6.49ea,,$1.43/ 100g,False,
dairy_and_eggs,President's Choice,"Greek Yogurt, Black Cherry 0%","President's ChoiceGreek Yogurt, Black Cherry 0%500 g",$6.49ea,,$1.30/ 100g,False,
dairy_and_eggs,Oikos,"Greek Yogurt, Key Lime Flavour, 2% M.F., Blended","OikosGreek Yogurt, Key Lime Flavour, 2% M.F., Blended4x100.0 g",$4.79ea,,$1.20/ 100g,False,
dairy_and_eggs,Oikos,"Greek Yogurt, Banana Flavour, Blended, 2% Mf, 4X100G","OikosGreek Yogurt, Banana Flavour, Blended, 2% Mf, 4X100G4x100.0 g",$4.79ea,,$1.20/ 100g,False,
dairy_and_eggs,siggi's,"Yogurt, Plain 0% M.F. Icelandic Skyr Thick Yogourt","siggi'sYogurt, Plain 0% M.F. Icelandic Skyr Thick Yogourt750 g",$7.79ea,,$1.04/ 100g,False,
dairy_and_eggs,President's Choice,Vanilla Skyr Icelandic Style 0% M.F. Yogurt,President's ChoiceVanilla Skyr Icelandic Style 0% M.F. Yogurt500 g,$6.29ea,,$1.26/ 100g,False,
dairy_and_eggs,PC Organics,"Organic Kefir Milk, Strawberry","PC OrganicsOrganic Kefir Milk, Strawberry1000 ml",$5.49ea,,$0.55/ 100ml,False,
dairy_and_eggs,President's Choice,Plant Based Cultured Oat Yogurt Alternative Strawberry Vanilla,President's ChoicePlant Based Cultured Oat Yogurt Alternative Strawberry Vanilla500 g,$3.99ea,,$0.80/ 100g,False,
dairy_and_eggs,Activia,"Immune System, Raspberry Probiotic Yogurt Drink. Lactose Free, 8 Pack","ActiviaImmune System, Raspberry Probiotic Yogurt Drink. Lactose Free, 8 Pack8x93.0 ml",$7.99ea,,$1.07/ 100ml,False,
dairy_and_eggs,Organic Meadow,Cottage Cheese,Organic MeadowCottage Cheese500 g,$9.49ea,,$1.90/ 100g,False,
dairy_and_eggs,Rolling Meadow,Grass Fed 10% Cream,Rolling MeadowGrass Fed 10% Cream473 ml,$4.29ea,,$0.91/ 100ml,False,
dairy_and_eggs,Activia,"Yogurt With Probioticsactose-Free, Vanilla Flavour","ActiviaYogurt With Probioticsactose-Free, Vanilla Flavour650 g",$3.99ea,,$0.61/ 100g,False,
dairy_and_eggs,Yoplait,Tubes Raspberry,YoplaitTubes Raspberry8x56.0 g,$4.79ea,,$1.07/ 100g,False,
dairy_and_eggs,Liberte,Kéfir Organic 1% MF Raspberry,LiberteKéfir Organic 1% MF Raspberry1000 g,$6.99ea,,$0.70/ 100g,False,
dairy_and_eggs,Earth Island, Mozzarella Slices,Earth Island Mozzarella Slices200 g,$8.99ea,,$4.50/ 100g,False,
dairy_and_eggs,Liberte,Méditerranée Black Cherry 9% MF Yogurt,LiberteMéditerranée Black Cherry 9% MF Yogurt500 g,$5.79ea,,$1.16/ 100g,False,
dairy_and_eggs,IOGO,Yogurt 1.5% M.F. Variety Pack,IOGOYogurt 1.5% M.F. Variety Pack16x100.0 g,$8.49ea,$6.49ea,$0.41/ 100g,True,saleEnds 03/01
dairy_and_eggs,President's Choice,Black Cherry 0% M.F. Greek Yogurt ,President's ChoiceBlack Cherry 0% M.F. Greek Yogurt 4x100.0 g,$4.49ea,,$1.12/ 100g,False,
dairy_and_eggs,Gay Lea,Butter Unsalted Organic ,Gay LeaButter Unsalted Organic 250 g,$7.99ea,,$3.20/ 100g,False,
dairy_and_eggs,No Name,"Old Cheddar Cheese, Light","No NameOld Cheddar Cheese, Light400 g",$5.99ea,,$1.50/ 100g,False,
dairy_and_eggs,Liberte,Greek Coconut 2% MF Yogurt,LiberteGreek Coconut 2% MF Yogurt750 g,$6.49ea,,$0.87/ 100g,False,
dairy_and_eggs,Lactantia,Partly Skimmed Milk Lactose Free 2% M.F.,LactantiaPartly Skimmed Milk Lactose Free 2% M.F.2 l,$6.09ea,$5.49ea,$0.27/ 100ml,True,saleEnds 03/08
dairy_and_eggs,Cracker Barrel,Cheese Sauce Kit Creamy Alfredo,Cracker BarrelCheese Sauce Kit Creamy Alfredo271 g,$7.99ea,,$2.95/ 100g,False,
dairy_and_eggs,Yummy Doh,Raw Cookie Dough Strawberry Confetti,Yummy DohRaw Cookie Dough Strawberry Confetti400 g,$6.49ea,,$1.62/ 100g,False,
dairy_and_eggs,Neilson,Table Cream,NeilsonTable Cream237 ml,$3.29ea,,$1.39/ 100ml,False,
dairy_and_eggs,Cracker Barrel,Shreds Old Cheddar,Cracker BarrelShreds Old Cheddar320 g,$7.99ea,,$2.50/ 100g,False,
dairy_and_eggs,Neilson,Trutaste Skim Milk,NeilsonTrutaste Skim Milk1 l,$4.19ea,,$0.42/ 100ml,False,
dairy_and_eggs,Tim Hortons,Creamy & Sweet Instant Coffee Mix With Natural Flavours,Tim HortonsCreamy & Sweet Instant Coffee Mix With Natural Flavours8 ea,$5.99ea,,$0.75/ 1ea,False,
dairy_and_eggs,Tim Hortons,"Coffee, Roast: Medium Premium Instant ","Tim HortonsCoffee, Roast: Medium Premium Instant 300 g",$16.99ea,,$5.66/ 100g,False,
dairy_and_eggs,Tre Stelle,Tre Stelle Cream Cheese Light    ,Tre StelleTre Stelle Cream Cheese Light    200 g,$4.49ea,,$2.25/ 100g,False,
dairy_and_eggs,Lactantia,Healthy Attitude Omega-3 Margarine,LactantiaHealthy Attitude Omega-3 Margarine850 g,$8.99ea,,$1.06/ 100g,False,
dairy_and_eggs,No Name,Cream Cheese Product With Jalapeño ,No NameCream Cheese Product With Jalapeño 227 g,$3.99ea,,$1.76/ 100g,False,
dairy_and_eggs,President's Choice,Vanilla 0% M.F. Greek Yogurt,President's ChoiceVanilla 0% M.F. Greek Yogurt500 g,$6.49ea,,$1.30/ 100g,False,
dairy_and_eggs,International Delight,Classic Hazelnut Coffee Creamer,International DelightClassic Hazelnut Coffee Creamer1.42 l,$8.99ea,,$0.63/ 100ml,False,
dairy_and_eggs,siggi's,"Yogurt, Plain 0% M.F. Icelandic Skyr Thick Yogourt","siggi'sYogurt, Plain 0% M.F. Icelandic Skyr Thick Yogourt750 g",$7.79ea,,$1.04/ 100g,False,
dairy_and_eggs,President's Choice,Vanilla Skyr Icelandic Style 0% M.F. Yogurt,President's ChoiceVanilla Skyr Icelandic Style 0% M.F. Yogurt500 g,$6.29ea,,$1.26/ 100g,False,
dairy_and_eggs,PC Organics,"Organic Kefir Milk, Strawberry","PC OrganicsOrganic Kefir Milk, Strawberry1000 ml",$5.49ea,,$0.55/ 100ml,False,
dairy_and_eggs,President's Choice,Black Cherry 0% M.F. Greek Yogurt ,President's ChoiceBlack Cherry 0% M.F. Greek Yogurt 4x100.0 g,$4.49ea,,$1.12/ 100g,False,
dairy_and_eggs,Olympic,"Greek Yogurt, Vanilla","OlympicGreek Yogurt, Vanilla650 g",$4.99ea,,$0.77/ 100g,False,
dairy_and_eggs,Neilson,Homogenized Milk 3.25%,NeilsonHomogenized Milk 3.25%473 ml,$2.89ea,,$0.61/ 100ml,False,
dairy_and_eggs,Golden Gate,Mirage Margarine,Golden GateMirage Margarine907 g,$7.19ea,,$0.79/ 100g,False,
dairy_and_eggs,Neilson,"Flavoured Milk, Chocolate","NeilsonFlavoured Milk, Chocolate1 l",$3.49ea,$1.99ea,$0.20/ 100ml,True,saleEnds 03/08
dairy_and_eggs,No Name,"Cottage Cheese, 2% M.F.","No NameCottage Cheese, 2% M.F.500 g",$4.99ea,,$1.00/ 100g,False,
dairy_and_eggs,Fairlife,Lactose Free 2% Partly Skimmed Ultrafiltered Milk,FairlifeLactose Free 2% Partly Skimmed Ultrafiltered Milk1.5 l,$5.79ea,,$0.39/ 100ml,False,
