category,brand,product_text,product_name,price_text,sale_price,per_unit_price_text,is_sale,sale_valid_to
dairy_and_eggs,Liberte,Greek Peach 2% MF Yogurt,LiberteGreek Peach 2% MF Yogurt750 g,$6.49ea,,$0.87/ 100g,False,
dairy_and_eggs,Kraft,Shredded Parmesan Cheese,KraftShredded Parmesan Cheese200 g,$9.49ea,,$4.75/ 100g,False,
dairy_and_eggs,Kraft,Shaved Parmesan Cheese,KraftShaved Parmesan Cheese141 g,$7.49ea,,$5.31/ 100g,False,
dairy_and_eggs,Kraft,Singles Original Slices,KraftSingles Original Slices825 g,$10.99ea,,$1.33/ 100g,False,
dairy_and_eggs,Activia,"Probiotic Yogurt, Blackberry, Blueberry, Blackcurrent, Berries, 12XG","ActiviaProbiotic Yogurt, Blackberry, Blueberry, Blackcurrent, Berries, 12XG12x100.0 g",$8.49ea,,$0.71/ 100g,False,
dairy_and_eggs,Goldegg,"Omega 3 White Eggs, Large","GoldeggOmega 3 White Eggs, Large12 eggs",$6.59ea,,$0.55/ 1ea,False,
dairy_and_eggs,Philadelphia,Herb & Garlic Dip,PhiladelphiaHerb & Garlic Dip227 g,$5.49ea,,$2.42/ 100g,False,
dairy_and_eggs,Hans,Dairy 2% Natural Yogurt   ,HansDairy 2% Natural Yogurt   750 g,$2.99ea,,$0.40/ 100g,False,
dairy_and_eggs,No Name,Mild Cheddar Cheese,No NameMild Cheddar Cheese400 g,$5.99ea,,$1.50/ 100g,False,
dairy_and_eggs,Black Diamond,White Cheddar Sliced Cheese,Black DiamondWhite Cheddar Sliced Cheese220 g,$5.99ea,,$2.72/ 100g,False,
dairy_and_eggs,Pillsbury,Ciinnamon Rolls,PillsburyCiinnamon Rolls351 g,$4.49ea,,$1.28/ 100g,False,
dairy_and_eggs,Black Diamond,Old Cheddar Cheese + Sea-Salted Roasted Cashews & Cherry Infused Dried Cranberries,Black DiamondOld Cheddar Cheese + Sea-Salted Roasted Cashews & Cherry Infused Dried Cranberries127.6 g,$5.79ea,,$4.54/ 100g,False,
dairy_and_eggs,President's Choice,Vanilla Skyr Icelandic Style 4% M.F. Yogurt,President's ChoiceVanilla Skyr Icelandic Style 4% M.F. Yogurt500 g,$6.29ea,,$1.26/ 100g,False,
dairy_and_eggs,Yummy Doh,Raw Cookie Dough Chocolate Chunk,Yummy DohRaw Cookie Dough Chocolate Chunk400 g,$6.49ea,,$1.62/ 100g,False,
dairy_and_eggs,No Name,Old Cheddar Cheese,No NameOld Cheddar Cheese400 g,$5.99ea,,$1.50/ 100g,False,
dairy_and_eggs,No Name,Light Cheddar Flavour Processed Cheese Product Slices,No NameLight Cheddar Flavour Processed Cheese Product Slices400 g,$4.49ea,,$1.12/ 100g,False,
dairy_and_eggs,No Name,Pie Shells,No NamePie Shells350 g,$4.29ea,,$1.23/ 100g,False,
dairy_and_eggs,Kiri,"Cheese, Cream Product Original 29.5% M.F.","KiriCheese, Cream Product Original 29.5% M.F.150 g",$4.29ea,,$2.86/ 100g,False,
dairy_and_eggs,Kraft,Singles Swiss Slices,KraftSingles Swiss Slices410 g,$6.29ea,,$1.53/ 100g,False,
dairy_and_eggs,Gay Lea,"Sour Cream, Regular 14%","Gay LeaSour Cream, Regular 14%250 ml",$3.49ea,,$1.40/ 100ml,False,
dairy_and_eggs,Armstrong,Combos - Mozzarella & Naturally Smoked Salami Sticks,ArmstrongCombos - Mozzarella & Naturally Smoked Salami Sticks180 g,$7.49ea,,$4.16/ 100g,False,
dairy_and_eggs,Pillsbury,Easy Roll Pie Crust   ,PillsburyEasy Roll Pie Crust   400 g,$4.99ea,,$1.25/ 100g,False,
dairy_and_eggs,Pillsbury,Crescents - Reduced Fat,PillsburyCrescents - Reduced Fat227 g,$3.19ea,,$1.41/ 100g,False,
dairy_and_eggs,Black Diamond,Combo Marble Cubes and Sea Salted Roasted Almonds and Dried Cranberries,Black DiamondCombo Marble Cubes and Sea Salted Roasted Almonds and Dried Cranberries127.6 g,$5.79ea,,$4.54/ 100g,False,
dairy_and_eggs,Philadelphia,Dill Pickle Dip,PhiladelphiaDill Pickle Dip340 g,$7.99ea,,$2.35/ 100g,False,
dairy_and_eggs,President's Choice,Plain 2% M.F. Greek Yogurt,President's ChoicePlain 2% M.F. Greek Yogurt908 g,$7.79ea,,$0.86/ 100g,False,
dairy_and_eggs,Astro,"Yogurt, Peach Cobbler 6% M.F. Balkan Yogourt","AstroYogurt, Peach Cobbler 6% M.F. Balkan Yogourt500 g",$4.99ea,,$1.00/ 100g,False,
dairy_and_eggs,Gay Lea,Salted Butter,Gay LeaSalted Butter454 g,$8.49ea,,$1.87/ 100g,False,
dairy_and_eggs,Liberte,Greek Yogourt Banana 0 % M.F.,LiberteGreek Yogourt Banana 0 % M.F.750 g,$6.49ea,,$0.87/ 100g,False,
dairy_and_eggs,Cracker Barrel,Signature Shredded Natural Cheese Extra Old & Mozza 31 % M.F.,Cracker BarrelSignature Shredded Natural Cheese Extra Old & Mozza 31 % M.F.300 g,$7.99ea,,$2.66/ 100g,False,
dairy_and_eggs,Cracker Barrel,Cheese Sauce Kit 4 Cheeses Italiano,Cracker BarrelCheese Sauce Kit 4 Cheeses Italiano280 g,$7.99ea,,$2.85/ 100g,False,
dairy_and_eggs,President's Choice,Extra Large Free Run Brown Eggs,President's ChoiceExtra Large Free Run Brown Eggs12 eggs,$7.09ea,,$0.59/ 1ea,False,
dairy_and_eggs,Philadelphia,Dill Pickle Dip,PhiladelphiaDill Pickle Dip227 g,$5.49ea,,$2.42/ 100g,False,
dairy_and_eggs,1850,"Coffee, Ground  100% Colombian Light Roast ","1850Coffee, Ground  100% Colombian Light Roast 340 g",$12.99ea,,$3.82/ 100g,False,
dairy_and_eggs,Black Diamond,Cheestrings Marble 18% M.F.,Black DiamondCheestrings Marble 18% M.F.336 g,$6.99ea,,$2.08/ 100g,False,
dairy_and_eggs,Neilson,2% Milk,Neilson2% Milk473 ml,$2.69ea,,$0.57/ 100ml,False,
dairy_and_eggs,Gay Lea,Whipped Topping,Gay LeaWhipped Topping400 g,$5.99ea,,$1.50/ 100g,False,
dairy_and_eggs,No Name,Medium Cheddar Cheese,No NameMedium Cheddar Cheese400 g,$5.99ea,,$1.50/ 100g,False,
dairy_and_eggs,Black Diamond,Cheddar Coloured Mild,Black DiamondCheddar Coloured Mild400 g,$8.49ea,,$2.12/ 100g,False,
dairy_and_eggs,PC Organics,Organic Skyr Yogurt 0% Mf Plain,PC OrganicsOrganic Skyr Yogurt 0% Mf Plain500 g,$5.49ea,,$1.10/ 100g,False,
dairy_and_eggs,Saputo,Mozzarellissima,SaputoMozzarellissima500 g,$9.99ea,,$2.00/ 100g,False,
dairy_and_eggs,Cracker Barrel,Slice Medium Cheddar,Cracker BarrelSlice Medium Cheddar240 g,$5.99ea,,$2.50/ 100g,False,
dairy_and_eggs,Gay Lea,"Nordica Cottage Cheese, Creamed 4%","Gay LeaNordica Cottage Cheese, Creamed 4%500 g",$5.99ea,,$1.20/ 100g,False,
dairy_and_eggs,Cracker Barrel,Shreds Italiano,Cracker BarrelShreds Italiano320 g,$7.99ea,,$2.50/ 100g,False,
dairy_and_eggs,No Name,Cottage Cheese,No NameCottage Cheese250 g,$3.49ea,,$1.40/ 100g,False,
dairy_and_eggs,Black Diamond,Sliced Medium Cheddar Cheese,Black DiamondSliced Medium Cheddar Cheese240 g,$5.99ea,,$2.50/ 100g,False,
dairy_and_eggs,President's Choice,Naturally Lactose-Free Swiss Cheese ,President's ChoiceNaturally Lactose-Free Swiss Cheese 300 g,$6.49ea,,$2.16/ 100g,False,
dairy_and_eggs,Cracker Barrel,Bar Mozzarella,Cracker BarrelBar Mozzarella400 g,$9.79ea,,$2.45/ 100g,False,
dairy_and_eggs,No Name,"Old Cheddar Cheese, Light","No NameOld Cheddar Cheese, Light400 g",$5.99ea,,$1.50/ 100g,False,
dairy_and_eggs,Liberte,Greek Coconut 2% MF Yogurt,LiberteGreek Coconut 2% MF Yogurt4x100.0 g,$4.99ea,,$1.25/ 100g,False,
dairy_and_eggs,Gay Lea,Spreadables Butter With Canola Oil,Gay LeaSpreadables Butter With Canola Oil227 g,$5.99ea,,$2.64/ 100g,False,
dairy_and_eggs,Black Diamond,Sliced Medium Cheddar Cheese,Black DiamondSliced Medium Cheddar Cheese240 g,$5.99ea,,$2.50/ 100g,False,
dairy_and_eggs,Cracker Barrel,Cheese Sauce Kit Creamy Alfredo,Cracker BarrelCheese Sauce Kit Creamy Alfredo271 g,$7.99ea,,$2.95/ 100g,False,
dairy_and_eggs,Liberte,Greek Coconut 2% MF Yogurt,LiberteGreek Coconut 2% MF Yogurt750 g,$6.49ea,,$0.87/ 100g,False,
dairy_and_eggs,Liberte,Greek Yogourt Banana 0 % M.F.,LiberteGreek Yogourt Banana 0 % M.F.750 g,$6.49ea,,$0.87/ 100g,False,
dairy_and_eggs,Cracker Barrel,Signature Shredded Natural Cheese Extra Old & Mozza 31 % M.F.,Cracker BarrelSignature Shredded Natural Cheese Extra Old & Mozza 31 % M.F.300 g,$7.99ea,,$2.66/ 100g,False,
dairy_and_eggs,President,Premium Unsalted Cultured Butter,PresidentPremium Unsalted Cultured Butter250 g,$5.49ea,,$2.20/ 100g,False,
dairy_and_eggs,No Name,Swiss Cheese Slices,No NameSwiss Cheese Slices210 g,$5.49ea,,$2.61/ 100g,False,
dairy_and_eggs,Gay Lea,"Sour Cream, Low Fat 3%","Gay LeaSour Cream, Low Fat 3%500 ml",$4.29ea,,$0.86/ 100ml,False,
dairy_and_eggs,Philadelphia,French Onion Dip,PhiladelphiaFrench Onion Dip227 g,$5.49ea,,$2.42/ 100g,False,
dairy_and_eggs,Yummy Doh,Raw Cookie Dough Strawberry Confetti,Yummy DohRaw Cookie Dough Strawberry Confetti400 g,$6.49ea,,$1.62/ 100g,False,
dairy_and_eggs,Liberte,Greek Lemon 2% MF Yogurt,LiberteGreek Lemon 2% MF Yogurt4x100.0 g,$4.99ea,,$1.25/ 100g,False,
dairy_and_eggs,Gray Ridge,"Grade A Premium White Eggs, Large","Gray RidgeGrade A Premium White Eggs, Large12 eggs",$4.59ea,,$0.38/ 1ea,False,
dairy_and_eggs,Tim Hortons,Fine Grind Coffee Maple Roast Medium,Tim HortonsFine Grind Coffee Maple Roast Medium300 g,$10.99ea,,$3.66/ 100g,False,
dairy_and_eggs,IOGO,3.2% M.F. Yogurt,IOGO3.2% M.F. Yogurt12x100.0 g,$7.49ea,$6.49ea,$0.54/ 100g,True,saleEnds 03/01
dairy_and_eggs,Black Diamond,Marble Cheese,Black DiamondMarble Cheese400 g,$8.49ea,,$2.12/ 100g,False,
dairy_and_eggs,Becel,Buttery Taste Margarine,BecelButtery Taste Margarine1.36 kg,$16.99ea,,$1.33/ 100g,False,
dairy_and_eggs,Astro,Original Balkan Yogourt 4% M.F.,AstroOriginal Balkan Yogourt 4% M.F.12x100.0 g,$8.49ea,,$0.71/ 100g,False,
dairy_and_eggs,IOGO,"Yogurt Tubes, Strawberry & Peach","IOGOYogurt Tubes, Strawberry & Peach8x60.0 g",$3.29ea,$2.99ea,$0.62/ 100g,True,saleEnds 03/22
dairy_and_eggs,Riviera,"Vegan Yogurt, Plain Coconut","RivieraVegan Yogurt, Plain Coconut650 g",$6.49ea,,$1.00/ 100g,False,
dairy_and_eggs,Armstrong,Medium Cheddar Cheese Slice,ArmstrongMedium Cheddar Cheese Slice240 g,$6.49ea,,$2.70/ 100g,False,
dairy_and_eggs,No Name,Light Double Cheddar Shredded Cheese,No NameLight Double Cheddar Shredded Cheese320 g,$5.99ea,,$1.87/ 100g,False,
dairy_and_eggs,Kraft,Velveeta Processed Cheese Loaf,KraftVelveeta Processed Cheese Loaf450 g,$8.49ea,,$1.89/ 100g,False,
dairy_and_eggs,Cracker Barrel,Bar Mozzarella,Cracker BarrelBar Mozzarella400 g,$9.79ea,,$2.45/ 100g,False,
dairy_and_eggs,Black Diamond,Shredded Cheese Tacos & Nachos,Black DiamondShredded Cheese Tacos & Nachos320 g,$6.99ea,,$2.18/ 100g,False,
dairy_and_eggs,President's Choice,Extra Large Free Run Brown Eggs,President's ChoiceExtra Large Free Run Brown Eggs12 eggs,$7.09ea,,$0.59/ 1ea,False,
dairy_and_eggs,Neilson,2% Milk,Neilson2% Milk473 ml,$2.69ea,,$0.57/ 100ml,False,
dairy_and_eggs,PC Organics,Organic Skyr Yogurt 0% Mf Plain,PC OrganicsOrganic Skyr Yogurt 0% Mf Plain500 g,$5.49ea,,$1.10/ 100g,False,
dairy_and_eggs,Gay Lea,Whipped Topping,Gay LeaWhipped Topping400 g,$5.99ea,,$1.50/ 100g,False,
dairy_and_eggs,Saputo,Mozzarellissima,SaputoMozzarellissima500 g,$9.99ea,,$2.00/ 100g,False,
dairy_and_eggs,No Name,Medium Cheddar Cheese,No NameMedium Cheddar Cheese400 g,$5.99ea,,$1.50/ 100g,False,
dairy_and_eggs,Black Diamond,Cheddar Coloured Mild,Black DiamondCheddar Coloured Mild400 g,$8.49ea,,$2.12/ 100g,False,
dairy_and_eggs,Activia,"Immune System, Probiotic Drinkable Yogurt, Strawberry Banana, 8X","ActiviaImmune System, Probiotic Drinkable Yogurt, Strawberry Banana, 8X8x93.0 ml",$7.99ea,,$1.07/ 100ml,False,
dairy_and_eggs,IOGO,iÖGO Canadian Harvest 3.2% Peach Yogurt,IOGOiÖGO Canadian Harvest 3.2% Peach Yogurt650 g,$3.49ea,,$0.54/ 100g,False,
dairy_and_eggs,No Name,"Cottage Cheese, 2% M.F.","No NameCottage Cheese, 2% M.F.500 g",$4.99ea,,$1.00/ 100g,False,
dairy_and_eggs,Fairlife,Lactose Free 2% Partly Skimmed Ultrafiltered Milk,FairlifeLactose Free 2% Partly Skimmed Ultrafiltered Milk1.5 l,$5.79ea,,$0.39/ 100ml,False,
dairy_and_eggs,No Name,Cream Cheese Spread with Herbs & Roasted Garlic ,No NameCream Cheese Spread with Herbs & Roasted Garlic 227 g,$3.99ea,,$1.76/ 100g,False,
dairy_and_eggs,Philadelphia,Herb & Spice Dip,PhiladelphiaHerb & Spice Dip227 g,$5.49ea,,$2.42/ 100g,False,
dairy_and_eggs,President's Choice,Vanilla 0% M.F. Greek Yogurt,President's ChoiceVanilla 0% M.F. Greek Yogurt500 g,$6.49ea,,$1.30/ 100g,False,
dairy_and_eggs,Earth Balance,Organic Whipped Spread,Earth BalanceOrganic Whipped Spread369 g,$6.99ea,,$1.89/ 100g,False,
dairy_and_eggs,President's Choice,Vanilla 0% M.F. Greek Yogurt,President's ChoiceVanilla 0% M.F. Greek Yogurt4x100.0 g,$4.49ea,,$1.12/ 100g,False,
dairy_and_eggs,PC Organics,Organic Plain Kefir Probiotic Fermented 1% M.F. Milk,PC OrganicsOrganic Plain Kefir Probiotic Fermented 1% M.F. Milk1 l,$5.49ea,,$0.55/ 100ml,False,
dairy_and_eggs,Organic Meadow,"Organic Yogurt, Plain 2%","Organic MeadowOrganic Yogurt, Plain 2%750 g",$7.49ea,,$1.00/ 100g,False,
dairy_and_eggs,Olympic,"Organic Yogurt, French Vanilla","OlympicOrganic Yogurt, French Vanilla650 g",$4.99ea,,$0.77/ 100g,False,
dairy_and_eggs,Nestle,Coffee Mate Liquid Creamer Caramel Macchiato,NestleCoffee Mate Liquid Creamer Caramel Macchiato946 ml,$6.49ea,$5.49ea,$0.58/ 100ml,True,saleEnds 03/01
dairy_and_eggs,Nestle,Coffee Mate Liquid Fat Free French Vanilla,NestleCoffee Mate Liquid Fat Free French Vanilla946 ml,$6.49ea,$5.49ea,$0.58/ 100ml,True,saleEnds 03/01
dairy_and_eggs,Cracker Barrel,Shreds Italiano,Cracker BarrelShreds Italiano320 g,$7.99ea,,$2.50/ 100g,False,
dairy_and_eggs,No Name,Cottage Cheese,No NameCottage Cheese250 g,$3.49ea,,$1.40/ 100g,False,
dairy_and_eggs,Black Diamond,Sliced Medium Cheddar Cheese,Black DiamondSliced Medium Cheddar Cheese240 g,$5.99ea,,$2.50/ 100g,False,
dairy_and_eggs,Armstrong,Marble Cheese Sticks,ArmstrongMarble Cheese Sticks630 g,$14.99ea,,$2.38/ 100g,False,
dairy_and_eggs,Cracker Barrel,Cheese Sauce Kit Creamy Alfredo,Cracker BarrelCheese Sauce Kit Creamy Alfredo271 g,$7.99ea,,$2.95/ 100g,False,
dairy_and_eggs,Gay Lea,Butter Unsalted Organic ,Gay LeaButter Unsalted Organic 250 g,$7.99ea,,$3.20/ 100g,False,
dairy_and_eggs,No Name,"Old Cheddar Cheese, Light","No NameOld Cheddar Cheese, Light400 g",$5.99ea,,$1.50/ 100g,False,
dairy_and_eggs,Liberte,Greek Coconut 2% MF Yogurt,LiberteGreek Coconut 2% MF Yogurt4x100.0 g,$4.99ea,,$1.25/ 100g,False,
dairy_and_eggs,Gay Lea,Spreadables Butter With Canola Oil,Gay LeaSpreadables Butter With Canola Oil227 g,$5.99ea,,$2.64/ 100g,False,
dairy_and_eggs,No Name,Cheddar Flavour Processed Cheese Product Slices,No NameCheddar Flavour Processed Cheese Product Slices400 g,$4.49ea,,$1.12/ 100g,False,
dairy_and_eggs,Gray Ridge,"White Eggs, Large","Gray RidgeWhite Eggs, Large6 eggs",$2.89ea,,$0.48/ 1ea,False,
dairy_and_eggs,No Name,French Onion Sour Cream Dip ,No NameFrench Onion Sour Cream Dip 250 g,$3.99ea,,$1.60/ 100g,False,
dairy_and_eggs,President's Choice,Black Cherry 0% M.F. Greek Yogurt ,President's ChoiceBlack Cherry 0% M.F. Greek Yogurt 4x100.0 g,$4.49ea,,$1.12/ 100g,False,
dairy_and_eggs,Olympic,"Greek Yogurt, Vanilla","OlympicGreek Yogurt, Vanilla650 g",$4.99ea,,$0.77/ 100g,False,
dairy_and_eggs,Liberte,Méditerranée Black Cherry 9% MF Yogurt,LiberteMéditerranée Black Cherry 9% MF Yogurt500 g,$5.79ea,,$1.16/ 100g,False,
dairy_and_eggs,IOGO,Yogurt 1.5% M.F. Variety Pack,IOGOYogurt 1.5% M.F. Variety Pack16x100.0 g,$8.49ea,$6.49ea,$0.41/ 100g,True,saleEnds 03/01
dairy_and_eggs,President's Choice,Vanilla 0% M.F. Greek Yogurt,President's ChoiceVanilla 0% M.F. Greek Yogurt500 g,$6.49ea,,$1.30/ 100g,False,
dairy_and_eggs,Violife,Feta Style Block Alternative To Cheese,ViolifeFeta Style Block Alternative To Cheese200 g,$6.99ea,,$3.50/ 100g,False,
dairy_and_eggs,Liberte,Yogourt Orchard Peach 9 % M.F.,LiberteYogourt Orchard Peach 9 % M.F.4x100.0 g,$4.99ea,,$1.25/ 100g,False,
dairy_and_eggs,Organic Meadow,"Organic Yogurt, Plain 3.8%","Organic MeadowOrganic Yogurt, Plain 3.8%750 g",$7.49ea,,$1.00/ 100g,False,
dairy_and_eggs,PC Organics,Organic Homogenized Milk,PC OrganicsOrganic Homogenized Milk2 l,$7.29ea,,$0.36/ 100ml,False,
dairy_and_eggs,Liberte,Kéfir 1% MF Plain,LiberteKéfir 1% MF Plain1000 ml,$5.50ea,$4.99ea,$0.50/ 100ml,True,saleEnds 03/01
dairy_and_eggs,Activia,"Probiotic Smoothie, Mango, Peach & Carrot, Drinkable Yogurt","ActiviaProbiotic Smoothie, Mango, Peach & Carrot, Drinkable Yogurt190 ml",$2.29ea,,$1.21/ 100ml,False,
dairy_and_eggs,Astro,"Original Balkan Style Yogurt, Plain 0%","AstroOriginal Balkan Style Yogurt, Plain 0%750 g",$4.49ea,$3.99ea,$0.53/ 100g,True,saleEnds 03/01
dairy_and_eggs,President's Choice,"Yogurt, Plant Based Cultured Oat Alternative Yuzu Citrus Flavour","President's ChoiceYogurt, Plant Based Cultured Oat Alternative Yuzu Citrus Flavour500 g",$3.99ea,,$0.80/ 100g,False,
dairy_and_eggs,Liberte,Greek Cherry 2% MF Yogurt,LiberteGreek Cherry 2% MF Yogurt750 g,$6.49ea,,$0.87/ 100g,False,
dairy_and_eggs,Activia,"Yogurt With Probiotics, Vanilla Flavour","ActiviaYogurt With Probiotics, Vanilla Flavour650 g",$3.99ea,,$0.61/ 100g,False,
dairy_and_eggs,Liberte,Goat Milk 3.25% M.F,LiberteGoat Milk 3.25% M.F1 l,$5.49ea,,$0.55/ 100ml,False,
dairy_and_eggs,Savor,Grass Fed Salted Butter,SavorGrass Fed Salted Butter250 g,$7.99ea,,$3.20/ 100g,False,
dairy_and_eggs,President's Choice,Plant Based Kefir Probiotic Fermented Coconut Milk,President's ChoicePlant Based Kefir Probiotic Fermented Coconut Milk1 l,$4.79ea,,$0.48/ 100ml,False,
dairy_and_eggs,Yoplait,Strawberry Banana Yogurt,YoplaitStrawberry Banana Yogurt8x93.0 ml,$7.49ea,,$1.01/ 100ml,False,
dairy_and_eggs,Nestle,Coffee Mate Liquid Hazelnut,NestleCoffee Mate Liquid Hazelnut946 ml,$6.49ea,$5.49ea,$0.58/ 100ml,True,saleEnds 03/01
dairy_and_eggs,Activia,"Probiotic Yogurt, Strawberry/Blueberry/Raspberry/Peach Flavour","ActiviaProbiotic Yogurt, Strawberry/Blueberry/Raspberry/Peach Flavour12x100.0 g",$8.49ea,,$0.71/ 100g,False,
dairy_and_eggs,Yoplait,Yop Drinkable Yogurt Watermelon Flavour ,YoplaitYop Drinkable Yogurt Watermelon Flavour 200 ml,$1.69ea,,$0.85/ 100ml,False,
dairy_and_eggs,President's Choice,Plain 1% M.F. Yogurt,President's ChoicePlain 1% M.F. Yogurt750 g,$3.79ea,,$0.51/ 100g,False,
dairy_and_eggs,Woolwich,Dairy Old Goat's Milk Cheddar Cheese,WoolwichDairy Old Goat's Milk Cheddar Cheese200 g,$9.99ea,$8.99ea,$4.50/ 100g,True,saleEnds 03/08
dairy_and_eggs,Yoplait,Tubes Vanilla Yogurt,YoplaitTubes Vanilla Yogurt8x56.0 g,$4.79ea,,$1.07/ 100g,False,
dairy_and_eggs,The Greek Gods,"Greek Style Yogurt, Traditional Plain","The Greek GodsGreek Style Yogurt, Traditional Plain500 g",$5.49ea,,$1.10/ 100g,False,
dairy_and_eggs,PC Organics,Organic Homogenized Milk,PC OrganicsOrganic Homogenized Milk1 l,$4.69ea,,$0.47/ 100ml,False,
dairy_and_eggs,President's Choice,Plain 2% M.F. Greek Yogurt,President's ChoicePlain 2% M.F. Greek Yogurt4x100.0 g,$4.49ea,,$1.12/ 100g,False,
dairy_and_eggs,Neilson,Trutaste Lactose Free 2% Milk,NeilsonTrutaste Lactose Free 2% Milk2 l,$6.99ea,,$0.35/ 100ml,False,
dairy_and_eggs,Liberte,Raspberry Pomegranate 1.5 % M.F. Drinkable Yogourt,LiberteRaspberry Pomegranate 1.5 % M.F. Drinkable Yogourt1 l,$6.29ea,$4.99ea,$0.50/ 100ml,True,saleEnds 03/01
dairy_and_eggs,PC Organics,"Organic Cultured Coconut Milk Plain, Unsweetened","PC OrganicsOrganic Cultured Coconut Milk Plain, Unsweetened680 g",$5.99ea,,$0.88/ 100g,False,
dairy_and_eggs,Liberte,Kéfir 1% MF Mango,LiberteKéfir 1% MF Mango1000 ml,$5.50ea,$4.99ea,$0.50/ 100ml,True,saleEnds 03/01
dairy_and_eggs,Yoplait,Yop Drinkable Yogurt Blueberry Flavour,YoplaitYop Drinkable Yogurt Blueberry Flavour200 ml,$1.69ea,,$0.85/ 100ml,False,
dairy_and_eggs,Activia,"Yogurt With Probiotics, Stawberry Vanilla Flavour","ActiviaYogurt With Probiotics, Stawberry Vanilla Flavour8x100.0 g",$5.99ea,$5.49ea,$0.69/ 100g,True,saleEnds 03/01
dairy_and_eggs,PC Organics,Organic 2% Milk,PC OrganicsOrganic 2% Milk1 l,$4.69ea,,$0.47/ 100ml,False,
dairy_and_eggs,Liberte,Greek Yogurt Double Cream Plain 8% MF,LiberteGreek Yogurt Double Cream Plain 8% MF650 g,$6.49ea,,$1.00/ 100g,False,
dairy_and_eggs,Violife,Creamy Original ,ViolifeCreamy Original 200 g,$6.99ea,,$3.50/ 100g,False,
dairy_and_eggs,Earth Island,Cheddar Style Dairy-Free Cheese,Earth IslandCheddar Style Dairy-Free Cheese198 g,$6.99ea,,$3.53/ 100g,False,
dairy_and_eggs,Yoplait,Tubes Limited Edition,YoplaitTubes Limited Edition8x56.0 g,$4.79ea,,$1.07/ 100g,False,
dairy_and_eggs,IOGO,"Nano Yogurt, Vanilla","IOGONano Yogurt, Vanilla6x93.0 ml",$3.99ea,,$0.72/ 100ml,False,
dairy_and_eggs,Violife,Mozzarella Style Shreds ,ViolifeMozzarella Style Shreds 227 g,$6.99ea,,$3.08/ 100g,False,
dairy_and_eggs,Armstrong,Snack Marble Cheese,ArmstrongSnack Marble Cheese210 g,$6.99ea,,$3.33/ 100g,False,
dairy_and_eggs,Black Diamond,Natural Cheese Slices Lactose Free Mozzarella Cheese 27% M.F,Black DiamondNatural Cheese Slices Lactose Free Mozzarella Cheese 27% M.F220 g,$5.99ea,,$2.72/ 100g,False,
dairy_and_eggs,Cracker Barrel,Bar Extra Old White Cheddar,Cracker BarrelBar Extra Old White Cheddar400 g,$9.79ea,,$2.45/ 100g,False,
dairy_and_eggs,PC Organics,"Organic Free-Range Large Brown Eggs, Club Pack (30 Count)","PC OrganicsOrganic Free-Range Large Brown Eggs, Club Pack (30 Count)30 ea",$16.29ea,,$16.29/ 1ea,False,
dairy_and_eggs,Yoplait,Source Strawberry 0% MF,YoplaitSource Strawberry 0% MF630 g,$4.79ea,,$0.76/ 100g,False,
dairy_and_eggs,Midday Squares,Chocolate Bar Fudge Yah ,Midday SquaresChocolate Bar Fudge Yah 33 g,$2.99ea,,$9.06/ 100g,False,
dairy_and_eggs,Nestle,Coffee Mate Double Double-Mate Liquid Coffee Enhancer Value Size,NestleCoffee Mate Double Double-Mate Liquid Coffee Enhancer Value Size1.89 l,$8.99ea,,$0.48/ 100ml,False,
dairy_and_eggs,Activia,"Probiotics Yogurt, Yellow Apple/Apricot/Mango/Peach","ActiviaProbiotics Yogurt, Yellow Apple/Apricot/Mango/Peach12x100.0 g",$8.49ea,,$0.71/ 100g,False,
dairy_and_eggs,Rolling Meadow,Grass Fed 3.8% Milk,Rolling MeadowGrass Fed 3.8% Milk2 l,$7.49ea,,$0.37/ 100ml,False,
dairy_and_eggs,Neilson,Ultrafiltered Skim Milk 0% M.F.,NeilsonUltrafiltered Skim Milk 0% M.F.1 l,$3.69ea,$3.29ea,$0.33/ 100ml,True,saleEnds 04/05
dairy_and_eggs,siggi's,Vanilla Yogurt,siggi'sVanilla Yogurt750 g,$7.79ea,,$1.04/ 100g,False,
dairy_and_eggs,Yoplait,Tubes Mixed Berry,YoplaitTubes Mixed Berry8x56.0 g,$4.79ea,,$1.07/ 100g,False,
dairy_and_eggs,Liberte,Kéfir Organic 1% MF Plain,LiberteKéfir Organic 1% MF Plain1000 g,$6.99ea,,$0.70/ 100g,False,
dairy_and_eggs,Activia,"Probiotic Yogurt, Mixed Berries, Drinkable Yogurt, 8 Pack","ActiviaProbiotic Yogurt, Mixed Berries, Drinkable Yogurt, 8 Pack8x93.0 ml",$7.99ea,,$1.07/ 100ml,False,
dairy_and_eggs,siggi's,Lemon 3.25% M.F. Creamy Skyr,siggi'sLemon 3.25% M.F. Creamy Skyr650 g,$7.79ea,,$1.20/ 100g,False,
dairy_and_eggs,Silk,"Dairy Free Plant Based Coconut Yogurt, Vanilla, Unsweetened","SilkDairy Free Plant Based Coconut Yogurt, Vanilla, Unsweetened680 g",$7.49ea,,$1.10/ 100g,False,
dairy_and_eggs,Yoplait,Tubes Strawberry Yogurt,YoplaitTubes Strawberry Yogurt8x56.0 g,$4.79ea,,$1.07/ 100g,False,
dairy_and_eggs,PC Organics,"Organic Greek Yogurt, Plain","PC OrganicsOrganic Greek Yogurt, Plain500 g",$6.49ea,,$1.30/ 100g,False,
dairy_and_eggs,Nestle,Coffee Mate Liquid French Vanilla Value Size,NestleCoffee Mate Liquid French Vanilla Value Size1.89 l,$8.99ea,,$0.48/ 100ml,False,
dairy_and_eggs,Rolling Meadow,"Yogurt, Plain 3.25%","Rolling MeadowYogurt, Plain 3.25%500 g",$4.29ea,,$0.86/ 100g,False,
dairy_and_eggs,Olympic,Organic Yogurt Plain,OlympicOrganic Yogurt Plain1.75 kg,$12.99ea,,$0.74/ 100g,False,
dairy_and_eggs,Rolling Meadow,Grass Fed 2% Milk,Rolling MeadowGrass Fed 2% Milk2 l,$6.29ea,,$0.31/ 100ml,False,
dairy_and_eggs,Silk,"Oat For Coffee, Vanilla, Plant Based, Dairy Free Coffee Creamer","SilkOat For Coffee, Vanilla, Plant Based, Dairy Free Coffee Creamer890 ml",$5.49ea,,$0.62/ 100ml,False,
dairy_and_eggs,PC Organics,"Organic Cheese, Old Cheddar","PC OrganicsOrganic Cheese, Old Cheddar200 g",$6.49ea,,$3.25/ 100g,False,
dairy_and_eggs,Olympic,"Fat Free Organic Yogurt, Plain","OlympicFat Free Organic Yogurt, Plain650 g",$4.99ea,,$0.77/ 100g,False,
dairy_and_eggs,Violife,Cheddar Style Slices ,ViolifeCheddar Style Slices 200 g,$6.99ea,,$3.50/ 100g,False,
dairy_and_eggs,Yoplait,Source Raspberry 0% MF,YoplaitSource Raspberry 0% MF630 g,$4.79ea,,$0.76/ 100g,False,
dairy_and_eggs,Yoplait,Source Cherry Yogurt 0% MF,YoplaitSource Cherry Yogurt 0% MF630 g,$4.79ea,,$0.76/ 100g,False,
dairy_and_eggs,Oikos,"Greek Yogurt, Variety Pack, 6X Strawberry, 6X Vanilla, Blended, 2% M.F.","OikosGreek Yogurt, Variety Pack, 6X Strawberry, 6X Vanilla, Blended, 2% M.F.12x100.0 g",$10.99ea,,$0.92/ 100g,False,
dairy_and_eggs,Yoplait,Yop Drinkable Yogurt  Strawberry-Banana Flavour,YoplaitYop Drinkable Yogurt  Strawberry-Banana Flavour200 ml,$1.69ea,,$0.85/ 100ml,False,
dairy_and_eggs,Silk,"Almond For Coffee, Vanilla, Plant Based, Dairy Free Coffee Creamer","SilkAlmond For Coffee, Vanilla, Plant Based, Dairy Free Coffee Creamer473 ml",$2.99ea,,$0.63/ 100ml,False,
dairy_and_eggs,Forager Project,Cashew Yogurt Alternative Unsweetened Plain,Forager ProjectCashew Yogurt Alternative Unsweetened Plain680 g,$10.99ea,,$1.62/ 100g,False,
dairy_and_eggs,Liberte,3.25% Goat Milk,Liberte3.25% Goat Milk4 l,$12.99ea,,$0.32/ 100ml,False,
dairy_and_eggs,Liberte,Grk Ex Crm Vanilla 5%,LiberteGrk Ex Crm Vanilla 5%650 g,$6.49ea,,$1.00/ 100g,False,
dairy_and_eggs,Liberte,Greek Vanilla Large Size 2 % M.F. Yogourt,LiberteGreek Vanilla Large Size 2 % M.F. Yogourt1 kg,$9.79ea,,$0.98/ 100g,False,
dairy_and_eggs,Organic Meadow,"Organic Cheese, Old Cheddar","Organic MeadowOrganic Cheese, Old Cheddar340 g",$12.99ea,,$3.82/ 100g,False,
dairy_and_eggs,Liberte,Greek Vanilla 2% MF Yogurt,LiberteGreek Vanilla 2% MF Yogurt750 g,$6.49ea,,$0.87/ 100g,False,
dairy_and_eggs,Yoplait,Source Vanilla  Yogurt 0% MF,YoplaitSource Vanilla  Yogurt 0% MF630 g,$4.79ea,,$0.76/ 100g,False,
dairy_and_eggs,President's Choice,"Plant Based Cultured Coconut Milk Yogurt Alternative, Vanilla","President's ChoicePlant Based Cultured Coconut Milk Yogurt Alternative, Vanilla500 g",$4.79ea,,$0.96/ 100g,False,
dairy_and_eggs,PC Organics,"Organic Cultured Coconut Milk Yogurt, Alternative Vanilla","PC OrganicsOrganic Cultured Coconut Milk Yogurt, Alternative Vanilla680 g",$5.99ea,,$0.88/ 100g,False,
dairy_and_eggs,Neilson,"Flavoured Milk, Chocolate","NeilsonFlavoured Milk, Chocolate2 l",$5.99ea,,$0.30/ 100ml,False,
dairy_and_eggs,Burnbrae Farms,"Egg Creations, Cheese & Chives","Burnbrae FarmsEgg Creations, Cheese & Chives500 g",$5.29ea,,$1.06/ 100g,False,
dairy_and_eggs,Cracker Barrel,Bar Old Cheddar,Cracker BarrelBar Old Cheddar400 g,$9.79ea,,$2.45/ 100g,False,
dairy_and_eggs,Yoplait,Tubes Strawberry Yogurt,YoplaitTubes Strawberry Yogurt8x56.0 g,$4.79ea,,$1.07/ 100g,False,
