category,brand,product_text,product_name,price_text,sale_price,per_unit_price_text,is_sale
drinks,Tea at the White House,Black Tea Sticky Toffee Pudding,Tea at the White HouseBlack Tea Sticky Toffee Pudding31.2 g,$9.99ea,,$32.02/ 100g,False
drinks,Crystal Light,Lemon Lime,Crystal LightLemon Lime46.4 g,$3.99ea,,$8.60/ 100g,False
drinks,Snapple,Diet Lemon,SnappleDiet Lemon473 ml,$1.99ea,,$0.42/ 100ml,False
drinks,Limmi,Lemon Juice,LimmiLemon Juice200 ml,$1.99ea,,$1.00/ 100ml,False
drinks,Nescafe,Gold Espresso Decaf Instant Coffee,NescafeGold Espresso Decaf Instant Coffee90 g,$8.29ea,,$9.21/ 100g,False
drinks,Tetley,Rooibos Tea,TetleyRooibos Tea40 ea,$7.99ea,,$0.20/ 1ea,False
drinks,Folgers, Lively Colombian Decaf K-Cup Coffee Pods 12 Count,Folgers Lively Colombian Decaf K-Cup Coffee Pods 12 Count12 ea,$9.99ea,,$0.83/ 1ea,False
drinks,Balzac's,A Dark Affair Whole Bean Coffee,Balzac'sA Dark Affair Whole Bean Coffee340 g,$12.99ea,,$3.82/ 100g,False
drinks,Wissotzky,"Herbal Fruit Tea, Mango & Passion Fruit","WissotzkyHerbal Fruit Tea, Mango & Passion Fruit44 g",$3.39ea,,$7.70/ 100g,False
drinks,Exclusive Brands,Chocolate Flavour Magic Sipper ,Exclusive BrandsChocolate Flavour Magic Sipper 60 g,$2.99ea,,$4.98/ 100g,False
drinks,Greenhouse,Grapefruit Organic Kombucha,GreenhouseGrapefruit Organic Kombucha340 ml,$4.99ea,,$0.82/ 100g,False
drinks,Whistler,Glacial Spring Water,WhistlerGlacial Spring Water500 ml,$1.49ea,,$0.30/ 100ml,False
drinks,iiCiNG,Liquid Beverage Enhancer Raspberry Grapefruit,iiCiNGLiquid Beverage Enhancer Raspberry Grapefruit48 ml,$3.99ea,,$8.31/ 100ml,False
drinks,Tassimo,Nabob Breakfast Blend Coffee Single Serve T-Discs,TassimoNabob Breakfast Blend Coffee Single Serve T-Discs14 ea,$11.99ea,,$9.75/ 100g,False
drinks,Van Houtte,"Coffee, Ground  Flavoured Irish Cream Light Roast 12 Recyclable K-Cup Pods","Van HoutteCoffee, Ground  Flavoured Irish Cream Light Roast 12 Recyclable K-Cup Pods12 ea",$12.99ea,,$1.08/ 1ea,False
drinks,Odouls,Beer Dealcoholized,OdoulsBeer Dealcoholized12x355.0 ml,$14.99pack of 12,,$0.35/ 100ml,False
drinks,Voss,Carbonated Artesian Mineralised Water  Sparkling Tangerine Lemongrass,VossCarbonated Artesian Mineralised Water  Sparkling Tangerine Lemongrass375 ml,$2.79ea,,$0.74/ 100ml,False
drinks,Voss,"Sparkling Water, Lime Mint","VossSparkling Water, Lime Mint375 ml",$2.49ea,,$0.66/ 100ml,False
drinks,International Delight,"Coffee Creamer, Hazelnut Portion Cups, 24 Pack","International DelightCoffee Creamer, Hazelnut Portion Cups, 24 Pack13 g",$4.99ea,,$38.38/ 100g,False
drinks,Terra Beata,Undiluted Cherry Juice,Terra BeataUndiluted Cherry Juice473 ml,$5.29ea,,$1.12/ 100ml,False
drinks,Hawaiian Punch,"Liquid Water Enhancer, Fruit Juicy Red","Hawaiian PunchLiquid Water Enhancer, Fruit Juicy Red48 ml",$3.99ea,,$8.31/ 100ml,False
drinks,Cha's Organics,Turmeric Latte Instant Mix,Cha's OrganicsTurmeric Latte Instant Mix110 g,$14.99ea,,$13.63/ 100g,False
drinks,Remedy,Kombucha Raspberry Lemonade    ,RemedyKombucha Raspberry Lemonade    330 ml,$3.99ea,,$1.21/ 100ml,False
drinks,Monster Energy,Zero Sugar Can,Monster EnergyZero Sugar Can8x355.0 ml,$23.99c08,,$0.84/ 100ml,False
drinks,Starbucks,Sumatra Dark Roast Whole Bean Coffee Bag,StarbucksSumatra Dark Roast Whole Bean Coffee Bag340 g,$12.99ea,,$3.82/ 100g,False
drinks,Starbucks,Winter Blend Ground Coffee,StarbucksWinter Blend Ground Coffee283 g,$12.99ea,,$4.59/ 100g,False
drinks,Muskoka,Maple Pods,MuskokaMaple Pods220 g,$20.99ea,,$9.54/ 100g,False
drinks,Madawaska Coffee Co.,Ground Coffee  Light Roast,Madawaska Coffee Co.Ground Coffee  Light Roast245 g,$13.99ea,,$5.71/ 100g,False
drinks,Tree of Life,Earth Group Aluminium Bottle Spring Water,Tree of LifeEarth Group Aluminium Bottle Spring Water473 ml,$3.29ea,,$0.70/ 100ml,False
drinks,President's Choice,Original Carbonated Natural Spring Water,President's ChoiceOriginal Carbonated Natural Spring Water1 l,$1.99ea,,$0.20/ 100ml,False
drinks,President's Choice,Chai Tea Latte Flavoured Beverage Pods,President's ChoiceChai Tea Latte Flavoured Beverage Pods112 g,$7.49ea,$6.99ea,$6.24/ 100g,True
drinks,Fruit2O,"Fruit 2O Sparkling Water, Grape","Fruit2OFruit 2O Sparkling Water, Grape502 ml",$1.99ea,,$0.40/ 100ml,False
drinks,Starbucks,Tripleshot Café Mocha,StarbucksTripleshot Café Mocha444 ml,$3.99ea,,$0.90/ 100ml,False
drinks,Tim Hortons,Ground Coffee Bright Espresso,Tim HortonsGround Coffee Bright Espresso10 ea,$8.99ea,,$0.90/ 1ea,False
drinks,Bean Head,Specialty Coffee Ground Medium Dark Roast,Bean HeadSpecialty Coffee Ground Medium Dark Roast340 g,$13.99ea,,$4.11/ 100g,False
drinks,Twinings,Superblends Herbal Tea Peppermint & Fennel,TwiningsSuperblends Herbal Tea Peppermint & Fennel18 ea,$6.99ea,$5.99ea,$0.33/ 1ea,True
drinks,Toro Matcha,Sparkling Energizing Infusion Lemon+Mint,Toro MatchaSparkling Energizing Infusion Lemon+Mint355 ml,$3.99ea,,$1.12/ 100ml,False
drinks,Starbucks,Whole Bean 100% Arabica Coffee Espresso Roast Dark Roast,StarbucksWhole Bean 100% Arabica Coffee Espresso Roast Dark Roast907 g,$26.99ea,,$2.98/ 100g,False
drinks,Starbucks,Nespresso Single Origin Colombia  ,StarbucksNespresso Single Origin Colombia  57 g,$11.49ea,,$20.16/ 100g,False
drinks,Red Bull,Energy Drink,Red BullEnergy Drink12x250.0 ml,$29.99pack of 12,,$1.00/ 100ml,False
drinks,Tim Hortons,K-Cup Single Serve Espresso,Tim HortonsK-Cup Single Serve Espresso12 ea,$12.99ea,$9.99ea,$0.83/ 1ea,True
drinks,Stassen,Jasmine Green Tea,StassenJasmine Green Tea150 g,$6.99ea,,$4.66/ 100g,False
drinks,Tim Hortons,"Tea, Green  with Lemongrass 20  Bags","Tim HortonsTea, Green  with Lemongrass 20  Bags20 ea",$5.49ea,,$0.27/ 1ea,False
drinks,DAVIDsTEA,Fruit Infusion Forever Nuts,DAVIDsTEAFruit Infusion Forever Nuts30 g,$9.99ea,,$33.30/ 100g,False
drinks,Inglenook,White Chardonnay Dealcoholized Wine,InglenookWhite Chardonnay Dealcoholized Wine750 ml,$10.99ea,,$1.47/ 100ml,False
drinks,Twinings,20ct Lemon & Ginger,Twinings20ct Lemon & Ginger20 ea,$6.49ea,,$0.32/ 1ea,False
drinks,DAVIDsTEA,White Tea Buddha'S Blend,DAVIDsTEAWhite Tea Buddha'S Blend18 g,$9.99ea,,$55.50/ 100g,False
drinks,Bolthouse,Vanilla Chai Tea,BolthouseVanilla Chai Tea946 ml,$6.99ea,,$0.74/ 100ml,False
drinks,Vin(zero),"Chardonnay, Non-Alcoholic     ","Vin(zero)Chardonnay, Non-Alcoholic     750 ml",$11.50ea,$9.99ea,$1.33/ 100ml,True
drinks,Twinings,"Tea, Camomile, Honey & Vanilla Herbal ","TwiningsTea, Camomile, Honey & Vanilla Herbal 20 ea",$6.49ea,,$0.32/ 1ea,False
drinks,Nescafe,"Coffee, Gold Espresso Intenso, Roast & Ground  Capsules","NescafeCoffee, Gold Espresso Intenso, Roast & Ground  Capsules300 g",$19.99ea,,$6.66/ 100g,False
drinks,Marley Coffee,"Lively Up Fair Trade, Coffee","Marley CoffeeLively Up Fair Trade, Coffee12 ea",$9.99ea,,$0.83/ 1ea,False
drinks,Casablanca,Basil Seed Drink with Pomegranate Flavor,CasablancaBasil Seed Drink with Pomegranate Flavor290 ml,$1.19ea,,$0.41/ 100ml,False
drinks,San Pellegrino,Naturali Pompelmo Sparkling Grapefruit Beverage,San PellegrinoNaturali Pompelmo Sparkling Grapefruit Beverage6x330.0 ml,$7.49c06,,$0.38/ 100ml,False
drinks,President's Choice,"The Great Canadian Maple Flavoured Coffee, Single Serve Coffee Pods","President's ChoiceThe Great Canadian Maple Flavoured Coffee, Single Serve Coffee Pods136 g",$7.49ea,$6.99ea,$5.14/ 100g,True
drinks,Twinings,12ct Chai K-Cup,Twinings12ct Chai K-Cup12 ea,$11.99ea,,$1.00/ 1ea,False
drinks,Tea at the White House,Black Tea Cream Earl Grey,Tea at the White HouseBlack Tea Cream Earl Grey31.2 g,$9.99ea,,$32.02/ 100g,False
drinks,Earths Own,"Almond Fresh, Chocolate","Earths OwnAlmond Fresh, Chocolate1.89 l",$4.49ea,,$0.24/ 100ml,False
drinks,Tim Hortons,"Instant Coffee, Decaf","Tim HortonsInstant Coffee, Decaf100 g",$9.49ea,,$9.49/ 100g,False
drinks,Lavazza,Perfetto Dark Roast Whole Bean Coffee,LavazzaPerfetto Dark Roast Whole Bean Coffee340 g,$12.99ea,,$3.82/ 100g,False
drinks,Kiki McDonough,Maple Water Blueberry,Kiki McDonoughMaple Water Blueberry240x240.0 ml,$2.99ea,,$1.25/ 100ml,False
drinks,PC Black Label,Lemon Sour Mix,PC Black LabelLemon Sour Mix375 ml,$5.29ea,,$1.41/ 100ml,False
drinks,Starbucks,Verona Dark Roast Whole Bean Coffee Bag,StarbucksVerona Dark Roast Whole Bean Coffee Bag340 g,$12.99ea,,$3.82/ 100g,False
drinks,Van Houtte,"Coffee, House Blend Dark Roast , K Cup","Van HoutteCoffee, House Blend Dark Roast , K Cup114 g",$12.99ea,,$11.39/ 100g,False
drinks,Tim Hortons,Whole Bean Original Blend,Tim HortonsWhole Bean Original Blend300 g,$10.99ea,$8.99ea,$3.00/ 100g,True
drinks,Limmi,Lemon Juice,LimmiLemon Juice200 ml,$1.99ea,,$1.00/ 100ml,False
drinks,International Delight,"Coffee Creamer, Hazelnut Portion Cups, 24 Pack","International DelightCoffee Creamer, Hazelnut Portion Cups, 24 Pack13 g",$4.99ea,,$38.38/ 100g,False
drinks,Voss,"Sparkling Water, Lime Mint","VossSparkling Water, Lime Mint375 ml",$2.49ea,,$0.66/ 100ml,False
drinks,Cha's Organics,Turmeric Latte Instant Mix,Cha's OrganicsTurmeric Latte Instant Mix110 g,$14.99ea,,$13.63/ 100g,False
drinks,Monster Energy,Zero Sugar Can,Monster EnergyZero Sugar Can8x355.0 ml,$23.99c08,,$0.84/ 100ml,False
drinks,Starbucks,Sumatra Dark Roast Whole Bean Coffee Bag,StarbucksSumatra Dark Roast Whole Bean Coffee Bag340 g,$12.99ea,,$3.82/ 100g,False
drinks,Yorkshire Tea,Yorkshire Gold Orange Pekoe Tea,Yorkshire TeaYorkshire Gold Orange Pekoe Tea80 ea,$9.99ea,,$0.12/ 1ea,False
drinks,Elite,Instant Coffee,EliteInstant Coffee200 g,$10.69ea,,$5.35/ 100g,False
drinks,DAVIDsTEA,Black Tea Cream Of Earl Grey Organic,DAVIDsTEABlack Tea Cream Of Earl Grey Organic22.8 g,$9.99ea,,$43.82/ 100g,False
drinks,CLAUSTHALER,Classic Beer Non-Alcoholic ,CLAUSTHALERClassic Beer Non-Alcoholic 4x330.0 ml,$7.99pack of 4,,$0.61/ 100ml,False
drinks,Wissotzky,"Herbal Fruit Tea, Mango & Passion Fruit","WissotzkyHerbal Fruit Tea, Mango & Passion Fruit44 g",$3.39ea,,$7.70/ 100g,False
drinks,Exclusive Brands,Chocolate Flavour Magic Sipper ,Exclusive BrandsChocolate Flavour Magic Sipper 60 g,$2.99ea,,$4.98/ 100g,False
drinks,Toro Matcha,Sparkling Energizing Infusion Lemon+Mint,Toro MatchaSparkling Energizing Infusion Lemon+Mint355 ml,$3.99ea,,$1.12/ 100ml,False
drinks,Red Bull,Energy Drink,Red BullEnergy Drink12x250.0 ml,$29.99pack of 12,,$1.00/ 100ml,False
drinks,Dole,Premium Pineapple Juice ,DolePremium Pineapple Juice 4x250.0 ml,$3.99pack of 4,,$0.40/ 100ml,False
drinks,Cool Runnings,Fruit Beverage Syrup Strawberry,Cool RunningsFruit Beverage Syrup Strawberry750 ml,$4.99ea,,$0.67/ 100ml,False
drinks,Tetley,Rooibos Tea,TetleyRooibos Tea40 ea,$7.99ea,,$0.20/ 1ea,False
drinks,Voss,Artesian Spring Water,VossArtesian Spring Water800 ml,$4.49ea,,$0.56/ 100ml,False
drinks,Crystal Light,"Pitcher Packs, Lemonade","Crystal LightPitcher Packs, Lemonade56.6 g",$3.99ea,,$7.05/ 100g,False
drinks,Minute Maid,Mango Passion,Minute MaidMango Passion1.54 l,$4.99ea,,$0.32/ 100ml,False
drinks,Tim Hortons,Dark Roast Coffee,Tim HortonsDark Roast Coffee300 g,$10.99ea,$8.99ea,$3.00/ 100g,True
drinks,President's Choice,8-Vegetable Cocktail,President's Choice8-Vegetable Cocktail1.89 l,$3.49ea,,$0.18/ 100ml,False
drinks,No Name,California Style Iced Tea Mix,No NameCalifornia Style Iced Tea Mix2 kg,$7.49ea,,$0.36/ 100g,False
drinks,President's Choice,Green Tea,President's ChoiceGreen Tea20 ea,$3.99ea,,$0.20/ 1ea,False
drinks,Allen's, Lemonade,Allen's Lemonade1 l,$2.29ea,,$0.23/ 100ml,False
drinks,Al Rifai,Premium Ground Brazilian Coffee,Al RifaiPremium Ground Brazilian Coffee450 g,$8.79ea,,$1.95/ 100g,False
drinks,Crystal Light,"Liquid Drink Mix, Strawberry Lemon","Crystal LightLiquid Drink Mix, Strawberry Lemon48 ml",$4.29ea,,$8.94/ 100ml,False
drinks,Oasis,Smoothie Green Activ,OasisSmoothie Green Activ1.75 l,$6.49ea,,$0.37/ 100ml,False
drinks,Rose,Lime Cordial,RoseLime Cordial739 ml,$5.49ea,,$0.74/ 100ml,False
drinks,Bubly Sparkling Water,Sparkling Water Limebubly,Bubly Sparkling WaterSparkling Water Limebubly473 ml,$2.49ea,,$0.53/ 100ml,False
drinks,President's Choice,Original Tomato Clam Cocktail,President's ChoiceOriginal Tomato Clam Cocktail1.89 l,$2.79ea,,$0.15/ 100ml,False
drinks,President's Choice,Colombian Supremo Medium Roast Whole Bean Coffee,President's ChoiceColombian Supremo Medium Roast Whole Bean Coffee907 g,$14.99ea,,$1.65/ 100g,False
drinks,Montellier,"Carbonated Water, Lemon ","MontellierCarbonated Water, Lemon 10x355.0 ml",$7.49pack of 10,,$0.21/ 100ml,False
drinks,Tropicana,Blackberry Blueberry Fruit Drink   ,TropicanaBlackberry Blueberry Fruit Drink   1.54 l,$5.49ea,,$0.36/ 100ml,False
drinks,President's Choice,Original Lemonade,President's ChoiceOriginal Lemonade1.89 l,$3.29ea,,$0.17/ 100ml,False
drinks,Eagle Brand,Brand Sweetened Condensed Milk,Eagle BrandBrand Sweetened Condensed Milk300 ml,$4.79ea,,$1.60/ 100ml,False
drinks,AHA,Sparkling Water Beverage Orange + Grapefruit,AHASparkling Water Beverage Orange + Grapefruit12x355.0 ml,$7.49pack of 12,,$0.18/ 100ml,False
drinks,Realime,Single Strength Lime Juice,RealimeSingle Strength Lime Juice440 ml,$3.49ea,,$0.79/ 100ml,False
drinks,President's Choice,Diet Ginger Ale 6 Cans,President's ChoiceDiet Ginger Ale 6 Cans6x222.0 ml,$3.99pack of 6,,$0.30/ 100ml,False
drinks,Nescafe,"Tasters Choice Classic, Instant Coffee","NescafeTasters Choice Classic, Instant Coffee250 g",$14.99ea,,$6.00/ 100g,False
drinks,Tetley,The corse orange pekoe - Corse ,TetleyThe corse orange pekoe - Corse 72 ea,$4.99ea,,$0.07/ 1ea,False
drinks,President's Choice,100% Cranberry Juice Blend,President's Choice100% Cranberry Juice Blend1.89 l,$3.49ea,,$0.18/ 100ml,False
drinks,Oasis,Pineapple Banana Orange Juice,OasisPineapple Banana Orange Juice960 ml,$1.79ea,,$0.19/ 100ml,False
drinks,Vitamalt,Classic Malt Beverage,VitamaltClassic Malt Beverage330 ml,$1.29ea,,$0.39/ 100ml,False
drinks,Fruite,Fruit Punch Drink,FruiteFruit Punch Drink2 l,$2.89ea,,$0.14/ 100ml,False
drinks,Kraft,Pineapple Orange Liquid Drink Mix,KraftPineapple Orange Liquid Drink Mix48 ml,$4.29ea,,$8.94/ 100ml,False
drinks,President's Choice,Half & Half Lemonade With Iced Tea,President's ChoiceHalf & Half Lemonade With Iced Tea1.89 l,$3.29ea,,$0.17/ 100ml,False
drinks,No Name,Pasteurized Instant Skim Milk Powder,No NamePasteurized Instant Skim Milk Powder2.5 kg,$29.99ea,,$1.20/ 100g,False
drinks,President's Choice,Espresso 100% Arabica Coffee,President's ChoiceEspresso 100% Arabica Coffee907 g,$14.99ea,,$1.65/ 100g,False
drinks,Angel,Evaporada (Evaporated Liquid Creamer),AngelEvaporada (Evaporated Liquid Creamer)405 ml,$1.99ea,,$0.49/ 100ml,False
drinks,Lavazza,Roasted Coffee Beans Qualità Rossa,LavazzaRoasted Coffee Beans Qualità Rossa1 kg,$23.99ea,$19.99ea,$2.00/ 100g,True
drinks,Coca-Cola,Soda ,Coca-ColaSoda 6x710.0 ml,$6.99pack of 6,,$0.16/ 100ml,False
drinks,Sparkling Ice,Cherry Limeade Sparkling Water,Sparkling IceCherry Limeade Sparkling Water503 ml,$2.29ea,,$0.46/ 100ml,False
drinks,Pepsi,Diet Soda Caffeine Free,PepsiDiet Soda Caffeine Free12x355.0 ml,$7.49c12,,$0.18/ 100ml,False
drinks,President's Choice,Diet Ginger Ale,President's ChoiceDiet Ginger Ale2 l,$1.99ea,,$0.10/ 100ml,False
drinks,MiO,Sport Lemon Lime Liquid Water Enhancer,MiOSport Lemon Lime Liquid Water Enhancer48 ml,$4.29ea,,$8.94/ 100ml,False
drinks,Crush,Orange Soda     ,CrushOrange Soda     6x222.0 ml,$4.99pack of 6,,$0.37/ 100ml,False
drinks,Gold Kili,Instant Ginger Latte With Honey,Gold KiliInstant Ginger Latte With Honey250 g,$4.99ea,,$2.00/ 100g,False
drinks,Coors,Edge Non-Alcoholic Beer with Natural Flavours Double Brewed ,CoorsEdge Non-Alcoholic Beer with Natural Flavours Double Brewed 12x355.0 ml,$21.99pack of 12,,$0.52/ 100ml,False
drinks,Nescafe,Rich Intense Instant Coffee,NescafeRich Intense Instant Coffee160 g,$7.79ea,,$4.87/ 100g,False
drinks,Pepsi,Diet Soda,PepsiDiet Soda24x355.0 ml,$14.99pack of 24,,$0.18/ 100ml,False
drinks,Cool Runnings,Runnings Coconut Water    ,Cool RunningsRunnings Coconut Water    500 ml,$2.29ea,,$0.46/ 100ml,False
drinks,Tea India,"Chai Tea Latte Mix, Cardamom","Tea IndiaChai Tea Latte Mix, Cardamom224 g",$6.29ea,,$2.81/ 100g,False
drinks,Rubicon,Guanabana Juice,RubiconGuanabana Juice1 l,$2.69ea,,$0.27/ 100ml,False
drinks,PC Blue Menu,Blueberry Cocktail,PC Blue MenuBlueberry Cocktail1.89 l,$3.49ea,,$0.18/ 100ml,False
drinks,President's Choice,Fruit Punch Liquid Water Enhancer,President's ChoiceFruit Punch Liquid Water Enhancer48 ml,$3.99ea,,$8.31/ 100ml,False
drinks,Nescafe,Sweet & Creamy Iced Original Instant Coffee Mix ,NescafeSweet & Creamy Iced Original Instant Coffee Mix 256 g,$7.79ea,,$3.04/ 100g,False
drinks,Crystal Light,Iced Tea Powdered Drink Mix Pitcher Packs,Crystal LightIced Tea Powdered Drink Mix Pitcher Packs30.9 g,$3.99ea,,$12.91/ 100g,False
drinks,Nestea,"Zero Sugar Tea, Bottle","NesteaZero Sugar Tea, Bottle1.89 l",$3.29ea,,$0.17/ 100ml,False
drinks,MiO,Berry Pomegranate Liquid Water Enhancer,MiOBerry Pomegranate Liquid Water Enhancer48 ml,$4.29ea,,$8.94/ 100ml,False
drinks,President's Choice,Diet Spritz-Up Naturally Flavoured Calorie-Free Sugar-Free Lemon-Lime Soda,President's ChoiceDiet Spritz-Up Naturally Flavoured Calorie-Free Sugar-Free Lemon-Lime Soda12x355.0 ml,$6.49ea,,$0.15/ 100ml,False
drinks,Maxwell House,Original Roast Instant Coffee,Maxwell HouseOriginal Roast Instant Coffee150 g,$6.99ea,,$4.66/ 100g,False
drinks,Allen's,Apple Juice,Allen'sApple Juice1.89 l,$3.99ea,,$0.21/ 100ml,False
drinks,President's Choice,Rooibos Red Tea,President's ChoiceRooibos Red Tea20 ea,$3.99ea,,$0.20/ 1ea,False
drinks,President's Choice,Spritz Up Lemon-Lime Soda,President's ChoiceSpritz Up Lemon-Lime Soda2 l,$1.99ea,,$0.10/ 100ml,False
drinks,President's Choice,Espresso Perfetto,President's ChoiceEspresso Perfetto250 g,$6.99ea,,$2.80/ 100g,False
drinks,AQUAFINA,Water ,AQUAFINAWater 24x500.0 ml,$7.99pack of 24,,$0.07/ 100ml,False
drinks,Rubicon,Lychee Exotic Juice Drink,RubiconLychee Exotic Juice Drink1 l,$2.69ea,,$0.27/ 100ml,False
drinks,Oasis,Watermelon Apple Fruit Juice,OasisWatermelon Apple Fruit Juice960 ml,$1.79ea,,$0.19/ 100ml,False
drinks,Fruite,Lemon Iced Tea,FruiteLemon Iced Tea2 l,$2.89ea,,$0.14/ 100ml,False
drinks,President's Choice,Orange Soda,President's ChoiceOrange Soda12x355.0 ml,$6.49pack of 12,,$0.15/ 100ml,False
drinks,Peace Tea,"Peach Tea, Cherry","Peace TeaPeach Tea, Cherry695 ml",$1.99ea,,$0.29/ 100ml,False
drinks,Starbucks,Blonde Roast Iced Coffee,StarbucksBlonde Roast Iced Coffee1.42 l,$9.99ea,,$0.70/ 100ml,False
drinks,Minute Maid,Fruit Punch,Minute MaidFruit Punch1.54 l,$4.99ea,,$0.32/ 100ml,False
drinks,Twinings,Herbal Tea Goodnight Blend,TwiningsHerbal Tea Goodnight Blend50 ea,$10.99ea,,$0.22/ 1ea,False
drinks,President's Choice,Diet Grapefruit Sparkling Soda,President's ChoiceDiet Grapefruit Sparkling Soda12x355.0 ml,$6.49pack of 12,,$0.15/ 100ml,False
drinks,Real Lemon,Single Strength Lemon Juice,Real LemonSingle Strength Lemon Juice125 ml,$1.49ea,,$1.19/ 100ml,False
drinks,V8,Vegetable Cocktail,V8Vegetable Cocktail6x156.0 ml,$4.29ea,,$0.46/ 100ml,False
drinks,Dabur, Alphonso Mango Fruit Juice Nectar,Dabur Alphonso Mango Fruit Juice Nectar1 l,$4.99ea,,$0.50/ 100ml,False
drinks,President's Choice,Gourmet West Coast Dark Whole Bean Coffee,President's ChoiceGourmet West Coast Dark Whole Bean Coffee907 g,$14.99ea,,$1.65/ 100g,False
drinks,Tim Hortons,Variety Pack K-Cup Coffee Pods,Tim HortonsVariety Pack K-Cup Coffee Pods30 ea,$24.99ea,,$0.83/ 1ea,False
drinks,PC Organics,Organic 100% Maple Water,PC OrganicsOrganic 100% Maple Water1 l,$4.49ea,,$0.45/ 100ml,False
drinks,President's Choice,Diet Tonic Water,President's ChoiceDiet Tonic Water2 l,$1.99ea,,$0.10/ 100ml,False
drinks,Van Houtte,Vanilla Hazelnut Ground Coffee,Van HoutteVanilla Hazelnut Ground Coffee340 g,$13.99ea,,$4.11/ 100g,False
drinks,MiO,Sport Lemon Lime Liquid Water Enhancer,MiOSport Lemon Lime Liquid Water Enhancer48 ml,$4.29ea,,$8.94/ 100ml,False
drinks,Crush,Orange Soda     ,CrushOrange Soda     6x222.0 ml,$4.99pack of 6,,$0.37/ 100ml,False
drinks,Gold Kili,Instant Ginger Latte With Honey,Gold KiliInstant Ginger Latte With Honey250 g,$4.99ea,,$2.00/ 100g,False
drinks,Coors,Edge Non-Alcoholic Beer with Natural Flavours Double Brewed ,CoorsEdge Non-Alcoholic Beer with Natural Flavours Double Brewed 12x355.0 ml,$21.99pack of 12,,$0.52/ 100ml,False
drinks,Nescafe,Rich Intense Instant Coffee,NescafeRich Intense Instant Coffee160 g,$7.79ea,,$4.87/ 100g,False
drinks,Pepsi,Diet Soda,PepsiDiet Soda24x355.0 ml,$14.99pack of 24,,$0.18/ 100ml,False
drinks,Cool Runnings,Runnings Coconut Water    ,Cool RunningsRunnings Coconut Water    500 ml,$2.29ea,,$0.46/ 100ml,False
drinks,Tea India,"Chai Tea Latte Mix, Cardamom","Tea IndiaChai Tea Latte Mix, Cardamom224 g",$6.29ea,,$2.81/ 100g,False
drinks,Rubicon,Guanabana Juice,RubiconGuanabana Juice1 l,$2.69ea,,$0.27/ 100ml,False
drinks,PC Blue Menu,Blueberry Cocktail,PC Blue MenuBlueberry Cocktail1.89 l,$3.49ea,,$0.18/ 100ml,False
drinks,President's Choice,Fruit Punch Liquid Water Enhancer,President's ChoiceFruit Punch Liquid Water Enhancer48 ml,$3.99ea,,$8.31/ 100ml,False
drinks,Nescafe,Sweet & Creamy Iced Original Instant Coffee Mix ,NescafeSweet & Creamy Iced Original Instant Coffee Mix 256 g,$7.79ea,,$3.04/ 100g,False
drinks,President's Choice,Grape Cranberry Cocktail,President's ChoiceGrape Cranberry Cocktail1.89 l,$3.49ea,,$0.18/ 100ml,False
drinks,Del Monte,Orange Juice Without Pulp,Del MonteOrange Juice Without Pulp2.5 l,$8.99ea,,$0.36/ 100ml,False
drinks,Oasis,Tropical Fruits Fruit Juice And Filtered Water Blend,OasisTropical Fruits Fruit Juice And Filtered Water Blend960 ml,$1.79ea,,$0.19/ 100ml,False
drinks,Nescafe,"Sweet & Creamy, Ice Java","NescafeSweet & Creamy, Ice Java470 ml",$6.49ea,,$1.38/ 100ml,False
drinks,Lotte,Milkis Carbonated Drink Refreshing Milk & Yogurt Flavor Original,LotteMilkis Carbonated Drink Refreshing Milk & Yogurt Flavor Original6x250.0 ml,$5.29c06,,$2.12/ 100ml,False
drinks,Canada Dry,Ginger Ale ,Canada DryGinger Ale 6x710.0 ml,$6.99pack of 6,,$0.16/ 100ml,False
drinks,FANTA,Fanta Orange,FANTAFanta Orange500 ml,$2.99ea,,$0.60/ 100ml,False
drinks,The Great Gentleman, Spicy Ginger Beer,The Great Gentleman Spicy Ginger Beer250 ml,$1.29ea,,$0.52/ 100ml,False
drinks,President's Choice,Blonde Brew Dealcoholized Lager Beer,President's ChoiceBlonde Brew Dealcoholized Lager Beer12x355.0 ml,$8.99pack of 12,,$0.21/ 100ml,False
drinks,Suraj,Masala Chai Tea,SurajMasala Chai Tea166 g,$4.89ea,,$2.95/ 100g,False
drinks,Maxwell House,House Blend Pods,Maxwell HouseHouse Blend Pods585 g,$37.99c01,,$6.49/ 100g,False
drinks,President's Choice,Orange Pekoe Premium Black Tea,President's ChoiceOrange Pekoe Premium Black Tea216 ea,$10.99ea,,$0.05/ 1ea,False
drinks,President's Choice,Peach Mist Naturally Fruit-Flavoured Water Beverage,President's ChoicePeach Mist Naturally Fruit-Flavoured Water Beverage6x500.0 ml,$3.99pack of 6,,$0.13/ 100ml,False
drinks,Tamam,Herbal Tea,TamamHerbal Tea100 g,$5.49ea,,$5.49/ 100g,False
drinks,Pride Of Arabia,Whole Bean Arabica Coffee,Pride Of ArabiaWhole Bean Arabica Coffee907 g,$19.99ea,,$2.20/ 100g,False
drinks,Carl Jung,"De-Alcoholized Wine, Red","Carl JungDe-Alcoholized Wine, Red750 ml",$7.99ea,,$1.07/ 100ml,False
drinks,Five Alive,Mango Citrus Juice,Five AliveMango Citrus Juice1.75 l,$4.79ea,,$0.27/ 100ml,False
drinks,Maxwell House,Morning Blend Coffee 100% Compostable K Cup Coffee Pods,Maxwell HouseMorning Blend Coffee 100% Compostable K Cup Coffee Pods285 g,$17.99ea,,$6.31/ 100g,False
drinks,Pepsi,Diet Soda,PepsiDiet Soda2 l,$3.99ea,,$0.20/ 100ml,False
drinks,Silk,Fortified Oat Beverage Original,SilkFortified Oat Beverage Original946 ml,$3.29ea,,$0.35/ 100ml,False
drinks,Nabob,Breakfast Blend Coffee 100% Compostable Pods,NabobBreakfast Blend Coffee 100% Compostable Pods292 g,$18.99ea,,$6.50/ 100g,False
drinks,Nabob,100% Colombian Coffee 100% Compostable Pods,Nabob100% Colombian Coffee 100% Compostable Pods292 g,$18.99ea,,$6.50/ 100g,False
drinks,Nestle,Nesquik Chocolate Syrup,NestleNesquik Chocolate Syrup700 ml,$6.99ea,,$1.00/ 100ml,False
drinks,Tetley,Herbal Tea Live Calm Camomile Spearmint Orange,TetleyHerbal Tea Live Calm Camomile Spearmint Orange30 g,$3.99ea,,$13.30/ 100g,False
drinks,Minute Maid,"Fruit Punch Juice Beverage, 10 Pack","Minute MaidFruit Punch Juice Beverage, 10 Pack10x200.0 ml",$4.19ea,$3.99ea,$0.20/ 100ml,True
drinks,President's Choice,Concord Grape 100% Juice Blend,President's ChoiceConcord Grape 100% Juice Blend1 l,$1.99ea,,$0.20/ 100ml,False
drinks,President's Choice,Merlot Dealcoholized Wine,President's ChoiceMerlot Dealcoholized Wine750 ml,$7.49ea,$6.99ea,$0.93/ 100ml,True
drinks,Grace,Coconut Water with Pulp,GraceCoconut Water with Pulp500 ml,$1.68ea,,$0.34/ 100ml,False
drinks,Oasis,Peach Clementine Juice,OasisPeach Clementine Juice8x200.0 ml,$3.49ea,,$0.22/ 100ml,False
drinks,No Name,Hot Chocolate Mix ,No NameHot Chocolate Mix 1.8 kg,$14.99ea,,$0.83/ 100g,False
drinks,Thirsty Buddha,All Natural Coconut Water,Thirsty BuddhaAll Natural Coconut Water500 ml,$3.99ea,,$0.80/ 100ml,False
drinks,Nestea,Iced Tea Natural Lemon Flavour  ,NesteaIced Tea Natural Lemon Flavour  500 ml,$3.29ea,,$0.66/ 100ml,False
drinks,Nestle,Nesquik Less Sugar Chocolate Syrup,NestleNesquik Less Sugar Chocolate Syrup510 ml,$6.99ea,,$1.37/ 100ml,False
drinks,Oasis,Exotic Mango Fruit Juice,OasisExotic Mango Fruit Juice960 ml,$1.79ea,,$0.19/ 100ml,False
drinks,Nature,Regular Strength,NatureRegular Strength30 ea,$8.29ea,,$13.82/ 100g,False
drinks,Tea India,"Chai Tea Latte Mix, Milk Tea","Tea IndiaChai Tea Latte Mix, Milk Tea224 g",$6.29ea,,$2.81/ 100g,False
drinks,Tim Hortons,Dark Roast Coffee,Tim HortonsDark Roast Coffee300 g,$10.99ea,$8.99ea,$3.00/ 100g,True
drinks,President's Choice,8-Vegetable Cocktail,President's Choice8-Vegetable Cocktail1.89 l,$3.49ea,,$0.18/ 100ml,False
drinks,No Name,California Style Iced Tea Mix,No NameCalifornia Style Iced Tea Mix2 kg,$7.49ea,,$0.36/ 100g,False
drinks,President's Choice,Green Tea,President's ChoiceGreen Tea20 ea,$3.99ea,,$0.20/ 1ea,False
drinks,Allen's, Lemonade,Allen's Lemonade1 l,$2.29ea,,$0.23/ 100ml,False
