category,brand,product_text,product_name,price_text,sale_price,per_unit_price_text,is_sale
drinks,Ovaltine,"Malted Drink, Classic","OvaltineMalted Drink, Classic400 g",$6.49ea,,$1.62/ 100g,False
drinks,Tim Hortons,Columbian K-Cup Coffee Pods,Tim HortonsColumbian K-Cup Coffee Pods30 ea,$24.99ea,,$0.83/ 1ea,False
drinks,Crystal Light,"Liquid Drink Mix, Aloha Pineapple Coconut","Crystal LightLiquid Drink Mix, Aloha Pineapple Coconut48 ml",$4.29ea,,$8.94/ 100ml,False
drinks,Suraj,Guava Drink,SurajGuava Drink1 l,$1.99ea,,$0.20/ 100ml,False
drinks,President's Choice,Gourmet Medium Roast Decaffeinated Coffee Pods,President's ChoiceGourmet Medium Roast Decaffeinated Coffee Pods12 ea,$7.49ea,$6.99ea,$0.58/ 1ea,True
drinks,Nestle,Nesquik Chocolate Syrup,NestleNesquik Chocolate Syrup1.4 l,$14.99ea,,$1.07/ 100ml,False
drinks,Kool-Aid,Grape Liquid Drink Mix,Kool-AidGrape Liquid Drink Mix48 ml,$4.29ea,,$8.94/ 100ml,False
drinks,Oasis,Nutrisource Fruit Juice Beverage Berry Pomegranate,OasisNutrisource Fruit Juice Beverage Berry Pomegranate1.36 l,$3.99ea,,$0.29/ 100ml,False
drinks,President's Choice,Hibiscus White Tea,President's ChoiceHibiscus White Tea20 ea,$3.99ea,,$0.20/ 1ea,False
drinks,Van Houtte,Colombian Medium Roast,Van HoutteColombian Medium Roast12 ea,$12.99ea,,$1.08/ 1ea,False
drinks,PC Organics,"Organic 100% Florida Orange Juice, Pulp Free","PC OrganicsOrganic 100% Florida Orange Juice, Pulp Free1.75 l",$10.49ea,,$0.60/ 100ml,False
drinks,Lavazza,Gran Aroma Coffee,LavazzaGran Aroma Coffee340 g,$12.99ea,,$3.82/ 100g,False
drinks,Red Bull,Energy Drink,Red BullEnergy Drink355 ml,$4.29ea,,$1.21/ 100ml,False
drinks,Starbucks,Pike Place Roast Medium Roast Ground Coffee K-Cup Pods,StarbucksPike Place Roast Medium Roast Ground Coffee K-Cup Pods10 ea,$12.99ea,,$1.30/ 1ea,False
drinks,Starbucks,French Roast Dark Roast Ground Coffee ,StarbucksFrench Roast Dark Roast Ground Coffee 340 g,$12.99ea,,$3.82/ 100g,False
drinks,PC Blue Menu,Lime Sparkling Water,PC Blue MenuLime Sparkling Water12x355.0 ml,$5.99ea,,$0.14/ 100ml,False
drinks,Tea India,Tea,Tea IndiaTea681 g,$8.99ea,,$1.32/ 100g,False
drinks,Perrier,Energize Pomegranate,PerrierEnergize Pomegranate330 ml,$2.99ea,,$0.91/ 100ml,False
drinks,Red Bull,"Energy Drink, Sugar Free","Red BullEnergy Drink, Sugar Free8x250.0 ml",$18.99pack of 8,,$0.95/ 100ml,False
drinks,Tim Hortons,"Instant Coffee, Medium","Tim HortonsInstant Coffee, Medium100 g",$9.49ea,,$9.49/ 100g,False
drinks,Starbucks,By Nespresso Pike Place Roast Coffee Pods,StarbucksBy Nespresso Pike Place Roast Coffee Pods53 g,$11.49ea,,$21.68/ 100g,False
drinks,Brioschi,Aranciata Sweet Orange,BrioschiAranciata Sweet Orange355 ml,$1.29ea,,$0.36/ 100ml,False
drinks,Bolthouse,100% Carrot,Bolthouse100% Carrot946 ml,$6.99ea,,$0.74/ 100ml,False
drinks,Monster Energy,Reserve Energy Drink Watermelon,Monster EnergyReserve Energy Drink Watermelon473 ml,$3.99ea,,$0.84/ 100ml,False
drinks,Red Bull,"Energy Drink, Sugar Free","Red BullEnergy Drink, Sugar Free355 ml",$4.29ea,,$1.21/ 100ml,False
drinks,Rockstar,"Pure Zero, Mandarin Energy Drink","RockstarPure Zero, Mandarin Energy Drink473 ml",$3.99ea,,$0.84/ 100ml,False
drinks,Lavazza,Gran Aroma Coffee,LavazzaGran Aroma Coffee340 g,$12.99ea,,$3.82/ 100g,False
drinks,Red Bull,Energy Drink,Red BullEnergy Drink355 ml,$4.29ea,,$1.21/ 100ml,False
drinks,Starbucks,Pike Place Roast Medium Roast Ground Coffee K-Cup Pods,StarbucksPike Place Roast Medium Roast Ground Coffee K-Cup Pods10 ea,$12.99ea,,$1.30/ 1ea,False
drinks,Starbucks,French Roast Dark Roast Ground Coffee ,StarbucksFrench Roast Dark Roast Ground Coffee 340 g,$12.99ea,,$3.82/ 100g,False
drinks,PC Blue Menu,Lime Sparkling Water,PC Blue MenuLime Sparkling Water12x355.0 ml,$5.99ea,,$0.14/ 100ml,False
drinks,Tea India,Tea,Tea IndiaTea681 g,$8.99ea,,$1.32/ 100g,False
drinks,Five Alive,Passionate Peach Citrus Juice,Five AlivePassionate Peach Citrus Juice1.75 l,$4.79ea,,$0.27/ 100ml,False
drinks,Lipton,Brisk Lemon Iced Tea,LiptonBrisk Lemon Iced Tea2 l,$3.99ea,,$0.20/ 100ml,False
drinks,Crush,Orange Soda,CrushOrange Soda2 l,$3.99ea,,$0.20/ 100ml,False
drinks,Silk,"Almond Coconut Blend Beverage, Unsweetened, Dairy-Free","SilkAlmond Coconut Blend Beverage, Unsweetened, Dairy-Free1.89 l",$4.50ea,$3.49ea,$0.18/ 100ml,True
drinks,Dr Pepper,Diet Soda,Dr PepperDiet Soda12x355.0 ml,$7.49c12,,$0.18/ 100ml,False
drinks,7Up,Soda      ,7UpSoda      2 l,$3.99ea,,$0.20/ 100ml,False
drinks,President's Choice,Lemon Flavour Iced Tea,President's ChoiceLemon Flavour Iced Tea1.54 l,$3.99ea,,$0.26/ 100ml,False
drinks,Fruite,Peach Drink,FruitePeach Drink2 l,$2.89ea,,$0.14/ 100ml,False
drinks,Nabob,Full City Dark Coffee 100% Compostable Pods,NabobFull City Dark Coffee 100% Compostable Pods292 g,$18.99ea,,$6.50/ 100g,False
drinks,Tropicana,Orange Grapefruit,TropicanaOrange Grapefruit1.54 l,$6.99ea,,$0.45/ 100ml,False
drinks,Ovaltine,"Malted Drink, Classic","OvaltineMalted Drink, Classic400 g",$6.49ea,,$1.62/ 100g,False
drinks,Perrier,Energize Grapefruit,PerrierEnergize Grapefruit330 ml,$2.99ea,,$0.91/ 100ml,False
drinks,Van Houtte,"Belgian Chocolate Light, Ground Coffee","Van HoutteBelgian Chocolate Light, Ground Coffee340 g",$13.99ea,,$4.11/ 100g,False
drinks,Tetley,Earl Grey Decaffeinated Specialty Cannister Pack,TetleyEarl Grey Decaffeinated Specialty Cannister Pack24 ea,$3.99ea,,$0.17/ 1ea,False
drinks,Tropicana,Tropics Orange Strawberry,TropicanaTropics Orange Strawberry1.75 l,$6.69ea,,$0.38/ 100ml,False
drinks,Califia Farms,Califia Unsweetened Almond Vanilla Beverage ,Califia FarmsCalifia Unsweetened Almond Vanilla Beverage 1.4 l,$7.49ea,,$0.54/ 100ml,False
drinks,PC Organics,"Organic 100% Florida Orange Juice, Pulp Free","PC OrganicsOrganic 100% Florida Orange Juice, Pulp Free1.75 l",$10.49ea,,$0.60/ 100ml,False
drinks,Monster Energy,Ultra Watermelon Energy Drink,Monster EnergyUltra Watermelon Energy Drink473 ml,$3.99ea,,$0.84/ 100ml,False
drinks,Red Bull,"Energy Drink, Tropical","Red BullEnergy Drink, Tropical4x250.0 ea",$11.49c04,,,False
drinks,Red Bull,Energy Drink,Red BullEnergy Drink250 ml,$3.49ea,,$1.40/ 100ml,False
drinks,Starbucks,Ground Coffee Pike Place Roast,StarbucksGround Coffee Pike Place Roast100 g,$11.49ea,,$11.49/ 100g,False
drinks,Evian,"Spring Water, Bottle","EvianSpring Water, Bottle1.5 l",$3.99ea,,$0.27/ 100ml,False
drinks,Monster Energy,Ultra Paradise,Monster EnergyUltra Paradise473 ml,$3.99ea,,$0.84/ 100ml,False
drinks,Peace Tea,Sno-Berry,Peace TeaSno-Berry12x341.0 ml,$8.99c12,,$0.22/ 100ml,False
drinks,Budweiser,Bud Zero Can,BudweiserBud Zero Can12x355.0 ml,$18.99pack of 12,,$0.45/ 100ml,False
drinks,Folgers,Ground Coffee Intensely Dark,FolgersGround Coffee Intensely Dark641 g,$11.99ea,,$1.87/ 100g,False
drinks,Bubly Sparkling Water,Blackberry Sparkling Water ,Bubly Sparkling WaterBlackberry Sparkling Water 12x355.0 ml,$6.99pack of 12,,$0.16/ 100ml,False
drinks,Brisk,Iced Tea Lemonade,BriskIced Tea Lemonade710 ml,$1.99ea,,$0.28/ 100ml,False
drinks,Bubly Sparkling Water,Orange Bubly ,Bubly Sparkling WaterOrange Bubly 12x355.0 ml,$6.99pack of 12,,$0.16/ 100ml,False
drinks,Ocean Spray,"Cranberry Cocktail, Light","Ocean SprayCranberry Cocktail, Light1.89 l",$3.79ea,$3.29ea,$0.17/ 100ml,True
drinks,President's Choice,Gourmet Medium Roast Fine Grind Coffee ,President's ChoiceGourmet Medium Roast Fine Grind Coffee 930 g,$14.99ea,,$1.61/ 100g,False
drinks,Crystal Light,"Singles, Raspberry Peach","Crystal LightSingles, Raspberry Peach54 g",$3.99ea,,$7.39/ 100g,False
drinks,Powerade,Full Sugar Fruit Punch ,PoweradeFull Sugar Fruit Punch 6x591.0 ml,$6.99pack of 6,,$0.20/ 100ml,False
drinks,Bubly Sparkling Water,Limited Edition Watermelon,Bubly Sparkling WaterLimited Edition Watermelon12x355.0 ml,$6.99c12,,$0.16/ 100ml,False
drinks,Ocean Spray,Diet Cranberry Mango Cocktail,Ocean SprayDiet Cranberry Mango Cocktail1.89 l,$3.79ea,$3.29ea,$0.17/ 100ml,True
drinks,President's Choice,Fresh-Pressed Sweet Apple Cider,President's ChoiceFresh-Pressed Sweet Apple Cider2 l,$5.99ea,,$0.30/ 100ml,False
drinks,Pepsi,Soda  ,PepsiSoda  8x355.0 ml,$7.49pack of 8,,$0.26/ 100ml,False
drinks,Peace Tea,Peach Party,Peace TeaPeach Party12x341.0 ml,$8.99pack of 12,,$0.22/ 100ml,False
drinks,Nestea,Raspberry Can,NesteaRaspberry Can12x341.0 ml,$8.99c12,,$0.22/ 100ml,False
drinks,Lavazza,"Coffee, Ground  Espresso Deciso Intensity 10","LavazzaCoffee, Ground  Espresso Deciso Intensity 100.05 kg",$8.99ea,,$17.98/ 100g,False
drinks,Coca-Cola,"Zero Sugar Caffeine, 12 Pack ","Coca-ColaZero Sugar Caffeine, 12 Pack 12x355.0 ml",$7.49pack of 12,,$0.18/ 100ml,False
drinks,Canada Dry,Club Soda Triple Berry,Canada DryClub Soda Triple Berry12x355.0 ml,$7.49c12,,$0.18/ 100ml,False
drinks,Canada Dry,Club Soda,Canada DryClub Soda2 l,$3.99ea,,$0.20/ 100ml,False
drinks,Rockstar,Pure Zero Punched Energy Drink,RockstarPure Zero Punched Energy Drink473 ml,$3.99ea,,$0.84/ 100ml,False
drinks,A&W,Diet Root Beer,A&WDiet Root Beer2 l,$3.99ea,,$0.20/ 100ml,False
drinks,Rockstar,Punched Fruit Punch Energy Drink ,RockstarPunched Fruit Punch Energy Drink 473 ml,$3.99ea,,$0.84/ 100ml,False
drinks,A&W,Diet Root Beer    ,A&WDiet Root Beer    12x355.0 ml,$7.49pack of 12,,$0.18/ 100ml,False
drinks,Rockstar,Sugar Free,RockstarSugar Free473 ml,$3.99ea,,$0.84/ 100ml,False
drinks,Sprite,Soda ,SpriteSoda 12x355.0 ml,$7.49pack of 12,,$0.18/ 100ml,False
drinks,Canada Dry,Pomegranate Ginger Ale  ,Canada DryPomegranate Ginger Ale  12x355.0 ml,$7.49c12,,$0.18/ 100ml,False
drinks,Coca-Cola,Bottle     ,Coca-ColaBottle     8x300.0 ml,$6.99pack of 8,,$0.29/ 100ml,False
drinks,Sparkling Ice,Lemon Lime Sparkling Water,Sparkling IceLemon Lime Sparkling Water503 ml,$2.29ea,,$0.46/ 100ml,False
drinks,Coca-Cola,Bottle,Coca-ColaBottle2 l,$3.99ea,,$0.20/ 100ml,False
drinks,Mott's,"Clamato, Original    ","Mott'sClamato, Original    945 ml",$3.19ea,,$0.34/ 100ml,False
drinks,Canada Dry,Club Soda Mandarin Orange  ,Canada DryClub Soda Mandarin Orange  12x355.0 ml,$7.49pack of 12,,$0.18/ 100ml,False
drinks,Rockstar,Original Energy Drink,RockstarOriginal Energy Drink473 ml,$3.99ea,,$0.84/ 100ml,False
drinks,Bai,"Water, Low Calorie Beverage Ipanema Pomegranate","BaiWater, Low Calorie Beverage Ipanema Pomegranate530 ml",$2.99ea,,$0.56/ 100ml,False
drinks,Tetley,Green Tea The Vert Classique 48's ,TetleyGreen Tea The Vert Classique 48's 48 ea,$7.99ea,,$0.17/ 1ea,False
drinks,Stur,"Liquid Drink Mix, Lemonade","SturLiquid Drink Mix, Lemonade42 ml",$4.49ea,,$10.69/ 100ml,False
drinks,Powerade,Sports Drink Melon-Pineapple Flavour,PoweradeSports Drink Melon-Pineapple Flavour710 ml,$2.39ea,,$0.34/ 100ml,False
drinks,Lacroix,Sparkling Water Beverage Naturally Black Razzberry Essenced,LacroixSparkling Water Beverage Naturally Black Razzberry Essenced8x355.0 ml,$6.49c08,,$0.23/ 100ml,False
drinks,Illy,"Coffee, Ground Espresso Intenso Bold Roast","IllyCoffee, Ground Espresso Intenso Bold Roast250 g",$15.99ea,,$6.40/ 100g,False
drinks,Stur,Liquid Water Enhancer Coconut Pineapple ,SturLiquid Water Enhancer Coconut Pineapple 42 ml,$4.49ea,,$10.69/ 100ml,False
drinks,Celestial Seasonings,Wild Berry Zinger Herbal Tea,Celestial SeasoningsWild Berry Zinger Herbal Tea20 ea,$5.49ea,,$0.27/ 1ea,False
drinks,Ocean Spray,"100% Juice Blend, Ruby Red Grapefruit","Ocean Spray100% Juice Blend, Ruby Red Grapefruit1.77 l",$3.79ea,$3.29ea,$0.19/ 100ml,True
drinks,DAVIDsTEA,Loose Leaf Tea Fruit Infusion Frozen Raspberry,DAVIDsTEALoose Leaf Tea Fruit Infusion Frozen Raspberry50 g,$9.99ea,,$19.98/ 100g,False
drinks,Nestle,0 Calories,Nestle0 Calories1 l,$2.99ea,,$0.30/ 100ml,False
drinks,Balzac's,Marble Roast Bold Balanced Coffee Pods,Balzac'sMarble Roast Bold Balanced Coffee Pods189 g,$17.99ea,,$9.52/ 100g,False
drinks,Twinings,50ct Earl Grey,Twinings50ct Earl Grey50 ea,$10.99ea,,$0.22/ 1ea,False
drinks,Starbucks,"Coffee, Sumatra Single-Origin Dark Roast Ground  K-Cup Pods","StarbucksCoffee, Sumatra Single-Origin Dark Roast Ground  K-Cup Pods10 ea",$12.99ea,,$1.30/ 1ea,False
drinks,Lipton,"Iced Tea Raspberry, 12 cans","LiptonIced Tea Raspberry, 12 cans12x340.0 ml",$7.49c12,,$0.18/ 100ml,False
drinks,Walter,Craft Caesar Mix Mild Spice,WalterCraft Caesar Mix Mild Spice946 ml,$6.99ea,,$0.74/ 100ml,False
drinks,Terra Beata,Cranberry Cocktail,Terra BeataCranberry Cocktail1.89 l,$5.99ea,,$0.32/ 100ml,False
drinks,Illy,Keurig Hot Dark Roast Coffee K-Cup Pods,IllyKeurig Hot Dark Roast Coffee K-Cup Pods10 ea,$13.49ea,,$1.35/ 1ea,False
drinks,Celestial Seasonings,Sleepy Time Tea,Celestial SeasoningsSleepy Time Tea40 ea,$7.99ea,,$0.20/ 1ea,False
drinks,Powerade,"Ultra White Cherry Electrolyte Beverage, Bottle","PoweradeUltra White Cherry Electrolyte Beverage, Bottle710 ml",$2.39ea,,$0.34/ 100ml,False
drinks,,Green Tea (Sencha),Green Tea (Sencha)150 g,$7.49ea,,$4.99/ 100g,False
drinks,Erdinger,Wheat Beer Non-Alcoholic,ErdingerWheat Beer Non-Alcoholic6x330.0 ml,$10.99pack of 6,,$0.56/ 100ml,False
drinks,Tata,Loose Black Tea Desh Ka Anokha Swad,TataLoose Black Tea Desh Ka Anokha Swad900 g,$14.99ea,,$1.67/ 100g,False
drinks,Glaceau,Energy Tropical Citrus Nutrient Enhanced Water Bottle,GlaceauEnergy Tropical Citrus Nutrient Enhanced Water Bottle591 ml,$2.99ea,,$0.51/ 100ml,False
drinks,AHA,"Water, Blueberry + Pomegranate Sparkling , Bottle","AHAWater, Blueberry + Pomegranate Sparkling , Bottle1 l",$1.99ea,,$0.20/ 100ml,False
drinks,Mott's,"Clamato, Extra Spicy","Mott'sClamato, Extra Spicy2.54 l",$5.79ea,,$0.23/ 100ml,False
drinks,Eagle Brand,Brand Dulce De Leche Sweetened Condensed Milk,Eagle BrandBrand Dulce De Leche Sweetened Condensed Milk300 ml,$4.79ea,,$1.60/ 100ml,False
drinks,Tetley,"Tea, Honey Lemon Ginseng Green Specialty  ","TetleyTea, Honey Lemon Ginseng Green Specialty  24 ea",$3.99ea,,$0.17/ 1ea,False
drinks,Silk,"Almond Beverage, Dark Chocolate Flavour","SilkAlmond Beverage, Dark Chocolate Flavour1.89 l",$4.50ea,$3.49ea,$0.18/ 100ml,True
drinks,Jarritos,Soft Drink Mandarin Orange,JarritosSoft Drink Mandarin Orange370 ml,$1.69ea,,$0.46/ 100ml,False
drinks,Fruitopia,Strawberry Passion Awareness,FruitopiaStrawberry Passion Awareness1 l,$2.49ea,,$0.25/ 100ml,False
drinks,Partake,Non Alcoholic Beer,PartakeNon Alcoholic Beer4x355.0 ml,$8.49pack of 4,,$0.60/ 100ml,False
drinks,Silk,"Nextmilk, Plant Based Dairy Free Milk Alternative","SilkNextmilk, Plant Based Dairy Free Milk Alternative1.74 l",$5.99ea,$3.49ea,$0.20/ 100ml,True
drinks,Rockstar,Punched Strawberry,RockstarPunched Strawberry473 ml,$3.99ea,,$0.84/ 100ml,False
drinks,Starbucks,Via Instant Pike Place,StarbucksVia Instant Pike Place8 ea,$8.99ea,,$1.12/ 1ea,False
drinks,No Name,Peach Drink,No NamePeach Drink2 l,$1.49ea,,$0.07/ 100ml,False
drinks,Monster Energy,Reserve Energy Drink White Pineapple,Monster EnergyReserve Energy Drink White Pineapple473 ml,$3.99ea,,$0.84/ 100ml,False
drinks,Tropicana,"Trop50 Orange Juice, No Pulp","TropicanaTrop50 Orange Juice, No Pulp1.54 l",$6.99ea,,$0.45/ 100ml,False
drinks,Lavazza,Intenso Coffee,LavazzaIntenso Coffee340 g,$12.99ea,,$3.82/ 100g,False
drinks,Fruitopia,Blueberry Watermelon Wisdom Fruit Beverage,FruitopiaBlueberry Watermelon Wisdom Fruit Beverage1.75 l,$3.79ea,,$0.22/ 100ml,False
drinks,Maxwell House,Decaffeinated Coffee 100% Compostable K Cup Coffee Pods,Maxwell HouseDecaffeinated Coffee 100% Compostable K Cup Coffee Pods292 g,$17.99ea,,$6.16/ 100g,False
drinks,Mountain Dew,Soda,Mountain DewSoda2 l,$3.99ea,,$0.20/ 100ml,False
drinks,Oasis,Berry Smoothie,OasisBerry Smoothie1.75 l,$6.49ea,,$0.37/ 100ml,False
drinks,Minute Maid, Lemonade ,Minute Maid Lemonade 1.54 l,$4.99ea,,$0.32/ 100ml,False
drinks,Minute Maid,Pink Lemonade,Minute MaidPink Lemonade1.54 l,$4.99ea,,$0.32/ 100ml,False
drinks,Tetley,Mint Green Specialty Tea   ,TetleyMint Green Specialty Tea   24 ea,$3.99ea,,$0.17/ 1ea,False
drinks,7Up,Zero Soda,7UpZero Soda2 l,$3.99ea,,$0.20/ 100ml,False
drinks,Minute Maid,Low Acid 100% Orange Juice Nutri Pulp Free,Minute MaidLow Acid 100% Orange Juice Nutri Pulp Free1.75 l,$5.49ea,,$0.31/ 100ml,False
drinks,Silk,"Oat Beverage, Vanilla, Unsweetened, Dairy-Free, Shelf Stable","SilkOat Beverage, Vanilla, Unsweetened, Dairy-Free, Shelf Stable946 ml",$3.29ea,,$0.35/ 100ml,False
drinks,Van Houtte,"Colombian Medium K-Cup Coffee Pods, 24 Count","Van HoutteColombian Medium K-Cup Coffee Pods, 24 Count228 g",$18.99ea,$17.99ea,$7.89/ 100g,True
drinks,Glaceau,"Water with Sports Cap, Bottle","GlaceauWater with Sports Cap, Bottle700 ml",$2.89ea,,$0.41/ 100ml,False
drinks,President's Choice,Jalapeno Lemonade,President's ChoiceJalapeno Lemonade1.54 l,$3.99ea,,$0.26/ 100ml,False
drinks,Galil,Camomile Tea,GalilCamomile Tea20 ea,$2.99ea,,$0.15/ 1ea,False
drinks,Oasis,Berry Juice,OasisBerry Juice8x200.0 ml,$3.49ea,,$0.22/ 100ml,False
drinks,Five Alive,", Carton","Five Alive, Carton1.75 l",$4.79ea,,$0.27/ 100ml,False
drinks,Canada Dry,Premium Ginger Ale,Canada DryPremium Ginger Ale4x237.0 ml,$8.99pack of 4,,$0.95/ 100ml,False
drinks,Arizona,100% Natural Raspberry Iced Tea,Arizona100% Natural Raspberry Iced Tea960 ml,$1.79ea,,$0.19/ 100ml,False
drinks,Montellier,"Carbonated Water, Lime ","MontellierCarbonated Water, Lime 10x355.0 ml",$7.49pack of 10,,$0.21/ 100ml,False
drinks,T&T,Organic Green Tea,T&TOrganic Green Tea200 g,$6.99ea,,$3.50/ 100g,False
drinks,Tim Hortons,Hot Chocolate Sachet,Tim HortonsHot Chocolate Sachet8 ea,$5.99ea,,$0.75/ 1ea,False
drinks,President's Choice,Natural Spring Water,President's ChoiceNatural Spring Water4 l,$1.99ea,,$0.05/ 100ml,False
drinks,Ujinotsuyu,"Tea, Green  with Roasted Rice Genmaicha","UjinotsuyuTea, Green  with Roasted Rice Genmaicha40 g",$4.49ea,,$11.23/ 100g,False
drinks,Pepsi,Pespi Cans  ,PepsiPespi Cans  24x355.0 ml,$14.99pack of 24,,$0.18/ 100ml,False
drinks,Carnation,Rich And Creamy Hot Chocolate Canister,CarnationRich And Creamy Hot Chocolate Canister450 g,$6.79ea,$5.99ea,$1.33/ 100g,True
drinks,President's Choice,Dreamland Herbal Tea,President's ChoiceDreamland Herbal Tea20 ea,$3.99ea,,$0.20/ 1ea,False
drinks,Nescafe,RICH Instant Coffee,NescafeRICH Instant Coffee475 g,$16.99ea,,$3.58/ 100g,False
drinks,Tchibo,Gold Selection Instant Coffee,TchiboGold Selection Instant Coffee250 g,$4.29ea,,$1.72/ 100g,False
drinks,Rockstar,Punched Orange,RockstarPunched Orange473 ml,$3.99ea,,$0.84/ 100ml,False
drinks,Virgil's,Orange Cream Soda,Virgil'sOrange Cream Soda4x355.0 ml,$7.49c04,,$0.53/ 100ml,False
drinks,Guru,"Energy Drink, Light    ","GuruEnergy Drink, Light    355 ml",$3.99ea,,$1.12/ 100ml,False
drinks,Bolthouse,100% Carrot,Bolthouse100% Carrot1.54 l,$9.99ea,,$0.65/ 100ml,False
drinks,Monster Energy,Drink,Monster EnergyDrink4x473.0 ml,$11.99pack of 4,,$0.63/ 100ml,False
drinks,President's Choice,Sweetened Condensed Milk,President's ChoiceSweetened Condensed Milk300 ml,$4.29ea,,$1.43/ 100ml,False
drinks,Tetley,Herbal Tea Clarity Blueberry Ginseng Tea   ,TetleyHerbal Tea Clarity Blueberry Ginseng Tea   20 ea,$3.99ea,,$0.20/ 1ea,False
drinks,Ceres,Peach Juice,CeresPeach Juice1 l,$3.99ea,,$0.40/ 100ml,False
drinks,Ocean Spray,"Juice Drink, Diet Cranberry Cherry","Ocean SprayJuice Drink, Diet Cranberry Cherry1.89 l",$3.79ea,$3.29ea,$0.17/ 100ml,True
drinks,Montellier,Natural Water ,MontellierNatural Water 10x355.0 ml,$7.49pack of 10,,$0.21/ 100ml,False
drinks,Rougemont,100% Pure Apple Juice with Calcium and Vitamin D,Rougemont100% Pure Apple Juice with Calcium and Vitamin D2 l,$3.69ea,,$0.18/ 100ml,False
drinks,Pepsi,Zero Sugar ,PepsiZero Sugar 6x222.0 ml,$4.99pack of 6,,$0.37/ 100ml,False
drinks,Rani,"Fruit Drink, Peach","RaniFruit Drink, Peach240 ml",$1.39ea,,$0.58/ 100ml,False
drinks,No Name,"Orange Juice, Pulp Free","No NameOrange Juice, Pulp Free1.75 l",$2.99ea,,$0.17/ 100ml,False
drinks,Ocean Spray,Cran Tropical Cocktail,Ocean SprayCran Tropical Cocktail1.89 l,$3.79ea,$3.29ea,$0.17/ 100ml,True
drinks,Ocean Spray,Cran Grape,Ocean SprayCran Grape1.89 l,$3.79ea,$3.29ea,$0.17/ 100ml,True
drinks,Partake,Craft Non-Alcoholic Beer Blonde,PartakeCraft Non-Alcoholic Beer Blonde4x355.0 ml,$8.49c04,,$0.60/ 100ml,False
drinks,Lipton,Yellow Label Black Tea Refreshing Taste ,LiptonYellow Label Black Tea Refreshing Taste 200 g,$10.99ea,,$5.50/ 100g,False
drinks,Tim Hortons,Coffee,Tim HortonsCoffee14 ea,$12.99ea,,$0.93/ 1ea,False
drinks,Lipton,Yellow Label Green Tea 100% Rainforest Alliance Certified,LiptonYellow Label Green Tea 100% Rainforest Alliance Certified200 g,$10.99ea,,$5.50/ 100g,False
drinks,Dr Pepper,Soda,Dr PepperSoda12x355.0 ml,$7.49c12,,$0.18/ 100ml,False
drinks,President's Choice,Maple Rooibos Red Tea,President's ChoiceMaple Rooibos Red Tea20 ea,$3.99ea,,$0.20/ 1ea,False
drinks,Frooti,Mango Juice,FrootiMango Juice1000 ml,$2.89ea,,$0.29/ 100ml,False
drinks,Tazo,Wild Sweet Orange Tea,TazoWild Sweet Orange Tea20 ea,$6.99ea,,$0.35/ 1ea,False
drinks,Partake,Nonalcoholic Craft Beer    ,PartakeNonalcoholic Craft Beer    4x355.0 ml,$8.49pack of 4,,$0.60/ 100ml,False
drinks,President's Choice,Free & Clear Tangerine-Lime Sparkling Water ,President's ChoiceFree & Clear Tangerine-Lime Sparkling Water 1 l,$1.99ea,,$0.20/ 100ml,False
drinks,Corona,Sunbrew,CoronaSunbrew6x330.0 ml,$14.99c06,,$0.76/ 100ml,False
drinks,President's Choice,Ginger Ale,President's ChoiceGinger Ale2 l,$1.99ea,,$0.10/ 100ml,False
drinks,Nescafe,RICH Instant Coffee,NescafeRICH Instant Coffee475 g,$16.99ea,,$3.58/ 100g,False
drinks,President's Choice,Mint Refresher Herbal Tea,President's ChoiceMint Refresher Herbal Tea20 ea,$3.99ea,,$0.20/ 1ea,False
drinks,Red Rose,Orange Pekoe Black Tea,Red RoseOrange Pekoe Black Tea72 ea,$6.79ea,,$0.09/ 1ea,False
drinks,President's Choice,Lemon Iced Tea Naturally Flavoured,President's ChoiceLemon Iced Tea Naturally Flavoured12x355.0 ml,$6.49pack of 12,,$0.15/ 100ml,False
drinks,President's Choice,Colombian Supremo Medium Roast 100% Arabica Single Serve Coffee Pods,President's ChoiceColombian Supremo Medium Roast 100% Arabica Single Serve Coffee Pods30 ea,$14.99ea,,$0.50/ 1ea,False
drinks,President's Choice,Grape Soda ,President's ChoiceGrape Soda 12x355.0 ml,$6.49pack of 12,,$0.15/ 100ml,False
drinks,Vita Coco,Coconut Water Original,Vita CocoCoconut Water Original500 ml,$3.79ea,,$0.76/ 100ml,False
drinks,Ocean Spray,"100% Juice Blends 100% Juice, Cranberry and Raspberry","Ocean Spray100% Juice Blends 100% Juice, Cranberry and Raspberry1.77 l",$3.79ea,$3.29ea,$0.19/ 100ml,True
drinks,Coca-Cola,Coffee Dark Blend,Coca-ColaCoffee Dark Blend355 ml,$3.49ea,,$0.98/ 100ml,False
drinks,PC Blue Menu,Natural Sparkling Water ,PC Blue MenuNatural Sparkling Water 1 l,$1.39ea,,$0.14/ 100ml,False
drinks,President's Choice,Free & Clear Golden Peach Sparkling Water ,President's ChoiceFree & Clear Golden Peach Sparkling Water 1 l,$1.99ea,,$0.20/ 100ml,False
drinks,Dr Pepper,Soft Drink Mini ,Dr PepperSoft Drink Mini 6x222.0 ml,$4.99pack of 6,,$0.37/ 100ml,False
drinks,Tetley,Earl Grey The Speciaux   ,TetleyEarl Grey The Speciaux   80 ea,$9.99ea,,$0.12/ 1ea,False
drinks,PC Blue Menu,Mandarin Orange Sparkling Water,PC Blue MenuMandarin Orange Sparkling Water1 l,$1.39ea,,$0.14/ 100ml,False
drinks,President's Choice,Chocolatey Chai Herbal Tea,President's ChoiceChocolatey Chai Herbal Tea20 ea,$3.99ea,,$0.20/ 1ea,False
drinks,Grace,100% Pure Coconut Water,Grace100% Pure Coconut Water500 ml,$1.68ea,,$0.34/ 100ml,False
drinks,Pure Leaf,Peach Tea,Pure LeafPeach Tea1.75 l,$5.79ea,$5.49ea,$0.31/ 100ml,True
drinks,President's Choice,Pulp Free Orange Juice,President's ChoicePulp Free Orange Juice1.54 l,$3.99ea,,$0.26/ 100ml,False
drinks,No Name,Chocolate Syrup,No NameChocolate Syrup700 ml,$5.49ea,,$0.78/ 100ml,False
drinks,President's Choice,Peach Ginger Sparkling Soda  ,President's ChoicePeach Ginger Sparkling Soda  12x355.0 ml,$6.49pack of 12,,$0.15/ 100ml,False
drinks,President's Choice,"Tea, Premium Flavoured Black  Earl Grey Decaffeinated","President's ChoiceTea, Premium Flavoured Black  Earl Grey Decaffeinated48 ea",$4.99ea,,$0.10/ 1ea,False
drinks,7Up,Zero Soda,7UpZero Soda12x355.0 ml,$7.49c12,,$0.18/ 100ml,False
drinks,No Name,Lemon Juice,No NameLemon Juice946 ml,$2.49ea,,$0.26/ 100ml,False
drinks,Tang's,Orange Drink Mix,Tang'sOrange Drink Mix2 kg,$11.99ea,,$0.55/ 100g,False
drinks,Glaceau,"Multi-V Nutrient Enhanced Water, Bottle","GlaceauMulti-V Nutrient Enhanced Water, Bottle591 ml",$2.99ea,,$0.51/ 100ml,False
drinks,PC Blue Menu,Lemon Sparkling Water,PC Blue MenuLemon Sparkling Water1 l,$1.39ea,,$0.14/ 100ml,False
drinks,Carnation,2% Evaporated Partly Skimmed Milk,Carnation2% Evaporated Partly Skimmed Milk354 ml,$2.49ea,,$0.70/ 100ml,False
drinks,Tim Hortons,Dark Roast K-Cup Compatible,Tim HortonsDark Roast K-Cup Compatible30 ea,$24.99ea,,$0.83/ 1ea,False
drinks,President's Choice,Strawberry Lemonade,President's ChoiceStrawberry Lemonade1.54 l,$3.99ea,,$0.26/ 100ml,False
drinks,Monster Energy,Can,Monster EnergyCan8x355.0 ml,$23.99c08,,$0.84/ 100ml,False
drinks,Tropicana,Orange Juice Some Pulp,TropicanaOrange Juice Some Pulp1.54 l,$6.99ea,,$0.45/ 100ml,False
drinks,President's Choice,Berry Flavour Hibiscus Herbal Tea,President's ChoiceBerry Flavour Hibiscus Herbal Tea1.54 l,$3.99ea,,$0.26/ 100ml,False
drinks,Tetley,"Tea, Honey Lemon Ginseng Green Specialty  ","TetleyTea, Honey Lemon Ginseng Green Specialty  24 ea",$3.99ea,,$0.17/ 1ea,False
drinks,Silk,"Almond Beverage, Dark Chocolate Flavour","SilkAlmond Beverage, Dark Chocolate Flavour1.89 l",$4.50ea,$3.49ea,$0.18/ 100ml,True
drinks,Jarritos,Soft Drink Mandarin Orange,JarritosSoft Drink Mandarin Orange370 ml,$1.69ea,,$0.46/ 100ml,False
drinks,Fruitopia,Strawberry Passion Awareness,FruitopiaStrawberry Passion Awareness1 l,$2.49ea,,$0.25/ 100ml,False
drinks,Partake,Non Alcoholic Beer,PartakeNon Alcoholic Beer4x355.0 ml,$8.49pack of 4,,$0.60/ 100ml,False
drinks,Silk,"Nextmilk, Plant Based Dairy Free Milk Alternative","SilkNextmilk, Plant Based Dairy Free Milk Alternative1.74 l",$5.99ea,$3.49ea,$0.20/ 100ml,True
drinks,Rockstar,Punched Strawberry,RockstarPunched Strawberry473 ml,$3.99ea,,$0.84/ 100ml,False
drinks,Starbucks,Via Instant Pike Place,StarbucksVia Instant Pike Place8 ea,$8.99ea,,$1.12/ 1ea,False
