category,brand,product_text,product_name,price_text,sale_price,per_unit_price_text,is_sale
drinks,President's Choice,Diet Cola,President's ChoiceDiet Cola12x355.0 ml,$6.49pack of 12,,$0.15/ 100ml,False
drinks,McCafe,Decaf Roast Pod    ,McCafeDecaf Roast Pod    12 ea,$12.99ea,,$1.08/ 1ea,False
drinks,Ujinotsuyu,"Tea, Green  with Roasted Rice (Genmaicha)","UjinotsuyuTea, Green  with Roasted Rice (Genmaicha)400 g",$5.79ea,,$1.45/ 100g,False
drinks,President's Choice,The Great Canadian Light to Medium Roast 100% Arabica Single Serve Coffee Pods,President's ChoiceThe Great Canadian Light to Medium Roast 100% Arabica Single Serve Coffee Pods30 ea,$14.99ea,,$0.50/ 1ea,False
drinks,7Up,Soda      ,7UpSoda      12x355.0 ml,$7.49pack of 12,,$0.18/ 100ml,False
drinks,President's Choice,100% Apple & Grape,President's Choice100% Apple & Grape10x200.0 ml,$3.89ea,,$0.19/ 100ml,False
drinks,No Name,Fruit Punch Drink Mix Club Size,No NameFruit Punch Drink Mix Club Size2.3 kg,$7.49ea,,$0.33/ 100g,False
drinks,Nescafe,Gold Dark Roast Instant and Roast & Ground Coffee,NescafeGold Dark Roast Instant and Roast & Ground Coffee100 g,$8.29ea,,$8.29/ 100g,False
drinks,7Up,Soda      ,7UpSoda      591 ml,$2.99ea,,$0.51/ 100ml,False
drinks,President's Choice,100% Raspberry Orange Juice,President's Choice100% Raspberry Orange Juice10x200.0 ml,$3.89ea,,$0.19/ 100ml,False
drinks,Pure Leaf,"Brewed Iced Tea, Lemon","Pure LeafBrewed Iced Tea, Lemon1.75 l",$5.79ea,$5.49ea,$0.31/ 100ml,True
drinks,Natura,Unsweetened Vanilla Organic Fortified Gluten-Free Oat Beverage,NaturaUnsweetened Vanilla Organic Fortified Gluten-Free Oat Beverage946 ml,$2.99ea,,$0.32/ 100ml,False
drinks,Tetley,Earl Grey Vanilla Specialty Cannister Pack,TetleyEarl Grey Vanilla Specialty Cannister Pack24 ea,$3.99ea,,$0.17/ 1ea,False
drinks,Minute Maid,"Low Acid 100% Orange Juice From Concentrate, Carton","Minute MaidLow Acid 100% Orange Juice From Concentrate, Carton1.75 l",$5.99ea,,$0.34/ 100ml,False
drinks,Van Houtte,"Original House Blend, Medium Ground","Van HoutteOriginal House Blend, Medium Ground340 g",$13.99ea,,$4.11/ 100g,False
drinks,PC Blue Menu,M Strawberry Watermelon,PC Blue MenuM Strawberry Watermelon10x200.0 ml,$3.89ea,,$1.95/ 100ml,False
drinks,Minute Maid,"Low Acid Nutri Bone Support 100% Orange Juice, Carton","Minute MaidLow Acid Nutri Bone Support 100% Orange Juice, Carton1.75 l",$5.49ea,,$0.31/ 100ml,False
drinks,Simply,"Limeade, Bottle","SimplyLimeade, Bottle1.54 l",$5.99ea,$4.99ea,$0.32/ 100ml,True
drinks,Dr Pepper,Soda,Dr PepperSoda2 l,$3.99ea,,$0.20/ 100ml,False
drinks,NOS,Energy Drink Turbo,NOSEnergy Drink Turbo473 ml,$3.99ea,,$0.84/ 100ml,False
drinks,Pepsi,Max Zero Sugar Soda    ,PepsiMax Zero Sugar Soda    2 l,$3.99ea,,$0.20/ 100ml,False
drinks,Folgers, Hazelnut Cream K-Cup Coffee Pods 12 Count,Folgers Hazelnut Cream K-Cup Coffee Pods 12 Count12 ea,$9.99ea,,$0.83/ 1ea,False
drinks,Minute Maid,"100% Orange Juice From Concentrate, 8 Pack","Minute Maid100% Orange Juice From Concentrate, 8 Pack8x200.0 ml",$4.19ea,$3.99ea,$0.25/ 100ml,True
drinks,Nescafe,Gold Dark Roast Instant and Roast & Ground Coffee,NescafeGold Dark Roast Instant and Roast & Ground Coffee100 g,$8.29ea,,$8.29/ 100g,False
drinks,7Up,Soda      ,7UpSoda      591 ml,$2.99ea,,$0.51/ 100ml,False
drinks,President's Choice,100% Raspberry Orange Juice,President's Choice100% Raspberry Orange Juice10x200.0 ml,$3.89ea,,$0.19/ 100ml,False
drinks,Pure Leaf,"Brewed Iced Tea, Lemon","Pure LeafBrewed Iced Tea, Lemon1.75 l",$5.79ea,$5.49ea,$0.31/ 100ml,True
drinks,Rockstar,Punched Peach,RockstarPunched Peach473 ml,$4.79ea,,$1.01/ 100ml,False
drinks,PC Organics,Organic 100% Coconut Water,PC OrganicsOrganic 100% Coconut Water1 l,$5.49ea,,$0.55/ 100ml,False
drinks,Allen's,Fruit Punch Cocktail,Allen'sFruit Punch Cocktail8x200.0 ml,$3.29ea,$2.99ea,$0.19/ 100ml,True
drinks,Nestle,Nesquik Chocolate Powder,NestleNesquik Chocolate Powder540 g,$7.49ea,,$1.39/ 100g,False
drinks,Bru,Instant Coffee & Roasted Chicory,BruInstant Coffee & Roasted Chicory200 g,$4.99ea,,$2.50/ 100g,False
drinks,President's Choice,Espresso Forte Decaffeinato Coffee Capsules,President's ChoiceEspresso Forte Decaffeinato Coffee Capsules10 ea,$7.49ea,,$0.75/ 1ea,False
drinks,Starbucks,By Nespresso Decaf Espresso Roast Coffee Pods,StarbucksBy Nespresso Decaf Espresso Roast Coffee Pods57 g,$11.49ea,,$20.16/ 100g,False
drinks,President's Choice,Peach Mango Liquid Water Enhancer,President's ChoicePeach Mango Liquid Water Enhancer48 ml,$3.99ea,,$8.31/ 100ml,False
drinks,SunRype,Slim Tropical Mango Low Calorie Beverage,SunRypeSlim Tropical Mango Low Calorie Beverage1.36 l,$3.99ea,,$0.29/ 100ml,False
drinks,PC Blue Menu,Pink Grapefruit Sparkling Water ,PC Blue MenuPink Grapefruit Sparkling Water 12x355.0 ml,$5.99ea,,$0.14/ 100ml,False
drinks,No Name,Medium Roast Decaf Coffee,No NameMedium Roast Decaf Coffee925 g,$11.99ea,,$1.30/ 100g,False
drinks,Gatorade,Frost Lemon-Lime (Instant) Powder,GatoradeFrost Lemon-Lime (Instant) Powder560 g,$6.99ea,,$1.25/ 100g,False
drinks,HAO TEA,Jasmine Tea,HAO TEAJasmine Tea200 g,$3.99ea,,$2.00/ 100g,False
drinks,President's Choice,Vanilla Cherry Soda Flavour Sparkling Water,President's ChoiceVanilla Cherry Soda Flavour Sparkling Water12x355.0 ml,$5.99c01,,$0.14/ 100ml,False
drinks,Fruite,Zesty Raspberry Mixed Fruit Drink,FruiteZesty Raspberry Mixed Fruit Drink1.65 l,$3.49ea,,$0.21/ 100ml,False
drinks,President's Choice,100% Orange Juice,President's Choice100% Orange Juice1 l,$1.99ea,,$0.20/ 100ml,False
drinks,Nin Jiom,Pei Pa Koa,Nin JiomPei Pa Koa150 ml,$5.49ea,,$3.66/ 100ml,False
drinks,Timothy's,Rainforest Espresso Coffee Ground Extra Dark K-Cup,Timothy'sRainforest Espresso Coffee Ground Extra Dark K-Cup30 ea,$21.99ea,,$0.73/ 1ea,False
drinks,Carnation,Hot Chocolate 30 Capsules ,CarnationHot Chocolate 30 Capsules 450 g,$21.99ea,,$4.89/ 100g,False
drinks,McCafe,Premium Roast     ,McCafePremium Roast     12 ea,$12.99ea,,$1.08/ 1ea,False
drinks,President's Choice,Premium Flavoured Black Tea ,President's ChoicePremium Flavoured Black Tea 48 ea,$4.99ea,,$0.10/ 1ea,False
drinks,President's Choice,Costa Rica Medium Roast 100% Arabica Single Serve Coffee Pods,President's ChoiceCosta Rica Medium Roast 100% Arabica Single Serve Coffee Pods30 ea,$14.99ea,,$0.50/ 1ea,False
drinks,San Pellegrino,Naturali Limonata Sparkling Lemon Beverage,San PellegrinoNaturali Limonata Sparkling Lemon Beverage6x330.0 ml,$7.49c06,,$0.38/ 100ml,False
drinks,Gold Kili,Instant Coffee Mix,Gold KiliInstant Coffee Mix30x18.0 g,$6.49ea,,$1.20/ 100g,False
drinks,SunRype,Slim Blueberry Burst Low Calorie Beverage,SunRypeSlim Blueberry Burst Low Calorie Beverage1.36 l,$3.99ea,,$0.29/ 100ml,False
drinks,Nestle,Nesquik Strawberry Syrup,NestleNesquik Strawberry Syrup510 ml,$6.99ea,,$1.37/ 100ml,False
drinks,Oasis,Exotic Mango Fruit Juice,OasisExotic Mango Fruit Juice8x200.0 ml,$3.49ea,,$0.22/ 100ml,False
drinks,Cool Runnings,Coconut Milk,Cool RunningsCoconut Milk400 ml,$1.79ea,,$0.45/ 100ml,False
drinks,Nescafe,"Coffee, GOLD Medium Roast & Ground & Instant  Capsules","NescafeCoffee, GOLD Medium Roast & Ground & Instant  Capsules12 ea",$9.49ea,,$0.79/ 1ea,False
drinks,Rose,Grenadine,RoseGrenadine739 ml,$5.49ea,,$0.74/ 100ml,False
drinks,Kosa,Coconut Water ,KosaCoconut Water 520 ml,$2.29ea,,$0.44/ 100ml,False
drinks,President's Choice,Honeycrisp Sweet Apple Cider,President's ChoiceHoneycrisp Sweet Apple Cider3000 ml,$8.99ea,,$0.30/ 100ml,False
drinks,President's Choice,"Feeling Soothed Peppermint, Ginger & Fennel Herbal Tea","President's ChoiceFeeling Soothed Peppermint, Ginger & Fennel Herbal Tea20 ea",$3.99ea,,$0.20/ 1ea,False
drinks,Ocean Spray,Diet Cranberry & Pomegranate Cocktail,Ocean SprayDiet Cranberry & Pomegranate Cocktail1.89 l,$3.79ea,$3.29ea,$0.17/ 100ml,True
drinks,Kool-Aid,Orange Liquid Drink Mix,Kool-AidOrange Liquid Drink Mix48 ml,$4.29ea,,$8.94/ 100ml,False
drinks,Jarritos,Soft Drink Pineapple,JarritosSoft Drink Pineapple370 ml,$1.69ea,,$0.46/ 100ml,False
drinks,PC Blue Menu,M Mango Pineapple,PC Blue MenuM Mango Pineapple10x200.0 ml,$3.89ea,,$1.95/ 100ml,False
drinks,Nestea,"Peach Tea, Cartons 10 Pack","NesteaPeach Tea, Cartons 10 Pack10x200.0 ml",$4.19ea,$3.99ea,$0.20/ 100ml,True
drinks,Kool-Aid,"Jammers, Blue Raspberry","Kool-AidJammers, Blue Raspberry10x180.0 ml",$3.89ea,,$0.22/ 100ml,False
drinks,Grace,100% Pure Coconut Water,Grace100% Pure Coconut Water1 l,$3.39ea,,$0.34/ 100ml,False
drinks,Mott's,Mr & Mrs T Pina Colada Mix,Mott'sMr & Mrs T Pina Colada Mix1 l,$5.49ea,,$0.55/ 100ml,False
drinks,Grand Pre,2% Milk,Grand Pre2% Milk1 l,$4.99ea,,$0.50/ 100ml,False
drinks,Gold Kili,Instant Coffee Mix,Gold KiliInstant Coffee Mix30x18.0 g,$6.49ea,,$1.20/ 100g,False
drinks,SunRype,Slim Blueberry Burst Low Calorie Beverage,SunRypeSlim Blueberry Burst Low Calorie Beverage1.36 l,$3.99ea,,$0.29/ 100ml,False
drinks,Nestle,Nesquik Strawberry Syrup,NestleNesquik Strawberry Syrup510 ml,$6.99ea,,$1.37/ 100ml,False
drinks,Oasis,Exotic Mango Fruit Juice,OasisExotic Mango Fruit Juice8x200.0 ml,$3.49ea,,$0.22/ 100ml,False
drinks,Cool Runnings,Coconut Milk,Cool RunningsCoconut Milk400 ml,$1.79ea,,$0.45/ 100ml,False
drinks,Nescafe,"Coffee, GOLD Medium Roast & Ground & Instant  Capsules","NescafeCoffee, GOLD Medium Roast & Ground & Instant  Capsules12 ea",$9.49ea,,$0.79/ 1ea,False
drinks,Rose,Grenadine,RoseGrenadine739 ml,$5.49ea,,$0.74/ 100ml,False
drinks,Kosa,Coconut Water ,KosaCoconut Water 520 ml,$2.29ea,,$0.44/ 100ml,False
drinks,President's Choice,Honeycrisp Sweet Apple Cider,President's ChoiceHoneycrisp Sweet Apple Cider3000 ml,$8.99ea,,$0.30/ 100ml,False
drinks,President's Choice,"Feeling Soothed Peppermint, Ginger & Fennel Herbal Tea","President's ChoiceFeeling Soothed Peppermint, Ginger & Fennel Herbal Tea20 ea",$3.99ea,,$0.20/ 1ea,False
drinks,Ocean Spray,Diet Cranberry & Pomegranate Cocktail,Ocean SprayDiet Cranberry & Pomegranate Cocktail1.89 l,$3.79ea,$3.29ea,$0.17/ 100ml,True
drinks,Kool-Aid,Orange Liquid Drink Mix,Kool-AidOrange Liquid Drink Mix48 ml,$4.29ea,,$8.94/ 100ml,False
drinks,Jarritos,Soft Drink Pineapple,JarritosSoft Drink Pineapple370 ml,$1.69ea,,$0.46/ 100ml,False
drinks,PC Blue Menu,M Mango Pineapple,PC Blue MenuM Mango Pineapple10x200.0 ml,$3.89ea,,$1.95/ 100ml,False
drinks,Nestea,"Peach Tea, Cartons 10 Pack","NesteaPeach Tea, Cartons 10 Pack10x200.0 ml",$4.19ea,$3.99ea,$0.20/ 100ml,True
drinks,Kool-Aid,"Jammers, Blue Raspberry","Kool-AidJammers, Blue Raspberry10x180.0 ml",$3.89ea,,$0.22/ 100ml,False
drinks,Grace,100% Pure Coconut Water,Grace100% Pure Coconut Water1 l,$3.39ea,,$0.34/ 100ml,False
drinks,Mott's,Mr & Mrs T Pina Colada Mix,Mott'sMr & Mrs T Pina Colada Mix1 l,$5.49ea,,$0.55/ 100ml,False
drinks,Grand Pre,2% Milk,Grand Pre2% Milk1 l,$4.99ea,,$0.50/ 100ml,False
drinks,Allen's,Peach Cocktail,Allen'sPeach Cocktail1 l,$2.29ea,,$0.23/ 100ml,False
drinks,Monster Energy,Ultra Watermelon,Monster EnergyUltra Watermelon4x473.0 ml,$11.99c04,,$0.63/ 100ml,False
drinks,President's Choice,Premium Black Tea Orange Pekoe,President's ChoicePremium Black Tea Orange Pekoe72 ea,$5.99ea,,$0.08/ 1ea,False
drinks,PC Blue Menu,Apple Juice from Concentrate ,PC Blue MenuApple Juice from Concentrate 2 l,$3.49ea,,$0.17/ 100ml,False
drinks,Allen's,Lemonade,Allen'sLemonade8x200.0 ml,$3.29ea,$2.99ea,$0.19/ 100ml,True
drinks,Grace,Sweetened Condensed Whitener,GraceSweetened Condensed Whitener297 ml,$2.99ea,,$1.01/ 100ml,False
drinks,No Name,Hot Chocolate Mix,No NameHot Chocolate Mix500 g,$3.99ea,,$0.80/ 100g,False
drinks,President's Choice,Hazelnut Vanilla Naturally Flavoured Decaffeinated Coffee,President's ChoiceHazelnut Vanilla Naturally Flavoured Decaffeinated Coffee250 g,$7.99ea,,$3.20/ 100g,False
drinks,Tim Hortons,Instant Dark Coffee,Tim HortonsInstant Dark Coffee100 g,$9.49ea,,$9.49/ 100g,False
drinks,Dasani,"Water, Bottle","DasaniWater, Bottle591 ml",$2.79ea,,$0.47/ 100ml,False
drinks,No Name,Orange Juice With Pulp,No NameOrange Juice With Pulp1.75 l,$2.99ea,,$0.17/ 100ml,False
drinks,Mr Brown,"Iced Coffee, Cappuccino","Mr BrownIced Coffee, Cappuccino240 ml",$1.49ea,,$0.62/ 100ml,False
drinks,Carnation,Fat Free Evaporated Skim Milk,CarnationFat Free Evaporated Skim Milk354 ml,$2.49ea,,$0.70/ 100ml,False
drinks,Minute Maid,"Mixed Berry Juice Beverage, 8 Pack","Minute MaidMixed Berry Juice Beverage, 8 Pack8x200.0 ml",$4.19ea,$3.99ea,$0.25/ 100ml,True
drinks,President's Choice,Espresso Perfetto Coffee Capsules,President's ChoiceEspresso Perfetto Coffee Capsules10 ea,$7.49ea,,$74.90/ 100ea,False
drinks,No Name,Lemon Iced Tea,No NameLemon Iced Tea3.78 l,$4.29ea,,$0.11/ 100ml,False
drinks,Marble Pop,Original,Marble PopOriginal200 ml,$2.79ea,,$1.40/ 100ml,False
drinks,MiO,Vitamins Blackberry Raspberry Liquid Water Enhancer,MiOVitamins Blackberry Raspberry Liquid Water Enhancer48 ml,$4.29ea,,$8.94/ 100ml,False
drinks,No Name,Tomato Juice,No NameTomato Juice1 l,$3.29ea,,$0.24/ 100ml,False
drinks,President's Choice,Naturally Flavoured Grape Soda,President's ChoiceNaturally Flavoured Grape Soda2 l,$1.99ea,,$0.10/ 100ml,False
drinks,Starbucks,Frappuccino Mocha Coffee Drink,StarbucksFrappuccino Mocha Coffee Drink405 ml,$3.99ea,,$0.99/ 100ml,False
drinks,Minute Maid,"Real Fruit Beverage Peach Mango, 8","Minute MaidReal Fruit Beverage Peach Mango, 88x200.0 ml",$4.19ea,$3.99ea,$0.25/ 100ml,True
drinks,Nesquik,Vanilla Syrup,NesquikVanilla Syrup510 ml,$6.99ea,,$1.37/ 100ml,False
drinks,Lavazza,Crema Gusto Beans,LavazzaCrema Gusto Beans1 kg,$23.99ea,$19.99ea,$2.00/ 100g,True
drinks,Coca-Cola,Coffee Vanilla,Coca-ColaCoffee Vanilla355 ml,$3.49ea,,$0.98/ 100ml,False
drinks,Best,Guava Nectar     ,BestGuava Nectar     1 l,$3.59ea,,$0.36/ 100ml,False
drinks,Gatorade,Zero Variety Flavour,GatoradeZero Variety Flavour24x591.0 ml,$19.99c24,,$0.14/ 100ml,False
drinks,President's Choice,Lemon Thriller Herbal Tea,President's ChoiceLemon Thriller Herbal Tea20 ea,$3.99ea,,$9.98/ 100g,False
drinks,President's Choice,Winter Blend Dark Roast Coffee,President's ChoiceWinter Blend Dark Roast Coffee250 g,$6.99ea,,$2.80/ 100g,False
drinks,Thai Kitchen,Coconut Milk,Thai KitchenCoconut Milk160 ml,$1.79ea,,$1.12/ 100ml,False
drinks,So Nice,Earths Own Organic Almond Original,So NiceEarths Own Organic Almond Original1.75 l,$5.49ea,,$0.31/ 100ml,False
drinks,Perfect Hydration,9.5+ Ph Alkaline Water,Perfect Hydration9.5+ Ph Alkaline Water591 ml,$1.99ea,,$0.34/ 100ml,False
drinks,Muskoka,Loon Call Breakfast Blend Pods,MuskokaLoon Call Breakfast Blend Pods230 g,$20.99ea,,$9.13/ 100g,False
drinks,Pure Leaf,Pureleaf Herbal Mango Hibiscus,Pure LeafPureleaf Herbal Mango Hibiscus547 ml,$3.49ea,,$0.64/ 100ml,False
drinks,CLAUSTHALER,Alcohol Free Beer    ,CLAUSTHALERAlcohol Free Beer    500 ml,$2.29ea,,$0.46/ 100ml,False
drinks,Wissotzky,Earl Grey Tea,WissotzkyEarl Grey Tea25 ea,$3.39ea,,$9.04/ 100g,False
drinks,Zevia,Energy Kola,ZeviaEnergy Kola355 ml,$2.99ea,,$0.84/ 100ml,False
drinks,Tazo,"Calm Chamomile Tea Chamomile, Rose Petals and Soothing Herbs","TazoCalm Chamomile Tea Chamomile, Rose Petals and Soothing Herbs20 ea",$6.99ea,,$0.35/ 1ea,False
drinks,Bolthouse,Amazing Mango,BolthouseAmazing Mango946 ml,$6.99ea,,$0.74/ 100ml,False
drinks,Van Houtte,Ground Coffee Flavoured Dulce De Leche Light Roast,Van HoutteGround Coffee Flavoured Dulce De Leche Light Roast340 g,$13.99ea,,$4.11/ 100g,False
drinks,Twinings,20ct Variety Pack,Twinings20ct Variety Pack20 ea,$6.49ea,,$0.32/ 1ea,False
drinks,Twinings,Green Tea,TwiningsGreen Tea50 ea,$10.99ea,,$0.22/ 1ea,False
drinks,Brooke Bond,"Taj Mahal Black Tea, Loose, Small","Brooke BondTaj Mahal Black Tea, Loose, Small450 g",$6.99ea,$5.49ea,$1.22/ 100g,True
drinks,Dr Pepper,Soda,Dr PepperSoda473 ml,$1.79ea,,$0.38/ 100ml,False
drinks,iiCiNG,Liquid Beverage Enhancer Pina Colada,iiCiNGLiquid Beverage Enhancer Pina Colada48 ml,$3.99ea,,$8.31/ 100ml,False
drinks,Stur,Strawberry & Watermelon,SturStrawberry & Watermelon552 ml,$4.49ea,,$10.95/ 100ml,False
drinks,Stur,"Jelly Belly, Berry Blue","SturJelly Belly, Berry Blue48 ml",$3.99ea,,$8.31/ 100ml,False
drinks,Sunny Delight,Tangy Original ,Sunny DelightTangy Original 500 ml,$1.79ea,,$0.36/ 100ml,False
drinks,Tetley,"Green Tea, Decaf","TetleyGreen Tea, Decaf48 ea",$7.99ea,,$0.17/ 1ea,False
drinks,Twinings,English Breakfast,TwiningsEnglish Breakfast100 g,$9.79ea,,$9.79/ 100g,False
drinks,Timothy's,Colombian La Vereda K cups,Timothy'sColombian La Vereda K cups30 ea,$21.99ea,,$0.73/ 1ea,False
drinks,Typhoo,Decaf Tea,TyphooDecaf Tea80 ea,$10.99ea,,$0.14/ 1ea,False
drinks,Tetley,Strawberry & Watermelon Flavoured Herbal Tea,TetleyStrawberry & Watermelon Flavoured Herbal Tea12 ea,$4.49ea,,$0.37/ 1ea,False
drinks,Van Houtte,"Coffee, Amaretto K-Cup  Pods, 12 Count","Van HoutteCoffee, Amaretto K-Cup  Pods, 12 Count12 ea",$12.99ea,,$1.08/ 1ea,False
drinks,Starbucks,Ground Coffee French Roast,StarbucksGround Coffee French Roast793 g,$24.99ea,,$3.15/ 100g,False
drinks,Starbucks,Whole Bean 100% Arabica Coffee Caffè Verona Dark Roast,StarbucksWhole Bean 100% Arabica Coffee Caffè Verona Dark Roast907 g,$26.99ea,,"$2,975.74/ 100g",False
drinks,Kosa,Coconut Milk Unsweetened,KosaCoconut Milk Unsweetened165 ml,$1.79ea,,$1.08/ 100ml,False
drinks,Van Houtte,Ground Coffee Flavoured Dulce De Leche Light Roast,Van HoutteGround Coffee Flavoured Dulce De Leche Light Roast12 ea,$12.99ea,,$1.08/ 1ea,False
drinks,Nestle,Purelife Natural Spring Water ,NestlePurelife Natural Spring Water 12x330.0 ml,$4.29pack of 12,,$0.11/ 100ml,False
drinks,Monster Energy,Ultra Watermelon,Monster EnergyUltra Watermelon4x473.0 ml,$11.99c04,,$0.63/ 100ml,False
drinks,President's Choice,Premium Black Tea Orange Pekoe,President's ChoicePremium Black Tea Orange Pekoe72 ea,$5.99ea,,$0.08/ 1ea,False
drinks,PC Blue Menu,Apple Juice from Concentrate ,PC Blue MenuApple Juice from Concentrate 2 l,$3.49ea,,$0.17/ 100ml,False
drinks,Allen's,Lemonade,Allen'sLemonade8x200.0 ml,$3.29ea,$2.99ea,$0.19/ 100ml,True
drinks,Grace,Sweetened Condensed Whitener,GraceSweetened Condensed Whitener297 ml,$2.99ea,,$1.01/ 100ml,False
drinks,No Name,Hot Chocolate Mix,No NameHot Chocolate Mix500 g,$3.99ea,,$0.80/ 100g,False
drinks,President's Choice,Hazelnut Vanilla Naturally Flavoured Decaffeinated Coffee,President's ChoiceHazelnut Vanilla Naturally Flavoured Decaffeinated Coffee250 g,$7.99ea,,$3.20/ 100g,False
drinks,Tim Hortons,Instant Dark Coffee,Tim HortonsInstant Dark Coffee100 g,$9.49ea,,$9.49/ 100g,False
drinks,Dasani,"Water, Bottle","DasaniWater, Bottle591 ml",$2.79ea,,$0.47/ 100ml,False
drinks,No Name,Orange Juice With Pulp,No NameOrange Juice With Pulp1.75 l,$2.99ea,,$0.17/ 100ml,False
drinks,Mr Brown,"Iced Coffee, Cappuccino","Mr BrownIced Coffee, Cappuccino240 ml",$1.49ea,,$0.62/ 100ml,False
drinks,Carnation,Fat Free Evaporated Skim Milk,CarnationFat Free Evaporated Skim Milk354 ml,$2.49ea,,$0.70/ 100ml,False
drinks,Minute Maid,"Mixed Berry Juice Beverage, 8 Pack","Minute MaidMixed Berry Juice Beverage, 8 Pack8x200.0 ml",$4.19ea,$3.99ea,$0.25/ 100ml,True
drinks,President's Choice,Espresso Perfetto Coffee Capsules,President's ChoiceEspresso Perfetto Coffee Capsules10 ea,$7.49ea,,$74.90/ 100ea,False
drinks,No Name,Lemon Iced Tea,No NameLemon Iced Tea3.78 l,$4.29ea,,$0.11/ 100ml,False
drinks,Marble Pop,Original,Marble PopOriginal200 ml,$2.79ea,,$1.40/ 100ml,False
drinks,MiO,Vitamins Blackberry Raspberry Liquid Water Enhancer,MiOVitamins Blackberry Raspberry Liquid Water Enhancer48 ml,$4.29ea,,$8.94/ 100ml,False
drinks,No Name,Tomato Juice,No NameTomato Juice1 l,$3.29ea,,$0.24/ 100ml,False
drinks,President's Choice,Naturally Flavoured Grape Soda,President's ChoiceNaturally Flavoured Grape Soda2 l,$1.99ea,,$0.10/ 100ml,False
drinks,Starbucks,Frappuccino Mocha Coffee Drink,StarbucksFrappuccino Mocha Coffee Drink405 ml,$3.99ea,,$0.99/ 100ml,False
drinks,No Name,Dark Roast Coffee Pods,No NameDark Roast Coffee Pods114 g,$5.99ea,,$5.25/ 100g,False
drinks,Perrier,Carbonated Natural Spring Water with Lime,PerrierCarbonated Natural Spring Water with Lime10x250.0 ml,$8.99c10,,$0.36/ 100ml,False
drinks,Foco,Coconut Juice,FocoCoconut Juice520 ml,$1.89ea,,$0.36/ 100ml,False
drinks,President's Choice,Espresso Forte,President's ChoiceEspresso Forte250 g,$6.99ea,,$2.80/ 100g,False
drinks,Eagle Brand,Brand Low Fat Sweetened Condensed Milk,Eagle BrandBrand Low Fat Sweetened Condensed Milk300 ml,$4.79ea,,$1.60/ 100ml,False
drinks,Mr Brown,"Iced Coffee, Regular","Mr BrownIced Coffee, Regular240 ml",$1.49ea,,$0.62/ 100ml,False
drinks,President's Choice,Low Sodium & Caffeine-Free Diet Cola,President's ChoiceLow Sodium & Caffeine-Free Diet Cola2 l,$1.99ea,,$0.10/ 100ml,False
drinks,President's Choice,Espresso Aromatico Lungo Coffee Capsules,President's ChoiceEspresso Aromatico Lungo Coffee Capsules10 ea,$7.49ea,,$74.90/ 100ea,False
drinks,President's Choice,Sparkling Dealcoholized Wine,President's ChoiceSparkling Dealcoholized Wine750 ml,$7.49ea,$6.99ea,$0.93/ 100ml,True
drinks,Peace Tea,"Razzleberry Tea, Can","Peace TeaRazzleberry Tea, Can695 ml",$1.99ea,,$0.29/ 100ml,False
drinks,Tazo,"Herbal Tea Passion Hibiscus, Orange peel and Passion Fruit Flavours","TazoHerbal Tea Passion Hibiscus, Orange peel and Passion Fruit Flavours1 ea",$6.99ea,,$6.99/ 1ea,False
drinks,President's Choice,Spritz Up,President's ChoiceSpritz Up12x355.0 ml,$6.49ea,,$0.15/ 100ml,False
drinks,Ahmad,"Tea, Earl Grey Tea","AhmadTea, Earl Grey Tea200 g",$6.49ea,,$3.25/ 100g,False
drinks,Five Alive,"Passionate Peach Juice, 8 Pack","Five AlivePassionate Peach Juice, 8 Pack8x200.0 ml",$4.19ea,$3.99ea,$0.25/ 100ml,True
drinks,Gold Kili,Matcha Latte Instant 10,Gold KiliMatcha Latte Instant 10250 g,$6.99ea,,$2.80/ 100g,False
drinks,Mott's,Clamato Rimmer,Mott'sClamato Rimmer200 g,$4.49ea,,$2.25/ 100g,False
drinks,Maxwell House,Pure Ground Coffee Rich Dark Roast,Maxwell HousePure Ground Coffee Rich Dark Roast900 g,$12.99ea,,$1.44/ 100g,False
drinks,President's Choice,Free & Clear Black Cherry Sparkling Water ,President's ChoiceFree & Clear Black Cherry Sparkling Water 1 l,$1.99ea,,$0.20/ 100ml,False
drinks,Tropicana,"Pure Premium Orange Juice, Homestyle","TropicanaPure Premium Orange Juice, Homestyle3.78 l",$11.99ea,,$0.32/ 100ml,False
drinks,Pepsi,Diet Soda,PepsiDiet Soda12x355.0 ml,$7.49c12,,$0.18/ 100ml,False
drinks,Minute Maid,"Peach Mango Juice Beverage, Carton","Minute MaidPeach Mango Juice Beverage, Carton1 l",$2.49ea,,$0.25/ 100ml,False
drinks,Tropicana,Pineapple Mango With Lime Beverage  ,TropicanaPineapple Mango With Lime Beverage  1.54 l,$5.49ea,,$0.36/ 100ml,False
drinks,Del Monte,Orange Juice With Pulp,Del MonteOrange Juice With Pulp2.5 l,$8.99ea,,$0.36/ 100ml,False
drinks,Kool-Aid,Cherry Liquid Drink Mix,Kool-AidCherry Liquid Drink Mix48 ml,$4.29ea,,$8.94/ 100ml,False
drinks,Coca-Cola,"Diet, Bottle","Coca-ColaDiet, Bottle500 ml",$2.99ea,,$0.60/ 100ml,False
drinks,Crush,Crush Orange Soda ,CrushCrush Orange Soda 12x355.0 ml,$7.49c12,,$0.18/ 100ml,False
drinks,Grace,100% Pure Coconut Water,Grace100% Pure Coconut Water310 ml,$1.29ea,,$0.42/ 100ml,False
drinks,President's Choice,Espresso Potente Coffee Capsules,President's ChoiceEspresso Potente Coffee Capsules10 ea,$7.49ea,,$74.90/ 100ea,False
drinks,Toro Matcha,Sparkling Peach,Toro MatchaSparkling Peach355 ml,$3.99ea,,$1.12/ 100ml,False
drinks,Walini, Lemon Flavor Black Tea,Walini Lemon Flavor Black Tea45 g,$4.29ea,,$9.53/ 100g,False
drinks,Van Houtte,"Vanilla Hazelnut K-Cup Coffee Pods, 24 Count","Van HoutteVanilla Hazelnut K-Cup Coffee Pods, 24 Count24 ea",$18.99ea,$17.99ea,$0.75/ 1ea,True
drinks,iiCiNG,Liquid Beverage Enhancer Cherry Burst,iiCiNGLiquid Beverage Enhancer Cherry Burst48 ml,$3.99ea,,$8.31/ 100ml,False
drinks,Kintore Coffee Co,Dark Roasted Ground Coffee,Kintore Coffee CoDark Roasted Ground Coffee454 g,$19.99ea,,$4.40/ 100g,False
drinks,Celestial Seasonings,Bengal Spice Herbal Tea,Celestial SeasoningsBengal Spice Herbal Tea94 g,$7.99ea,,$19.98/ 100g,False
drinks,DAVIDsTEA,Loose Leaf Tea Black Tea Vanilla Cappuccino,DAVIDsTEALoose Leaf Tea Black Tea Vanilla Cappuccino50 g,$9.99ea,,$19.98/ 100g,False
drinks,Nestle,Pure Life Natural Spring Water ,NestlePure Life Natural Spring Water 12x710.0 ml,$5.99pack of 12,,$0.07/ 100ml,False
drinks,Trung Nguyen,"G7 3-in-1 Instant Coffee, Box    ","Trung NguyenG7 3-in-1 Instant Coffee, Box    288 g",$3.99ea,,$1.39/ 100g,False
drinks,Schweppes,Ginger Ale Zero Sugar   ,SchweppesGinger Ale Zero Sugar   12x355.0 ml,$7.49pack of 12,,$0.18/ 100ml,False
drinks,Celestial Seasonings,Sleepytime Herbal Tea,Celestial SeasoningsSleepytime Herbal Tea20 ea,$5.49ea,,$0.27/ 1ea,False
drinks,Starbucks,VIA Instant House Blend,StarbucksVIA Instant House Blend8 ea,$8.99ea,,$1.12/ 1ea,False
drinks,Twinings,20ct Earl Grey,Twinings20ct Earl Grey20 ea,$6.49ea,,$0.32/ 1ea,False
drinks,Maxwell House,Decaffeinated Coffee 100% Compostable K Cup Coffee Pods,Maxwell HouseDecaffeinated Coffee 100% Compostable K Cup Coffee Pods117 g,$9.49ea,,$8.11/ 100g,False
drinks,Muskoka,Loon Call Breakfast Blend,MuskokaLoon Call Breakfast Blend454 g,$13.99ea,,$3.08/ 100g,False
drinks,Marley Coffee,"Coffee, Simmer Down Decaf Fair Trade, Ground ","Marley CoffeeCoffee, Simmer Down Decaf Fair Trade, Ground 284 g",$9.99ea,,$3.52/ 100g,False
drinks,Tealish,Green Tea Organic Sencha,TealishGreen Tea Organic Sencha37.5 g,$9.99ea,,$26.64/ 100g,False
drinks,Perrier,Sparkling Strawberry & Kiwi Beverage,PerrierSparkling Strawberry & Kiwi Beverage6x330.0 ml,$8.79pack of 6,,$0.44/ 100ml,False
drinks,President's Choice,"Coffee, French Vanilla Flavoured  Single Serve  Pods","President's ChoiceCoffee, French Vanilla Flavoured  Single Serve  Pods12 ea",$7.49ea,$6.99ea,$0.58/ 1ea,True
drinks,ARTO LIFE WTR,Arto Life Water,ARTO LIFE WTRArto Life Water1 l,$3.39ea,,$0.34/ 100ml,False
drinks,Brisk,Mountain Dew,BriskMountain Dew473 ml,$1.79ea,,$0.38/ 100ml,False
drinks,Tetley,Bellini Herbal Tea    ,TetleyBellini Herbal Tea    20 ea,$3.99ea,,$0.20/ 1ea,False
drinks,Bolthouse,Strawberry Banana,BolthouseStrawberry Banana450 ml,$5.49ea,,$1.22/ 100ml,False
