category,brand,product_text,product_name,price_text,sale_price,per_unit_price_text,is_sale
frozen,Wholly Veggie,Mozzarella Sticks,Wholly VeggieMozzarella Sticks283 g,$7.49ea,$6.99ea,$2.47/ 100g,True
frozen,BlueWater Seafoods,Beer Batter Fillets,BlueWater SeafoodsBeer Batter Fillets450 g,$8.49ea,,$1.89/ 100g,False
frozen,Impossible Foods Inc.,Chicken Nuggets Made From Plants,Impossible Foods Inc.Chicken Nuggets Made From Plants383 g,$9.99ea,,$2.61/ 100g,False
frozen,NotCo,"Not Burger Plant-Based Patties, 4 pack","NotCoNot Burger Plant-Based Patties, 4 pack452 g",$13.99ea,,$3.10/ 100g,False
frozen,President's Choice,"Italian Meatballs, Club Pack","President's ChoiceItalian Meatballs, Club Pack1.81 kg",$29.99ea,,$1.66/ 100g,False
frozen,Boston Market,Salisbury Steak,Boston MarketSalisbury Steak411 g,$5.49ea,,$1.34/ 100g,False
frozen,,"Fresh Snapper, Whole","Fresh Snapper, Whole",$18.33(est.)ea,,$28.64/ 1kg,False
frozen,Mama Yolanda's,Mini Gourmet Bolognese Lasagna,Mama Yolanda'sMini Gourmet Bolognese Lasagna1.22 kg,$14.99ea,$12.99ea,$1.06/ 100g,True
frozen,Kinnikinnick,Donuts Chocolate Dipped,KinnikinnickDonuts Chocolate Dipped320 g,$6.99ea,,$2.18/ 100g,False
frozen,Schneider,Original Beef Pies,SchneiderOriginal Beef Pies400 g,$8.49ea,,$2.12/ 100g,False
frozen,Wholly Veggie,Vegan Cauliflower Wings,Wholly VeggieVegan Cauliflower Wings375 g,$8.99ea,$7.49ea,$2.00/ 100g,True
frozen,BlueWater Seafoods,Beer Battered Haddock    ,BlueWater SeafoodsBeer Battered Haddock    480 g,$14.99ea,$13.99ea,$2.91/ 100g,True
frozen,Little Northern Bakehouse,Artisan Style Pizza Crust Original Gluten Free,Little Northern BakehouseArtisan Style Pizza Crust Original Gluten Free300 g,$10.99ea,,$3.66/ 100g,False
frozen,Cosmic Bliss,Dairy-Free Frozen Dessert Madagascan Vanilla Bean,Cosmic BlissDairy-Free Frozen Dessert Madagascan Vanilla Bean473 ml,$9.99ea,,$2.11/ 100ml,False
frozen,Cosmic Bliss,Dairy-Free Frozen Dessert Sea Salt Caramel Chocolate,Cosmic BlissDairy-Free Frozen Dessert Sea Salt Caramel Chocolate473 ml,$9.99ea,,$2.11/ 100ml,False
frozen,,Taco Bites,Taco Bites850 g,$10.00ea,,$1.18/ 100g,False
frozen,New Zealand,Lamb Sausage,New ZealandLamb Sausage500 g,$9.99ea,,$19.98/ 1kg,False
frozen,St Hubert,Tourtière Fully Cooked,St HubertTourtière Fully Cooked470 g,$9.99ea,,$2.13/ 100g,False
frozen,Daiya,Vegetable Crust Pizza Mediterranean,DaiyaVegetable Crust Pizza Mediterranean411 g,$10.99ea,$8.49ea,$2.07/ 100g,True
frozen,,"All-Seasoned Salmon Sausage, Italian","All-Seasoned Salmon Sausage, Italian",$5.73(est.)ea,,$22.02/ 1kg,False
frozen,Dr. Praeger's,Purely Sensible Foods Veggie Burgers Kale 4 Vegan Burgers,Dr. Praeger'sPurely Sensible Foods Veggie Burgers Kale 4 Vegan Burgers283 g,$9.49ea,,$3.35/ 100g,False
frozen,Unbun,Cinnamon Raisin Bread,UnbunCinnamon Raisin Bread520 g,$12.99ea,$10.99ea,$2.11/ 100g,True
frozen,Chef Bombay,Palak Paneer,Chef BombayPalak Paneer350 g,$6.99ea,,$2.00/ 100g,False
frozen,Healthy Choice,Simply Chicken Pesto Veg,Healthy ChoiceSimply Chicken Pesto Veg259 g,$5.79ea,,$2.24/ 100g,False
frozen,Stouffers,"Fit Wraps, Greek Chicken","StouffersFit Wraps, Greek Chicken145 g",$6.99ea,,$4.82/ 100g,False
frozen,Toblerone,Chocolate Torte,TobleroneChocolate Torte400 g,$11.99ea,,$3.00/ 100g,False
frozen,So Delicious,"Dairy Free Cashew-Based Frozen Dessert, Chocolate Banana Flambe","So DeliciousDairy Free Cashew-Based Frozen Dessert, Chocolate Banana Flambe500 ml",$8.49ea,,$1.70/ 100ml,False
frozen,Schneider,Mini Chicken & Vegetable Pies,SchneiderMini Chicken & Vegetable Pies400 g,$8.49ea,,$2.12/ 100g,False
frozen,Prime,"Chicken Stuffed with Butter & Chive, Raised Without Antibiotics","PrimeChicken Stuffed with Butter & Chive, Raised Without Antibiotics568 g",$15.99ea,,$2.82/ 100g,False
frozen,Cheemo,Bite-Size Perogies Potato & Cheddar Cheese,CheemoBite-Size Perogies Potato & Cheddar Cheese907 g,$4.29ea,,$0.47/ 100g,False
frozen,Hayter's Farm,Turkey Sausage Original,Hayter's FarmTurkey Sausage Original1.14 kg,$17.49ea,,$1.53/ 100g,False
frozen,Dose,Yogi Cold Pressed Juice,DoseYogi Cold Pressed Juice300 ml,$7.49ea,,$2.50/ 100ml,False
frozen,Cosmic Bliss,Dairy-Free Frozen Dessert Chocolate Peanut Butter,Cosmic BlissDairy-Free Frozen Dessert Chocolate Peanut Butter473 ml,$9.99ea,,$2.11/ 100ml,False
frozen,BlueWater Seafoods,Fish Burger Fillets,BlueWater SeafoodsFish Burger Fillets519 g,$8.49ea,,$1.64/ 100g,False
frozen,President's Choice,Red Curry Chicken,President's ChoiceRed Curry Chicken350 g,$4.99ea,,$1.43/ 100g,False
frozen,PC Blue Menu,"Chicken Breasts, Sliced","PC Blue MenuChicken Breasts, Sliced400 g",$12.99ea,,$3.25/ 100g,False
frozen,Millennia Tea,Raw Chopped Green Tea Organic Superfood Tea,Millennia TeaRaw Chopped Green Tea Organic Superfood Tea120 g,$17.99ea,,$14.99/ 100g,False
frozen,Krinos,"Fillo Twisters, Feta & Ricotta Cheese","KrinosFillo Twisters, Feta & Ricotta Cheese840 g",$9.99ea,,$1.19/ 100g,False
frozen,PC Organics,Organics Peaches and Cream Corn,PC OrganicsOrganics Peaches and Cream Corn500 g,$5.49ea,,$1.10/ 100g,False
frozen,Stouffers,"Fit Bowls, Chicken with Roasted Cashew Bowl","StouffersFit Bowls, Chicken with Roasted Cashew Bowl340 g",$6.99ea,,$2.06/ 100g,False
frozen,Pizza Oggi,Margherita,Pizza OggiMargherita452 g,$9.99ea,,$2.21/ 100g,False
frozen,Foppen,Smoked Slice Salmon Loin,FoppenSmoked Slice Salmon Loin170 g,$13.99ea,,$8.23/ 100g,False
frozen,Delissio,Stuffed Crust Pizza Smoky BBQ Chicken,DelissioStuffed Crust Pizza Smoky BBQ Chicken634 g,$9.99ea,,$1.58/ 100g,False
frozen,President's Choice,Shrimp & Scallops Au Gratin,President's ChoiceShrimp & Scallops Au Gratin240 g,$13.99ea,,$5.83/ 100g,False
frozen,Mccain,Deluxe Pizza Pockets ,MccainDeluxe Pizza Pockets 600 g,$5.99ea,,$1.00/ 100g,False
frozen,,Buttermilk Chicken Tenders,Buttermilk Chicken Tenders1.2 kg,$10.00ea,,$0.83/ 100g,False
frozen,Tim Hortons,Ice Cream Salted Caramel Iced Capp ,Tim HortonsIce Cream Salted Caramel Iced Capp 500 ml,$6.99ea,,$1.40/ 100ml,False
frozen,Hungry-Man,Chicken Strips Buffalo Style,Hungry-ManChicken Strips Buffalo Style428 g,$5.79ea,,$1.35/ 100g,False
frozen,Hungry-Man,Beer-Battered Chicken,Hungry-ManBeer-Battered Chicken411 g,$5.79ea,,$1.41/ 100g,False
frozen,Righteous,Sea Salted Caramel Gelato,RighteousSea Salted Caramel Gelato562 ml,$9.99ea,$9.49ea,$1.69/ 100ml,True
frozen,Breyers,Ice Cream Creamery Style Light Kosher Certified Caramel Fudge ,BreyersIce Cream Creamery Style Light Kosher Certified Caramel Fudge 1.66 l,$5.49ea,,$0.33/ 100ml,False
frozen,Chapmans,Yukon French Vanilla & Almond Lynx Bar,ChapmansYukon French Vanilla & Almond Lynx Bar6x90.0 ml,$8.99ea,,$1.66/ 100ml,False
frozen,Wall’s,"Ice Cream, Bubble Tea Milk Tea & Boba Pearls Flavours, with Chewy Tapioca Balls","Wall’sIce Cream, Bubble Tea Milk Tea & Boba Pearls Flavours, with Chewy Tapioca Balls6 ea",$5.99ea,$5.49ea,$0.92/ 1ea,True
frozen,President's Choice,Plant Based Original Cheesecake-Style Dessert,President's ChoicePlant Based Original Cheesecake-Style Dessert540 g,$9.99ea,,$1.85/ 100g,False
frozen,President's Choice,"Ice Cream Shop, Elk Crossing Mini Ice Cream Bars","President's ChoiceIce Cream Shop, Elk Crossing Mini Ice Cream Bars330 ml",$6.49ea,,$1.97/ 100ml,False
frozen,High Liner,"Breaded Haddock Bites, Roasted Garlic & Herb","High LinerBreaded Haddock Bites, Roasted Garlic & Herb600 g",$12.99ea,,$2.17/ 100g,False
frozen,President's Choice,"Plant Based Black Bean, Corn and Sweet Potato Veggie Burgers","President's ChoicePlant Based Black Bean, Corn and Sweet Potato Veggie Burgers452 g",$7.99ea,,$1.77/ 100g,False
frozen,No Name,"Green Peas, Club Size","No NameGreen Peas, Club Size2 kg",$7.99ea,,$0.40/ 100g,False
frozen,Chapmans,"Chocolate, Salty Caramel & Peanuts","ChapmansChocolate, Salty Caramel & Peanuts2 l",$7.49ea,,$0.37/ 100ml,False
frozen,President's Choice,Shepherd's Pie Club Pack,President's ChoiceShepherd's Pie Club Pack1.8 kg,$25.99ea,,$1.44/ 100g,False
frozen,Pillsbury,Toaster Strudel Wildberry Flavour,PillsburyToaster Strudel Wildberry Flavour326 g,$3.99ea,,$1.22/ 100g,False
frozen,Breyers,"Ice Cream, Blueberry Grunt Locally Inspired Light ","BreyersIce Cream, Blueberry Grunt Locally Inspired Light 1.41 l",$5.49ea,,$0.39/ 100ml,False
frozen,Chapmans,Dutch Chocolate,ChapmansDutch Chocolate2 l,$5.49ea,$3.99ea,$0.20/ 100ml,True
frozen,CAVENDISH FARMS,Onion Hash Brown Patties,CAVENDISH FARMSOnion Hash Brown Patties600 g,$4.49ea,,$0.75/ 100g,False
frozen,Chapmans,No Sugar Added Lactose Free Ice Cream Coffee & Chocolate,ChapmansNo Sugar Added Lactose Free Ice Cream Coffee & Chocolate1 l,$5.50ea,$3.99ea,$0.40/ 100ml,True
frozen,Healthy Choice,Zero Tomato Basil Chicken,Healthy ChoiceZero Tomato Basil Chicken269 g,$7.49ea,,$2.78/ 100g,False
frozen,President's Choice,"Strawberries, Raspberries, Blackberries & Blueberries 4-Berry Blend, Club Size","President's ChoiceStrawberries, Raspberries, Blackberries & Blueberries 4-Berry Blend, Club Size2 kg",$19.99ea,,$1.00/ 100g,False
frozen,Breyers,Family Classic Frozen Dessert ,BreyersFamily Classic Frozen Dessert 1.66 l,$5.49ea,$4.99ea,$0.30/ 100ml,True
frozen,President's Choice,Cream First Chocolate Ice Cream,President's ChoiceCream First Chocolate Ice Cream1.5 l,$7.49ea,$5.49ea,$0.37/ 100ml,True
frozen,President's Choice,Cherry-Topped New York-Style Cheesecake,President's ChoiceCherry-Topped New York-Style Cheesecake600 g,$10.99ea,,$1.83/ 100g,False
frozen,Chapmans,"Yukon Ice Cream Chocolate, Salty Caramel, Peanuts & Milk Chocolate","ChapmansYukon Ice Cream Chocolate, Salty Caramel, Peanuts & Milk Chocolate5x140.0 ml",$8.99ea,,$1.28/ 100ml,False
frozen,President's Choice,Asian-Style Vegetable Blend ,President's ChoiceAsian-Style Vegetable Blend 500 g,$5.49ea,,$1.10/ 100g,False
frozen,Halo Top,Cookie Dough,Halo TopCookie Dough473 ml,$5.99ea,,$1.27/ 100ml,False
frozen,Chef Bombay,Butter Chicken,Chef BombayButter Chicken354 g,$6.99ea,,$1.97/ 100g,False
frozen,Stouffers,"BowlFULLs, Chicken Bacon Ranch","StouffersBowlFULLs, Chicken Bacon Ranch305 g",$6.99ea,,$2.29/ 100g,False
frozen,President's Choice,Sweet Potato Chunks,President's ChoiceSweet Potato Chunks400 g,$5.49ea,,$1.37/ 100g,False
frozen,Mccain,"Potato, Bistro Selects 9 Minute Savoury Frites","MccainPotato, Bistro Selects 9 Minute Savoury Frites600 g",$4.25ea,$2.99ea,$0.50/ 100g,True
frozen,Delissio,Rising Crust Veggie Deluxe Pizza,DelissioRising Crust Veggie Deluxe Pizza835 g,$6.50ea,$5.88ea,$0.70/ 100g,True
frozen,Delissio,Hawaiian Pizza,DelissioHawaiian Pizza857 g,$6.50ea,$5.88ea,$0.69/ 100g,True
frozen,President's Choice,Bacon-Wrapped Wild Sea Scallops,President's ChoiceBacon-Wrapped Wild Sea Scallops260 g,$17.99ea,,$6.92/ 100g,False
frozen,President's Choice,"Ice Cream, Plant Based Coconut Milk Frozen Dessert, Peanut Butter & Chocolatey Flakes","President's ChoiceIce Cream, Plant Based Coconut Milk Frozen Dessert, Peanut Butter & Chocolatey Flakes500 ml",$3.99ea,,$0.80/ 100ml,False
frozen,President's Choice,"Plant Based Coconut Milk Frozen Dessert, Chocolate","President's ChoicePlant Based Coconut Milk Frozen Dessert, Chocolate500 ml",$3.99ea,,$0.80/ 100ml,False
frozen,Gardein,Breakfast Saus'age Patties Maple,GardeinBreakfast Saus'age Patties Maple190 g,$8.49ea,,$4.47/ 100g,False
frozen,Shana,Okra Rings,ShanaOkra Rings300 g,$2.19ea,,$0.73/ 100g,False
frozen,Dr Oetker,Casa di Mama Deluxe Pizza,Dr OetkerCasa di Mama Deluxe Pizza410 g,$5.49ea,,$1.34/ 100g,False
frozen,Haagen Dazs,Exträaz Rocky Road Ice Cream,Haagen DazsExträaz Rocky Road Ice Cream500 ml,$6.99ea,,$1.40/ 100ml,False
frozen,Crave,All Day Breakfast Double Sausage and Bacon Loaded Tots,CraveAll Day Breakfast Double Sausage and Bacon Loaded Tots255 g,$6.49ea,,$2.55/ 100g,False
frozen,Life Cuisine,"Three Cheese Chicken, Pesto & Spinach Bowl","Life CuisineThree Cheese Chicken, Pesto & Spinach Bowl270 g",$6.99ea,,$2.59/ 100g,False
frozen,High Liner,"Pan Sear Selects Haddock, Traditional","High LinerPan Sear Selects Haddock, Traditional540 g",$17.99ea,,$3.60/ 100g,False
frozen,Dr Oetker,The Good Baker Spinach & Pumpkin Seed,Dr OetkerThe Good Baker Spinach & Pumpkin Seed350 g,$6.99ea,,$2.00/ 100g,False
frozen,Dr Oetker,Casa di Mama Three Meat Pizza,Dr OetkerCasa di Mama Three Meat Pizza395 g,$5.49ea,,$1.39/ 100g,False
frozen,Crave,Oven Baked Chicken and Ham in Macaroni & Cheese,CraveOven Baked Chicken and Ham in Macaroni & Cheese320 g,$6.49ea,,$2.03/ 100g,False
frozen,Haagen Dazs,Vanilla Almond Ice Cream Bars,Haagen DazsVanilla Almond Ice Cream Bars3x88.0 ml,$6.99ea,,$2.65/ 100ml,False
frozen,Swiss Chalet,BBQ Pork Ribs,Swiss ChaletBBQ Pork Ribs600 g,$15.99ea,,$2.67/ 100g,False
frozen,CAVENDISH FARMS,Restaurant Style Pub Fries,CAVENDISH FARMSRestaurant Style Pub Fries750 g,$4.99ea,,$0.67/ 100g,False
frozen,Crave,Pulled Chicken Burrito Bowl Frozen Meal,CravePulled Chicken Burrito Bowl Frozen Meal320 g,$6.49ea,,$2.03/ 100g,False
frozen,Green Giant,Valley Selections Cheddar Pasta With Vegetables,Green GiantValley Selections Cheddar Pasta With Vegetables500 g,$3.49ea,,$0.70/ 100g,False
frozen,Haagen Dazs,Exträaz Cookies & Cream Ice Cream Bars,Haagen DazsExträaz Cookies & Cream Ice Cream Bars3x72.0 ml,$6.99ea,,$3.24/ 100ml,False
frozen,Dr Oetker,Giuseppe Pizzeria Pizza 3 Cheese,Dr OetkerGiuseppe Pizzeria Pizza 3 Cheese3x186.0 g,$6.49ea,,$1.16/ 100g,False
frozen,President's Choice,Swedish Beef Meatballs,President's ChoiceSwedish Beef Meatballs907 g,$17.49ea,,$1.93/ 100g,False
frozen,PC Blue Menu,Chicken Korma,PC Blue MenuChicken Korma350 g,$4.99ea,,$1.43/ 100g,False
frozen,Dr Oetker,Casa di Mama Bacon Pizza,Dr OetkerCasa di Mama Bacon Pizza405 g,$5.49ea,,$1.36/ 100g,False
frozen,President's Choice,General Tao Chicken,President's ChoiceGeneral Tao Chicken350 g,$4.99ea,,$1.43/ 100g,False
frozen,Haagen Dazs,Ice Cream Extraaz Brownie Cookie Dough ,Haagen DazsIce Cream Extraaz Brownie Cookie Dough 500 ml,$6.99ea,,$1.40/ 100ml,False
frozen,Gardein,Fishless Fillet,GardeinFishless Fillet288 g,$7.49ea,,$2.60/ 100g,False
frozen,President's Choice,Crisp & Crunchy Mild Southern-Style Chicken Wings,President's ChoiceCrisp & Crunchy Mild Southern-Style Chicken Wings1.81 kg,$29.99ea,,$1.66/ 100g,False
frozen,President's Choice,Free From Turkey Meatballs,President's ChoiceFree From Turkey Meatballs800 g,$17.49ea,,$2.19/ 100g,False
frozen,President's Choice,Basil and Spinach Pesto Focaccia,President's ChoiceBasil and Spinach Pesto Focaccia415 g,$5.79ea,,$1.40/ 100g,False
frozen,PC Blue Menu,Sirloin Beef Burger,PC Blue MenuSirloin Beef Burger1.02 kg,$16.99ea,,$1.67/ 100g,False
frozen,President's Choice,Rotisserie-Style Chicken Wings,President's ChoiceRotisserie-Style Chicken Wings907 g,$17.99ea,,$1.98/ 100g,False
frozen,PC Blue Menu,Thick & Juicy™ Lean Beef Burgers  ,PC Blue MenuThick & Juicy™ Lean Beef Burgers  1.13 kg,$16.99ea,,$1.50/ 100g,False
frozen,President's Choice,Yorkshire Pudding,President's ChoiceYorkshire Pudding185 g,$4.99ea,,$2.70/ 100g,False
frozen,President's Choice,French Quiche Bistro-Style Selection,President's ChoiceFrench Quiche Bistro-Style Selection360 g,$7.99ea,,$2.22/ 100g,False
frozen,President's Choice,Crisp & Crunchy Spicy Southern-Style Chicken Wings,President's ChoiceCrisp & Crunchy Spicy Southern-Style Chicken Wings907 g,$17.99ea,,$1.98/ 100g,False
frozen,President's Choice,Mini Sausage Rolls,President's ChoiceMini Sausage Rolls500 g,$10.99ea,,$2.20/ 100g,False
frozen,President's Choice,"Flatbread Chicken, Bacon & Caramelized Onion","President's ChoiceFlatbread Chicken, Bacon & Caramelized Onion340 g",$5.79ea,,$1.70/ 100g,False
frozen,President's Choice,Nashville-Style Chicken Wings,President's ChoiceNashville-Style Chicken Wings907 g,$17.99ea,,$1.98/ 100g,False
frozen,PC Blue Menu,"Thin & Crispy Vegetables, Spinach And Goat Cheese Pizza","PC Blue MenuThin & Crispy Vegetables, Spinach And Goat Cheese Pizza363 g",$5.79ea,,$1.60/ 100g,False
frozen,No Name,Diced Hash Browns,No NameDiced Hash Browns1 kg,$4.49ea,,$0.45/ 100g,False
frozen,PC Blue Menu,Meat Lasagna,PC Blue MenuMeat Lasagna320 g,$4.49ea,,$1.40/ 100g,False
frozen,President's Choice,Plant Based Beefless Undeniable Burger,President's ChoicePlant Based Beefless Undeniable Burger452 g,$11.99ea,,$2.65/ 100g,False
frozen,Lous,Maple Bourbon Pork Back Ribs In Maple Bourbon Bbq Sauce,LousMaple Bourbon Pork Back Ribs In Maple Bourbon Bbq Sauce585 g,$15.99ea,,$2.73/ 100g,False
frozen,Dream Pops,Vanilla Sky Bites,Dream PopsVanilla Sky Bites118 ml,$8.99ea,,$7.62/ 100ml,False
frozen,Roman,Lasagna,RomanLasagna2.25 kg,$14.99ea,,$0.67/ 100g,False
frozen,Lean Cuisine,"Selections, Sweet & Sour Chicken","Lean CuisineSelections, Sweet & Sour Chicken238 g",$4.79ea,,$2.01/ 100g,False
frozen,Natrel,Lactose Free Completely Chocolate Ice Cream ,NatrelLactose Free Completely Chocolate Ice Cream 473 ml,$5.79ea,,$1.22/ 100ml,False
frozen,President's Choice,Pacific White Shrimp Cooked Peeled,President's ChoicePacific White Shrimp Cooked Peeled400 g,$10.99ea,$7.99ea,$2.00/ 100g,True
frozen,Ready Bake,Frozen Garlic Bread With Cheese,Ready BakeFrozen Garlic Bread With Cheese395 g,$4.99ea,,$1.26/ 100g,False
frozen,No Name,Concentrated Lemonade,No NameConcentrated Lemonade283 ml,$1.89ea,,$0.67/ 100ml,False
frozen,Janes,BBQ Chickens Bites,JanesBBQ Chickens Bites710 g,$20.99ea,,$2.96/ 100g,False
frozen,PC Blue Menu,Italian-Style Bean & Chicken Protein Bowl,PC Blue MenuItalian-Style Bean & Chicken Protein Bowl300 g,$4.99ea,,$1.66/ 100g,False
frozen,Sweets From The Earth,Chocolate Chip Cookie Dough,Sweets From The EarthChocolate Chip Cookie Dough454 g,$9.99ea,,$2.20/ 100g,False
frozen,CAVENDISH FARMS,Original Hash Brown Patties,CAVENDISH FARMSOriginal Hash Brown Patties1.2 kg,$6.99ea,,$0.58/ 100g,False
frozen,No Name,"Chicken Burger, Club Pack","No NameChicken Burger, Club Pack1810 g",$12.49ea,,$0.69/ 100g,False
frozen,President's Choice,Berry Blush Banana Smoothie Blend,President's ChoiceBerry Blush Banana Smoothie Blend450 g,$5.99ea,,$1.33/ 100g,False
frozen,Seaquest,"Colossal Raw Shrimp, 16/20","SeaquestColossal Raw Shrimp, 16/20300 g",$7.99ea,,$2.66/ 100g,False
frozen,Honeydew,100% Apple Juice With Vitamine C Added,Honeydew100% Apple Juice With Vitamine C Added355 ml,$2.49ea,,$0.70/ 100ml,False
frozen,Amys,Mattar Paneer,AmysMattar Paneer284 g,$4.49ea,,$1.58/ 100g,False
frozen,Zabiha Halal,Chicken Breast Nuggets,Zabiha HalalChicken Breast Nuggets800 g,$13.99ea,,$1.75/ 100g,False
frozen,Mccain,Pepperoni Pizza Pockets,MccainPepperoni Pizza Pockets300 g,$4.99ea,,$1.66/ 100g,False
frozen,No Name,"Fully Cooked, Breaded Chicken Nuggets Cutlettes","No NameFully Cooked, Breaded Chicken Nuggets Cutlettes908 g",$6.99ea,,$0.77/ 100g,False
frozen,So Delicious,"Dairy Free Cashew-Based Frozen Dessert, Salted Caramel Cluster","So DeliciousDairy Free Cashew-Based Frozen Dessert, Salted Caramel Cluster500 ml",$8.49ea,,$1.70/ 100ml,False
frozen,So Delicious,"Dairy Free Cashew-Based Frozen Dessert, Cinnamon Cookie Dough","So DeliciousDairy Free Cashew-Based Frozen Dessert, Cinnamon Cookie Dough479 ml",$8.49ea,,$1.70/ 100ml,False
frozen,Villas,Cheese Tortellini,VillasCheese Tortellini400 g,$4.49ea,,$1.12/ 100g,False
frozen,Magnum,Mini Ice Cream Bar Double Caramel,MagnumMini Ice Cream Bar Double Caramel4x55.0 ml,$6.99ea,,$3.18/ 100ml,False
frozen,BlueWater Seafoods,Garlic & Herb Fillets,BlueWater SeafoodsGarlic & Herb Fillets300 g,$5.99ea,,$2.00/ 100g,False
frozen,Boston Market,Meatloaf,Boston MarketMeatloaf397 g,$5.49ea,,$1.38/ 100g,False
frozen,President's Choice,California Vegetable Blend,President's ChoiceCalifornia Vegetable Blend1.75 kg,$10.99ea,$9.99ea,$0.57/ 100g,True
frozen,CAVENDISH FARMS,Cavendish Farms Restaurant Style Diner Style Hash Browns (1.5 Kg),CAVENDISH FARMSCavendish Farms Restaurant Style Diner Style Hash Browns (1.5 Kg)1.5 kg,$10.49ea,,$0.70/ 100g,False
frozen,Dream Pops,Berry Dreams,Dream PopsBerry Dreams168 ml,$7.49ea,,$4.46/ 100ml,False
frozen,Unbun,Everything Unbagels,UnbunEverything Unbagels360 g,$12.99ea,$10.99ea,$3.05/ 100g,True
frozen,Mikes,Pizza Bbq Chicken,MikesPizza Bbq Chicken777 g,$10.49ea,,$1.35/ 100g,False
frozen,Green Giant,Broccoli & Cheese Veggie Tots,Green GiantBroccoli & Cheese Veggie Tots454 g,$6.49ea,,$1.43/ 100g,False
frozen,Righteous,Dairy Free Dark Chocolate Plant Based Gelato,RighteousDairy Free Dark Chocolate Plant Based Gelato562 ml,$8.99ea,,$1.60/ 100ml,False
frozen,Krinos,"Fillo Twisters, Delicious Apples","KrinosFillo Twisters, Delicious Apples6x140.0 g",$9.99ea,,$1.19/ 100g,False
frozen,BlueWater Seafoods,Crunchy Breaded Sole    ,BlueWater SeafoodsCrunchy Breaded Sole    525 g,$14.99ea,$13.99ea,$2.66/ 100g,True
frozen,Nature's Path,Envirokidz Polar Beary Waffles Pink Blueberry Organic,Nature's PathEnvirokidz Polar Beary Waffles Pink Blueberry Organic240 g,$6.49ea,$5.49ea,$2.29/ 100g,True
frozen,Lean Cuisine,"White Cheddar Macaroni & Cheese, Frozen Entrée","Lean CuisineWhite Cheddar Macaroni & Cheese, Frozen Entrée226 g",$4.79ea,,$2.12/ 100g,False
frozen,Cheemo,"Perogies, Pizza","CheemoPerogies, Pizza815 g",$4.29ea,,$0.53/ 100g,False
frozen,Cheemo,"Heritage Pierogies, Harvest Potatoes with Aged White Cheddar Cheese","CheemoHeritage Pierogies, Harvest Potatoes with Aged White Cheddar Cheese815 g",$4.29ea,,$0.53/ 100g,False
frozen,Mccain,Pizza Pockets Three Cheese,MccainPizza Pockets Three Cheese1.2 kg,$14.99ea,,$1.25/ 100g,False
frozen,Foppen,Smoked Salmon Toast Trio,FoppenSmoked Salmon Toast Trio248 g,$15.99ea,,$6.45/ 100g,False
frozen,Millennia Tea, Superfood Tea Cubes,Millennia Tea Superfood Tea Cubes81 g,$12.99ea,,$16.04/ 100g,False
frozen,,In Homestyle Brown Gravy Salisbury Meat Pot Pie,In Homestyle Brown Gravy Salisbury Meat Pot Pie470 g,$10.99ea,,$2.34/ 100g,False
frozen,Blender Bites,Green D-Tox One Step Smoothie Puck Organic,Blender BitesGreen D-Tox One Step Smoothie Puck Organic540 g,$14.99ea,$12.99ea,$2.41/ 100g,True
frozen,Healthy Choice,Power Bowl Chicken,Healthy ChoicePower Bowl Chicken262 g,$7.49ea,,$2.86/ 100g,False
frozen,Pulp and Press,Fruit & Vegetable Juice Rinse & Rebeet,Pulp and PressFruit & Vegetable Juice Rinse & Rebeet355 ml,$7.99ea,,$2.25/ 100ml,False
frozen,Silver Hills,Sprouted Power Organic Turmeric Tortillas 6 Hand-Stretched Tortillas,Silver HillsSprouted Power Organic Turmeric Tortillas 6 Hand-Stretched Tortillas255 g,$6.99ea,,$2.74/ 100g,False
frozen,President's Choice,Breaded Chicken Breast Fillets Buttermilk 17 Pieces Minimum,President's ChoiceBreaded Chicken Breast Fillets Buttermilk 17 Pieces Minimum907 g,$19.99ea,,$2.20/ 100g,False
frozen,Healthy Choice,Chicken Marinara,Healthy ChoiceChicken Marinara262 g,$7.49ea,,$2.86/ 100g,False
frozen,T&T,Frozen Cooked Soy Beans,T&TFrozen Cooked Soy Beans454 g,$3.49ea,,$0.77/ 100g,False
frozen,Tenderflake,Patty Shells,TenderflakePatty Shells300 g,$5.29ea,,$1.76/ 100g,False
frozen,Schneider,"Deep Dish Quiche Lorraine, Ham & Cheese","SchneiderDeep Dish Quiche Lorraine, Ham & Cheese624 g",$16.99ea,,$2.72/ 100g,False
frozen,Sol Cuisine,Crispy Chik'N Tenders Plant Based,Sol CuisineCrispy Chik'N Tenders Plant Based300 g,$7.49ea,,$2.50/ 100g,False
frozen,President's Choice,Free From Chicken Fillet,President's ChoiceFree From Chicken Fillet750 g,$17.99ea,,$2.40/ 100g,False
frozen,Mccain,Egg and Cheese Breakfast Pockets,MccainEgg and Cheese Breakfast Pockets600 g,$5.99ea,,$1.00/ 100g,False
frozen,Chapmans,Lolly Banana,ChapmansLolly Banana28x50.0 ml,$5.99ea,$3.99ea,$0.29/ 100ml,True
frozen,Swanson,Oven Roasters Seasoned Red Potato Wedges & Onions,SwansonOven Roasters Seasoned Red Potato Wedges & Onions425 g,$6.49ea,,$1.53/ 100g,False
frozen,President's Choice,Butternut Squash Chunks ,President's ChoiceButternut Squash Chunks 750 g,$5.49ea,,$0.73/ 100g,False
frozen,Chapmans,Saucy Vanilla Bean & Salty Caramel Yogurt,ChapmansSaucy Vanilla Bean & Salty Caramel Yogurt2 l,$5.49ea,,$0.27/ 100ml,False
frozen,President's Choice,"Pineapple, Dragon Fruit & Passion Fruit Tropical Fruit Blend","President's ChoicePineapple, Dragon Fruit & Passion Fruit Tropical Fruit Blend500 g",$5.99ea,,$1.20/ 100g,False
frozen,Binggrae,Melona Frozen Dessert Bars Honeydew Melon,BinggraeMelona Frozen Dessert Bars Honeydew Melon560 ml,$6.99ea,,$1.25/ 100ml,False
frozen,Green Giant,Cauliflower Riced Veggies,Green GiantCauliflower Riced Veggies340 g,$5.49ea,,$1.61/ 100g,False
frozen,President's Choice,"Dark Sweet Cherries, Blueberries and Blackberries Power Fruit Blend ","President's ChoiceDark Sweet Cherries, Blueberries and Blackberries Power Fruit Blend 600 g",$5.99ea,,$1.00/ 100g,False
frozen,President's Choice,Black Tiger Shrimp With Mild Cocktail Sauce Gigantico,President's ChoiceBlack Tiger Shrimp With Mild Cocktail Sauce Gigantico568 g,$27.99ea,,$4.93/ 100g,False
frozen,No Name,Diced Onions,No NameDiced Onions750 g,$3.50ea,$3.29ea,$0.44/ 100g,True
frozen,No Name,"Peas & Carrots, Club Size","No NamePeas & Carrots, Club Size2 kg",$7.99ea,,$0.40/ 100g,False
frozen,Chapmans,Cherry Centre Super Cone,ChapmansCherry Centre Super Cone8x120.0 ml,$8.99ea,,$0.94/ 100ml,False
frozen,PC Blue Menu,Honey Greek Yogurt Smoothie Bars,PC Blue MenuHoney Greek Yogurt Smoothie Bars6x80.0 ml,$6.99ea,,$1.46/ 100ml,False
frozen,President's Choice,Cranberries,President's ChoiceCranberries600 g,$5.99ea,,$1.00/ 100g,False
frozen,Marie Callender's,Three Meat Lasagna,Marie Callender'sThree Meat Lasagna879 g,$10.99ea,,$1.25/ 100g,False
frozen,PC Organics,Organic Chopped Kale,PC OrganicsOrganic Chopped Kale300 g,$5.49ea,,$1.83/ 100g,False
frozen,Kawartha,Moose Tracks Ice Cream,KawarthaMoose Tracks Ice Cream1.5 l,$8.99ea,,$0.60/ 100ml,False
frozen,Chapmans,Vanilla Yogurt Sandwich,ChapmansVanilla Yogurt Sandwich12x120.0 ml,$8.99ea,,$0.62/ 100ml,False
frozen,Tenderflake,Deep Dish Pie Shells,TenderflakeDeep Dish Pie Shells350 g,$5.29ea,,$1.51/ 100g,False
frozen,President's Choice,Breaded Avocado Bites ,President's ChoiceBreaded Avocado Bites 400 g,$8.99ea,$5.99ea,$1.50/ 100g,True
frozen,President's Choice,Cream First Vanilla Ice Cream Bars,President's ChoiceCream First Vanilla Ice Cream Bars340 ml,$6.49ea,,$1.91/ 100ml,False
