category,brand,product_text,product_name,price_text,sale_price,per_unit_price_text,is_sale
frozen,Michelina,Zap'ems Taco Bites,MichelinaZap'ems Taco Bites156 g,$2.49ea,,$1.60/ 100g,False
frozen,President's Choice,Extra Cheesy Mac & Cheese,President's ChoiceExtra Cheesy Mac & Cheese1.13 kg,$12.99ea,,$1.15/ 100g,False
frozen,President's Choice,Lavender Lemonade Flavoured Ice Pops,President's ChoiceLavender Lemonade Flavoured Ice Pops6x60.0 ml,$5.99ea,,$1.66/ 100ml,False
frozen,Healthy Choice,"Gourmet Steamers, Grilled Chicken Marinara","Healthy ChoiceGourmet Steamers, Grilled Chicken Marinara283 g",$5.79ea,,$2.05/ 100g,False
frozen,Chapmans,Cherry Peach Passion Sorbet,ChapmansCherry Peach Passion Sorbet2 l,$5.49ea,,$0.27/ 100ml,False
frozen,Chapmans,No Sugar Added NSA Vanilla Cone,ChapmansNo Sugar Added NSA Vanilla Cone4x120.0 ml,$5.50ea,$3.99ea,$0.83/ 100ml,True
frozen,Michelina,"Grande, Macaroni and Beef","MichelinaGrande, Macaroni and Beef454 g",$4.49ea,,$0.99/ 100g,False
frozen,Breyers,Ice Cream Creamery Style Light Gluten-Free Dark Cherry Vanilla ,BreyersIce Cream Creamery Style Light Gluten-Free Dark Cherry Vanilla 1.66 l,$5.49ea,,$0.33/ 100ml,False
frozen,Tenderflake,"Pie Shells, Original","TenderflakePie Shells, Original320 g",$5.29ea,,$1.65/ 100g,False
frozen,Healthy Choice,Chicken Teriyaki,Healthy ChoiceChicken Teriyaki283 g,$5.79ea,,$2.05/ 100g,False
frozen,Healthy Choice,Power Bowls Cauliflower Curry 280 g,Healthy ChoicePower Bowls Cauliflower Curry 280 g280 g,$7.49ea,,$2.68/ 100g,False
frozen,High Liner,"Lemon Peppercorn Fillets, Breaded Seasoned Pollock","High LinerLemon Peppercorn Fillets, Breaded Seasoned Pollock500 g",$10.99ea,$8.49ea,$1.70/ 100g,True
frozen,No Name,Space Pops,No NameSpace Pops30x75.0 ml,$7.99ea,,$0.36/ 100ml,False
frozen,President's Choice,Thick & Juicy Beef Burgers,President's ChoiceThick & Juicy Beef Burgers2.72 kg,$31.99ea,,$1.18/ 100g,False
frozen,Chapmans,Mint Chip,ChapmansMint Chip2 l,$5.49ea,$3.99ea,$0.20/ 100ml,True
frozen,Cadbury,Caramilk Frozen Dessert Bars,CadburyCaramilk Frozen Dessert Bars5x80.0 ml,$5.49ea,,$1.37/ 100ml,False
frozen,Healthy Choice,Simply Chicken Broccoli Alfredo,Healthy ChoiceSimply Chicken Broccoli Alfredo259 g,$5.79ea,,$2.24/ 100g,False
frozen,Swanson,Fried Chicken,SwansonFried Chicken280 g,$4.79ea,,$1.71/ 100g,False
frozen,Nestle,Drumstick Vanilla,NestleDrumstick Vanilla4x140.0 ml,$7.99ea,,$1.43/ 100ml,False
frozen,Healthy Choice,Simply Meatball Marinara ,Healthy ChoiceSimply Meatball Marinara 283 g,$5.79ea,,$2.05/ 100g,False
frozen,President's Choice,"Riced Ready Veggie, Cauliflower","President's ChoiceRiced Ready Veggie, Cauliflower500 g",$5.49ea,,$1.10/ 100g,False
frozen,No Name,Cut Green Beans,No NameCut Green Beans750 g,$3.50ea,$3.29ea,$0.44/ 100g,True
frozen,Tenderflake,Puff Pastry,TenderflakePuff Pastry397 g,$5.29ea,,$1.33/ 100g,False
frozen,Michelina,s Grande 1LB Macaroni & Cheese,Michelinas Grande 1LB Macaroni & Cheese454 g,$4.49ea,,$0.99/ 100g,False
frozen,Breyers,Family Classic Frozen Dessert Gluten Free ,BreyersFamily Classic Frozen Dessert Gluten Free 1.66 l,$5.49ea,$4.99ea,$0.30/ 100ml,True
frozen,President's Choice,Neapolitan Ice Cream,President's ChoiceNeapolitan Ice Cream1.65 l,$5.99ea,,$0.36/ 100ml,False
frozen,Cool Whip,Original Frozen Whipped Topping,Cool WhipOriginal Frozen Whipped Topping1 l,$4.99ea,,$0.50/ 100ml,False
frozen,Del Monte, Real Banana 1/2 Dipped Chocolate,Del Monte Real Banana 1/2 Dipped Chocolate10x50.0 ml,$7.99ea,,$1.60/ 100ml,False
frozen,Chapmans,Premium Cookies & Cream,ChapmansPremium Cookies & Cream2 l,$7.49ea,,$0.37/ 100ml,False
frozen,,Lean Ground Beef,Lean Ground Beef1.2 kg,$10.00ea,,$0.83/ 100g,False
frozen,Breyers,Ice Cream Creamery Style Light Gluten-Free Butterscotch Ripple ,BreyersIce Cream Creamery Style Light Gluten-Free Butterscotch Ripple 1.66 l,$5.49ea,,$0.33/ 100ml,False
frozen,Breyers,Frozen Dessert for a delicious treat Reese's Peanut Butter Cups,BreyersFrozen Dessert for a delicious treat Reese's Peanut Butter Cups1.66 l,$5.49ea,,$0.33/ 100ml,False
frozen,High Liner,Crispy Breaded Fish Fillets,High LinerCrispy Breaded Fish Fillets350 g,$5.99ea,,$1.71/ 100g,False
frozen,Shaw's,Ice Cream Unicorn Toots,Shaw'sIce Cream Unicorn Toots1.5 l,$8.99ea,,$0.60/ 100ml,False
frozen,Breyers,Family Classic Ice Cream Mint Chocolate Chip For a Frozen Dessert ,BreyersFamily Classic Ice Cream Mint Chocolate Chip For a Frozen Dessert 1.66 l,$6.99ea,$4.99ea,$0.30/ 100ml,True
frozen,Righteous,"Ice Cream, Dark Chocolate Caramel Sea Salt Gelato","RighteousIce Cream, Dark Chocolate Caramel Sea Salt Gelato562 ml",$9.99ea,$9.49ea,$1.69/ 100ml,True
frozen,Michelina,Spaghetti Bolognese,MichelinaSpaghetti Bolognese255 g,$2.49ea,,$0.98/ 100g,False
frozen,President's Choice,Plant Based Fishless Bites,President's ChoicePlant Based Fishless Bites400 g,$7.99ea,,$2.00/ 100g,False
frozen,President's Choice,Coconut Cream Pie,President's ChoiceCoconut Cream Pie830 g,$11.99ea,,$1.44/ 100g,False
frozen,President's Choice,Free From Chicken Fillet,President's ChoiceFree From Chicken Fillet750 g,$17.99ea,,$2.40/ 100g,False
frozen,Mccain,Egg and Cheese Breakfast Pockets,MccainEgg and Cheese Breakfast Pockets600 g,$5.99ea,,$1.00/ 100g,False
frozen,President's Choice,Wild Blueberry-Topped New York-Style Cheesecake,President's ChoiceWild Blueberry-Topped New York-Style Cheesecake600 g,$10.99ea,,$1.83/ 100g,False
frozen,Chapmans,3 Of a Kind Vanilla,Chapmans3 Of a Kind Vanilla2 l,$5.49ea,,$0.27/ 100ml,False
frozen,Chapmans,Sorbet Mango,ChapmansSorbet Mango2 l,$5.49ea,,$0.27/ 100ml,False
frozen,Chapmans,Premium Chocolate Fudge Brownie,ChapmansPremium Chocolate Fudge Brownie2 l,$7.49ea,,$0.37/ 100ml,False
frozen,Bridor,Mini Chocolatines All Butter,BridorMini Chocolatines All Butter450 g,$6.99ea,,$1.55/ 100g,False
frozen,President's Choice,Breaded Haddock Fillets,President's ChoiceBreaded Haddock Fillets550 g,$17.99ea,,$3.27/ 100g,False
frozen,Shaw's,Ice Cream Cotton Candy,Shaw'sIce Cream Cotton Candy1.5 l,$8.99ea,,$0.60/ 100ml,False
frozen,Marie Callender's,Three Meat Lasagna,Marie Callender'sThree Meat Lasagna879 g,$10.99ea,,$1.25/ 100g,False
frozen,PC Organics,Organic Chopped Kale,PC OrganicsOrganic Chopped Kale300 g,$5.49ea,,$1.83/ 100g,False
frozen,Kawartha,Moose Tracks Ice Cream,KawarthaMoose Tracks Ice Cream1.5 l,$8.99ea,,$0.60/ 100ml,False
frozen,Chapmans,Vanilla Yogurt Sandwich,ChapmansVanilla Yogurt Sandwich12x120.0 ml,$8.99ea,,$0.62/ 100ml,False
frozen,Tenderflake,Deep Dish Pie Shells,TenderflakeDeep Dish Pie Shells350 g,$5.29ea,,$1.51/ 100g,False
frozen,President's Choice,Breaded Avocado Bites ,President's ChoiceBreaded Avocado Bites 400 g,$8.99ea,$5.99ea,$1.50/ 100g,True
frozen,President's Choice,Cream First Vanilla Ice Cream Bars,President's ChoiceCream First Vanilla Ice Cream Bars340 ml,$6.49ea,,$1.91/ 100ml,False
frozen,Michelina,Zap'ems Taco Bites,MichelinaZap'ems Taco Bites156 g,$2.49ea,,$1.60/ 100g,False
frozen,President's Choice,Extra Cheesy Mac & Cheese,President's ChoiceExtra Cheesy Mac & Cheese1.13 kg,$12.99ea,,$1.15/ 100g,False
frozen,President's Choice,Lavender Lemonade Flavoured Ice Pops,President's ChoiceLavender Lemonade Flavoured Ice Pops6x60.0 ml,$5.99ea,,$1.66/ 100ml,False
frozen,President's Choice,Neapolitan Ice Cream,President's ChoiceNeapolitan Ice Cream1.65 l,$5.99ea,,$0.36/ 100ml,False
frozen,Cool Whip,Original Frozen Whipped Topping,Cool WhipOriginal Frozen Whipped Topping1 l,$4.99ea,,$0.50/ 100ml,False
frozen,Del Monte, Real Banana 1/2 Dipped Chocolate,Del Monte Real Banana 1/2 Dipped Chocolate10x50.0 ml,$7.99ea,,$1.60/ 100ml,False
frozen,Chapmans,Premium Cookies & Cream,ChapmansPremium Cookies & Cream2 l,$7.49ea,,$0.37/ 100ml,False
frozen,,Lean Ground Beef,Lean Ground Beef1.2 kg,$10.00ea,,$0.83/ 100g,False
frozen,Breyers,Ice Cream Creamery Style Light Gluten-Free Butterscotch Ripple ,BreyersIce Cream Creamery Style Light Gluten-Free Butterscotch Ripple 1.66 l,$5.49ea,,$0.33/ 100ml,False
frozen,Breyers,Frozen Dessert for a delicious treat Reese's Peanut Butter Cups,BreyersFrozen Dessert for a delicious treat Reese's Peanut Butter Cups1.66 l,$5.49ea,,$0.33/ 100ml,False
frozen,High Liner,Crispy Breaded Fish Fillets,High LinerCrispy Breaded Fish Fillets350 g,$5.99ea,,$1.71/ 100g,False
frozen,Shaw's,Ice Cream Unicorn Toots,Shaw'sIce Cream Unicorn Toots1.5 l,$8.99ea,,$0.60/ 100ml,False
frozen,Breyers,Family Classic Ice Cream Mint Chocolate Chip For a Frozen Dessert ,BreyersFamily Classic Ice Cream Mint Chocolate Chip For a Frozen Dessert 1.66 l,$6.99ea,$4.99ea,$0.30/ 100ml,True
frozen,Righteous,"Ice Cream, Dark Chocolate Caramel Sea Salt Gelato","RighteousIce Cream, Dark Chocolate Caramel Sea Salt Gelato562 ml",$9.99ea,$9.49ea,$1.69/ 100ml,True
frozen,Michelina,Spaghetti Bolognese,MichelinaSpaghetti Bolognese255 g,$2.49ea,,$0.98/ 100g,False
frozen,President's Choice,Plant Based Fishless Bites,President's ChoicePlant Based Fishless Bites400 g,$7.99ea,,$2.00/ 100g,False
frozen,President's Choice,Coconut Cream Pie,President's ChoiceCoconut Cream Pie830 g,$11.99ea,,$1.44/ 100g,False
frozen,Shaw's,Chocolate Peanut Butter ,Shaw'sChocolate Peanut Butter 1.5 l,$8.99ea,,$0.60/ 100ml,False
frozen,President's Choice,Bangkok-Style Vegetable Blend ,President's ChoiceBangkok-Style Vegetable Blend 500 g,$5.49ea,,$1.10/ 100g,False
frozen,Swanson,Turkey,SwansonTurkey338 g,$4.79ea,,$1.42/ 100g,False
frozen,Healthy Choice,"Gourmet Steamers, Grilled Chicken Marinara","Healthy ChoiceGourmet Steamers, Grilled Chicken Marinara283 g",$5.79ea,,$2.05/ 100g,False
frozen,Chapmans,Cherry Peach Passion Sorbet,ChapmansCherry Peach Passion Sorbet2 l,$5.49ea,,$0.27/ 100ml,False
frozen,Chapmans,No Sugar Added NSA Vanilla Cone,ChapmansNo Sugar Added NSA Vanilla Cone4x120.0 ml,$5.50ea,$3.99ea,$0.83/ 100ml,True
frozen,Nestle,Drumstick Vanilla,NestleDrumstick Vanilla4x140.0 ml,$7.99ea,,$1.43/ 100ml,False
frozen,President's Choice,Salted Caramel Mochi,President's ChoiceSalted Caramel Mochi6x35.0 ml,$6.49ea,,$3.09/ 100ml,False
frozen,Delissio,Rising Crust 4 Cheese Pizza,DelissioRising Crust 4 Cheese Pizza782 g,$6.50ea,$5.88ea,$0.75/ 100g,True
frozen,Cheemo,"Perogies, Cheddar Cheese","CheemoPerogies, Cheddar Cheese2 kg",$7.99ea,$5.99ea,$0.30/ 100g,True
frozen,Delissio,Rising Crust Pepperoni Pizza,DelissioRising Crust Pepperoni Pizza788 g,$6.50ea,$5.88ea,$0.75/ 100g,True
frozen,Haagen Dazs,Exträaz Salted Caramel Brownie Ice Cream,Haagen DazsExträaz Salted Caramel Brownie Ice Cream500 ml,$6.99ea,,$1.40/ 100ml,False
frozen,Haagen Dazs,Ice Cream Extraaz Layers Mocha Cheesecake ,Haagen DazsIce Cream Extraaz Layers Mocha Cheesecake 414 ml,$6.99ea,,$1.69/ 100ml,False
frozen,CAVENDISH FARMS,Cavendish Farms Simply Homestyle Straight Cut Fries (750 G),CAVENDISH FARMSCavendish Farms Simply Homestyle Straight Cut Fries (750 G)750 g,$4.99ea,,$0.67/ 100g,False
frozen,Dr Oetker,Giuseppe Pizzeria Giuseppe Rising Crust Deluxe Pizza,Dr OetkerGiuseppe Pizzeria Giuseppe Rising Crust Deluxe Pizza785 g,$8.49ea,,$1.08/ 100g,False
frozen,Dr Oetker,Ristorante Thin Crust Pepperoni Pizza,Dr OetkerRistorante Thin Crust Pepperoni Pizza320 g,$5.49ea,,$1.72/ 100g,False
frozen,Dr Oetker,Ristorante Thin Crust Pollo (Chicken) Pizza,Dr OetkerRistorante Thin Crust Pollo (Chicken) Pizza355 g,$5.49ea,,$1.55/ 100g,False
frozen,Chapmans,Premuim Canadian Collection Creamy Milk Chocolate and Vanilla Bars,ChapmansPremuim Canadian Collection Creamy Milk Chocolate and Vanilla Bars8x55.0 ml,$5.99ea,$3.99ea,$0.91/ 100ml,True
frozen,Haagen Dazs,Dulce de Leche Ice Cream,Haagen DazsDulce de Leche Ice Cream500 ml,$6.99ea,,$1.40/ 100ml,False
frozen,CAVENDISH FARMS,Cavendish Farms Flavourcrisp Crispy Spicy Cracked Pepper Straight Cut (750G),CAVENDISH FARMSCavendish Farms Flavourcrisp Crispy Spicy Cracked Pepper Straight Cut (750G)750 g,$4.99ea,,$0.67/ 100g,False
frozen,No Name,"Chicken Wings, Honey Garlic","No NameChicken Wings, Honey Garlic908 g",$14.99ea,$14.49ea,$1.60/ 100g,True
frozen,Dr Oetker,Ristorante Thin Crust Pepperoni Pesto Pizza,Dr OetkerRistorante Thin Crust Pepperoni Pesto Pizza360 g,$5.49ea,,$1.53/ 100g,False
frozen,Dr Oetker,Giuseppe Thin Crust Canadian Pizza,Dr OetkerGiuseppe Thin Crust Canadian Pizza501 g,$8.49ea,,$1.69/ 100g,False
frozen,Haagen Dazs,Premium Ice Cream Bar Cacao Ruby,Haagen DazsPremium Ice Cream Bar Cacao Ruby72 ml,$6.99ea,,$9.71/ 100ml,False
frozen,Chapmans,Neapolitan,ChapmansNeapolitan2 l,$5.49ea,$3.99ea,$0.20/ 100ml,True
frozen,Green Giant,French Style Green Beans,Green GiantFrench Style Green Beans750 g,$3.49ea,,$0.47/ 100g,False
frozen,Dr Oetker,"Giuseppe Pizza, 4 Cheese","Dr OetkerGiuseppe Pizza, 4 Cheese660 g",$8.49ea,,$1.29/ 100g,False
frozen,Dr Oetker,Giuseppe Pizzeria Giuseppe Thin Crust Spinach Pizza,Dr OetkerGiuseppe Pizzeria Giuseppe Thin Crust Spinach Pizza540 g,$8.49ea,,$1.57/ 100g,False
frozen,CAVENDISH FARMS,Restaurant Style All - Seasoned Kettle Style Potato Wedges,CAVENDISH FARMSRestaurant Style All - Seasoned Kettle Style Potato Wedges750 g,$4.99ea,,$0.67/ 100g,False
frozen,President's Choice,Beef & Broccoli,President's ChoiceBeef & Broccoli350 g,$4.99ea,,$1.43/ 100g,False
frozen,Gardein,Crispy Fingers Chipotle Lime,GardeinCrispy Fingers Chipotle Lime270 g,$7.49ea,,$2.77/ 100g,False
frozen,CAVENDISH FARMS,Fries Extra Thin Gourmet,CAVENDISH FARMSFries Extra Thin Gourmet750 g,$4.99ea,,$0.67/ 100g,False
frozen,Green Giant,Peaches N Cream Corn,Green GiantPeaches N Cream Corn750 g,$3.49ea,,$0.47/ 100g,False
frozen,Crave,Sweet & Tangy Pulled Pork with Spicy Sweet Potatoes Frozen Meal,CraveSweet & Tangy Pulled Pork with Spicy Sweet Potatoes Frozen Meal283 g,$6.49ea,,$2.29/ 100g,False
frozen,Haagen Dazs,Ice Cream Extraaz Layers Mocha Cheesecake ,Haagen DazsIce Cream Extraaz Layers Mocha Cheesecake 414 ml,$6.99ea,,$1.69/ 100ml,False
frozen,CAVENDISH FARMS,Cavendish Farms Simply Homestyle Straight Cut Fries (750 G),CAVENDISH FARMSCavendish Farms Simply Homestyle Straight Cut Fries (750 G)750 g,$4.99ea,,$0.67/ 100g,False
frozen,Dr Oetker,Giuseppe Pizzeria Giuseppe Rising Crust Deluxe Pizza,Dr OetkerGiuseppe Pizzeria Giuseppe Rising Crust Deluxe Pizza785 g,$8.49ea,,$1.08/ 100g,False
frozen,Dr Oetker,Ristorante Thin Crust Pepperoni Pizza,Dr OetkerRistorante Thin Crust Pepperoni Pizza320 g,$5.49ea,,$1.72/ 100g,False
frozen,High Liner,"Frozen Crispy Breaded, Frozen, Cod Fillets, Uncooked","High LinerFrozen Crispy Breaded, Frozen, Cod Fillets, Uncooked515 g",$17.99ea,,$3.49/ 100g,False
frozen,PC Blue Menu,Chicken Tikka Masala,PC Blue MenuChicken Tikka Masala350 g,$4.99ea,,$1.43/ 100g,False
frozen,Dr Oetker,Ristorante Thin Crust Mushroom Funghi Pizza,Dr OetkerRistorante Thin Crust Mushroom Funghi Pizza365 g,$5.49ea,,$1.50/ 100g,False
frozen,President's Choice,Meat Lasagna,President's ChoiceMeat Lasagna320 g,$4.49ea,,$1.40/ 100g,False
frozen,PC Blue Menu,Mediterranean-Style Grain & Chicken Protein Bowl,PC Blue MenuMediterranean-Style Grain & Chicken Protein Bowl300 g,$4.99ea,,$1.66/ 100g,False
frozen,CAVENDISH FARMS,Restaurant Style Waffle Fries,CAVENDISH FARMSRestaurant Style Waffle Fries540 g,$4.99ea,,$0.92/ 100g,False
frozen,President's Choice,Breaded Coconut Shrimp With Sweet Chili Dipping Sauce,President's ChoiceBreaded Coconut Shrimp With Sweet Chili Dipping Sauce454 g,$9.99ea,,$2.20/ 100g,False
frozen,President's Choice,Salted Caramel Mochi,President's ChoiceSalted Caramel Mochi6x35.0 ml,$6.49ea,,$3.09/ 100ml,False
frozen,Haagen Dazs,Mint Chip Ice Cream,Haagen DazsMint Chip Ice Cream500 ml,$6.99ea,,$1.40/ 100ml,False
frozen,President's Choice,Medium Buffalo-Style Chicken Wings,President's ChoiceMedium Buffalo-Style Chicken Wings907 g,$17.99ea,,$1.98/ 100g,False
frozen,President's Choice,Thick & Juicy™ Beef Burgers  ,President's ChoiceThick & Juicy™ Beef Burgers  1.36 kg,$16.99ea,,$1.25/ 100g,False
frozen,Delissio,"Rising Crust Pizza, Cheeseburger","DelissioRising Crust Pizza, Cheeseburger789 g",$6.50ea,$5.88ea,$0.75/ 100g,True
frozen,President's Choice,Tourtière,President's ChoiceTourtière900 g,$15.99ea,,$1.78/ 100g,False
frozen,President's Choice,Gochujang Sweet & Spicy Chicken Wings,President's ChoiceGochujang Sweet & Spicy Chicken Wings907 g,$17.99ea,,$1.98/ 100g,False
frozen,President's Choice,Mini Jamaican Beef Patties,President's ChoiceMini Jamaican Beef Patties480 g,$7.99ea,,$1.66/ 100g,False
frozen,President's Choice,"Chicken Wings, Crisp & Crunchy Mild Southern-Style ","President's ChoiceChicken Wings, Crisp & Crunchy Mild Southern-Style 907 g",$17.99ea,,$1.98/ 100g,False
frozen,President's Choice,Loads Of Pepperoni Thin Crust Pizza,President's ChoiceLoads Of Pepperoni Thin Crust Pizza400 g,$5.79ea,,$1.45/ 100g,False
frozen,President's Choice,Thick & Juicy™ Chicken Burgers ,President's ChoiceThick & Juicy™ Chicken Burgers 1.13 kg,$16.99ea,,$1.50/ 100g,False
frozen,Breyers,Creamery Style  Ice Cream with Fresh Cream & Rich Coca Chocolate ,BreyersCreamery Style  Ice Cream with Fresh Cream & Rich Coca Chocolate 1.66 l,$5.49ea,,$0.33/ 100ml,False
frozen,President's Choice,Cauliflower Florets,President's ChoiceCauliflower Florets500 g,$5.49ea,,$1.10/ 100g,False
frozen,PC Organics,Organic Canadian Wild Blueberries,PC OrganicsOrganic Canadian Wild Blueberries600 g,$8.99ea,,$1.50/ 100g,False
frozen,PC Blue Menu,Shepherd's Pie,PC Blue MenuShepherd's Pie275 g,$4.49ea,,$1.63/ 100g,False
frozen,Halo Top,Sea Salt Caramel,Halo TopSea Salt Caramel473 ml,$5.99ea,,$1.27/ 100ml,False
frozen,Chapmans,Ice Cream Twister Super Cone 8 x 120 ml,ChapmansIce Cream Twister Super Cone 8 x 120 ml8x120.0 ml,$8.99ea,,$0.94/ 100ml,False
frozen,Chapmans,Canadian Blueberries & Cream Frozen Yogurt,ChapmansCanadian Blueberries & Cream Frozen Yogurt2 l,$5.49ea,,$0.27/ 100ml,False
frozen,Stouffers,"Bistro Crustini, Sausage, Egg and Cheese","StouffersBistro Crustini, Sausage, Egg and Cheese240 g",$4.79ea,,$2.00/ 100g,False
frozen,President's Choice,"Peaches, Strawberries, Pineapple & Mango 4-Fruit Blend","President's ChoicePeaches, Strawberries, Pineapple & Mango 4-Fruit Blend600 g",$5.99ea,,$1.00/ 100g,False
frozen,Seaquest,Salad Shrimp,SeaquestSalad Shrimp454 g,$11.99ea,,$2.64/ 100g,False
frozen,President's Choice,Chicken Pot Pie,President's ChoiceChicken Pot Pie800 g,$13.99ea,,$1.75/ 100g,False
frozen,Little Northern Bakehouse,Millet & Chia Bread,Little Northern BakehouseMillet & Chia Bread454 g,$6.00ea,$5.00ea,$1.10/ 100g,True
frozen,PC Organics,Organic Whole Red Raspberries,PC OrganicsOrganic Whole Red Raspberries600 g,$8.99ea,,$1.50/ 100g,False
frozen,Healthy Choice,Power Bowls Korean-Inspired Beef,Healthy ChoicePower Bowls Korean-Inspired Beef269 g,$7.49ea,,$2.78/ 100g,False
frozen,Stouffers,Bowl Fulls Buffalo Ranch Fried Chicken,StouffersBowl Fulls Buffalo Ranch Fried Chicken305 g,$6.99ea,,$2.29/ 100g,False
frozen,ACE,Frozen Butter Croissant,ACEFrozen Butter Croissant210 g,$5.49ea,,$2.61/ 100g,False
frozen,PC Organics,Organic Butternut Squash Chunks,PC OrganicsOrganic Butternut Squash Chunks400 g,$5.49ea,,$1.37/ 100g,False
frozen,Cheemo,"Perogies, Three Cheese","CheemoPerogies, Three Cheese907 g",$4.29ea,,$0.47/ 100g,False
frozen,No Name,Mixed Vegetables,No NameMixed Vegetables750 g,$3.50ea,$3.29ea,$0.44/ 100g,True
frozen,President's Choice,Shepherd's Pie,President's ChoiceShepherd's Pie275 g,$4.49ea,,$1.63/ 100g,False
frozen,No Name,Light Whipped Topping,No NameLight Whipped Topping1 l,$3.99ea,,$0.40/ 100ml,False
frozen,Luigi's,"Real Italian Ice, Lemon","Luigi'sReal Italian Ice, Lemon6x177.0 ml",$5.49ea,,$0.52/ 100ml,False
frozen,Kawartha,Vanilla Ice Cream,KawarthaVanilla Ice Cream1.5 l,$8.99ea,,$0.60/ 100ml,False
frozen,PC Blue Menu,"Greek Smoothie Bar, Mango","PC Blue MenuGreek Smoothie Bar, Mango6x80.0 ml",$6.99ea,,$1.46/ 100ml,False
frozen,No Name,Whole Strawberries,No NameWhole Strawberries2 kg,$15.99ea,,$0.80/ 100g,False
frozen,Breyers,Creamery Style Ice Cream French Vanilla gluten-free and kosher,BreyersCreamery Style Ice Cream French Vanilla gluten-free and kosher1.66 l,$5.49ea,,$0.33/ 100ml,False
frozen,Chapmans,"Ice Cream, Canadian Peaches & Cream Frozen Yogurt","ChapmansIce Cream, Canadian Peaches & Cream Frozen Yogurt2 l",$5.49ea,,$0.27/ 100ml,False
frozen,Stouffers,Diner Classics Salisbury Steak,StouffersDiner Classics Salisbury Steak282 g,$6.99ea,,$2.48/ 100g,False
frozen,Michelina,Macaroni and Beef,MichelinaMacaroni and Beef255 g,$2.49ea,,$0.98/ 100g,False
frozen,President's Choice,Chocolate Ice Cream,President's ChoiceChocolate Ice Cream1.65 l,$5.99ea,,$0.36/ 100ml,False
frozen,Chapmans,Premium Caramel Praline,ChapmansPremium Caramel Praline2 l,$7.49ea,,$0.37/ 100ml,False
frozen,No Name,Chocolate Ice Cream Sandwiches,No NameChocolate Ice Cream Sandwiches24x120.0 ml,$10.99ea,,$0.38/ 100ml,False
frozen,Chapmans,Ice Cream Premium the Only Chocolate,ChapmansIce Cream Premium the Only Chocolate2 l,$7.49ea,,$0.37/ 100ml,False
frozen,Chapmans,Strawberry Shortcake,ChapmansStrawberry Shortcake2 l,$7.49ea,,$0.37/ 100ml,False
frozen,No Name,Whole Green Beans,No NameWhole Green Beans750 g,$3.50ea,$3.29ea,$0.44/ 100g,True
frozen,Hungry-Man,Beef Steakette Grilled,Hungry-ManBeef Steakette Grilled425 g,$5.79ea,,$1.36/ 100g,False
frozen,Chapmans,Premium Heavenly Hash,ChapmansPremium Heavenly Hash2 l,$7.49ea,,$0.37/ 100ml,False
frozen,Michelina, Rigatoni Pomodoro,Michelina Rigatoni Pomodoro255 g,$2.49ea,,$0.98/ 100g,False
frozen,Christie,Frozen Dessert Bars,ChristieFrozen Dessert Bars72 ml,$5.49ea,,$7.63/ 100ml,False
frozen,President's Choice,Petite Pois,President's ChoicePetite Pois750 g,$5.49ea,,$0.73/ 100g,False
frozen,Swanson,Chicken Fried Rice,SwansonChicken Fried Rice1.19 kg,$13.69ea,,$1.15/ 100g,False
frozen,President's Choice,Tiger Tail Ice Cream,President's ChoiceTiger Tail Ice Cream946 ml,$4.49ea,$3.99ea,$0.42/ 100ml,True
frozen,Swanson,Oven Roasters Seasoned Broccoli & Cauliflower,SwansonOven Roasters Seasoned Broccoli & Cauliflower397 g,$6.49ea,,$1.63/ 100g,False
frozen,Breyers,Ice Cream Creamery Style Light Kosher Certified Dark Chocolate Truffle ,BreyersIce Cream Creamery Style Light Kosher Certified Dark Chocolate Truffle 1.66 l,$5.49ea,,$0.33/ 100ml,False
frozen,PC Blue Menu,Fruit Bars,PC Blue MenuFruit Bars12x75.0 ml,$6.99ea,,$0.78/ 100ml,False
frozen,Lean Cuisine,Chicken in Wine Sauce,Lean CuisineChicken in Wine Sauce212 g,$4.79ea,,$2.26/ 100g,False
frozen,President's Choice,Butter Chicken Meal Kit,President's ChoiceButter Chicken Meal Kit907 g,$15.99ea,,$1.76/ 100g,False
frozen,So Delicious,"Dairy Free Coconut-Based Frozen Dessert, 4 Coconut Almond Bars","So DeliciousDairy Free Coconut-Based Frozen Dessert, 4 Coconut Almond Bars272 ml",$7.99ea,,$2.94/ 100ml,False
frozen,President's Choice,French Vanilla Frozen Yogurt,President's ChoiceFrench Vanilla Frozen Yogurt2 l,$5.49ea,,$0.27/ 100ml,False
frozen,PC Black Label,Salted Caramel Ice Cream,PC Black LabelSalted Caramel Ice Cream500 ml,$5.99ea,,$1.20/ 100ml,False
frozen,President's Choice,"Ready Veggie Tots, Cauliflower","President's ChoiceReady Veggie Tots, Cauliflower400 g",$5.49ea,,$1.37/ 100g,False
frozen,President's Choice," Extra Cheesy, Mac & Cheese, Club Size","President's Choice Extra Cheesy, Mac & Cheese, Club Size2 kg",$19.99ea,,$1.00/ 100g,False
frozen,Bridor,Mini Butter Croissants,BridorMini Butter Croissants425 g,$6.99ea,,$1.64/ 100g,False
frozen,President's Choice,Garden Vegetable Blend,President's ChoiceGarden Vegetable Blend1.75 kg,$10.99ea,$9.99ea,$0.57/ 100g,True
frozen,No Name,Whipped Topping,No NameWhipped Topping1 l,$3.99ea,,$0.40/ 100ml,False
frozen,President's Choice,Meringata Traditional Italian Dessert,President's ChoiceMeringata Traditional Italian Dessert400 g,$8.99ea,,$2.25/ 100g,False
frozen,Cool Whip,Light Frozen Whipped Topping,Cool WhipLight Frozen Whipped Topping1 l,$4.99ea,,$0.50/ 100ml,False
frozen,Kawartha,Vanilla Ice Cream,KawarthaVanilla Ice Cream1.5 l,$8.99ea,,$0.60/ 100ml,False
frozen,PC Blue Menu,"Greek Smoothie Bar, Mango","PC Blue MenuGreek Smoothie Bar, Mango6x80.0 ml",$6.99ea,,$1.46/ 100ml,False
frozen,No Name,Whole Strawberries,No NameWhole Strawberries2 kg,$15.99ea,,$0.80/ 100g,False
frozen,Breyers,Creamery Style Ice Cream French Vanilla gluten-free and kosher,BreyersCreamery Style Ice Cream French Vanilla gluten-free and kosher1.66 l,$5.49ea,,$0.33/ 100ml,False
frozen,President's Choice,Vanilla Frozen Yogurt,President's ChoiceVanilla Frozen Yogurt2 l,$5.49ea,,$0.27/ 100ml,False
frozen,President's Choice,Loads Of Chocolatey Peanut Butter Treats Light Ice Cream,President's ChoiceLoads Of Chocolatey Peanut Butter Treats Light Ice Cream1.5 l,$7.49ea,$5.49ea,$0.37/ 100ml,True
frozen,Minute Maid,"Grape Punch Frozen Concentrate Juice Beverage, Can","Minute MaidGrape Punch Frozen Concentrate Juice Beverage, Can295 ml",$2.29ea,,$0.78/ 100ml,False
frozen,President's Choice,Sliced Peaches,President's ChoiceSliced Peaches600 g,$5.99ea,,$1.00/ 100g,False
frozen,Chapmans,Yogurt Cappuccino,ChapmansYogurt Cappuccino2 l,$5.49ea,,$0.27/ 100ml,False
frozen,President's Choice,French Vanilla Ice Cream,President's ChoiceFrench Vanilla Ice Cream1.65 l,$5.99ea,,$0.36/ 100ml,False
frozen,President's Choice,Original Belgian Waffles,President's ChoiceOriginal Belgian Waffles390 g,$5.49ea,,$1.41/ 100g,False
frozen,Ben & Jerry's,Ice Cream with Fairtrade Ingredients Cherry Non-Gmo,Ben & Jerry'sIce Cream with Fairtrade Ingredients Cherry Non-Gmo473 ml,$6.99ea,,$1.48/ 100ml,False
frozen,Green Giant,Veggie Fries Zucchini Parmesan & Garlic ,Green GiantVeggie Fries Zucchini Parmesan & Garlic 340 g,$6.49ea,,$1.91/ 100g,False
frozen,Minute Maid,"Fruit Punch Frozen Concentrate Juice Beverage, Can","Minute MaidFruit Punch Frozen Concentrate Juice Beverage, Can295 ml",$2.29ea,,$0.78/ 100ml,False
frozen,Magnum,Ice Cream Bars Belgian Chocolate,MagnumIce Cream Bars Belgian Chocolate3 ea,$6.99ea,,$2.33/ 1ea,False
frozen,President's Choice,Yuzu Citrus Chicken Wings,President's ChoiceYuzu Citrus Chicken Wings907 g,$17.99ea,,$1.98/ 100g,False
frozen,President's Choice,Cabbage Rolls,President's ChoiceCabbage Rolls1.81 kg,$17.99ea,,$0.99/ 100g,False
