category,brand,product_text,product_name,price_text,sale_price,per_unit_price_text,is_sale
meat,Marcangelo,Italian Pork Meatballs,MarcangeloItalian Pork Meatballs1 kg,$15.99ea,,$1.60/ 100g,False
meat,Johnsonville,Mild Italian Sausage,JohnsonvilleMild Italian Sausage500 g,$7.99ea,,$1.60/ 100g,False
meat,,Honey Garlic Sausage,Honey Garlic Sausage,$13.88(est.)ea,,$15.41/ 1kg,False
meat,Mina,Supreme Crunch Halal Spicy Chicken Drumsticks,MinaSupreme Crunch Halal Spicy Chicken Drumsticks720 g,$14.99ea,,$2.08/ 100g,False
meat,Janes,Chicken Wings Buffalo,JanesChicken Wings Buffalo660 g,$17.99ea,,$2.73/ 100g,False
meat,,Sirloin and Rib End Chops,Sirloin and Rib End Chops,$12.30(est.)ea,,$7.69/ 1kg,False
meat,,"Plain Chicken Kebab, Service Case","Plain Chicken Kebab, Service Case",$11.51(est.)ea,,$24.23/ 1kg,False
meat,,Beef Jalapeno Tequila Meatball ,Beef Jalapeno Tequila Meatball ,$6.65(est.)ea,,$16.51/ 1kg,False
meat,Gold Label,Naturally Prime Angus Smoked Sausages Made With Natural Ingredients Original,Gold LabelNaturally Prime Angus Smoked Sausages Made With Natural Ingredients Original375 g,$6.49ea,,$1.73/ 100g,False
meat,,"Beef Blade Simmering Steak, Boneless, Club Pack","Beef Blade Simmering Steak, Boneless, Club Pack",$13.79(est.)ea,,$16.51/ 1kg,False
meat,No Name,Crispy Southern Style Chicken,No NameCrispy Southern Style Chicken1 kg,$16.99ea,,$1.70/ 100g,False
meat,President's Choice,Free From Top Sirloin Steak,President's ChoiceFree From Top Sirloin Steak,$14.81(est.)ea,,$35.25/ 1kg,False
meat,Marcangelo,Pork Medallions Bacon Wrapped,MarcangeloPork Medallions Bacon Wrapped340 g,$7.99ea,,$2.35/ 100g,False
meat,President's Choice,Smokin' Honey Fully Cooked Pork Back Ribs,President's ChoiceSmokin' Honey Fully Cooked Pork Back Ribs500 g,$15.49ea,$13.99ea,$2.80/ 100g,True
meat,Maple Lodge Farms LT,"Ultimate Chicken Wiener, Spicy","Maple Lodge Farms LTUltimate Chicken Wiener, Spicy900 g",$6.99ea,,$0.78/ 100g,False
meat,Lesters,Hot Dog Wieners Jumbo Bbq,LestersHot Dog Wieners Jumbo Bbq450 g,$4.49ea,,$1.00/ 100g,False
meat,President's Choice,Breaded Chicken Strips,President's ChoiceBreaded Chicken Strips600 g,$5.99ea,,$1.00/ 100g,False
meat,Maple Leaf,Natural Top Dogs Less Salt Hot Dogs,Maple LeafNatural Top Dogs Less Salt Hot Dogs375 g,$6.49ea,,$1.73/ 100g,False
meat,Maple Leaf,Natural Smoked Honey Ham,Maple LeafNatural Smoked Honey Ham600 g,$13.99ea,$13.49ea,$2.25/ 100g,True
meat,Johnsonville,"Smoked Sausage, Doubled Smoked","JohnsonvilleSmoked Sausage, Doubled Smoked375 g",$7.49ea,,$2.00/ 100g,False
meat,Maple Leaf,Country Naturals Hot Dogs,Maple LeafCountry Naturals Hot Dogs375 g,$5.99ea,,$1.60/ 100g,False
meat,Schneider,"Smokies, Original Smoked Sausage","SchneiderSmokies, Original Smoked Sausage900 g",$15.49ea,,$1.72/ 100g,False
meat,Johnsonville,"Smoked Sausage, Buffalo Cheese","JohnsonvilleSmoked Sausage, Buffalo Cheese375 g",$7.49ea,,$2.00/ 100g,False
meat,Schneider,Sliced Smoked Ham Applewood Smoked,SchneiderSliced Smoked Ham Applewood Smoked600 g,$16.99ea,,$2.83/ 100g,False
meat,President's Choice,Original Smokies,President's ChoiceOriginal Smokies1 kg,$14.29ea,,$1.43/ 100g,False
meat,President's Choice,Ham Steak,President's ChoiceHam Steak175 g,$5.49ea,,$3.14/ 100g,False
meat,President's Choice,"Cocktail Sausage Smokies, Original","President's ChoiceCocktail Sausage Smokies, Original500 g",$7.49ea,,$1.50/ 100g,False
meat,Schneider,Cheddar Hot Dogs,SchneiderCheddar Hot Dogs375 g,$6.49ea,,$1.73/ 100g,False
meat,No Name,Salt & Pepper Chicken Wings,No NameSalt & Pepper Chicken Wings908 g,$14.99ea,$14.49ea,$1.60/ 100g,True
meat,President's Choice,World of Flavours Barbecue Seasoned Boneless Beef Blade Roast,President's ChoiceWorld of Flavours Barbecue Seasoned Boneless Beef Blade Roast800 g,$19.99ea,,$2.50/ 100g,False
meat,Swiss Chalet,"Pork Back Ribs, Honey Garlic","Swiss ChaletPork Back Ribs, Honey Garlic600 g",$15.99ea,,$2.67/ 100g,False
meat,President's Choice,Angus Beef Meatballs,President's ChoiceAngus Beef Meatballs907 g,$17.49ea,,$1.93/ 100g,False
meat,President's Choice,"Free From Split Chicken Breasts, Bone-in, Skin-on","President's ChoiceFree From Split Chicken Breasts, Bone-in, Skin-on",$11.10(est.)ea,,$15.85/ 1kg,False
meat,President's Choice,"Meatballs, Italian Style","President's ChoiceMeatballs, Italian Style907 g",$17.49ea,,$1.93/ 100g,False
meat,PC Blue Menu,Angus Beef Meatballs,PC Blue MenuAngus Beef Meatballs907 g,$18.49ea,,$2.04/ 100g,False
meat,President's Choice,"Fully Cooked Pork Back Ribs, Smokin Stampede","President's ChoiceFully Cooked Pork Back Ribs, Smokin Stampede500 g",$15.49ea,$13.99ea,$2.80/ 100g,True
meat,President's Choice,Thick & Juicy™ Beef Burgers  ,President's ChoiceThick & Juicy™ Beef Burgers  1.36 kg,$16.99ea,,$1.25/ 100g,False
meat,President's Choice,Free From Angus Beef Burger,President's ChoiceFree From Angus Beef Burger1.02 kg,$16.99ea,,$1.67/ 100g,False
meat,President's Choice,Thick & Juicy™ Sirloin Beef Burgers ,President's ChoiceThick & Juicy™ Sirloin Beef Burgers 1.13 kg,$16.99ea,,$1.50/ 100g,False
