category,brand,product_text,product_name,price_text,sale_price,per_unit_price_text,is_sale,ranking,sale_valid_to
seafood,President's Choice,Pacific White Shrimp Raw Peeled,President's ChoicePacific White Shrimp Raw Peeled400 g,$10.99ea,$7.99ea,$2.00/ 100g,True,1.0,saleEnds 03/15
seafood,,"Fresh Atlantic Salmon Fillets, Skin On, Packaged","Fresh Atlantic Salmon Fillets, Skin On, Packaged",$10.89(est.)ea,,$34.15/ 1kg,False,2.0,
seafood,,"Fresh Atlantic Salmon Fillets, Skin On, Packaged, Club Size","Fresh Atlantic Salmon Fillets, Skin On, Packaged, Club Size",$26.68(est.)ea,,$31.95/ 1kg,False,3.0,
seafood,Seaquest,"Colossal Raw Shrimp, 16/20","SeaquestColossal Raw Shrimp, 16/20300 g",$7.99ea,$6.99ea,$2.33/ 100g,True,4.0,saleEnds 04/05
seafood,President's Choice,Pacific White Shrimp Cooked Peeled,President's ChoicePacific White Shrimp Cooked Peeled400 g,$10.99ea,$7.99ea,$2.00/ 100g,True,5.0,saleEnds 03/15
seafood,DOM,Smoked Steelhead Salmon,DOMSmoked Steelhead Salmon50 g,$3.49ea,,$6.98/ 100g,False,6.0,
seafood,,"Rainbow Trout Fillets, Boneless, Packaged","Rainbow Trout Fillets, Boneless, Packaged",$9.22(est.)ea,,$30.84/ 1kg,False,7.0,
seafood,Seaquest,King Crab Flavoured Wild Alaska Pollock & Wild Pacific Whiting,SeaquestKing Crab Flavoured Wild Alaska Pollock & Wild Pacific Whiting227 g,$3.99ea,,$1.76/ 100g,False,8.0,
seafood,Seaquest,Leg-style King Crab Flavoured Wild Alaska Pollock & Wild Pacific Whiting,SeaquestLeg-style King Crab Flavoured Wild Alaska Pollock & Wild Pacific Whiting227 g,$3.99ea,,$1.76/ 100g,False,9.0,
seafood,Seaquest,Wild Haddock Fillets Skinless Boneless ,SeaquestWild Haddock Fillets Skinless Boneless 400 g,$8.99ea,,$2.25/ 100g,False,10.0,
seafood,,$10 Basa Fillets,$10 Basa Fillets908 g,$10.00ea,,$1.10/ 100g,False,11.0,
seafood,President's Choice,Smoked Wild Sockeye Salmon,President's ChoiceSmoked Wild Sockeye Salmon150 g,$13.99ea,,$9.33/ 100g,False,12.0,
seafood,Seaquest,Pink Salmon Fillets,SeaquestPink Salmon Fillets400 g,$10.99ea,,$2.75/ 100g,False,13.0,
seafood,High Liner,Pink Salmon,High LinerPink Salmon400 g,$10.99ea,,$2.75/ 100g,False,14.0,
seafood,Seaquest,Salad Shrimp,SeaquestSalad Shrimp454 g,$11.99ea,,$2.64/ 100g,False,15.0,
seafood,Seaquest,"Sole Fillets, Skinless Boneless","SeaquestSole Fillets, Skinless Boneless400 g",$8.99ea,,$2.25/ 100g,False,16.0,
seafood,Seaquest,Lobster Flavoured Wild Alaska Pollock Chunks,SeaquestLobster Flavoured Wild Alaska Pollock Chunks227 g,$3.99ea,,$1.76/ 100g,False,17.0,
seafood,Seaquest,Crab Flakes,SeaquestCrab Flakes454 g,$6.49ea,,$1.43/ 100g,False,18.0,
seafood,President's Choice,Beer Battered Shrimp,President's ChoiceBeer Battered Shrimp300 g,$12.99ea,,$4.33/ 100g,False,19.0,
seafood,President's Choice,Zipperback Pacific White Shrimp Raw,President's ChoiceZipperback Pacific White Shrimp Raw400 g,$12.99ea,,$3.25/ 100g,False,20.0,
seafood,Seaquest,Tilapia Fillets,SeaquestTilapia Fillets400 g,$8.99ea,,$2.25/ 100g,False,21.0,
seafood,PC Blue Menu,"Wild Nova Scotian Sea Scallops, Frozen","PC Blue MenuWild Nova Scotian Sea Scallops, Frozen400 g",$25.99ea,,$6.50/ 100g,False,22.0,
seafood,Seaquest,Cod Fillets Wild Pacific,SeaquestCod Fillets Wild Pacific400 g,$8.99ea,,$2.25/ 100g,False,23.0,
seafood,Seaquest,Wild Haddock Fillets Club Size ,SeaquestWild Haddock Fillets Club Size 1 kg,$17.99ea,,$1.80/ 100g,False,24.0,
seafood,,Fresh Atlantic Salmon Portion Tray Pack,Fresh Atlantic Salmon Portion Tray Pack,$10.60(est.)ea,,$46.28/ 1kg,False,25.0,
seafood,President's Choice,Breaded Butterflied Shrimp ,President's ChoiceBreaded Butterflied Shrimp 400 g,$14.99ea,,$3.75/ 100g,False,26.0,
seafood,President's Choice,Breaded Coconut Shrimp With Sweet Chili Dipping Sauce,President's ChoiceBreaded Coconut Shrimp With Sweet Chili Dipping Sauce454 g,$14.99ea,,$3.30/ 100g,False,27.0,
seafood,President's Choice,Raw Shrimp,President's ChoiceRaw Shrimp340 g,$12.99ea,,$3.82/ 100g,False,28.0,
seafood,President's Choice,Scottish Atlantic Salmon Double Smoked ,President's ChoiceScottish Atlantic Salmon Double Smoked 150 g,$12.99ea,,$8.66/ 100g,False,29.0,
seafood,Seaquest,Crab Leg Style,SeaquestCrab Leg Style454 g,$6.49ea,,$1.43/ 100g,False,30.0,
seafood,Seaquest,Pink Salmon Fillets,SeaquestPink Salmon Fillets1 kg,$18.99ea,,$1.90/ 100g,False,31.0,
seafood,Waterview Market,Crispy Calamari,Waterview MarketCrispy Calamari300 g,$4.99ea,,$1.66/ 100g,False,32.0,
seafood,,Pickerel Fillets,Pickerel Fillets,$21.48(est.)ea,,$50.68/ 1kg,False,33.0,
seafood,Nanuk,Smoked Coho Salmon,NanukSmoked Coho Salmon300 g,$22.99ea,,$7.66/ 100g,False,34.0,
seafood,,"Lobster Tail, Frozen (5-6Oz)","Lobster Tail, Frozen (5-6Oz)156 g",$12.99ea,,$8.33/ 100g,False,35.0,
seafood,Feature Foods,Herring Rollmops,Feature FoodsHerring Rollmops320 g,$5.99ea,,$1.87/ 100g,False,36.0,
seafood,Foppen,Smoked Salmon Slices Flame Roasted ,FoppenSmoked Salmon Slices Flame Roasted 170 g,$12.99ea,,$7.64/ 100g,False,37.0,
seafood,,Cod Fillet,Cod Fillet,$7.82(est.)ea,,$26.43/ 1kg,False,38.0,
seafood,,Fresh Atlantic Smelt,Fresh Atlantic Smelt,$7.27(est.)ea,,$22.02/ 1kg,False,39.0,
seafood,Seaquest,Wild Pollock Fillets,SeaquestWild Pollock Fillets400 g,$7.99ea,,$2.00/ 100g,False,40.0,
seafood,Salads of the Sea,Smoked Salmon Flavoured Dip,Salads of the SeaSmoked Salmon Flavoured Dip198 g,$5.29ea,,$2.67/ 100g,False,41.0,
seafood,Paese Mio,Anchovies,Paese MioAnchovies160 g,$7.99ea,,$5.33/ 100g,False,42.0,
seafood,PC Blue Menu,"Wild Sea Scallops, 100/150","PC Blue MenuWild Sea Scallops, 100/150400 g",$15.99ea,$12.99ea,$3.25/ 100g,True,43.0,saleEnds 03/15
seafood,PC Organics,Organics Cooked Black Tiger Shrimp,PC OrganicsOrganics Cooked Black Tiger Shrimp340 g,$24.99ea,,$7.35/ 100g,False,44.0,
seafood,Marina,Wild Caught Argentinian Shrimp,MarinaWild Caught Argentinian Shrimp300 g,$13.99ea,,$4.66/ 100g,False,45.0,
seafood,Chelsea,Dried Boneless Cod Bits,ChelseaDried Boneless Cod Bits454 g,$9.99ea,,$2.20/ 100g,False,46.0,
seafood,Premier,Wild Crab Blue Swimming Crab Meat,PremierWild Crab Blue Swimming Crab Meat227 g,$15.99ea,,$7.04/ 100g,False,47.0,
seafood,,Atlantic Salmon Portion,Atlantic Salmon Portion113 g,$5.49ea,,$4.86/ 100g,False,48.0,
seafood,President's Choice,Salmon & Haddock Fish Cake,President's ChoiceSalmon & Haddock Fish Cake290 g,$9.99ea,,$3.44/ 100g,False,49.0,
seafood,President's Choice,Crispy Shrimp Fine Hors D'Oeuvre Trio,President's ChoiceCrispy Shrimp Fine Hors D'Oeuvre Trio528 g,$16.99ea,,$3.22/ 100g,False,50.0,
seafood,,Mussels,Mussels907 g,$6.99ea,,$0.77/ 100g,False,51.0,
seafood,President's Choice,"Wild Yellowfin Tuna Skinless Boneless Steaks, Sustainably Sourced 280g","President's ChoiceWild Yellowfin Tuna Skinless Boneless Steaks, Sustainably Sourced 280g280 g",$12.99ea,,$4.64/ 100g,False,52.0,
seafood,Seaquest,"Basa fillets, skinless & boneless","SeaquestBasa fillets, skinless & boneless1 kg",$14.99ea,,$1.50/ 100g,False,53.0,
seafood,Anchor Bay,Cooked Shrimp 61-70 ct,Anchor BayCooked Shrimp 61-70 ct454 g,$15.99ea,,$3.52/ 100g,False,54.0,
seafood,,"Fresh Organic Atlantic Salmon Fillets, Skin On, Packaged","Fresh Organic Atlantic Salmon Fillets, Skin On, Packaged",$16.84(est.)ea,,$57.29/ 1kg,False,55.0,
seafood,President's Choice,Pacific White Shrimp Platter with Mild Cocktail Sauce,President's ChoicePacific White Shrimp Platter with Mild Cocktail Sauce568 g,$19.99ea,,$3.52/ 100g,False,56.0,
seafood,Feature Foods,Herring Fillets in Wine Marinade,Feature FoodsHerring Fillets in Wine Marinade600 g,$7.99ea,,$1.33/ 100g,False,57.0,
seafood,President's Choice,Sea Salt and Malt Vinegar Haddock Bites,President's ChoiceSea Salt and Malt Vinegar Haddock Bites454 g,$11.99ea,,$2.64/ 100g,False,58.0,
seafood,Bos,Smoked Rainbow Trout Fillet Natural,BosSmoked Rainbow Trout Fillet Natural190 g,$11.99ea,,$6.31/ 100g,False,59.0,
seafood,,Fresh Rainbow Trout Fillet,Fresh Rainbow Trout Fillet,$16.68(est.)ea,,$30.84/ 1kg,False,60.0,
seafood,High Liner,Catch of the Day Sole Fillets,High LinerCatch of the Day Sole Fillets800 g,$14.99ea,,$1.87/ 100g,False,61.0,
seafood,,"Salmon Portions, Marinated","Salmon Portions, Marinated",$11.49(est.)ea,,$48.48/ 1kg,False,62.0,
seafood,President's Choice, Atlantic Salmon Burger,President's Choice Atlantic Salmon Burger568 g,$13.99ea,,$2.46/ 100g,False,63.0,
seafood,,"Scallops, 20-40, Packaged","Scallops, 20-40, Packaged",$11.35(est.)ea,,$55.09/ 1kg,False,64.0,
seafood,PC Blue Menu,Rainbow Trout Skinless Boneless Fillets,PC Blue MenuRainbow Trout Skinless Boneless Fillets280 g,$13.99ea,,$5.00/ 100g,False,65.0,
seafood,Premier, Seafood Mix,Premier Seafood Mix340 g,$5.99ea,$4.99ea,$1.47/ 100g,True,66.0,saleEnds 03/15
seafood,,"All-Seasoned Salmon Sausage, Italian","All-Seasoned Salmon Sausage, Italian",$5.73(est.)ea,,$22.02/ 1kg,False,67.0,
seafood,,"Fresh Snapper, Whole","Fresh Snapper, Whole",$18.33(est.)ea,,$28.64/ 1kg,False,68.0,
seafood,,"Littleneck Clams, Live","Littleneck Clams, Live",$16.74(est.)ea,,$24.23/ 1kg,False,69.0,
seafood,,"Pink Shrimp, Raw","Pink Shrimp, Raw",$7.65(est.)ea,,$30.84/ 1kg,False,70.0,
seafood,Foppen,Smoked Slice Salmon Loin,FoppenSmoked Slice Salmon Loin170 g,$13.99ea,,$8.23/ 100g,False,71.0,
seafood,President's Choice,Halibut,President's ChoiceHalibut240 g,$25.99ea,,$10.83/ 100g,False,72.0,
seafood,,Tuna Steak Previously Frozen ,Tuna Steak Previously Frozen ,$10.18(est.)ea,,$36.35/ 1kg,False,73.0,
seafood,,"Atlantic Salmon Steaks, Packaged","Atlantic Salmon Steaks, Packaged",$8.45(est.)ea,,$30.84/ 1kg,False,74.0,
seafood,,Haddock Fillet,Haddock Fillet,$6.27(est.)ea,,$28.64/ 1kg,False,75.0,
seafood,,Marinated Cat Fish,Marinated Cat Fish,$8.99(est.)ea,,$37.46/ 1kg,False,76.0,
seafood,Millionnaires,Flat Fillets of Anchovies,MillionnairesFlat Fillets of Anchovies50 g,$4.99ea,,$4.99/ 50g,False,77.0,
seafood,PC Blue Menu,"Wild Sockeye Salmon Sustainably Sourced, Skin-On Boneless Fillets","PC Blue MenuWild Sockeye Salmon Sustainably Sourced, Skin-On Boneless Fillets280 g",$17.99ea,,$6.43/ 100g,False,78.0,
seafood,President's Choice,Tempura Torpedo Shrimp With Sweet Soy Dipping Sauce,President's ChoiceTempura Torpedo Shrimp With Sweet Soy Dipping Sauce340 g,$14.99ea,,$4.41/ 100g,False,79.0,
seafood,,Previously Frozen Snow Crab Clusters,Previously Frozen Snow Crab Clusters,$23.36(est.)ea,,$44.07/ 1kg,False,80.0,
seafood,President's Choice,"Candied Salmon, Maple Flavour","President's ChoiceCandied Salmon, Maple Flavour150 g",$10.99ea,,$7.33/ 100g,False,81.0,
seafood,PC Organics,Organic Atlantic Salmon Fillets,PC OrganicsOrganic Atlantic Salmon Fillets280 g,$19.99ea,,$7.14/ 100g,False,82.0,
seafood,Sardo,Herb & Garlic Marinated Mussels ,SardoHerb & Garlic Marinated Mussels 250 ml,$7.99ea,,$3.20/ 100g,False,83.0,
seafood,President's Choice,Bacon-Wrapped Wild Sea Scallops,President's ChoiceBacon-Wrapped Wild Sea Scallops260 g,$17.99ea,,$6.92/ 100g,False,84.0,
seafood,,"Fresh Atlantic Salmon Portion, Maple Flavour Packaged","Fresh Atlantic Salmon Portion, Maple Flavour Packaged1 ea",$5.49ea,,$5.49/ 1ea,False,85.0,
seafood,,"Sea Scallops 25-35, Frozen, Packaged","Sea Scallops 25-35, Frozen, Packaged",$16.33(est.)ea,,$66.12/ 1kg,False,86.0,
seafood,Toppits,"Tempura Shrimp, Oven Ready","ToppitsTempura Shrimp, Oven Ready500 g",$12.99ea,,$2.60/ 100g,False,87.0,
seafood,President's Choice,Zipperback Colossal Raw Freshwater Shrimp,President's ChoiceZipperback Colossal Raw Freshwater Shrimp454 g,$18.99ea,,$4.18/ 100g,False,88.0,
seafood,Sardo,Marinated Seafood Salad,SardoMarinated Seafood Salad500 ml,$9.99ea,,$2.00/ 100ml,False,89.0,
seafood,Seaquest,Basa Fillets,SeaquestBasa Fillets400 g,$8.99ea,,$2.25/ 100g,False,90.0,
seafood,President's Choice,Black Tiger Shrimp With Mild Cocktail Sauce Gigantico,President's ChoiceBlack Tiger Shrimp With Mild Cocktail Sauce Gigantico568 g,$27.99ea,,$4.93/ 100g,False,91.0,
seafood,High Liner,Catch of the Day Haddock Fillets 5,High LinerCatch of the Day Haddock Fillets 5580 g,$14.99ea,,$2.58/ 100g,False,92.0,
seafood,,"Cherrystone Clams, Live","Cherrystone Clams, Live",$15.29(est.)ea,,$13.21/ 1kg,False,93.0,
seafood,PC Organics,Organic Zipperback Shrimp,PC OrganicsOrganic Zipperback Shrimp300 g,$14.99ea,,$5.00/ 100g,False,94.0,
seafood,Paese Mio,Anchovies,Paese MioAnchovies80 g,$4.49ea,,$5.99/ 100g,False,95.0,
seafood,President's Choice,Black Tiger Shrimp Raw Gigantico,President's ChoiceBlack Tiger Shrimp Raw Gigantico400 g,$16.99ea,,$4.25/ 100g,False,96.0,
seafood,Toppits,"Frozen Lobster Meat, Cooked","ToppitsFrozen Lobster Meat, Cooked150 g",$28.99ea,,$19.33/ 100g,False,97.0,
seafood,Paese Mio,Peppered Anchovies In Sun Flower Oil,Paese MioPeppered Anchovies In Sun Flower Oil314 g,$7.99ea,,$2.54/ 100g,False,98.0,
seafood,,"Lobster Tail, Frozen","Lobster Tail, Frozen95 g",$8.99ea,,$9.46/ 100g,False,99.0,
seafood,Feature Foods,Herring Fillets in Wine Marinade,Feature FoodsHerring Fillets in Wine Marinade320 g,$5.99ea,,$1.87/ 100g,False,100.0,
seafood,Foppen,Smoked Salmon Toast Trio,FoppenSmoked Salmon Toast Trio248 g,$15.99ea,,$6.45/ 100g,False,101.0,
seafood,,Calamari With Stuffing,Calamari With Stuffing,$9.75(est.)ea,,$22.02/ 1kg,False,102.0,
seafood,,"Lobster Tail, Frozen","Lobster Tail, Frozen125 g",$10.99ea,,$9.73/ 100g,False,103.0,
seafood,,"Rock Lobster Tail, 10-12 oz","Rock Lobster Tail, 10-12 oz100 ea",$34.99ea,,$34.99/ 1ea,False,104.0,
seafood,Anchor Bay,Mussel Meat,Anchor BayMussel Meat340 g,$5.99ea,,$1.76/ 100g,False,105.0,
seafood,,Cooked Octopus Tentacles ,Cooked Octopus Tentacles 250 g,$19.99ea,,$8.00/ 100g,False,106.0,
seafood,Chelsea,"Boned Cod Fillets, Salted","ChelseaBoned Cod Fillets, Salted454 g",$12.99ea,,$2.86/ 100g,False,107.0,
seafood,President's Choice,Butter & Lemon Grilling Lobster Tail Skewers,President's ChoiceButter & Lemon Grilling Lobster Tail Skewers200 g,$21.99ea,,$11.00/ 100g,False,108.0,
seafood,President's Choice,Melt In The Middle Sustainably Sourced Cod Fish Cakes,President's ChoiceMelt In The Middle Sustainably Sourced Cod Fish Cakes290 g,$9.99ea,,$3.44/ 100g,False,109.0,
seafood,Sardo,Select Shrimp Herb & Garlic Marinated ,SardoSelect Shrimp Herb & Garlic Marinated 212 g,$9.49ea,,$3.80/ 100ml,False,110.0,
seafood,Sardo,Select Seafood Salad Marinated   ,SardoSelect Seafood Salad Marinated   212 g,$7.39ea,,$2.96/ 100ml,False,111.0,
seafood,,"Atlantic Salmon, Whole","Atlantic Salmon, Whole",$18.50(est.)ea,,$24.23/ 1kg,False,112.0,
seafood,President's Choice,Breaded Cod Bites With Sauce,President's ChoiceBreaded Cod Bites With Sauce454 g,$13.99ea,,$3.08/ 100g,False,113.0,
seafood,Aquastar,Rainbow Trout Boneless,AquastarRainbow Trout Boneless680 g,$16.99ea,,$2.50/ 100g,False,114.0,
seafood,,"Fresh Atlantic Salmon Fillets, Skin On, Marinated, Packaged","Fresh Atlantic Salmon Fillets, Skin On, Marinated, Packaged",$10.65(est.)ea,,$36.36/ 1kg,False,115.0,
seafood,,Fresh Pickerel,Fresh Pickerel,$11.76(est.)ea,,$50.68/ 1kg,False,116.0,
seafood,,"Raw Wild Shrimp, Easy Peel","Raw Wild Shrimp, Easy Peel300 g",$13.99ea,,$4.66/ 100g,False,117.0,
seafood,,Cooked Lobster Tray Pack,Cooked Lobster Tray Pack,$25.54(est.)ea,,$41.87/ 1kg,False,118.0,
seafood,Seaquest,Shrimp Ring,SeaquestShrimp Ring454 g,$16.99ea,,$3.74/ 100g,False,119.0,
seafood,,"Faroe Island Salmon Fillet, Tray Pack","Faroe Island Salmon Fillet, Tray Pack",$12.73(est.)ea,,$39.66/ 1kg,False,120.0,
seafood,,"Sea Scallops 25-35, Frozen","Sea Scallops 25-35, Frozen",$18.51(est.)ea,,$66.12/ 1kg,False,121.0,
seafood,President's Choice,Pacific White Shrimp Cooked Peeled Responsibly Farmed Jumbo ,President's ChoicePacific White Shrimp Cooked Peeled Responsibly Farmed Jumbo 400 g,$18.99ea,,$4.75/ 100g,False,122.0,
seafood,,"Malpeque Oysters, Medium","Malpeque Oysters, Medium40 g",$1.49ea,,$3.73/ 100g,False,123.0,
seafood,High Liner,Alaskan Pollock Fillets,High LinerAlaskan Pollock Fillets1.32 kg,$14.99ea,,$1.14/ 100g,False,124.0,
seafood,,BC Rockfish Fillets,BC Rockfish Fillets,$7.42(est.)ea,,$28.64/ 1kg,False,125.0,
seafood,President's Choice,Wild Atlantic Cod Fillets ,President's ChoiceWild Atlantic Cod Fillets 280 g,$9.99ea,,$3.57/ 100g,False,126.0,
seafood,Toppits,Snow Crab Legs & Claw,ToppitsSnow Crab Legs & Claw500 g,$29.99ea,,$6.00/ 100g,False,127.0,
seafood,,"European Sea Bass, Whole","European Sea Bass, Whole",$21.50(est.)ea,,$28.64/ 1kg,False,128.0,
seafood,President's Choice,Atlantic Salmon Strips Hot Smoked Spicy & Candied ,President's ChoiceAtlantic Salmon Strips Hot Smoked Spicy & Candied 150 g,$10.99ea,,$7.33/ 100g,False,129.0,
seafood,PC Organics,Organics Zipperback Raw Black Tiger Shrimp,PC OrganicsOrganics Zipperback Raw Black Tiger Shrimp300 g,$14.99ea,,$5.00/ 100g,False,130.0,
seafood,President's Choice,Gluten Free Breaded Shrimp,President's ChoiceGluten Free Breaded Shrimp340 g,$11.99ea,,$3.53/ 100g,False,131.0,
seafood,PC Blue Menu,Atlantic Salmon Skinless Boneless Fillets,PC Blue MenuAtlantic Salmon Skinless Boneless Fillets280 g,$15.99ea,,$5.71/ 100g,False,132.0,
seafood,PC Organics,Organics Peeled Raw Black Tiger Shrimp,PC OrganicsOrganics Peeled Raw Black Tiger Shrimp300 g,$14.99ea,,$5.00/ 100g,False,133.0,
seafood,Salads of the Sea,Smoky Bacon Crab Flavoured Dip,Salads of the SeaSmoky Bacon Crab Flavoured Dip198 g,$5.29ea,,$2.67/ 100g,False,134.0,
seafood,President's Choice,Breaded Potato and Wild Salt Cod Croquettes,President's ChoiceBreaded Potato and Wild Salt Cod Croquettes300 g,$11.99ea,,$4.00/ 100g,False,135.0,
seafood,,Canadian Snow Crab,Canadian Snow Crab,$26.81(est.)ea,,$59.50/ 1kg,False,136.0,
seafood,DOM,Organics Live Mussels,DOMOrganics Live Mussels907 g,$6.99ea,,$0.77/ 100g,False,137.0,
seafood,High Liner,Catch of the Day Salmon Fillets,High LinerCatch of the Day Salmon Fillets680 g,$15.99ea,$14.99ea,$2.20/ 100g,True,138.0,saleEnds 04/05
seafood,President's Choice,Smoked Atlantic Salmon,President's ChoiceSmoked Atlantic Salmon150 g,$13.99ea,,$9.33/ 100g,False,139.0,
seafood,,Atlantic Perch Fillets,Atlantic Perch Fillets,$7.03(est.)ea,,$30.84/ 1kg,False,140.0,
seafood,,Fresh Whole Whiting,Fresh Whole Whiting,$12.00(est.)ea,,$13.21/ 1kg,False,141.0,
seafood,Paese Mio,Anchovies,Paese MioAnchovies235 g,$13.99ea,,$5.95/ 100g,False,142.0,
seafood,,Sole Fillet,Sole Fillet,$6.08(est.)ea,,$30.84/ 1kg,False,143.0,
seafood,Fortune Oysters, Live Oysters,Fortune Oysters Live Oysters360 g,$9.99ea,,$2.78/ 100g,False,144.0,
seafood,Chelsea,Boned Salted Cod Fillets,ChelseaBoned Salted Cod Fillets908 g,$24.99ea,,$2.75/ 100g,False,145.0,
seafood,,"Fresh Atlantic Salmon Portion, Jerk Flavour, 113G, Packaged","Fresh Atlantic Salmon Portion, Jerk Flavour, 113G, Packaged1 ea",$5.49ea,,$5.49/ 1ea,False,146.0,
seafood,,"Fresh Atlantic Salmon Portion, Herb and Garlic Flavour, Packaged","Fresh Atlantic Salmon Portion, Herb and Garlic Flavour, Packaged1 ea",$5.49ea,,$5.49/ 1ea,False,147.0,
seafood,Seaquest,Shrimp Ring,SeaquestShrimp Ring227 g,$8.99ea,,$3.96/ 100g,False,148.0,
seafood,,Lobster Tail 2-3 Oz Frozen (1 Ea),Lobster Tail 2-3 Oz Frozen (1 Ea)57 g,$6.99ea,,$6.99/ 1ea,False,149.0,
seafood,,Lake Perch Fillet Tray Pack ,Lake Perch Fillet Tray Pack ,$25.99(est.)ea,,$66.12/ 1kg,False,150.0,
seafood,Laurena,Anchovy Paste,LaurenaAnchovy Paste60 g,$3.49ea,,$5.82/ 100g,False,151.0,
seafood,Anchor Bay,Cooked Clam Meat,Anchor BayCooked Clam Meat340 g,$6.99ea,,$2.33/ 100g,False,152.0,
seafood,Seaquest,King Crab Flavoured Wild Alaska Pollock Chunks,SeaquestKing Crab Flavoured Wild Alaska Pollock Chunks227 g,$3.99ea,,$1.76/ 100g,False,153.0,
seafood,Sardo,Select Shrimp Spicy Jalapeño Marinated,SardoSelect Shrimp Spicy Jalapeño Marinated250 ml,$9.99ea,,$4.00/ 100ml,False,154.0,
seafood,President's Choice,Wild Atlantic Cold Water Shrimp Cooked Peeled ,President's ChoiceWild Atlantic Cold Water Shrimp Cooked Peeled 340 g,$13.99ea,,$4.11/ 100g,False,155.0,
seafood,President's Choice,Everything Seasoned Smoked Steelhead Salmon,President's ChoiceEverything Seasoned Smoked Steelhead Salmon150 g,$13.99ea,,$9.33/ 100g,False,156.0,
