category,brand,product_text,product_name,price_text,sale_price,per_unit_price_text,is_sale
snacks,President's Choice,The Decadent Chocolate Chunk Cookies,President's ChoiceThe Decadent Chocolate Chunk Cookies500 g,$5.99ea,$5.49ea,$1.10/ 100g,True
snacks,President's Choice,The Decadent Chocolate Chip Cookie ,President's ChoiceThe Decadent Chocolate Chip Cookie 500 g,$5.99ea,$5.49ea,$1.10/ 100g,True
snacks,Peek Freans,Lifestyle Selections Shortcake Cookies,Peek FreansLifestyle Selections Shortcake Cookies290 g,$4.99ea,,$1.72/ 100g,False
snacks,Tic Tac,"Mints, Breath Freshener, Fruit Adventure, 200 pills","Tic TacMints, Breath Freshener, Fruit Adventure, 200 pills98 g",$4.49ea,,$4.58/ 100g,False
snacks,Darrell Lea,Soft Strawberry Liquorice,Darrell LeaSoft Strawberry Liquorice200 g,$3.99ea,$3.49ea,$1.75/ 100g,True
snacks,From Farm To Table,Kettle Chips Barbeque Flavour,From Farm To TableKettle Chips Barbeque Flavour142 g,$3.69ea,,$2.60/ 100g,False
snacks,Sunmaid,Fruity Raisin Snacks Sour Blue Raspberry,SunmaidFruity Raisin Snacks Sour Blue Raspberry7x20.0 g,$5.49ea,$3.99ea,$2.85/ 100g,True
snacks,PATIENCE FRUIT & CO,Sour Cherry Flavoured Candy,PATIENCE FRUIT & COSour Cherry Flavoured Candy60 g,$2.99ea,,$4.98/ 100g,False
snacks,Lindt,LINDOR Hazelnut Milk Chocolate Truffles Bag,LindtLINDOR Hazelnut Milk Chocolate Truffles Bag150 g,$8.99ea,,$5.99/ 100g,False
snacks,Christie,Fig Newtons,ChristieFig Newtons283 g,$4.99ea,,$1.76/ 100g,False
snacks,Cadbury,Mini Eggs,CadburyMini Eggs33 g,$1.79ea,,$5.42/ 100g,False
snacks,No Name,"Crackers and Cheese, Processed Cheese Product, Club Size","No NameCrackers and Cheese, Processed Cheese Product, Club Size24x29.0 g",$11.99ea,,$1.72/ 100g,False
snacks,Darrell Lea, Natural Liquorice,Darrell Lea Natural Liquorice200 g,$3.99ea,$3.49ea,$1.75/ 100g,True
snacks,Purity,"Cookies, Ginger","PurityCookies, Ginger400 g",$5.49ea,,$1.37/ 100g,False
snacks,Whittaker's,Milk Chocolate,Whittaker'sMilk Chocolate200 g,$5.99ea,$5.49ea,$2.75/ 100g,True
snacks,Munchies,BBQ Flavour Snack Mix 250g,MunchiesBBQ Flavour Snack Mix 250g250 g,$4.99ea,,$2.00/ 100g,False
snacks,Mentos,Mint,MentosMint4x37.0 g,$2.99ea,,$2.02/ 100g,False
snacks,Ulker,Tea Biscuit Cookies,UlkerTea Biscuit Cookies175 g,$1.39ea,,$0.79/ 100g,False
snacks,Takis,Rolled Tortilla Chips Zesty Nacho Mild,TakisRolled Tortilla Chips Zesty Nacho Mild280 g,$4.29ea,,$1.53/ 100g,False
snacks,President's Choice,Milk Chocolate Covered Raisins,President's ChoiceMilk Chocolate Covered Raisins908 g,$10.99ea,,$1.21/ 100g,False
snacks,Kambly,Butterfly Au Chocolat Delicately Thin Biscuits With Hazelnuts And Milk Chocolate,KamblyButterfly Au Chocolat Delicately Thin Biscuits With Hazelnuts And Milk Chocolate100 g,$5.99ea,,$5.99/ 100g,False
snacks,Nestle,Smarties Easter Chocolate Egg Hunt Kit,NestleSmarties Easter Chocolate Egg Hunt Kit262 g,$9.99ea,,$3.81/ 100g,False
snacks,Shufra,Premier Dark Chocolate,ShufraPremier Dark Chocolate100 g,$2.29ea,,$2.29/ 100g,False
snacks,Nestle,KitKat Chunky Cookie Dough Wafer Bar,NestleKitKat Chunky Cookie Dough Wafer Bar52 g,$1.00ea,$0.88ea,$1.69/ 100g,True
snacks,Wrigley,"Winterfresh Flavoured Mints, 1 Tin","WrigleyWinterfresh Flavoured Mints, 1 Tin34 g",$3.29ea,,$9.68/ 100g,False
snacks,Covered Bridge,"Potato Chips, Sea Salt & Vinegar","Covered BridgePotato Chips, Sea Salt & Vinegar170 g",$3.50ea,$2.99ea,$1.76/ 100g,True
snacks,Wrigley,"Wintermint-Ascent Flavoured Sugar Free Chewing Gum, 15 Sticks, 3 Packs","WrigleyWintermint-Ascent Flavoured Sugar Free Chewing Gum, 15 Sticks, 3 Packs3 ea",$5.99ea,,$2.00/ 1ea,False
snacks,Lindt,EXCELLENCE 100% Cacao Dark Chocolate Bar,LindtEXCELLENCE 100% Cacao Dark Chocolate Bar50 g,$3.99ea,,$7.98/ 100g,False
snacks,Oreo,Double Stuf Golden Cookies,OreoDouble Stuf Golden Cookies261 g,$3.99ea,,$1.53/ 100g,False
snacks,President's Choice,Apple Mango Sweet Potato Squeeze Fruit Snacks,President's ChoiceApple Mango Sweet Potato Squeeze Fruit Snacks4x90.0 g,$2.99ea,,$0.83/ 100g,False
snacks,Lindt,SWISS CLASSIC GRANDES Almond White Chocolate Bar,LindtSWISS CLASSIC GRANDES Almond White Chocolate Bar150 g,$6.49ea,,$4.33/ 100g,False
snacks,Smart Food,White Cheddar flavour seasoned popcorn (small bag) 50g,Smart FoodWhite Cheddar flavour seasoned popcorn (small bag) 50g50 g,$1.89ea,,$3.78/ 100g,False
snacks,M&M's,"Classic Mix, Milk Chocolate, Peanut and Peanut Butter Flavoured Milk Chocolate Candies, Sharing Bag","M&M'sClassic Mix, Milk Chocolate, Peanut and Peanut Butter Flavoured Milk Chocolate Candies, Sharing Bag185 g",$5.99ea,,$3.24/ 100g,False
snacks,President's Choice,Sweet and Salty Peanut Chewy Nut Bars,President's ChoiceSweet and Salty Peanut Chewy Nut Bars175 g,$3.49ea,,$1.99/ 100g,False
snacks,Reese's,"Chocolate, Peanut Butter Cups Snack Sized Candy","Reese'sChocolate, Peanut Butter Cups Snack Sized Candy124 g",$2.99ea,,$2.41/ 100g,False
snacks,Snickers,"Peanut Milk Chocolate Candy Bars, 4 Full Size Bars","SnickersPeanut Milk Chocolate Candy Bars, 4 Full Size Bars208 g",$5.99ea,,$2.88/ 100g,False
snacks,Neal Brothers Foods,Tortillas Organic White,Neal Brothers FoodsTortillas Organic White300 g,$5.49ea,,$1.83/ 100g,False
snacks,,Hazelnut Pieces 100% Alpine Milk Chocolate,Hazelnut Pieces 100% Alpine Milk Chocolate100 g,$1.99ea,,$1.99/ 100g,False
snacks,Garden Fresh,Tortilla Chips Blue Corn,Garden FreshTortilla Chips Blue Corn397 g,$4.99ea,,$1.26/ 100g,False
snacks,Voortman,Orange Cream Wafers,VoortmanOrange Cream Wafers250 g,$3.99ea,$3.79ea,$1.52/ 100g,True
snacks,Pepperidge Farm,Goldfish  Flavour Blasted  Wild White Cheddar,Pepperidge FarmGoldfish  Flavour Blasted  Wild White Cheddar180 g,$3.99ea,,$2.22/ 100g,False
snacks,Werther's,Original Soft Crème Caramel Candy,Werther'sOriginal Soft Crème Caramel Candy230 g,$4.49ea,,$1.95/ 100g,False
snacks,TRIDENT,Peppermint Gum,TRIDENTPeppermint Gum3 ea,$4.99ea,,$1.66/ 1ea,False
snacks,Lindt,LINDOR Assorted Chocolate Truffles Bag,LindtLINDOR Assorted Chocolate Truffles Bag240 g,$11.99ea,,$5.00/ 100g,False
snacks,Brookside,Dark Chocolate Pomegranate,BrooksideDark Chocolate Pomegranate235 g,$5.29ea,,$2.25/ 100g,False
snacks,Nutella,"and Go Snack Packs, Chocolate Hazelnut Spread with Breadsticks, Pack of 4","Nutellaand Go Snack Packs, Chocolate Hazelnut Spread with Breadsticks, Pack of 4208 g",$6.49ea,,$3.12/ 100g,False
snacks,Karachi Bakery,Fruit Biscuits,Karachi BakeryFruit Biscuits400 g,$7.99ea,,$2.00/ 100g,False
snacks,Cadbury,Dairy Milk Chocolate Indulgence Chocolate Bar,CadburyDairy Milk Chocolate Indulgence Chocolate Bar95 g,$2.99ea,,$3.15/ 100g,False
snacks,Clean Beans,Creamy Ranch Roasted Broad Beans,Clean BeansCreamy Ranch Roasted Broad Beans85 g,$2.99ea,,$3.52/ 100g,False
snacks,President's Choice,"Garlic, Parmesan, & Herb Baked Pita Crackers","President's ChoiceGarlic, Parmesan, & Herb Baked Pita Crackers142 g",$3.79ea,,$2.67/ 100g,False
snacks,Hershey's,Syrup Delicious Strawberry Flavour,Hershey'sSyrup Delicious Strawberry Flavour472 ml,$5.99ea,,$1.27/ 100ml,False
snacks,Voortman,Maple Wafers,VoortmanMaple Wafers300 g,$2.99ea,,$1.00/ 100g,False
snacks,Haldiram,Moong Dal,HaldiramMoong Dal350 g,$3.99ea,,$1.14/ 100g,False
snacks,Lindt,No Sugar Added Milk Chocolate Bar,LindtNo Sugar Added Milk Chocolate Bar100 g,$6.49ea,,$6.49/ 100g,False
snacks,President's Choice,"Garlic, Parmesan, & Herb Baked Pita Crackers","President's ChoiceGarlic, Parmesan, & Herb Baked Pita Crackers142 g",$3.79ea,,$2.67/ 100g,False
snacks,Tic Tac,"Mints, Breath Freshener, Fruit Adventure, 200 pills","Tic TacMints, Breath Freshener, Fruit Adventure, 200 pills98 g",$4.49ea,,$4.58/ 100g,False
snacks,Darrell Lea,Soft Strawberry Liquorice,Darrell LeaSoft Strawberry Liquorice200 g,$3.99ea,$3.49ea,$1.75/ 100g,True
snacks,Haldiram,Moong Dal,HaldiramMoong Dal350 g,$3.99ea,,$1.14/ 100g,False
snacks,PATIENCE FRUIT & CO,Sour Cherry Flavoured Candy,PATIENCE FRUIT & COSour Cherry Flavoured Candy60 g,$2.99ea,,$4.98/ 100g,False
snacks,Lindt,LINDOR Hazelnut Milk Chocolate Truffles Bag,LindtLINDOR Hazelnut Milk Chocolate Truffles Bag150 g,$8.99ea,,$5.99/ 100g,False
snacks,Hardbite,"Handcrafted-Style Chips, Paprika","HardbiteHandcrafted-Style Chips, Paprika128 g",$5.49ea,,$4.29/ 100g,False
snacks,Britannia,Biscuits Family Pack,BritanniaBiscuits Family Pack540 g,$4.49ea,,$0.83/ 100g,False
snacks,Cadbury,Mini Eggs,CadburyMini Eggs33 g,$1.79ea,,$5.42/ 100g,False
snacks,Lindt,"Chocolate,  White with A Delectably Smooth Centre","LindtChocolate,  White with A Delectably Smooth Centre150 g",$8.99ea,,$5.99/ 100g,False
snacks,Quaker,Crispy Minis Rice Chips Sour Cream & Chive,QuakerCrispy Minis Rice Chips Sour Cream & Chive100 g,$3.99ea,,$3.99/ 100g,False
snacks,Excel,"Spearmint Flavoured Sugar Free Chewing Gum, 18 Pieces, 3 Packs","ExcelSpearmint Flavoured Sugar Free Chewing Gum, 18 Pieces, 3 Packs77 g",$4.99ea,,$6.48/ 100g,False
snacks,Britannia,Strawberry Crm Bis    ,BritanniaStrawberry Crm Bis    120 g,$1.29ea,,$1.08/ 100g,False
snacks,Wellness Bites,Crispy Quinoa Brittle,Wellness BitesCrispy Quinoa Brittle725 g,$17.99ea,,$2.48/ 100g,False
snacks,PC Blue Menu,Fruit & Nut Dark Chocolate Cherry Chewy Bars,PC Blue MenuFruit & Nut Dark Chocolate Cherry Chewy Bars165 g,$4.49ea,,$2.72/ 100g,False
snacks,Parle,Sweet & Salty Crackers The Original,ParleSweet & Salty Crackers The Original60 g,$0.79ea,,$1.32/ 100g,False
snacks,Hot Kid,Qq Gummy Candy Pineapple Flavour,Hot KidQq Gummy Candy Pineapple Flavour70 g,$1.39ea,,$1.99/ 100g,False
snacks,Nestle,Aero Peppermint Snack Size,NestleAero Peppermint Snack Size88 g,$2.99ea,,$3.40/ 100g,False
snacks,President's Choice,Almond Medley,President's ChoiceAlmond Medley250 g,$5.99ea,,$2.40/ 100g,False
snacks,Dare,Realfruit Tropical,DareRealfruit Tropical180 g,$2.99ea,,$1.66/ 100g,False
snacks,Milano,Chocolate  Biscuit    ,MilanoChocolate  Biscuit    200 g,$2.49ea,,$1.25/ 100g,False
snacks,Hershey's,Cookie N Cream Dipper Pretzel,Hershey'sCookie N Cream Dipper Pretzel170 g,$5.99ea,,$3.52/ 100g,False
snacks,Eat My Shortbread,"Shortbread, Buttercrunch Toffee","Eat My ShortbreadShortbread, Buttercrunch Toffee43 g",$2.49ea,,$5.79/ 100g,False
snacks,Kind,Dipped Clusters Clusters Dark Chocolate Nuts & Berries,KindDipped Clusters Clusters Dark Chocolate Nuts & Berries113 g,$6.49ea,$5.49ea,$4.86/ 100g,True
snacks,OMG's,Peanut Butter Pretzel,OMG'sPeanut Butter Pretzel200 g,$5.79ea,,$2.90/ 100g,False
snacks,Jelly Belly,Kids Mix,Jelly BellyKids Mix100 g,$3.49ea,,$3.49/ 100g,False
snacks,Excel,"Bubblemint Flavoured Sugar Free Chewing Gum, 18 Pieces, 3 Packs","ExcelBubblemint Flavoured Sugar Free Chewing Gum, 18 Pieces, 3 Packs77 g",$4.99ea,,$6.48/ 100g,False
snacks,Hardbite,"Handcrafted-Style Chips, BBQ Sweet Potato Chips","HardbiteHandcrafted-Style Chips, BBQ Sweet Potato Chips150 g",$5.99ea,,$3.99/ 100g,False
snacks,SunRype,Apple Strawberry 100% Fruit Bar,SunRypeApple Strawberry 100% Fruit Bar37 g,$0.99ea,,$2.68/ 100g,False
snacks,Nong Shim,Onion Rings,Nong ShimOnion Rings50 g,$1.59ea,,$3.18/ 100g,False
snacks,Lindt,LINDOR Caramel Milk Chocolate Mini Eggs,LindtLINDOR Caramel Milk Chocolate Mini Eggs100 g,$4.99ea,,$4.99/ 100g,False
snacks,Wrigley,"Peppermint Flavoured Sugar Free Soft Chew Gum, 15 Pieces, 1 Pack","WrigleyPeppermint Flavoured Sugar Free Soft Chew Gum, 15 Pieces, 1 Pack1 ea",$2.79ea,,$2.79/ 1ea,False
snacks,Ritter Sport,"Chocolate, Milk  with Butter Biscuit & Cocoa CrÃ¨me","Ritter SportChocolate, Milk  with Butter Biscuit & Cocoa CrÃ¨me100 g",$2.99ea,,$2.99/ 100g,False
snacks,Monde,Eggnog Cookies,MondeEggnog Cookies130 g,$2.19ea,,$1.68/ 100g,False
snacks,Christie,Wheat Thins Spinach And Roasted Garlic Crackers,ChristieWheat Thins Spinach And Roasted Garlic Crackers175 g,$3.99ea,,$2.28/ 100g,False
snacks,Papadopoulos,"Biscuits, Petit-Beurre    ","PapadopoulosBiscuits, Petit-Beurre    225 g",$1.99ea,,$0.88/ 100g,False
snacks,SunRype,Apple Wildberry Carrot 100% Fruit and Veggie Bar,SunRypeApple Wildberry Carrot 100% Fruit and Veggie Bar37 g,$0.99ea,,$2.68/ 100g,False
snacks,Hershey's,Easter Egg Hunt Multi 10 Pack,Hershey'sEaster Egg Hunt Multi 10 Pack348 g,$15.99ea,,$4.59/ 100g,False
snacks,Nairn's,Fruit Seed Oat Cracker,Nairn'sFruit Seed Oat Cracker225 g,$4.99ea,,$2.22/ 100g,False
snacks,Que Pasa,Organic Grain Free Nacho Tortilla Chips,Que PasaOrganic Grain Free Nacho Tortilla Chips142 g,$6.29ea,,$4.43/ 100g,False
snacks,Neal Brothers Foods,"Tortillas, Restaurant Round","Neal Brothers FoodsTortillas, Restaurant Round300 g",$5.49ea,,$1.83/ 100g,False
snacks,PopCorners,White Cheddar Flavoured Popped-Corn Chips,PopCornersWhite Cheddar Flavoured Popped-Corn Chips142 g,$5.99ea,,$4.22/ 100g,False
snacks,From Farm To Table,Seriously Crispy Kettle Chips Salt & Malt Flavour,From Farm To TableSeriously Crispy Kettle Chips Salt & Malt Flavour142 g,$3.69ea,,$2.60/ 100g,False
snacks,Haitai,Honey Butter Chip Sweet Honey Flavour,HaitaiHoney Butter Chip Sweet Honey Flavour60 g,$3.29ea,$2.99ea,$4.98/ 100g,True
snacks,Cadbury,Crispy Crunch Peanut Butter Chocolate Bar,CadburyCrispy Crunch Peanut Butter Chocolate Bar48 g,$1.79ea,,$3.73/ 100g,False
snacks,Ghirardelli,Dark Chocolate Caramel Sea Salt Bar,GhirardelliDark Chocolate Caramel Sea Salt Bar100 g,$4.99ea,,$4.99/ 100g,False
snacks,Darrell Lea,Soft Australian Liquorice Mixed Fruit Flavored,Darrell LeaSoft Australian Liquorice Mixed Fruit Flavored200 g,$3.99ea,$3.49ea,$1.75/ 100g,True
snacks,Zweet,Ropes Rainbow Sour    ,ZweetRopes Rainbow Sour    285 g,$4.29ea,,$1.51/ 100g,False
snacks,Beanfields,"Chips, Nacho","BeanfieldsChips, Nacho156 g",$4.99ea,,$3.20/ 100g,False
snacks,Lay's,Poppables Honey BBQ Flavoured Potato Snacks,Lay'sPoppables Honey BBQ Flavoured Potato Snacks130 g,$3.49ea,,$2.68/ 100g,False
snacks,Alma,Wafers Chocolate Belgian,AlmaWafers Chocolate Belgian200 g,$1.59ea,,$0.80/ 100g,False
snacks,Que Pasa,Organic Grain Free Sea Salt Tortilla Chips,Que PasaOrganic Grain Free Sea Salt Tortilla Chips142 g,$6.29ea,,$4.43/ 100g,False
snacks,Hershey's,Syrup Indulgent Caramel Flavour,Hershey'sSyrup Indulgent Caramel Flavour623 g,$5.99ea,,$0.96/ 100g,False
snacks,Paqui,Jalapeno Tropicale Tortilla Chips,PaquiJalapeno Tropicale Tortilla Chips155 g,$5.99ea,,$3.86/ 100g,False
snacks,Whittaker's,Almond Milk Chocolate,Whittaker'sAlmond Milk Chocolate200 g,$5.99ea,$5.49ea,$2.75/ 100g,True
snacks,HIPPEAS,Chickpea Puff Snacks Bohemian Barbecue,HIPPEASChickpea Puff Snacks Bohemian Barbecue113 g,$5.99ea,$4.99ea,$4.42/ 100g,True
snacks,Quaker,"Harvest Granola Bars, Yogurt  Strawberry","QuakerHarvest Granola Bars, Yogurt  Strawberry175 g",$4.79ea,,$2.74/ 100g,False
snacks,Loacker,"Gran Pasticceria, Dark Hazelnut","LoackerGran Pasticceria, Dark Hazelnut100 g",$4.49ea,,$4.49/ 100g,False
snacks,Waterbridge,Sour Candy Wine Gums ,WaterbridgeSour Candy Wine Gums 200 g,$4.49ea,,$2.25/ 100g,False
snacks,Ritter Sport,Mini Chocolate Mix Assorted Chocolates,Ritter SportMini Chocolate Mix Assorted Chocolates133 g,$5.19ea,,$3.90/ 100g,False
snacks,Nature Valley,Wafer Peanut Butter Chocolate,Nature ValleyWafer Peanut Butter Chocolate184 g,$5.49ea,,$2.98/ 100g,False
snacks,Brookside,Dark Chocolate  Acai & Blueberry,BrooksideDark Chocolate  Acai & Blueberry90 g,$3.29ea,,$3.66/ 100g,False
snacks,Dare,Wagon Wheels Original Cookies,DareWagon Wheels Original Cookies630 g,$5.49ea,,$0.87/ 100g,False
snacks,Valor,70 % Cacao With Orange Dark Chocolate,Valor70 % Cacao With Orange Dark Chocolate100 g,$3.99ea,,$3.99/ 100g,False
snacks,Shufra,Premier Chocolate Milk,ShufraPremier Chocolate Milk100 g,$2.29ea,,$2.29/ 100g,False
snacks,Mars,"Peanut Free Chocolate Candy Bites, Sharing Bag","MarsPeanut Free Chocolate Candy Bites, Sharing Bag400 g",$9.99ea,,$2.50/ 100g,False
snacks,5 Gum,"Peppermint-Cobalt Flavoured Sugar Free Chewing Gum, 35 Sticks, 1 Pack","5 GumPeppermint-Cobalt Flavoured Sugar Free Chewing Gum, 35 Sticks, 1 Pack94.49 g",$4.99ea,,$5.28/ 100g,False
snacks,Paris Toasts,Rusks,Paris ToastsRusks270 g,$5.49ea,,$2.03/ 100g,False
snacks,Cadbury,Jersey Milk Milk Chocolate Chocolate Bar,CadburyJersey Milk Milk Chocolate Chocolate Bar100 g,$2.99ea,,$2.99/ 100g,False
snacks,Munchies,Original Snack Mix 415g,MunchiesOriginal Snack Mix 415g415 g,$6.49ea,,$1.56/ 100g,False
snacks,HIPPEAS,Chickpea Puff Snacks Vegan Nacho Vibes,HIPPEASChickpea Puff Snacks Vegan Nacho Vibes113 g,$5.99ea,$4.99ea,$4.42/ 100g,True
snacks,Tremarie, Milk Chocolate And Almonds Cream Filled Wafers,Tremarie Milk Chocolate And Almonds Cream Filled Wafers140 g,$3.49ea,,$2.49/ 100g,False
snacks,Milano,Mini S Biscuits 6 x 26 g,MilanoMini S Biscuits 6 x 26 g156 g,$3.29ea,,$2.11/ 100g,False
snacks,Garden,"Cream Wafers, Strawberry Flavour","GardenCream Wafers, Strawberry Flavour200 g",$2.39ea,,$1.20/ 100g,False
snacks,Terry's,"Chocolate, Orange Flavoured Milk y Confection Original","Terry'sChocolate, Orange Flavoured Milk y Confection Original90 g",$2.99ea,,$3.32/ 100g,False
snacks,Christie,Premium Plus Salted Crackers,ChristiePremium Plus Salted Crackers900 g,$9.49ea,,$1.05/ 100g,False
snacks,Orville,"Microwave Popcorn, Buttery","OrvilleMicrowave Popcorn, Buttery24x99.0 g",$13.99ea,,$0.59/ 100g,False
snacks,Peace By Chocolate,With Milk Chocolate,Peace By ChocolateWith Milk Chocolate46 g,$3.99ea,,$8.67/ 100g,False
snacks,JOLLY RANCHER,Misfits Gummies Candy,JOLLY RANCHERMisfits Gummies Candy355 g,$5.99ea,,$1.69/ 100g,False
snacks,Ritter Sport,Mini Chocolate Nut Selection Assorted Chocolates,Ritter SportMini Chocolate Nut Selection Assorted Chocolates116 g,$5.19ea,,$4.47/ 100g,False
snacks,Lay's,Stax Bar-B-Q flavoured potato crisps,Lay'sStax Bar-B-Q flavoured potato crisps155 g,$2.99ea,,$1.93/ 100g,False
snacks,Nestle,Smarties Milk Tablet,NestleSmarties Milk Tablet100 g,$2.99ea,,$2.99/ 100g,False
snacks,Wrigley,"Peppermint-Cobalt Flavoured Sugar Free Chewing Gum, 15 Sticks, 3 Packs","WrigleyPeppermint-Cobalt Flavoured Sugar Free Chewing Gum, 15 Sticks, 3 Packs3 ea",$5.99ea,,$2.00/ 1ea,False
snacks,Nestle,"Rolo Mini, Reclosable Pack","NestleRolo Mini, Reclosable Pack203 g",$5.99ea,,$2.95/ 100g,False
snacks,Humpty Dumpty,Cheese Sticks,Humpty DumptyCheese Sticks265 g,$4.99ea,,$1.88/ 100g,False
snacks,Blue Diamond,"Almonds, BBQ","Blue DiamondAlmonds, BBQ454 g",$13.99ea,,$3.08/ 100g,False
snacks,Lindt,EXCELLENCE Caramel & Sea Salt Dark Chocolate Bar,LindtEXCELLENCE Caramel & Sea Salt Dark Chocolate Bar100 g,$3.99ea,,$3.99/ 100g,False
snacks,President's Choice,Creme Filled Salted Caramel Sandwich Cookies,President's ChoiceCreme Filled Salted Caramel Sandwich Cookies300 g,$3.99ea,,$1.33/ 100g,False
snacks,Cadbury,Smooth Chocolate Bar,CadburySmooth Chocolate Bar90 g,$5.99ea,,$6.66/ 100g,False
snacks,President's Choice,Garlic Crackers,President's ChoiceGarlic Crackers185 g,$3.79ea,,$2.05/ 100g,False
snacks,Hershey's,Reese'S Pieces With Caramel Flavoured Chocolate Candy,Hershey'sReese'S Pieces With Caramel Flavoured Chocolate Candy170 g,$5.99ea,,$3.52/ 100g,False
snacks,The Snack Factory,"Pretzel Crisps Gluten Free Minis, Original","The Snack FactoryPretzel Crisps Gluten Free Minis, Original142 g",$5.99ea,,$4.22/ 100g,False
snacks,President's Choice,Extra Butter Flavour Purple Kernel Microwave Popcorn,President's ChoiceExtra Butter Flavour Purple Kernel Microwave Popcorn493 g,$5.49ea,,$1.11/ 100g,False
snacks,President's Choice,Unsalted Peanuts,President's ChoiceUnsalted Peanuts700 g,$6.99ea,,$1.00/ 100g,False
snacks,Lindt,EXCELLENCE 85% Cacao Dark Chocolate Bar,LindtEXCELLENCE 85% Cacao Dark Chocolate Bar100 g,$3.99ea,,$3.99/ 100g,False
snacks,Nestle,Coffee Crisp Minis Classic Chocolate Wafer Bars Pouch,NestleCoffee Crisp Minis Classic Chocolate Wafer Bars Pouch180 g,$5.99ea,,$3.33/ 100g,False
snacks,Oh Henry!, Chocolatey Full Size Candy Bar,Oh Henry! Chocolatey Full Size Candy Bar58 g,$1.79ea,,$3.09/ 100g,False
snacks,TRIDENT,Splash Strawberry Kiwi Gum,TRIDENTSplash Strawberry Kiwi Gum40 ea,$4.99ea,,$0.12/ 1ea,False
snacks,Leclerc,Celebration 45% Chocolate Butter Cake,LeclercCelebration 45% Chocolate Butter Cake240 g,$3.99ea,,$1.66/ 100g,False
snacks,,Unsalted Pistachios,Unsalted Pistachios200 g,$6.99ea,,$3.50/ 100g,False
snacks,Cracker Jack,Original Caramel Coated Popcorn and Peanuts 200g,Cracker JackOriginal Caramel Coated Popcorn and Peanuts 200g200 g,$5.49ea,,$2.75/ 100g,False
snacks,Hershey's,"Chocolate, Milk  with Almonds","Hershey'sChocolate, Milk  with Almonds100 g",$2.99ea,,$2.99/ 100g,False
snacks,Pringles,Cheddar & Sour Cream Flavour Potato Chips,PringlesCheddar & Sour Cream Flavour Potato Chips156 g,$3.29ea,,$2.11/ 100g,False
snacks,Lindt,SWISS CLASSIC Gold Milk Chocolate Bar,LindtSWISS CLASSIC Gold Milk Chocolate Bar300 g,$9.99ea,,$3.33/ 100g,False
snacks,Lindt,SWISS CLASSIC Gold Hazelnut Milk Chocolate Bar,LindtSWISS CLASSIC Gold Hazelnut Milk Chocolate Bar300 g,$9.99ea,,$3.33/ 100g,False
snacks,Nestle,Crunch Chocolate Bar,NestleCrunch Chocolate Bar100 g,$2.99ea,,$2.99/ 100g,False
snacks,Merci,"Milk Chocolate Bar, 100G   ","MerciMilk Chocolate Bar, 100G   100 g",$3.49ea,,$3.49/ 100g,False
snacks,Carnaby Sweet,Real Milk Chocolate Solid Eggs,Carnaby SweetReal Milk Chocolate Solid Eggs150 g,$1.99ea,,$1.33/ 100g,False
snacks,President's Choice,Loads Of Cheddar Cheese Crackers,President's ChoiceLoads Of Cheddar Cheese Crackers200 g,$3.79ea,,$1.90/ 100g,False
snacks,Kinder,Surprise Maxi,KinderSurprise Maxi150 g,$14.99ea,,$9.99/ 100g,False
snacks,President's Choice,Onion & Chives Swiss Sticks,President's ChoiceOnion & Chives Swiss Sticks100 g,$3.49ea,,$3.49/ 100g,False
snacks,President's Choice,The World's Best Shortbread Cookies,President's ChoiceThe World's Best Shortbread Cookies200 g,$4.99ea,,$2.50/ 100g,False
snacks,Kelloggs,"Nutri-Grain Cereal Bars, Mixed Berry 8 Bars","KelloggsNutri-Grain Cereal Bars, Mixed Berry 8 Bars295 g",$4.49ea,,$1.52/ 100g,False
snacks,President's Choice,Milk Chocolate with Almonds,President's ChoiceMilk Chocolate with Almonds100 g,$2.49ea,,$2.49/ 100g,False
snacks,Christie,Triscuit Cracked Pepper And Olive Oil Crackers,ChristieTriscuit Cracked Pepper And Olive Oil Crackers200 g,$3.99ea,,$2.00/ 100g,False
snacks,Merci,"Chocolate, Dark Orange-Almond  Bar, 100G  ","MerciChocolate, Dark Orange-Almond  Bar, 100G  100 g",$3.49ea,,$3.49/ 100g,False
snacks,President's Choice,"Milk Chocolate, Toasted Coconut","President's ChoiceMilk Chocolate, Toasted Coconut300 g",$5.99ea,,$2.00/ 100g,False
snacks,Orville,"Popcorn, Buttery Light","OrvillePopcorn, Buttery Light6x76.0 g",$3.99ea,,$0.88/ 100g,False
snacks,President's Choice,Peanut Free Apple Cereal Bars,President's ChoicePeanut Free Apple Cereal Bars300 g,$3.99ea,,$1.33/ 100g,False
snacks,Sunmaid,"Raisins, Mini Packs","SunmaidRaisins, Mini Packs196 g",$3.79ea,,$1.93/ 100g,False
snacks,PC Blue Menu," Butter Flavour Microwave Popcorn, Mini Bags","PC Blue Menu Butter Flavour Microwave Popcorn, Mini Bags8x32.0 g",$4.99ea,,$1.95/ 100g,False
snacks,Twigz,"Craft Pretzels, Buttery Herb and Garlic","TwigzCraft Pretzels, Buttery Herb and Garlic130 g",$4.99ea,,$3.84/ 100g,False
snacks,Snackpack,Butterscotch Pudding,SnackpackButterscotch Pudding4x99.0 g,$3.79ea,,$0.96/ 100g,False
snacks,President's Choice,World of Flavours Caramelized Cocoa Nibs and Coffee Dark Chocolate Dessert Bar,President's ChoiceWorld of Flavours Caramelized Cocoa Nibs and Coffee Dark Chocolate Dessert Bar100 g,$2.49ea,,$2.49/ 100g,False
snacks,Werther's,Original Creamy Caramel Filled Hard Candy,Werther'sOriginal Creamy Caramel Filled Hard Candy135 g,$3.49ea,,$2.59/ 100g,False
snacks,Pringles,Pizza Flavour Potato Chips,PringlesPizza Flavour Potato Chips156 g,$3.29ea,,$2.11/ 100g,False
snacks,President's Choice,Dry-Roasted Jumbo Pistachios,President's ChoiceDry-Roasted Jumbo Pistachios290 g,$9.99ea,,$3.44/ 100g,False
snacks,Reese's, Peanut Butter Cups Candy,Reese's Peanut Butter Cups Candy46 g,$1.79ea,,$3.89/ 100g,False
snacks,Pringles,Mega Can BBQ Flavour,PringlesMega Can BBQ Flavour202 g,$3.99ea,,$1.97/ 100g,False
snacks,Wrigley,"Polar Ice Flavoured Sugar Free Chewing Gum, 60 Pieces, 1 Bottle","WrigleyPolar Ice Flavoured Sugar Free Chewing Gum, 60 Pieces, 1 Bottle83 g",$4.99ea,,$6.01/ 100g,False
snacks,Martin's Family Fruit Farm,Nothin' But Apple Crispy Apple Chips,Martin's Family Fruit FarmNothin' But Apple Crispy Apple Chips85 g,$3.69ea,,$4.34/ 100g,False
snacks,Planters,Mixed Nuts Deluxe Salted   ,PlantersMixed Nuts Deluxe Salted   200 g,$7.49ea,,$3.75/ 100g,False
snacks,Mott's,"Fruitsations, Unsweetened Strawberry Kiwi","Mott'sFruitsations, Unsweetened Strawberry Kiwi6x111.0 g",$3.79ea,,$0.57/ 100g,False
snacks,Twizzler,Strawberry Twists Candy,TwizzlerStrawberry Twists Candy454 g,$3.99ea,,$0.88/ 100g,False
snacks,Merci,"Chocolate, Coffee & Cream Chocoalte Bar, 100G ","MerciChocolate, Coffee & Cream Chocoalte Bar, 100G 100 g",$3.49ea,,$3.49/ 100g,False
snacks,No Name,Original Trail Mix,No NameOriginal Trail Mix1 kg,$10.99ea,,$1.10/ 100g,False
snacks,Ruffles,Sour Cream 'n Onion Flavoured Potato Chips,RufflesSour Cream 'n Onion Flavoured Potato Chips200 g,$4.99ea,,$2.50/ 100g,False
snacks,Grissol,Melba Toast Original,GrissolMelba Toast Original200 g,$3.99ea,,$2.00/ 100g,False
snacks,President's Choice,Candy Coated Milk Chocolate Eggs,President's ChoiceCandy Coated Milk Chocolate Eggs200 g,$3.99ea,,$2.00/ 100g,False
snacks,Peek Freans,Fruit Creme Biscuits,Peek FreansFruit Creme Biscuits300 g,$4.99ea,,$1.66/ 100g,False
snacks,President's Choice,Milk Chocolate,President's ChoiceMilk Chocolate100 g,$2.49ea,,$2.49/ 100g,False
snacks,Maynards,Sour Patch Kids Grape Soft Candy,MaynardsSour Patch Kids Grape Soft Candy185 g,$2.99ea,,$1.62/ 100g,False
snacks,Oreo,Chocolate Sandwich Cookies Double Stuf,OreoChocolate Sandwich Cookies Double Stuf261 g,$3.99ea,,$1.53/ 100g,False
snacks,Cadbury,Smooth Chocolate Bar,CadburySmooth Chocolate Bar90 g,$5.99ea,,$6.66/ 100g,False
snacks,President's Choice,Garlic Crackers,President's ChoiceGarlic Crackers185 g,$3.79ea,,$2.05/ 100g,False
snacks,Hershey's,Reese'S Pieces With Caramel Flavoured Chocolate Candy,Hershey'sReese'S Pieces With Caramel Flavoured Chocolate Candy170 g,$5.99ea,,$3.52/ 100g,False
