category,brand,product_text,product_name,price_text,sale_price,per_unit_price_text,is_sale
dairy_and_eggs,MacLarens,Cheese Spread,MacLarensCheese Spread230 g,$8.99ea,,$3.91/ 100g,False
dairy_and_eggs,Activia,"Yogurt With Probiotics, Vanilla Flavouractose-Free","ActiviaYogurt With Probiotics, Vanilla Flavouractose-Free8x100.0 g",$6.69ea,,$0.84/ 100g,False
dairy_and_eggs,Baileys,French Vanilla,BaileysFrench Vanilla400 ml,$4.39ea,,$1.10/ 100ml,False
dairy_and_eggs,Neilson,"Homogenized Milk Microfiltered, 3.25% M.F.","NeilsonHomogenized Milk Microfiltered, 3.25% M.F.1 l",$3.79ea,,$0.38/ 100ml,False
dairy_and_eggs,No Name,Whipped Topping ,No NameWhipped Topping 225 g,$3.49ea,,$1.55/ 100g,False
dairy_and_eggs,Organic Meadow,"Organic Butter, Salted     ","Organic MeadowOrganic Butter, Salted     454 g",$11.99ea,,$2.64/ 100g,False
dairy_and_eggs,No Name,Mozzarella 100% Real Cheese Slices ,No NameMozzarella 100% Real Cheese Slices 230 g,$4.99ea,,$2.17/ 100g,False
dairy_and_eggs,Organic Meadow,"Organic Butter, Unsalted","Organic MeadowOrganic Butter, Unsalted454 g",$11.99ea,,$2.64/ 100g,False
dairy_and_eggs,Spread 'Em Kitchen Co.,The Meadow,Spread 'Em Kitchen Co.The Meadow200 g,$10.99ea,,$5.50/ 100g,False
dairy_and_eggs,Earth Balance,Soy Free Buttery Spread    ,Earth BalanceSoy Free Buttery Spread    425 g,$5.49ea,,$1.29/ 100g,False
dairy_and_eggs,Neilson,Skim Milk,NeilsonSkim Milk1 l,$3.59ea,,$0.36/ 100ml,False
dairy_and_eggs,President's Choice,Monterey Jack Cheese,President's ChoiceMonterey Jack Cheese400 g,$6.49ea,,$1.62/ 100g,False
dairy_and_eggs,PC Organics,"Organic Fresh Churned Butter, Unsalted","PC OrganicsOrganic Fresh Churned Butter, Unsalted250 g",$6.99ea,,$2.80/ 100g,False
dairy_and_eggs,Tre Stelle,Tre Stelle Organic Cream Cheese Spread,Tre StelleTre Stelle Organic Cream Cheese Spread200 g,$4.49ea,,$2.25/ 100g,False
dairy_and_eggs,Earth Island,Cheddar Cheese Slices,Earth IslandCheddar Cheese Slices200 g,$8.99ea,,$4.50/ 100g,False
dairy_and_eggs,Neilson,Chocolate Dairy Beverage 2% M.F.,NeilsonChocolate Dairy Beverage 2% M.F.1 l,$4.69ea,$3.29ea,$0.33/ 100ml,True
dairy_and_eggs,PC Organics,Organic Homogenized Milk,PC OrganicsOrganic Homogenized Milk4 l,$10.39ea,,$0.26/ 100ml,False
dairy_and_eggs,President's Choice,Smoke Flavoured Cheddar Cheese,President's ChoiceSmoke Flavoured Cheddar Cheese400 g,$6.49ea,,$1.62/ 100g,False
dairy_and_eggs,Neilson,Half & Half Cream,NeilsonHalf & Half Cream237 ml,$2.59ea,,$1.09/ 100ml,False
dairy_and_eggs,Neilson,"Cream, 18%","NeilsonCream, 18%473 ml",$4.79ea,,$1.01/ 100ml,False
dairy_and_eggs,The Greek Gods,"Yogurt, Vanille","The Greek GodsYogurt, Vanille500 g",$5.49ea,,$1.10/ 100g,False
dairy_and_eggs,Milk 2 Go,Chocolate Partly Skimmed Milk 1% M.F. 6 x,Milk 2 GoChocolate Partly Skimmed Milk 1% M.F. 6 x6x200.0 ml,$6.19ea,,$515.83/ 100ml,False
dairy_and_eggs,Burnbrae Farms,Eggs2go! 6 Hard Boiled Peeled Eggs,Burnbrae FarmsEggs2go! 6 Hard Boiled Peeled Eggs6 ea,$5.59ea,,$0.93/ 1ea,False
dairy_and_eggs,PC Blue Menu,Blue Menu Original Margarine,PC Blue MenuBlue Menu Original Margarine454 g,$4.79ea,,$1.06/ 100g,False
dairy_and_eggs,Black Diamond,Cheddar Coloured Old,Black DiamondCheddar Coloured Old400 g,$8.49ea,,$2.12/ 100g,False
dairy_and_eggs,Natrel,2% Lactose Free Chocolate Enriched Milk,Natrel2% Lactose Free Chocolate Enriched Milk2 l,$7.39ea,,$0.37/ 100ml,False
dairy_and_eggs,Saputo,Lactose Free Mozzarellissima,SaputoLactose Free Mozzarellissima500 g,$9.29ea,,$1.86/ 100g,False
dairy_and_eggs,Kraft,Grated Parmesan Cheese,KraftGrated Parmesan Cheese500 g,$15.99ea,,$3.20/ 100g,False
dairy_and_eggs,Spread 'Em Kitchen Co.,The Big Smoke,Spread 'Em Kitchen Co.The Big Smoke200 g,$10.99ea,,$5.50/ 100g,False
dairy_and_eggs,Oikos,"Greek Yogurtimited Edition, Vanilla Chai Flavour, 4X100G","OikosGreek Yogurtimited Edition, Vanilla Chai Flavour, 4X100G4x100.0 g",$4.79ea,,$1.20/ 100g,False
dairy_and_eggs,Yoplait,Lactose Free Mango,YoplaitLactose Free Mango200 ml,$1.69ea,,$0.85/ 100ml,False
dairy_and_eggs,Liberte,Kéfir Organic 1% MF Strawberry,LiberteKéfir Organic 1% MF Strawberry1000 g,$6.99ea,,$0.70/ 100g,False
dairy_and_eggs,No Name,Dill Pickle Sour Cream Dip,No NameDill Pickle Sour Cream Dip250 g,$3.79ea,,$1.52/ 100g,False
dairy_and_eggs,Gay Lea,"Sour Cream, Fat Free 1%","Gay LeaSour Cream, Fat Free 1%500 ml",$4.29ea,,$0.86/ 100ml,False
dairy_and_eggs,Philadelphia,Herb & Garlic Cream Cheese Product,PhiladelphiaHerb & Garlic Cream Cheese Product340 g,$7.99ea,,$2.35/ 100g,False
dairy_and_eggs,Becel,Margarine Original,BecelMargarine Original1.81 kg,$16.99ea,,$1.00/ 100g,False
dairy_and_eggs,Lactantia,"My Country Butter, Unsalted","LactantiaMy Country Butter, Unsalted454 g",$8.49ea,,$1.87/ 100g,False
dairy_and_eggs,President's Choice,Berries & Cherries Skyr Icelandic Style 0% M.F. Yogurt,President's ChoiceBerries & Cherries Skyr Icelandic Style 0% M.F. Yogurt500 g,$5.99ea,,$1.20/ 100g,False
dairy_and_eggs,Neilson,"Chocolate Milk, 25% Less Sugar","NeilsonChocolate Milk, 25% Less Sugar1 l",$3.59ea,,$0.36/ 100ml,False
dairy_and_eggs,Imperial,Soft Margarine Spread,ImperialSoft Margarine Spread427 g,$4.99ea,,$1.17/ 100g,False
dairy_and_eggs,Pillsbury,Holiday Premium Edition Cookies,PillsburyHoliday Premium Edition Cookies396 g,$4.49ea,,$1.13/ 100g,False
dairy_and_eggs,Lactantia,"Butter Sticks, Salted","LactantiaButter Sticks, Salted4x113.0 g",$8.99ea,$7.99ea,$1.77/ 100g,True
dairy_and_eggs,Riviera,"Vegan Yogurt, Vanilla Coconut","RivieraVegan Yogurt, Vanilla Coconut650 g",$7.49ea,,$1.15/ 100g,False
dairy_and_eggs,Pillsbury,Cut-Out Heart Cookies,PillsburyCut-Out Heart Cookies204 g,$4.49ea,,$2.20/ 100g,False
dairy_and_eggs,PC Organics,Organic Free-Range Brown Eggs,PC OrganicsOrganic Free-Range Brown Eggs12 eggs,$7.69ea,,$0.64/ 1ea,False
dairy_and_eggs,PC Blue Menu,Blue Menu Free Run Large White Eggs 12 Pack,PC Blue MenuBlue Menu Free Run Large White Eggs 12 Pack12 ea,$7.09ea,,$0.59/ 1ea,False
dairy_and_eggs,Black Diamond,Cheddar Coloured Old,Black DiamondCheddar Coloured Old400 g,$8.49ea,,$2.12/ 100g,False
dairy_and_eggs,Kiri,Cream Cheese,KiriCream Cheese144 g,$3.99ea,,$2.77/ 100g,False
dairy_and_eggs,Oikos,"Greek Yogurt, Variety Pack, Raspberry-Pomegranate / Key Lime / Vanilla / Strawberry Banana, Blended 2% M.F.","OikosGreek Yogurt, Variety Pack, Raspberry-Pomegranate / Key Lime / Vanilla / Strawberry Banana, Blended 2% M.F.12x100.0 g",$10.99ea,,$0.92/ 100g,False
dairy_and_eggs,Kraft,Grated Parmesan Cheese,KraftGrated Parmesan Cheese500 g,$15.99ea,,$3.20/ 100g,False
dairy_and_eggs,Neilson,TruTaste Lactose Free 2% Milk,NeilsonTruTaste Lactose Free 2% Milk4 l,$10.79ea,,$0.27/ 100ml,False
dairy_and_eggs,Heluva,"Sour Cream Dip, Dill Pickle","HeluvaSour Cream Dip, Dill Pickle250 g",$4.49ea,,$1.80/ 100g,False
dairy_and_eggs,No Name,Stringable Cheese Marble,No NameStringable Cheese Marble336 g,$6.79ea,,$2.02/ 100g,False
dairy_and_eggs,Gay Lea,Lactose Free Sour Cream,Gay LeaLactose Free Sour Cream450 ml,$4.29ea,,$0.95/ 100ml,False
dairy_and_eggs,Imperial,Soft Margarine Spread,ImperialSoft Margarine Spread850 g,$8.79ea,$7.99ea,$0.94/ 100g,True
dairy_and_eggs,IOGO,"Yogurt Duo, Pineapple-Coconut-Banana, Raspberry, Orange-Mandarin, Peach-Mango","IOGOYogurt Duo, Pineapple-Coconut-Banana, Raspberry, Orange-Mandarin, Peach-Mango16x100.0 g",$8.99ea,,$0.56/ 100g,False
dairy_and_eggs,No Name,Dill Pickle Sour Cream Dip,No NameDill Pickle Sour Cream Dip250 g,$3.79ea,,$1.52/ 100g,False
dairy_and_eggs,PC Blue Menu,Blue Menu Original Margarine,PC Blue MenuBlue Menu Original Margarine454 g,$4.79ea,,$1.06/ 100g,False
dairy_and_eggs,Lactantia,Partly Skimmed Milk Organic 1% M.F.,LactantiaPartly Skimmed Milk Organic 1% M.F.1.5 l,$5.74ea,,$0.38/ 100ml,False
dairy_and_eggs,Lactantia,Whole Milk Organic 3.8% M.F.,LactantiaWhole Milk Organic 3.8% M.F.1.5 l,$5.74ea,,$0.38/ 100ml,False
dairy_and_eggs,Lactantia,"Butter Sticks, Salted","LactantiaButter Sticks, Salted4x113.0 g",$8.99ea,$7.99ea,$1.77/ 100g,True
dairy_and_eggs,Pillsbury,Grands Cinnamon Rolls Regular   ,PillsburyGrands Cinnamon Rolls Regular   496 g,$5.29ea,,$1.07/ 100g,False
dairy_and_eggs,President's Choice,Black Cherry Skyr Icelandic Style 4% M.F. Yogurt,President's ChoiceBlack Cherry Skyr Icelandic Style 4% M.F. Yogurt500 g,$5.99ea,,$1.20/ 100g,False
dairy_and_eggs,No Name,2% M.F. Cottage Cheese ,No Name2% M.F. Cottage Cheese 750 g,$5.99ea,,$0.80/ 100g,False
dairy_and_eggs,No Name,Herb and Spice Sour Cream Dip,No NameHerb and Spice Sour Cream Dip250 g,$3.79ea,,$1.52/ 100g,False
dairy_and_eggs,Riviera,"Vegan Yogurt, Vanilla Coconut","RivieraVegan Yogurt, Vanilla Coconut650 g",$7.49ea,,$1.15/ 100g,False
dairy_and_eggs,Pillsbury,Cut-Out Heart Cookies,PillsburyCut-Out Heart Cookies204 g,$4.49ea,,$2.20/ 100g,False
dairy_and_eggs,PC Organics,Organic Free-Range Brown Eggs,PC OrganicsOrganic Free-Range Brown Eggs12 eggs,$7.69ea,,$0.64/ 1ea,False
dairy_and_eggs,PC Blue Menu,Blue Menu Free Run Large White Eggs 12 Pack,PC Blue MenuBlue Menu Free Run Large White Eggs 12 Pack12 ea,$7.09ea,,$0.59/ 1ea,False
dairy_and_eggs,No Name, Light Cottage Cheese,No Name Light Cottage Cheese250 g,$3.29ea,,$1.32/ 100g,False
dairy_and_eggs,No Name,Shredded Mozzarella Cheese,No NameShredded Mozzarella Cheese900 g,$14.99ea,,$1.67/ 100g,False
dairy_and_eggs,No Name,Pasteurized Light Cream Cheese Spread,No NamePasteurized Light Cream Cheese Spread250 g,$3.79ea,,$1.52/ 100g,False
dairy_and_eggs,Danone,"Drinkable Yogurt, Peach Flavour, Made With Real Fruit, 2% M.F.","DanoneDrinkable Yogurt, Peach Flavour, Made With Real Fruit, 2% M.F.190 ml",$1.29ea,,$0.68/ 100ml,False
dairy_and_eggs,President's Choice,Parmesan Shredded Cheese,President's ChoiceParmesan Shredded Cheese250 g,$6.49ea,,$2.60/ 100g,False
dairy_and_eggs,Oikos,"Greek Yogurtimited Edition, Vanilla Chai Flavour, 4X100G","OikosGreek Yogurtimited Edition, Vanilla Chai Flavour, 4X100G4x100.0 g",$4.79ea,,$1.20/ 100g,False
dairy_and_eggs,Gay Lea,"Sour Cream, Fat Free 1%","Gay LeaSour Cream, Fat Free 1%500 ml",$4.29ea,,$0.86/ 100ml,False
dairy_and_eggs,Activia,"Yogurt With Probiotics, Strawberry, Raspberry, Vanilla, Blueberry Flavour, 24XG","ActiviaYogurt With Probiotics, Strawberry, Raspberry, Vanilla, Blueberry Flavour, 24XG24x100.0 g",$13.99ea,,$0.58/ 100g,False
dairy_and_eggs,Yoplait,Lactose Free Mango,YoplaitLactose Free Mango200 ml,$1.69ea,,$0.85/ 100ml,False
dairy_and_eggs,Neilson,Table Cream,NeilsonTable Cream1 l,$7.19ea,,$0.72/ 100ml,False
dairy_and_eggs,Neilson,TruTaste 2% Milk,NeilsonTruTaste 2% Milk1 l,$4.19ea,,$0.42/ 100ml,False
dairy_and_eggs,Organic Meadow,10% Half & Half Organic Cream,Organic Meadow10% Half & Half Organic Cream500 ml,$4.29ea,,$0.86/ 100ml,False
dairy_and_eggs,Neilson,Trutaste Homogenized Milk,NeilsonTrutaste Homogenized Milk4 l,$7.89ea,,$0.20/ 100ml,False
dairy_and_eggs,Neilson,Trutaste Lactose Free Skim Milk,NeilsonTrutaste Lactose Free Skim Milk1 l,$4.59ea,,$0.46/ 100ml,False
dairy_and_eggs,Silk,"For Coffee, Hazelnut Flavour, Dairy Free Coffee Creamer","SilkFor Coffee, Hazelnut Flavour, Dairy Free Coffee Creamer473 ml",$2.99ea,,$0.63/ 100ml,False
dairy_and_eggs,Pillsbury,Chub Chocolate Chunk Cookie   ,PillsburyChub Chocolate Chunk Cookie   468 g,$4.49ea,,$0.96/ 100g,False
dairy_and_eggs,PC Organics,"Organic Cheese, Medium Cheddar","PC OrganicsOrganic Cheese, Medium Cheddar200 g",$6.49ea,,$3.25/ 100g,False
dairy_and_eggs,Activia,"Yogurt With Probiotics, Vanilla Flavour, 100G","ActiviaYogurt With Probiotics, Vanilla Flavour, 100G8x100.0 g",$6.69ea,,$0.84/ 100g,False
dairy_and_eggs,Nestle,Coffee Mate Liquid French Vanilla,NestleCoffee Mate Liquid French Vanilla946 ml,$6.49ea,,$0.69/ 100ml,False
dairy_and_eggs,PC Organics,Organic Partly Skimmed 1% Milk,PC OrganicsOrganic Partly Skimmed 1% Milk2 l,$6.89ea,,$0.34/ 100ml,False
dairy_and_eggs,PC Organics,"Organic Cheese, Marble Cheddar","PC OrganicsOrganic Cheese, Marble Cheddar200 g",$6.49ea,,$3.25/ 100g,False
dairy_and_eggs,Danone,Strawberry Flavoured Paw Patrol Yogurt Drink For Kids,DanoneStrawberry Flavoured Paw Patrol Yogurt Drink For Kids8x93.0 ml,$5.99ea,,$0.81/ 100ml,False
dairy_and_eggs,President's Choice,Lactose Free Old Yellow Cheddar Cheese,President's ChoiceLactose Free Old Yellow Cheddar Cheese400 g,$6.49ea,,$1.62/ 100g,False
dairy_and_eggs,President's Choice,Butter Puff Pastry,President's ChoiceButter Puff Pastry450 g,$6.49ea,,$1.44/ 100g,False
dairy_and_eggs,Natrel,Lactose Free Fat Free Skim 0% Dairy Product (2L),NatrelLactose Free Fat Free Skim 0% Dairy Product (2L)2 l,$7.09ea,,$0.35/ 100ml,False
dairy_and_eggs,President's Choice,Lactose Free Old Yellow Cheddar Cheese,President's ChoiceLactose Free Old Yellow Cheddar Cheese400 g,$6.49ea,,$1.62/ 100g,False
dairy_and_eggs,President's Choice,Butter Puff Pastry,President's ChoiceButter Puff Pastry450 g,$6.49ea,,$1.44/ 100g,False
dairy_and_eggs,Natrel,Lactose Free Fat Free Skim 0% Dairy Product (2L),NatrelLactose Free Fat Free Skim 0% Dairy Product (2L)2 l,$7.09ea,,$0.35/ 100ml,False
dairy_and_eggs,Starbucks,Almond And Oat Dairy Free Caramel Macchiato Coffee Enhancer,StarbucksAlmond And Oat Dairy Free Caramel Macchiato Coffee Enhancer828 ml,$7.99ea,,$0.96/ 100ml,False
dairy_and_eggs,Yoso,"Cultured Coconut Yogurt, Unsweetened","YosoCultured Coconut Yogurt, Unsweetened440 g",$6.49ea,,$1.48/ 100g,False
dairy_and_eggs,IOGO,Nano Yogurt Vanilla,IOGONano Yogurt Vanilla900 ml,$5.99ea,,$0.67/ 100ml,False
dairy_and_eggs,Neilson,Ultrafiltered Milk 3.25% M.F.,NeilsonUltrafiltered Milk 3.25% M.F.1 l,$4.69ea,$3.29ea,$0.33/ 100ml,True
dairy_and_eggs,Danone,"Drinkable Yogurt, Strawberry Banana Flavour, Made With Real Fruit, 2% M.F.","DanoneDrinkable Yogurt, Strawberry Banana Flavour, Made With Real Fruit, 2% M.F.190 ml",$1.29ea,,$0.68/ 100ml,False
dairy_and_eggs,Beatrice,Protein Milk Chocolate,BeatriceProtein Milk Chocolate460 ml,$3.49ea,,$0.76/ 100ml,False
dairy_and_eggs,Silk,"Oat Yogurt Style, Plainluten Free, Vegan","SilkOat Yogurt Style, Plainluten Free, Vegan640 g",$7.49ea,,$1.17/ 100g,False
dairy_and_eggs,Activia,"Probiotic Yogurt, 4X Blueberry, 4X Strawberry & Rhubarb, 8 Pack","ActiviaProbiotic Yogurt, 4X Blueberry, 4X Strawberry & Rhubarb, 8 Pack8x100.0 g",$6.69ea,,$0.84/ 100g,False
dairy_and_eggs,Philadelphia,Light Cream Cheese,PhiladelphiaLight Cream Cheese450 g,$9.49ea,,$2.11/ 100g,False
dairy_and_eggs,Armstrong,"Cheese, Sliced Cheddar with Jalapeño Mexican Fiesta 31 % M.F.","ArmstrongCheese, Sliced Cheddar with Jalapeño Mexican Fiesta 31 % M.F.220 g",$6.49ea,,$2.95/ 100g,False
dairy_and_eggs,Gay Lea,"Real Whipped Cream, Light","Gay LeaReal Whipped Cream, Light225 g",$4.49ea,,$2.00/ 100g,False
dairy_and_eggs,Organic Meadow,"Whipping Cream, 35%","Organic MeadowWhipping Cream, 35%500 ml",$7.29ea,,$1.46/ 100ml,False
dairy_and_eggs,The A2 Milk Company,3.25% M.F. Homogenized Milk,The A2 Milk Company3.25% M.F. Homogenized Milk2 l,$6.69ea,,$0.33/ 100ml,False
dairy_and_eggs,International Delight,Irish Creme Coffee Creamer,International DelightIrish Creme Coffee Creamer946 ml,$5.99ea,,$0.63/ 100ml,False
dairy_and_eggs,Neilson,TruTaste 1% Milk,NeilsonTruTaste 1% Milk1 l,$4.19ea,,$0.42/ 100ml,False
dairy_and_eggs,International Delight,"French Vanilla Flavoured Fat Free Coffee Creamer, 63 Servings","International DelightFrench Vanilla Flavoured Fat Free Coffee Creamer, 63 Servings946 ml",$5.99ea,,$0.63/ 100ml,False
dairy_and_eggs,Liberte,"Goat Milk, 2%","LiberteGoat Milk, 2%1 l",$5.49ea,,$0.55/ 100ml,False
dairy_and_eggs,Milk 2 Go,Chocolate,Milk 2 GoChocolate473 ml,$2.79ea,$1.79ea,$0.38/ 100ml,True
dairy_and_eggs,Imperial,Margarine Club Pack,ImperialMargarine Club Pack1.36 kg,$8.99ea,,$0.71/ 100g,False
dairy_and_eggs,No Name,Deep Dish Pie Shells,No NameDeep Dish Pie Shells380 g,$4.29ea,,$1.13/ 100g,False
dairy_and_eggs,IOGO,1% Lactose Free Strawberry-Banana Drinkable Yogurt,IOGO1% Lactose Free Strawberry-Banana Drinkable Yogurt6x93.0 ml,$4.99ea,,$0.89/ 100g,False
dairy_and_eggs,Woolwich,Goat Dairy Marble Goat Cheddar Cheese 31 % M.F.,WoolwichGoat Dairy Marble Goat Cheddar Cheese 31 % M.F.200 g,$8.99ea,,$4.50/ 100g,False
dairy_and_eggs,PC Organics,Organic Partly Skimmed 2% Milk,PC OrganicsOrganic Partly Skimmed 2% Milk2 l,$6.89ea,,$0.34/ 100ml,False
dairy_and_eggs,PC Organics,Organic Partly Skimmed 2% Milk,PC OrganicsOrganic Partly Skimmed 2% Milk4 l,$10.39ea,,$0.26/ 100ml,False
dairy_and_eggs,Neilson,Trutaste Lactose Free Cream Half & Half 10% M.F.,NeilsonTrutaste Lactose Free Cream Half & Half 10% M.F.1 l,$4.89ea,,$0.49/ 100ml,False
dairy_and_eggs,President's Choice,Plain Kefir Probiotic Fermented 1% M.F. Milk,President's ChoicePlain Kefir Probiotic Fermented 1% M.F. Milk1 l,$4.99ea,,$0.50/ 100ml,False
dairy_and_eggs,President's Choice,Lactose Free Marble Cheddar ,President's ChoiceLactose Free Marble Cheddar 400 g,$6.49ea,,$1.62/ 100g,False
dairy_and_eggs,Philadelphia,Smoked Salmon Cream Cheese Product,PhiladelphiaSmoked Salmon Cream Cheese Product227 g,$5.49ea,,$2.42/ 100g,False
dairy_and_eggs,Neilson,TruTaste Homogenized Milk,NeilsonTruTaste Homogenized Milk2 l,$6.19ea,,$0.31/ 100ml,False
dairy_and_eggs,Neilson,Strawberry Milkshake,NeilsonStrawberry Milkshake310 ml,$1.00ea,,$0.32/ 100ml,False
dairy_and_eggs,No Name,Farmer's Marble Cheese ,No NameFarmer's Marble Cheese 200 g,$4.29ea,,$2.15/ 100g,False
dairy_and_eggs,President's Choice,Monterey Jack Cheese With Jalapeño,President's ChoiceMonterey Jack Cheese With Jalapeño400 g,$6.49ea,,$1.62/ 100g,False
dairy_and_eggs,Neilson,1% Partly Skimmed Milk,Neilson1% Partly Skimmed Milk2 l,$5.19ea,,$0.26/ 100ml,False
dairy_and_eggs,No Name,Mild Cheddar Cheese,No NameMild Cheddar Cheese400 g,$5.99ea,,$1.50/ 100g,False
dairy_and_eggs,Neilson,"Flavoured Milk, Chocolate","NeilsonFlavoured Milk, Chocolate4 l",$8.19ea,,$0.20/ 100ml,False
dairy_and_eggs,Woolwich,Partially Skimmed Goat Milk 2%,WoolwichPartially Skimmed Goat Milk 2%1 l,$4.59ea,,$0.46/ 100ml,False
dairy_and_eggs,Pillsbury,Country Biscuits,PillsburyCountry Biscuits340 g,$4.49ea,,$1.32/ 100g,False
dairy_and_eggs,Activia,Yogurt With Probioticsemon Pineapple Flavour,ActiviaYogurt With Probioticsemon Pineapple Flavour8x100.0 g,$6.69ea,,$0.84/ 100g,False
dairy_and_eggs,Pillsbury,Crescents Flaky Rolls,PillsburyCrescents Flaky Rolls340 g,$4.49ea,,$1.32/ 100g,False
dairy_and_eggs,Philadelphia,Light Herb & Garlic Cream Cheese,PhiladelphiaLight Herb & Garlic Cream Cheese227 g,$5.49ea,,$2.42/ 100g,False
dairy_and_eggs,Pillsbury,"Wiener Wrap, Regular","PillsburyWiener Wrap, Regular200 g",$3.19ea,,$1.60/ 100g,False
dairy_and_eggs,Yoplait,Yop Drinkable Yogurt Strawberry Flavour ,YoplaitYop Drinkable Yogurt Strawberry Flavour 200 ml,$1.69ea,,$0.85/ 100ml,False
dairy_and_eggs,Philadelphia,Original Cream Cheese Product,PhiladelphiaOriginal Cream Cheese Product450 g,$9.49ea,,$2.11/ 100g,False
dairy_and_eggs,International Delight,Caramel Macchiato,International DelightCaramel Macchiato946 ml,$5.99ea,,$0.63/ 100ml,False
dairy_and_eggs,Pillsbury,Flaky Real Apple Turnovers,PillsburyFlaky Real Apple Turnovers383 g,$4.49ea,,$1.17/ 100g,False
dairy_and_eggs,Riviera,Coconut Milk Vegan Yogurt - Raspberry Blackcurrant,RivieraCoconut Milk Vegan Yogurt - Raspberry Blackcurrant500 g,$7.49ea,,$1.50/ 100g,False
dairy_and_eggs,Black Diamond,Lactose Free Sliced Marble Cheese ,Black DiamondLactose Free Sliced Marble Cheese 220 g,$5.99ea,,$2.72/ 100g,False
dairy_and_eggs,No Name,Everything Bagel Seasoning Sour Cream Dip,No NameEverything Bagel Seasoning Sour Cream Dip250 g,$3.79ea,,$1.52/ 100g,False
dairy_and_eggs,Becel,Unsalted Plant-Based Margarine Bricks,BecelUnsalted Plant-Based Margarine Bricks454 g,$5.99ea,,$1.32/ 100g,False
dairy_and_eggs,Yoplait,Vanilla Yogurt,YoplaitVanilla Yogurt200 ml,$1.69ea,,$0.85/ 100ml,False
dairy_and_eggs,President's Choice,Plain Kefir Probiotic Fermented 1% M.F. Milk,President's ChoicePlain Kefir Probiotic Fermented 1% M.F. Milk1 l,$4.99ea,,$0.50/ 100ml,False
dairy_and_eggs,President's Choice,Lactose Free Marble Cheddar ,President's ChoiceLactose Free Marble Cheddar 400 g,$6.49ea,,$1.62/ 100g,False
dairy_and_eggs,Philadelphia,Smoked Salmon Cream Cheese Product,PhiladelphiaSmoked Salmon Cream Cheese Product227 g,$5.49ea,,$2.42/ 100g,False
dairy_and_eggs,Neilson,TruTaste Homogenized Milk,NeilsonTruTaste Homogenized Milk2 l,$6.19ea,,$0.31/ 100ml,False
dairy_and_eggs,Neilson,Strawberry Milkshake,NeilsonStrawberry Milkshake310 ml,$1.00ea,,$0.32/ 100ml,False
dairy_and_eggs,No Name,Farmer's Marble Cheese ,No NameFarmer's Marble Cheese 200 g,$4.29ea,,$2.15/ 100g,False
dairy_and_eggs,President's Choice,Monterey Jack Cheese With Jalapeño,President's ChoiceMonterey Jack Cheese With Jalapeño400 g,$6.49ea,,$1.62/ 100g,False
dairy_and_eggs,Neilson,1% Partly Skimmed Milk,Neilson1% Partly Skimmed Milk2 l,$5.19ea,,$0.26/ 100ml,False
dairy_and_eggs,No Name,Mild Cheddar Cheese,No NameMild Cheddar Cheese400 g,$5.99ea,,$1.50/ 100g,False
dairy_and_eggs,Neilson,"Flavoured Milk, Chocolate","NeilsonFlavoured Milk, Chocolate4 l",$8.19ea,,$0.20/ 100ml,False
dairy_and_eggs,Woolwich,Partially Skimmed Goat Milk 2%,WoolwichPartially Skimmed Goat Milk 2%1 l,$4.59ea,,$0.46/ 100ml,False
dairy_and_eggs,Pillsbury,Country Biscuits,PillsburyCountry Biscuits340 g,$4.49ea,,$1.32/ 100g,False
dairy_and_eggs,Activia,Yogurt With Probioticsemon Pineapple Flavour,ActiviaYogurt With Probioticsemon Pineapple Flavour8x100.0 g,$6.69ea,,$0.84/ 100g,False
dairy_and_eggs,Pillsbury,Crescents Flaky Rolls,PillsburyCrescents Flaky Rolls340 g,$4.49ea,,$1.32/ 100g,False
dairy_and_eggs,Philadelphia,Light Herb & Garlic Cream Cheese,PhiladelphiaLight Herb & Garlic Cream Cheese227 g,$5.49ea,,$2.42/ 100g,False
dairy_and_eggs,Pillsbury,"Wiener Wrap, Regular","PillsburyWiener Wrap, Regular200 g",$3.19ea,,$1.60/ 100g,False
dairy_and_eggs,Yoplait,Yop Drinkable Yogurt Strawberry Flavour ,YoplaitYop Drinkable Yogurt Strawberry Flavour 200 ml,$1.69ea,,$0.85/ 100ml,False
dairy_and_eggs,Philadelphia,Original Cream Cheese Product,PhiladelphiaOriginal Cream Cheese Product450 g,$9.49ea,,$2.11/ 100g,False
dairy_and_eggs,International Delight,Caramel Macchiato,International DelightCaramel Macchiato946 ml,$5.99ea,,$0.63/ 100ml,False
dairy_and_eggs,Pillsbury,Flaky Real Apple Turnovers,PillsburyFlaky Real Apple Turnovers383 g,$4.49ea,,$1.17/ 100g,False
dairy_and_eggs,Oikos,"Greek Yogurt, Key Lime Flavour, 2% M.F., Blended","OikosGreek Yogurt, Key Lime Flavour, 2% M.F., Blended4x100.0 g",$4.79ea,,$1.20/ 100g,False
dairy_and_eggs,Pillsbury,Grands! Crescents,PillsburyGrands! Crescents318 g,$4.49ea,,$1.41/ 100g,False
dairy_and_eggs,Kraft,Singles Original Slices,KraftSingles Original Slices825 g,$10.99ea,,$1.33/ 100g,False
dairy_and_eggs,Vegenaise,Original,VegenaiseOriginal473 ml,$6.99ea,,$1.48/ 100ml,False
dairy_and_eggs,Earth Balance,Original Buttery Spread,Earth BalanceOriginal Buttery Spread425 g,$5.49ea,,$1.29/ 100g,False
dairy_and_eggs,Neilson,2% Milk,Neilson2% Milk2 l,$5.19ea,,$0.26/ 100ml,False
dairy_and_eggs,Silk,"Coconut Yogurt Style, Raspberry Flavour, Plant Based Dairy Free Yogurt","SilkCoconut Yogurt Style, Raspberry Flavour, Plant Based Dairy Free Yogurt680 g",$7.49ea,,$1.10/ 100g,False
dairy_and_eggs,PC Organics,Organic Fresh Skim Milk,PC OrganicsOrganic Fresh Skim Milk2 l,$6.89ea,,$0.34/ 100ml,False
dairy_and_eggs,Kraft,Shredded Parmesan Cheese,KraftShredded Parmesan Cheese200 g,$9.49ea,,$4.75/ 100g,False
dairy_and_eggs,Oikos,"Drinkable Greek Yogurt With Field Berries, Oats, & Seeds, 9G Protein","OikosDrinkable Greek Yogurt With Field Berries, Oats, & Seeds, 9G Protein190 ml",$2.29ea,,$1.21/ 100ml,False
dairy_and_eggs,No Name,Pie Shells,No NamePie Shells350 g,$4.29ea,,$1.23/ 100g,False
dairy_and_eggs,PC Organics,Dairy-Free Coconut Milk Kefir,PC OrganicsDairy-Free Coconut Milk Kefir1000 ml,$5.49ea,,$0.55/ 100ml,False
dairy_and_eggs,Kraft,Shaved Parmesan Cheese,KraftShaved Parmesan Cheese141 g,$7.99ea,,$5.67/ 100g,False
dairy_and_eggs,Black Diamond,Old Cheddar Cheese + Sea-Salted Roasted Cashews & Cherry Infused Dried Cranberries,Black DiamondOld Cheddar Cheese + Sea-Salted Roasted Cashews & Cherry Infused Dried Cranberries127.6 g,$5.79ea,,$4.54/ 100g,False
dairy_and_eggs,Philadelphia,Herb & Garlic Cream Cheese Product,PhiladelphiaHerb & Garlic Cream Cheese Product227 g,$5.49ea,,$2.42/ 100g,False
dairy_and_eggs,President's Choice,Lactose Free Plain Cream Cheese ,President's ChoiceLactose Free Plain Cream Cheese 250 g,$4.29ea,,$1.72/ 100g,False
dairy_and_eggs,Violife,Mature Cheddar Style Slices,ViolifeMature Cheddar Style Slices200 g,$6.99ea,$6.49ea,$3.25/ 100g,True
dairy_and_eggs,President's Choice,Tex Mex Shredded Cheese Blend,President's ChoiceTex Mex Shredded Cheese Blend320 g,$6.49ea,,$2.03/ 100g,False
dairy_and_eggs,Becel,Margarine Original,BecelMargarine Original427 g,$5.49ea,$4.99ea,$1.17/ 100g,True
dairy_and_eggs,Pillsbury,Reese Cookie Dough,PillsburyReese Cookie Dough454 g,$5.29ea,,$1.17/ 100g,False
dairy_and_eggs,No Name,Original Cream Cheese Spread ,No NameOriginal Cream Cheese Spread 340 g,$5.49ea,,$1.61/ 100g,False
dairy_and_eggs,I Can't Believe it's Not,Margarine Spread,I Can't Believe it's NotMargarine Spread454 g,$4.29ea,,$1.00/ 100g,False
dairy_and_eggs,Yummy Doh,Raw Cookie Dough Chocolate Chunk,Yummy DohRaw Cookie Dough Chocolate Chunk400 g,$6.49ea,,$1.62/ 100g,False
dairy_and_eggs,Organic Meadow,"Organic Cheese, Medium Cheddar","Organic MeadowOrganic Cheese, Medium Cheddar340 g",$12.99ea,,$3.82/ 100g,False
dairy_and_eggs,Spread 'Em Kitchen Co.,The Classic Greek Inspired Cashew Cheeze Block,Spread 'Em Kitchen Co.The Classic Greek Inspired Cashew Cheeze Block200 g,$10.99ea,,$5.50/ 100g,False
dairy_and_eggs,President's Choice,Marble Cheddar Cheese,President's ChoiceMarble Cheddar Cheese400 g,$6.49ea,,$1.62/ 100g,False
dairy_and_eggs,International Delight,"White Chocolate Mocha, Zero Sugar Coffee Creamer, Limited Edition","International DelightWhite Chocolate Mocha, Zero Sugar Coffee Creamer, Limited Edition946 ml",$5.99ea,,$0.63/ 100ml,False
