category,brand,product_text,product_name,price_text,sale_price,per_unit_price_text,is_sale,sale_valid_to
dairy_and_eggs,No Name,Large Grade A Eggs,No NameLarge Grade A Eggs12 eggs,$4.09ea,,$0.34/ 1ea,False,
dairy_and_eggs,No Name,"White Large Eggs, 30 Pack ","No NameWhite Large Eggs, 30 Pack 30 ea",$9.49ea,,$0.32/ 1ea,False,
dairy_and_eggs,No Name,Sour Cream 14%,No NameSour Cream 14%500 ml,$3.99ea,,$0.80/ 100ml,False,
dairy_and_eggs,Gray Ridge,Premium Large Eggs,Gray RidgePremium Large Eggs18 eggs,$6.89ea,,$0.38/ 1ea,False,
dairy_and_eggs,President's Choice,Free Run Brown Eggs Large,President's ChoiceFree Run Brown Eggs Large12 eggs,$6.79ea,,$0.57/ 1ea,False,
dairy_and_eggs,No Name,Grade A Extra Large Eggs,No NameGrade A Extra Large Eggs12 eggs,$4.39ea,,$0.37/ 1ea,False,
dairy_and_eggs,Gay Lea,"Sour Cream, Regular 14%","Gay LeaSour Cream, Regular 14%500 ml",$4.49ea,,$0.90/ 100ml,False,
dairy_and_eggs,No Name,Pasteurized Cream Cheese,No NamePasteurized Cream Cheese250 g,$3.99ea,,$1.60/ 100g,False,
dairy_and_eggs,Neilson,"Flavoured Milk, Chocolate","NeilsonFlavoured Milk, Chocolate1 l",$3.59ea,,$0.36/ 100ml,False,
dairy_and_eggs,Astro,Original Balkan Balkan Style Yogurt,AstroOriginal Balkan Balkan Style Yogurt750 g,$4.99ea,,$0.67/ 100g,False,
dairy_and_eggs,No Name,Farmer's Marble Cheese,No NameFarmer's Marble Cheese700 g,$9.79ea,$8.99ea,$1.28/ 100g,True,saleEnds 03/01
dairy_and_eggs,Activia,"Yogurt With Probiotics, Vanilla Flavour","ActiviaYogurt With Probiotics, Vanilla Flavour650 g",$4.79ea,$3.99ea,$0.61/ 100g,True,saleEnds 03/15
dairy_and_eggs,IOGO,"Nano Drinkable Yogurt, Strawberry","IOGONano Drinkable Yogurt, Strawberry6x93.0 ml",$4.99ea,,$0.89/ 100ml,False,
dairy_and_eggs,Neilson,"True Taste, 2% Milk","NeilsonTrue Taste, 2% Milk2 l",$5.69ea,,$0.28/ 100ml,False,
dairy_and_eggs,Kraft,Singles Original Slices,KraftSingles Original Slices410 g,$6.29ea,,$1.53/ 100g,False,
dairy_and_eggs,Neilson,TruTaste 1% Milk,NeilsonTruTaste 1% Milk4 l,$6.99ea,,$0.17/ 100ml,False,
dairy_and_eggs,No Name,Farmer's Marble Cheese,No NameFarmer's Marble Cheese400 g,$5.99ea,,$1.50/ 100g,False,
dairy_and_eggs,No Name,Shredded Mozzarella,No NameShredded Mozzarella320 g,$5.99ea,,$1.87/ 100g,False,
dairy_and_eggs,No Name,Marble Cheddar Cheese Slices,No NameMarble Cheddar Cheese Slices230 g,$5.49ea,,$2.39/ 100g,False,
dairy_and_eggs,I Can't Believe it's Not,Margarine Spread,I Can't Believe it's NotMargarine Spread454 g,$4.29ea,,$1.00/ 100g,False,
dairy_and_eggs,Heluva,"Sour Cream Dip, French Onion","HeluvaSour Cream Dip, French Onion250 g",$4.49ea,,$1.80/ 100g,False,
dairy_and_eggs,President's Choice,Triple Cheddar Shredded Cheese Blend,President's ChoiceTriple Cheddar Shredded Cheese Blend320 g,$6.49ea,,$2.03/ 100g,False,
dairy_and_eggs,Becel,Margarine Original,BecelMargarine Original427 g,$5.49ea,,$1.29/ 100g,False,
dairy_and_eggs,No Name,Old Cheddar Cheese,No NameOld Cheddar Cheese700 g,$9.79ea,$8.99ea,$1.28/ 100g,True,saleEnds 03/01
dairy_and_eggs,No Name,Shredded Nacho Cheese Blend,No NameShredded Nacho Cheese Blend320 g,$5.99ea,,$1.87/ 100g,False,
dairy_and_eggs,Neilson,Whipping Cream,NeilsonWhipping Cream473 ml,$3.99ea,$3.49ea,$0.74/ 100ml,True,saleEnds 03/01
dairy_and_eggs,Becel,Margarine with Avocado Oil,BecelMargarine with Avocado Oil850 g,$9.29ea,,$1.09/ 100g,False,
dairy_and_eggs,Philadelphia,Onion Dip,PhiladelphiaOnion Dip340 g,$7.99ea,,$2.35/ 100g,False,
dairy_and_eggs,Gay Lea,"Butter Sticks, Salted","Gay LeaButter Sticks, Salted454 g",$8.99ea,,$1.98/ 100g,False,
dairy_and_eggs,Philadelphia,Whipped Jalapeno Cheddar Cream Cheese Product,PhiladelphiaWhipped Jalapeno Cheddar Cream Cheese Product227 g,$5.49ea,,$2.42/ 100g,False,
dairy_and_eggs,Olivina,Margarine,OlivinaMargarine427 g,$5.49ea,,$1.29/ 100g,False,
dairy_and_eggs,Tofutti,"Better Than Sour Cream, Plain","TofuttiBetter Than Sour Cream, Plain340 g",$5.29ea,,$1.56/ 100g,False,
dairy_and_eggs,President's Choice,Lactose Free 14% M.F. Sour Cream,President's ChoiceLactose Free 14% M.F. Sour Cream500 ml,$4.79ea,,$0.96/ 100ml,False,
dairy_and_eggs,No Name,Coffee Whitener,No NameCoffee Whitener450 g,$5.49ea,,$1.22/ 100g,False,
dairy_and_eggs,Cracker Barrel,Sweet Combo,Cracker BarrelSweet Combo129 g,$5.79ea,,$4.49/ 100g,False,
dairy_and_eggs,Tre Stelle,"Grated Cheese, 100% Parmesan","Tre StelleGrated Cheese, 100% Parmesan200 g",$8.49ea,,$4.25/ 100g,False,
dairy_and_eggs,Burnbrae Farms,Naturegg Simply Egg Whites,Burnbrae FarmsNaturegg Simply Egg Whites1 ea,$5.29ea,,$1.06/ 100ml,False,
dairy_and_eggs,Kraft,Grated Parmesan Cheese,KraftGrated Parmesan Cheese125 g,$5.99ea,,$4.79/ 100g,False,
dairy_and_eggs,Pillsbury,Grands Cookie Dough Chocolate Chip,PillsburyGrands Cookie Dough Chocolate Chip454 g,$5.29ea,,$1.17/ 100g,False,
dairy_and_eggs,Green Valley,Rowe Farm Free Run XL,Green ValleyRowe Farm Free Run XL12 eggs,$6.79ea,,$0.57/ 1ea,False,
dairy_and_eggs,Black Diamond,Marble Shredded Cheese,Black DiamondMarble Shredded Cheese320 g,$6.99ea,,$2.18/ 100g,False,
dairy_and_eggs,Cracker Barrel,Snack Marble Cheddar,Cracker BarrelSnack Marble Cheddar168 g,$6.49ea,,$3.86/ 100g,False,
dairy_and_eggs,Black Diamond,Cheestrings Marble 18% M.F.,Black DiamondCheestrings Marble 18% M.F.588 g,$12.29ea,,$2.09/ 100g,False,
dairy_and_eggs,siggi's,"Yogurt, Strawberry 2% M.F. Simple Ingredient Skyr","siggi'sYogurt, Strawberry 2% M.F. Simple Ingredient Skyr650 g",$7.79ea,,$1.20/ 100g,False,
dairy_and_eggs,No Name,Medium Cheddar Cheese Slices,No NameMedium Cheddar Cheese Slices230 g,$5.49ea,,$2.39/ 100g,False,
dairy_and_eggs,Gay Lea,Butter Garlic Parsley ,Gay LeaButter Garlic Parsley 125 g,$4.29ea,,$3.43/ 100g,False,
dairy_and_eggs,Black Diamond,Cheestrings Mozzarella 18% M.F.,Black DiamondCheestrings Mozzarella 18% M.F.336 g,$6.99ea,,$2.08/ 100g,False,
dairy_and_eggs,President's Choice,French Onion Greek Yogurt Dip,President's ChoiceFrench Onion Greek Yogurt Dip227 g,$3.79ea,,$1.67/ 100g,False,
dairy_and_eggs,Black Diamond,Sliced Marble Cheddar Cheese,Black DiamondSliced Marble Cheddar Cheese240 g,$5.99ea,,$2.50/ 100g,False,
dairy_and_eggs,President's Choice,Lactose Free Pizza Mozzarella Shredded Cheese,President's ChoiceLactose Free Pizza Mozzarella Shredded Cheese320 g,$6.49ea,,$2.03/ 100g,False,
dairy_and_eggs,Activia,"Yogurt With Probiotics, Mango Flavour Tub","ActiviaYogurt With Probiotics, Mango Flavour Tub650 g",$4.79ea,$3.99ea,$0.61/ 100g,True,saleEnds 03/15
dairy_and_eggs,Burnbrae Farms,"Egg Creations, Original","Burnbrae FarmsEgg Creations, Original500 g",$5.29ea,,$1.06/ 100g,False,
dairy_and_eggs,IOGO,"Zip Yogurt, Limited Edition Game Over Edition Strawberry-Melon/Blueberry","IOGOZip Yogurt, Limited Edition Game Over Edition Strawberry-Melon/Blueberry8x60.0 g",$4.49ea,,$0.94/ 100g,False,
dairy_and_eggs,Gay Lea,Butter 82 Farmhouse ,Gay LeaButter 82 Farmhouse 250 g,$7.99ea,,$3.20/ 100g,False,
dairy_and_eggs,No Name,Medium Grade A White Eggs,No NameMedium Grade A White Eggs12 eggs,$3.89ea,,$0.32/ 1ea,False,
dairy_and_eggs,Neilson,Trutaste Homogenized Milk Lactose Free 3.25% M.F.,NeilsonTrutaste Homogenized Milk Lactose Free 3.25% M.F.4 l,$10.99ea,,$0.27/ 100ml,False,
dairy_and_eggs,Gray Ridge,Extra Large Eggs,Gray RidgeExtra Large Eggs18 eggs,$7.19ea,,$0.40/ 1ea,False,
dairy_and_eggs,IOGO,"Yogurt, Vanilla 1.5%","IOGOYogurt, Vanilla 1.5%650 g",$4.49ea,,$0.69/ 100g,False,
dairy_and_eggs,No Name,68% Vegetable Oil Margarine ,No Name68% Vegetable Oil Margarine 907 g,$4.49ea,,$0.50/ 100g,False,
dairy_and_eggs,President's Choice,Triple Cheddar Shredded Cheese Blend ,President's ChoiceTriple Cheddar Shredded Cheese Blend 620 g,$12.49ea,$8.99ea,$1.45/ 100g,True,saleEnds 03/01
dairy_and_eggs,President's Choice,Pizza Mozzarella Shredded Cheese,President's ChoicePizza Mozzarella Shredded Cheese320 g,$6.49ea,,$2.03/ 100g,False,
dairy_and_eggs,Kraft,Grated Parmesan Cheese,KraftGrated Parmesan Cheese125 g,$5.99ea,,$4.79/ 100g,False,
dairy_and_eggs,Pillsbury,Grands Cookie Dough Chocolate Chip,PillsburyGrands Cookie Dough Chocolate Chip454 g,$5.29ea,,$1.17/ 100g,False,
dairy_and_eggs,Becel,Margarine with Avocado Oil,BecelMargarine with Avocado Oil850 g,$9.29ea,,$1.09/ 100g,False,
dairy_and_eggs,Philadelphia,Onion Dip,PhiladelphiaOnion Dip340 g,$7.99ea,,$2.35/ 100g,False,
dairy_and_eggs,Green Valley,Rowe Farm Free Run XL,Green ValleyRowe Farm Free Run XL12 eggs,$6.79ea,,$0.57/ 1ea,False,
dairy_and_eggs,Black Diamond,Marble Shredded Cheese,Black DiamondMarble Shredded Cheese320 g,$6.99ea,,$2.18/ 100g,False,
dairy_and_eggs,Olivina,Margarine,OlivinaMargarine427 g,$5.49ea,,$1.29/ 100g,False,
dairy_and_eggs,Tofutti,"Better Than Sour Cream, Plain","TofuttiBetter Than Sour Cream, Plain340 g",$5.29ea,,$1.56/ 100g,False,
dairy_and_eggs,President's Choice,Lactose Free 14% M.F. Sour Cream,President's ChoiceLactose Free 14% M.F. Sour Cream500 ml,$4.79ea,,$0.96/ 100ml,False,
dairy_and_eggs,Tre Stelle,"Grated Cheese, 100% Parmesan","Tre StelleGrated Cheese, 100% Parmesan200 g",$8.49ea,,$4.25/ 100g,False,
dairy_and_eggs,Burnbrae Farms,Naturegg Simply Egg Whites,Burnbrae FarmsNaturegg Simply Egg Whites1 ea,$5.29ea,,$1.06/ 100ml,False,
dairy_and_eggs,siggi's,"Yogurt, Strawberry 2% M.F. Simple Ingredient Skyr","siggi'sYogurt, Strawberry 2% M.F. Simple Ingredient Skyr650 g",$7.79ea,,$1.20/ 100g,False,
dairy_and_eggs,Gay Lea,"Butter Sticks, Salted","Gay LeaButter Sticks, Salted454 g",$8.99ea,,$1.98/ 100g,False,
dairy_and_eggs,Philadelphia,Whipped Jalapeno Cheddar Cream Cheese Product,PhiladelphiaWhipped Jalapeno Cheddar Cream Cheese Product227 g,$5.49ea,,$2.42/ 100g,False,
dairy_and_eggs,No Name,Medium Cheddar Cheese Slices,No NameMedium Cheddar Cheese Slices230 g,$5.49ea,,$2.39/ 100g,False,
dairy_and_eggs,Black Diamond,Cheestrings Marble 18% M.F.,Black DiamondCheestrings Marble 18% M.F.588 g,$12.29ea,,$2.09/ 100g,False,
dairy_and_eggs,Yoplait,Lactose Free Strawberry/Raspberry Drinkable Yogurt,YoplaitLactose Free Strawberry/Raspberry Drinkable Yogurt200 ml,$1.69ea,,$0.85/ 100ml,False,
dairy_and_eggs,No Name, 75% Vegetable Oil Margarine Squares,No Name 75% Vegetable Oil Margarine Squares1.36 kg,$7.99ea,,$0.59/ 100g,False,
dairy_and_eggs,PC Organics,Organic Homogenized Milk,PC OrganicsOrganic Homogenized Milk2 l,$7.29ea,,$0.36/ 100ml,False,
dairy_and_eggs,Liberte,Kéfir 1% MF Plain,LiberteKéfir 1% MF Plain1000 ml,$6.49ea,,$0.65/ 100ml,False,
dairy_and_eggs,Activia,"Probiotic Smoothie, Mango, Peach & Carrot, Drinkable Yogurt","ActiviaProbiotic Smoothie, Mango, Peach & Carrot, Drinkable Yogurt190 ml",$2.29ea,,$1.21/ 100ml,False,
dairy_and_eggs,Liberte,Goat Milk 3.25% M.F,LiberteGoat Milk 3.25% M.F1 l,$5.49ea,,$0.55/ 100ml,False,
dairy_and_eggs,Savor,Grass Fed Salted Butter,SavorGrass Fed Salted Butter250 g,$7.99ea,,$3.20/ 100g,False,
dairy_and_eggs,President's Choice,Plant Based Kefir Probiotic Fermented Coconut Milk,President's ChoicePlant Based Kefir Probiotic Fermented Coconut Milk1 l,$4.99ea,,$0.50/ 100ml,False,
dairy_and_eggs,Nestle,Coffee Mate Liquid Hazelnut,NestleCoffee Mate Liquid Hazelnut946 ml,$6.49ea,$5.49ea,$0.58/ 100ml,True,saleEnds 03/15
dairy_and_eggs,Activia,"Probiotic Yogurt, Strawberry/Blueberry/Raspberry/Peach Flavour","ActiviaProbiotic Yogurt, Strawberry/Blueberry/Raspberry/Peach Flavour12x100.0 g",$8.49ea,,$0.71/ 100g,False,
dairy_and_eggs,Yoplait,Yop Drinkable Yogurt Watermelon Flavour ,YoplaitYop Drinkable Yogurt Watermelon Flavour 200 ml,$1.69ea,,$0.85/ 100ml,False,
dairy_and_eggs,President's Choice,Plain 1% M.F. Yogurt,President's ChoicePlain 1% M.F. Yogurt750 g,$3.79ea,,$0.51/ 100g,False,
dairy_and_eggs,Woolwich,Dairy Old Goat's Milk Cheddar Cheese,WoolwichDairy Old Goat's Milk Cheddar Cheese200 g,$9.99ea,$8.99ea,$4.50/ 100g,True,saleEnds 03/15
dairy_and_eggs,The Greek Gods,"Greek Style Yogurt, Traditional Plain","The Greek GodsGreek Style Yogurt, Traditional Plain500 g",$5.49ea,,$1.10/ 100g,False,
dairy_and_eggs,PC Organics,Organic Homogenized Milk,PC OrganicsOrganic Homogenized Milk1 l,$4.69ea,,$0.47/ 100ml,False,
dairy_and_eggs,Neilson,Trutaste Lactose Free 2% Milk,NeilsonTrutaste Lactose Free 2% Milk2 l,$7.19ea,,$0.36/ 100ml,False,
dairy_and_eggs,PC Organics,"Organic Cultured Coconut Milk Plain, Unsweetened","PC OrganicsOrganic Cultured Coconut Milk Plain, Unsweetened680 g",$5.99ea,,$0.88/ 100g,False,
dairy_and_eggs,Activia,"Yogurt With Probiotics, Stawberry Vanilla Flavour","ActiviaYogurt With Probiotics, Stawberry Vanilla Flavour8x100.0 g",$6.69ea,,$0.84/ 100g,False,
dairy_and_eggs,PC Organics,Organic 2% Milk,PC OrganicsOrganic 2% Milk1 l,$4.69ea,,$0.47/ 100ml,False,
dairy_and_eggs,PC Organics,Organic 2% Milk,PC OrganicsOrganic 2% Milk1 l,$4.69ea,,$0.47/ 100ml,False,
dairy_and_eggs,Liberte,Greek Yogurt Double Cream Plain 8% MF,LiberteGreek Yogurt Double Cream Plain 8% MF650 g,$6.49ea,,$1.00/ 100g,False,
dairy_and_eggs,Violife,Creamy Original ,ViolifeCreamy Original 200 g,$6.99ea,,$3.50/ 100g,False,
dairy_and_eggs,Earth Island,Cheddar Style Dairy-Free Cheese,Earth IslandCheddar Style Dairy-Free Cheese198 g,$6.99ea,,$3.53/ 100g,False,
dairy_and_eggs,Yoplait,Tubes Limited Edition,YoplaitTubes Limited Edition8x56.0 g,$4.79ea,,$1.07/ 100g,False,
dairy_and_eggs,IOGO,"Nano Yogurt, Vanilla","IOGONano Yogurt, Vanilla6x93.0 ml",$4.99ea,,$0.89/ 100ml,False,
dairy_and_eggs,Violife,Mozzarella Style Shreds ,ViolifeMozzarella Style Shreds 227 g,$6.99ea,,$3.08/ 100g,False,
dairy_and_eggs,Armstrong,Snack Marble Cheese,ArmstrongSnack Marble Cheese210 g,$7.49ea,,$3.57/ 100g,False,
dairy_and_eggs,Yoplait,Source Strawberry 0% MF,YoplaitSource Strawberry 0% MF630 g,$4.79ea,,$0.76/ 100g,False,
dairy_and_eggs,Nestle,Coffee Mate Double Double-Mate Liquid Coffee Enhancer Value Size,NestleCoffee Mate Double Double-Mate Liquid Coffee Enhancer Value Size1.89 l,$8.99ea,,$0.48/ 100ml,False,
dairy_and_eggs,Activia,"Probiotics Yogurt, Yellow Apple/Apricot/Mango/Peach","ActiviaProbiotics Yogurt, Yellow Apple/Apricot/Mango/Peach12x100.0 g",$8.49ea,,$0.71/ 100g,False,
dairy_and_eggs,Neilson,Ultrafiltered Skim Milk 0% M.F.,NeilsonUltrafiltered Skim Milk 0% M.F.1 l,$4.69ea,$3.29ea,$0.33/ 100ml,True,saleEnds 04/05
dairy_and_eggs,siggi's,Vanilla Yogurt,siggi'sVanilla Yogurt750 g,$7.79ea,,$1.04/ 100g,False,
dairy_and_eggs,Yoplait,Tubes Mixed Berry,YoplaitTubes Mixed Berry8x56.0 g,$4.79ea,,$1.07/ 100g,False,
dairy_and_eggs,Activia,"Probiotic Yogurt, Mixed Berries, Drinkable Yogurt, 8 Pack","ActiviaProbiotic Yogurt, Mixed Berries, Drinkable Yogurt, 8 Pack8x93.0 ml",$7.99ea,,$1.07/ 100ml,False,
dairy_and_eggs,Silk,"Dairy Free Plant Based Coconut Yogurt, Vanilla, Unsweetened","SilkDairy Free Plant Based Coconut Yogurt, Vanilla, Unsweetened680 g",$7.49ea,,$1.10/ 100g,False,
dairy_and_eggs,Yoplait,Tubes Strawberry Yogurt,YoplaitTubes Strawberry Yogurt8x56.0 g,$4.79ea,,$1.07/ 100g,False,
dairy_and_eggs,PC Organics,"Organic Greek Yogurt, Plain","PC OrganicsOrganic Greek Yogurt, Plain500 g",$6.49ea,,$1.30/ 100g,False,
dairy_and_eggs,Nestle,Coffee Mate Liquid French Vanilla Value Size,NestleCoffee Mate Liquid French Vanilla Value Size1.89 l,$8.99ea,,$0.48/ 100ml,False,
dairy_and_eggs,Rolling Meadow,"Yogurt, Plain 3.25%","Rolling MeadowYogurt, Plain 3.25%500 g",$4.29ea,,$0.86/ 100g,False,
dairy_and_eggs,Olympic,Organic Yogurt Plain,OlympicOrganic Yogurt Plain1.75 kg,$12.99ea,,$0.74/ 100g,False,
dairy_and_eggs,Silk,"Oat For Coffee, Vanilla, Plant Based, Dairy Free Coffee Creamer","SilkOat For Coffee, Vanilla, Plant Based, Dairy Free Coffee Creamer890 ml",$5.49ea,,$0.62/ 100ml,False,
dairy_and_eggs,PC Organics,"Organic Cheese, Old Cheddar","PC OrganicsOrganic Cheese, Old Cheddar200 g",$6.49ea,,$3.25/ 100g,False,
dairy_and_eggs,Olympic,"Fat Free Organic Yogurt, Plain","OlympicFat Free Organic Yogurt, Plain650 g",$4.99ea,,$0.77/ 100g,False,
dairy_and_eggs,Violife,Cheddar Style Slices ,ViolifeCheddar Style Slices 200 g,$6.99ea,,$3.50/ 100g,False,
dairy_and_eggs,Oikos,"Greek Yogurt, Variety Pack, 6X Strawberry, 6X Vanilla, Blended, 2% M.F.","OikosGreek Yogurt, Variety Pack, 6X Strawberry, 6X Vanilla, Blended, 2% M.F.12x100.0 g",$10.99ea,,$0.92/ 100g,False,
dairy_and_eggs,Yoplait,Yop Drinkable Yogurt  Strawberry-Banana Flavour,YoplaitYop Drinkable Yogurt  Strawberry-Banana Flavour200 ml,$1.69ea,,$0.85/ 100ml,False,
dairy_and_eggs,Silk,"Almond For Coffee, Vanilla, Plant Based, Dairy Free Coffee Creamer","SilkAlmond For Coffee, Vanilla, Plant Based, Dairy Free Coffee Creamer473 ml",$2.99ea,,$0.63/ 100ml,False,
dairy_and_eggs,Derlea,Garlic Spread,DerleaGarlic Spread250 g,$2.99ea,,$1.20/ 100g,False,
dairy_and_eggs,Gay Lea,Spreadables Light Butter With Canola Oil,Gay LeaSpreadables Light Butter With Canola Oil227 g,$5.99ea,,$2.64/ 100g,False,
dairy_and_eggs,The A2 Milk Company,2% M.F. Partly Skimmed Milk,The A2 Milk Company2% M.F. Partly Skimmed Milk2 l,$6.69ea,,$0.33/ 100ml,False,
dairy_and_eggs,Activia,"Yogurt With Probiotics, Peach Flavour Tub","ActiviaYogurt With Probiotics, Peach Flavour Tub650 g",$4.79ea,$3.99ea,$0.61/ 100g,True,saleEnds 03/15
dairy_and_eggs,Fairlife,Ultrafiltered Partly Skimmed Milk Lactose Free 2% M.F,FairlifeUltrafiltered Partly Skimmed Milk Lactose Free 2% M.F240 ml,$2.89ea,,$1.20/ 100ml,False,
dairy_and_eggs,Cracker Barrel,Shreds Tex Mex,Cracker BarrelShreds Tex Mex320 g,$7.99ea,,$2.50/ 100g,False,
dairy_and_eggs,President's Choice,Lactose Free Plain 2%  M.F. Yogurt,President's ChoiceLactose Free Plain 2%  M.F. Yogurt750 g,$3.79ea,,$0.51/ 100g,False,
dairy_and_eggs,President's Choice,Tre Formaggi Shredded Cheese Blend,President's ChoiceTre Formaggi Shredded Cheese Blend620 g,$12.49ea,$8.99ea,$1.45/ 100g,True,saleEnds 03/01
dairy_and_eggs,No Name,Fat-Free Cottage Cheese,No NameFat-Free Cottage Cheese500 g,$4.99ea,,$1.00/ 100g,False,
dairy_and_eggs,MacLarens,Cheese Spread,MacLarensCheese Spread230 g,$8.99ea,,$3.91/ 100g,False,
dairy_and_eggs,President's Choice,Smoke Flavoured Cheddar Cheese,President's ChoiceSmoke Flavoured Cheddar Cheese400 g,$6.49ea,,$1.62/ 100g,False,
dairy_and_eggs,Kraft,Singles Original Thick Slices,KraftSingles Original Thick Slices410 g,$6.29ea,,$1.53/ 100g,False,
dairy_and_eggs,Gay Lea,Unsalted Butter,Gay LeaUnsalted Butter454 g,$8.49ea,,$1.87/ 100g,False,
dairy_and_eggs,President's Choice,Banana 2% M.F. Greek Yogurt,President's ChoiceBanana 2% M.F. Greek Yogurt4x100.0 g,$4.49ea,,$1.12/ 100g,False,
dairy_and_eggs,Gay Lea,"Nordica Cottage Cheese, 2%","Gay LeaNordica Cottage Cheese, 2%500 g",$5.99ea,,$1.20/ 100g,False,
dairy_and_eggs,Black Diamond,Natural Shredded Cheese Mozza Cheddar 24% M.F.,Black DiamondNatural Shredded Cheese Mozza Cheddar 24% M.F.320 g,$6.99ea,,$2.18/ 100g,False,
dairy_and_eggs,No Name,Mozzarella 100% Real Cheese Slices ,No NameMozzarella 100% Real Cheese Slices 230 g,$5.49ea,,$2.39/ 100g,False,
dairy_and_eggs,Black Diamond,"Cheddar Cheese Medium, 32% M.F.","Black DiamondCheddar Cheese Medium, 32% M.F.400 g",$8.49ea,,$2.12/ 100g,False,
dairy_and_eggs,Rowe Farms,"Green Valley Omega 3 Eggs, Large","Rowe FarmsGreen Valley Omega 3 Eggs, Large12 ea",$5.79ea,,$5.79/ 1ea,False,
dairy_and_eggs,Gray Ridge,"Grade A Brown Eggs, Large","Gray RidgeGrade A Brown Eggs, Large12 eggs",$5.89ea,,$0.49/ 1ea,False,
dairy_and_eggs,Pillsbury,Grands! Cinnamon Rolls Flaky Supreme with Icing,PillsburyGrands! Cinnamon Rolls Flaky Supreme with Icing468 g,$5.29ea,,$1.07/ 100g,False,
dairy_and_eggs,Black Diamond,Marble Cheddar Cheese Sticks,Black DiamondMarble Cheddar Cheese Sticks252 g,$7.29ea,,$2.89/ 100g,False,
dairy_and_eggs,President's Choice,Phyllo Pastry,President's ChoicePhyllo Pastry454 g,$4.69ea,,$1.03/ 100g,False,
dairy_and_eggs,Black Diamond,Cheddar Cheese Thin Slices,Black DiamondCheddar Cheese Thin Slices410 g,$5.49ea,,$1.34/ 100g,False,
dairy_and_eggs,Cracker Barrel,Slice Swiss,Cracker BarrelSlice Swiss220 g,$5.99ea,,$2.72/ 100g,False,
dairy_and_eggs,Tre Stelle,Tre Stelle Cream Cheese with Herbs and Spices,Tre StelleTre Stelle Cream Cheese with Herbs and Spices200 g,$4.49ea,,$2.25/ 100g,False,
dairy_and_eggs,PC Organics,Organic Free-Range Large Brown Eggs,PC OrganicsOrganic Free-Range Large Brown Eggs12 eggs,$7.49ea,,$0.62/ 1ea,False,
dairy_and_eggs,Becel,Buttery Taste Margarine,BecelButtery Taste Margarine680 g,$9.29ea,,$1.46/ 100g,False,
dairy_and_eggs,Burnbrae Farms,"Naturegg Nest Laid White Eggs, Large","Burnbrae FarmsNaturegg Nest Laid White Eggs, Large12 eggs",$5.79ea,,$0.48/ 1ea,False,
dairy_and_eggs,Becel,Margarine with Olive Oil,BecelMargarine with Olive Oil850 g,$9.29ea,,$1.09/ 100g,False,
dairy_and_eggs,Cracker Barrel,Slice Medium Cheddar Light,Cracker BarrelSlice Medium Cheddar Light240 g,$5.99ea,,$2.50/ 100g,False,
dairy_and_eggs,PC Organics,"Organic Free Run Brown Eggs, Medium","PC OrganicsOrganic Free Run Brown Eggs, Medium12 eggs",$7.29ea,,$0.61/ 1ea,False,
dairy_and_eggs,Nestle,Coffee Mate Coffee Crisp Liquid Coffee Enhancer,NestleCoffee Mate Coffee Crisp Liquid Coffee Enhancer946 ml,$6.49ea,$5.49ea,$0.58/ 100ml,True,saleEnds 03/15
dairy_and_eggs,Armstrong,Natural Swiss Cheese Slice,ArmstrongNatural Swiss Cheese Slice220 g,$6.49ea,,$2.95/ 100g,False,
dairy_and_eggs,President's Choice,Monterey Jack Cheese,President's ChoiceMonterey Jack Cheese400 g,$6.49ea,,$1.62/ 100g,False,
dairy_and_eggs,President's Choice,Shredded Pizza Mozzarella Cheese,President's ChoiceShredded Pizza Mozzarella Cheese620 g,$12.49ea,$8.99ea,$1.45/ 100g,True,saleEnds 03/01
dairy_and_eggs,Armstrong,Pizza Mozz Cheese Slice,ArmstrongPizza Mozz Cheese Slice240 g,$6.49ea,,$2.70/ 100g,False,
dairy_and_eggs,President's Choice,Greek Vanilla 5%,President's ChoiceGreek Vanilla 5%908 g,$7.79ea,,$0.86/ 100g,False,
dairy_and_eggs,Gay Lea,Butter 84% Sea Salted ,Gay LeaButter 84% Sea Salted 250 g,$7.99ea,,$3.20/ 100g,False,
dairy_and_eggs,Oikos,"Extra Creamy Greek Yogurt, Banana Chocolate Flavour, 4% Mf","OikosExtra Creamy Greek Yogurt, Banana Chocolate Flavour, 4% Mf4x95.0 g",$4.79ea,,$1.26/ 100g,False,
dairy_and_eggs,PC Blue Menu,Free Run Egg Whites,PC Blue MenuFree Run Egg Whites1 g,$5.49ea,,$1.10/ 100g,False,
dairy_and_eggs,Silk,"Coconut Yogurt Style, Plain, Unsweetened, Plant Based Dairy Free Yogurt","SilkCoconut Yogurt Style, Plain, Unsweetened, Plant Based Dairy Free Yogurt680 g",$7.49ea,,$1.10/ 100g,False,
dairy_and_eggs,Nestle,Coffee Mate After Eight Liquid Coffee Enhancer,NestleCoffee Mate After Eight Liquid Coffee Enhancer946 ml,$6.49ea,$5.49ea,$0.58/ 100ml,True,saleEnds 03/15
dairy_and_eggs,Liberte,Greek Mango 0% MF Yogurt,LiberteGreek Mango 0% MF Yogurt750 g,$6.49ea,,$0.87/ 100g,False,
dairy_and_eggs,IOGO,"Drinkable Yogurt, Banana 1.5%","IOGODrinkable Yogurt, Banana 1.5%6x93.0 ml",$4.99ea,,$0.89/ 100ml,False,
dairy_and_eggs,Woolwich,Dairy Goat Milk Sea Salted Butter,WoolwichDairy Goat Milk Sea Salted Butter250 g,$7.49ea,,$3.00/ 100g,False,
dairy_and_eggs,Tre Stelle,Tre Stelle Organic Cream Cheese Spread,Tre StelleTre Stelle Organic Cream Cheese Spread200 g,$4.49ea,,$2.25/ 100g,False,
dairy_and_eggs,Silk,"Soy For Coffee, Original Coffee Creamer","SilkSoy For Coffee, Original Coffee Creamer890 ml",$5.49ea,,$0.62/ 100ml,False,
dairy_and_eggs,International Delight,"Hazelnut Flavoured Coffee Creamer, 63 Servings","International DelightHazelnut Flavoured Coffee Creamer, 63 Servings946 ml",$5.99ea,,$0.63/ 100ml,False,
dairy_and_eggs,Neilson,Trutaste Lactose Free 1% Milk,NeilsonTrutaste Lactose Free 1% Milk2 l,$7.19ea,,$0.36/ 100ml,False,
dairy_and_eggs,Neilson,Whipping Cream,NeilsonWhipping Cream237 ml,$3.89ea,,$1.64/ 100ml,False,
dairy_and_eggs,Neilson,"Homogenized Milk Microfiltered, 3.25% M.F.","NeilsonHomogenized Milk Microfiltered, 3.25% M.F.1 l",$3.79ea,,$0.38/ 100ml,False,
dairy_and_eggs,Earth Balance,Soy Free Buttery Spread    ,Earth BalanceSoy Free Buttery Spread    425 g,$5.99ea,,$1.41/ 100g,False,
dairy_and_eggs,PC Organics,"Organic Fresh Churned Butter, Salted","PC OrganicsOrganic Fresh Churned Butter, Salted250 g",$6.99ea,,$2.80/ 100g,False,
dairy_and_eggs,IOGO,"Fat Free Yogurt, Strawberry, Blueberry, Peach, Vanilla","IOGOFat Free Yogurt, Strawberry, Blueberry, Peach, Vanilla16x100.0 g",$8.99ea,,$0.56/ 100g,False,
dairy_and_eggs,Olympic,Yogurt-French Vanilla,OlympicYogurt-French Vanilla1.75 kg,$12.99ea,,$0.74/ 100g,False,
dairy_and_eggs,Saputo,Mozzarellissima,SaputoMozzarellissima500 g,$9.99ea,,$2.00/ 100g,False,
dairy_and_eggs,Baileys,French Vanilla,BaileysFrench Vanilla400 ml,$4.39ea,$2.49ea,$0.62/ 100ml,True,saleEnds 04/05
dairy_and_eggs,Philadelphia,"Original Cream Cheese, Lactose Free","PhiladelphiaOriginal Cream Cheese, Lactose Free250 g",$6.49ea,,$2.60/ 100g,False,
dairy_and_eggs,Neilson,Caramel Chocolate Milkshake,NeilsonCaramel Chocolate Milkshake310 ml,$2.79ea,,$0.90/ 100ml,False,
dairy_and_eggs,President's Choice,Country Churned Unsalted Butter ,President's ChoiceCountry Churned Unsalted Butter 454 g,$8.49ea,,$1.87/ 100g,False,
dairy_and_eggs,Neilson,Skim Milk,NeilsonSkim Milk2 l,$5.19ea,,$0.26/ 100ml,False,
dairy_and_eggs,Becel,Margarine with Oat Beverage,BecelMargarine with Oat Beverage850 g,$9.29ea,,$1.09/ 100g,False,
dairy_and_eggs,Becel,Margarine with Oat Beverage,BecelMargarine with Oat Beverage427 g,$5.49ea,,$1.29/ 100g,False,
dairy_and_eggs,Starbucks,White Chocolate Mocha Liquid Coffee Enhancer,StarbucksWhite Chocolate Mocha Liquid Coffee Enhancer828 ml,$7.99ea,,$0.96/ 100ml,False,
dairy_and_eggs,Neilson,Whipping Cream 35 percent MF,NeilsonWhipping Cream 35 percent MF1 l,$9.49ea,,$0.95/ 100ml,False,
dairy_and_eggs,Woolwich,Dairy Goat Milk Unsalted Butter,WoolwichDairy Goat Milk Unsalted Butter250 g,$7.49ea,,$3.00/ 100g,False,
dairy_and_eggs,Liberte,Méditerranée Raspbery Cheesecake 9%MF Yogurt,LiberteMéditerranée Raspbery Cheesecake 9%MF Yogurt500 g,$5.79ea,,$1.16/ 100g,False,
dairy_and_eggs,President's Choice,Plain Skyr Icelandic Style 0% M.F. Yogurt,President's ChoicePlain Skyr Icelandic Style 0% M.F. Yogurt500 g,$6.29ea,,$1.26/ 100g,False,
dairy_and_eggs,Liberte,Greek Grk Ex Crm Str/Ban 5%,LiberteGreek Grk Ex Crm Str/Ban 5%650 g,$6.49ea,,$1.00/ 100g,False,
dairy_and_eggs,Earth Island,Cheddar Cheese Slices,Earth IslandCheddar Cheese Slices200 g,$8.99ea,,$4.50/ 100g,False,
