category,brand,product_text,product_name,price_text,sale_price,per_unit_price_text,is_sale,sale_valid_to
dairy_and_eggs,PC Organics,Organic Homogenized Milk,PC OrganicsOrganic Homogenized Milk4 l,$10.69ea,,$0.27/ 100ml,False,
dairy_and_eggs,PC Organics,"Organic Fresh Churned Butter, Unsalted","PC OrganicsOrganic Fresh Churned Butter, Unsalted250 g",$6.99ea,,$2.80/ 100g,False,
dairy_and_eggs,Liberte,Greek Plain 0% MF Yogurt,LiberteGreek Plain 0% MF Yogurt750 g,$6.49ea,,$0.87/ 100g,False,
dairy_and_eggs,Nestle,Coffee Mate Coffee Enhancer Hazelnut Value Size,NestleCoffee Mate Coffee Enhancer Hazelnut Value Size1.89 l,$8.99ea,,$0.48/ 100ml,False,
dairy_and_eggs,Activia,"Yogurt With Probiotics, Stawberry Raspberry Flavour","ActiviaYogurt With Probiotics, Stawberry Raspberry Flavour8x100.0 g",$6.69ea,,$0.84/ 100g,False,
dairy_and_eggs,Activia,"Yogurt With Probiotics, Vanilla Flavouractose-Free","ActiviaYogurt With Probiotics, Vanilla Flavouractose-Free8x100.0 g",$6.69ea,,$0.84/ 100g,False,
dairy_and_eggs,PC Organics,Organic 14% M.F. Sour Cream,PC OrganicsOrganic 14% M.F. Sour Cream500 g,$5.29ea,,$1.06/ 100g,False,
dairy_and_eggs,IOGO,"0% Strawberry, Raspberry, Blueberry, Cherry Yogurt","IOGO0% Strawberry, Raspberry, Blueberry, Cherry Yogurt16x100.0 g",$8.99ea,,$0.56/ 100g,False,
dairy_and_eggs,Oikos,"Fat Free Greek Yogurt, Vanilla Flavour, Blended, 0% M.F.","OikosFat Free Greek Yogurt, Vanilla Flavour, Blended, 0% M.F.750 g",$7.49ea,$6.99ea,$0.93/ 100g,True,saleEnds 03/15
dairy_and_eggs,Activia,"Probiotic Yogurt, Raspberry/Apple/Blackberry/Strawberry Flavour, 12XG","ActiviaProbiotic Yogurt, Raspberry/Apple/Blackberry/Strawberry Flavour, 12XG12x100.0 g",$8.49ea,,$0.71/ 100g,False,
dairy_and_eggs,PC Organics,Organic Free-Range Egg Whites,PC OrganicsOrganic Free-Range Egg Whites500 g,$5.99ea,,$1.20/ 100g,False,
dairy_and_eggs,Oikos,"High Protein Greek Yogurt, Vanilla Flavour, Blended, Value Tub","OikosHigh Protein Greek Yogurt, Vanilla Flavour, Blended, Value Tub650 g",$7.49ea,$6.99ea,$1.08/ 100g,True,saleEnds 03/15
dairy_and_eggs,Yoplait,Special Edition Yogurt,YoplaitSpecial Edition Yogurt8x56.0 g,$4.79ea,,$1.07/ 100g,False,
dairy_and_eggs,Activia,"Probiotic Yogurt, Blueberry/Vanilla","ActiviaProbiotic Yogurt, Blueberry/Vanilla12x100.0 g",$8.49ea,,$0.71/ 100g,False,
dairy_and_eggs,Natrel,10% Lactose Free Coffee Cream (1L),Natrel10% Lactose Free Coffee Cream (1L)1 l,$5.99ea,,$0.60/ 100ml,False,
dairy_and_eggs,Yoplait,Yop Drinkable Yogurt Limited Edition,YoplaitYop Drinkable Yogurt Limited Edition200 ml,$1.69ea,,$0.85/ 100ml,False,
dairy_and_eggs,Oikos,"Greek Yogurt, Plain, No Added Sugar, 2% Mf, Value Tub","OikosGreek Yogurt, Plain, No Added Sugar, 2% Mf, Value Tub750 g",$7.49ea,$6.99ea,$0.93/ 100g,True,saleEnds 03/15
dairy_and_eggs,IOGO,"Nano Yogurt, Peach 1%","IOGONano Yogurt, Peach 1%6x93.0 ml",$4.99ea,,$0.89/ 100ml,False,
dairy_and_eggs,The Greek Gods,"Yogurt, Vanille","The Greek GodsYogurt, Vanille500 g",$5.49ea,,$1.10/ 100g,False,
dairy_and_eggs,PC Organics,Organic Partly Skimmed 1% Milk,PC OrganicsOrganic Partly Skimmed 1% Milk4 l,$10.69ea,,$0.27/ 100ml,False,
dairy_and_eggs,Oikos,"High Protein Greek Yogurt, Strawberry-Raspberry Flavour, Blended, Value Tub","OikosHigh Protein Greek Yogurt, Strawberry-Raspberry Flavour, Blended, Value Tub650 g",$7.49ea,$6.99ea,$1.08/ 100g,True,saleEnds 03/15
dairy_and_eggs,Olympic,"Organic Yogurt, Plain 3.5%","OlympicOrganic Yogurt, Plain 3.5%650 g",$4.99ea,,$0.77/ 100g,False,
dairy_and_eggs,Pillsbury,Grands Cinnamon Rolls Regular   ,PillsburyGrands Cinnamon Rolls Regular   496 g,$5.29ea,,$1.07/ 100g,False,
dairy_and_eggs,No Name,Old Cheddar Cheese Slices ,No NameOld Cheddar Cheese Slices 210 g,$5.49ea,,$2.61/ 100g,False,
dairy_and_eggs,Kiri,Cream Cheese,KiriCream Cheese144 g,$5.99ea,,$4.16/ 100g,False,
dairy_and_eggs,Gay Lea,"Nordica On-The-Go Cottage Cheese, Plain","Gay LeaNordica On-The-Go Cottage Cheese, Plain4x113.0 g",$5.99ea,,$1.33/ 100g,False,
dairy_and_eggs,No Name, Light Cottage Cheese,No Name Light Cottage Cheese250 g,$3.49ea,,$1.40/ 100g,False,
dairy_and_eggs,IOGO,Nano Yogurt Vanilla,IOGONano Yogurt Vanilla900 ml,$5.99ea,,$0.67/ 100ml,False,
dairy_and_eggs,No Name,Shredded Medium Cheddar,No NameShredded Medium Cheddar320 g,$5.99ea,,$1.87/ 100g,False,
dairy_and_eggs,No Name,Shredded Mild White Cheddar Cheese,No NameShredded Mild White Cheddar Cheese320 g,$5.99ea,,$1.87/ 100g,False,
dairy_and_eggs,Kraft,Grated Parmesan Cheese,KraftGrated Parmesan Cheese500 g,$16.99ea,,$3.40/ 100g,False,
dairy_and_eggs,President's Choice,Lactose Free Old Yellow Cheddar Cheese,President's ChoiceLactose Free Old Yellow Cheddar Cheese400 g,$6.49ea,,$1.62/ 100g,False,
dairy_and_eggs,Lactantia,"My Country Butter, Unsalted","LactantiaMy Country Butter, Unsalted454 g",$9.29ea,,$2.05/ 100g,False,
dairy_and_eggs,No Name,Herb and Spice Sour Cream Dip,No NameHerb and Spice Sour Cream Dip250 g,$3.99ea,,$1.60/ 100g,False,
dairy_and_eggs,President's Choice,Plain Skyr Icelandic Style 4% M.F. Yogurt,President's ChoicePlain Skyr Icelandic Style 4% M.F. Yogurt500 g,$6.29ea,,$1.26/ 100g,False,
dairy_and_eggs,PC Organics,Organic Free-Range Extra Large Brown Eggs,PC OrganicsOrganic Free-Range Extra Large Brown Eggs12 eggs,$7.69ea,,$0.64/ 1ea,False,
dairy_and_eggs,Liberte,Greek Raspberry 5% MF Yogurt,LiberteGreek Raspberry 5% MF Yogurt4x100.0 g,$5.49ea,,$1.37/ 100g,False,
dairy_and_eggs,No Name,Marble Cheddar Cheese Light,No NameMarble Cheddar Cheese Light400 g,$5.99ea,,$1.50/ 100g,False,
dairy_and_eggs,Imperial,Soft Margarine Spread,ImperialSoft Margarine Spread850 g,$8.79ea,,$1.03/ 100g,False,
dairy_and_eggs,Black Diamond,Cheddar Coloured Old,Black DiamondCheddar Coloured Old400 g,$8.49ea,,$2.12/ 100g,False,
dairy_and_eggs,Riviera,"Vegan Yogurt, Vanilla Coconut","RivieraVegan Yogurt, Vanilla Coconut650 g",$6.99ea,,$1.08/ 100g,False,
dairy_and_eggs,Nestle,Coffee Mate Turtles Liquid Coffee Enhancer,NestleCoffee Mate Turtles Liquid Coffee Enhancer946 ml,$6.49ea,$5.49ea,$0.58/ 100ml,True,saleEnds 03/15
dairy_and_eggs,No Name,2% M.F. Cottage Cheese ,No Name2% M.F. Cottage Cheese 750 g,$6.49ea,,$0.87/ 100g,False,
dairy_and_eggs,President's Choice,Parmesan Shredded Cheese,President's ChoiceParmesan Shredded Cheese250 g,$6.49ea,,$2.60/ 100g,False,
dairy_and_eggs,Astro,"Original Balkan Style Yogurt, Strawberry, Raspberry, Black Cherry, Nectarine","AstroOriginal Balkan Style Yogurt, Strawberry, Raspberry, Black Cherry, Nectarine12x100.0 g",$8.49ea,,$0.71/ 100g,False,
dairy_and_eggs,Gay Lea,"Sour Cream, Fat Free 1%","Gay LeaSour Cream, Fat Free 1%500 ml",$4.49ea,,$0.90/ 100ml,False,
dairy_and_eggs,Danone,"Drinkable Yogurt, Strawberry Banana Flavour, Made With Real Fruit, 2% M.F.","DanoneDrinkable Yogurt, Strawberry Banana Flavour, Made With Real Fruit, 2% M.F.190 ml",$1.29ea,,$0.68/ 100ml,False,
dairy_and_eggs,No Name,Herb and Spice Sour Cream Dip,No NameHerb and Spice Sour Cream Dip250 g,$3.99ea,,$1.60/ 100g,False,
dairy_and_eggs,President's Choice,Plain Skyr Icelandic Style 4% M.F. Yogurt,President's ChoicePlain Skyr Icelandic Style 4% M.F. Yogurt500 g,$6.29ea,,$1.26/ 100g,False,
dairy_and_eggs,Cracker Barrel,Shreds 3 Cheese Mexicana,Cracker BarrelShreds 3 Cheese Mexicana320 g,$7.99ea,,$2.50/ 100g,False,
dairy_and_eggs,Kiri,Cream Cheese,KiriCream Cheese144 g,$5.99ea,,$4.16/ 100g,False,
dairy_and_eggs,Gay Lea,"Nordica On-The-Go Cottage Cheese, Plain","Gay LeaNordica On-The-Go Cottage Cheese, Plain4x113.0 g",$5.99ea,,$1.33/ 100g,False,
dairy_and_eggs,IOGO,Nano Yogurt Vanilla,IOGONano Yogurt Vanilla900 ml,$5.99ea,,$0.67/ 100ml,False,
dairy_and_eggs,No Name,Old Cheddar Cheese,No NameOld Cheddar Cheese200 g,$3.99ea,,$2.00/ 100g,False,
dairy_and_eggs,Kraft,Grated Parmesan Cheese,KraftGrated Parmesan Cheese500 g,$16.99ea,,$3.40/ 100g,False,
dairy_and_eggs,PC Organics,Organic Free-Range Extra Large Brown Eggs,PC OrganicsOrganic Free-Range Extra Large Brown Eggs12 eggs,$7.69ea,,$0.64/ 1ea,False,
dairy_and_eggs,Beatrice,Protein Milk Chocolate,BeatriceProtein Milk Chocolate460 ml,$3.49ea,,$0.76/ 100ml,False,
dairy_and_eggs,President's Choice,Butter Puff Pastry,President's ChoiceButter Puff Pastry450 g,$6.49ea,,$1.44/ 100g,False,
dairy_and_eggs,Activia,"Yogurt With Probioticsactose Free, Vanilla, Strawberry, Raspberry, Cherry Flavour","ActiviaYogurt With Probioticsactose Free, Vanilla, Strawberry, Raspberry, Cherry Flavour12x100.0 g",$8.49ea,,$0.71/ 100g,False,
dairy_and_eggs,Riviera,Oat Based Vegan Delight Plain,RivieraOat Based Vegan Delight Plain650 g,$7.49ea,,$1.15/ 100g,False,
dairy_and_eggs,No Name,Deep Dish Pie Shells,No NameDeep Dish Pie Shells380 g,$4.29ea,,$1.13/ 100g,False,
dairy_and_eggs,Yoplait,Lactose Free Mango,YoplaitLactose Free Mango200 ml,$1.69ea,,$0.85/ 100ml,False,
dairy_and_eggs,President's Choice,Lactose Free Old Yellow Cheddar Cheese,President's ChoiceLactose Free Old Yellow Cheddar Cheese400 g,$6.49ea,,$1.62/ 100g,False,
dairy_and_eggs,PC Blue Menu,Blue Menu Free Run Large White Eggs 12 Pack,PC Blue MenuBlue Menu Free Run Large White Eggs 12 Pack12 ea,$6.89ea,$5.99ea,$0.50/ 1ea,True,saleEnds 03/15
dairy_and_eggs,Cracker Barrel,Shreds Mozza Cheddar,Cracker BarrelShreds Mozza Cheddar320 g,$7.99ea,,$2.50/ 100g,False,
dairy_and_eggs,Heluva,"Sour Cream Dip, Dill Pickle","HeluvaSour Cream Dip, Dill Pickle250 g",$4.49ea,,$1.80/ 100g,False,
dairy_and_eggs,Gay Lea,Lactose Free Sour Cream,Gay LeaLactose Free Sour Cream450 ml,$4.49ea,,$1.00/ 100ml,False,
dairy_and_eggs,Cracker Barrel,Bar Marble Cheddar,Cracker BarrelBar Marble Cheddar400 g,$9.79ea,,$2.45/ 100g,False,
dairy_and_eggs,Yoplait,Yop Drinkable Yogurt Strawberry Flavour 1% M.F.,YoplaitYop Drinkable Yogurt Strawberry Flavour 1% M.F.6x200.0 ml,$8.99ea,,$0.75/ 100ml,False,
dairy_and_eggs,President's Choice,Vanilla 2% M.F. Greek Yogurt,President's ChoiceVanilla 2% M.F. Greek Yogurt908 g,$7.79ea,,$0.86/ 100g,False,
dairy_and_eggs,No Name,Shredded Mild White Cheddar Cheese,No NameShredded Mild White Cheddar Cheese320 g,$5.99ea,,$1.87/ 100g,False,
dairy_and_eggs,Imperial,Soft Margarine Spread,ImperialSoft Margarine Spread427 g,$4.99ea,,$1.17/ 100g,False,
dairy_and_eggs,Armstrong,"Cheese, Sliced Cheddar with Jalapeño Mexican Fiesta 31 % M.F.","ArmstrongCheese, Sliced Cheddar with Jalapeño Mexican Fiesta 31 % M.F.220 g",$6.49ea,,$2.95/ 100g,False,
dairy_and_eggs,President,Premium Salted Cultured Butter,PresidentPremium Salted Cultured Butter250 g,$5.49ea,,$2.20/ 100g,False,
dairy_and_eggs,President's Choice,Gluten Free Pie Crust,President's ChoiceGluten Free Pie Crust380 g,$8.99ea,,$2.37/ 100g,False,
dairy_and_eggs,Activia,"Probiotic Yogurt, 4X Blueberry, 4X Strawberry & Rhubarb, 8 Pack","ActiviaProbiotic Yogurt, 4X Blueberry, 4X Strawberry & Rhubarb, 8 Pack8x100.0 g",$6.69ea,,$0.84/ 100g,False,
dairy_and_eggs,Silk,"For Coffee, Hazelnut Flavour, Dairy Free Coffee Creamer","SilkFor Coffee, Hazelnut Flavour, Dairy Free Coffee Creamer473 ml",$2.99ea,,$0.63/ 100ml,False,
dairy_and_eggs,IOGO,1% Lactose Free Strawberry-Banana Drinkable Yogurt,IOGO1% Lactose Free Strawberry-Banana Drinkable Yogurt6x93.0 ml,$4.99ea,,$0.89/ 100g,False,
dairy_and_eggs,PC Organics,"Organic Cheese, Medium Cheddar","PC OrganicsOrganic Cheese, Medium Cheddar200 g",$6.49ea,,$3.25/ 100g,False,
dairy_and_eggs,Activia,"Yogurt With Probiotics & Fibre, 3X Vanilla, 3X Blueberry, 3X Peach, 3X Strawberry Kiwi,","ActiviaYogurt With Probiotics & Fibre, 3X Vanilla, 3X Blueberry, 3X Peach, 3X Strawberry Kiwi,12x100.0 g",$8.49ea,,$0.71/ 100g,False,
dairy_and_eggs,Woolwich,Goat Dairy Marble Goat Cheddar Cheese 31 % M.F.,WoolwichGoat Dairy Marble Goat Cheddar Cheese 31 % M.F.200 g,$8.99ea,,$4.50/ 100g,False,
dairy_and_eggs,Liberte,Yogourt Black Cherry 9 % M.F.,LiberteYogourt Black Cherry 9 % M.F.4x100.0 g,$5.49ea,,$1.37/ 100g,False,
dairy_and_eggs,International Delight,"Zero Sugar Hazelnut Coffee Creamer,","International DelightZero Sugar Hazelnut Coffee Creamer,946 ml",$5.99ea,,$0.63/ 100ml,False,
dairy_and_eggs,Philadelphia,Herb & Garlic Cream Cheese Product,PhiladelphiaHerb & Garlic Cream Cheese Product340 g,$7.99ea,,$2.35/ 100g,False,
dairy_and_eggs,Gay Lea,"Real Whipped Cream, Light","Gay LeaReal Whipped Cream, Light225 g",$4.49ea,,$2.00/ 100g,False,
dairy_and_eggs,Starbucks,Caramel Macchiato Liquid Coffee Enhancer,StarbucksCaramel Macchiato Liquid Coffee Enhancer828 ml,$7.99ea,,$0.96/ 100ml,False,
dairy_and_eggs,Pillsbury,Holiday Premium Edition Cookies,PillsburyHoliday Premium Edition Cookies396 g,$4.49ea,,$1.13/ 100g,False,
dairy_and_eggs,Neilson,Trutaste Homogenized Milk,NeilsonTrutaste Homogenized Milk4 l,$7.59ea,,$0.19/ 100ml,False,
dairy_and_eggs,International Delight,"Caramel Waffle Cookie Coffee Enhancer, Limited Edition","International DelightCaramel Waffle Cookie Coffee Enhancer, Limited Edition946 ml",$5.99ea,,$0.63/ 100ml,False,
dairy_and_eggs,IOGO,"Yogurt Duo, Pineapple-Coconut-Banana, Raspberry, Orange-Mandarin, Peach-Mango","IOGOYogurt Duo, Pineapple-Coconut-Banana, Raspberry, Orange-Mandarin, Peach-Mango16x100.0 g",$8.99ea,,$0.56/ 100g,False,
dairy_and_eggs,Activia,"Yogurt With Probiotics, Blueberry Flavour","ActiviaYogurt With Probiotics, Blueberry Flavour650 g",$4.79ea,$3.99ea,$0.61/ 100g,True,saleEnds 03/15
dairy_and_eggs,Silk,"Plant Based Dairy Free Coconut Yogurt, Vanilla Flavour, 4 pack","SilkPlant Based Dairy Free Coconut Yogurt, Vanilla Flavour, 4 pack100 g",$4.29ea,$3.99ea,$3.99/ 100g,True,saleEnds 03/08
dairy_and_eggs,Activia,"Yogurt With Probiotics, Strawberry, Raspberry, Vanilla, Blueberry Flavour, 24XG","ActiviaYogurt With Probiotics, Strawberry, Raspberry, Vanilla, Blueberry Flavour, 24XG24x100.0 g",$13.99ea,,$0.58/ 100g,False,
dairy_and_eggs,Heluva,"Sour Cream Dip, Dill Pickle","HeluvaSour Cream Dip, Dill Pickle250 g",$4.49ea,,$1.80/ 100g,False,
dairy_and_eggs,Riviera,Oat Based Vegan Delight Plain,RivieraOat Based Vegan Delight Plain650 g,$7.49ea,,$1.15/ 100g,False,
dairy_and_eggs,Gay Lea,Lactose Free Sour Cream,Gay LeaLactose Free Sour Cream450 ml,$4.49ea,,$1.00/ 100ml,False,
dairy_and_eggs,Cracker Barrel,Bar Marble Cheddar,Cracker BarrelBar Marble Cheddar400 g,$9.79ea,,$2.45/ 100g,False,
dairy_and_eggs,Beatrice,Protein Milk Chocolate,BeatriceProtein Milk Chocolate460 ml,$3.49ea,,$0.76/ 100ml,False,
dairy_and_eggs,Rowe Farms,Green Valley Eggs Size Large Free Run Brown,Rowe FarmsGreen Valley Eggs Size Large Free Run Brown12 eggs,$6.69ea,,$0.56/ 1ea,False,
dairy_and_eggs,Kraft,Grated Parmesan Cheese,KraftGrated Parmesan Cheese500 g,$16.99ea,,$3.40/ 100g,False,
dairy_and_eggs,PC Organics,Organic Free-Range Extra Large Brown Eggs,PC OrganicsOrganic Free-Range Extra Large Brown Eggs12 eggs,$7.69ea,,$0.64/ 1ea,False,
dairy_and_eggs,Activia,"Probiotic Yogurt, 4X Blueberry, 4X Strawberry & Rhubarb, 8 Pack","ActiviaProbiotic Yogurt, 4X Blueberry, 4X Strawberry & Rhubarb, 8 Pack8x100.0 g",$6.69ea,,$0.84/ 100g,False,
dairy_and_eggs,Silk,"For Coffee, Hazelnut Flavour, Dairy Free Coffee Creamer","SilkFor Coffee, Hazelnut Flavour, Dairy Free Coffee Creamer473 ml",$2.99ea,,$0.63/ 100ml,False,
dairy_and_eggs,Organic Meadow,"Kéfir, Plain","Organic MeadowKéfir, Plain1 l",$7.49ea,,$0.75/ 100ml,False,
dairy_and_eggs,Neilson,Ultrafiltered Milk 3.25% M.F.,NeilsonUltrafiltered Milk 3.25% M.F.1 l,$4.69ea,$3.29ea,$0.33/ 100ml,True,saleEnds 04/05
dairy_and_eggs,Lactantia,Whole Milk Organic 3.8% M.F.,LactantiaWhole Milk Organic 3.8% M.F.1.5 l,$6.29ea,,$0.42/ 100ml,False,
dairy_and_eggs,Silk,"Almond Plant Based Yogurt, Plain, Unsweetened, Dairy-Free","SilkAlmond Plant Based Yogurt, Plain, Unsweetened, Dairy-Free640 g",$7.49ea,,$1.17/ 100g,False,
dairy_and_eggs,Yoplait,Yop Drinkable Yogurt Raspberrry Flavour,YoplaitYop Drinkable Yogurt Raspberrry Flavour200 ml,$1.69ea,,$0.85/ 100ml,False,
dairy_and_eggs,Activia,"Yogurt With Probiotics, Raspberry Flavour","ActiviaYogurt With Probiotics, Raspberry Flavour650 g",$4.79ea,$3.99ea,$0.61/ 100g,True,saleEnds 03/15
dairy_and_eggs,Follow Your Heart,Soy Free Vegenaise,Follow Your HeartSoy Free Vegenaise473 ml,$9.49ea,,$2.01/ 100ml,False,
dairy_and_eggs,Activia,"Immune System, Probiotic Yogurt Drink, Strawberry Drinkable Yogurt, 8 Pack","ActiviaImmune System, Probiotic Yogurt Drink, Strawberry Drinkable Yogurt, 8 Pack8x93.0 ml",$7.99ea,,$1.07/ 100ml,False,
dairy_and_eggs,President's Choice,Blueberry Fruit On The Bottom 0% M.F. Greek Yogurt,President's ChoiceBlueberry Fruit On The Bottom 0% M.F. Greek Yogurt4x100.0 g,$4.49ea,,$1.12/ 100g,False,
dairy_and_eggs,Organic Meadow,"Whipping Cream, 35%","Organic MeadowWhipping Cream, 35%500 ml",$8.49ea,,$1.70/ 100ml,False,
dairy_and_eggs,Activia,"Yogurt With Probiotics & Fibre, 3X Vanilla, 3X Blueberry, 3X Peach, 3X Strawberry Kiwi,","ActiviaYogurt With Probiotics & Fibre, 3X Vanilla, 3X Blueberry, 3X Peach, 3X Strawberry Kiwi,12x100.0 g",$8.49ea,,$0.71/ 100g,False,
dairy_and_eggs,Woolwich,Goat Dairy Marble Goat Cheddar Cheese 31 % M.F.,WoolwichGoat Dairy Marble Goat Cheddar Cheese 31 % M.F.200 g,$8.99ea,,$4.50/ 100g,False,
dairy_and_eggs,Liberte,Yogourt Black Cherry 9 % M.F.,LiberteYogourt Black Cherry 9 % M.F.4x100.0 g,$5.49ea,,$1.37/ 100g,False,
dairy_and_eggs,President's Choice,Gluten Free Pie Crust,President's ChoiceGluten Free Pie Crust380 g,$8.99ea,,$2.37/ 100g,False,
dairy_and_eggs,No Name,Original Cream Cheese Spread ,No NameOriginal Cream Cheese Spread 340 g,$5.49ea,,$1.61/ 100g,False,
dairy_and_eggs,Philadelphia,Light Herb & Garlic Cream Cheese,PhiladelphiaLight Herb & Garlic Cream Cheese227 g,$5.49ea,,$2.42/ 100g,False,
dairy_and_eggs,Pillsbury,"Crescents Original Dough, 8 Pieces","PillsburyCrescents Original Dough, 8 Pieces226 g",$3.19ea,,$1.41/ 100g,False,
dairy_and_eggs,PC Blue Menu,Blue Menu Free Run Large Brown Eggs 12 Pack,PC Blue MenuBlue Menu Free Run Large Brown Eggs 12 Pack12 eggs,$7.59ea,,$0.63/ 1ea,False,
dairy_and_eggs,Beatrice,Vanila Milkshake Bottle,BeatriceVanila Milkshake Bottle460 ml,$3.49ea,,$0.76/ 100ml,False,
dairy_and_eggs,No Name,Mild Cheddar Cheese,No NameMild Cheddar Cheese400 g,$5.99ea,,$1.50/ 100g,False,
dairy_and_eggs,Baileys,Original Irish Cream,BaileysOriginal Irish Cream400 ml,$4.39ea,$2.49ea,$0.62/ 100ml,True,saleEnds 04/05
dairy_and_eggs,Black Diamond,Cheddar Old Coloured Shred,Black DiamondCheddar Old Coloured Shred320 g,$6.99ea,,$2.18/ 100g,False,
dairy_and_eggs,President's Choice,Lactose Free Nacho Shredded Cheese Blend,President's ChoiceLactose Free Nacho Shredded Cheese Blend320 g,$6.49ea,,$2.03/ 100g,False,
dairy_and_eggs,Silk,"Coconut Yogurt Style, Raspberry Flavour, Plant Based Dairy Free Yogurt","SilkCoconut Yogurt Style, Raspberry Flavour, Plant Based Dairy Free Yogurt680 g",$7.49ea,,$1.10/ 100g,False,
dairy_and_eggs,President's Choice,Extra Old White Cheddar,President's ChoiceExtra Old White Cheddar400 g,$6.49ea,,$1.62/ 100g,False,
dairy_and_eggs,Pillsbury,Grands! Crescents,PillsburyGrands! Crescents318 g,$4.49ea,,$1.41/ 100g,False,
dairy_and_eggs,Activia,"Probiotic Yogurt With Fibre, Vanilla Flavour With Oats, Almonds, Pumpkin Seeds And Dried Cranberries, 3 Pack","ActiviaProbiotic Yogurt With Fibre, Vanilla Flavour With Oats, Almonds, Pumpkin Seeds And Dried Cranberries, 3 Pack3x150.0 g",$6.69ea,,$1.49/ 100g,False,
dairy_and_eggs,Oikos,"Fat Free Greek Yogurt, 30% Less Sugar, Mixed Berry Flavour, Blended","OikosFat Free Greek Yogurt, 30% Less Sugar, Mixed Berry Flavour, Blended4x100.0 g",$4.79ea,,$1.20/ 100g,False,
dairy_and_eggs,President's Choice,Lactose Free Plain Cream Cheese ,President's ChoiceLactose Free Plain Cream Cheese 250 g,$4.29ea,,$1.72/ 100g,False,
dairy_and_eggs,Pillsbury,Ciinnamon Rolls,PillsburyCiinnamon Rolls351 g,$4.49ea,,$1.28/ 100g,False,
dairy_and_eggs,No Name,1% M.F. Cottage Cheese,No Name1% M.F. Cottage Cheese750 g,$6.49ea,,$0.87/ 100g,False,
dairy_and_eggs,Gay Lea,Gold Sour Cream 18%,Gay LeaGold Sour Cream 18%425 ml,$4.79ea,,$1.13/ 100ml,False,
dairy_and_eggs,International Delight,"White Chocolate Mocha, Zero Sugar Coffee Creamer, Limited Edition","International DelightWhite Chocolate Mocha, Zero Sugar Coffee Creamer, Limited Edition946 ml",$5.99ea,,$0.63/ 100ml,False,
dairy_and_eggs,Heluva,"Sour Cream Dip, French Onion","HeluvaSour Cream Dip, French Onion680 g",$8.99ea,,$1.32/ 100g,False,
dairy_and_eggs,Liberte,Greek Peach 2% MF Yogurt,LiberteGreek Peach 2% MF Yogurt750 g,$6.49ea,,$0.87/ 100g,False,
dairy_and_eggs,Kraft,Shredded Parmesan Cheese,KraftShredded Parmesan Cheese200 g,$9.49ea,,$4.75/ 100g,False,
dairy_and_eggs,Kraft,Singles Original Slices,KraftSingles Original Slices825 g,$10.99ea,,$1.33/ 100g,False,
dairy_and_eggs,President's Choice,Shredded Feta Cheese,President's ChoiceShredded Feta Cheese300 g,$6.49ea,,$2.16/ 100g,False,
dairy_and_eggs,Activia,"Probiotic Yogurt With Fibre, Vanilla Flavour With Oats, Almonds, Pumpkin Seeds And Dried Cranberries, 3 Pack","ActiviaProbiotic Yogurt With Fibre, Vanilla Flavour With Oats, Almonds, Pumpkin Seeds And Dried Cranberries, 3 Pack3x150.0 g",$6.69ea,,$1.49/ 100g,False,
dairy_and_eggs,Pillsbury,Grands! Crescents,PillsburyGrands! Crescents318 g,$4.49ea,,$1.41/ 100g,False,
dairy_and_eggs,Oikos,"Fat Free Greek Yogurt, 30% Less Sugar, Mixed Berry Flavour, Blended","OikosFat Free Greek Yogurt, 30% Less Sugar, Mixed Berry Flavour, Blended4x100.0 g",$4.79ea,,$1.20/ 100g,False,
dairy_and_eggs,President's Choice,Lactose Free Plain Cream Cheese ,President's ChoiceLactose Free Plain Cream Cheese 250 g,$4.29ea,,$1.72/ 100g,False,
dairy_and_eggs,No Name,Original Cream Cheese Spread ,No NameOriginal Cream Cheese Spread 340 g,$5.49ea,,$1.61/ 100g,False,
dairy_and_eggs,President's Choice,Extra Old White Cheddar,President's ChoiceExtra Old White Cheddar400 g,$6.49ea,,$1.62/ 100g,False,
dairy_and_eggs,No Name,1% M.F. Cottage Cheese,No Name1% M.F. Cottage Cheese750 g,$6.49ea,,$0.87/ 100g,False,
dairy_and_eggs,Gay Lea,Gold Sour Cream 18%,Gay LeaGold Sour Cream 18%425 ml,$4.79ea,,$1.13/ 100ml,False,
dairy_and_eggs,No Name,Mild Cheddar Cheese,No NameMild Cheddar Cheese400 g,$5.99ea,,$1.50/ 100g,False,
dairy_and_eggs,Baileys,Original Irish Cream,BaileysOriginal Irish Cream400 ml,$4.39ea,$2.49ea,$0.62/ 100ml,True,saleEnds 04/05
dairy_and_eggs,Black Diamond,Cheddar Old Coloured Shred,Black DiamondCheddar Old Coloured Shred320 g,$6.99ea,,$2.18/ 100g,False,
dairy_and_eggs,President's Choice,Lactose Free Nacho Shredded Cheese Blend,President's ChoiceLactose Free Nacho Shredded Cheese Blend320 g,$6.49ea,,$2.03/ 100g,False,
dairy_and_eggs,Silk,"Coconut Yogurt Style, Raspberry Flavour, Plant Based Dairy Free Yogurt","SilkCoconut Yogurt Style, Raspberry Flavour, Plant Based Dairy Free Yogurt680 g",$7.49ea,,$1.10/ 100g,False,
dairy_and_eggs,Pillsbury,"Wiener Wrap, Regular","PillsburyWiener Wrap, Regular200 g",$3.19ea,,$1.60/ 100g,False,
dairy_and_eggs,Heluva,"Sour Cream Dip, French Onion","HeluvaSour Cream Dip, French Onion680 g",$8.99ea,,$1.32/ 100g,False,
dairy_and_eggs,Liberte,Greek Peach 2% MF Yogurt,LiberteGreek Peach 2% MF Yogurt750 g,$6.49ea,,$0.87/ 100g,False,
dairy_and_eggs,No Name,Pie Shells,No NamePie Shells350 g,$4.29ea,,$1.23/ 100g,False,
dairy_and_eggs,Pillsbury,Ciinnamon Rolls,PillsburyCiinnamon Rolls351 g,$4.49ea,,$1.28/ 100g,False,
dairy_and_eggs,President's Choice,Shredded Feta Cheese,President's ChoiceShredded Feta Cheese300 g,$6.49ea,,$2.16/ 100g,False,
dairy_and_eggs,Kraft,Shredded Parmesan Cheese,KraftShredded Parmesan Cheese200 g,$9.49ea,,$4.75/ 100g,False,
dairy_and_eggs,Kraft,Shaved Parmesan Cheese,KraftShaved Parmesan Cheese141 g,$7.99ea,,$5.67/ 100g,False,
dairy_and_eggs,Kraft,Singles Original Slices,KraftSingles Original Slices825 g,$10.99ea,,$1.33/ 100g,False,
dairy_and_eggs,Activia,"Probiotic Yogurt, Blackberry, Blueberry, Blackcurrent, Berries, 12XG","ActiviaProbiotic Yogurt, Blackberry, Blueberry, Blackcurrent, Berries, 12XG12x100.0 g",$8.49ea,,$0.71/ 100g,False,
dairy_and_eggs,Yummy Doh,Raw Cookie Dough Chocolate Chunk,Yummy DohRaw Cookie Dough Chocolate Chunk400 g,$6.49ea,,$1.62/ 100g,False,
dairy_and_eggs,No Name,Old Cheddar Cheese,No NameOld Cheddar Cheese400 g,$5.99ea,,$1.50/ 100g,False,
dairy_and_eggs,Black Diamond,Old Cheddar Cheese + Sea-Salted Roasted Cashews & Cherry Infused Dried Cranberries,Black DiamondOld Cheddar Cheese + Sea-Salted Roasted Cashews & Cherry Infused Dried Cranberries127.6 g,$5.79ea,,$4.54/ 100g,False,
dairy_and_eggs,Pillsbury,Chocolatey Chip Cookies,PillsburyChocolatey Chip Cookies468 g,$4.49ea,,$0.96/ 100g,False,
dairy_and_eggs,PC Blue Menu,Blue Menu Free Run Large Brown Eggs 12 Pack,PC Blue MenuBlue Menu Free Run Large Brown Eggs 12 Pack12 eggs,$7.59ea,,$0.63/ 1ea,False,
dairy_and_eggs,Beatrice,Vanila Milkshake Bottle,BeatriceVanila Milkshake Bottle460 ml,$3.49ea,,$0.76/ 100ml,False,
dairy_and_eggs,Philadelphia,Light Herb & Garlic Cream Cheese,PhiladelphiaLight Herb & Garlic Cream Cheese227 g,$5.49ea,,$2.42/ 100g,False,
dairy_and_eggs,Pillsbury,"Crescents Original Dough, 8 Pieces","PillsburyCrescents Original Dough, 8 Pieces226 g",$3.19ea,,$1.41/ 100g,False,
dairy_and_eggs,International Delight,"White Chocolate Mocha, Zero Sugar Coffee Creamer, Limited Edition","International DelightWhite Chocolate Mocha, Zero Sugar Coffee Creamer, Limited Edition946 ml",$5.99ea,,$0.63/ 100ml,False,
dairy_and_eggs,Becel,Margarine Salt Free,BecelMargarine Salt Free850 g,$9.29ea,,$1.09/ 100g,False,
dairy_and_eggs,President's Choice,Tex Mex Shredded Cheese Blend,President's ChoiceTex Mex Shredded Cheese Blend320 g,$6.49ea,,$2.03/ 100g,False,
dairy_and_eggs,No Name,Pizza Mozzarella Cheese with 28% M.F.,No NamePizza Mozzarella Cheese with 28% M.F.400 g,$5.99ea,,$1.50/ 100g,False,
dairy_and_eggs,Activia,"Probiotic Smoothie, Blueberry, Strawberry, & Beet, Drinkable Yogurt","ActiviaProbiotic Smoothie, Blueberry, Strawberry, & Beet, Drinkable Yogurt190 ml",$2.29ea,,$1.21/ 100ml,False,
dairy_and_eggs,Yoplait,Vanilla Yogurt,YoplaitVanilla Yogurt200 ml,$1.69ea,,$0.85/ 100ml,False,
dairy_and_eggs,Yoplait,"Yogurt Tubes, Strawberry Banana & Fruit Punch","YoplaitYogurt Tubes, Strawberry Banana & Fruit Punch8x56.0 g",$4.79ea,,$1.07/ 100g,False,
