category,brand,product_text,product_name,price_text,sale_price,per_unit_price_text,is_sale
dairy_and_eggs,President's Choice,Shredded Feta Cheese,President's ChoiceShredded Feta Cheese300 g,$6.49ea,,$2.16/ 100g,False
dairy_and_eggs,Lactantia,"Lactose Free Butter, Salted","LactantiaLactose Free Butter, Salted250 g",$6.39ea,,$2.56/ 100g,False
dairy_and_eggs,Beatrice,Vanila Milkshake Bottle,BeatriceVanila Milkshake Bottle460 ml,$3.49ea,,$0.76/ 100ml,False
dairy_and_eggs,Black Diamond,"Cheese Mozzarella, 27% M.F.","Black DiamondCheese Mozzarella, 27% M.F.400 g",$8.49ea,,$2.12/ 100g,False
dairy_and_eggs,Beatrice,"Sour Cream, Regular 14%","BeatriceSour Cream, Regular 14%500 ml",$4.29ea,,$0.86/ 100ml,False
dairy_and_eggs,Tofutti,Better Than Cream Cheese,TofuttiBetter Than Cream Cheese227 g,$5.29ea,,$2.33/ 100g,False
dairy_and_eggs,Black Diamond,Lactose Free Sliced Marble Cheese ,Black DiamondLactose Free Sliced Marble Cheese 220 g,$5.99ea,,$2.72/ 100g,False
dairy_and_eggs,Gray Ridge,Grade A Double Yolk White Eggs,Gray RidgeGrade A Double Yolk White Eggs12 eggs,$5.99ea,,$0.50/ 1ea,False
dairy_and_eggs,PC Organics,Organic Skim Milk,PC OrganicsOrganic Skim Milk4 l,$10.39ea,,$0.26/ 100ml,False
dairy_and_eggs,No Name,Cream Cheese Spread ,No NameCream Cheese Spread 227 g,$3.79ea,,$1.67/ 100g,False
dairy_and_eggs,Pillsbury,"Cinnamon Rolls, Strawberry","PillsburyCinnamon Rolls, Strawberry496 g",$4.19ea,,$0.84/ 100g,False
dairy_and_eggs,President's Choice,Lactose Free Nacho Shredded Cheese Blend,President's ChoiceLactose Free Nacho Shredded Cheese Blend320 g,$6.49ea,,$2.03/ 100g,False
dairy_and_eggs,Becel,Margarine with Avocado Oil,BecelMargarine with Avocado Oil427 g,$5.49ea,$4.99ea,$1.17/ 100g,True
dairy_and_eggs,Activia,"Probiotic Smoothie, Blueberry, Strawberry, & Beet, Drinkable Yogurt","ActiviaProbiotic Smoothie, Blueberry, Strawberry, & Beet, Drinkable Yogurt190 ml",$2.29ea,,$1.21/ 100ml,False
dairy_and_eggs,Gay Lea,"Nordica Cottage Cheese, Light 1%","Gay LeaNordica Cottage Cheese, Light 1%500 g",$5.49ea,,$1.10/ 100g,False
dairy_and_eggs,Lactantia,Butter Sticks Salted with Sea Salt,LactantiaButter Sticks Salted with Sea Salt454 g,$8.99ea,$7.99ea,$1.76/ 100g,True
dairy_and_eggs,Earth Island, Mozzarella Slices,Earth Island Mozzarella Slices200 g,$8.99ea,,$4.50/ 100g,False
dairy_and_eggs,Organic Meadow,"Organic Yogurt, Plain 3.8%","Organic MeadowOrganic Yogurt, Plain 3.8%750 g",$6.99ea,,$0.93/ 100g,False
dairy_and_eggs,No Name,Old Cheddar Cheese,No NameOld Cheddar Cheese400 g,$5.99ea,,$1.50/ 100g,False
dairy_and_eggs,Earth Island,Shredded Cheese Alternative Parmesan Style,Earth IslandShredded Cheese Alternative Parmesan Style113 g,$7.99ea,,$7.07/ 100g,False
dairy_and_eggs,Neilson,1% Milk,Neilson1% Milk1 l,$3.59ea,,$0.36/ 100ml,False
dairy_and_eggs,Liberte,Yogourt Orchard Peach 9 % M.F.,LiberteYogourt Orchard Peach 9 % M.F.4x100.0 g,$5.49ea,,$1.37/ 100g,False
dairy_and_eggs,PC Organics,Balkan Style Yogurt Plain 11 % M.F. ,PC OrganicsBalkan Style Yogurt Plain 11 % M.F. 500 g,$4.99ea,,$1.00/ 100g,False
dairy_and_eggs,Lactantia,Healthy Attitude Omega-3 Margarine,LactantiaHealthy Attitude Omega-3 Margarine850 g,$8.29ea,$7.49ea,$0.88/ 100g,True
dairy_and_eggs,Nestle,Coffee Mate Liquid Fat Free French Vanilla,NestleCoffee Mate Liquid Fat Free French Vanilla946 ml,$6.49ea,,$0.69/ 100ml,False
dairy_and_eggs,Armstrong,Combos - Mozzarella & Naturally Smoked Salami Sticks,ArmstrongCombos - Mozzarella & Naturally Smoked Salami Sticks180 g,$6.99ea,,$3.88/ 100g,False
dairy_and_eggs,Activia,"Plant-Based Probiotic Yogurt, Cherry And Peach, 8 Pack","ActiviaPlant-Based Probiotic Yogurt, Cherry And Peach, 8 Pack8x100.0 g",$6.69ea,,$0.84/ 100g,False
dairy_and_eggs,Nestle,Coffee Mate Liquid Creamer Caramel Macchiato,NestleCoffee Mate Liquid Creamer Caramel Macchiato946 ml,$6.49ea,,$0.69/ 100ml,False
dairy_and_eggs,Tre Stelle,Tre Stelle Cream Cheese Light    ,Tre StelleTre Stelle Cream Cheese Light    200 g,$4.49ea,,$2.25/ 100g,False
dairy_and_eggs,Liberte,Kéfir Organic 1% MF Raspberry,LiberteKéfir Organic 1% MF Raspberry1000 g,$6.99ea,,$0.70/ 100g,False
dairy_and_eggs,President's Choice,Mozzarella Cheese ,President's ChoiceMozzarella Cheese 400 g,$6.49ea,,$1.62/ 100g,False
dairy_and_eggs,Tim Hortons,Fine Grind Coffee Maple Roast Medium,Tim HortonsFine Grind Coffee Maple Roast Medium300 g,$10.99ea,,$3.66/ 100g,False
dairy_and_eggs,Riviera,"Goat Yogurt, Vanilla 4.9%","RivieraGoat Yogurt, Vanilla 4.9%500 g",$5.99ea,,$1.20/ 100ml,False
dairy_and_eggs,President's Choice,Plant Based Cultured Oat Yogurt Alternative Strawberry Vanilla,President's ChoicePlant Based Cultured Oat Yogurt Alternative Strawberry Vanilla500 g,$3.99ea,,$0.80/ 100g,False
dairy_and_eggs,Kiri,"Cheese, Cream Product Original 29.5% M.F.","KiriCheese, Cream Product Original 29.5% M.F.150 g",$3.99ea,,$2.66/ 100g,False
dairy_and_eggs,Armstrong,Combos - Marble & Naturally Smoked Ham Sausage Sticks,ArmstrongCombos - Marble & Naturally Smoked Ham Sausage Sticks180 g,$6.99ea,,$3.88/ 100g,False
dairy_and_eggs,Del Monte,Peach Chunks In Light Syrup 8 Cups X (1.52 L)  (Case),Del MontePeach Chunks In Light Syrup 8 Cups X (1.52 L)  (Case)8x190.0 ml,$18.99ea,,$1.25/ 100ml,False
dairy_and_eggs,Tim Hortons,"K-cup Pods Medium Roast, Maple","Tim HortonsK-cup Pods Medium Roast, Maple12 ea",$12.99ea,,$1.08/ 1ea,False
dairy_and_eggs,Yoso,Oat Unsweetened Yogurt Alternative,YosoOat Unsweetened Yogurt Alternative440 g,$6.49ea,,$1.48/ 100g,False
dairy_and_eggs,Black Diamond,Marble Cheese,Black DiamondMarble Cheese400 g,$8.49ea,,$2.12/ 100g,False
dairy_and_eggs,President's Choice,Tre Formaggi Shredded Cheese Blend,President's ChoiceTre Formaggi Shredded Cheese Blend320 g,$6.49ea,,$2.03/ 100g,False
dairy_and_eggs,PC Organics,Organic Skyr Yogurt 0% Mf Plain,PC OrganicsOrganic Skyr Yogurt 0% Mf Plain500 g,$5.49ea,,$1.10/ 100g,False
dairy_and_eggs,Gay Lea,"Nordica Cottage Cheese, Creamed 4%","Gay LeaNordica Cottage Cheese, Creamed 4%500 g",$5.49ea,,$1.10/ 100g,False
dairy_and_eggs,President's Choice,Plain 2% M.F. Greek Yogurt,President's ChoicePlain 2% M.F. Greek Yogurt908 g,$6.99ea,,$0.77/ 100g,False
dairy_and_eggs,siggi's,"Yogurt, Plain 0% M.F. Icelandic Skyr Thick Yogourt","siggi'sYogurt, Plain 0% M.F. Icelandic Skyr Thick Yogourt750 g",$7.79ea,,$1.04/ 100g,False
dairy_and_eggs,No Name,14% M.F. Regular Sour Cream,No Name14% M.F. Regular Sour Cream250 ml,$2.99ea,,$1.20/ 100ml,False
dairy_and_eggs,No Name,Cottage Cheese,No NameCottage Cheese250 g,$3.29ea,,$1.32/ 100g,False
dairy_and_eggs,Riviera,Coconut Milk Vegan Yogurt - Mango And Passion Fruit,RivieraCoconut Milk Vegan Yogurt - Mango And Passion Fruit500 g,$7.49ea,,$1.50/ 100g,False
dairy_and_eggs,No Name,Cheddar Flavour Processed Cheese Product Slices,No NameCheddar Flavour Processed Cheese Product Slices400 g,$4.29ea,,$1.07/ 100g,False
dairy_and_eggs,PC Blue Menu,Blue Menu Margarine with Olive Oil,PC Blue MenuBlue Menu Margarine with Olive Oil907 g,$6.49ea,$5.99ea,$0.66/ 100g,True
dairy_and_eggs,No Name,Cream Cheese Spread with Herbs & Roasted Garlic ,No NameCream Cheese Spread with Herbs & Roasted Garlic 227 g,$3.79ea,,$1.67/ 100g,False
dairy_and_eggs,Amooza,Pizza Mozzarella Cheese With Mild Cheddar Taste 22 % M.F.,AmoozaPizza Mozzarella Cheese With Mild Cheddar Taste 22 % M.F.228 g,$6.49ea,,$2.85/ 100g,False
dairy_and_eggs,Cracker Barrel,Slice Medium Cheddar,Cracker BarrelSlice Medium Cheddar240 g,$5.99ea,,$2.50/ 100g,False
dairy_and_eggs,President's Choice,Greek Yogurt Tzatziki Dip,President's ChoiceGreek Yogurt Tzatziki Dip227 g,$3.79ea,,$1.67/ 100g,False
dairy_and_eggs,Philadelphia,Dill Pickle Dip,PhiladelphiaDill Pickle Dip340 g,$7.99ea,,$2.35/ 100g,False
dairy_and_eggs,Astro,Original Balkan Yogourt 4% M.F.,AstroOriginal Balkan Yogourt 4% M.F.12x100.0 g,$8.49ea,,$0.71/ 100g,False
dairy_and_eggs,President's Choice,Vanilla Skyr Icelandic Style 0% M.F. Yogurt,President's ChoiceVanilla Skyr Icelandic Style 0% M.F. Yogurt500 g,$5.99ea,,$1.20/ 100g,False
dairy_and_eggs,Lactantia,Dairy Product 2% M.F.,LactantiaDairy Product 2% M.F.1.5 l,$5.59ea,,$0.37/ 100ml,False
dairy_and_eggs,Cracker Barrel,Sweet Combo,Cracker BarrelSweet Combo129 g,$5.79ea,,$4.49/ 100g,False
dairy_and_eggs,No Name,Cream Cheese Product With Jalapeño ,No NameCream Cheese Product With Jalapeño 227 g,$3.79ea,,$1.67/ 100g,False
dairy_and_eggs,Gray Ridge,"Grade A Brown Eggs, Extra Large","Gray RidgeGrade A Brown Eggs, Extra Large12 eggs",$5.79ea,,$0.48/ 1ea,False
dairy_and_eggs,Golden Gate,Mirage Margarine,Golden GateMirage Margarine907 g,$7.19ea,,$0.79/ 100g,False
dairy_and_eggs,Lactantia,2% M.F. Partly Skimmed Milk,Lactantia2% M.F. Partly Skimmed Milk2 l,$5.89ea,,$0.29/ 100ml,False
dairy_and_eggs,Gay Lea,Spreadables Butter With Canola Oil,Gay LeaSpreadables Butter With Canola Oil227 g,$5.49ea,,$2.42/ 100g,False
dairy_and_eggs,Becel,Margarine Salted Plant-Based Sticks,BecelMargarine Salted Plant-Based Sticks454 g,$5.49ea,$4.99ea,$1.10/ 100g,True
dairy_and_eggs,Philadelphia,Dill Pickle Dip,PhiladelphiaDill Pickle Dip227 g,$5.49ea,,$2.42/ 100g,False
dairy_and_eggs,No Name,"Cottage Cheese, 2% M.F.","No NameCottage Cheese, 2% M.F.500 g",$5.49ea,,$1.10/ 100g,False
dairy_and_eggs,Lactantia,"My Country Butter Sticks, Unsalted","LactantiaMy Country Butter Sticks, Unsalted4x113.5 g",$8.49ea,$7.99ea,$1.76/ 100g,True
dairy_and_eggs,No Name,Shredded Marble Farmer's Cheese,No NameShredded Marble Farmer's Cheese900 g,$14.99ea,,$1.67/ 100g,False
dairy_and_eggs,IOGO,"Yogurt Tubes, Strawberry & Peach","IOGOYogurt Tubes, Strawberry & Peach8x60.0 g",$4.49ea,,$0.94/ 100g,False
dairy_and_eggs,President's Choice,Jalapeno Greek Yogurt Dip,President's ChoiceJalapeno Greek Yogurt Dip227 g,$3.79ea,,$1.67/ 100g,False
dairy_and_eggs,Philadelphia,Strawberry Cream Cheese Product,PhiladelphiaStrawberry Cream Cheese Product227 g,$5.49ea,,$2.42/ 100g,False
dairy_and_eggs,Gay Lea,Salted Butter,Gay LeaSalted Butter454 g,$8.19ea,,$1.80/ 100g,False
dairy_and_eggs,Gray Ridge,"Grade A Premium White Eggs, Large","Gray RidgeGrade A Premium White Eggs, Large12 eggs",$4.59ea,,$0.38/ 1ea,False
dairy_and_eggs,Gay Lea,"Sour Cream, Low Fat 3%","Gay LeaSour Cream, Low Fat 3%500 ml",$4.29ea,,$0.86/ 100ml,False
dairy_and_eggs,No Name,French Onion Sour Cream Dip ,No NameFrench Onion Sour Cream Dip 250 g,$3.79ea,,$1.52/ 100g,False
dairy_and_eggs,PC Blue Menu,Blue Menu Original Margarine,PC Blue MenuBlue Menu Original Margarine907 g,$6.49ea,$5.99ea,$0.66/ 100g,True
dairy_and_eggs,Gay Lea,"Sour Cream, Regular 14%","Gay LeaSour Cream, Regular 14%250 ml",$3.29ea,,$1.32/ 100ml,False
dairy_and_eggs,Oikos,"Extra Creamy Greek Yogurtemon Meringue Flavour, 4% Mf","OikosExtra Creamy Greek Yogurtemon Meringue Flavour, 4% Mf4x95.0 g",$4.79ea,,$1.26/ 100g,False
dairy_and_eggs,Becel,Salted Plant-Based Margarine Bricks,BecelSalted Plant-Based Margarine Bricks454 g,$5.99ea,,$1.32/ 100g,False
dairy_and_eggs,IOGO,Yogurt 1.5% M.F. Variety Pack,IOGOYogurt 1.5% M.F. Variety Pack16x100.0 g,$8.99ea,,$0.56/ 100g,False
dairy_and_eggs,Pillsbury,Easy Roll Pie Crust   ,PillsburyEasy Roll Pie Crust   400 g,$4.49ea,,$1.12/ 100g,False
dairy_and_eggs,Philadelphia,Original Cream Cheese Product,PhiladelphiaOriginal Cream Cheese Product340 g,$7.99ea,,$2.35/ 100g,False
dairy_and_eggs,Liberte,Greek Plain 0% MF Yogurt,LiberteGreek Plain 0% MF Yogurt1000 g,$10.79ea,,$1.08/ 100g,False
dairy_and_eggs,Philadelphia,French Onion Dip,PhiladelphiaFrench Onion Dip227 g,$5.49ea,,$2.42/ 100g,False
dairy_and_eggs,Woolwich,Homogenized Goat Milk 3.25%MF  ,WoolwichHomogenized Goat Milk 3.25%MF  1 l,$4.59ea,,$0.46/ 100ml,False
dairy_and_eggs,Becel,Buttery Taste Margarine,BecelButtery Taste Margarine1.36 kg,$16.99ea,,$1.33/ 100g,False
dairy_and_eggs,Yoplait,Yop Drinkable Yogurt Peach Flavour 1% M.F.,YoplaitYop Drinkable Yogurt Peach Flavour 1% M.F.200 ml,$1.69ea,,$0.85/ 100ml,False
dairy_and_eggs,Savor,Grass Fed Unsalted Butter,SavorGrass Fed Unsalted Butter250 g,$7.99ea,,$3.20/ 100g,False
dairy_and_eggs,No Name,1% M.F. Fat Free Sour Cream ,No Name1% M.F. Fat Free Sour Cream 500 ml,$3.79ea,,$0.76/ 100ml,False
dairy_and_eggs,No Name,Medium Cheddar Cheese,No NameMedium Cheddar Cheese400 g,$5.99ea,,$1.50/ 100g,False
dairy_and_eggs,Neilson,"Flavoured Milk, Chocolate","NeilsonFlavoured Milk, Chocolate750 ml",$2.89ea,,$0.39/ 100ml,False
dairy_and_eggs,Oikos,"Fat Free Greek Yogurt, Peach-Mango Flavour, Fruit On The Bottom, 0% M.F.","OikosFat Free Greek Yogurt, Peach-Mango Flavour, Fruit On The Bottom, 0% M.F.4x100.0 g",$4.79ea,,$1.20/ 100g,False
dairy_and_eggs,International Delight,Classic French Vanilla Coffee Creamer,International DelightClassic French Vanilla Coffee Creamer1.42 l,$8.99ea,,$0.63/ 100ml,False
dairy_and_eggs,Starbucks,Almond And Oat Dairy Free Hazelnut Latte Coffee Enhancer,StarbucksAlmond And Oat Dairy Free Hazelnut Latte Coffee Enhancer828 ml,$7.99ea,,$0.96/ 100ml,False
dairy_and_eggs,Milk 2 Go,Strawberry,Milk 2 GoStrawberry473 ml,$2.79ea,$1.79ea,$0.38/ 100ml,True
dairy_and_eggs,Earth Balance,Organic Whipped Spread,Earth BalanceOrganic Whipped Spread369 g,$6.49ea,,$1.76/ 100g,False
dairy_and_eggs,Pillsbury,Crescents - Reduced Fat,PillsburyCrescents - Reduced Fat227 g,$3.19ea,,$1.41/ 100g,False
dairy_and_eggs,Neilson,Trutaste Skim Milk,NeilsonTrutaste Skim Milk1 l,$4.19ea,,$0.42/ 100ml,False
dairy_and_eggs,No Name,Swiss Cheese Slices,No NameSwiss Cheese Slices210 g,$4.99ea,,$2.38/ 100g,False
dairy_and_eggs,PC Organics,"Organic Kefir Milk, Strawberry","PC OrganicsOrganic Kefir Milk, Strawberry1000 ml",$5.49ea,,$0.55/ 100ml,False
dairy_and_eggs,International Delight,Classic Hazelnut Coffee Creamer,International DelightClassic Hazelnut Coffee Creamer1.42 l,$8.99ea,,$0.63/ 100ml,False
dairy_and_eggs,Olympic,"Organic Yogurt, French Vanilla","OlympicOrganic Yogurt, French Vanilla650 g",$4.99ea,,$0.77/ 100g,False
dairy_and_eggs,Neilson,Trutaste Light Cream,NeilsonTrutaste Light Cream473 ml,$3.79ea,,$0.80/ 100ml,False
dairy_and_eggs,Liberte,Goat Milk 2%MF,LiberteGoat Milk 2%MF4 l,$12.99ea,,$0.32/ 100ml,False
dairy_and_eggs,Oikos,"Greek Yogurt, Vanilla Flavour, 2% M.F.,  Blended","OikosGreek Yogurt, Vanilla Flavour, 2% M.F.,  Blended4x100.0 g",$4.79ea,,$1.20/ 100g,False
dairy_and_eggs,Neilson,Trutaste Lactose Free Skim Milk,NeilsonTrutaste Lactose Free Skim Milk2 l,$7.19ea,,$0.36/ 100ml,False
dairy_and_eggs,Kraft,Velveeta Processed Cheese Loaf,KraftVelveeta Processed Cheese Loaf450 g,$8.49ea,,$1.89/ 100g,False
dairy_and_eggs,Savor,Grass Fed Unsalted Butter,SavorGrass Fed Unsalted Butter250 g,$7.99ea,,$3.20/ 100g,False
dairy_and_eggs,Philadelphia,Strawberry Cream Cheese Product,PhiladelphiaStrawberry Cream Cheese Product227 g,$5.49ea,,$2.42/ 100g,False
dairy_and_eggs,Gay Lea,Salted Butter,Gay LeaSalted Butter454 g,$8.19ea,,$1.80/ 100g,False
dairy_and_eggs,Yoplait,Yop Drinkable Yogurt Peach Flavour 1% M.F.,YoplaitYop Drinkable Yogurt Peach Flavour 1% M.F.200 ml,$1.69ea,,$0.85/ 100ml,False
dairy_and_eggs,Natrel,Lactose Free 1% Dairy Product (2L),NatrelLactose Free 1% Dairy Product (2L)2 l,$7.09ea,,$0.35/ 100ml,False
dairy_and_eggs,President's Choice,Gouda Sliced Cheese,President's ChoiceGouda Sliced Cheese210 g,$4.99ea,,$2.38/ 100g,False
dairy_and_eggs,President's Choice,Havarti Cheese,President's ChoiceHavarti Cheese400 g,$6.49ea,,$1.62/ 100g,False
dairy_and_eggs,PC Organics,"Organic Greek Yogurt, Plain","PC OrganicsOrganic Greek Yogurt, Plain500 g",$6.49ea,,$1.30/ 100g,False
dairy_and_eggs,Neilson,TruTaste 1% Milk,NeilsonTruTaste 1% Milk4 l,$6.99ea,,$0.17/ 100ml,False
dairy_and_eggs,President's Choice,Havarti Sliced Cheese,President's ChoiceHavarti Sliced Cheese210 g,$4.99ea,,$2.38/ 100g,False
dairy_and_eggs,Neilson,Homogenized Milk,NeilsonHomogenized Milk2 l,$5.29ea,,$0.26/ 100ml,False
dairy_and_eggs,Silk,"Oat For Coffee, Vanilla, Plant Based, Dairy Free Coffee Creamer","SilkOat For Coffee, Vanilla, Plant Based, Dairy Free Coffee Creamer890 ml",$5.49ea,,$0.62/ 100ml,False
dairy_and_eggs,Oikos,"Greek Yogurt, Blueberry Flavour, Fruit On The Bottom, 2% M.F.","OikosGreek Yogurt, Blueberry Flavour, Fruit On The Bottom, 2% M.F.4x100.0 g",$4.79ea,,$1.20/ 100g,False
dairy_and_eggs,Yoplait,Yop Drinkable Yogurt  Strawberry-Banana Flavour,YoplaitYop Drinkable Yogurt  Strawberry-Banana Flavour200 ml,$1.69ea,,$0.85/ 100ml,False
dairy_and_eggs,Neilson,Trutaste Homogenized Milk Lactose Free 3.25% M.F.,NeilsonTrutaste Homogenized Milk Lactose Free 3.25% M.F.4 l,$10.99ea,,$0.27/ 100ml,False
dairy_and_eggs,President's Choice,Plain 0% M.F. Greek Yogurt ,President's ChoicePlain 0% M.F. Greek Yogurt 908 g,$6.99ea,,$0.77/ 100g,False
dairy_and_eggs,Neilson,Chocolate Milkshake,NeilsonChocolate Milkshake310 ml,$1.00ea,,$0.32/ 100ml,False
dairy_and_eggs,Nestle,Nesquik Milkshake,NestleNesquik Milkshake473 ml,$3.15ea,$1.79ea,$0.38/ 100ml,True
dairy_and_eggs,Liberte,Goat Milk 3.25% M.F,LiberteGoat Milk 3.25% M.F1 l,$5.49ea,,$0.55/ 100ml,False
dairy_and_eggs,Liberte,3.25% Goat Milk,Liberte3.25% Goat Milk4 l,$12.99ea,,$0.32/ 100ml,False
dairy_and_eggs,Armstrong,Marble Cheddar Cheese Slice,ArmstrongMarble Cheddar Cheese Slice240 g,$6.49ea,,$2.70/ 100g,False
dairy_and_eggs,Cracker Barrel,Sweet Combo,Cracker BarrelSweet Combo129 g,$5.79ea,,$4.49/ 100g,False
dairy_and_eggs,Activia,"Probiotic Smoothie, Mango, Peach & Carrot, Drinkable Yogurt","ActiviaProbiotic Smoothie, Mango, Peach & Carrot, Drinkable Yogurt190 ml",$2.29ea,,$1.21/ 100ml,False
dairy_and_eggs,Black Diamond,Sliced Marble Cheddar Cheese,Black DiamondSliced Marble Cheddar Cheese240 g,$5.99ea,,$2.50/ 100g,False
dairy_and_eggs,Black Diamond,Processed Cheddar Cheese Slices Thick,Black DiamondProcessed Cheddar Cheese Slices Thick410 g,$5.49ea,,$1.34/ 100g,False
dairy_and_eggs,No Name,Farmer's Marble Cheese,No NameFarmer's Marble Cheese700 g,$9.79ea,,$1.40/ 100g,False
dairy_and_eggs,The Greek Gods,"Greek Style Yogurt, Traditional Plain","The Greek GodsGreek Style Yogurt, Traditional Plain500 g",$5.49ea,,$1.10/ 100g,False
dairy_and_eggs,PC Organics,Organic Homogenized Milk,PC OrganicsOrganic Homogenized Milk2 l,$6.89ea,,$0.34/ 100ml,False
dairy_and_eggs,Earth Island,Cheddar Style Dairy-Free Cheese,Earth IslandCheddar Style Dairy-Free Cheese198 g,$6.99ea,,$3.53/ 100g,False
dairy_and_eggs,Neilson,French Vanilla Milkshake,NeilsonFrench Vanilla Milkshake310 ml,$1.00ea,,$0.32/ 100ml,False
dairy_and_eggs,President's Choice,Gouda Cheese,President's ChoiceGouda Cheese400 g,$6.49ea,,$1.62/ 100g,False
dairy_and_eggs,No Name,Light Medium Cheddar Cheese,No NameLight Medium Cheddar Cheese400 g,$5.99ea,,$1.50/ 100g,False
dairy_and_eggs,Activia,"Yogurt With Probiotics, Stawberry Vanilla Flavour","ActiviaYogurt With Probiotics, Stawberry Vanilla Flavour8x100.0 g",$6.69ea,,$0.84/ 100g,False
dairy_and_eggs,Olympic,"Fat Free Organic Yogurt, Plain","OlympicFat Free Organic Yogurt, Plain650 g",$4.99ea,,$0.77/ 100g,False
dairy_and_eggs,Philadelphia,Light Original Cream Cheese Product,PhiladelphiaLight Original Cream Cheese Product227 g,$5.49ea,,$2.42/ 100g,False
dairy_and_eggs,Oikos,"Fat Free Greek Yogurt, Cherry Flavour, Fruit On The Bottom, 0% M.F.","OikosFat Free Greek Yogurt, Cherry Flavour, Fruit On The Bottom, 0% M.F.4x100.0 g",$4.79ea,,$1.20/ 100g,False
dairy_and_eggs,Savor,Grass Fed Salted Butter,SavorGrass Fed Salted Butter250 g,$7.99ea,,$3.20/ 100g,False
dairy_and_eggs,Kraft,Cheez Whiz Cheese Spread,KraftCheez Whiz Cheese Spread450 g,$6.29ea,,$1.40/ 100g,False
dairy_and_eggs,Yoplait,Source Vanilla  Yogurt 0% MF,YoplaitSource Vanilla  Yogurt 0% MF630 g,$3.75ea,$3.49ea,$0.55/ 100g,True
dairy_and_eggs,Yoplait,Source Strawberry 0% MF,YoplaitSource Strawberry 0% MF630 g,$3.75ea,$3.49ea,$0.55/ 100g,True
dairy_and_eggs,President's Choice,Lactose Free 14% M.F. Sour Cream,President's ChoiceLactose Free 14% M.F. Sour Cream500 ml,$4.49ea,,$0.90/ 100ml,False
dairy_and_eggs,Liberte,Grk Ex Crm Vanilla 5%,LiberteGrk Ex Crm Vanilla 5%650 g,$6.49ea,,$1.00/ 100g,False
dairy_and_eggs,Liberte,Greek Yogurt Double Cream Plain 8% MF,LiberteGreek Yogurt Double Cream Plain 8% MF650 g,$6.49ea,,$1.00/ 100g,False
dairy_and_eggs,Liberte,Greek Vanilla 2% MF Yogurt,LiberteGreek Vanilla 2% MF Yogurt750 g,$6.49ea,,$0.87/ 100g,False
dairy_and_eggs,Cracker Barrel,Shreds Double Ched,Cracker BarrelShreds Double Ched320 g,$7.99ea,,$2.50/ 100g,False
dairy_and_eggs,Black Diamond,Cheestrings Mozzarella 18% M.F.,Black DiamondCheestrings Mozzarella 18% M.F.336 g,$6.99ea,,$2.08/ 100g,False
dairy_and_eggs,Activia,"Probiotics Yogurt, Yellow Apple/Apricot/Mango/Peach","ActiviaProbiotics Yogurt, Yellow Apple/Apricot/Mango/Peach12x100.0 g",$6.99ea,,$0.58/ 100g,False
dairy_and_eggs,Yoplait,Tubes Mixed Berry,YoplaitTubes Mixed Berry8x56.0 g,$3.75ea,$3.49ea,$0.78/ 100g,True
dairy_and_eggs,Activia,"Yogurt With Probiotics, Mango Flavour Tub","ActiviaYogurt With Probiotics, Mango Flavour Tub650 g",$4.49ea,$3.49ea,$0.54/ 100g,True
dairy_and_eggs,Burnbrae Farms,"Egg Creations, Original","Burnbrae FarmsEgg Creations, Original500 g",$5.29ea,,$1.06/ 100g,False
dairy_and_eggs,Cracker Barrel,Bar Old Cheddar,Cracker BarrelBar Old Cheddar400 g,$9.79ea,,$2.45/ 100g,False
dairy_and_eggs,President's Choice,Triple Cheddar Shredded Cheese Blend ,President's ChoiceTriple Cheddar Shredded Cheese Blend 620 g,$12.49ea,,$2.01/ 100g,False
dairy_and_eggs,Olympic,Organic Yogurt Plain,OlympicOrganic Yogurt Plain1.75 kg,$11.99ea,$11.49ea,$0.66/ 100g,True
dairy_and_eggs,Activia,"Yogurt With Probiotics, Vanilla Flavour","ActiviaYogurt With Probiotics, Vanilla Flavour650 g",$4.49ea,$3.49ea,$0.54/ 100g,True
dairy_and_eggs,Yoplait,Tubes Limited Edition,YoplaitTubes Limited Edition8x56.0 g,$3.75ea,$3.49ea,$0.78/ 100g,True
dairy_and_eggs,Yoplait,Tubes Strawberry Yogurt,YoplaitTubes Strawberry Yogurt8x56.0 g,$3.75ea,$3.49ea,$0.78/ 100g,True
dairy_and_eggs,Burnbrae Farms,Naturegg Simply Egg Whites,Burnbrae FarmsNaturegg Simply Egg Whites1 ea,$5.29ea,,$1.06/ 100ml,False
dairy_and_eggs,Activia,"Probiotic Yogurt, Strawberry/Blueberry/Raspberry/Peach Flavour","ActiviaProbiotic Yogurt, Strawberry/Blueberry/Raspberry/Peach Flavour12x100.0 g",$6.99ea,,$0.58/ 100g,False
dairy_and_eggs,The A2 Milk Company,2% M.F. Partly Skimmed Milk,The A2 Milk Company2% M.F. Partly Skimmed Milk2 l,$6.69ea,,$0.33/ 100ml,False
dairy_and_eggs,Starbucks,Cinnamon Dolce Latte,StarbucksCinnamon Dolce Latte828 ml,$7.99ea,,$0.96/ 100ml,False
dairy_and_eggs,Nestle,Coffee Mate Coffee Enhancer Hazelnut Value Size,NestleCoffee Mate Coffee Enhancer Hazelnut Value Size1.89 l,$8.99ea,,$0.48/ 100ml,False
dairy_and_eggs,Oikos,"Greek Yogurt, Strawberry Flavour, Fruit On The Bottom, 2% M.F.","OikosGreek Yogurt, Strawberry Flavour, Fruit On The Bottom, 2% M.F.4x100.0 g",$4.79ea,,$1.20/ 100g,False
dairy_and_eggs,Starbucks,White Chocolate Mocha Liquid Coffee Enhancer,StarbucksWhite Chocolate Mocha Liquid Coffee Enhancer828 ml,$7.99ea,,$0.96/ 100ml,False
dairy_and_eggs,Silk,"Dairy-Free Whipping Cream Alternative, Coconut based","SilkDairy-Free Whipping Cream Alternative, Coconut based473 ml",$5.49ea,,$1.16/ 100ml,False
dairy_and_eggs,Silk,"Coconut Yogurt Style, Plain, Unsweetened, Plant Based Dairy Free Yogurt","SilkCoconut Yogurt Style, Plain, Unsweetened, Plant Based Dairy Free Yogurt680 g",$7.49ea,,$1.10/ 100g,False
dairy_and_eggs,Oikos,"Greek Yogurt, Strawberry-Banana Flavour, Blended, 2% M.F.","OikosGreek Yogurt, Strawberry-Banana Flavour, Blended, 2% M.F.4x100.0 g",$4.79ea,,$1.20/ 100g,False
dairy_and_eggs,Neilson,Buttermilk,NeilsonButtermilk1 l,$4.49ea,,$0.45/ 100ml,False
dairy_and_eggs,Lactantia,Chocolate Milk,LactantiaChocolate Milk1.5 l,$5.59ea,,$0.37/ 100ml,False
dairy_and_eggs,PC Organics,"Organic Fresh Churned Butter, Salted","PC OrganicsOrganic Fresh Churned Butter, Salted250 g",$6.99ea,,$2.80/ 100g,False
dairy_and_eggs,Black Diamond,Cheddar Cheese Thin Slices,Black DiamondCheddar Cheese Thin Slices410 g,$5.49ea,,$1.34/ 100g,False
dairy_and_eggs,PC Organics,Organic 14% M.F. Sour Cream,PC OrganicsOrganic 14% M.F. Sour Cream500 g,$5.29ea,,$1.06/ 100g,False
dairy_and_eggs,Neilson,TruTaste 1% Milk,NeilsonTruTaste 1% Milk2 l,$5.69ea,,$0.28/ 100ml,False
dairy_and_eggs,Black Diamond,"Cheddar Cheese Style Light, 22 Slices","Black DiamondCheddar Cheese Style Light, 22 Slices410 g",$5.49ea,,$1.34/ 100g,False
dairy_and_eggs,Neilson,Caramel Chocolate Milkshake,NeilsonCaramel Chocolate Milkshake310 ml,$1.00ea,,$0.32/ 100ml,False
dairy_and_eggs,Organic Meadow,Vanilla Kefir,Organic MeadowVanilla Kefir1 l,$6.99ea,,$0.70/ 100ml,False
dairy_and_eggs,Neilson,Skim Milk,NeilsonSkim Milk2 l,$5.19ea,,$0.26/ 100ml,False
dairy_and_eggs,Kraft,Singles Original Thick Slices,KraftSingles Original Thick Slices410 g,$6.29ea,,$1.53/ 100g,False
dairy_and_eggs,President's Choice,Phyllo Pastry,President's ChoicePhyllo Pastry454 g,$4.69ea,,$1.03/ 100g,False
dairy_and_eggs,Fairlife,Ultrafiltered Partly Skimmed Milk Lactose Free 2% M.F,FairlifeUltrafiltered Partly Skimmed Milk Lactose Free 2% M.F240 ml,$2.89ea,,$1.20/ 100ml,False
dairy_and_eggs,Silk,"Soy For Coffee, Original Coffee Creamer","SilkSoy For Coffee, Original Coffee Creamer890 ml",$5.49ea,,$0.62/ 100ml,False
dairy_and_eggs,Lactantia,"Lactose Free Butter, Unsalted","LactantiaLactose Free Butter, Unsalted250 g",$6.39ea,,$2.56/ 100g,False
dairy_and_eggs,Liberte,Méditerranée Raspbery Cheesecake 9%MF Yogurt,LiberteMéditerranée Raspbery Cheesecake 9%MF Yogurt500 g,$5.79ea,,$1.16/ 100g,False
dairy_and_eggs,Liberte,Greek Grk Ex Crm Str/Ban 5%,LiberteGreek Grk Ex Crm Str/Ban 5%650 g,$6.49ea,,$1.00/ 100g,False
dairy_and_eggs,Liberte,Greek Mango 0% MF Yogurt,LiberteGreek Mango 0% MF Yogurt750 g,$6.49ea,,$0.87/ 100g,False
dairy_and_eggs,Liberte,Greek Plain 0% MF Yogurt,LiberteGreek Plain 0% MF Yogurt750 g,$6.49ea,,$0.87/ 100g,False
dairy_and_eggs,Cracker Barrel,Shreds Tex Mex,Cracker BarrelShreds Tex Mex320 g,$7.99ea,,$2.50/ 100g,False
dairy_and_eggs,No Name,Farmer's Marble Cheese,No NameFarmer's Marble Cheese400 g,$5.99ea,,$1.50/ 100g,False
