category,brand,product_text,product_name,price_text,sale_price,per_unit_price_text,is_sale
dairy_and_eggs,President's Choice,Banana 2% M.F. Greek Yogurt,President's ChoiceBanana 2% M.F. Greek Yogurt4x100.0 g,$3.79ea,,$0.95/ 100g,False
dairy_and_eggs,Burnbrae Farms,"Egg Creations! Whole Eggs, Original","Burnbrae FarmsEgg Creations! Whole Eggs, Original500 g",$5.29ea,,$1.06/ 100g,False
dairy_and_eggs,Oikos,"High Protein Greek Yogurt, Vanilla Flavour, Blended, Value Tub","OikosHigh Protein Greek Yogurt, Vanilla Flavour, Blended, Value Tub650 g",$7.49ea,,$1.15/ 100g,False
dairy_and_eggs,Activia,"Probiotic Yogurt, Raspberry/Apple/Blackberry/Strawberry Flavour, 12XG","ActiviaProbiotic Yogurt, Raspberry/Apple/Blackberry/Strawberry Flavour, 12XG12x100.0 g",$6.99ea,,$0.58/ 100g,False
dairy_and_eggs,Yoplait,Special Edition Yogurt,YoplaitSpecial Edition Yogurt8x56.0 g,$3.49ea,,$0.78/ 100g,False
dairy_and_eggs,Oikos,"High Protein Greek Yogurt, Strawberry-Raspberry Flavour, Blended, Value Tub","OikosHigh Protein Greek Yogurt, Strawberry-Raspberry Flavour, Blended, Value Tub650 g",$7.49ea,,$1.15/ 100g,False
dairy_and_eggs,President's Choice,Shredded Pizza Mozzarella Cheese,President's ChoiceShredded Pizza Mozzarella Cheese620 g,$12.49ea,,$2.01/ 100g,False
dairy_and_eggs,President's Choice,Tre Formaggi Shredded Cheese Blend,President's ChoiceTre Formaggi Shredded Cheese Blend620 g,$12.49ea,,$2.01/ 100g,False
dairy_and_eggs,Oikos,"Greek Yogurt, Plain, No Added Sugar, 2% Mf, Value Tub","OikosGreek Yogurt, Plain, No Added Sugar, 2% Mf, Value Tub750 g",$7.49ea,,$1.00/ 100g,False
dairy_and_eggs,Activia,"Yogurt With Probiotics, Peach Flavour Tub","ActiviaYogurt With Probiotics, Peach Flavour Tub650 g",$4.49ea,$3.49ea,$0.54/ 100g,True
dairy_and_eggs,President's Choice,Peach Mango 2% M.F. Greek Yogurt,President's ChoicePeach Mango 2% M.F. Greek Yogurt4x100.0 g,$3.79ea,,$0.95/ 100g,False
dairy_and_eggs,Oikos,"Fat Free Greek Yogurt, Vanilla Flavour, Blended, 0% M.F.","OikosFat Free Greek Yogurt, Vanilla Flavour, Blended, 0% M.F.750 g",$7.49ea,,$1.00/ 100g,False
dairy_and_eggs,Activia,"Probiotic Yogurt, Blueberry/Vanilla","ActiviaProbiotic Yogurt, Blueberry/Vanilla12x100.0 g",$6.99ea,,$0.58/ 100g,False
dairy_and_eggs,IOGO,"Nano Drinkable Yogurt, Raspberry","IOGONano Drinkable Yogurt, Raspberry6x93.0 ml",$4.99ea,,$0.89/ 100ml,False
dairy_and_eggs,IOGO,"Drinkable Yogurt, Banana 1.5%","IOGODrinkable Yogurt, Banana 1.5%6x93.0 ml",$4.99ea,,$0.89/ 100ml,False
dairy_and_eggs,Silk,"Almond Plant Based Yogurt, Plain, Unsweetened, Dairy-Free","SilkAlmond Plant Based Yogurt, Plain, Unsweetened, Dairy-Free640 g",$7.49ea,,$1.17/ 100g,False
dairy_and_eggs,Neilson,TruTaste Skim Milk,NeilsonTruTaste Skim Milk4 l,$6.99ea,,$0.17/ 100ml,False
dairy_and_eggs,Riviera,Oat Based Vegan Delight Plain,RivieraOat Based Vegan Delight Plain650 g,$7.49ea,,$1.15/ 100g,False
dairy_and_eggs,Neilson,"Milk, Ultrafiltered Partly Skimmed 2% M.F.","NeilsonMilk, Ultrafiltered Partly Skimmed 2% M.F.1 l",$4.69ea,$3.29ea,$0.33/ 100ml,True
dairy_and_eggs,No Name,Old Cheddar Cheese Slices ,No NameOld Cheddar Cheese Slices 210 g,$4.99ea,,$2.38/ 100g,False
dairy_and_eggs,International Delight,"Caramel Waffle Cookie, Limited Edition Coffee Creamer","International DelightCaramel Waffle Cookie, Limited Edition Coffee Creamer946 ml",$5.99ea,,$0.63/ 100ml,False
dairy_and_eggs,Organic Meadow,"Kéfir, Plain","Organic MeadowKéfir, Plain1 l",$6.99ea,,$0.70/ 100ml,False
dairy_and_eggs,siggi's,"Yogurt, Vanilla Cinnamon 3.25% M.F. Creamy Skyr","siggi'sYogurt, Vanilla Cinnamon 3.25% M.F. Creamy Skyr650 g",$7.79ea,,$1.20/ 100g,False
dairy_and_eggs,Kraft,Singles Original Slices,KraftSingles Original Slices410 g,$6.29ea,,$1.53/ 100g,False
dairy_and_eggs,IOGO,Nanö Drinkable Yogurt Strawberry 1 % M.F.,IOGONanö Drinkable Yogurt Strawberry 1 % M.F.900 ml,$5.99ea,,$0.67/ 100ml,False
dairy_and_eggs,Starbucks,Caramel Macchiato Liquid Coffee Enhancer,StarbucksCaramel Macchiato Liquid Coffee Enhancer828 ml,$7.99ea,,$0.96/ 100ml,False
dairy_and_eggs,President's Choice,Cheddar Cheese with Habanero,President's ChoiceCheddar Cheese with Habanero400 g,$6.49ea,,$1.62/ 100g,False
dairy_and_eggs,Oikos,"Greek Yogurt, Raspberry-Pomegramate Flavour, Fruit On Bottom, 2% M.F.,","OikosGreek Yogurt, Raspberry-Pomegramate Flavour, Fruit On Bottom, 2% M.F.,4x100.0 g",$4.79ea,,$1.20/ 100g,False
dairy_and_eggs,Lactantia,1% M.F. Partly Skimmed Milk,Lactantia1% M.F. Partly Skimmed Milk2 l,$5.89ea,,$0.29/ 100ml,False
dairy_and_eggs,Neilson,Homogenized Milk 3.25%,NeilsonHomogenized Milk 3.25%4 l,$6.89ea,,$0.17/ 100ml,False
dairy_and_eggs,International Delight,"Zero Sugar Hazelnut Coffee Creamer,","International DelightZero Sugar Hazelnut Coffee Creamer,946 ml",$5.99ea,,$0.63/ 100ml,False
dairy_and_eggs,Earth Island,Mozzarella Style Dairy-Free Cheese,Earth IslandMozzarella Style Dairy-Free Cheese198 g,$6.99ea,,$3.53/ 100g,False
dairy_and_eggs,Neilson,Partly Skimmed Milk 1% MF,NeilsonPartly Skimmed Milk 1% MF4 l,$6.19ea,,$0.15/ 100ml,False
dairy_and_eggs,No Name,Old Cheddar Cheese,No NameOld Cheddar Cheese200 g,$4.29ea,,$2.15/ 100g,False
dairy_and_eggs,Silk,"Plant Based Dairy Free Coconut Yogurt, Vanilla Flavour, 4 pack","SilkPlant Based Dairy Free Coconut Yogurt, Vanilla Flavour, 4 pack100 g",$4.29ea,,$4.29/ 100g,False
dairy_and_eggs,Danone,"Drinkable Yogurt, Strawberry, Made With Real Fruit, 2% M.F.","DanoneDrinkable Yogurt, Strawberry, Made With Real Fruit, 2% M.F.190 ml",$1.29ea,,$0.68/ 100ml,False
dairy_and_eggs,Follow Your Heart,Soy Free Vegenaise,Follow Your HeartSoy Free Vegenaise473 ml,$9.49ea,,$2.01/ 100ml,False
dairy_and_eggs,Neilson,2% Milk,Neilson2% Milk1 l,$3.59ea,,$0.36/ 100ml,False
dairy_and_eggs,President,Premium Salted Cultured Butter,PresidentPremium Salted Cultured Butter250 g,$5.19ea,$4.99ea,$2.00/ 100g,True
dairy_and_eggs,Liberte,Méditerranée Plain 10% MF Yogurt Limited Edition,LiberteMéditerranée Plain 10% MF Yogurt Limited Edition900 g,$6.49ea,,$0.72/ 100g,False
dairy_and_eggs,Liberte,Yogourt Black Cherry 9 % M.F.,LiberteYogourt Black Cherry 9 % M.F.4x100.0 g,$5.49ea,,$1.37/ 100g,False
dairy_and_eggs,Liberte,Greek 5% M.F Plain Yogourt,LiberteGreek 5% M.F Plain Yogourt650 g,$6.49ea,,$1.00/ 100g,False
dairy_and_eggs,Cracker Barrel,Shreds 3 Cheese Mexicana,Cracker BarrelShreds 3 Cheese Mexicana320 g,$7.99ea,,$2.50/ 100g,False
dairy_and_eggs,Yoplait,Minigo 3% MF Fresh Cheese Strawberry/Strawberry-Vanilla/Strawberry-Banana,YoplaitMinigo 3% MF Fresh Cheese Strawberry/Strawberry-Vanilla/Strawberry-Banana6x60.0 g,$3.75ea,$3.49ea,$0.97/ 100g,True
dairy_and_eggs,President's Choice,Blueberry Fruit On The Bottom 0% M.F. Greek Yogurt,President's ChoiceBlueberry Fruit On The Bottom 0% M.F. Greek Yogurt4x100.0 g,$3.79ea,,$0.95/ 100g,False
dairy_and_eggs,No Name,Shredded Medium Cheddar,No NameShredded Medium Cheddar320 g,$5.99ea,,$1.87/ 100g,False
dairy_and_eggs,No Name,Shredded Nacho Cheese Blend,No NameShredded Nacho Cheese Blend320 g,$5.99ea,,$1.87/ 100g,False
dairy_and_eggs,Oikos,"Fat Free Greek Yogurt, High Protein, Plain, 0% M.F.","OikosFat Free Greek Yogurt, High Protein, Plain, 0% M.F.650 g",$7.49ea,,$1.15/ 100g,False
dairy_and_eggs,Activia,"Yogurt With Probiotics, Cherry Flavour","ActiviaYogurt With Probiotics, Cherry Flavour650 g",$4.49ea,$3.49ea,$0.54/ 100g,True
dairy_and_eggs,Activia,"Yogurt With Probiotics, Blueberry Flavour","ActiviaYogurt With Probiotics, Blueberry Flavour650 g",$4.49ea,$3.49ea,$0.54/ 100g,True
dairy_and_eggs,Cracker Barrel,Bar Marble Cheddar,Cracker BarrelBar Marble Cheddar400 g,$9.79ea,,$2.45/ 100g,False
dairy_and_eggs,Activia,"Yogurt With Probiotics, Strawberry Flavour","ActiviaYogurt With Probiotics, Strawberry Flavour12x100.0 g",$6.99ea,,$0.58/ 100g,False
dairy_and_eggs,Activia,"Yogurt With Probioticsactose Free, Vanilla, Strawberry, Raspberry, Cherry Flavour","ActiviaYogurt With Probioticsactose Free, Vanilla, Strawberry, Raspberry, Cherry Flavour12x100.0 g",$6.99ea,,$0.58/ 100g,False
dairy_and_eggs,Activia,"Yogurt With Probiotics & Fibre, 3X Vanilla, 3X Blueberry, 3X Peach, 3X Strawberry Kiwi,","ActiviaYogurt With Probiotics & Fibre, 3X Vanilla, 3X Blueberry, 3X Peach, 3X Strawberry Kiwi,12x100.0 g",$6.99ea,,$0.58/ 100g,False
dairy_and_eggs,Cracker Barrel,Shreds Mozza Cheddar,Cracker BarrelShreds Mozza Cheddar320 g,$7.99ea,,$2.50/ 100g,False
dairy_and_eggs,No Name,Marble Cheddar Cheese Light,No NameMarble Cheddar Cheese Light400 g,$5.99ea,,$1.50/ 100g,False
dairy_and_eggs,No Name,Shredded Mild White Cheddar Cheese,No NameShredded Mild White Cheddar Cheese320 g,$5.99ea,,$1.87/ 100g,False
dairy_and_eggs,Fairlife,Lactose Free Skim Ultrafiltered Milk,FairlifeLactose Free Skim Ultrafiltered Milk1.5 l,$5.49ea,$5.29ea,$0.35/ 100ml,True
dairy_and_eggs,Liberte,Greek Raspberry 5% MF Yogurt,LiberteGreek Raspberry 5% MF Yogurt4x100.0 g,$5.49ea,,$1.37/ 100g,False
dairy_and_eggs,IOGO,"Lactose Free Yogurt, Vanilla 1.5%","IOGOLactose Free Yogurt, Vanilla 1.5%650 g",$4.49ea,,$0.69/ 100g,False
dairy_and_eggs,Rowe Farms,Green Valley Eggs Size Large Free Run Brown,Rowe FarmsGreen Valley Eggs Size Large Free Run Brown12 eggs,$6.69ea,,$0.56/ 1ea,False
dairy_and_eggs,Activia,"Yogurt With Probiotics, Raspberry Flavour","ActiviaYogurt With Probiotics, Raspberry Flavour650 g",$4.49ea,$3.49ea,$0.54/ 100g,True
dairy_and_eggs,Activia,"Immune System, Probiotic Yogurt Drink, Strawberry Drinkable Yogurt, 8 Pack","ActiviaImmune System, Probiotic Yogurt Drink, Strawberry Drinkable Yogurt, 8 Pack8x93.0 ml",$7.99ea,,$1.07/ 100ml,False
dairy_and_eggs,Liberte,Greek Vanilla Bean 5% MF Yogurt,LiberteGreek Vanilla Bean 5% MF Yogurt4x100.0 g,$5.49ea,,$1.37/ 100g,False
dairy_and_eggs,Baileys,Original Irish Cream,BaileysOriginal Irish Cream400 ml,$4.39ea,,$1.10/ 100ml,False
dairy_and_eggs,Nestle,Rolo Milkshake,NestleRolo Milkshake473 ml,$3.15ea,$1.79ea,$0.38/ 100ml,True
dairy_and_eggs,Oikos,"Greek Yogurt, Banana Flavour, Blended, 2% Mf, 4X100G","OikosGreek Yogurt, Banana Flavour, Blended, 2% Mf, 4X100G4x100.0 g",$4.79ea,,$1.20/ 100g,False
dairy_and_eggs,Oikos,"Fat Free Greek Yogurt, 30% Less Sugar, Mixed Berry Flavour, Blended","OikosFat Free Greek Yogurt, 30% Less Sugar, Mixed Berry Flavour, Blended4x100.0 g",$4.79ea,,$1.20/ 100g,False
dairy_and_eggs,Activia,"Probiotic Yogurt With Fibre, Vanilla Flavour With Oats, Almonds, Pumpkin Seeds And Dried Cranberries, 3 Pack","ActiviaProbiotic Yogurt With Fibre, Vanilla Flavour With Oats, Almonds, Pumpkin Seeds And Dried Cranberries, 3 Pack3x150.0 g",$6.69ea,,$1.49/ 100g,False
dairy_and_eggs,Becel,Margarine Original,BecelMargarine Original850 g,$9.29ea,,$1.09/ 100g,False
dairy_and_eggs,Pillsbury,"Crescents Original Dough, 8 Pieces","PillsburyCrescents Original Dough, 8 Pieces226 g",$3.19ea,,$1.41/ 100g,False
dairy_and_eggs,Becel,Margarine Salt Free,BecelMargarine Salt Free850 g,$9.29ea,,$1.09/ 100g,False
dairy_and_eggs,Liberte,Méditerranée Apple Pie 9%MF Yogurt,LiberteMéditerranée Apple Pie 9%MF Yogurt500 g,$5.79ea,,$1.16/ 100g,False
dairy_and_eggs,Liberte,Greek Lactose Free Plain 0% MF Yogurt,LiberteGreek Lactose Free Plain 0% MF Yogurt750 g,$6.49ea,,$0.87/ 100g,False
dairy_and_eggs,Liberte,Greek Peach 2% MF Yogurt,LiberteGreek Peach 2% MF Yogurt750 g,$6.49ea,,$0.87/ 100g,False
dairy_and_eggs,Liberte,Greek Lactose Free Vanilla 0% MF Yogurt,LiberteGreek Lactose Free Vanilla 0% MF Yogurt750 g,$6.49ea,,$0.87/ 100g,False
dairy_and_eggs,Astro,"Original Balkan Style Yogurt, Plain 2%","AstroOriginal Balkan Style Yogurt, Plain 2%750 g",$4.99ea,,$0.67/ 100g,False
dairy_and_eggs,Activia,Yogurt With Probioticsemon Flavour,ActiviaYogurt With Probioticsemon Flavour650 g,$4.49ea,$3.49ea,$0.54/ 100g,True
dairy_and_eggs,Activia,"Yogurt With Probiotics, Strawberry Flavour","ActiviaYogurt With Probiotics, Strawberry Flavour650 g",$4.49ea,$3.49ea,$0.54/ 100g,True
dairy_and_eggs,Yoplait,"Yogurt Tubes, Strawberry Banana & Fruit Punch","YoplaitYogurt Tubes, Strawberry Banana & Fruit Punch8x56.0 g",$3.75ea,$3.49ea,$0.78/ 100g,True
dairy_and_eggs,Fairlife,Lactose Free Whole Ultrafiltered Milk,FairlifeLactose Free Whole Ultrafiltered Milk1.5 l,$5.49ea,$5.29ea,$0.35/ 100ml,True
dairy_and_eggs,Oikos,"Greek Yogurt, Vanilla Flavour, 2% M.F., Value Tub","OikosGreek Yogurt, Vanilla Flavour, 2% M.F., Value Tub750 g",$7.49ea,,$1.00/ 100g,False
dairy_and_eggs,Activia,"Probiotic Yogurt, Blackberry, Blueberry, Blackcurrent, Berries, 12XG","ActiviaProbiotic Yogurt, Blackberry, Blueberry, Blackcurrent, Berries, 12XG12x100.0 g",$6.99ea,,$0.58/ 100g,False
dairy_and_eggs,No Name,Light Part Skim Mozzarella Cheese,No NameLight Part Skim Mozzarella Cheese400 g,$5.99ea,,$1.50/ 100g,False
dairy_and_eggs,Yoplait,Minigo 3% MF Duo Fresh Cheese Strawberry-Banana/Blueberry-Strawberry/Banana-Blueberry,YoplaitMinigo 3% MF Duo Fresh Cheese Strawberry-Banana/Blueberry-Strawberry/Banana-Blueberry6x60.0 g,$3.75ea,$3.49ea,$0.97/ 100g,True
dairy_and_eggs,Oikos,"High Protein Greek Yogurt, Zesty Lemon & Lime Flavour, Blended, Value Tub","OikosHigh Protein Greek Yogurt, Zesty Lemon & Lime Flavour, Blended, Value Tub650 g",$7.49ea,,$1.15/ 100g,False
dairy_and_eggs,Activia,"Yogurt With Probiotics, Fieldberry Flavour Tub","ActiviaYogurt With Probiotics, Fieldberry Flavour Tub650 g",$4.49ea,$3.49ea,$0.54/ 100g,True
dairy_and_eggs,Cracker Barrel,Bar Medium Cheddar,Cracker BarrelBar Medium Cheddar400 g,$9.79ea,,$2.45/ 100g,False
dairy_and_eggs,No Name,Pizza Mozzarella Cheese with 28% M.F.,No NamePizza Mozzarella Cheese with 28% M.F.400 g,$5.99ea,,$1.50/ 100g,False
dairy_and_eggs,No Name,Light Part Skim Mozzarella Cheese,No NameLight Part Skim Mozzarella Cheese400 g,$5.99ea,,$1.50/ 100g,False
dairy_and_eggs,Yoplait,Minigo 3% MF Duo Fresh Cheese Strawberry-Banana/Blueberry-Strawberry/Banana-Blueberry,YoplaitMinigo 3% MF Duo Fresh Cheese Strawberry-Banana/Blueberry-Strawberry/Banana-Blueberry6x60.0 g,$3.75ea,$3.49ea,$0.97/ 100g,True
dairy_and_eggs,No Name,Tart Shells,No NameTart Shells30 ea,$7.49ea,,$1.31/ 100g,False
dairy_and_eggs,siggi's,"Yogurt, Plain 0% M.F. Icelandic Skyr Thick Yogourt","siggi'sYogurt, Plain 0% M.F. Icelandic Skyr Thick Yogourt750 g",$7.79ea,,$1.04/ 100g,False
dairy_and_eggs,No Name,14% M.F. Regular Sour Cream,No Name14% M.F. Regular Sour Cream250 ml,$2.99ea,,$1.20/ 100ml,False
dairy_and_eggs,No Name,Cheddar Flavour Processed Cheese Product Slices,No NameCheddar Flavour Processed Cheese Product Slices400 g,$4.29ea,,$1.07/ 100g,False
dairy_and_eggs,PC Blue Menu,Blue Menu Margarine with Olive Oil,PC Blue MenuBlue Menu Margarine with Olive Oil907 g,$6.49ea,$5.99ea,$0.66/ 100g,True
dairy_and_eggs,No Name,Cream Cheese Spread with Herbs & Roasted Garlic ,No NameCream Cheese Spread with Herbs & Roasted Garlic 227 g,$3.79ea,,$1.67/ 100g,False
dairy_and_eggs,Amooza,Pizza Mozzarella Cheese With Mild Cheddar Taste 22 % M.F.,AmoozaPizza Mozzarella Cheese With Mild Cheddar Taste 22 % M.F.228 g,$6.49ea,,$2.85/ 100g,False
dairy_and_eggs,Cracker Barrel,Slice Medium Cheddar,Cracker BarrelSlice Medium Cheddar240 g,$5.99ea,,$2.50/ 100g,False
dairy_and_eggs,Astro,Original Balkan Yogourt 4% M.F.,AstroOriginal Balkan Yogourt 4% M.F.12x100.0 g,$8.49ea,,$0.71/ 100g,False
dairy_and_eggs,President's Choice,Vanilla Skyr Icelandic Style 0% M.F. Yogurt,President's ChoiceVanilla Skyr Icelandic Style 0% M.F. Yogurt500 g,$5.99ea,,$1.20/ 100g,False
dairy_and_eggs,Lactantia,Dairy Product 2% M.F.,LactantiaDairy Product 2% M.F.1.5 l,$5.59ea,,$0.37/ 100ml,False
dairy_and_eggs,Cracker Barrel,Sweet Combo,Cracker BarrelSweet Combo129 g,$5.79ea,,$4.49/ 100g,False
dairy_and_eggs,Tre Stelle,Tre Stelle Cream Cheese Light    ,Tre StelleTre Stelle Cream Cheese Light    200 g,$4.49ea,,$2.25/ 100g,False
dairy_and_eggs,Tim Hortons,Fine Grind Coffee Maple Roast Medium,Tim HortonsFine Grind Coffee Maple Roast Medium300 g,$10.99ea,,$3.66/ 100g,False
dairy_and_eggs,Liberte,Kéfir Organic 1% MF Raspberry,LiberteKéfir Organic 1% MF Raspberry1000 g,$6.99ea,,$0.70/ 100g,False
dairy_and_eggs,President's Choice,Plant Based Cultured Oat Yogurt Alternative Strawberry Vanilla,President's ChoicePlant Based Cultured Oat Yogurt Alternative Strawberry Vanilla500 g,$3.99ea,,$0.80/ 100g,False
dairy_and_eggs,Yoso,Oat Unsweetened Yogurt Alternative,YosoOat Unsweetened Yogurt Alternative440 g,$6.49ea,,$1.48/ 100g,False
dairy_and_eggs,Black Diamond,Marble Cheese,Black DiamondMarble Cheese400 g,$8.49ea,,$2.12/ 100g,False
dairy_and_eggs,PC Organics,Balkan Style Yogurt Plain 11 % M.F. ,PC OrganicsBalkan Style Yogurt Plain 11 % M.F. 500 g,$4.99ea,,$1.00/ 100g,False
dairy_and_eggs,Nestle,Coffee Mate Liquid Fat Free French Vanilla,NestleCoffee Mate Liquid Fat Free French Vanilla946 ml,$6.49ea,,$0.69/ 100ml,False
dairy_and_eggs,Lactantia,Healthy Attitude Omega-3 Margarine,LactantiaHealthy Attitude Omega-3 Margarine850 g,$8.29ea,$7.49ea,$0.88/ 100g,True
dairy_and_eggs,IOGO,"Yogurt Tubes, Strawberry & Peach","IOGOYogurt Tubes, Strawberry & Peach8x60.0 g",$4.49ea,,$0.94/ 100g,False
dairy_and_eggs,Savor,Grass Fed Unsalted Butter,SavorGrass Fed Unsalted Butter250 g,$7.99ea,,$3.20/ 100g,False
dairy_and_eggs,President's Choice,Tre Formaggi Shredded Cheese Blend,President's ChoiceTre Formaggi Shredded Cheese Blend320 g,$6.49ea,,$2.03/ 100g,False
dairy_and_eggs,President,Premium Unsalted Cultured Butter,PresidentPremium Unsalted Cultured Butter250 g,$5.19ea,$4.99ea,$2.00/ 100g,True
dairy_and_eggs,Liberte,Greek Blueberry 0% MF Yogurt,LiberteGreek Blueberry 0% MF Yogurt750 g,$6.49ea,,$0.87/ 100g,False
dairy_and_eggs,No Name,Sour Cream 14%,No NameSour Cream 14%500 ml,$3.79ea,,$0.76/ 100ml,False
dairy_and_eggs,IOGO,"Nano Drinkable Yogurt, Strawberry","IOGONano Drinkable Yogurt, Strawberry6x93.0 ml",$4.99ea,,$0.89/ 100ml,False
dairy_and_eggs,Oikos,"Fat Free Greek Yogurt, Plain, No Added Sugar Value Tub","OikosFat Free Greek Yogurt, Plain, No Added Sugar Value Tub750 g",$7.49ea,,$1.00/ 100g,False
