category,brand,product_text,product_name,price_text,sale_price,per_unit_price_text,is_sale,sale_valid_to
dairy_and_eggs,Heluva,Sour Cream Dip Nacho Queso Supreme,HeluvaSour Cream Dip Nacho Queso Supreme250 g,$4.49ea,,$1.80/ 100g,False,
dairy_and_eggs,Lactantia,Chocolate Milk,LactantiaChocolate Milk1.5 l,$5.59ea,,$0.37/ 100ml,False,
dairy_and_eggs,Neilson,Original Chocolate Milkshake,NeilsonOriginal Chocolate Milkshake310 ml,$2.79ea,,$0.90/ 100ml,False,
dairy_and_eggs,Tre Stelle,Tre Stelle Cream Cheese Original    ,Tre StelleTre Stelle Cream Cheese Original    200 g,$4.49ea,,$2.25/ 100g,False,
dairy_and_eggs,Fairlife,Chocolate Lactose Free 2% Partly Skimmed Ultrafiltered Milk,FairlifeChocolate Lactose Free 2% Partly Skimmed Ultrafiltered Milk1.5 l,$5.79ea,,$0.39/ 100ml,False,
dairy_and_eggs,International Delight,Reduced Sugar French Vanilla Coffee Creamer,International DelightReduced Sugar French Vanilla Coffee Creamer946 ml,$5.99ea,,$0.63/ 100ml,False,
dairy_and_eggs,Becel,Margarine with Olive Oil,BecelMargarine with Olive Oil454 g,$5.49ea,,$1.29/ 100g,False,
dairy_and_eggs,Neilson,TruTaste 1% Milk,NeilsonTruTaste 1% Milk2 l,$5.69ea,,$0.28/ 100ml,False,
dairy_and_eggs,Lactantia,"Fresh Churned Butter, Salted","LactantiaFresh Churned Butter, Salted454 g",$9.29ea,,$2.05/ 100g,False,
dairy_and_eggs,Neilson,"Cream, 18%","NeilsonCream, 18%473 ml",$3.99ea,$3.49ea,$0.74/ 100ml,True,saleEnds 03/01
dairy_and_eggs,Neilson,Buttermilk,NeilsonButtermilk1 l,$4.49ea,,$0.45/ 100ml,False,
dairy_and_eggs,Neilson,Partly Skimmed Milk 2% MF,NeilsonPartly Skimmed Milk 2% MF4 l,$6.19ea,,$0.15/ 100ml,False,
dairy_and_eggs,Natrel,Lactose Free 2% Dairy Product (2L),NatrelLactose Free 2% Dairy Product (2L)2 l,$7.09ea,,$0.35/ 100ml,False,
dairy_and_eggs,No Name,5% M.F. Light Sour Cream,No Name5% M.F. Light Sour Cream500 ml,$3.99ea,,$0.80/ 100ml,False,
dairy_and_eggs,Neilson,Caramel Chocolate Milkshake,NeilsonCaramel Chocolate Milkshake310 ml,$2.79ea,,$0.90/ 100ml,False,
dairy_and_eggs,President's Choice,Country Churned Unsalted Butter ,President's ChoiceCountry Churned Unsalted Butter 454 g,$8.49ea,,$1.87/ 100g,False,
dairy_and_eggs,Neilson,Skim Milk,NeilsonSkim Milk2 l,$5.19ea,,$0.26/ 100ml,False,
dairy_and_eggs,Becel,Margarine with Oat Beverage,BecelMargarine with Oat Beverage850 g,$9.29ea,,$1.09/ 100g,False,
dairy_and_eggs,Becel,Margarine with Oat Beverage,BecelMargarine with Oat Beverage427 g,$5.49ea,,$1.29/ 100g,False,
dairy_and_eggs,Starbucks,White Chocolate Mocha Liquid Coffee Enhancer,StarbucksWhite Chocolate Mocha Liquid Coffee Enhancer828 ml,$7.99ea,,$0.96/ 100ml,False,
dairy_and_eggs,Neilson,Whipping Cream 35 percent MF,NeilsonWhipping Cream 35 percent MF1 l,$9.49ea,,$0.95/ 100ml,False,
dairy_and_eggs,Neilson,Half & Half Cream,NeilsonHalf & Half Cream237 ml,$2.59ea,,$1.09/ 100ml,False,
dairy_and_eggs,Milk 2 Go,Chocolate Partly Skimmed Milk 1% M.F. 6 x,Milk 2 GoChocolate Partly Skimmed Milk 1% M.F. 6 x6x200.0 ml,$6.19ea,$4.49ea,$374.17/ 100ml,True,saleEnds 04/05
dairy_and_eggs,Oikos,"Greek Yogurt, Pineapple Flavour, Fruit On The Bottom, 2% M.F.","OikosGreek Yogurt, Pineapple Flavour, Fruit On The Bottom, 2% M.F.4x100.0 g",$4.79ea,,$1.20/ 100g,False,
dairy_and_eggs,Oikos,Maple Syrup 2% M.F. Greek Yogurt,OikosMaple Syrup 2% M.F. Greek Yogurt4x100.0 g,$4.79ea,,$1.20/ 100g,False,
dairy_and_eggs,Oikos,"Greek Yogurt, Strawberry-Banana Flavour, Blended, 2% M.F.","OikosGreek Yogurt, Strawberry-Banana Flavour, Blended, 2% M.F.4x100.0 g",$4.79ea,,$1.20/ 100g,False,
dairy_and_eggs,Oikos,"Greek Yogurt, Strawberry Raspberry, Fruit On The Bottom, 2% M.F.","OikosGreek Yogurt, Strawberry Raspberry, Fruit On The Bottom, 2% M.F.4x100.0 g",$4.79ea,,$1.20/ 100g,False,
dairy_and_eggs,Burnbrae Farms,"Egg Creations! Whole Eggs, Original","Burnbrae FarmsEgg Creations! Whole Eggs, Original500 g",$5.29ea,,$1.06/ 100g,False,
dairy_and_eggs,Oikos,"Fat Free Greek Yogurt, 30% Less Sugar, Peach Flavour, Blended","OikosFat Free Greek Yogurt, 30% Less Sugar, Peach Flavour, Blended4x100.0 g",$4.79ea,,$1.20/ 100g,False,
dairy_and_eggs,Burnbrae Farms,Naturegg Egg Whites,Burnbrae FarmsNaturegg Egg Whites2x250.0 ea,$5.29ea,,$1.06/ 100ml,False,
dairy_and_eggs,PC Blue Menu,Egg Whites,PC Blue MenuEgg Whites1 kg,$7.99ea,,$0.80/ 100g,False,
dairy_and_eggs,Oikos,"Greek Yogurt, Strawberry Flavour, Fruit On The Bottom, 2% M.F.","OikosGreek Yogurt, Strawberry Flavour, Fruit On The Bottom, 2% M.F.4x100.0 g",$4.79ea,,$1.20/ 100g,False,
dairy_and_eggs,Black Diamond,"Cheddar Cheese Style Light, 22 Slices","Black DiamondCheddar Cheese Style Light, 22 Slices410 g",$5.49ea,,$1.34/ 100g,False,
dairy_and_eggs,Neilson,Trutaste Homogenized Milk,NeilsonTrutaste Homogenized Milk4 l,$7.59ea,,$0.19/ 100ml,False,
dairy_and_eggs,International Delight,"Caramel Waffle Cookie Coffee Enhancer, Limited Edition","International DelightCaramel Waffle Cookie Coffee Enhancer, Limited Edition946 ml",$5.99ea,,$0.63/ 100ml,False,
dairy_and_eggs,International Delight,"Zero Sugar Hazelnut Coffee Creamer,","International DelightZero Sugar Hazelnut Coffee Creamer,946 ml",$5.99ea,,$0.63/ 100ml,False,
dairy_and_eggs,Philadelphia,Herb & Garlic Cream Cheese Product,PhiladelphiaHerb & Garlic Cream Cheese Product340 g,$7.99ea,,$2.35/ 100g,False,
dairy_and_eggs,Gay Lea,"Real Whipped Cream, Light","Gay LeaReal Whipped Cream, Light225 g",$4.49ea,,$2.00/ 100g,False,
dairy_and_eggs,Starbucks,Caramel Macchiato Liquid Coffee Enhancer,StarbucksCaramel Macchiato Liquid Coffee Enhancer828 ml,$7.99ea,,$0.96/ 100ml,False,
dairy_and_eggs,Neilson,Homogenized Milk 3.25%,NeilsonHomogenized Milk 3.25%4 l,$6.89ea,,$0.17/ 100ml,False,
dairy_and_eggs,Neilson,Table Cream,NeilsonTable Cream1 l,$7.19ea,,$0.72/ 100ml,False,
dairy_and_eggs,Natrel,Lactose Free Fat Free Skim 0% Dairy Product (2L),NatrelLactose Free Fat Free Skim 0% Dairy Product (2L)2 l,$7.09ea,,$0.35/ 100ml,False,
dairy_and_eggs,Neilson,TruTaste 2% Milk,NeilsonTruTaste 2% Milk1 l,$4.19ea,,$0.42/ 100ml,False,
dairy_and_eggs,No Name,Pasteurized Light Cream Cheese Spread,No NamePasteurized Light Cream Cheese Spread250 g,$3.99ea,,$1.60/ 100g,False,
dairy_and_eggs,President's Choice,Cheddar Cheese with Habanero,President's ChoiceCheddar Cheese with Habanero400 g,$6.49ea,,$1.62/ 100g,False,
dairy_and_eggs,Milk 2 Go,Chocolate,Milk 2 GoChocolate473 ml,$2.79ea,$1.79ea,$0.38/ 100ml,True,saleEnds 03/08
dairy_and_eggs,Neilson,2% Milk,Neilson2% Milk1 l,$3.59ea,,$0.36/ 100ml,False,
dairy_and_eggs,Danone,Strawberry Flavoured Paw Patrol Yogurt Drink For Kids,DanoneStrawberry Flavoured Paw Patrol Yogurt Drink For Kids8x93.0 ml,$5.99ea,,$0.81/ 100ml,False,
dairy_and_eggs,Starbucks,Almond And Oat Dairy Free Caramel Macchiato Coffee Enhancer,StarbucksAlmond And Oat Dairy Free Caramel Macchiato Coffee Enhancer828 ml,$7.99ea,,$0.96/ 100ml,False,
dairy_and_eggs,Imperial,Margarine Club Pack,ImperialMargarine Club Pack1.36 kg,$8.99ea,,$0.71/ 100g,False,
dairy_and_eggs,Philadelphia,Original Cream Cheese Product,PhiladelphiaOriginal Cream Cheese Product227 g,$5.49ea,,$2.42/ 100g,False,
dairy_and_eggs,Philadelphia,Light Cream Cheese,PhiladelphiaLight Cream Cheese450 g,$9.49ea,,$2.11/ 100g,False,
dairy_and_eggs,Becel,Margarine Vegan,BecelMargarine Vegan850 g,$9.29ea,,$1.09/ 100g,False,
dairy_and_eggs,International Delight,"French Vanilla Flavoured Fat Free Coffee Creamer, 63 Servings","International DelightFrench Vanilla Flavoured Fat Free Coffee Creamer, 63 Servings946 ml",$5.99ea,,$0.63/ 100ml,False,
dairy_and_eggs,Fairlife,Lactose Free Skim Ultrafiltered Milk,FairlifeLactose Free Skim Ultrafiltered Milk1.5 l,$5.79ea,,$0.39/ 100ml,False,
dairy_and_eggs,Becel,Margarine Original,BecelMargarine Original1.7 kg,$16.99ea,,$1.00/ 100g,False,
dairy_and_eggs,Neilson,"Chocolate Milk, 25% Less Sugar","NeilsonChocolate Milk, 25% Less Sugar1 l",$3.59ea,,$0.36/ 100ml,False,
dairy_and_eggs,Neilson,TruTaste Skim Milk,NeilsonTruTaste Skim Milk4 l,$6.99ea,,$0.17/ 100ml,False,
dairy_and_eggs,Lactantia,"Butter Sticks, Salted","LactantiaButter Sticks, Salted4x113.0 g",$8.99ea,,$1.99/ 100g,False,
dairy_and_eggs,International Delight,Irish Creme Coffee Creamer,International DelightIrish Creme Coffee Creamer946 ml,$5.99ea,,$0.63/ 100ml,False,
dairy_and_eggs,Philadelphia,Light Cream Cheese,PhiladelphiaLight Cream Cheese450 g,$9.49ea,,$2.11/ 100g,False,
dairy_and_eggs,Becel,Margarine Vegan,BecelMargarine Vegan850 g,$9.29ea,,$1.09/ 100g,False,
dairy_and_eggs,International Delight,"French Vanilla Flavoured Fat Free Coffee Creamer, 63 Servings","International DelightFrench Vanilla Flavoured Fat Free Coffee Creamer, 63 Servings946 ml",$5.99ea,,$0.63/ 100ml,False,
dairy_and_eggs,Fairlife,Lactose Free Skim Ultrafiltered Milk,FairlifeLactose Free Skim Ultrafiltered Milk1.5 l,$5.79ea,,$0.39/ 100ml,False,
dairy_and_eggs,Becel,Margarine Original,BecelMargarine Original1.7 kg,$16.99ea,,$1.00/ 100g,False,
dairy_and_eggs,Lactantia,1% M.F. Partly Skimmed Milk,Lactantia1% M.F. Partly Skimmed Milk2 l,$5.89ea,,$0.29/ 100ml,False,
dairy_and_eggs,Neilson,"Chocolate Milk, 25% Less Sugar","NeilsonChocolate Milk, 25% Less Sugar1 l",$3.59ea,,$0.36/ 100ml,False,
dairy_and_eggs,Oikos,"Greek Yogurtimited Edition, Vanilla Chai Flavour, 4X100G","OikosGreek Yogurtimited Edition, Vanilla Chai Flavour, 4X100G4x100.0 g",$4.79ea,,$1.20/ 100g,False,
dairy_and_eggs,Oikos,"Greek Yogurt, Raspberry-Pomegramate Flavour, Fruit On Bottom, 2% M.F.,","OikosGreek Yogurt, Raspberry-Pomegramate Flavour, Fruit On Bottom, 2% M.F.,4x100.0 g",$4.79ea,,$1.20/ 100g,False,
dairy_and_eggs,Pillsbury,Holiday Premium Edition Cookies,PillsburyHoliday Premium Edition Cookies396 g,$4.49ea,,$1.13/ 100g,False,
dairy_and_eggs,Burnbrae Farms,Eggs2go! 6 Hard Boiled Peeled Eggs,Burnbrae FarmsEggs2go! 6 Hard Boiled Peeled Eggs6 ea,$5.59ea,,$0.93/ 1ea,False,
dairy_and_eggs,Nestle,Rolo Milkshake,NestleRolo Milkshake473 ml,$3.15ea,$1.79ea,$0.38/ 100ml,True,saleEnds 03/08
dairy_and_eggs,Woolwich,Partially Skimmed Goat Milk 2%,WoolwichPartially Skimmed Goat Milk 2%1 l,$4.59ea,,$0.46/ 100ml,False,
dairy_and_eggs,Lactantia,"Lactose Free Butter, Salted","LactantiaLactose Free Butter, Salted250 g",$6.79ea,,$2.72/ 100g,False,
dairy_and_eggs,PC Organics,Organic Partly Skimmed 2% Milk,PC OrganicsOrganic Partly Skimmed 2% Milk2 l,$7.09ea,,$0.35/ 100ml,False,
dairy_and_eggs,Philadelphia,Smoked Salmon Cream Cheese Product,PhiladelphiaSmoked Salmon Cream Cheese Product227 g,$5.49ea,,$2.42/ 100g,False,
dairy_and_eggs,Becel,Margarine Original,BecelMargarine Original427 g,$5.49ea,,$1.29/ 100g,False,
dairy_and_eggs,Becel,Unsalted Plant-Based Margarine Bricks,BecelUnsalted Plant-Based Margarine Bricks454 g,$5.99ea,,$1.32/ 100g,False,
dairy_and_eggs,No Name,Pasteurized Cream Cheese,No NamePasteurized Cream Cheese250 g,$3.99ea,,$1.60/ 100g,False,
dairy_and_eggs,Neilson,Strawberry Milkshake,NeilsonStrawberry Milkshake310 ml,$2.79ea,,$0.90/ 100ml,False,
dairy_and_eggs,Becel,Margarine Original,BecelMargarine Original850 g,$9.29ea,,$1.09/ 100g,False,
dairy_and_eggs,Neilson,TruTaste Homogenized Milk,NeilsonTruTaste Homogenized Milk2 l,$6.19ea,,$0.31/ 100ml,False,
dairy_and_eggs,Philadelphia,Original Cream Cheese,PhiladelphiaOriginal Cream Cheese227 g,$6.49ea,,$2.86/ 100g,False,
dairy_and_eggs,Pillsbury,Reese Cookie Dough,PillsburyReese Cookie Dough454 g,$5.29ea,,$1.17/ 100g,False,
dairy_and_eggs,Neilson,2% Milk,Neilson2% Milk2 l,$5.19ea,,$0.26/ 100ml,False,
dairy_and_eggs,Philadelphia,Herb & Garlic Cream Cheese Product,PhiladelphiaHerb & Garlic Cream Cheese Product227 g,$5.49ea,,$2.42/ 100g,False,
dairy_and_eggs,Nestle,Coffee Crisp Milkshake,NestleCoffee Crisp Milkshake473 ml,$3.15ea,$1.79ea,$0.38/ 100ml,True,saleEnds 03/08
dairy_and_eggs,Philadelphia,Whipped Original Cream Cheese Product,PhiladelphiaWhipped Original Cream Cheese Product227 g,$5.49ea,,$2.42/ 100g,False,
dairy_and_eggs,Lactantia,Unsalted Butter,LactantiaUnsalted Butter454 g,$9.29ea,,$2.05/ 100g,False,
dairy_and_eggs,Neilson,"Flavoured Milk, Chocolate","NeilsonFlavoured Milk, Chocolate4 l",$8.19ea,,$0.20/ 100ml,False,
dairy_and_eggs,No Name,Salted Butter,No NameSalted Butter454 g,$6.49ea,,$1.43/ 100g,False,
dairy_and_eggs,Fairlife,Lactose Free Whole Ultrafiltered Milk,FairlifeLactose Free Whole Ultrafiltered Milk1.5 l,$5.79ea,,$0.39/ 100ml,False,
dairy_and_eggs,Neilson,Trutaste No Lactose 3.25% Milk,NeilsonTrutaste No Lactose 3.25% Milk2 l,$7.09ea,,$0.35/ 100ml,False,
dairy_and_eggs,International Delight,Caramel Macchiato,International DelightCaramel Macchiato946 ml,$5.99ea,,$0.63/ 100ml,False,
dairy_and_eggs,No Name,Unsalted Butter,No NameUnsalted Butter454 g,$6.49ea,,$1.43/ 100g,False,
dairy_and_eggs,Oikos,"Greek Yogurt, Banana Flavour, Blended, 2% Mf, 4X100G","OikosGreek Yogurt, Banana Flavour, Blended, 2% Mf, 4X100G4x100.0 g",$4.79ea,,$1.20/ 100g,False,
dairy_and_eggs,Oikos,"Greek Yogurt, Key Lime Flavour, 2% M.F., Blended","OikosGreek Yogurt, Key Lime Flavour, 2% M.F., Blended4x100.0 g",$4.79ea,,$1.20/ 100g,False,
dairy_and_eggs,Activia,"Plant-Based Probiotic Yogurt, Cherry And Peach, 8 Pack","ActiviaPlant-Based Probiotic Yogurt, Cherry And Peach, 8 Pack8x100.0 g",$6.69ea,,$0.84/ 100g,False,
dairy_and_eggs,Milk 2 Go,Strawberry,Milk 2 GoStrawberry473 ml,$2.79ea,$1.79ea,$0.38/ 100ml,True,saleEnds 03/08
dairy_and_eggs,PC Blue Menu,Blue Menu Original Margarine,PC Blue MenuBlue Menu Original Margarine907 g,$6.49ea,,$0.72/ 100g,False,
dairy_and_eggs,Neilson,Trutaste Light Cream,NeilsonTrutaste Light Cream1 l,$3.99ea,$3.49ea,$0.35/ 100ml,True,saleEnds 03/01
dairy_and_eggs,Philadelphia,Strawberry Cream Cheese Product,PhiladelphiaStrawberry Cream Cheese Product227 g,$5.49ea,,$2.42/ 100g,False,
dairy_and_eggs,Neilson,Half and Half Cream,NeilsonHalf and Half Cream1 l,$3.99ea,$3.49ea,$0.35/ 100ml,True,saleEnds 03/01
dairy_and_eggs,No Name,Sour Cream 14%,No NameSour Cream 14%500 ml,$3.99ea,,$0.80/ 100ml,False,
dairy_and_eggs,Neilson,1% Milk,Neilson1% Milk1 l,$3.59ea,,$0.36/ 100ml,False,
dairy_and_eggs,No Name,French Onion Sour Cream Dip ,No NameFrench Onion Sour Cream Dip 250 g,$3.99ea,,$1.60/ 100g,False,
dairy_and_eggs,The A2 Milk Company,1% M.F. Partly Skimmed Milk,The A2 Milk Company1% M.F. Partly Skimmed Milk2 l,$6.69ea,,$0.33/ 100ml,False,
dairy_and_eggs,Philadelphia,Strawberry Cream Cheese Product,PhiladelphiaStrawberry Cream Cheese Product227 g,$5.49ea,,$2.42/ 100g,False,
dairy_and_eggs,Neilson,Half and Half Cream,NeilsonHalf and Half Cream1 l,$3.99ea,$3.49ea,$0.35/ 100ml,True,saleEnds 03/01
dairy_and_eggs,No Name,Cream Cheese Spread with Herbs & Roasted Garlic ,No NameCream Cheese Spread with Herbs & Roasted Garlic 227 g,$3.99ea,,$1.76/ 100g,False,
dairy_and_eggs,No Name,Sour Cream 14%,No NameSour Cream 14%500 ml,$3.99ea,,$0.80/ 100ml,False,
dairy_and_eggs,Neilson,1% Milk,Neilson1% Milk1 l,$3.59ea,,$0.36/ 100ml,False,
dairy_and_eggs,International Delight,Classic Hazelnut Coffee Creamer,International DelightClassic Hazelnut Coffee Creamer1.42 l,$8.99ea,,$0.63/ 100ml,False,
dairy_and_eggs,siggi's,"Yogurt, Plain 0% M.F. Icelandic Skyr Thick Yogourt","siggi'sYogurt, Plain 0% M.F. Icelandic Skyr Thick Yogourt750 g",$7.79ea,,$1.04/ 100g,False,
dairy_and_eggs,President's Choice,Vanilla Skyr Icelandic Style 0% M.F. Yogurt,President's ChoiceVanilla Skyr Icelandic Style 0% M.F. Yogurt500 g,$6.29ea,,$1.26/ 100g,False,
dairy_and_eggs,PC Organics,"Organic Kefir Milk, Strawberry","PC OrganicsOrganic Kefir Milk, Strawberry1000 ml",$5.49ea,,$0.55/ 100ml,False,
dairy_and_eggs,President's Choice,Black Cherry 0% M.F. Greek Yogurt ,President's ChoiceBlack Cherry 0% M.F. Greek Yogurt 4x100.0 g,$4.49ea,,$1.12/ 100g,False,
dairy_and_eggs,Riviera,Coconut Milk Vegan Yogurt - Mango And Passion Fruit,RivieraCoconut Milk Vegan Yogurt - Mango And Passion Fruit500 g,$6.49ea,,$1.30/ 100g,False,
dairy_and_eggs,PC Blue Menu,Blue Menu Original Margarine,PC Blue MenuBlue Menu Original Margarine907 g,$6.49ea,,$0.72/ 100g,False,
dairy_and_eggs,Neilson,Trutaste Light Cream,NeilsonTrutaste Light Cream1 l,$3.99ea,$3.49ea,$0.35/ 100ml,True,saleEnds 03/01
