category,brand,product_text,product_name,price_text,sale_price,per_unit_price_text,is_sale
frozen,Ben & Jerry's,Ice Cream with Fairtrade Ingredients The Tonight Dough® Non-Gmo,Ben & Jerry'sIce Cream with Fairtrade Ingredients The Tonight Dough® Non-Gmo473 ml,$6.99ea,,$1.48/ 100ml,False
frozen,President's Choice,Free From Turkey Pot Pie Frozen,President's ChoiceFree From Turkey Pot Pie Frozen800 g,$13.99ea,,$1.75/ 100g,False
frozen,Gardein,Crispy Fingers Chipotle Lime,GardeinCrispy Fingers Chipotle Lime270 g,$7.49ea,,$2.77/ 100g,False
frozen,ODoughs,"Flax Bagel Thins, Sprouted Whole Grain","ODoughsFlax Bagel Thins, Sprouted Whole Grain300 g",$5.00ea,$4.49ea,$1.50/ 100g,True
frozen,President's Choice,California Vegetable Blend,President's ChoiceCalifornia Vegetable Blend1.75 kg,$10.99ea,$9.49ea,$0.54/ 100g,True
frozen,President's Choice,Thick & Juicy™ Chicken Burgers ,President's ChoiceThick & Juicy™ Chicken Burgers 1.13 kg,$16.99ea,,$1.50/ 100g,False
frozen,PC Organics,Organic Blueberries,PC OrganicsOrganic Blueberries600 g,$8.99ea,,$1.50/ 100g,False
frozen,No Name,California Blend Veggies,No NameCalifornia Blend Veggies2 kg,$7.99ea,,$0.40/ 100g,False
frozen,PC Organics,Organic Chopped Kale,PC OrganicsOrganic Chopped Kale300 g,$5.49ea,,$1.83/ 100g,False
frozen,President's Choice,Melt In The Middle Sustainably Sourced Cod Fish Cakes,President's ChoiceMelt In The Middle Sustainably Sourced Cod Fish Cakes290 g,$9.99ea,,$3.44/ 100g,False
frozen,PC Organics,Organic Zipperback Shrimp,PC OrganicsOrganic Zipperback Shrimp300 g,$13.99ea,,$4.66/ 100g,False
frozen,President's Choice,Butternut Squash Chunks ,President's ChoiceButternut Squash Chunks 750 g,$5.49ea,,$0.73/ 100g,False
frozen,Marie Callender's,Three Meat Lasagna,Marie Callender'sThree Meat Lasagna879 g,$10.99ea,,$1.25/ 100g,False
frozen,President's Choice,Cream First Vanilla Ice Cream Bars,President's ChoiceCream First Vanilla Ice Cream Bars340 ml,$6.49ea,,$1.91/ 100ml,False
frozen,Cadbury,Caramilk Frozen Dessert Bars,CadburyCaramilk Frozen Dessert Bars5x80.0 ml,$7.99ea,,$2.00/ 100ml,False
frozen,President's Choice,Breaded Wild Sole Fillets,President's ChoiceBreaded Wild Sole Fillets680 g,$17.99ea,,$2.65/ 100g,False
frozen,Mccain,Pepperoni Pizza Pockets,MccainPepperoni Pizza Pockets600 g,$8.49ea,$6.99ea,$1.17/ 100g,True
frozen,President's Choice,Breaded Chicken Breast Fillets Buttermilk 17 Pieces Minimum,President's ChoiceBreaded Chicken Breast Fillets Buttermilk 17 Pieces Minimum907 g,$20.99ea,,$2.31/ 100g,False
frozen,President's Choice,Butter Infused Young Turkey - Frozen - 5-7 kg,President's ChoiceButter Infused Young Turkey - Frozen - 5-7 kg1 kg,$46.00ea,,,False
frozen,Silver Hills,"Organic Sprouted Bread, Soft Wheat","Silver HillsOrganic Sprouted Bread, Soft Wheat680 g",$4.99ea,,$0.73/ 100g,False
frozen,Del Monte, Real Banana 1/2 Dipped Chocolate,Del Monte Real Banana 1/2 Dipped Chocolate10x50.0 ml,$7.99ea,,$1.60/ 100ml,False
frozen,Lean Cuisine,Thai Peanut Chicken,Lean CuisineThai Peanut Chicken248 g,$4.79ea,,$1.93/ 100g,False
frozen,Haagen Dazs,Vanilla Dark Ice Cream Bars,Haagen DazsVanilla Dark Ice Cream Bars3x88.0 ml,$6.99ea,,$2.65/ 100ml,False
frozen,President's Choice,Pad Thai Spring Rolls ,President's ChoicePad Thai Spring Rolls 574 g,$9.99ea,,$1.74/ 100g,False
frozen,Swanson,Turkey,SwansonTurkey338 g,$4.79ea,,$1.42/ 100g,False
frozen,Honeydew,100% Apple Juice With Vitamine C Added,Honeydew100% Apple Juice With Vitamine C Added355 ml,$2.49ea,,$0.70/ 100ml,False
frozen,No Name,Vanilla Ice Milk Bars,No NameVanilla Ice Milk Bars30x60.0 ml,$10.99ea,,$0.61/ 100ml,False
frozen,Magnum,Ice Cream Bar Classic Kosher,MagnumIce Cream Bar Classic Kosher3x100.0 ml,$6.99ea,,$2.33/ 100ml,False
frozen,Haagen Dazs,Dulce de Leche Ice Cream,Haagen DazsDulce de Leche Ice Cream500 ml,$6.99ea,,$1.40/ 100ml,False
frozen,Foppen,Smoked Salmon Toast Trio,FoppenSmoked Salmon Toast Trio248 g,$15.99ea,,$6.45/ 100g,False
frozen,President's Choice,"Ready Veggie Fries – Carrot, Parsnip & Beet","President's ChoiceReady Veggie Fries – Carrot, Parsnip & Beet500 g",$5.49ea,,$1.10/ 100g,False
frozen,President's Choice,Medium Buffalo-Style Chicken Wings,President's ChoiceMedium Buffalo-Style Chicken Wings907 g,$15.99ea,,$1.76/ 100g,False
frozen,President's Choice,"Pineapple, Dragon Fruit & Passion Fruit Tropical Fruit Blend","President's ChoicePineapple, Dragon Fruit & Passion Fruit Tropical Fruit Blend500 g",$4.99ea,,$1.00/ 100g,False
frozen,Chapmans,Caramel and Vanilla Cone with Chocolate Centre,ChapmansCaramel and Vanilla Cone with Chocolate Centre8x120.0 ml,$5.64ea,$4.49ea,$0.47/ 100ml,True
frozen,ACE,Bake Your Own Brioche Cluster,ACEBake Your Own Brioche Cluster420 g,$6.49ea,,$1.55/ 100g,False
frozen,Seaquest,"Colossal Raw Shrimp, 16/20","SeaquestColossal Raw Shrimp, 16/20300 g",$7.99ea,,$2.66/ 100g,False
frozen,Burnbrae Farms,Egg Bake Garden Spinach and Ricotta Quiche,Burnbrae FarmsEgg Bake Garden Spinach and Ricotta Quiche2x95.0 g,$4.39ea,,$2.31/ 100g,False
frozen,No Name,Naturally Imperfect Mango,No NameNaturally Imperfect Mango2 kg,$15.99ea,,$0.80/ 100g,False
frozen,CAVENDISH FARMS,Fries Extra Thin Gourmet,CAVENDISH FARMSFries Extra Thin Gourmet750 g,$4.99ea,,$0.67/ 100g,False
frozen,President's Choice,Bangkok-Style Vegetable Blend ,President's ChoiceBangkok-Style Vegetable Blend 500 g,$5.49ea,,$1.10/ 100g,False
frozen,President's Choice,Wild Blueberry-Topped New York-Style Cheesecake,President's ChoiceWild Blueberry-Topped New York-Style Cheesecake600 g,$10.99ea,$10.49ea,$1.75/ 100g,True
frozen,Delissio,Garlic Bread Pizza Pepperoni,DelissioGarlic Bread Pizza Pepperoni513 g,$9.79ea,,$1.91/ 100g,False
frozen,Chapmans,Premuim Canadian Collection Creamy Milk Chocolate and Vanilla Bars,ChapmansPremuim Canadian Collection Creamy Milk Chocolate and Vanilla Bars8x55.0 ml,$6.99ea,,$1.59/ 100ml,False
frozen,Dr Oetker,Giuseppe Pizzeria Rising Crust Deluxe Pizza,Dr OetkerGiuseppe Pizzeria Rising Crust Deluxe Pizza785 g,$8.49ea,,$1.08/ 100g,False
frozen,President's Choice,Meat Lasagna,President's ChoiceMeat Lasagna320 g,$4.49ea,,$1.40/ 100g,False
frozen,Healthy Choice,Simply Chicken Broccoli Alfredo,Healthy ChoiceSimply Chicken Broccoli Alfredo259 g,$5.79ea,,$2.24/ 100g,False
frozen,Pillsbury,Pizza Pops Pepperoni 4ct,PillsburyPizza Pops Pepperoni 4ct380 g,$4.49ea,,$1.18/ 100g,False
frozen,Swanson,Fried Chicken,SwansonFried Chicken280 g,$4.79ea,,$1.71/ 100g,False
frozen,President's Choice,Phyllo Collection,President's ChoicePhyllo Collection240 g,$8.99ea,,$3.75/ 100g,False
frozen,Chapmans,Neapolitan,ChapmansNeapolitan2 l,$5.99ea,,$0.30/ 100ml,False
frozen,President's Choice,Breaded Avocado Bites ,President's ChoiceBreaded Avocado Bites 400 g,$9.99ea,,$2.50/ 100g,False
frozen,President's Choice,Oak Smoked Scottish Atlantic Salmon,President's ChoiceOak Smoked Scottish Atlantic Salmon150 g,$12.99ea,,$8.66/ 100g,False
frozen,BlueWater Seafoods,Garlic & Herb Fillets,BlueWater SeafoodsGarlic & Herb Fillets300 g,$5.99ea,,$2.00/ 100g,False
frozen,President's Choice,Mini Vegetable Samosas,President's ChoiceMini Vegetable Samosas345 g,$6.99ea,,$2.03/ 100g,False
frozen,No Name,Space Pops,No NameSpace Pops30x75.0 ml,$7.99ea,,$0.36/ 100ml,False
frozen,President's Choice,Loads Of Cherries & Chocolatey Chunks Light Ice Cream,President's ChoiceLoads Of Cherries & Chocolatey Chunks Light Ice Cream1.5 l,$7.49ea,,$0.50/ 100ml,False
frozen,Minute Maid,"Home Squeezed Style Frozen Concentate Orange Juice, Can","Minute MaidHome Squeezed Style Frozen Concentate Orange Juice, Can295 ml",$2.79ea,,$0.95/ 100ml,False
frozen,Breyers,Family Classic Frozen Dessert Gluten Free ,BreyersFamily Classic Frozen Dessert Gluten Free 1.66 l,$6.99ea,$4.99ea,$0.30/ 100ml,True
frozen,President's Choice,Extra Cheesy Mac & Cheese,President's ChoiceExtra Cheesy Mac & Cheese1.13 kg,$10.99ea,,$0.97/ 100g,False
frozen,Swanson,Hungryman Salisbury Steak,SwansonHungryman Salisbury Steak345 g,$4.79ea,,$1.39/ 100g,False
frozen,President's Choice,Fc Pork Breakfast Patties,President's ChoiceFc Pork Breakfast Patties375 g,$8.49ea,,$2.26/ 100g,False
frozen,Dr Oetker,Ristorante Thin Crust Pepperoni Pesto Pizza,Dr OetkerRistorante Thin Crust Pepperoni Pesto Pizza360 g,$5.49ea,,$1.53/ 100g,False
frozen,Chapmans,Premium Chocolate Fudge Brownie,ChapmansPremium Chocolate Fudge Brownie2 l,$7.49ea,$4.49ea,$0.22/ 100ml,True
frozen,Dr Oetker,Ristorante Thin Crust Mushroom Funghi Pizza,Dr OetkerRistorante Thin Crust Mushroom Funghi Pizza365 g,$5.49ea,,$1.50/ 100g,False
frozen,Chapmans,Yogurt Black Jack Cherry,ChapmansYogurt Black Jack Cherry2 l,$7.49ea,$4.49ea,$0.22/ 100ml,True
frozen,Silver Hills,Sprouted Power Organic Turmeric Tortillas 6 Hand-Stretched Tortillas,Silver HillsSprouted Power Organic Turmeric Tortillas 6 Hand-Stretched Tortillas255 g,$6.99ea,,$2.74/ 100g,False
frozen,President's Choice,Butter Infused Young Turkey - Frozen - 7-9kg,President's ChoiceButter Infused Young Turkey - Frozen - 7-9kg1 kg,$62.00ea,,,False
frozen,Beyond Meat,Beyond Burger Plant-Based,Beyond MeatBeyond Burger Plant-Based226 g,$7.99ea,,$3.54/ 100g,False
frozen,BlueWater Seafoods,Crunchy Breaded Sole    ,BlueWater SeafoodsCrunchy Breaded Sole    525 g,$14.99ea,$13.99ea,$2.66/ 100g,True
frozen,President's Choice,Berry Blush Banana Smoothie Blend,President's ChoiceBerry Blush Banana Smoothie Blend450 g,$5.99ea,,$1.33/ 100g,False
frozen,Chapmans,Premium Maple Walnut,ChapmansPremium Maple Walnut2 l,$7.49ea,$4.49ea,$0.22/ 100ml,True
frozen,PC Blue Menu,Meat Lasagna,PC Blue MenuMeat Lasagna320 g,$4.49ea,,$1.40/ 100g,False
frozen,Healthy Choice,"Gourmet Steamers, Grilled Chicken Marinara","Healthy ChoiceGourmet Steamers, Grilled Chicken Marinara283 g",$5.79ea,,$2.05/ 100g,False
frozen,Delissio,Rising Crust Pepperoni Pizza,DelissioRising Crust Pepperoni Pizza788 g,$6.50ea,$5.88ea,$0.75/ 100g,True
frozen,President's Choice,Thick & Juicy™ Beef Burgers  ,President's ChoiceThick & Juicy™ Beef Burgers  1.36 kg,$16.99ea,,$1.25/ 100g,False
frozen,President's Choice,Ascolana Fried Olives Stuffed with Cheese,President's ChoiceAscolana Fried Olives Stuffed with Cheese450 g,$8.99ea,,$2.00/ 100g,False
frozen,Righteous,"Ice Cream, Dark Chocolate Caramel Sea Salt Gelato","RighteousIce Cream, Dark Chocolate Caramel Sea Salt Gelato562 ml",$9.99ea,$9.49ea,$1.69/ 100ml,True
frozen,President's Choice,Tourtière,President's ChoiceTourtière900 g,$15.99ea,,$1.78/ 100g,False
frozen,Chapmans,Saucy Vanilla Bean & Salty Caramel Yogurt,ChapmansSaucy Vanilla Bean & Salty Caramel Yogurt2 l,$7.49ea,$4.49ea,$0.22/ 100ml,True
frozen,President's Choice,Cheese Sticks In Za'Atar-Herbed Batter Halloom,President's ChoiceCheese Sticks In Za'Atar-Herbed Batter Halloom300 g,$13.49ea,,$4.50/ 100g,False
frozen,Silver Hills,Sprouted Power Bagels Cinnamon Raisin Organic 5 Bagels,Silver HillsSprouted Power Bagels Cinnamon Raisin Organic 5 Bagels400 g,$8.99ea,,$2.25/ 100g,False
frozen,Chapmans,Premium Cookies & Cream,ChapmansPremium Cookies & Cream2 l,$7.49ea,$4.49ea,$0.22/ 100ml,True
frozen,No Name,"Peas & Carrots, Club Size","No NamePeas & Carrots, Club Size2 kg",$7.99ea,,$0.40/ 100g,False
frozen,Butterball,Boneless Stuffed Turkey Ball Frozen,ButterballBoneless Stuffed Turkey Ball Frozen1.5 kg,$26.99ea,,$1.80/ 100g,False
frozen,President's Choice,"Dark Sweet Cherries, Blueberries and Blackberries Power Fruit Blend ","President's ChoiceDark Sweet Cherries, Blueberries and Blackberries Power Fruit Blend 600 g",$4.99ea,,$0.83/ 100g,False
frozen,Dr Oetker,Ristorante Thin Crust Pollo (Chicken) Pizza,Dr OetkerRistorante Thin Crust Pollo (Chicken) Pizza355 g,$5.49ea,,$1.55/ 100g,False
frozen,No Name,California Blend Mixed Vegetables,No NameCalifornia Blend Mixed Vegetables750 g,$3.49ea,,$0.47/ 100g,False
frozen,Mccain,Egg and Cheese Breakfast Pockets,MccainEgg and Cheese Breakfast Pockets600 g,$8.49ea,$6.99ea,$1.17/ 100g,True
frozen,Nestle,Drumstick Non-Dairy Caramel,NestleDrumstick Non-Dairy Caramel4x120.0 ml,$7.99ea,,$1.66/ 100ml,False
frozen,Mccain,Deep 'n Delicious Vanilla Cake,MccainDeep 'n Delicious Vanilla Cake510 g,$6.99ea,,$1.37/ 100g,False
frozen,President's Choice,"Strawberries, Bananas & Kiwi Fruit Blend","President's ChoiceStrawberries, Bananas & Kiwi Fruit Blend600 g",$4.99ea,,$0.83/ 100g,False
frozen,President's Choice,Coconut Cream Pie,President's ChoiceCoconut Cream Pie830 g,$11.99ea,,$1.44/ 100g,False
frozen,Chapmans,Vanilla Ice Cream Sandwich,ChapmansVanilla Ice Cream Sandwich12x120.0 ml,$7.99ea,$4.49ea,$0.31/ 100ml,True
frozen,Mccain,Pepperoni Pizza Pockets,MccainPepperoni Pizza Pockets300 g,$4.99ea,,$1.66/ 100g,False
frozen,President's Choice,"Chicken Wings, Crisp & Crunchy Mild Southern-Style ","President's ChoiceChicken Wings, Crisp & Crunchy Mild Southern-Style 907 g",$15.99ea,,$1.76/ 100g,False
frozen,Hungry-Man,Jumbo Popcorn Chicken Croquettes,Hungry-ManJumbo Popcorn Chicken Croquettes397 g,$5.79ea,,$1.46/ 100g,False
frozen,Ready Bake,Frozen Garlic Bread With Cheese,Ready BakeFrozen Garlic Bread With Cheese395 g,$4.99ea,,$1.26/ 100g,False
frozen,PC Blue Menu,Honey Greek Yogurt Smoothie Bars,PC Blue MenuHoney Greek Yogurt Smoothie Bars6x80.0 ml,$6.99ea,,$1.46/ 100ml,False
frozen,President's Choice,Raspberry Hibiscus Flavoured Ice Pops,President's ChoiceRaspberry Hibiscus Flavoured Ice Pops6x60.0 ml,$5.99ea,,$1.66/ 100ml,False
frozen,PC Blue Menu,Mediterranean-Style Grain & Chicken Protein Bowl,PC Blue MenuMediterranean-Style Grain & Chicken Protein Bowl300 g,$4.99ea,,$1.66/ 100g,False
frozen,Kelloggs,"Eggo Original Waffles, 48 waffles","KelloggsEggo Original Waffles, 48 waffles1.68 kg",$16.99ea,,$1.01/ 100g,False
frozen,Bridor,Mini Chocolatines All Butter,BridorMini Chocolatines All Butter450 g,$6.99ea,,$1.55/ 100g,False
frozen,President's Choice,Chicken Spring Rolls ,President's ChoiceChicken Spring Rolls 574 g,$10.99ea,,$1.91/ 100g,False
frozen,No Name,Unsweetened Frozen Concentrated Pulp Free Orange Juice ,No NameUnsweetened Frozen Concentrated Pulp Free Orange Juice 283 ml,$2.49ea,,$0.88/ 100ml,False
frozen,Silver Hills,"Sprouted Organic Ancient Grains, Big Red's Bread","Silver HillsSprouted Organic Ancient Grains, Big Red's Bread510 g",$4.99ea,,$0.98/ 100g,False
frozen,St Hubert,Chicken Pot Pie,St HubertChicken Pot Pie800 g,$11.49ea,,$1.44/ 100g,False
frozen,High Liner,"Pan Sear Selects Tilapia, Lime Chili","High LinerPan Sear Selects Tilapia, Lime Chili540 g",$17.99ea,,$3.33/ 100g,False
frozen,Silver Hills,"Sprouted Organic Ancient Grains, Big Red's Bread","Silver HillsSprouted Organic Ancient Grains, Big Red's Bread510 g",$4.99ea,,$0.98/ 100g,False
frozen,St Hubert,Chicken Pot Pie,St HubertChicken Pot Pie800 g,$11.49ea,,$1.44/ 100g,False
frozen,High Liner,"Pan Sear Selects Tilapia, Lime Chili","High LinerPan Sear Selects Tilapia, Lime Chili540 g",$17.99ea,,$3.33/ 100g,False
frozen,Kelloggs,"Eggo Original Waffles, 16 waffles","KelloggsEggo Original Waffles, 16 waffles560 g",$6.99ea,,$1.25/ 100g,False
frozen,No Name,Concentrated Lemonade,No NameConcentrated Lemonade283 ml,$1.89ea,,$0.67/ 100ml,False
frozen,Breyers,Family Classic Ice Cream Mint Chocolate Chip For a Frozen Dessert ,BreyersFamily Classic Ice Cream Mint Chocolate Chip For a Frozen Dessert 1.66 l,$6.99ea,$4.99ea,$0.30/ 100ml,True
frozen,Delissio,"Rising Crust Pizza, Cheeseburger","DelissioRising Crust Pizza, Cheeseburger789 g",$6.50ea,$5.88ea,$0.75/ 100g,True
frozen,Magnum,"Ice Cream Bar, Cookie Duet","MagnumIce Cream Bar, Cookie Duet3 ea",$6.99ea,,$2.33/ 1ea,False
frozen,Lean Cuisine,"White Cheddar Macaroni & Cheese, Frozen Entrée","Lean CuisineWhite Cheddar Macaroni & Cheese, Frozen Entrée226 g",$4.79ea,,$2.12/ 100g,False
frozen,Tenderflake,Deep Dish Pie Shells,TenderflakeDeep Dish Pie Shells350 g,$5.29ea,,$1.51/ 100g,False
frozen,Lean Cuisine,Selections Chicken Teriyaki Frozen Entrée,Lean CuisineSelections Chicken Teriyaki Frozen Entrée214 g,$4.79ea,,$2.24/ 100g,False
frozen,Stouffers,"Crustini, Turkey Bacon Club","StouffersCrustini, Turkey Bacon Club255 g",$4.79ea,,$1.88/ 100g,False
frozen,Nestle,Drumstick Vanilla,NestleDrumstick Vanilla4x140.0 ml,$7.99ea,,$1.43/ 100ml,False
frozen,Lean Cuisine,"Selections, Sweet & Sour Chicken","Lean CuisineSelections, Sweet & Sour Chicken238 g",$4.79ea,,$2.01/ 100g,False
frozen,Tenderflake,Puff Pastry,TenderflakePuff Pastry397 g,$5.29ea,,$1.33/ 100g,False
frozen,Tenderflake,"Pie Shells, Original","TenderflakePie Shells, Original320 g",$5.29ea,,$1.65/ 100g,False
frozen,Lean Cuisine,Chicken Parmigiana,Lean CuisineChicken Parmigiana268 g,$4.79ea,,$1.79/ 100g,False
frozen,Stouffers,"Crustini, Italian Five Cheese","StouffersCrustini, Italian Five Cheese255 g",$4.79ea,,$1.88/ 100g,False
frozen,Nestle,Mini Vanilla Caramel Ice Cream Cone,NestleMini Vanilla Caramel Ice Cream Cone63 ml,$7.99ea,,$12.68/ 100ml,False
frozen,President's Choice,Lemon Skyr Icelandic-Style Lactose Free Frozen Bars,President's ChoiceLemon Skyr Icelandic-Style Lactose Free Frozen Bars480 ml,$6.99ea,,$1.46/ 100ml,False
frozen,President's Choice,Chopped Spinach,President's ChoiceChopped Spinach500 g,$5.49ea,,$1.10/ 100g,False
frozen,Michelina,Tao Chicken,MichelinaTao Chicken227 g,$2.79ea,,$1.23/ 100g,False
frozen,No Name,"Fully Cooked, Breaded Chicken Burgers","No NameFully Cooked, Breaded Chicken Burgers908 g",$6.99ea,,$0.77/ 100g,False
frozen,President's Choice,"Italian Tipo ""OO"" Flour Pizza Dough","President's ChoiceItalian Tipo ""OO"" Flour Pizza Dough560 g",$4.19ea,,$0.75/ 100g,False
frozen,ACE,Frozen Butter Croissant,ACEFrozen Butter Croissant210 g,$5.49ea,,$2.61/ 100g,False
frozen,Breyers,Ice Cream Frozen Dessert Creamsicle ,BreyersIce Cream Frozen Dessert Creamsicle 1.66 l,$6.99ea,$4.99ea,$0.30/ 100ml,True
frozen,No Name,Chocolate Chips Waffles,No NameChocolate Chips Waffles280 g,$2.99ea,,$1.07/ 100g,False
frozen,President's Choice,Strawberry Mochi ,President's ChoiceStrawberry Mochi 6x35.0 ml,$6.99ea,,$3.33/ 100ml,False
frozen,Chapmans,Premium Caramel Praline,ChapmansPremium Caramel Praline2 l,$7.49ea,$4.49ea,$0.22/ 100ml,True
frozen,Chapmans,Premium Heavenly Hash,ChapmansPremium Heavenly Hash2 l,$7.49ea,$4.49ea,$0.22/ 100ml,True
frozen,President's Choice,Fruit Blend,President's ChoiceFruit Blend2 kg,$16.49ea,,$0.82/ 100g,False
frozen,No Name,"Chicken Wings, Mild BBQ","No NameChicken Wings, Mild BBQ908 g",$14.99ea,$12.99ea,$1.43/ 100g,True
frozen,Fruitopia,Fruit Integration Fruit Beverage,FruitopiaFruit Integration Fruit Beverage295 ml,$2.79ea,,$0.95/ 100ml,False
frozen,BlueWater Seafoods,"Breaded Fish Sticks, Value Pack 20","BlueWater SeafoodsBreaded Fish Sticks, Value Pack 20500 g",$8.49ea,,$1.70/ 100g,False
frozen,President's Choice,"Too Good To Be Wings, Honey Garlic","President's ChoiceToo Good To Be Wings, Honey Garlic800 g",$15.99ea,,$2.00/ 100g,False
frozen,President's Choice,"Peaches, Strawberries, Pineapple & Mango 4-Fruit Blend","President's ChoicePeaches, Strawberries, Pineapple & Mango 4-Fruit Blend600 g",$4.99ea,,$0.83/ 100g,False
frozen,President's Choice,Dry-Rubbed Sea Salt & Black Pepper Pork Back Ribs,President's ChoiceDry-Rubbed Sea Salt & Black Pepper Pork Back Ribs680 g,$15.99ea,,$2.35/ 100g,False
frozen,High Liner,"Pan Sear Selects Cod, Savoury Herb","High LinerPan Sear Selects Cod, Savoury Herb540 g",$17.99ea,,$3.33/ 100g,False
frozen,President's Choice,"Butter Infused Stuffed Turkey  5-7 Kg, Frozen","President's ChoiceButter Infused Stuffed Turkey  5-7 Kg, Frozen1 kg",$50.00ea,,,False
frozen,Pillsbury,Toaster Scrambles Sausage,PillsburyToaster Scrambles Sausage204 g,$3.99ea,,$1.96/ 100g,False
frozen,Crave,All Day Breakfast Steak 'N Eggs with Roasted Potatoes,CraveAll Day Breakfast Steak 'N Eggs with Roasted Potatoes255 g,$6.79ea,,$2.66/ 100g,False
frozen,President's Choice,Butter Chicken Meal Kit,President's ChoiceButter Chicken Meal Kit907 g,$15.99ea,,$1.76/ 100g,False
frozen,Swanson,Chicken Fried Rice,SwansonChicken Fried Rice1.19 kg,$13.69ea,,$1.15/ 100g,False
frozen,Green Giant,"Green Beans, Cut","Green GiantGreen Beans, Cut750 g",$3.99ea,$3.49ea,$0.47/ 100g,True
frozen,No Name,Winter Vegetables,No NameWinter Vegetables750 g,$3.49ea,,$0.47/ 100g,False
frozen,High Liner,"English Style Battered Haddock Fillets, Uncooked","High LinerEnglish Style Battered Haddock Fillets, Uncooked425 g",$17.99ea,,$4.23/ 100g,False
frozen,Healthy Choice,Simply Chicken Stir Fry,Healthy ChoiceSimply Chicken Stir Fry262 g,$5.79ea,,$2.21/ 100g,False
frozen,PC Blue Menu,Korean-Style Buckwheat Noodle & Tofu Protein Bowl,PC Blue MenuKorean-Style Buckwheat Noodle & Tofu Protein Bowl300 g,$4.99ea,,$1.66/ 100g,False
frozen,President's Choice,Cabbage Rolls,President's ChoiceCabbage Rolls1.81 kg,$16.99ea,$15.99ea,$0.88/ 100g,True
frozen,Minute Maid,Margarita Mixers,Minute MaidMargarita Mixers250 ml,$2.79ea,,$1.12/ 100ml,False
frozen,Boston Market,Chicken Fettuccine Alfredo,Boston MarketChicken Fettuccine Alfredo369 g,$5.99ea,,$1.62/ 100g,False
frozen,Stouffers,"Fit Bowls, Teriyaki Chicken Bowl","StouffersFit Bowls, Teriyaki Chicken Bowl340 g",$6.99ea,,$2.06/ 100g,False
frozen,Healthy Choice,Power Bowls Korean-Inspired Beef,Healthy ChoicePower Bowls Korean-Inspired Beef269 g,$7.49ea,,$2.78/ 100g,False
frozen,President's Choice,Garden Vegetable Blend,President's ChoiceGarden Vegetable Blend1.75 kg,$10.99ea,$9.49ea,$0.54/ 100g,True
frozen,Ben & Jerry's,Ice Cream with Fairtrade Ingredients Netflix & Chilll'D„¢ Non-Gmo,Ben & Jerry'sIce Cream with Fairtrade Ingredients Netflix & Chilll'D„¢ Non-Gmo473 ml,$6.99ea,,$1.48/ 100ml,False
frozen,So Delicious,"Dairy Free Coconut-Based Frozen Dessert, 4 Coconut Almond Bars","So DeliciousDairy Free Coconut-Based Frozen Dessert, 4 Coconut Almond Bars272 ml",$7.99ea,,$2.94/ 100ml,False
frozen,So Delicious,"Dairy Free Cashew-Based Frozen Dessert, Simply Vanilla","So DeliciousDairy Free Cashew-Based Frozen Dessert, Simply Vanilla479 ml",$8.49ea,,$1.70/ 100ml,False
frozen,Halo Top,Sea Salt Caramel,Halo TopSea Salt Caramel473 ml,$5.99ea,,$1.27/ 100ml,False
frozen,President's Choice,Potato & Bacon Flatbread,President's ChoicePotato & Bacon Flatbread395 g,$4.50ea,$3.99ea,$1.01/ 100g,True
frozen,Green Giant,"Valley Selection, Asian Blend Vegetables","Green GiantValley Selection, Asian Blend Vegetables400 g",$3.99ea,$3.49ea,$0.87/ 100g,True
frozen,Ben & Jerry's,"Ice Cream, Non-Dairy Frozen Dessert Chocolate Fudge Brownie","Ben & Jerry'sIce Cream, Non-Dairy Frozen Dessert Chocolate Fudge Brownie473 ml",$6.99ea,,$1.48/ 100ml,False
frozen,Healthy Choice,Sweet N Sour Chicken,Healthy ChoiceSweet N Sour Chicken283 g,$5.79ea,,$2.05/ 100g,False
frozen,Green Giant,Mixed Vegetables,Green GiantMixed Vegetables750 g,$3.99ea,$3.49ea,$0.47/ 100g,True
frozen,Crave,Smokey BBQ Angus Beef Frozen Meal,CraveSmokey BBQ Angus Beef Frozen Meal283 g,$6.79ea,,$2.40/ 100g,False
frozen,President's Choice,Shepherd's Pie,President's ChoiceShepherd's Pie275 g,$4.49ea,,$1.63/ 100g,False
frozen,Breyers,Creamery Style Ice Cream French Vanilla gluten-free and kosher,BreyersCreamery Style Ice Cream French Vanilla gluten-free and kosher1.66 l,$7.99ea,,$0.48/ 100ml,False
frozen,Minute Maid,"Grape Punch Frozen Concentrate Juice Beverage, Can","Minute MaidGrape Punch Frozen Concentrate Juice Beverage, Can295 ml",$2.29ea,,$0.78/ 100ml,False
frozen,President's Choice,Chicken Lasagna,President's ChoiceChicken Lasagna1.13 kg,$11.99ea,,$1.06/ 100g,False
frozen,Mccain,9 Minute Onion & Potato Patties,Mccain9 Minute Onion & Potato Patties600 g,$4.99ea,,$0.83/ 100g,False
frozen,President's Choice,Stuffed Butternut Squash,President's ChoiceStuffed Butternut Squash600 g,$11.99ea,,$2.00/ 100g,False
frozen,Life Cuisine,Korean Beef & Broccoli Bowl,Life CuisineKorean Beef & Broccoli Bowl275 g,$6.99ea,,$2.54/ 100g,False
frozen,President's Choice,Everything Seasoned Breaded Chicken Breast Fillets,President's ChoiceEverything Seasoned Breaded Chicken Breast Fillets750 g,$15.99ea,,$2.13/ 100g,False
frozen,Delissio,Thin Crispy Crust 4 Meat Pizza,DelissioThin Crispy Crust 4 Meat Pizza525 g,$7.29ea,,$1.39/ 100g,False
frozen,President's Choice,Vegetable Lasagna,President's ChoiceVegetable Lasagna2.27 kg,$17.99ea,$16.99ea,$0.75/ 100g,True
frozen,CAVENDISH FARMS, Flavourcrisp Classic Straight Cut Fries,CAVENDISH FARMS Flavourcrisp Classic Straight Cut Fries750 g,$4.99ea,,$0.67/ 100g,False
frozen,Chapmans,Yogurt Crispy Peanut Butter Crunch,ChapmansYogurt Crispy Peanut Butter Crunch2 l,$7.49ea,$4.49ea,$0.22/ 100ml,True
frozen,No Name,Baked 3 Cheese Pizza Pouches,No NameBaked 3 Cheese Pizza Pouches800 g,$6.29ea,,$0.79/ 100g,False
frozen,Ben & Jerry's,Ice Cream with Fairtrade Ingredients Choco Chip Cookie Dough Non-Gmo,Ben & Jerry'sIce Cream with Fairtrade Ingredients Choco Chip Cookie Dough Non-Gmo473 ml,$6.99ea,,$1.48/ 100ml,False
frozen,President's Choice,Vanilla Frozen Yogurt,President's ChoiceVanilla Frozen Yogurt2 l,$5.99ea,,$0.30/ 100ml,False
frozen,No Name,Buttermilk Pancakes,No NameButtermilk Pancakes310 g,$2.99ea,,$0.96/ 100g,False
frozen,Chapmans,Vanilla,ChapmansVanilla2 l,$5.99ea,,$0.30/ 100ml,False
frozen,Dr Oetker,Ristorante Thin Crust Mozzarella Pizza,Dr OetkerRistorante Thin Crust Mozzarella Pizza325 g,$5.49ea,,$1.69/ 100g,False
frozen,PC Blue Menu,Shepherd's Pie,PC Blue MenuShepherd's Pie275 g,$4.49ea,,$1.63/ 100g,False
frozen,No Name,Light Whipped Topping,No NameLight Whipped Topping1 l,$3.99ea,,$0.40/ 100ml,False
frozen,Pogo,Regular,PogoRegular1.5 kg,$19.99ea,,$1.33/ 100g,False
frozen,Mccain,Superfries Extra Crispy Crinkle Cut Fries,MccainSuperfries Extra Crispy Crinkle Cut Fries650 g,$4.99ea,,$0.77/ 100g,False
frozen,,"Raw Wild Shrimp, Easy Peel","Raw Wild Shrimp, Easy Peel300 g",$13.99ea,,$4.66/ 100g,False
frozen,Honeydew,Frozen Concentrated Fruit Beverage Cherry Berry,HoneydewFrozen Concentrated Fruit Beverage Cherry Berry355 ml,$1.79ea,,$0.50/ 100ml,False
frozen,President's Choice,Meringata Traditional Italian Dessert,President's ChoiceMeringata Traditional Italian Dessert400 g,$8.99ea,,$2.25/ 100g,False
