category,brand,product_text,product_name,price_text,sale_price,per_unit_price_text,is_sale
frozen,Delissio,Stuffed Crust Delux Pizza,DelissioStuffed Crust Delux Pizza744 g,$8.99ea,,$1.21/ 100g,False
frozen,President's Choice,Apple Caramel Blossoms,President's ChoiceApple Caramel Blossoms228 g,$3.99ea,,$1.75/ 100g,False
frozen,No Name,Concentrated Fruit Punch,No NameConcentrated Fruit Punch283 ml,$1.29ea,,$0.46/ 100ml,False
frozen,President's Choice,Loads Of Chocolatey Caramel Treats Light Ice Cream,President's ChoiceLoads Of Chocolatey Caramel Treats Light Ice Cream1.5 l,$7.49ea,,$0.50/ 100ml,False
frozen,President's Choice,Lemon Garlic Shrimp & Scallop Pasta Meal Kit,President's ChoiceLemon Garlic Shrimp & Scallop Pasta Meal Kit907 g,$15.99ea,,$1.76/ 100g,False
frozen,No Name,Ice Milk Fudge Bars,No NameIce Milk Fudge Bars30x60.0 ml,$10.99ea,,$0.61/ 100ml,False
frozen,ACE,Frozen White Demi Baguette,ACEFrozen White Demi Baguette400 g,$5.69ea,,$1.42/ 100g,False
frozen,President's Choice,Chocolate Frozen Yogurt,President's ChoiceChocolate Frozen Yogurt2 l,$5.99ea,,$0.30/ 100ml,False
frozen,President's Choice,Maple Crunch Mini Ice Cream Bars,President's ChoiceMaple Crunch Mini Ice Cream Bars330 ml,$6.49ea,,$1.97/ 100ml,False
frozen,President's Choice,Carrot Pecan Cake,President's ChoiceCarrot Pecan Cake480 g,$9.99ea,,$2.08/ 100g,False
frozen,Five Alive,Passionate Peach Juice,Five AlivePassionate Peach Juice295 ml,$2.79ea,,$0.95/ 100ml,False
frozen,President's Choice,Puff Pastry Hors D’Oeuvre Collection ,President's ChoicePuff Pastry Hors D’Oeuvre Collection 720 g,$15.49ea,,$2.15/ 100g,False
frozen,President's Choice,Cream First Vanilla Ice Cream,President's ChoiceCream First Vanilla Ice Cream1.5 l,$7.49ea,,$0.50/ 100ml,False
frozen,Burnbrae Farms,Egg Bites! Mini Crustless Quiches Snack Size,Burnbrae FarmsEgg Bites! Mini Crustless Quiches Snack Size336 g,$7.49ea,,$2.23/ 100g,False
frozen,No Name,"Fried Potatoes, Crispy Skin On","No NameFried Potatoes, Crispy Skin On1 kg",$4.49ea,,$0.45/ 100g,False
frozen,Kelloggs,"Eggo Waffles, Chocolatey Chip","KelloggsEggo Waffles, Chocolatey Chip280 g",$4.29ea,,$1.53/ 100g,False
frozen,Healthy Choice,"Gourmet Steamers, Sweet Sesame Chicken","Healthy ChoiceGourmet Steamers, Sweet Sesame Chicken292 g",$5.79ea,,$1.98/ 100g,False
frozen,Janes,"Pub Style Chicken Nugget, Fully Cooked","JanesPub Style Chicken Nugget, Fully Cooked700 g",$13.99ea,,$2.00/ 100g,False
frozen,President's Choice,"Pub Recipe Chicken Strips, Fully Cooked, Club Size","President's ChoicePub Recipe Chicken Strips, Fully Cooked, Club Size1.4 kg",$12.99ea,,$0.93/ 100g,False
frozen,Green Giant,"Valley Selections Essentials, California Blend","Green GiantValley Selections Essentials, California Blend500 g",$3.99ea,$3.49ea,$0.70/ 100g,True
frozen,President's Choice,"Gluten-free Waffles, Blueberry","President's ChoiceGluten-free Waffles, Blueberry320 g",$3.99ea,,$1.25/ 100g,False
frozen,Green Giant,Riced Veggies Asian Stir Fry Style,Green GiantRiced Veggies Asian Stir Fry Style283 g,$5.49ea,,$1.94/ 100g,False
frozen,Stouffers,"Fit Wraps, Teriyaki Chicken","StouffersFit Wraps, Teriyaki Chicken163 g",$6.99ea,,$4.29/ 100g,False
frozen,Chapmans,Lolly Chocolate,ChapmansLolly Chocolate28x50.0 ml,$4.49ea,,$0.32/ 100ml,False
frozen,Mikes,"Pepperoni, Bacon and Mozzarella Cheese Pizza","MikesPepperoni, Bacon and Mozzarella Cheese Pizza840 g",$10.49ea,,$1.25/ 100g,False
frozen,President's Choice,Gluten Free Homestyle Waffles,President's ChoiceGluten Free Homestyle Waffles320 g,$3.99ea,,$1.25/ 100g,False
frozen,Delissio,Stuffed Crust 4 Cheese Pizza,DelissioStuffed Crust 4 Cheese Pizza664 g,$8.99ea,,$1.35/ 100g,False
frozen,Delissio,Crispy Pan 4-Cheese Pizza,DelissioCrispy Pan 4-Cheese Pizza570 g,$8.99ea,,$1.58/ 100g,False
frozen,President's Choice,Plant Based Chickpea and Sweet Potato Veggie Burgers,President's ChoicePlant Based Chickpea and Sweet Potato Veggie Burgers452 g,$7.99ea,,$1.77/ 100g,False
frozen,President's Choice,Maple Crunch Ice Cream,President's ChoiceMaple Crunch Ice Cream946 ml,$4.49ea,$3.99ea,$0.42/ 100ml,True
frozen,Pinty's,Chicken Wings Honey & Garlic Flavoured,Pinty'sChicken Wings Honey & Garlic Flavoured780 g,$23.99ea,,$3.08/ 100g,False
frozen,PC Organics,Organic Broccoli Florets,PC OrganicsOrganic Broccoli Florets500 g,$5.49ea,,$1.10/ 100g,False
frozen,Chapmans,Ice Cream Premium Pistachio & Almonds ,ChapmansIce Cream Premium Pistachio & Almonds 2 l,$7.49ea,$4.49ea,$0.22/ 100ml,True
frozen,PC Organics,Organic Green Peas,PC OrganicsOrganic Green Peas500 g,$5.49ea,,$1.10/ 100g,False
frozen,PC Organics,Organics Riced Cauliflower,PC OrganicsOrganics Riced Cauliflower500 g,$5.49ea,,$1.10/ 100g,False
frozen,The Keg,Prime Rib Beef Burger,The KegPrime Rib Beef Burger1.02 kg,$22.99ea,,$2.25/ 100g,False
frozen,Nestle,Kit Kat Frozen Dessert Bars,NestleKit Kat Frozen Dessert Bars5x80.0 ml,$7.99ea,,$2.00/ 100ml,False
frozen,CAVENDISH FARMS,Restaurant Style Drive Thru Fries,CAVENDISH FARMSRestaurant Style Drive Thru Fries750 g,$4.99ea,,$0.67/ 100g,False
frozen,Silver Hills,Sprouted Power Bagels Sesame Sunflower Organic 5 Bagels,Silver HillsSprouted Power Bagels Sesame Sunflower Organic 5 Bagels400 g,$8.99ea,,$2.25/ 100g,False
frozen,President's Choice,Chicken Pad Thai,President's ChoiceChicken Pad Thai365 g,$4.99ea,,$1.37/ 100g,False
frozen,Haagen Dazs,Chocolate Peanut Butter Ice Cream,Haagen DazsChocolate Peanut Butter Ice Cream500 ml,$6.99ea,,$1.40/ 100ml,False
frozen,Haagen Dazs,exträaz Cookies & Cream Ice Cream,Haagen Dazsexträaz Cookies & Cream Ice Cream500 ml,$6.99ea,,$1.40/ 100ml,False
frozen,President's Choice,Mozzarella Cheese Sticks,President's ChoiceMozzarella Cheese Sticks454 g,$7.99ea,,$1.76/ 100g,False
frozen,Stouffers,Creamy Chicken and Rice,StouffersCreamy Chicken and Rice309 g,$4.79ea,,$1.55/ 100g,False
frozen,Haagen Dazs,Vanilla Bean Ice Cream,Haagen DazsVanilla Bean Ice Cream500 ml,$6.99ea,,$1.40/ 100ml,False
frozen,President's Choice,Indian Hors D'oeuvre Collection,President's ChoiceIndian Hors D'oeuvre Collection800 g,$7.99ea,,$1.00/ 100g,False
frozen,High Liner,"Pan Sear Selects Haddock, Traditional","High LinerPan Sear Selects Haddock, Traditional540 g",$17.99ea,,$3.60/ 100g,False
frozen,Nature's Path,"Flax Plus Waffles, Buckwheat Wildberry","Nature's PathFlax Plus Waffles, Buckwheat Wildberry210 g",$5.49ea,$4.49ea,$2.14/ 100g,True
frozen,President's Choice,"Ice Cream Shop, Elk Crossing Mini Ice Cream Bars","President's ChoiceIce Cream Shop, Elk Crossing Mini Ice Cream Bars330 ml",$6.49ea,,$1.97/ 100ml,False
frozen,Chapmans,Dutch Chocolate,ChapmansDutch Chocolate2 l,$5.99ea,,$0.30/ 100ml,False
frozen,Chapmans,Yukon French Vanilla & Almond Lynx Bar,ChapmansYukon French Vanilla & Almond Lynx Bar6x90.0 ml,$8.99ea,,$1.66/ 100ml,False
frozen,President's Choice,Pork and Smoky Bacon Skewers,President's ChoicePork and Smoky Bacon Skewers450 g,$15.99ea,,$3.55/ 100g,False
frozen,Delissio,"Pizza, Croissant Crust Ham & Cheese ","DelissioPizza, Croissant Crust Ham & Cheese 691 g",$8.99ea,,$1.30/ 100g,False
frozen,PC Organics,Organics Peaches and Cream Corn,PC OrganicsOrganics Peaches and Cream Corn500 g,$5.49ea,,$1.10/ 100g,False
frozen,PC Organics,Organic Whole Strawberries,PC OrganicsOrganic Whole Strawberries600 g,$8.99ea,,$1.50/ 100g,False
frozen,President's Choice,"Plant Based Black Bean, Corn and Sweet Potato Veggie Burgers","President's ChoicePlant Based Black Bean, Corn and Sweet Potato Veggie Burgers452 g",$7.99ea,,$1.77/ 100g,False
frozen,No Name,Mixed Garden Vegetables,No NameMixed Garden Vegetables750 g,$3.49ea,,$0.47/ 100g,False
frozen,No Name,Chocolatey Chip Ice Cream Sandwiches,No NameChocolatey Chip Ice Cream Sandwiches24x120.0 ml,$10.99ea,,$0.38/ 100ml,False
frozen,Yves,Veggie Nuggets With Whole Wheat Breading Simulated Chicken Nuggets,YvesVeggie Nuggets With Whole Wheat Breading Simulated Chicken Nuggets320 g,$6.99ea,,$2.18/ 100g,False
frozen,Pillsbury,Pizza Pops 3 Cheese Flavour 8ct,PillsburyPizza Pops 3 Cheese Flavour 8ct760 g,$8.99ea,,$1.18/ 100g,False
frozen,President's Choice,Mint Chocolate Ice Cream,President's ChoiceMint Chocolate Ice Cream946 ml,$4.49ea,$3.99ea,$0.42/ 100ml,True
frozen,President's Choice,Sliced Red Beets,President's ChoiceSliced Red Beets500 g,$5.49ea,,$1.10/ 100g,False
frozen,Chapmans,Neapolitan Ice Cream Sandwich,ChapmansNeapolitan Ice Cream Sandwich12x120.0 ml,$5.64ea,$4.49ea,$0.31/ 100ml,True
frozen,President's Choice,"Chicken Wings Club Pack, Honey Garlic","President's ChoiceChicken Wings Club Pack, Honey Garlic1.81 kg",$29.99ea,,$1.66/ 100g,False
frozen,President's Choice,Rotisserie-Style Chicken Wings,President's ChoiceRotisserie-Style Chicken Wings907 g,$15.99ea,,$1.76/ 100g,False
frozen,President's Choice,Mini Sausage Rolls,President's ChoiceMini Sausage Rolls500 g,$10.99ea,,$2.20/ 100g,False
frozen,Pillsbury,Pizza Pops Pepperoni and Bacon 8ct,PillsburyPizza Pops Pepperoni and Bacon 8ct760 g,$8.99ea,,$1.18/ 100g,False
frozen,President's Choice,Tortilla and Jalapeno Cheese Sticks,President's ChoiceTortilla and Jalapeno Cheese Sticks345 g,$10.99ea,,$3.19/ 100g,False
frozen,Mccain,Deep 'n Delicious Chocolate Cake,MccainDeep 'n Delicious Chocolate Cake510 g,$6.99ea,,$1.37/ 100g,False
frozen,President's Choice,General Tao Chicken,President's ChoiceGeneral Tao Chicken350 g,$4.99ea,,$1.43/ 100g,False
frozen,Beyond Meat,Plant Based Burgers,Beyond MeatPlant Based Burgers678 g,$19.99ea,,$2.95/ 100g,False
frozen,President's Choice,Free From Chicken Breast,President's ChoiceFree From Chicken Breast680 g,$23.99ea,,$3.53/ 100g,False
frozen,The Original,Ice Pop Creamsicle Bars sweet treat made with natural colours and flavours,The OriginalIce Pop Creamsicle Bars sweet treat made with natural colours and flavours720 ml,$6.99ea,,$0.97/ 100ml,False
frozen,Magnum,Ice Cream Bar Velvety Smooth Vanilla Ice Cream ,MagnumIce Cream Bar Velvety Smooth Vanilla Ice Cream 3x100.0 ml,$6.99ea,,$2.33/ 100ml,False
frozen,President's Choice,Double Decker New York-Style Cheesecake,President's ChoiceDouble Decker New York-Style Cheesecake600 g,$10.99ea,$10.49ea,$1.75/ 100g,True
frozen,Lous,Pulled Pork,LousPulled Pork400 g,$10.99ea,$9.99ea,$2.50/ 100g,True
frozen,President's Choice,Vanilla Bean Mochi,President's ChoiceVanilla Bean Mochi6x35.0 ml,$6.99ea,,$3.33/ 100ml,False
frozen,No Name,Concentrated Berry Punch,No NameConcentrated Berry Punch283 ml,$1.29ea,,$0.46/ 100ml,False
frozen,Wong Wing,Chicken Chow Mein,Wong WingChicken Chow Mein400 g,$7.99ea,,$2.00/ 100g,False
frozen,President's Choice,Sweet Potato Chunks,President's ChoiceSweet Potato Chunks400 g,$5.49ea,,$1.37/ 100g,False
frozen,BlueWater Seafoods,Beer Batter Fillets,BlueWater SeafoodsBeer Batter Fillets450 g,$8.49ea,,$1.89/ 100g,False
frozen,No Name,Baked Pepperoni Pizza Pouches,No NameBaked Pepperoni Pizza Pouches800 g,$6.29ea,,$0.79/ 100g,False
frozen,Breyers,Family Classic Ice Cream Pralines & Cream For a Frozen Dessert Treat,BreyersFamily Classic Ice Cream Pralines & Cream For a Frozen Dessert Treat1.66 l,$6.99ea,$4.99ea,$0.30/ 100ml,True
frozen,President's Choice,Spanakopita,President's ChoiceSpanakopita264 g,$8.99ea,,$3.41/ 100g,False
frozen,Toblerone,Chocolate Torte,TobleroneChocolate Torte400 g,$11.99ea,,$3.00/ 100g,False
frozen,Mccain,"Deep'n Delicious® MINIS Chocolate Brownie Cake Cups, 4-pk","MccainDeep'n Delicious® MINIS Chocolate Brownie Cake Cups, 4-pk340 g",$7.79ea,,$2.29/ 100g,False
frozen,President's Choice,Chocolate Brownie Cheesecake with Ganache Topping,President's ChoiceChocolate Brownie Cheesecake with Ganache Topping600 g,$10.99ea,$10.49ea,$1.75/ 100g,True
frozen,President's Choice,Blueberries Cultivated,President's ChoiceBlueberries Cultivated2 kg,$16.49ea,,$0.82/ 100g,False
frozen,Foppen,Smoked Slice Salmon Loin,FoppenSmoked Slice Salmon Loin170 g,$13.99ea,,$8.23/ 100g,False
frozen,President's Choice,"Plant Based Coconut Milk Frozen Dessert, Chocolate","President's ChoicePlant Based Coconut Milk Frozen Dessert, Chocolate500 ml",$3.99ea,,$0.80/ 100ml,False
frozen,President's Choice,Smokin Stampede Pork Back Ribs ,President's ChoiceSmokin Stampede Pork Back Ribs 680 g,$15.99ea,,$2.35/ 100g,False
frozen,Breyers,Creamery Style Ice Cream ,BreyersCreamery Style Ice Cream 1.66 l,$7.99ea,,$0.48/ 100ml,False
frozen,Nestle,"Drumstick, Vanilla Fudge/Vanilla Caramel","NestleDrumstick, Vanilla Fudge/Vanilla Caramel18x140.0 ml",$21.99ea,,$0.87/ 100ml,False
frozen,Breyers,"Vanilla Ice Cream with Fresh Cream, Gluten-Free & Kosher Dessert","BreyersVanilla Ice Cream with Fresh Cream, Gluten-Free & Kosher Dessert1.66 l",$7.99ea,,$0.48/ 100ml,False
frozen,Little Northern Bakehouse,Cinnamon & Raisin Bread,Little Northern BakehouseCinnamon & Raisin Bread482 g,$6.00ea,$5.00ea,$1.04/ 100g,True
frozen,Charoen Pokphand,Red Curry Chicken With Jasmine Rice,Charoen PokphandRed Curry Chicken With Jasmine Rice350 g,$5.49ea,,$1.57/ 100g,False
frozen,President's Choice,Pacific White Shrimp Raw Peeled,President's ChoicePacific White Shrimp Raw Peeled400 g,$10.99ea,,$2.75/ 100g,False
frozen,Kawartha,"Dairy Ice Cream, French Vanilla  ","KawarthaDairy Ice Cream, French Vanilla  1.5 l",$8.99ea,,$0.60/ 100ml,False
frozen,Swiss Chalet,BBQ Pork Ribs,Swiss ChaletBBQ Pork Ribs600 g,$15.99ea,,$2.67/ 100g,False
frozen,Healthy Choice,Simply Chicken Pesto Veg,Healthy ChoiceSimply Chicken Pesto Veg259 g,$5.79ea,,$2.24/ 100g,False
frozen,President's Choice,Yorkshire Pudding,President's ChoiceYorkshire Pudding185 g,$4.99ea,,$2.70/ 100g,False
frozen,Ready Bake,Frozen Bread Dough White,Ready BakeFrozen Bread Dough White445 g,$7.99ea,,$1.80/ 100g,False
frozen,Chapmans,Yukon Ice Cream Double the Dip with Milk Chocolate,ChapmansYukon Ice Cream Double the Dip with Milk Chocolate5x140.0 ml,$8.99ea,,$1.28/ 100ml,False
frozen,Burnbrae Farms,Egg Bites Pizza Mini,Burnbrae FarmsEgg Bites Pizza Mini336 g,$7.49ea,,$2.23/ 100g,False
frozen,President's Choice,Bacon-Wrapped Wild Sea Scallops,President's ChoiceBacon-Wrapped Wild Sea Scallops260 g,$17.99ea,,$6.92/ 100g,False
frozen,Chef Bombay,Palak Paneer,Chef BombayPalak Paneer350 g,$6.99ea,,$2.00/ 100g,False
frozen,Furlani,"Ready Bake, Frozen Garlic Toast Texas-Style Bread","FurlaniReady Bake, Frozen Garlic Toast Texas-Style Bread638 g",$4.49ea,,$0.70/ 100g,False
frozen,President's Choice,Rosemary & Garlic Rack,President's ChoiceRosemary & Garlic Rack,$34.50(est.)ea,,$68.32/ 1kg,False
frozen,President's Choice,Lobster and Scallop Seafood Bake,President's ChoiceLobster and Scallop Seafood Bake700 g,$23.99ea,,$3.43/ 100g,False
frozen,Krinos,"Fillo Twisters, Feta & Ricotta Cheese","KrinosFillo Twisters, Feta & Ricotta Cheese840 g",$9.99ea,,$1.19/ 100g,False
frozen,Magnum,Rapberry Ice Cream ,MagnumRapberry Ice Cream 3x90.0 ml,$6.99ea,,$2.59/ 100ml,False
frozen,Chef Bombay,Vegetables Pakoras,Chef BombayVegetables Pakoras240 g,$6.99ea,,$2.91/ 100g,False
frozen,BlueWater Seafoods,Beer Batter Shrimp    ,BlueWater SeafoodsBeer Batter Shrimp    255 g,$8.49ea,,$3.33/ 100g,False
frozen,Kelloggs,Eggo Waffles Blueberry Flavour,KelloggsEggo Waffles Blueberry Flavour280 g,$4.29ea,,$1.53/ 100g,False
frozen,President's Choice,Nashville-Style Chicken Wings,President's ChoiceNashville-Style Chicken Wings907 g,$15.99ea,,$1.76/ 100g,False
frozen,No Name,Blueberry Waffles,No NameBlueberry Waffles560 g,$5.79ea,,$1.03/ 100g,False
frozen,President's Choice,Plant Based Original Cheesecake-Style Dessert,President's ChoicePlant Based Original Cheesecake-Style Dessert540 g,$9.99ea,,$1.85/ 100g,False
frozen,President's Choice,"Frozen Strawberries, Whole","President's ChoiceFrozen Strawberries, Whole600 g",$4.99ea,,$0.83/ 100g,False
frozen,President's Choice,"Flatbread Chicken, Bacon & Caramelized Onion","President's ChoiceFlatbread Chicken, Bacon & Caramelized Onion340 g",$4.50ea,$3.99ea,$1.17/ 100g,True
frozen,Stouffers,Spaghetti Bolognese,StouffersSpaghetti Bolognese270 g,$4.79ea,,$1.77/ 100g,False
frozen,Hungry-Man,Chicken Strips Buffalo Style,Hungry-ManChicken Strips Buffalo Style428 g,$5.79ea,,$1.35/ 100g,False
frozen,Life Cuisine,"Three Cheese Chicken, Pesto & Spinach Bowl","Life CuisineThree Cheese Chicken, Pesto & Spinach Bowl270 g",$6.99ea,,$2.59/ 100g,False
frozen,PC Blue Menu,Thick & Juicy™ Lean Beef Burgers  ,PC Blue MenuThick & Juicy™ Lean Beef Burgers  1.13 kg,$16.99ea,,$1.50/ 100g,False
frozen,Righteous,Dairy Free Mango Pineapple Sorbetto,RighteousDairy Free Mango Pineapple Sorbetto562 ml,$9.99ea,$9.49ea,$1.69/ 100ml,True
frozen,Hungry-Man,Salisbury Steak ,Hungry-ManSalisbury Steak 455 g,$5.79ea,,$1.27/ 100g,False
frozen,President's Choice,Edamame,President's ChoiceEdamame500 g,$5.49ea,,$1.10/ 100g,False
frozen,Kelloggs,Eggo Waffles Chocolatey Chip,KelloggsEggo Waffles Chocolatey Chip560 g,$6.99ea,,$1.25/ 100g,False
frozen,President's Choice,Plant Based Apple Crumble Pie,President's ChoicePlant Based Apple Crumble Pie770 g,$7.99ea,,$1.04/ 100g,False
frozen,Kelloggs,Thick & Fluffy Waffles Cinnamon Brown Sugar,KelloggsThick & Fluffy Waffles Cinnamon Brown Sugar330 g,$4.29ea,,$1.30/ 100g,False
frozen,Premier, Seafood Mix,Premier Seafood Mix340 g,$5.99ea,,$1.76/ 100g,False
frozen,President's Choice,Shepherd's Pie,President's ChoiceShepherd's Pie900 g,$13.99ea,,$1.55/ 100g,False
frozen,President's Choice,Butter Infused Young Turkey - Frozen - 3-5 kg,President's ChoiceButter Infused Young Turkey - Frozen - 3-5 kg1 kg,$35.00ea,,,False
frozen,Chapmans,Yogurt Caramel Pecan Crunch,ChapmansYogurt Caramel Pecan Crunch2 l,$7.49ea,$4.49ea,$0.22/ 100ml,True
frozen,President's Choice,Red Curry Chicken,President's ChoiceRed Curry Chicken350 g,$4.99ea,,$1.43/ 100g,False
frozen,President's Choice,Plant Based Mini Sausageless Rolls,President's ChoicePlant Based Mini Sausageless Rolls600 g,$7.99ea,,$1.33/ 100g,False
frozen,President's Choice,Yuzu Citrus and Blueberry Sorbet,President's ChoiceYuzu Citrus and Blueberry Sorbet946 ml,$3.99ea,,$0.42/ 100ml,False
frozen,No Name,Original Waffles,No NameOriginal Waffles1680 g,$15.99ea,,$0.95/ 100g,False
frozen,Wong Wing,Honey Garlic Pork,Wong WingHoney Garlic Pork400 g,$7.99ea,,$2.00/ 100g,False
frozen,Zoglos,Meatless Wieners,ZoglosMeatless Wieners300 g,$5.99ea,,$2.00/ 100g,False
frozen,PC Blue Menu,Lean Beef Burgers,PC Blue MenuLean Beef Burgers2.27 kg,$27.99ea,,$1.23/ 100g,False
frozen,President's Choice,Kofta Beef Meatballs,President's ChoiceKofta Beef Meatballs454 g,$9.99ea,,$2.20/ 100g,False
frozen,Delissio,Hawaiian Pizza,DelissioHawaiian Pizza857 g,$6.50ea,$5.88ea,$0.69/ 100g,True
frozen,St Hubert,Tourtière Fully Cooked,St HubertTourtière Fully Cooked470 g,$9.99ea,,$2.13/ 100g,False
frozen,High Liner,"Pan Sear Selects Haddock, Traditional","High LinerPan Sear Selects Haddock, Traditional540 g",$17.99ea,,$3.60/ 100g,False
frozen,Nature's Path,"Flax Plus Waffles, Buckwheat Wildberry","Nature's PathFlax Plus Waffles, Buckwheat Wildberry210 g",$5.49ea,$4.49ea,$2.14/ 100g,True
frozen,President's Choice,"Ice Cream Shop, Elk Crossing Mini Ice Cream Bars","President's ChoiceIce Cream Shop, Elk Crossing Mini Ice Cream Bars330 ml",$6.49ea,,$1.97/ 100ml,False
frozen,Chapmans,Dutch Chocolate,ChapmansDutch Chocolate2 l,$5.99ea,,$0.30/ 100ml,False
frozen,Chapmans,Yukon French Vanilla & Almond Lynx Bar,ChapmansYukon French Vanilla & Almond Lynx Bar6x90.0 ml,$8.99ea,,$1.66/ 100ml,False
frozen,President's Choice,Pork and Smoky Bacon Skewers,President's ChoicePork and Smoky Bacon Skewers450 g,$15.99ea,,$3.55/ 100g,False
frozen,Delissio,"Pizza, Croissant Crust Ham & Cheese ","DelissioPizza, Croissant Crust Ham & Cheese 691 g",$8.99ea,,$1.30/ 100g,False
frozen,PC Organics,Organics Peaches and Cream Corn,PC OrganicsOrganics Peaches and Cream Corn500 g,$5.49ea,,$1.10/ 100g,False
frozen,PC Organics,Organic Whole Strawberries,PC OrganicsOrganic Whole Strawberries600 g,$8.99ea,,$1.50/ 100g,False
frozen,President's Choice,Banana Split Ice Cream,President's ChoiceBanana Split Ice Cream946 ml,$4.49ea,$3.99ea,$0.42/ 100ml,True
frozen,President's Choice,Gluten Free Four Cheese Pizza,President's ChoiceGluten Free Four Cheese Pizza340 g,$9.99ea,,$2.94/ 100g,False
frozen,President's Choice,Plant Based Chickenless Breaded Cutlets,President's ChoicePlant Based Chickenless Breaded Cutlets340 g,$8.99ea,,$2.64/ 100g,False
frozen,President's Choice,"Plant Based Black Bean, Corn and Sweet Potato Veggie Burgers","President's ChoicePlant Based Black Bean, Corn and Sweet Potato Veggie Burgers452 g",$7.99ea,,$1.77/ 100g,False
frozen,No Name,Mixed Garden Vegetables,No NameMixed Garden Vegetables750 g,$3.49ea,,$0.47/ 100g,False
frozen,No Name,Chocolatey Chip Ice Cream Sandwiches,No NameChocolatey Chip Ice Cream Sandwiches24x120.0 ml,$10.99ea,,$0.38/ 100ml,False
frozen,Yves,Veggie Nuggets With Whole Wheat Breading Simulated Chicken Nuggets,YvesVeggie Nuggets With Whole Wheat Breading Simulated Chicken Nuggets320 g,$6.99ea,,$2.18/ 100g,False
frozen,Pillsbury,Pizza Pops 3 Cheese Flavour 8ct,PillsburyPizza Pops 3 Cheese Flavour 8ct760 g,$8.99ea,,$1.18/ 100g,False
frozen,President's Choice,Mint Chocolate Ice Cream,President's ChoiceMint Chocolate Ice Cream946 ml,$4.49ea,$3.99ea,$0.42/ 100ml,True
frozen,President's Choice,Sliced Red Beets,President's ChoiceSliced Red Beets500 g,$5.49ea,,$1.10/ 100g,False
frozen,Chapmans,Neapolitan Ice Cream Sandwich,ChapmansNeapolitan Ice Cream Sandwich12x120.0 ml,$5.64ea,$4.49ea,$0.31/ 100ml,True
frozen,President's Choice,"Ice Cream Shop, Elk Crossing Mini Ice Cream Bars","President's ChoiceIce Cream Shop, Elk Crossing Mini Ice Cream Bars330 ml",$6.49ea,,$1.97/ 100ml,False
frozen,Chapmans,Dutch Chocolate,ChapmansDutch Chocolate2 l,$5.99ea,,$0.30/ 100ml,False
frozen,Chapmans,Yukon French Vanilla & Almond Lynx Bar,ChapmansYukon French Vanilla & Almond Lynx Bar6x90.0 ml,$8.99ea,,$1.66/ 100ml,False
frozen,President's Choice,Pork and Smoky Bacon Skewers,President's ChoicePork and Smoky Bacon Skewers450 g,$15.99ea,,$3.55/ 100g,False
frozen,Stouffers,Diner Classics Swedish Meatballs,StouffersDiner Classics Swedish Meatballs270 g,$6.99ea,,$2.59/ 100g,False
frozen,Honeydew,Frozen Concentrated Fruit Beverage Tropical Fruit Punch,HoneydewFrozen Concentrated Fruit Beverage Tropical Fruit Punch355 ml,$1.79ea,,$0.50/ 100ml,False
frozen,Delissio,Thin Crispy Crust Canadian Pizza,DelissioThin Crispy Crust Canadian Pizza520 g,$7.29ea,,$1.40/ 100g,False
frozen,Green Giant,Valley Selections Stir Fry Medley,Green GiantValley Selections Stir Fry Medley400 g,$3.99ea,$3.49ea,$0.87/ 100g,True
frozen,Tim Hortons,Apple Fritter Ice Cream,Tim HortonsApple Fritter Ice Cream500 ml,$6.99ea,,$1.40/ 100ml,False
frozen,Mccain,Deluxe Pizza Pockets ,MccainDeluxe Pizza Pockets 600 g,$8.49ea,$6.99ea,$1.17/ 100g,True
frozen,Magnum,Ice Cream Bar Double Chocolate Bar,MagnumIce Cream Bar Double Chocolate Bar3x90.0 ml,$6.99ea,,$2.59/ 100ml,False
frozen,PC Blue Menu,Chicken Korma,PC Blue MenuChicken Korma350 g,$4.99ea,,$1.43/ 100g,False
frozen,PC Blue Menu,"Thin & Crispy Vegetables, Spinach And Goat Cheese Pizza","PC Blue MenuThin & Crispy Vegetables, Spinach And Goat Cheese Pizza363 g",$4.50ea,$3.99ea,$1.10/ 100g,True
frozen,Zoglos,Veggie Burgers,ZoglosVeggie Burgers300 g,$6.99ea,,$2.33/ 100g,False
frozen,T&T,Pork & Leek Potstickers,T&TPork & Leek Potstickers567 g,$6.49ea,,$1.14/ 100g,False
frozen,Wong Wing,Lemon Chicken,Wong WingLemon Chicken400 g,$7.99ea,,$2.00/ 100g,False
frozen,Ready Bake,Frozen Bread Dough White,Ready BakeFrozen Bread Dough White445 g,$7.99ea,,$1.80/ 100g,False
frozen,Chapmans,Yukon Ice Cream Double the Dip with Milk Chocolate,ChapmansYukon Ice Cream Double the Dip with Milk Chocolate5x140.0 ml,$8.99ea,,$1.28/ 100ml,False
frozen,Burnbrae Farms,Egg Bites Pizza Mini,Burnbrae FarmsEgg Bites Pizza Mini336 g,$7.49ea,,$2.23/ 100g,False
frozen,Nature's Path,Gluten Free Chocolate Chip Waffle,Nature's PathGluten Free Chocolate Chip Waffle210 g,$5.49ea,$4.49ea,$2.14/ 100g,True
frozen,President's Choice,Raw Shrimp,President's ChoiceRaw Shrimp340 g,$11.99ea,$10.99ea,$3.23/ 100g,True
frozen,Stouffers,Bistro Crustini Steak and Cheddar Cheese Pastry Snack,StouffersBistro Crustini Steak and Cheddar Cheese Pastry Snack226 g,$4.79ea,,$2.12/ 100g,False
frozen,Stouffers,"Bistro Crustini, Bacon, Egg and Cheese","StouffersBistro Crustini, Bacon, Egg and Cheese240 g",$4.79ea,,$2.00/ 100g,False
frozen,President's Choice,French Quiche Bistro-Style Selection,President's ChoiceFrench Quiche Bistro-Style Selection360 g,$7.99ea,,$2.22/ 100g,False
frozen,Stouffers,"Crustini, Barbecue Chicken","StouffersCrustini, Barbecue Chicken256 g",$4.79ea,,$1.87/ 100g,False
frozen,President's Choice,Nashville-Style Chicken Wings,President's ChoiceNashville-Style Chicken Wings907 g,$15.99ea,,$1.76/ 100g,False
frozen,President's Choice,Thick & Juicy Beef Burgers,President's ChoiceThick & Juicy Beef Burgers2.72 kg,$31.99ea,,$1.18/ 100g,False
frozen,Delissio,Pizzeria Vintage 4 Cheese,DelissioPizzeria Vintage 4 Cheese519 g,$6.50ea,$5.88ea,$1.13/ 100g,True
frozen,Swanson,Oven Roasters Seasoned Red Potato Wedges & Onions,SwansonOven Roasters Seasoned Red Potato Wedges & Onions425 g,$6.49ea,,$1.53/ 100g,False
frozen,Mccain,Pizza Pockets Three Cheese,MccainPizza Pockets Three Cheese1.2 kg,$14.99ea,,$1.25/ 100g,False
frozen,Janes, Turkey Burgers,Janes Turkey Burgers600 g,$15.99ea,,$2.67/ 100g,False
frozen,Cheemo,"Perogies, Cheddar Cheese","CheemoPerogies, Cheddar Cheese2 kg",$7.99ea,,$0.40/ 100g,False
frozen,Dr Oetker,Ristorante Thin Crust Pepperoni Pizza,Dr OetkerRistorante Thin Crust Pepperoni Pizza320 g,$5.49ea,,$1.72/ 100g,False
frozen,President's Choice,Strawberry Ice Cream,President's ChoiceStrawberry Ice Cream1.65 l,$5.99ea,,$0.36/ 100ml,False
frozen,PC Organics,Organic Pitted Dark Sweet Cherries,PC OrganicsOrganic Pitted Dark Sweet Cherries600 g,$8.99ea,,$1.50/ 100g,False
frozen,Chapmans,"Yukon Ice Cream Caramel, Toffee & Milk Chocolate","ChapmansYukon Ice Cream Caramel, Toffee & Milk Chocolate5x140.0 ml",$8.99ea,,$1.28/ 100ml,False
