category,brand,product_text,product_name,price_text,sale_price,per_unit_price_text,is_sale,ranking,sale_valid_to
meat,President's Choice,"Air Chilled Chicken Thighs, Bone-in, Skin-on","President's ChoiceAir Chilled Chicken Thighs, Bone-in, Skin-on1 ea",$10.00ea,,$10.00/ 1ea,False,198.0,
meat,President's Choice,Dry-Rubbed Sea Salt & Black Pepper Pork Back Ribs,President's ChoiceDry-Rubbed Sea Salt & Black Pepper Pork Back Ribs680 g,$16.99ea,,$2.50/ 100g,False,199.0,
meat,President's Choice,"Pub Recipe Chicken Strips, Fully Cooked","President's ChoicePub Recipe Chicken Strips, Fully Cooked700 g",$7.29ea,,$1.04/ 100g,False,200.0,
meat,President's Choice,Yuzu Citrus Chicken Wings,President's ChoiceYuzu Citrus Chicken Wings907 g,$16.99ea,,$1.87/ 100g,False,201.0,
meat,President's Choice,Thick & Juicy™ Prime Rib Beef Burger,President's ChoiceThick & Juicy™ Prime Rib Beef Burger1.13 kg,$16.99ea,,$1.50/ 100g,False,202.0,
meat,No Name,Breaded Chicken Cutlettes Chicken Strips,No NameBreaded Chicken Cutlettes Chicken Strips908 g,$6.99ea,,$0.77/ 100g,False,203.0,
meat,Zabiha Halal,Sausage Snacks Original Fully Cooked Chicken Sticks,Zabiha HalalSausage Snacks Original Fully Cooked Chicken Sticks300 g,$9.99ea,,$3.33/ 100g,False,204.0,
meat,President's Choice,"Too Good To Be Wings, Honey Garlic","President's ChoiceToo Good To Be Wings, Honey Garlic800 g",$15.99ea,,$2.00/ 100g,False,205.0,
meat,President's Choice,Honey Garlic Chicken Wings,President's ChoiceHoney Garlic Chicken Wings907 g,$16.99ea,,$1.87/ 100g,False,206.0,
meat,No Name,"Chicken Wings, Mild BBQ","No NameChicken Wings, Mild BBQ908 g",$15.99ea,,$1.76/ 100g,False,207.0,
meat,President's Choice,Italian Smokies,President's ChoiceItalian Smokies1 kg,$14.29ea,,$1.43/ 100g,False,208.0,
meat,Maple Leaf,Natural Ground Pork Sausage Meat,Maple LeafNatural Ground Pork Sausage Meat500 g,$7.69ea,,$1.54/ 100g,False,209.0,
meat,Sufra,Boneless Skinless Chicken Breasts,SufraBoneless Skinless Chicken Breasts645 g,$12.00ea,,$1.86/ 100g,False,210.0,
meat,,Beef Top Sirloin Fast Fry Steak,Beef Top Sirloin Fast Fry Steak,$7.85(est.)ea,,$29.74/ 1kg,False,211.0,
meat,,"Beef Sirloin Tip Steak, Club Pack","Beef Sirloin Tip Steak, Club Pack",$14.37(est.)ea,,$13.21/ 1kg,False,212.0,
meat,President's Choice,Free From Flank Steak,President's ChoiceFree From Flank Steak,$16.26(est.)ea,,$39.65/ 1kg,False,213.0,
meat,,"Beef Stewing Cubes, Boneless","Beef Stewing Cubes, Boneless",$9.80(est.)ea,,$22.02/ 1kg,False,214.0,
meat,,Beef Eye of Round Oven Roast,Beef Eye of Round Oven Roast,$21.27(est.)ea,,$18.71/ 1kg,False,215.0,
meat,President's Choice,Breaded Chicken Strips,President's ChoiceBreaded Chicken Strips600 g,$7.29ea,,$1.22/ 100g,False,216.0,
meat,President's Choice,Butter-Infused Stuffed Turkey Crown,President's ChoiceButter-Infused Stuffed Turkey Crown3 kg,$38.99ea,,$1.30/ 100g,False,217.0,
meat,Marcangelo,Italian Pork Meatballs,MarcangeloItalian Pork Meatballs1 kg,$15.99ea,,$1.60/ 100g,False,218.0,
meat,President's Choice,Free From Crisp & Crunchy Mild Southern-Style Chicken Wings,President's ChoiceFree From Crisp & Crunchy Mild Southern-Style Chicken Wings700 g,$16.99ea,,$2.43/ 100g,False,219.0,
meat,President's Choice,Free From Naturally Smoked Fully Cooked Thick Sliced Bacon,President's ChoiceFree From Naturally Smoked Fully Cooked Thick Sliced Bacon65 g,$7.29ea,,$11.22/ 100g,False,220.0,
meat,President's Choice,Plant Based Sweet Italian Sausage,President's ChoicePlant Based Sweet Italian Sausage400 g,$8.99ea,,$2.25/ 100g,False,221.0,
meat,President's Choice,Barbecue Seasoned Pork Shoulder Blade (World Of Flavours ),President's ChoiceBarbecue Seasoned Pork Shoulder Blade (World Of Flavours )900 g,$14.99ea,,$1.67/ 100g,False,222.0,
meat,President's Choice,"Fully Cooked Pork Back Ribs, Smokin Stampede","President's ChoiceFully Cooked Pork Back Ribs, Smokin Stampede500 g",$16.99ea,,$3.40/ 100g,False,223.0,
meat,Johnsonville,Mild Italian Sausage,JohnsonvilleMild Italian Sausage500 g,$7.99ea,,$1.60/ 100g,False,224.0,
meat,Janes, Turkey Strips,Janes Turkey Strips600 g,$15.99ea,,$2.67/ 100g,False,225.0,
meat,Janes,"Pub Style Chicken Fries, Fully Cooked","JanesPub Style Chicken Fries, Fully Cooked700 g",$13.99ea,,$2.00/ 100g,False,226.0,
meat,President's Choice,Free From Australian Lamb Spiedini 24 Skewers,President's ChoiceFree From Australian Lamb Spiedini 24 Skewers480 g,$26.99ea,,$5.62/ 100g,False,227.0,
meat,,Medium Ground Beef,Medium Ground Beef,$5.83(est.)ea,,$12.76/ 1kg,False,228.0,
meat,Butcher's Choice,Honey Garlic Flavoured Pork Sausages ,Butcher's ChoiceHoney Garlic Flavoured Pork Sausages 1.45 kg,$15.99ea,,$1.10/ 100g,False,229.0,
meat,,"Beef Top Sirloin Grilling Steak, Club Pack","Beef Top Sirloin Grilling Steak, Club Pack",$25.58(est.)ea,,$26.43/ 1kg,False,230.0,
meat,President's Choice,Dry-Rubbed Hardwood-Smoked Chicken Wings,President's ChoiceDry-Rubbed Hardwood-Smoked Chicken Wings800 g,$16.99ea,,$2.12/ 100g,False,231.0,
meat,Mina,Supreme Crunch Spicy Chicken Bites,MinaSupreme Crunch Spicy Chicken Bites600 g,$13.99ea,,$2.33/ 100g,False,232.0,
meat,President's Choice,Ham Steak,President's ChoiceHam Steak175 g,$5.49ea,$4.59ea,$2.62/ 100g,True,233.0,saleEnds 03/15
meat,No Name,Salt & Pepper Chicken Wings,No NameSalt & Pepper Chicken Wings908 g,$15.99ea,,$1.76/ 100g,False,234.0,
meat,,Pork Loin Center Cut Boneless Cutlet,Pork Loin Center Cut Boneless Cutlet,$5.38(est.)ea,,$15.41/ 1kg,False,235.0,
meat,Schneider,Applewood Smoked Sliced Ham,SchneiderApplewood Smoked Sliced Ham600 g,$16.99ea,,$2.83/ 100g,False,236.0,
meat,Pillers,European Wieners,PillersEuropean Wieners450 g,$9.99ea,,$2.22/ 100g,False,237.0,
meat,Maple Leaf,Natural Top Dogs Less Salt Hot Dogs,Maple LeafNatural Top Dogs Less Salt Hot Dogs375 g,$6.99ea,,$1.86/ 100g,False,238.0,
meat,Maple Leaf,Country Naturals Hot Dogs,Maple LeafCountry Naturals Hot Dogs375 g,$6.99ea,,$1.86/ 100g,False,239.0,
meat,Maple Leaf,Natural BBQ Shredded Chicken,Maple LeafNatural BBQ Shredded Chicken250 g,$11.49ea,,$4.60/ 100g,False,240.0,
meat,President's Choice,Smokin' Honey Fully Cooked Pork Back Ribs,President's ChoiceSmokin' Honey Fully Cooked Pork Back Ribs500 g,$16.99ea,,$3.40/ 100g,False,241.0,
meat,Schneider,Cheddar Hot Dogs,SchneiderCheddar Hot Dogs375 g,$6.49ea,,$1.73/ 100g,False,242.0,
meat,No Name,Crispy Southern Style Chicken,No NameCrispy Southern Style Chicken1 kg,$15.99ea,,$1.60/ 100g,False,243.0,
meat,Johnsonville,"Smoked Sausage, Buffalo Cheese","JohnsonvilleSmoked Sausage, Buffalo Cheese375 g",$7.49ea,,$2.00/ 100g,False,244.0,
meat,Janes,"Popcorn Chicken, Fully Cooked","JanesPopcorn Chicken, Fully Cooked700 g",$13.99ea,,$2.00/ 100g,False,245.0,
meat,Schneider,Juicy Jumbos Original Hot Dogs,SchneiderJuicy Jumbos Original Hot Dogs450 g,$6.99ea,,$1.55/ 100g,False,246.0,
meat,,Cook's Portion Ham,Cook's Portion Ham,$40.69(est.)ea,,$9.90/ 1kg,False,247.0,
meat,PC Blue Menu,Italian Beef Meatballs,PC Blue MenuItalian Beef Meatballs907 g,$16.99ea,,$1.87/ 100g,False,248.0,
meat,President's Choice,"Meatballs, Italian Style","President's ChoiceMeatballs, Italian Style907 g",$16.99ea,,$1.87/ 100g,False,249.0,
meat,President's Choice,Angus Beef Meatballs,President's ChoiceAngus Beef Meatballs907 g,$16.99ea,,$1.87/ 100g,False,250.0,
meat,President's Choice,Free From Angus Beef Burger,President's ChoiceFree From Angus Beef Burger1.02 kg,$16.99ea,,$1.67/ 100g,False,251.0,
meat,President's Choice,Original Smokies,President's ChoiceOriginal Smokies1 kg,$14.29ea,,$1.43/ 100g,False,252.0,
meat,President's Choice,Thick & Juicy™ Sirloin Beef Burgers ,President's ChoiceThick & Juicy™ Sirloin Beef Burgers 1.13 kg,$16.99ea,,$1.50/ 100g,False,253.0,
meat,Maple Leaf,Natural Smoked Honey Ham,Maple LeafNatural Smoked Honey Ham600 g,$15.99ea,,$2.67/ 100g,False,254.0,
meat,Schneider,Salt & Cracked Pepper Chicken Wings,SchneiderSalt & Cracked Pepper Chicken Wings615 g,$16.99ea,,$2.76/ 100g,False,255.0,
meat,Schneider,Juicy Jumbos All Beef Hot Dogs,SchneiderJuicy Jumbos All Beef Hot Dogs375 g,$8.99ea,,$2.40/ 100g,False,256.0,
meat,,"Beef Eye of Round Marinating Steak, Club Pack","Beef Eye of Round Marinating Steak, Club Pack",$21.31(est.)ea,,$19.82/ 1kg,False,257.0,
meat,Johnsonville,"Smoked Sausage, Doubled Smoked","JohnsonvilleSmoked Sausage, Doubled Smoked375 g",$7.49ea,,$2.00/ 100g,False,258.0,
meat,President's Choice,Free From Top Sirloin Steak,President's ChoiceFree From Top Sirloin Steak,$15.73(est.)ea,,$37.46/ 1kg,False,259.0,
meat,,"Beef Striploin Grilling Steak, Club Pack","Beef Striploin Grilling Steak, Club Pack",$33.66(est.)ea,,$35.25/ 1kg,False,260.0,
meat,President's Choice,Free From Chorizo Pork Sausages,President's ChoiceFree From Chorizo Pork Sausages500 g,$7.99ea,,$1.60/ 100g,False,261.0,
meat,Beyond Meat,Sausage Mild Italian,Beyond MeatSausage Mild Italian400 g,$9.99ea,,$2.50/ 100g,False,262.0,
meat,No Name,Beef Burger 4 Oz,No NameBeef Burger 4 Oz1.36 kg,$13.99ea,,$1.03/ 100g,False,263.0,
meat,Maple Leaf,Ready Crisp Fully Cooked Natural Bacon Slices,Maple LeafReady Crisp Fully Cooked Natural Bacon Slices65 g,$8.99ea,,$13.83/ 100g,False,264.0,
meat,Zabiha Halal,Chicken Breakfast Strips,Zabiha HalalChicken Breakfast Strips375 g,$6.29ea,,$1.68/ 100g,False,265.0,
