category,brand,product_text,product_name,price_text,sale_price,per_unit_price_text,is_sale,ranking,sale_valid_to
meat,President's Choice,Old-Fashioned Style Bacon,President's ChoiceOld-Fashioned Style Bacon1 kg,$17.99ea,,$1.80/ 100g,False,1.0,
meat,PC Blue Menu,"Chicken Breast, Boneless Skinless, 3 Pack","PC Blue MenuChicken Breast, Boneless Skinless, 3 Pack1 ea",$12.00ea,,$12.00/ 1ea,False,2.0,
meat,No Name,Mild Sugar-Cured Bacon,No NameMild Sugar-Cured Bacon500 g,$7.49ea,$6.99ea,$1.40/ 100g,True,3.0,saleEnds 03/15
meat,President's Choice,Bacon,President's ChoiceBacon500 g,$8.49ea,,$1.70/ 100g,False,4.0,
meat,PC Blue Menu,"Boneless Skinless Chicken Breasts, 4 Pack","PC Blue MenuBoneless Skinless Chicken Breasts, 4 Pack1 ea",$16.00ea,,$16.00/ 1ea,False,5.0,
meat,No Name,"Bacon, Mild Sugar Cured with Reduced Salt, Uncooked","No NameBacon, Mild Sugar Cured with Reduced Salt, Uncooked500 g",$7.49ea,$6.99ea,$1.40/ 100g,True,6.0,saleEnds 03/15
meat,PC Blue Menu,Chicken Thighs  boneless Skinless  8 Pack,PC Blue MenuChicken Thighs  boneless Skinless  8 Pack1 ea,$12.00ea,,$12.00/ 1ea,False,7.0,
meat,PC Blue Menu,Ground Chicken,PC Blue MenuGround Chicken454 g,$8.00ea,,$1.76/ 100g,False,8.0,
meat,Janes,"Pub Style Chicken Strips, Fully Cooked","JanesPub Style Chicken Strips, Fully Cooked700 g",$13.99ea,,$2.00/ 100g,False,9.0,
meat,,"Beef Ground Medium, Club Pack","Beef Ground Medium, Club Pack",$14.72(est.)ea,,$11.00/ 1kg,False,10.0,
meat,,Lean Ground Beef,Lean Ground Beef,$6.65(est.)ea,,$14.09/ 1kg,False,11.0,
meat,No Name,Original Hot Dogs    ,No NameOriginal Hot Dogs    450 g,$3.99ea,,$0.89/ 100g,False,12.0,
meat,President's Choice,"Air Chilled Chicken, Whole","President's ChoiceAir Chilled Chicken, Whole",$17.03(est.)ea,,$9.46/ 1kg,False,13.0,
meat,,Beef Ground Lean Club Pack,Beef Ground Lean Club Pack,$15.38(est.)ea,,$13.21/ 1kg,False,14.0,
meat,President's Choice,Reduced Salt Bacon  ,President's ChoiceReduced Salt Bacon  500 g,$8.49ea,,$1.70/ 100g,False,15.0,
meat,,"Pork Back Ribs, 2 Pack","Pork Back Ribs, 2 Pack",$25.50(est.)ea,,$13.21/ 1kg,False,16.0,
meat,,Prime Beef Rib Premium Oven Roast,Prime Beef Rib Premium Oven Roast,$73.00(est.)ea,,$40.76/ 1kg,False,17.0,
meat,President's Choice,Free From Bacon Naturally Smoked,President's ChoiceFree From Bacon Naturally Smoked0.375 kg,$8.49ea,$7.99ea,$2.13/ 100g,True,18.0,saleEnds 03/15
meat,Schneider,Hickory Smoked Classic Cut Bacon,SchneiderHickory Smoked Classic Cut Bacon375 g,$8.79ea,$6.99ea,$1.86/ 100g,True,19.0,saleEnds 03/15
meat,Janes,"Pub Style Chicken Nugget, Fully Cooked","JanesPub Style Chicken Nugget, Fully Cooked700 g",$13.99ea,,$2.00/ 100g,False,20.0,
meat,Maple Leaf,Original Natural Bacon,Maple LeafOriginal Natural Bacon375 g,$8.79ea,$6.99ea,$1.86/ 100g,True,21.0,saleEnds 03/15
meat,No Name,Chicken Hot Dogs,No NameChicken Hot Dogs450 g,$2.49ea,,$0.55/ 100g,False,22.0,
meat,President's Choice,Free From Mild Italian Pork Sausages,President's ChoiceFree From Mild Italian Pork Sausages500 g,$7.99ea,,$1.60/ 100g,False,23.0,
meat,,Pork Tenderloin Pack of 2,Pork Tenderloin Pack of 2,$11.66(est.)ea,,$11.00/ 1kg,False,24.0,
meat,,"Chicken Leg (Back Attached) , Club Pack","Chicken Leg (Back Attached) , Club Pack",$6.53(est.)ea,,$5.49/ 1kg,False,25.0,
meat,Janes,"Pub Style Chicken Burger, Fully Cooked","JanesPub Style Chicken Burger, Fully Cooked700 g",$13.99ea,,$2.00/ 100g,False,26.0,
meat,Maple Leaf,Natural Top Dogs Original Hot Dogs,Maple LeafNatural Top Dogs Original Hot Dogs375 g,$6.99ea,,$1.86/ 100g,False,27.0,
meat,St Hubert,Montana's Texan BBQ Ribs,St HubertMontana's Texan BBQ Ribs650 g,$16.49ea,,$2.54/ 100g,False,28.0,
meat,,Boneless Pork For Stew,Boneless Pork For Stew,$6.48(est.)ea,,$14.31/ 1kg,False,29.0,
meat,Maple Leaf,Oktoberfest Dinner Sausage,Maple LeafOktoberfest Dinner Sausage375 g,$8.99ea,,$2.40/ 100g,False,30.0,
meat,Pinty's,Chicken Wings Honey & Garlic Flavoured,Pinty'sChicken Wings Honey & Garlic Flavoured780 g,$23.99ea,,$3.08/ 100g,False,31.0,
meat,The Keg,Prime Rib Beef Burger,The KegPrime Rib Beef Burger1.02 kg,$22.99ea,,$2.25/ 100g,False,32.0,
meat,Janes,"Boneless Chicken Bites, Honey Garlic","JanesBoneless Chicken Bites, Honey Garlic710 g",$20.99ea,,$2.96/ 100g,False,33.0,
meat,,Beef Porterhouse T-Bone Grilling Steak,Beef Porterhouse T-Bone Grilling Steak,$24.95(est.)ea,,$41.87/ 1kg,False,34.0,
meat,Janes,Boneless Chicken Bites,JanesBoneless Chicken Bites710 g,$20.99ea,,$2.96/ 100g,False,35.0,
meat,,"Pork Loin Chop, Bone In Center Cut","Pork Loin Chop, Bone In Center Cut",$6.05(est.)ea,,$12.10/ 1kg,False,36.0,
meat,Butcher's Choice,Hot Italian Pork Sausages,Butcher's ChoiceHot Italian Pork Sausages1.45 kg,$15.99ea,,$1.10/ 100g,False,37.0,
meat,President's Choice,World Of Flavours Greek Seasoned Pork Loin Chops,President's ChoiceWorld Of Flavours Greek Seasoned Pork Loin Chops440 g,$9.99ea,,$2.27/ 100g,False,38.0,
meat,Gold Label,Naturally Smokeys Smoked Sausages Made With Natural Ingredients Original,Gold LabelNaturally Smokeys Smoked Sausages Made With Natural Ingredients Original375 g,$5.49ea,,$1.46/ 100g,False,39.0,
meat,Lous,Pork Back Ribs BBQ Sauce,LousPork Back Ribs BBQ Sauce610 g,$15.99ea,,$2.62/ 100g,False,40.0,
meat,,Pork Loin Rib End Chop,Pork Loin Rib End Chop,$5.40(est.)ea,,$11.00/ 1kg,False,41.0,
meat,Sufra,Skin-on Chicken Legs,SufraSkin-on Chicken Legs1.28 kg,$8.00ea,,$0.63/ 100g,False,42.0,
meat,President's Choice,Free From Lean Ground Lamb,President's ChoiceFree From Lean Ground Lamb454 g,$15.99ea,,$3.52/ 100g,False,43.0,
meat,Maple Leaf,Fully Cooked Natural Pork Breakfast Sausage Patties,Maple LeafFully Cooked Natural Pork Breakfast Sausage Patties300 g,$8.29ea,,$2.76/ 100g,False,44.0,
meat,Schneider,"Smoked Sausage, Oktoberfest","SchneiderSmoked Sausage, Oktoberfest375 g",$7.99ea,,$2.13/ 100g,False,45.0,
meat,President's Choice,Chicken Wing Nashville,President's ChoiceChicken Wing Nashville,$16.51/1 ea,,$16.51/ 1kg,False,46.0,
meat,,Beef Tenderloin Grilling Steak,Beef Tenderloin Grilling Steak,$25.86(est.)ea,,$79.34/ 1kg,False,47.0,
meat,No Name,Breaded Chicken Cutlettes Chicken Nuggets Club Size,No NameBreaded Chicken Cutlettes Chicken Nuggets Club Size1810 g,$12.49ea,,$0.69/ 100g,False,48.0,
meat,Gold Label,Naturally Smokeys Smoked Sausages Made With Natural Ingredients Original,Gold LabelNaturally Smokeys Smoked Sausages Made With Natural Ingredients Original375 g,$5.49ea,,$1.46/ 100g,False,49.0,
meat,Maple Leaf,Fully Cooked Natural Pork Breakfast Sausage Patties,Maple LeafFully Cooked Natural Pork Breakfast Sausage Patties300 g,$8.29ea,,$2.76/ 100g,False,50.0,
meat,Schneider,"Smoked Sausage, Oktoberfest","SchneiderSmoked Sausage, Oktoberfest375 g",$7.99ea,,$2.13/ 100g,False,51.0,
meat,President's Choice,Free From Bacon Style Turkey,President's ChoiceFree From Bacon Style Turkey300 g,$7.99ea,$7.29ea,$2.43/ 100g,True,52.0,saleEnds 03/22
meat,President's Choice,Honey Barbecue Pork Back Ribs,President's ChoiceHoney Barbecue Pork Back Ribs680 g,$16.99ea,,$2.50/ 100g,False,53.0,
meat,Maple Lodge Farms LT,Chicken Wiener,Maple Lodge Farms LTChicken Wiener450 g,$3.99ea,,$0.89/ 100g,False,54.0,
meat,Maple Leaf,Natural Top Dogs BBQ Hot Dogs,Maple LeafNatural Top Dogs BBQ Hot Dogs375 g,$6.99ea,,$1.86/ 100g,False,55.0,
meat,President's Choice,"Pub Recipe Chicken Strips, Fully Cooked, Club Size","President's ChoicePub Recipe Chicken Strips, Fully Cooked, Club Size1.4 kg",$12.99ea,,$0.93/ 100g,False,56.0,
meat,Schneider,Juicy Jumbos Original Hot Dogs Family Pack,SchneiderJuicy Jumbos Original Hot Dogs Family Pack900 g,$11.99ea,,$1.33/ 100g,False,57.0,
meat,President's Choice,October Wurst Fully Cooked Pork Sausages,President's ChoiceOctober Wurst Fully Cooked Pork Sausages1 kg,$14.29ea,,$1.43/ 100g,False,58.0,
meat,Zabiha Halal,"Chicken Stix, Fully Cooked","Zabiha HalalChicken Stix, Fully Cooked300 g",$9.99ea,,$3.33/ 100g,False,59.0,
meat,Sufra,Skin-on Chicken Legs,SufraSkin-on Chicken Legs1.28 kg,$8.00ea,,$0.63/ 100g,False,60.0,
meat,Lous,Pork Back Ribs BBQ Sauce,LousPork Back Ribs BBQ Sauce610 g,$15.99ea,,$2.62/ 100g,False,61.0,
meat,,Pork Loin Rib End Chop,Pork Loin Rib End Chop,$5.40(est.)ea,,$11.00/ 1kg,False,62.0,
meat,President's Choice,Too Good To Be Wings Maple Barbecue Boneless Coated Chicken Breast Chunks,President's ChoiceToo Good To Be Wings Maple Barbecue Boneless Coated Chicken Breast Chunks800 g,$16.99ea,,$2.12/ 100g,False,63.0,
meat,President's Choice,Jerk Chicken Wings,President's ChoiceJerk Chicken Wings907 g,$15.99ea,$13.99ea,$1.54/ 100g,True,64.0,saleEnds 03/30
meat,PC Blue Menu,Angus Burger,PC Blue MenuAngus Burger1.02 kg,$15.99ea,,$1.57/ 100g,False,65.0,
meat,President's Choice,Nashville Breaded Chicken Bites,President's ChoiceNashville Breaded Chicken Bites700 g,$15.99ea,,$2.28/ 100g,False,66.0,
meat,,Beef Eye Of Round Fast Fry Steak,Beef Eye Of Round Fast Fry Steak,$5.77(est.)ea,,$22.02/ 1kg,False,67.0,
meat,Johnsonville,Smoked & Fully Cooked Sausages Pure Pork Smoked Bratwurst,JohnsonvilleSmoked & Fully Cooked Sausages Pure Pork Smoked Bratwurst375 g,$7.49ea,,$2.00/ 100g,False,68.0,
meat,Maple Lodge Farms LT,Ultimate Chicken Wiener,Maple Lodge Farms LTUltimate Chicken Wiener900 g,$6.99ea,,$0.78/ 100g,False,69.0,
meat,Beyond Meat,Beyond Sausage Hot Italian,Beyond MeatBeyond Sausage Hot Italian400 g,$9.99ea,,$2.50/ 100g,False,70.0,
meat,President's Choice,Free From Hot Italian Pork Sausages,President's ChoiceFree From Hot Italian Pork Sausages500 g,$7.99ea,,$1.60/ 100g,False,71.0,
meat,President's Choice,Free From Bangers Pork Sausages,President's ChoiceFree From Bangers Pork Sausages500 g,$7.99ea,,$1.60/ 100g,False,72.0,
meat,President's Choice,Sirloin Beef Meatballs ,President's ChoiceSirloin Beef Meatballs 907 g,$16.99ea,,$1.87/ 100g,False,73.0,
meat,Schneider,All Beef Hot Dogs,SchneiderAll Beef Hot Dogs375 g,$8.79ea,,$2.34/ 100g,False,74.0,
meat,President's Choice,Gluten Free Chicken Nuggets,President's ChoiceGluten Free Chicken Nuggets600 g,$8.49ea,,$1.42/ 100g,False,75.0,
meat,President's Choice,Free From Turkey Meatballs,President's ChoiceFree From Turkey Meatballs800 g,$16.99ea,,$2.12/ 100g,False,76.0,
meat,President's Choice,"Air Chilled Chicken Drumsticks, 8-Pack","President's ChoiceAir Chilled Chicken Drumsticks, 8-Pack1 ea",$10.00ea,,$10.00/ 1ea,False,77.0,
meat,President's Choice,Rosemary & Garlic Rack,President's ChoiceRosemary & Garlic Rack,$34.50(est.)ea,,$68.32/ 1kg,False,78.0,
meat,,T-Bone Grilling Steak Club Pack,T-Bone Grilling Steak Club Pack,$32.84(est.)ea,,$37.45/ 1kg,False,79.0,
meat,Johnsonville,Ground Mild Italian Sausage,JohnsonvilleGround Mild Italian Sausage375 g,$7.99ea,,$2.13/ 100g,False,80.0,
meat,,Sirloin Tip Oven Roast,Sirloin Tip Oven Roast,$14.86(est.)ea,,$11.00/ 1kg,False,81.0,
meat,,Beef Top Sirloin Grilling Steak Boneless,Beef Top Sirloin Grilling Steak Boneless,$12.80(est.)ea,,$27.53/ 1kg,False,82.0,
meat,Johnsonville,Original Bratwurst Sausage,JohnsonvilleOriginal Bratwurst Sausage500 g,$7.99ea,,$1.60/ 100g,False,83.0,
meat,President's Choice,Worlds of Flavors Carnitas Pork Shoulder,President's ChoiceWorlds of Flavors Carnitas Pork Shoulder900 g,$14.99ea,,$1.67/ 100g,False,84.0,
meat,,Striploin Roast,Striploin Roast,$44.31(est.)ea,,$35.25/ 1kg,False,85.0,
meat,President's Choice,Crisp & Crunchy Spicy Southern-Style Chicken Wings,President's ChoiceCrisp & Crunchy Spicy Southern-Style Chicken Wings907 g,$16.99ea,,$1.87/ 100g,False,86.0,
meat,President's Choice,"Air Chilled Chicken Breast Cutlet, Boneless, Skinless","President's ChoiceAir Chilled Chicken Breast Cutlet, Boneless, Skinless1 ea",$12.00ea,,$12.00/ 1ea,False,87.0,
meat,President's Choice,Rotisserie-Style Chicken Wings,President's ChoiceRotisserie-Style Chicken Wings907 g,$16.99ea,,$1.87/ 100g,False,88.0,
meat,,Boneless Pork Sirloin Roast,Boneless Pork Sirloin Roast,$11.91(est.)ea,,$12.10/ 1kg,False,89.0,
meat,Anchor Bay,Cooked Shrimp 61-70 ct,Anchor BayCooked Shrimp 61-70 ct454 g,$15.99ea,,$3.52/ 100g,False,90.0,
meat,,"Extra Lean Ground Beef, Club Pack","Extra Lean Ground Beef, Club Pack",$16.78(est.)ea,,$15.41/ 1kg,False,91.0,
meat,Impossible Foods Inc.,Simulated Meat Burger Patties Made From Plants,Impossible Foods Inc.Simulated Meat Burger Patties Made From Plants226 g,$9.49ea,,$4.20/ 100g,False,92.0,
meat,President's Choice,Plant Based Beefless Ground,President's ChoicePlant Based Beefless Ground340 g,$9.99ea,,$2.94/ 100g,False,93.0,
meat,President's Choice,Swedish Beef Meatballs,President's ChoiceSwedish Beef Meatballs907 g,$16.99ea,,$1.87/ 100g,False,94.0,
meat,PC Blue Menu,Sirloin Beef Burger,PC Blue MenuSirloin Beef Burger1.02 kg,$16.99ea,,$1.67/ 100g,False,95.0,
meat,Maple Leaf,"Natural Pork Breakfast Sausage, Fully Cooked","Maple LeafNatural Pork Breakfast Sausage, Fully Cooked300 g",$8.29ea,,$2.76/ 100g,False,96.0,
meat,Schneider,Applewood Smoked Brown Sugar Ham,SchneiderApplewood Smoked Brown Sugar Ham700 g,$16.99ea,,$2.43/ 100g,False,97.0,
meat,President's Choice,Cheddar Smokies ,President's ChoiceCheddar Smokies 1 kg,$14.29ea,,$1.43/ 100g,False,98.0,
meat,No Name,Pork Cottage Roll,No NamePork Cottage Roll,$15.51(est.)ea,,$10.34/ 1kg,False,99.0,
meat,Swiss Chalet,BBQ Pork Ribs,Swiss ChaletBBQ Pork Ribs600 g,$16.49ea,,$2.75/ 100g,False,100.0,
meat,PC Blue Menu,Sirloin Beef Burger,PC Blue MenuSirloin Beef Burger1.02 kg,$16.99ea,,$1.67/ 100g,False,101.0,
meat,President's Choice,Kofta Beef Meatballs,President's ChoiceKofta Beef Meatballs454 g,$9.99ea,,$2.20/ 100g,False,102.0,
meat,President's Choice,Free From Smoked Ham,President's ChoiceFree From Smoked Ham700 g,$13.99ea,,$2.00/ 100g,False,103.0,
meat,President's Choice,Free From Pork Frankfurters,President's ChoiceFree From Pork Frankfurters375 g,$6.29ea,,$1.68/ 100g,False,104.0,
meat,President's Choice,Turkey Smokies,President's ChoiceTurkey Smokies300 g,$8.49ea,$7.99ea,$2.66/ 100g,True,105.0,saleEnds 03/22
meat,President's Choice,Cheddar Jalapeno Smokies Pork Sausages,President's ChoiceCheddar Jalapeno Smokies Pork Sausages1000 g,$14.29ea,,$1.43/ 100g,False,106.0,
meat,PC Blue Menu,Lean Beef Burgers,PC Blue MenuLean Beef Burgers2.27 kg,$27.99ea,,$1.23/ 100g,False,107.0,
meat,President's Choice,Gluten Free Chicken Strips,President's ChoiceGluten Free Chicken Strips600 g,$8.49ea,,$1.42/ 100g,False,108.0,
meat,President's Choice,Nashville-Style Chicken Wings,President's ChoiceNashville-Style Chicken Wings907 g,$16.99ea,,$1.87/ 100g,False,109.0,
meat,President's Choice,Honey Garlic Smokies,President's ChoiceHoney Garlic Smokies1 kg,$14.29ea,,$1.43/ 100g,False,110.0,
meat,Maple Leaf,Red Hots Original Hot Dogs Party Size,Maple LeafRed Hots Original Hot Dogs Party Size900 g,$9.99ea,,$1.11/ 100g,False,111.0,
meat,Maple Leaf,"Natural Pork Breakfast Sausage, Fully Cooked","Maple LeafNatural Pork Breakfast Sausage, Fully Cooked300 g",$8.29ea,,$2.76/ 100g,False,112.0,
meat,Maple Leaf,Natural Smoked Black Forest Ham,Maple LeafNatural Smoked Black Forest Ham600 g,$15.99ea,,$2.67/ 100g,False,113.0,
meat,President's Choice,Vermont-Style Maple Flavour Extra Lean Boneless Ham,President's ChoiceVermont-Style Maple Flavour Extra Lean Boneless Ham800 g,$12.99ea,,$1.62/ 100g,False,114.0,
meat,Maple Leaf,"Natural Top Dogs Original Hot Dogs, Family Size","Maple LeafNatural Top Dogs Original Hot Dogs, Family Size900 g",$9.99ea,,$1.11/ 100g,False,115.0,
meat,Maple Leaf,Original Natural Smoked Ham,Maple LeafOriginal Natural Smoked Ham600 g,$15.99ea,,$2.67/ 100g,False,116.0,
meat,President's Choice,Smokin Stampede Pork Back Ribs ,President's ChoiceSmokin Stampede Pork Back Ribs 680 g,$16.99ea,,$2.50/ 100g,False,117.0,
meat,Johnsonville,Ground Mild Italian Sausage,JohnsonvilleGround Mild Italian Sausage375 g,$7.99ea,,$2.13/ 100g,False,118.0,
meat,President's Choice,"Chicken Wings Club Pack, Honey Garlic","President's ChoiceChicken Wings Club Pack, Honey Garlic1.81 kg",$29.99ea,,$1.66/ 100g,False,119.0,
meat,,Beef Striploin Steak,Beef Striploin Steak,$14.87(est.)ea,,$37.46/ 1kg,False,120.0,
meat,,Beef Striploin Fast Fry Steak,Beef Striploin Fast Fry Steak,$11.98(est.)ea,,$39.66/ 1kg,False,121.0,
meat,President's Choice,Free From Lean Ground Beef,President's ChoiceFree From Lean Ground Beef454 g,$9.99ea,,$2.20/ 100g,False,122.0,
meat,No Name,Pork Loin Peameal-Style Sliced Cured,No NamePork Loin Peameal-Style Sliced Cured454 g,$6.49ea,,$1.43/ 100g,False,123.0,
meat,Beyond Meat,Beyond Beef Grounds,Beyond MeatBeyond Beef Grounds340 g,$9.99ea,,$2.94/ 100g,False,124.0,
meat,No Name,All-Beef Wieners,No NameAll-Beef Wieners450 g,$6.49ea,,$1.44/ 100g,False,125.0,
meat,Butterball,Boneless Stuffed Turkey Ball Frozen,ButterballBoneless Stuffed Turkey Ball Frozen1.5 kg,$26.99ea,,$1.80/ 100g,False,126.0,
meat,,Wing Grilling Steak,Wing Grilling Steak,$17.47(est.)ea,,$38.56/ 1kg,False,127.0,
meat,President's Choice,Butter Infused Young Turkey - Frozen - 7-9kg,President's ChoiceButter Infused Young Turkey - Frozen - 7-9kg1 kg,$62.00ea,,,False,128.0,
meat,Johnsonville,Hot Italian Sausage,JohnsonvilleHot Italian Sausage500 g,$7.99ea,,$1.60/ 100g,False,129.0,
meat,,Seasoned Veal Meatballs,Seasoned Veal Meatballs,$9.61(est.)ea,,$19.82/ 1kg,False,130.0,
meat,President's Choice,World of Flavours Greek Meatballs,President's ChoiceWorld of Flavours Greek Meatballs400 g,$8.49ea,,$2.12/ 100g,False,131.0,
meat,Janes, Turkey Burgers,Janes Turkey Burgers600 g,$15.99ea,,$2.67/ 100g,False,132.0,
meat,President's Choice,World Of Flavours Greek Seasoned Pork Loin Roast,President's ChoiceWorld Of Flavours Greek Seasoned Pork Loin Roast730 g,$12.99ea,,$1.78/ 100g,False,133.0,
meat,President's Choice,Plant Based Spicy Italian Sausage,President's ChoicePlant Based Spicy Italian Sausage400 g,$8.99ea,,$2.25/ 100g,False,134.0,
meat,Johnsonville,Maple Breakfast Sausage,JohnsonvilleMaple Breakfast Sausage375 g,$7.99ea,,$2.13/ 100g,False,135.0,
meat,President's Choice,Plant Based Breakfast Sausage,President's ChoicePlant Based Breakfast Sausage300 g,$8.99ea,,$3.00/ 100g,False,136.0,
meat,,Beef Eye of Round Marinating Steak,Beef Eye of Round Marinating Steak,$7.30(est.)ea,,$20.92/ 1kg,False,137.0,
meat,President's Choice,Free From Maple Breakfast Pork Sausages,President's ChoiceFree From Maple Breakfast Pork Sausages375 g,$7.99ea,,$2.13/ 100g,False,138.0,
meat,,Pork Tenderloin,Pork Tenderloin,$6.58(est.)ea,,$13.21/ 1kg,False,139.0,
meat,Schneider,Red Hots Original Hot Dogs,SchneiderRed Hots Original Hot Dogs375 g,$6.99ea,,$1.86/ 100g,False,140.0,
meat,Cooks,Premium Lean Hickory Smoked Ham Steak,CooksPremium Lean Hickory Smoked Ham Steak454 g,$6.99ea,,$1.54/ 100g,False,141.0,
meat,Janes,BBQ Chickens Bites,JanesBBQ Chickens Bites710 g,$20.99ea,,$2.96/ 100g,False,142.0,
meat,,"Pork Loin Chop, Boneless Butterfly Cut","Pork Loin Chop, Boneless Butterfly Cut",$6.24(est.)ea,,$14.31/ 1kg,False,143.0,
meat,,Centre Cut Pork Loin Chop Boneless,Centre Cut Pork Loin Chop Boneless,$5.97(est.)ea,,$13.21/ 1kg,False,144.0,
meat,Schneider,Original Ham Steak,SchneiderOriginal Ham Steak175 g,$6.19ea,,$3.54/ 100g,False,145.0,
meat,President's Choice,Free From Wieners,President's ChoiceFree From Wieners375 g,$5.49ea,,$1.46/ 100g,False,146.0,
meat,President's Choice,Thick & Juicy™ Beef Burgers  ,President's ChoiceThick & Juicy™ Beef Burgers  1.36 kg,$16.99ea,,$1.25/ 100g,False,147.0,
meat,No Name,"Chicken Wings, Honey Garlic","No NameChicken Wings, Honey Garlic908 g",$15.99ea,,$1.76/ 100g,False,148.0,
meat,President's Choice,Medium Buffalo-Style Chicken Wings,President's ChoiceMedium Buffalo-Style Chicken Wings907 g,$16.99ea,,$1.87/ 100g,False,149.0,
meat,Schneider,Original Half Ham,SchneiderOriginal Half Ham700 g,$16.99ea,,$2.43/ 100g,False,150.0,
meat,Schneider,Texas BBQ Chicken Wings,SchneiderTexas BBQ Chicken Wings615 g,$16.99ea,,$2.76/ 100g,False,151.0,
meat,No Name,"Honey Garlic Chicken Wings, Club Pack","No NameHoney Garlic Chicken Wings, Club Pack1.81 kg",$25.99ea,$24.99ea,$1.38/ 100g,True,152.0,saleEnds 03/15
meat,Schneider,Red Hots Original Hot Dogs,SchneiderRed Hots Original Hot Dogs375 g,$6.99ea,,$1.86/ 100g,False,153.0,
meat,President's Choice,Thick & Juicy™ Chicken Burgers ,President's ChoiceThick & Juicy™ Chicken Burgers 1.13 kg,$16.99ea,,$1.50/ 100g,False,154.0,
meat,No Name,"Chicken Wings, Club Pack","No NameChicken Wings, Club Pack1.81 kg",$25.99ea,$24.99ea,$1.38/ 100g,True,155.0,saleEnds 03/15
meat,President's Choice,"Chicken Wings, Crisp & Crunchy Mild Southern-Style ","President's ChoiceChicken Wings, Crisp & Crunchy Mild Southern-Style 907 g",$16.99ea,,$1.87/ 100g,False,156.0,
meat,Schneider,"Smoked Sausage, Classic Cheddar","SchneiderSmoked Sausage, Classic Cheddar375 g",$7.99ea,,$2.13/ 100g,False,157.0,
meat,President's Choice,Thick & Juicy Beef Burgers,President's ChoiceThick & Juicy Beef Burgers2.72 kg,$31.99ea,,$1.18/ 100g,False,158.0,
meat,Schneider,"Smoked Sausage, Classic Recipe","SchneiderSmoked Sausage, Classic Recipe375 g",$7.99ea,,$2.13/ 100g,False,159.0,
meat,,"Navel Beef, 4LB","Navel Beef, 4LB1.814 kg",$22.99ea,,$1.27/ 100g,False,160.0,
meat,President's Choice,Jerk Frenched Chops,President's ChoiceJerk Frenched Chops440 g,$9.99ea,,$2.27/ 100g,False,161.0,
meat,Beyond Meat,Beyond Burger Plant-Based,Beyond MeatBeyond Burger Plant-Based226 g,$7.99ea,,$3.54/ 100g,False,162.0,
meat,President's Choice,Free From Honey Garlic Flavoured Pork Sausages ,President's ChoiceFree From Honey Garlic Flavoured Pork Sausages 500 g,$7.99ea,,$1.60/ 100g,False,163.0,
meat,President's Choice,World of Flavours Korean Meatballs,President's ChoiceWorld of Flavours Korean Meatballs400 g,$8.49ea,,$2.12/ 100g,False,164.0,
meat,Johnsonville,Honey Garlic Sausage,JohnsonvilleHoney Garlic Sausage500 g,$7.99ea,,$1.60/ 100g,False,165.0,
meat,,"Boneless Pork Loin Rib Chops, Club Pack","Boneless Pork Loin Rib Chops, Club Pack",$8.18(est.)ea,,$10.34/ 1kg,False,166.0,
meat,,Pork Rib Loin & Sirloin Combination Chop,Pork Rib Loin & Sirloin Combination Chop,$12.21(est.)ea,,$8.80/ 1kg,False,167.0,
meat,President's Choice,Free From Extra Lean Ground Beef,President's ChoiceFree From Extra Lean Ground Beef454 g,$10.99ea,,$2.42/ 100g,False,168.0,
meat,President's Choice,Everything Seasoned Breaded Chicken Breast Fillets,President's ChoiceEverything Seasoned Breaded Chicken Breast Fillets750 g,$15.99ea,,$2.13/ 100g,False,169.0,
meat,President's Choice,World Of Flavours Canadian Maple Apple Butter Roast,President's ChoiceWorld Of Flavours Canadian Maple Apple Butter Roast730 g,$12.99ea,,$1.78/ 100g,False,170.0,
meat,Pinty's,Buffalo Chicken Wings,Pinty'sBuffalo Chicken Wings780 g,$23.49ea,,$3.01/ 100g,False,171.0,
meat,PC Black Label,Wagyu Beef Burgers,PC Black LabelWagyu Beef Burgers568 g,$15.99ea,,$2.82/ 100g,False,172.0,
meat,President's Choice,Air Chilled Split Chicken Wings,President's ChoiceAir Chilled Split Chicken Wings1 ea,$12.00ea,,$12.00/ 1ea,False,173.0,
meat,,"Pork Sirloin Chops Boneless, Club Pack","Pork Sirloin Chops Boneless, Club Pack",$12.39(est.)ea,,$12.10/ 1kg,False,174.0,
meat,Johnsonville,Ground Hot Italian Sausage,JohnsonvilleGround Hot Italian Sausage375 g,$7.99ea,,$2.13/ 100g,False,175.0,
meat,,Pork Whole Side Ribs,Pork Whole Side Ribs,$12.63(est.)ea,,$6.59/ 1kg,False,176.0,
meat,,Pork Loin Chop Boneless Club Pack,Pork Loin Chop Boneless Club Pack,$9.49(est.)ea,,$11.00/ 1kg,False,177.0,
meat,President's Choice,Chicken Wing Split Buffalo,President's ChoiceChicken Wing Split Buffalo,$16.51/1 ea,,$16.51/ 1kg,False,178.0,
meat,Janes,Pub Style Turkey Nuggets,JanesPub Style Turkey Nuggets600 g,$15.99ea,,$2.67/ 100g,False,179.0,
meat,Butcher's Choice,Mild Italian Pork Sausages,Butcher's ChoiceMild Italian Pork Sausages1.45 kg,$15.99ea,,$1.10/ 100g,False,180.0,
meat,,"Beef Bottom Blade Pot Roast, Boneless","Beef Bottom Blade Pot Roast, Boneless",$23.98(est.)ea,,$19.82/ 1kg,False,181.0,
meat,Johnsonville,Brown Sugar & Honey Breakfast Sausage,JohnsonvilleBrown Sugar & Honey Breakfast Sausage375 g,$7.99ea,,$2.13/ 100g,False,182.0,
meat,,Pork Back Ribs,Pork Back Ribs,$14.47(est.)ea,,$15.41/ 1kg,False,183.0,
meat,,Beef Top Sirloin Grilling Cap Steak,Beef Top Sirloin Grilling Cap Steak,$11.25(est.)ea,,$28.63/ 1kg,False,184.0,
meat,President's Choice,Free From Naturally Smoked Fully Cooked Bacon,President's ChoiceFree From Naturally Smoked Fully Cooked Bacon65 g,$7.29ea,,$11.22/ 100g,False,185.0,
meat,President's Choice,Gluten Free Chicken Burgers,President's ChoiceGluten Free Chicken Burgers600 g,$8.49ea,,$1.42/ 100g,False,186.0,
meat,President's Choice,"Chicken Nuggets, Club Pack","President's ChoiceChicken Nuggets, Club Pack1.4 kg",$12.99ea,,$0.93/ 100g,False,187.0,
meat,Johnsonville,Original Breakfast Sausage Rounds,JohnsonvilleOriginal Breakfast Sausage Rounds250 g,$7.99ea,,$3.20/ 100g,False,188.0,
meat,President's Choice,"Too Good To Be Wings Boneless Chicken Breast Chunks, Butter Buffalo","President's ChoiceToo Good To Be Wings Boneless Chicken Breast Chunks, Butter Buffalo800 g",$16.99ea,,$2.12/ 100g,False,189.0,
meat,Lilydale,Daystarters Sausage Turkey ,LilydaleDaystarters Sausage Turkey 375 g,$5.99ea,,$1.60/ 100g,False,190.0,
meat,,Pork Sirloin Chops Boneless,Pork Sirloin Chops Boneless,$5.47(est.)ea,,$13.21/ 1kg,False,191.0,
meat,President's Choice,Angus Ballpark Franks,President's ChoiceAngus Ballpark Franks450 g,$6.49ea,,$1.44/ 100g,False,192.0,
meat,Gold Label,Naturally Smokeys Smoked Sausages Made With Natural Ingredients Cheddar,Gold LabelNaturally Smokeys Smoked Sausages Made With Natural Ingredients Cheddar375 g,$5.49ea,,$1.46/ 100g,False,193.0,
meat,President's Choice,"Plant Based Undeniable Burger, Fresh","President's ChoicePlant Based Undeniable Burger, Fresh226 g",$8.99ea,,$3.98/ 100g,False,194.0,
meat,Butcher's Choice,Pork Shoulder Blade Steak,Butcher's ChoicePork Shoulder Blade Steak,$25.44(est.)ea,,$6.59/ 1kg,False,195.0,
meat,No Name,"Chicken Strips, Club Pack","No NameChicken Strips, Club Pack1810 g",$12.49ea,,$0.69/ 100g,False,196.0,
meat,,"Ground Pork, Lean","Ground Pork, Lean",$6.34(est.)ea,,$9.90/ 1kg,False,197.0,
