category,product_name,price,per_unit_price
produce,"Bananas, Bunch",$1.75(est.)ea,$1.52/ 1kg
produce,Green Onion1 bunch,$1.79ea,$1.79/ 1ea
produce,Celery Stalks1 ea,$2.99ea,$2.99/ 1ea
produce,Tomato On The Vine Red ( 1 Bunch),$3.12(est.)ea,$4.39/ 1kg
produce,Avocados Bag1 bag,$1.99ea,$0.40/ 1ea
produce,Cauliflower1 ea,$4.99ea,$4.99/ 1ea
produce,Farmer's MarketEnglish Cucumber 3Ct    3 pack,$4.49ea,$1.50/ 1ea
produce,"Romaine Heart, 3 Pack3 pack",$6.49ea,$2.16/ 1ea
produce,Green Seedless Grapes,$4.48(est.)ea,$4.39/ 1kg
produce,Red Onion,$2.44(est.)ea,$6.59/ 1kg
produce,Red Seedless Grapes,$4.35(est.)ea,$4.39/ 1kg
produce,Farmer's MarketCarrots3 lb bag,$1.29ea,$0.09/ 100g
produce,Blueberries 1 pint340 g,$4.99ea,$1.47/ 100g
produce,"PC OrganicsOrganic Bananas, Bunch",$2.40(est.)ea,$2.18/ 1kg
produce,Ginger,$1.85(est.)ea,$8.80/ 1kg
produce,Bartlett Pears,$1.15(est.)ea,$5.49/ 1kg
produce,RoosterGarlic      90 g,$1.49ea,$0.50/ 1ea
produce,Farmer's MarketMini Carrots340 g,$1.99ea,$0.59/ 100g
produce,Sweet Onion,$2.53(est.)ea,$5.49/ 1kg
produce,POM WonderfulFresh Arils122 g,$4.99ea,$4.09/ 100g
produce,Premium Chicken BLT340 g,$8.00ea,$2.35/ 100g
produce,PC OrganicsRose Spring Salad Mix142 g,$5.99ea,$4.22/ 100g
produce,Yellow Zucchini,$1.19(est.)ea,$4.39/ 1kg
produce,LoopMorning Glory Juice    947 ml,$7.99ea,$0.80/ 100ml
produce,President's ChoiceDressing Caesar44 ml,$0.59ea,$1.34/ 100ml
produce,Carrots & Celery 240 g,$4.00ea,$1.67/ 100g
produce,Organic Sage1 ea,$3.99ea,$3.99/ 1ea
produce,Avocado Salad238 g,$8.00ea,$3.36/ 100g
produce,President's ChoiceMini Mixed Potatoes5 lb bag,$9.99ea,$0.44/ 100g
produce,RemedyOrganic Mango Passionfruit Kombucha700 ml,$4.99ea,$0.71/ 100ml
produce,"Mushroom Kebab, 4 pack604 g",$9.00ea,$1.49/ 100g
produce,PC Blue MenuUnsalted California Pistachios 454 g,$9.99ea,$2.20/ 100g
produce,Romaine Salad Family Size1 kg,$14.00ea,$1.40/ 100g
produce,Fresh Orange Juice1.5 l,$15.00ea,$1.00/ 100ml
produce,Baby Bok Choy Jr,$3.95(est.)ea,$5.90/ 1kg
produce,President's ChoiceMixed Greens0.34 kg,$3.49ea,$1.03/ 100g
produce,BolthouseBlue Goodness946 ml,$6.99ea,$0.74/ 100ml
produce,President's ChoiceGreek Vin Pouch 45Ml45 ml,$0.59ea,$1.31/ 100ml
produce,President's ChoiceSalad Kit Chopped Sesame Wonton 347 g,$6.49ea,$1.87/ 100g
produce,Organic Dried Figs250 g,$5.99ea,$2.40/ 100g
produce,Organic Dill Potted1 ea,$3.99ea,$3.99/ 1ea
produce,President's ChoiceMini Cucumbers255 g,$3.99ea,$1.56/ 100g
produce,Chick Pea/Artichoke/Sundried Tomato Salad,$7.45(est.)ea,$21.90/ 1kg
produce,RemedyPeach Kombucha700 ml,$4.99ea,$0.71/ 100ml
produce,Gourmet GardenStir-In Paste Thai Seasoning115 g,$5.99ea,$5.21/ 100g
produce,Lunch Size Veg and Dip 600G1 kg,$8.00ea,$1.33/ 100g
produce,"BolthouseJuice, 100% Pomegranate1.54 l",$12.99ea,$0.84/ 100ml
produce,Organic English Cucumber1 ea,$2.99ea,$2.99/ 1ea
produce,Organic Raspberry Lemon Kombucha355 ml,$3.49ea,$0.98/ 100ml
produce,Fresh Orange Juice473 ml,$6.00ea,$1.27/ 100ml
produce,MarzettiSouthwest Ranch Veggie Dip85 g,$1.49ea,$1.75/ 100g
produce,LoopCold-Pressed Juice Magic Sip1000 ml,$7.99ea,$7.99/ 100ml
produce,Organic Brussel Sprouts227 g,$7.99ea,$3.52/ 100g
produce,GreenhouseUltraviolet Organic Kombucha1000 ml,$9.99ea,$1.00/ 100ml
produce,Orange1 ea,$0.35ea,$0.35/ 1ea
produce,GreenhouseOrganic Booster Lullaby60 ml,$3.99ea,$6.65/ 100ml
produce,Greek Salad Family Size1 kg,$16.00ea,$1.60/ 100g
produce,"GreenhouseRaw, Organic Juice Genius300 ml",$7.49ea,$2.50/ 100ml
produce,"Organic, Red Kale1 bunch",$4.49ea,$0.99/ 100g
produce,Honey Pitted Dates350 g,$4.99ea,$1.43/ 100g
produce,Cantaloupe Slices1 kg,$5.00ea,$0.50/ 100g
produce,POM Wonderful100% Pomegranate Juice1.4 l,$14.99ea,$1.07/ 100ml
produce,No NameBrown Mushrooms680 g,$6.49ea,$0.95/ 100g
produce,Fresh AttitudeCaesar Salad with Toppings Single Sized175 g,$5.99ea,$3.42/ 100g
produce,"GreenhouseRaw, Organic Juice the Good300 ml",$7.49ea,$2.50/ 100ml
produce,Organic Lime Strawberry Kombucha355 ml,$3.49ea,$0.98/ 100ml
produce,LoopCold-Pressed Juice Better Together Grapefruit Orange Ginger947 ml,$7.99ea,$0.80/ 100ml
produce,Organic Chives Potted1 ea,$3.99ea,$3.99/ 1ea
produce,Gourmet GardenLemongrass Stir-In Paste115 g,$5.99ea,$5.21/ 100g
produce,Organic French Beans350 g,$5.99ea,$1.71/ 100g
produce,Sweet Kale290 g,$8.00ea,$2.76/ 100g
produce,Platter Veggie Small850 g,$13.00ea,$1.49/ 100g
produce,Chicken Caesar Salad Family Size1.07 kg,$16.00ea,$1.50/ 100g
produce,PC OrganicsOrganic Baby King Oyster Mushrooms200 g,$5.99ea,$3.00/ 100g
produce,GoodLeafMicro Arugula50 g,$3.99ea,$7.98/ 100g
produce,PC OrganicsOrganics Whole Button Cremini Mushrooms227 g,$3.99ea,$1.76/ 100g
produce,WellCold Pressed Juice C Well  333 ml,$5.99ea,$1.80/ 100ml
produce,Happy PlanetClean Protein Smoothie Fair Trade Chocolate & Coconut900 ml,$6.99ea,$0.78/ 100ml
produce,"Happy PlanetFruit Smoothie, Coconut & Pineapple900 ml",$6.99ea,$0.78/ 100ml
produce,BolthouseGreen Goodness1.54 l,$9.99ea,$0.65/ 100ml
produce,President's ChoiceSpring Mix0.142 kg,$4.99ea,$3.51/ 100g
produce,MarzettiMarzetti Chocolate Dip 250g250 g,$5.49ea,$2.20/ 100g
produce,SunrichApple Slices280 g,$4.99ea,$1.78/ 100g
produce,GreenhouseKombucha Ultraviolet Organic    340 ml,$4.99ea,$1.47/ 100ml
produce,Golden Figs227 g,$4.99ea,$2.20/ 100g
produce,PC OrganicsOrganic Bartlett Pears,$1.76(est.)ea,$8.80/ 1kg
produce,President's ChoiceLive Red Leaf Lettuce - 1 Unit350 g,$3.99ea,$3.99/ 1ea
produce,Organic Grapefruit907 ea,$6.99ea,$0.77/ 100g
produce,President's ChoiceMint28 g,$2.50ea,
produce,President's ChoiceLemon Seedless2 lb bag,$5.99ea,$0.66/ 100g
produce,PC OrganicsOrganic Cauliflower1 ea,$5.99ea,$5.99/ 1ea
produce,Farmer's MarketCarrots4.54 kg,$8.99ea,$0.20/ 100g
produce,Farmer's MarketGranny Smith Apples4 lb bag,$8.99ea,$0.50/ 100g
produce,PC OrganicsOrganic Thyme20 g,$2.99ea,
produce,"ParamountPistachios, Salt & Pepper200 g",$5.99ea,$3.00/ 100g
produce,PC OrganicsOrganic Tomato On The Vine Red (1 Bunch),$6.34(est.)ea,$8.80/ 1kg
produce,RemedyOrganic Mango Passionfruit Kombucha700 ml,$4.99ea,$0.71/ 100ml
produce,"Mushroom Kebab, 4 pack604 g",$9.00ea,$1.49/ 100g
produce,PC Blue MenuUnsalted California Pistachios 454 g,$9.99ea,$2.20/ 100g
produce,Romaine Salad Family Size1 kg,$14.00ea,$1.40/ 100g
produce,"PC OrganicsOrganic Avocados, Bag3 pack",$6.99ea,$2.33/ 1ea
produce,WellInk. Lemonade Charcoal    333 ml,$5.99ea,$1.80/ 100ml
produce,Farmer's MarketRed Grapefruit3 lb bag,$6.99ea,$0.51/ 100g
produce,French Beans400 g,$4.99ea,$1.25/ 100g
produce,President's ChoiceCocktail Tomatoes340 g,$4.99ea,$1.47/ 100g
produce,Taylor FarmsBroccoli Crunch Salad Kit360 g,$6.49ea,$1.80/ 100g
produce,Coloured Carrots454 g,$3.49ea,$0.77/ 100g
produce,No NameNaturally Imperfect Avocados3 lb bag,$8.99ea,$0.66/ 100g
produce,President's ChoiceThyme 28 g,$2.50ea,
produce,Organic Cantaloupe1 ea,$5.99ea,$5.99/ 1ea
produce,President's ChoiceBroccoli Slaw340 g,$3.99ea,$1.17/ 100g
produce,Papaya,$7.14(est.)ea,$5.49/ 1kg
produce,President's ChoiceSpring Mix0.312 kg,$6.99ea,$2.24/ 100g
produce,PC OrganicsBaby Spinach142 g,$5.99ea,$4.22/ 100g
produce,PC OrganicsOrganic Garlic115 g,$3.99ea,$3.47/ 100g
produce,PC OrganicsOrganic Sweet Potatoes 3lb Bag3 lb bag,$7.99ea,$0.59/ 100g
produce,"GreenhouseRaw, Organic Juice Gatsby300 ml",$7.49ea,$2.50/ 100ml
produce,ReneesRanch Refrigerated Dip283 g,$5.99ea,$2.12/ 100g
produce,Gourmet GardenItalian Herbs Stir-In Paste115 g,$5.99ea,$5.21/ 100g
produce,BolthouseBerry Boost946 ml,$6.99ea,$0.74/ 100ml
produce,Italian Eggplants,$1.58(est.)ea,$8.80/ 1kg
produce,GoodLeafGood Leaf Baby Arugula142 g,$5.99ea,$4.22/ 100g
produce,Jamaican Ginger,$4.05(est.)ea,$17.61/ 1kg
produce,Wholly GuacamoleMinis227 g,$5.99ea,$2.64/ 100g
produce,7DDried Mangos140 g,$9.99ea,$7.14/ 100g
produce,PC Blue MenuBlue Menu Unsalted Virginia Peanuts454 g,$3.99ea,$0.88/ 100g
produce,President's ChoiceBacon Caesar Chop Salad Kit326 g,$6.49ea,$1.99/ 100g
produce,BolthouseAmazing Mango946 ml,$6.99ea,$0.74/ 100ml
produce,Fresh AttitudeSpring Mix Salad with Toppings Single Sized155 g,$5.99ea,$3.86/ 100g
produce, Strawberry Limeade4x355.0 ml,$10.99ea,$3.10/ 100ml
produce,Broccoli Cauli Peas Carrots392 g,$6.00ea,$1.53/ 100g
produce,Organic Pink Grapefruit Smoothie355 ml,$3.49ea,$0.98/ 100ml
produce,MannsSnap Peas227 g,$5.49ea,$2.42/ 100g
produce,Pineapple Cubed Large1 kg,$9.00ea,$1.16/ 100g
produce,Greenbelt Organic Fresh Mix0.142 kg,$5.99ea,$4.22/ 100g
produce,President's ChoiceCauliflower Slaw0.34 kg,$3.99ea,$1.17/ 100g
produce,"President's ChoiceLive Lettuce Red/Green, 2-pack1 ea",$5.49ea,$5.49/ 1ea
produce,PC OrganicsOrganics Portobello Mushroom Caps240 g,$5.99ea,$2.50/ 100g
produce,GreenhouseOrganic Shake Vanilla Almond Brekky300 ml,$7.49ea,$2.50/ 100g
produce,GreenhouseGinger Tumeric Kombucha340 ml,$4.99ea,$1.47/ 100ml
produce,AuroraSundried Tomatoes85 g,$2.99ea,$3.32/ 100g
produce,Large House Cheddar Salad648 g,$11.00ea,$1.70/ 100g
produce,Fruit Salad Large750 g,$9.00ea,$1.20/ 100g
produce,WellCold Pressed Juice Be Well  333 ml,$5.99ea,$1.80/ 100ml
produce,WellCold Pressed Juice Be Well  333 ml,$5.99ea,$1.80/ 100ml
produce,Greenhouse Fiery Ginger60 ml,$3.99ea,$6.65/ 100ml
produce,Hami Melons,$14.75(est.)ea,$5.05/ 1kg
produce,"Red Bananas, Bunch",$2.76(est.)ea,$3.73/ 1kg
produce,Cooking Spinach227 g,$3.49ea,$1.54/ 100g
produce,"President's ChoiceLive Lettuce Green, 2-pack1 ea",$5.49ea,$5.49/ 1ea
produce,Petite Carrots340 g,$3.49ea,$1.03/ 100g
produce,"Pineapple Vegetable Kebab, 4 pack764 g",$9.00ea,$1.18/ 100g
produce,Mini Greek Salad155 g,$5.00ea,$3.23/ 100g
produce,Golden Delicious Apples,$1.21(est.)ea,$5.49/ 1kg
produce,Organic Dried Apricots250 g,$5.99ea,$2.40/ 100g
produce,Greek Yogurt Parfait290 g,$5.00ea,$1.72/ 100g
produce,Organic Thyme Potted1 ea,$3.99ea,$3.99/ 1ea
produce,Organic Collard Greens1 bunch,$3.99ea,$3.99/ 1ea
produce,President's ChoiceCaesar Salad Kit282 g,$4.99ea,$1.77/ 100g
produce,Snack  Platter380 g,$7.00ea,$1.84/ 100g
produce,Black Figs1 ea,$1.29ea,$1.29/ 1ea
produce,Greek Chicken Salad Family Size1.415 kg,$16.00ea,$1.13/ 100g
produce,President's ChoiceFinger Hot Hot Peppers226 g,$5.99ea,$2.65/ 100g
produce,Seedless Watermelon Halves1 ea,$7.00ea,$7.00/ 1ea
produce,"No NameRoasted Peanuts, No Salt907 g",$6.99ea,$0.77/ 100g
produce,President's ChoiceSalted California Pistachios454 g,$9.99ea,$2.20/ 100g
produce,Carnival Squash,$8.96(est.)ea,$4.39/ 1kg
produce,"MarzettiVeggie Dip, Light Ranch340 g",$5.49ea,$1.61/ 100g
produce,Bard Valley Natural Delights Pitted Medjool Dates340 g,$9.99ea,$2.94/ 100g
produce,"Mushroom Kebab, 2 pack302 g",$5.00ea,$1.66/ 100g
produce,"MarzettiVeggie Dip, Spinach340 g",$5.49ea,$1.61/ 100g
produce,Small Cubed Cantaloupe300 g,$6.00ea,$2.00/ 100g
produce,"Garlic, Peeled250 g",$3.49ea,$1.40/ 100g
produce,Carrots & Cucumber 255 g,$4.00ea,$1.57/ 100g
produce,Farmer's MarketCortland Apples4 lb bag,$7.99ea,$0.44/ 100g
produce,President's ChoiceMini Sweet Potatoes1.5 lb bag,$4.99ea,$0.73/ 100g
produce,Premium Baby Spinach With Chicken294 g,$8.00ea,$2.72/ 100g
produce,Avocado Case2 kg case,$11.99ea,$0.60/ 100g
produce,Earthbound Farms OrganicOrganic Vegetable Tray with Ranch Dip 454 g,$8.99ea,$1.98/ 100g
produce,President's ChoiceGreen Beans340 g,$4.99ea,$1.47/ 100g
produce,Rutabaga,$4.52(est.)ea,$2.84/ 1kg
produce,Farmer's MarketSpartan Apples4 lb bag,$6.99ea,$0.39/ 100g
produce,"Chanterelle Mushrooms, Dried14 g",$5.49ea,$39.21/ 100g
produce,Anjou Pears,$1.58(est.)ea,$6.59/ 1kg
produce,Flavour Burst Sungold Golden Kiwi454 g,$5.99ea,$1.32/ 100g
produce,Organic Grape Tomatoes680 g,$7.99ea,$1.18/ 100g
produce,"Halloween Decorative Mini Corn, 3 Pack 1 ea",$1.99ea,$1.99/ 1ea
produce,PC OrganicsOrganics Whole Cremini Mushrooms227 g,$2.99ea,$1.32/ 100g
produce,PC OrganicsOrganic Yellow Potatoes3 lb bag,$5.49ea,$0.40/ 100g
produce,President's ChoiceCreamy Greek Pouch 44Ml44 ml,$0.59ea,$1.34/ 100ml
produce,Gold Cored Pineapple0.6 kg,$5.99ea,$1.00/ 100g
produce,"GreenhouseRaw, Organic Juice Farma-C300 ml",$7.49ea,$2.50/ 100ml
produce,Berry Berry Small295 g,$6.00ea,$0.60/ 100g
produce,Collard Greens1 bunch,$3.99ea,$3.99/ 1ea
produce,PC OrganicsOrganics Whole Oyster Mushrooms100 g,$3.99ea,$3.99/ 100g
produce,President's ChoiceChopped Mexican Style Street Corn Salad Kit285 g,$6.49ea,$2.28/ 100g
produce,PC OrganicsHoneycrisp Apples 3Lb Bag1.36 kg,$10.99ea,$0.81/ 100g
produce,President's ChoiceBlsmic Vin Pouch 45Ml45 ml,$0.59ea,$1.31/ 100ml
produce,President's ChoiceSweet Baby Lettuce142 g,$4.99ea,$3.51/ 100g
produce,Frisee Lettuce 2-pack200 g,$4.99ea,$2.50/ 100g
produce,Santa Claus Melons,$9.60(est.)ea,$5.05/ 1kg
produce,PC OrganicsRomaine Lettuce Hearts3 ea,$6.99ea,$2.33/ 1ea
produce,PC OrganicsOrganic Rosemary20 g,$2.99ea,
produce,"Farmer's MarketBartlett Pear, 2 L1 ea",$6.99ea,$6.99/ 1ea
produce,"Wonderful Pistachios, Shelled170 g",$8.99ea,$5.29/ 100g
produce,PC OrganicsOrganic Beefsteak Red Tomato,$2.67(est.)ea,$9.90/ 1kg
produce,Butternut Squash,$7.07(est.)ea,$4.39/ 1kg
produce,President's ChoiceOregano28 g,$2.50ea,
produce,PC OrganicsHand-Picked Gala Apples3 lb bag,$9.99ea,$0.73/ 100g
produce,"ParamountPistachios, Roasted Salted450 g",$11.99ea,$2.66/ 100g
produce,President's ChoiceLive Lettuce Boston1 ea,$2.99ea,$2.99/ 1ea
produce,Farmer's MarketRed Onions3 lb bag,$4.99ea,$0.37/ 100g
produce,Radicchio Lettuce,$4.10(est.)ea,$13.21/ 1kg
produce,Cobb with Cheddar Salad Mini165 g,$5.00ea,$3.03/ 100g
produce,RemedyKombucha Lemon Lime & Mint  700 ml,$4.99ea,$0.71/ 100ml
produce,Bolthouse100% Carrot946 ml,$6.99ea,$0.74/ 100ml
produce,Baby Spinach,$7.05(est.)ea,$17.62/ 1kg
produce,BolthouseGinger Carrot Turmeric1540 ml,$9.99ea,$0.65/ 100ml
produce,LitehouseDip Organic Ranch283 g,$5.49ea,$1.94/ 100g
produce,Premium Garden Vegetable With Cheese218 g,$8.00ea,$3.67/ 100g
produce,PC OrganicsOrganics Baby Cut Carrots2 lb,$5.99ea,$0.66/ 100g
produce,Roasted Corn & Pepper Quinoa,$9.20(est.)ea,$21.90/ 1kg
produce,Wholly GuacamoleChunky Bowl 213 g,$4.99ea,$2.34/ 100g
produce,Turmeric,$4.32(est.)ea,$30.84/ 1kg
produce,Tiffany GatesClassic Coleslaw,$21.90/1 kg,$21.90/ 1kg
produce,White Onion,$2.44(est.)ea,$6.59/ 1kg
produce,Popeye Select Spinach1 kg,$11.99ea,$1.06/ 100g
produce,GreenhouseFiery Ginger Juice240 ml,$14.99ea,$6.25/ 100ml
produce,"Taylor FarmsChopped Salad Kit, Thai Style Chili Mango319 g",$6.49ea,$2.03/ 100g
produce,Chicken BLT Salad Mini145 g,$5.00ea,$3.45/ 100g
produce,PC OrganicsOrganic Field Greens & Baby Spinach - Salad Mix312 g,$7.99ea,$2.56/ 100g
produce,Organic Mini Watermelon2.1 kg,$8.99ea,$8.99/ 1ea
produce,Colossal Garlic,$1.98(est.)ea,$19.82/ 1kg
produce,"Corn Pepper Zucchini Red Pepper Kebab, 4 pack884 g",$9.00ea,$1.02/ 100g
produce,PC OrganicsOrganic Honeycrisp Apples,$2.77(est.)ea,$11.00/ 1kg
produce,"No NameRaw, Unsalted Pumpkin Seeds100 g",$1.99ea,$1.99/ 100g
produce,Oyster Mushrooms,$0.72/25 g,$2.86/ 100g
produce,Mixed Melon Cubed Large1 kg,$8.00ea,$1.48/ 100g
produce,Strawberry Parfait290 g,$5.00ea,$1.92/ 100g
produce,GoodLeafPea Shoots50 g,$3.99ea,$7.98/ 100g
produce,Turnips,$2.50(est.)ea,$6.59/ 1kg
produce,President's ChoicePoppyseed Pouch 44Ml44 ml,$0.59ea,$1.34/ 100ml
produce,Cobb with Cheddar Salad Mini165 g,$5.00ea,$3.03/ 100g
produce,RemedyKombucha Lemon Lime & Mint  700 ml,$4.99ea,$0.71/ 100ml
produce,Bolthouse100% Carrot946 ml,$6.99ea,$0.74/ 100ml
produce,Baby Spinach,$7.05(est.)ea,$17.62/ 1kg
produce,BolthouseGinger Carrot Turmeric1540 ml,$9.99ea,$0.65/ 100ml
produce,LitehouseDip Organic Ranch283 g,$5.49ea,$1.94/ 100g
produce,PC OrganicsOrganics Baby Cut Carrots2 lb,$5.99ea,$0.66/ 100g
produce,Roasted Corn & Pepper Quinoa,$9.20(est.)ea,$21.90/ 1kg
produce,The Little Potato CompanyOven BBQ Ready Garlic Herb Potatoes454 g,$4.99ea,$1.10/ 100g
produce,Pineapple/Straws Large600 g,$8.00ea,$1.33/ 100g
produce,Large House Salad658 g,$11.00ea,$1.67/ 100g
produce,"GreenhouseRaw, Organic Juice Deep Roots300 ml",$7.49ea,$2.50/ 100ml
produce,"Halloom Pineapple Kebab, 4 pack804 g",$9.00ea,$1.12/ 100g
produce,MarzettiCaramel Dip227 g,$5.49ea,$2.42/ 100g
produce,PC OrganicsOrganic Lime1 lb bag,$6.99ea,$1.54/ 100g
produce,President's ChoiceSouthwest Salad Kit369 g,$6.49ea,$1.76/ 100g
produce,"Morel Mushrooms, Dried14 g",$12.99ea,$92.79/ 100g
produce,Farmer's MarketCarrot Chips454 g,$2.99ea,$0.66/ 100g
produce,Carrots & Snap Peas 250 g,$4.00ea,$1.60/ 100g
produce,Oyster Mushrooms,$0.72/25 g,$2.86/ 100g
produce,Mixed Melon Cubed Large1 kg,$8.00ea,$1.48/ 100g
produce,Strawberry Parfait290 g,$5.00ea,$1.92/ 100g
produce,Chicken BLT Salad Mini145 g,$5.00ea,$3.45/ 100g
produce,PC OrganicsOrganic Field Greens & Baby Spinach - Salad Mix312 g,$7.99ea,$2.56/ 100g
produce,Organic Mini Watermelon2.1 kg,$8.99ea,$8.99/ 1ea
produce,Colossal Garlic,$1.98(est.)ea,$19.82/ 1kg
produce,"Corn Pepper Zucchini Red Pepper Kebab, 4 pack884 g",$9.00ea,$1.02/ 100g
produce,PC OrganicsOrganic Honeycrisp Apples,$2.77(est.)ea,$11.00/ 1kg
produce,"No NameRaw, Unsalted Pumpkin Seeds100 g",$1.99ea,$1.99/ 100g
produce,GoodLeafPea Shoots50 g,$3.99ea,$7.98/ 100g
produce,President's ChoiceKale Slaw340 g,$3.99ea,$1.17/ 100g
produce,Gourmet GardenBasil Stir-In Paste115 g,$5.99ea,$5.21/ 100g
produce,Sweet Nantes Carrots467 g,$3.49ea,$0.75/ 100g
produce,PC OrganicsOrganic Peppers Mini 227G227 g,$5.99ea,$2.64/ 100g
produce,Cortland Apples,$1.15(est.)ea,$5.49/ 1kg
produce,Premium Baby Spinach With Fruit & Nuts296 g,$8.00ea,$2.70/ 100g
produce,Red Anjou Pears,$1.54(est.)ea,$6.59/ 1kg
produce,"Spinach, Kale, Celery Juice1 ea",$13.00ea,$13.00/ 1ea
produce,White Asparagus,$6.16(est.)ea,$15.41/ 1kg
produce,Organic Orange907 g,$6.99ea,$0.77/ 100g
produce,President's ChoiceRed Potatoes5 lb bag,$5.99ea,$0.26/ 100g
produce,Brussels Sprouts,$0.26(est.)ea,$8.80/ 1kg
produce,President's ChoiceWhite Potatoes5 lb bag,$5.49ea,$0.24/ 100g
produce,Snow Peas200 g,$4.99ea,$2.50/ 100g
produce,President's ChoiceLive Lettuce Tri Mix - 1 Unit350 g,$3.99ea,$3.99/ 1ea
produce,PC OrganicsOrganic Roma Tomatoes454 g,$4.99ea,$1.10/ 100g
produce,Endive300 g,$5.99ea,$2.00/ 100g
produce,Broccolini1 bunch,$3.49ea,$3.49/ 1ea
produce,"Pumpkin, Large1 ea",$5.99ea,$5.99/ 1ea
produce,No NameNaturally Imperfect Limes907 g,$6.99ea,$0.77/ 100g
produce,Farmer's MarketWhite Potatoes10 lb bag,$5.99ea,$0.13/ 100g
produce,President's ChoiceMini Sweet Peppers454 g,$5.99ea,$1.32/ 100g
produce,PC OrganicsOrganic Lemons2 lb bag,$7.99ea,$0.88/ 100g
produce,Envy Apples,$1.32(est.)ea,$6.59/ 1kg
produce,PC OrganicsOrganic Cooking Onions2 lb bag,$4.99ea,$0.55/ 100g
produce,Farmer's MarketGrape Tomato 907G    908 g,$5.99ea,$0.66/ 100g
produce,Yellow Asian Pears,$2.82(est.)ea,$8.80/ 1kg
produce,"Taylor FarmsChopped Salad Kit, Thai Style Chili Mango319 g",$6.49ea,$2.03/ 100g
produce,POM Wonderful100% Pomegranate Juice473 ml,$5.99ea,$1.27/ 100ml
produce,"Spinach, Bunched1 ea",$2.99ea,$2.99/ 1ea
produce,Eat SmartSweet Kale Salad Kit340 g,$6.49ea,$1.91/ 100g
produce,President's ChoiceSalted California Pistachios225 g,$5.99ea,$2.66/ 100g
produce,Ataulfo Mango1 ea,$2.49ea,$2.49/ 1ea
produce,President's ChoiceNavel Oranges Cara Cara3 lb bag,$7.99ea,$0.59/ 100g
produce,Farmer's MarketMixed Peppers (6 Pack)6x1.0 ea,$7.99ea,$1.33/ 1ea
produce,President's Choice50-50 Blend - A Blend of Baby Spinach and Field Greens0.283 kg,$6.99ea,$2.47/ 100g
produce,Honeydew Slices630 g,$5.00ea,$0.50/ 100g
produce,"No NameRaw, Unsalted Sunflower Seeds100 g",$1.99ea,$1.99/ 100g
produce,Happy PlanetGo Nuts Chocolate Nut Milk900 ml,$6.99ea,$0.78/ 100ml
produce,Blueberry Organic Kombucha355 ml,$3.49ea,$0.98/ 100ml
produce,Gourmet GardenGarlic Stir-In Paste115 g,$5.99ea,$5.21/ 100g
produce,"ReneesSweet Onion Vinaigrette, Pouch42 g",$0.59ea,$1.40/ 100g
produce,Large Greek Salad800 g,$11.00ea,$1.38/ 100g
produce,AuroraOven Cooked Figs with Almonds250 g,$8.99ea,$3.41/ 100g
produce,GreenhouseOrganic Booster Pick-Me-Up60 ml,$3.99ea,$6.65/ 100ml
produce,Organic Medjool Dates454 g,$11.99ea,$2.64/ 100g
produce,"Lemon Grass, 2 Pack104 g",$2.99ea,$2.88/ 100g
produce,Apple Cosmic Crisp,$1.85(est.)ea,$7.69/ 1kg
produce,Shiitake Mushrooms,$0.77/25 g,$3.08/ 100g
produce,"Zucchini Pepper Kebab, 2 pack470 g",$5.00ea,$1.06/ 100g
produce,Veggie Tripack800 g,$13.00ea,$1.57/ 100g
produce,Red Beets,$0.75(est.)ea,$3.95/ 1kg
produce,Premium Greek Classic342 g,$8.00ea,$2.34/ 100g
produce,President's ChoiceAxiany Cherry Tomatoes0.225 kg,$4.99ea,$2.22/ 100g
produce,President's ChoiceRed Thai Hot Peppers75 g,$5.99ea,$7.99/ 100g
produce,Spartan Apples,$1.15(est.)ea,$5.49/ 1kg
produce,Greenbelt Organic Super Crunch0.142 kg,$5.99ea,$4.22/ 100g
produce,PC OrganicsOrganic Basil20 g,$2.99ea,
produce,Dried Porcini Mushrooms    14 g,$5.49ea,$39.21/ 100g
produce,President's ChoiceSage28 g,$2.50ea,
produce,President's ChoiceKent Mango1 ea,$2.99ea,$2.99/ 1ea
produce,Farmer's MarketMcIntosh Apples4 lb bag,$7.99ea,$0.44/ 100g
produce,Bosc Pears,$1.45(est.)ea,$6.59/ 1kg
produce,Farmer's MarketPaula Red Apples4 lb bag,$4.99ea,$0.28/ 100g
produce,RemedyOrg Kom Rasp Lemn 700Ml  700 ml,$4.99ea,$0.71/ 100ml
produce,MarzettiCream Cheese Fruit Dip106 g,$1.49ea,$1.38/ 100g
produce,Broccoli Cashew Crunch Salad,$5.48(est.)ea,$21.90/ 1kg
produce,GreenhouseGinger Turmeric Organic Kombucha1000 ml,$9.99ea,$1.00/ 100ml
produce,PC Blue MenuUnsalted California Pistachios 225 g,$5.99ea,$2.66/ 100g
produce,President's ChoiceBeets Mixed 907G907 g,$3.99ea,$0.44/ 100g
produce,Fruit Salad Small440 g,$7.00ea,$1.59/ 100g
produce,Pumpernickel Snack1 ea,$5.00ea,$5.00/ 1ea
produce,Jalapeno Peppers2000 ml,$5.99ea,$0.30/ 100ml
produce,Chayote Squash,$5.49/1 kg,$5.49/ 1kg
produce,Chickpea Salad296 g,$8.00ea,$2.70/ 100g
produce,RemedyKombucha Ginger Lemon700 ml,$4.99ea,$0.71/ 100ml
produce,"Halloom Pineapple Kebab, 2 pack402 g",$5.00ea,$1.24/ 100g
produce,GoodLeafSpicy Mustard Medley50 g,$3.99ea,$7.98/ 100g
produce,Happy PlanetClean Protein Smoothie Banana Cashew900 ml,$6.99ea,$0.78/ 100ml
produce,PC OrganicsOrganic Mini Carrots 1lb Bag1 lb bag,$3.49ea,$0.77/ 100g
produce,No NameNaturally Imperfect White Mushrooms680 g,$6.49ea,$0.95/ 100g
produce,BolthouseC-Boost946 ml,$6.99ea,$0.74/ 100ml
produce,Mixed Fruit Parfait290 g,$5.00ea,$1.69/ 100g
produce,PC OrganicsOrganic Ginger160 g,$4.99ea,$3.12/ 100g
produce,Watermelon Cubed Small 300G1 kg,$6.00ea,$0.60/ 100g
produce,MannsSnow Peas170 g,$5.99ea,$3.52/ 100g
produce,Deluxe Neptune Salad,$5.93(est.)ea,$21.90/ 1kg
produce,President's ChoiceSweet Potato454 g,$4.99ea,$1.10/ 100g
produce,Caesar Salad Mini135 g,$5.00ea,$4.55/ 100g
produce,Honeycrisp Apples,$1.05(est.)ea,$4.39/ 1kg
produce,Red Potatoes,$1.43(est.)ea,$5.49/ 1kg
produce,Radish454 g,$2.99ea,$0.66/ 100g
produce,Kale1 bunch,$2.99ea,$2.99/ 1ea
produce,Fennel1 ea,$3.99ea,$3.99/ 1ea
produce,Blackberries 1/2 Pint170 g,$4.49ea,$2.64/ 100g
produce,Shanghai Bok Choy,$3.51(est.)ea,$5.49/ 1kg
produce,White Mushrooms,$0.36(est.)ea,$1.21/ 100g
produce,Empire Apples,$0.88(est.)ea,$5.49/ 1kg
produce,President's ChoiceRed Thai Hot Peppers75 g,$5.99ea,$7.99/ 100g
produce,Spartan Apples,$1.15(est.)ea,$5.49/ 1kg
produce,Greenbelt Organic Super Crunch0.142 kg,$5.99ea,$4.22/ 100g
produce,PC OrganicsOrganic Basil20 g,$2.99ea,
produce,Dried Porcini Mushrooms    14 g,$5.49ea,$39.21/ 100g
produce,President's ChoiceSage28 g,$2.50ea,
produce,President's ChoiceKent Mango1 ea,$2.99ea,$2.99/ 1ea
produce,Farmer's MarketMcIntosh Apples4 lb bag,$7.99ea,$0.44/ 100g
produce,President's ChoiceVariety Pack Tomatoes680 g,$5.99ea,$0.88/ 100g
produce,President's ChoiceYellow Hot Hot Peppers226 g,$5.99ea,$2.65/ 100g
produce,PC OrganicsOrganic Broccoli1 ea,$5.49ea,$5.49/ 1ea
produce,Farmer's MarketEmpire Apples4 lb bag,$6.99ea,$0.39/ 100g
produce,Farmer's MarketLemons2 lb bag,$4.99ea,$0.55/ 100g
produce,The Little Potato CompanyMicrowave Ready Lemon and Garden Herb Potatoes454 g,$4.99ea,$1.10/ 100g
produce,No NameNaturally Imperfect White Mushrooms680 g,$6.49ea,$0.95/ 100g
produce,BolthouseC-Boost946 ml,$6.99ea,$0.74/ 100ml
produce,Mixed Fruit Parfait290 g,$5.00ea,$1.69/ 100g
produce,PC Blue MenuUnsalted California Pistachios 225 g,$5.99ea,$2.66/ 100g
produce,President's ChoiceBeets Mixed 907G907 g,$3.99ea,$0.44/ 100g
produce,PC OrganicsOrganic Ginger160 g,$4.99ea,$3.12/ 100g
produce,GoodLeafSpicy Mustard Medley50 g,$3.99ea,$7.98/ 100g
produce,Bolthouse100% Carrot1.54 l,$9.99ea,$0.65/ 100ml
produce,Matchstick Carrots283 g,$2.99ea,$1.06/ 100g
produce,President's ChoiceSweet Potato454 g,$4.99ea,$1.10/ 100g
produce,Snack Platter Vegetables300 g,$5.00ea,$1.67/ 100g
produce,"PC OrganicsKale, Chard and Spinach Salad Mix142 g",$5.99ea,$4.22/ 100g
produce,No NameRoasted Peanuts In Shell2 kg,$10.99ea,$0.55/ 100g
produce,Chickpea Salad296 g,$8.00ea,$2.70/ 100g
produce,RemedyKombucha Ginger Lemon700 ml,$4.99ea,$0.71/ 100ml
produce,"Halloom Pineapple Kebab, 2 pack402 g",$5.00ea,$1.24/ 100g
produce,Caesar Salad Mini135 g,$5.00ea,$4.55/ 100g
produce,GoodLeafMicro Broccoli50 g,$3.99ea,$7.98/ 100g
produce,President's ChoiceBasil80 g,$3.99ea,
produce,Pitted Honey Dates907 g,$6.99ea,$0.77/ 100g
produce,Kumato Tomatoes454 g,$5.99ea,$1.32/ 100g
produce,Large Chicken Caesar Salad656 g,$11.00ea,$1.68/ 100g
produce,Duda FarmsDuda Celery Sticks454 g,$5.99ea,$1.32/ 100g
produce,Caesar Salad Family Size1 kg,$16.00ea,$1.76/ 100g
produce,President's ChoiceArugula0.142 kg,$4.99ea,$3.51/ 100g
produce,PC OrganicsSliced and Whole Bistro Blend Mushrooms200 g,$6.99ea,$3.50/ 100g
produce,PC OrganicsOrganics Sliced Cremini Mushrooms227 g,$3.29ea,$1.45/ 100g
produce,Happy PlanetMango Smoothie900 ml,$6.99ea,$0.78/ 100ml
produce,Coconut Rolled Medjool Dates340 g,$8.99ea,$2.64/ 100g
produce,Earthbound Farms OrganicChop Honey Citrus Salad207 g,$6.99ea,$3.38/ 100g
produce,PC OrganicsOrganic White Stuffer Mushrooms320 g,$5.99ea,$1.87/ 100g
produce,BolthouseGreen Goodness946 ml,$6.99ea,$0.74/ 100ml
produce,PC OrganicsOrganic Blueberries277 g,$6.49ea,$2.34/ 100g
produce,Sweet Onions 3lb Bag3 lb bag,$7.99ea,$0.59/ 100g
produce,POM WonderfulPomegranate Juice710 ml,$9.99ea,$1.41/ 100ml
