category,product_name,price,per_unit_price
bakery,Country Harvest14 Grains Whole Wheat Bread600 g,$3.99ea,$0.67/ 100g
bakery,President's ChoiceTortillas Original 650 g,$4.29ea,$0.66/ 100g
bakery,President's ChoiceEnglish Muffins Original 6 Fork-Split Muffins342 g,$2.89ea,$0.85/ 100g
bakery,White Baguette255 g,$1.69ea,$0.66/ 100g
bakery,Farmer's MarketButter Croissant270 g,$3.99ea,$1.48/ 100g
bakery,"WonderBread, Sliced White675 g",$3.99ea,$0.59/ 100g
bakery,Old MillWhite Bread675 g,$2.79ea,$0.41/ 100g
bakery,Old Mill100% Whole Wheat Bread675 g,$2.79ea,$0.41/ 100g
bakery,Farmer's MarketBanana Chocolate Chunk Muffins600 g,$6.99ea,$1.17/ 100g
bakery,WonderWhite Hotdog Buns8x44.5 g,$3.99ea,$1.12/ 100g
bakery,Casa MendosaLarge Whole Wheat Tortillas640 g,$4.79ea,$0.75/ 100g
bakery,WonderWhite Hamburger Buns8x47.25 g,$3.99ea,$1.06/ 100g
bakery,"WonderThin Sandwich Bread, White675 g",$3.99ea,$0.59/ 100g
bakery,Farmer's MarketChocolate Chip Muffins600 g,$6.99ea,$1.17/ 100g
bakery,WonderWhite Bread with Fibre675 g,$3.99ea,$0.59/ 100g
bakery,"ACEBread, White Baguette350 g",$3.79ea,$1.08/ 100g
bakery,DItalianoThick Slices Bread675 g,$3.99ea,$0.59/ 100g
bakery,Country HarvestEverything Bagel450 g,$3.99ea,$0.89/ 100g
bakery,Farmer's MarketBlueberry Muffins570 g,$6.99ea,$1.23/ 100g
bakery,"President's ChoiceMini Muffins, Chocolate275 g",$5.29ea,$1.92/ 100g
bakery,No NameBagel Plain 6 Pack510 g,$2.79ea,$0.55/ 100g
bakery,No NameBagel Everthing480 g,$2.79ea,$0.58/ 100g
bakery,Kaiser Rolls Large 6 Pack350 g,$3.99ea,$1.14/ 100g
bakery,Wonder100% Whole Wheat Bread675 g,$3.99ea,$0.59/ 100g
bakery,Farmer's MarketCarrot Muffins600 g,$6.99ea,$1.17/ 100g
bakery,WonderWhite Bread White Texas675 g,$3.99ea,$0.59/ 100g
bakery,Country HarvestEverything Bread600 g,$3.99ea,$0.67/ 100g
bakery,Country HarvestCinnamon Raisin Bread600 g,$3.99ea,$0.67/ 100g
bakery,"Casa Mendosa10 Medium Tortillas, Original340 g",$4.29ea,$1.26/ 100g
bakery,President's ChoiceBanana Chocolate Chip Mini Muffins275 g,$5.29ea,$1.92/ 100g
bakery,Dufflet8'' Harvest Caramel Apple Cake 1.1 kg,$29.99ea,$2.73/ 100g
bakery,Farmer's MarketPecan Butter Tarts6x85.0 g,$7.29ea,$1.43/ 100g
bakery,CadburyCaramilk Dome Cake1.2 kg,$16.99ea,$2.43/ 100g
bakery,Bulk Ts Donut100 g,$1.89ea,$1.89/ 100g
bakery,Sha ShaGinger Snap Cookies300x300.0 g,$7.49ea,$2.50/ 100g
bakery,CharlottesEuropean Spritz Butter Cookies430 g,$7.99ea,$1.86/ 100g
bakery,PC OrganicsOrganic 100% Whole Grain Bread709 g,$4.99ea,$0.70/ 100g
bakery,President's ChoiceMultigrain Flatbread300 g,$2.79ea,$0.93/ 100g
bakery,Farmer's MarketStrawberry Loaf Cake390 g,$4.49ea,$1.15/ 100g
bakery,"Old Mill12"" Thin Pizza Starter Kit700 g",$4.39ea,$0.63/ 100g
bakery,Cheese Swirl Buns 4 Pack400 g,$5.79ea,$1.45/ 100g
bakery,"7 Grain Bread, Sliced570 g",$3.99ea,$0.89/ 100g
bakery,President's ChoicePumpernickel Rye Loaf Bread480 g,$3.59ea,$0.75/ 100g
bakery,PC Dinner Rolls  Whole Wheat12x1.0 ea,$3.79ea,$0.32/ 1ea
bakery,BaxtersVanilla Raspberry Cream6x67.0 g,$5.49ea,$1.37/ 100g
bakery,DItalianoSesame Seed Bread675 g,$3.99ea,$0.59/ 100g
bakery,All Butter Almondine Rolls255 g,$3.99ea,$1.16/ 100g
bakery,"Farmer's MarketTea Biscuits, Cheddar Cheese315 g",$6.29ea,$2.00/ 100g
bakery,"Pumpernickel Bread, Unsliced675 g",$4.79ea,$0.71/ 100g
bakery,Sha ShaCookies Pumpkin Spice Snaps250 g,$5.29ea,$2.12/ 100g
bakery,No NameEnglish Muffin Whole Wheat342 g,$2.89ea,$0.85/ 100g
bakery,Submarine Buns 4 Pack464 g,$2.79ea,$2.15/ 100g
bakery,All Butter Chocolatine 4 pack248 g,$3.99ea,$1.61/ 100g
bakery,Farmer's MarketChocolate Cake490 g,$6.99ea,$1.43/ 100g
bakery,"White Subs, 2 Pack200 g",$1.59ea,$0.80/ 100g
bakery,DempsterFresh White Bread675 g,$3.39ea,$0.50/ 100g
bakery,Farmer's MarketCarrot Cake875 g,$15.99ea,$1.83/ 100g
bakery,Farmer's MarketLemon Curd Cake475 g,$6.99ea,$1.47/ 100g
bakery,two-biteTwo-Bite®  Halloween Vanilla Cupcakes284 g,$5.29ea,$1.86/ 100g
bakery,President's ChoiceThick Pizza Crust300 g,$3.49ea,$1.16/ 100g
bakery,President's ChoiceBrioche Loaf400 g,$3.99ea,$1.00/ 100g
bakery,Buns Kaiser 2 Pack117 g,$1.59ea,$1.36/ 100g
bakery,Farmer's MarketFruitck Dark Pecan Topped500 g,$8.99ea,$1.80/ 100g
bakery,President's ChoiceGluten Free Hot Dog Buns65 g,$4.49ea,$1.73/ 100g
bakery,Macarons Assorted Pk 696 g,$5.99ea,$6.24/ 100g
bakery,DItalianoBrizzolio Bread600 g,$3.99ea,$0.67/ 100g
bakery,Panini Roll 2 Pack107 g,$1.59ea,$1.49/ 100g
bakery,"Casa Mendosa6 Large Tortillas, Tomato Salsa384 g",$4.79ea,$1.25/ 100g
bakery,LA FOURNEE DOREE Croissant Bun300 g,$6.99ea,$2.33/ 100g
bakery,President's ChoiceTraditional Naan250 g,$3.19ea,$1.28/ 100g
bakery,FurlaniFrozen Texas Toast Garlic16x40.0 g,$4.69ea,$0.73/ 100g
bakery,"Casa Mendosa10 Medium Tortillas, Whole Wheat340 g",$4.29ea,$1.26/ 100g
bakery,ACECiabatta Piccola 800 g,$6.29ea,$0.79/ 100g
bakery,Dempster100% Whole Wheat Bread675 g,$3.89ea,$0.58/ 100g
bakery,President's ChoiceMultigrain Flatbread300 g,$2.79ea,$0.93/ 100g
bakery,President's ChoicePumpernickel Rye Loaf Bread480 g,$3.59ea,$0.75/ 100g
bakery,BaxtersVanilla Raspberry Cream6x67.0 g,$5.49ea,$1.37/ 100g
bakery,DItalianoSesame Seed Bread675 g,$3.99ea,$0.59/ 100g
bakery,All Butter Almondine Rolls255 g,$3.99ea,$1.16/ 100g
bakery,Sha ShaGinger Snap Cookies300x300.0 g,$7.49ea,$2.50/ 100g
bakery,Farmer's MarketFruitcake Light with Marzipan500 g,$8.99ea,$1.80/ 100g
bakery,CharlottesEuropean Spritz Butter Cookies430 g,$7.99ea,$1.86/ 100g
bakery,PC OrganicsOrganic 100% Whole Grain Bread709 g,$4.99ea,$0.70/ 100g
bakery,President's ChoiceTriple Chocolate Cake710 g,$17.49ea,$2.46/ 100g
bakery,Farmer's MarketStrawberry Loaf Cake390 g,$4.49ea,$1.15/ 100g
bakery,"Old Mill12"" Thin Pizza Starter Kit700 g",$4.39ea,$0.63/ 100g
bakery,Cheese Swirl Buns 4 Pack400 g,$5.79ea,$1.45/ 100g
bakery,"7 Grain Bread, Sliced570 g",$3.99ea,$0.89/ 100g
bakery,Villa Di MannoStuffing Croutons567 g,$4.59ea,$0.81/ 100g
bakery,PC Dinner Rolls  Whole Wheat12x1.0 ea,$3.79ea,$0.32/ 1ea
bakery,DimpflmeierBread Original Swedish Style Light Rye454 g,$4.49ea,$0.99/ 100g
bakery,President's ChoiceItalian Style Bread Crumbs275 g,$1.99ea,$0.72/ 100g
bakery,DimpflmeierKlosterbrot Bread454 g,$4.49ea,$0.99/ 100g
bakery,Dimpflmeier100% Rye Bread With Flaxseeds454 g,$4.29ea,$0.94/ 100g
bakery,Frontier BakeryLebanese Style Whole Wheat Pita330 g,$1.39ea,$0.42/ 100g
bakery,No NameBagel Whole Wheat510 g,$2.79ea,$0.55/ 100g
bakery,President's ChoicePumpernickel Rye Loaf Bread480 g,$3.59ea,$0.75/ 100g
bakery,President's ChoiceItalian Style Bread Crumbs275 g,$1.99ea,$0.72/ 100g
bakery,"Blueberry Pie, 8 Inch680 g",$5.99ea,$0.88/ 100g
bakery,Country HarvestOriginal Bagels450 g,$3.99ea,$0.89/ 100g
bakery,President's ChoiceMini Naan Garlic 4 Flatbreads180 g,$3.49ea,$1.94/ 100g
bakery,DItalianoThick Sliced Brioche-Style Loaf0.62 g,$3.99ea,$0.64/ 100g
bakery,PoppersWheat Popped Grains120 g,$4.99ea,$4.16/ 100g
bakery,ACEOlive Oil & Sea Salt Mini Crisps180 g,$6.29ea,$3.49/ 100g
bakery,BaxtersSwiss Roll Chocolate6x67.0 g,$5.49ea,$1.37/ 100g
bakery,Farmer's Market7 Layer Square450 g,$6.99ea,$1.55/ 100g
bakery,Core 12 Grain Breads284 g,$4.29ea,$1.51/ 100g
bakery,"Farmer's MarketSliced Loaf Cake, Marble420 g",$5.99ea,$1.43/ 100g
bakery,Farmer's MarketCake Tuxedo1.15 kg,$16.99ea,$1.48/ 100g
bakery,President's ChoiceBread Crumbs300 g,$1.59ea,$0.53/ 100g
bakery,Farmer's MarketCake Carrot1.4 kg,$22.99ea,$1.64/ 100g
bakery,Casa MendosaExtra Large Burrito Tortillas630 g,$4.19ea,$0.67/ 100g
bakery,"Apple ValleyApple Pie, No Sugar Added 8""620 g",$6.99ea,$1.13/ 100g
bakery,Flame-Baked Naan Cilantro & Roasted Garlic400 g,$3.99ea,$1.00/ 100g
bakery,Farmer's MarketCake Tiramisu 995 g995 g,$16.99ea,$1.71/ 100g
bakery,RudolphsBavarian Rye Bread500 g,$4.29ea,$0.86/ 100g
bakery,Farmer's MarketLemon Coffee Cake500 g,$6.00ea,$1.20/ 100g
bakery,PC Multigrain Laiser 6S400 g,$3.99ea,$1.00/ 100g
bakery,two-biteVanilla Cupcakes284 g,$4.99ea,$1.76/ 100g
bakery,President's ChoiceGluten Free Tortillas Original360 g,$5.99ea,$1.66/ 100g
bakery,Old Fashioned Apple Pie114 g,$1.79ea,$1.57/ 100g
bakery,School SafeMuffin Bars Banana Chocolate Chip296 g,$3.69ea,$1.25/ 100g
bakery,DimpflmeierMarble Rye Bread500 g,$3.79ea,$0.76/ 100g
bakery,President's ChoiceGigantico Burger Buns 8x71.0 g,$3.99ea,$0.70/ 100g
bakery,SurajNaan Orginal 10 Pk1 ea,$5.29ea,$5.29/ 1ea
bakery,ACERustic Italian Oval350 g,$4.59ea,$1.31/ 100g
bakery,"President's ChoiceMini Muffins, Carrot275 g",$5.29ea,$1.92/ 100g
bakery,Honey Glazed Ring Donuts 2 Pack2x160.0 g,$3.49ea,$2.18/ 100g
bakery,President's ChoiceVanilla Bark Cake690 g,$17.49ea,$2.53/ 100g
bakery,President's ChoiceBrandy Fruitcake524 g,$9.99ea,$1.91/ 100g
bakery,President's ChoiceGluten Free Hamburger Buns80 g,$4.49ea,$1.40/ 100g
bakery,"two-biteTwo-Bite®  Halloween Chocolate Cupcakes, 12 Pack284 g",$5.29ea,$1.86/ 100g
bakery,Amazing Grain Raisin Bread Sliced450 g,$4.49ea,$1.00/ 100g
bakery,President's ChoiceGluten Free Strawberry Cake 553 g,$9.99ea,$1.81/ 100g
bakery,"Sourdough Bread, Sliced450 g",$4.79ea,$0.71/ 100g
bakery,"100% Whole Wheat Bread, Sliced450 g",$3.29ea,$0.73/ 100g
bakery,Farmer's MarketChocolate Cake850 g,$15.99ea,$1.88/ 100g
bakery,Country HarvestCranberry & Oats Bagel450 g,$3.99ea,$0.89/ 100g
bakery,"Italian Bread, Multi-grain  Sliced450 g",$3.49ea,$0.78/ 100g
bakery,PC OrganicsOrganic Original Tortilla 10390 g,$4.39ea,$1.13/ 100g
bakery,King’s Hawaiian Sweet Rolls 0.34 kg,$4.49ea,$1.32/ 100g
bakery,President's ChoiceGarlic Naan 250 g,$3.19ea,$1.28/ 100g
bakery,WonderWhole Wheat Hamburger Buns8x56.0 g,$3.99ea,$0.89/ 100g
bakery,Farmer's MarketMini Chocolate Chip Cookies310 g,$5.99ea,$1.93/ 100g
bakery,DimpflmeierMarble Rye Bread500 g,$3.79ea,$0.76/ 100g
bakery,President's ChoiceGigantico Burger Buns 8x71.0 g,$3.99ea,$0.70/ 100g
bakery,ACERustic Italian Oval350 g,$4.59ea,$1.31/ 100g
bakery,"President's ChoiceMini Muffins, Carrot275 g",$5.29ea,$1.92/ 100g
bakery,President's ChoiceVanilla Bark Cake690 g,$17.49ea,$2.53/ 100g
bakery,President's ChoiceBrandy Fruitcake524 g,$9.99ea,$1.91/ 100g
bakery,President's ChoiceGluten Free Hamburger Buns80 g,$4.49ea,$1.40/ 100g
bakery,Honey Glazed Ring Donuts 2 Pack2x160.0 g,$3.49ea,$2.18/ 100g
bakery,SurajNaan Orginal 10 Pk1 ea,$5.29ea,$5.29/ 1ea
bakery,President's ChoiceGluten Free Tortillas Original360 g,$5.99ea,$1.66/ 100g
bakery,Country HarvestCranberry & Oats Bagel450 g,$3.99ea,$0.89/ 100g
bakery,"100% Whole Wheat Bread, Sliced450 g",$3.29ea,$0.73/ 100g
bakery,Farmer's MarketChocolate Cake850 g,$15.99ea,$1.88/ 100g
bakery,Farmer's MarketButter Croissants Mini336 g,$3.99ea,$1.19/ 100g
bakery,Farmer's MarketOatmeal & Chocolate Cookies456 g,$5.99ea,$1.31/ 100g
bakery,ACEPane Rustico Bread600 g,$5.79ea,$0.97/ 100g
bakery,DItalianoBrizzolio Sausage Buns420 g,$3.99ea,$0.95/ 100g
bakery,DimpflmeierBread Original Swedish Style Light Rye680 g,$4.29ea,$0.63/ 100g
bakery,Apple Fritter Donut 2 Pack2x290.0 g,$3.49ea,$1.20/ 100g
bakery,Farmer's MarketRaisin Butter Tarts6x85.0 g,$7.29ea,$1.43/ 100g
bakery,Poppers Popped Grains Wheat Minis45 g,$3.99ea,$8.87/ 100g
bakery,No NameWhole Wheat Mini Pitas170 g,$1.99ea,$1.17/ 100g
bakery,PC OrganicsOrganic Everything Bagel450 g,$4.49ea,$1.00/ 100g
bakery,Cheese Swirl Bun 2 Pack133 g,$3.19ea,$2.40/ 100g
bakery,RudolphsLight Rye Bread680 g,$4.29ea,$0.63/ 100g
bakery,"ACEArtisan Crisps, Rosemary & Sea Salt180 g",$6.29ea,$3.49/ 100g
bakery,"Farmer's MarketCookies, Peanut Butter, 12 Pack456 g",$5.99ea,$1.31/ 100g
bakery,DItalianoSausage Buns456 g,$3.99ea,$0.88/ 100g
bakery,Kaiser Rolls Whole Wheat 6 Pack400 g,$3.99ea,$1.00/ 100g
bakery,President's ChoiceTortillas Original 340 g,$3.79ea,$1.11/ 100g
bakery,"Pumpernickel Bread, Sliced450 g",$3.19ea,$0.71/ 100g
bakery,DimpflmeierBread Prebiotic Multi-Grain454 g,$3.79ea,$0.83/ 100g
bakery,Farmer's MarketSliced Loaf Cake Blueberry 420 g,$5.99ea,$1.43/ 100g
bakery,"Country HarvestBagels, Raisin Cinnamon with Whole Wheat450 g",$3.99ea,$0.89/ 100g
bakery,President's ChoiceYukon Gold Potato Loaf480 g,$3.59ea,$0.75/ 100g
bakery,Farmer's MarketSandwich Croissant260 g,$3.99ea,$1.53/ 100g
bakery,Ready BakeGarlic Bread330 g,$3.99ea,$1.21/ 100g
bakery,DimpflmeierSonnenblumenkerne Bread454 g,$4.49ea,$0.99/ 100g
bakery,Wonder100% Whole Wheat Bread Thin Sliced675 g,$3.99ea,$0.59/ 100g
bakery,Country HarvestProtein Bread600 g,$3.99ea,$0.67/ 100g
bakery,two-biteMini Chocolate Cupcakes 12 Pack284 g,$5.29ea,$1.86/ 100g
bakery,Sesame Egg Roll375 g,$3.99ea,$1.06/ 100g
bakery,Savoury Roll85 g,$1.49ea,$1.75/ 100g
bakery,President's ChoiceGluten Free Millet & Quinoa454 g,$5.79ea,$1.28/ 100g
bakery,SurajNaan Garlic 10 Pk1 kg,$5.29ea,$0.53/ 100g
bakery,Kimberley's BakeshoppeFrosted Harvest Orange & Yellow383 g,$4.49ea,$1.18/ 100g
bakery,VachonAh Caramel336 g,$4.09ea,$1.22/ 100g
bakery,"Farmer's MarketLoaf Cake, Banana390 g",$5.99ea,$1.54/ 100g
bakery,No NameWhole Wheat Mini Pitas170 g,$1.99ea,$1.17/ 100g
bakery,President's ChoiceYukon Gold Potato Loaf480 g,$3.59ea,$0.75/ 100g
bakery,Farmer's MarketSandwich Croissant260 g,$3.99ea,$1.53/ 100g
bakery,DimpflmeierBread Prebiotic Multi-Grain454 g,$3.79ea,$0.83/ 100g
bakery,Poppers Popped Grains Wheat Minis45 g,$3.99ea,$8.87/ 100g
bakery,PC OrganicsOrganic Everything Bagel450 g,$4.49ea,$1.00/ 100g
bakery,Cheese Swirl Bun 2 Pack133 g,$3.19ea,$2.40/ 100g
bakery,DimpflmeierSonnenblumenkerne Bread454 g,$4.49ea,$0.99/ 100g
bakery,two-biteMini Chocolate Cupcakes 12 Pack284 g,$5.29ea,$1.86/ 100g
bakery,VachonAh Caramel336 g,$4.09ea,$1.22/ 100g
bakery,"Farmer's MarketLoaf Cake, Banana390 g",$5.99ea,$1.54/ 100g
bakery,No NameBagel Sesame 6 Pack510 g,$2.79ea,$0.55/ 100g
bakery,Sesame Egg Roll375 g,$3.99ea,$1.06/ 100g
bakery,Savoury Roll85 g,$1.49ea,$1.75/ 100g
bakery,President's ChoiceGluten Free Millet & Quinoa454 g,$5.79ea,$1.28/ 100g
bakery,SurajNaan Garlic 10 Pk1 kg,$5.29ea,$0.53/ 100g
bakery,Kimberley's BakeshoppeFrosted Harvest Orange & Yellow383 g,$4.49ea,$1.18/ 100g
bakery,ACECiabatta Pezzetti Duo 840 g,$6.29ea,$0.75/ 100g
bakery,La BaguetterieWhite Oval454 g,$2.79ea,$0.61/ 100g
bakery,No NameWhole Wheat Dinner Roll420 g,$3.49ea,$0.83/ 100g
bakery,FurlaniFrozen Texas Toast Parmesan Garlic16x40.0 g,$4.69ea,$0.73/ 100g
bakery,Ready BakeGarlic Bread330 g,$3.99ea,$1.21/ 100g
bakery,Wonder100% Whole Wheat Bread Thin Sliced675 g,$3.99ea,$0.59/ 100g
bakery,Country HarvestProtein Bread600 g,$3.99ea,$0.67/ 100g
bakery,two-biteMini Vanilla Cupcakes 12 Pack284 g,$5.29ea,$1.86/ 100g
bakery,President's ChoiceTraditional Naan Club Size 750 g,$5.59ea,$0.75/ 100g
bakery,Country Harvest14 Grain Bagels450 g,$3.99ea,$0.89/ 100g
bakery,Farmer's MarketBumbleberry Crumble Pie1 kg,$9.99ea,$1.00/ 100g
bakery,Farmer's MarketRaisin Bran Muffins600 g,$6.99ea,$1.17/ 100g
bakery,Farmer's MarketDate Square450 g,$6.99ea,$1.55/ 100g
bakery,DItalianoBrioche-Style Hamburger Buns560 g,$3.99ea,$0.71/ 100g
bakery,President's ChoiceÀ L’Européenne Light Rye Loaf480 g,$3.59ea,$0.75/ 100g
bakery,President's ChoiceTraditional Naan Rounds480 g,$4.29ea,$0.89/ 100g
bakery,ACEAged Cheddar Mini Crisps150 g,$6.29ea,$4.19/ 100g
bakery,Old Fashioned Wild Blueberry Pie114 g,$1.79ea,$1.57/ 100g
bakery,Farmer's MarketMacaroons350 g,$6.49ea,$1.85/ 100g
bakery,No NameEnglish Muffin Original 6 Pack342 g,$2.89ea,$0.85/ 100g
bakery,Country HarvestSourdough Bagel450 g,$3.99ea,$0.89/ 100g
bakery,Farmer's MarketMini Angel Food Cakes270 g,$5.99ea,$2.22/ 100g
bakery,ACEBrioche Bagel272 g,$4.19ea,$1.54/ 100g
bakery,Farmer's MarketRed Velvet Cake490 g,$6.99ea,$1.43/ 100g
bakery,two-biteChocolate Cupcakes284 g,$4.99ea,$1.76/ 100g
bakery,President's ChoiceMini Tortilllas Original 192 g,$3.39ea,$1.77/ 100g
bakery,"6"" Grand Maman Marie Sponge Flan100 g",$2.99ea,$2.99/ 100g
bakery,"Kimberley's BakeshoppeHalloween Frosted Cookies, Pack 10383 g",$4.99ea,$1.30/ 100g
bakery,PC Blue Menu100% Whole Wheat Loaf450 g,$5.19ea,$1.15/ 100g
bakery,Dark Fruit Cake370 g,$5.99ea,$1.62/ 100g
bakery,Country HarvestQuinoa Flax Bread600 g,$3.99ea,$0.67/ 100g
bakery,President's ChoiceOriginal Mini Bagel380 g,$3.49ea,$0.92/ 100g
bakery,Farmer's MarketMarble Coffee Cake500 g,$6.00ea,$1.20/ 100g
bakery,DimpflmeierVollkornbrot Bread454 g,$3.79ea,$0.83/ 100g
bakery,Hawaiian Sprinkle Donutss 2 Pack2x200.0 g,$3.49ea,$1.75/ 100g
bakery,"Farmer's MarketSliced Loaf Cake, Vanilla420 g",$5.99ea,$1.43/ 100g
bakery,ACEGourmet Brioche Burger Buns260 g,$3.99ea,$1.53/ 100g
bakery,President's Choice Khubz Middle Eastern-Style Pita400 g,$3.49ea,$0.87/ 100g
bakery,President's ChoiceMeringue Nests100 g,$3.99ea,$3.99/ 100g
bakery,President's ChoiceCarrot Nut Rustic Cake610 g,$7.99ea,$1.31/ 100g
bakery,"Rolls, Calabrese480 g",$3.99ea,$0.83/ 100g
bakery,Texas Hot Dog Buns520 g,$3.00ea,$0.58/ 100g
bakery,Country HarvestNo Sugar Whole Wheat600 g,$3.99ea,$0.67/ 100g
bakery,Farmer's MarketMini Angel Food Cakes270 g,$5.99ea,$2.22/ 100g
bakery,ACEBrioche Bagel272 g,$4.19ea,$1.54/ 100g
bakery,Farmer's MarketRed Velvet Cake490 g,$6.99ea,$1.43/ 100g
bakery,Farmer's MarketMacaroons350 g,$6.49ea,$1.85/ 100g
bakery,No NameEnglish Muffin Original 6 Pack342 g,$2.89ea,$0.85/ 100g
bakery,Country HarvestSourdough Bagel450 g,$3.99ea,$0.89/ 100g
bakery,"6"" Grand Maman Marie Sponge Flan100 g",$2.99ea,$2.99/ 100g
bakery,"Kimberley's BakeshoppeHalloween Frosted Cookies, Pack 10383 g",$4.99ea,$1.30/ 100g
bakery,PC Blue Menu100% Whole Wheat Loaf450 g,$5.19ea,$1.15/ 100g
bakery,Dark Fruit Cake370 g,$5.99ea,$1.62/ 100g
bakery,two-biteChocolate Cupcakes284 g,$4.99ea,$1.76/ 100g
bakery,President's ChoiceMini Tortilllas Original 192 g,$3.39ea,$1.77/ 100g
bakery,Old Fashioned Wild Blueberry Pie114 g,$1.79ea,$1.57/ 100g
bakery,Bread Cinnamon Raisin Sliced550 g,$4.49ea,$0.82/ 100g
bakery,Sha ShaShasha Cocoa Snaps300x300.0 g,$7.49ea,$2.50/ 100g
bakery,Farmer's MarketBlack Forest Cake750 g,$15.99ea,$2.13/ 100g
bakery,Farmer's MarketChocolate Ganache Coffee Cake500 g,$6.00ea,$1.20/ 100g
bakery,Country HarvestQuinoa Flax Bread600 g,$3.99ea,$0.67/ 100g
bakery,LA FOURNEE DOREEMini Brioches480 g,$4.29ea,$0.89/ 100g
bakery,"Cherry Pie, 8 Inch680 g",$5.99ea,$0.88/ 100g
bakery,"Apple Pie, 8 Inch750 g",$5.99ea,$0.80/ 100g
bakery,La BaguetterieRoasted Garlic Oval398 g,$2.79ea,$0.70/ 100g
bakery,Country HarvestSunflower Flax Bread600 g,$3.99ea,$0.67/ 100g
bakery,Farmer's MarketOatmeal Raisin Cookies456 g,$5.99ea,$1.31/ 100g
bakery,"Elite Sweets6"" Spicy Pumpkin Mousse Cake750 g",$16.99ea,$2.27/ 100g
bakery,Farmer's MarketCookies Oatmeal456 g,$5.99ea,$1.31/ 100g
bakery,Farmer's MarketPumpkin Pie 10 Inch900 g,$9.99ea,$1.11/ 100g
bakery,"Pumpkin Pie, 8 Inch680 g",$5.99ea,$0.88/ 100g
bakery,Casa MendosaLarge Spinach Tortillas384 g,$4.79ea,$1.25/ 100g
bakery,"WestonTexas Toast Bread, 100% Whole Wheat675 g",$3.99ea,$0.59/ 100g
bakery,Frontier BakeryWhite Bread Greek Pitas425 g,$1.59ea,$0.37/ 100g
bakery,Farmer's MarketPecan Pie 9 Inch580 g,$9.99ea,$1.72/ 100g
bakery,Frontier BakeryThick Pouch Whole Wheat Pitas425 g,$1.59ea,$0.37/ 100g
bakery,Farmer's MarketNanaimo Square400 g,$6.99ea,$1.75/ 100g
bakery,"Kimberley's BakeshoppeTwo-Bite® Halloween Mini Pumpkin & Ghost Sugar Cookies, 25 CT284 g",$4.99ea,$1.76/ 100g
bakery,RubschlagerBavarian Multigrain Loaf454 g,$2.89ea,$0.64/ 100g
bakery,WonderFlour Tortillas White 10 Medium 340 g,$3.99ea,$1.17/ 100g
bakery,Farmer's MarketFudge Square400 g,$6.99ea,$1.75/ 100g
bakery,Farmer's MarketBrownies265 g,$4.99ea,$1.88/ 100g
bakery,DItalianoBrioche-Style Sausage Buns420 g,$3.99ea,$0.95/ 100g
bakery,President's ChoiceWhole Wheat Naan Rounds Buns480 g,$4.29ea,$0.89/ 100g
bakery,Farmer's MarketChocolate Chip Cookies456 g,$5.99ea,$1.31/ 100g
bakery,President's ChoiceAppetizer Flatbreads220 g,$2.79ea,$1.27/ 100g
bakery,ACEEverything Bagel Baguette360 g,$4.19ea,$1.16/ 100g
bakery,No NameOriginal Mini Pitas170 g,$1.99ea,$1.17/ 100g
bakery,ACEToasted Sesame Mini Crisps180 g,$6.29ea,$3.49/ 100g
bakery,"ACEBakery Bread, Sliced Organic Granary Loaf525 g",$6.19ea,$1.18/ 100g
bakery,Sha ShaCoconut Chia Snaps 300 g,$6.99ea,$2.33/ 100g
bakery,"WestonTurkey Ready, Bread675 g",$3.99ea,$0.59/ 100g
bakery,DItalianoThick Slice Bread 100% Whole Wheat 675 g,$3.99ea,$0.59/ 100g
bakery,"Celebration Cupcakes, White6x300.0 g",$6.49ea,$0.36/ 100g
bakery,Farmer's MarketCake Cookies And Crème1.2 kg,$22.99ea,$1.92/ 100g
bakery,DimpflmeierPumpernickel Bread454 g,$3.79ea,$0.83/ 100g
bakery,Farmer's MarketLemon Cranberry Muffins600 g,$6.99ea,$1.17/ 100g
bakery,ACEGourmet Sausage Bun340 g,$3.99ea,$1.17/ 100g
bakery,two-biteCupcakes Assorted568 g,$7.79ea,$1.37/ 100g
bakery,Texas Hot Dogs Sesame Buns528 g,$3.00ea,$0.57/ 100g
bakery,School SafeMuffin Bars Birthday Cake296 g,$3.69ea,$1.25/ 100g
bakery,President's ChoiceEuropean Multi Grain Bread500 g,$3.59ea,$0.72/ 100g
bakery,President's ChoiceProtein Tortillas342 g,$3.49ea,$1.02/ 100g
bakery,"ACEFocaccia, Cranberry Raisin320 g",$6.59ea,$2.06/ 100g
bakery,Amazing Grain Bread Sliced450 g,$4.49ea,$1.00/ 100g
bakery,Farmer's MarketAssorted Mini Tarts300 g,$7.29ea,$2.43/ 100g
bakery,Country HarvestOat & Honey Whole Wheat Bread600 g,$3.99ea,$0.67/ 100g
bakery,Cinnamon Twist Donut 6 pack690 g,$7.99ea,$1.16/ 100g
bakery,ACEWhite Baguette Bagel300 g,$4.19ea,$1.40/ 100g
bakery,WonderWrap Me White Flour Tortillas Large 640 g,$3.99ea,$0.62/ 100g
bakery,"ACEOval, Roasted Garlic454 g",$5.99ea,$1.32/ 100g
bakery,Farmer's MarketMini Cinnamon Rolls9x30.0 g,$6.29ea,$2.33/ 100g
bakery,President's ChoiceGluten Free White Bread454 g,$3.99ea,$0.88/ 100g
bakery,President's ChoiceOriginal Pizza Crusts440 g,$3.49ea,$0.76/ 100g
bakery,"Flax Bread, Sliced450 g",$3.99ea,$0.89/ 100g
bakery,"Ready BakeDemi-Baguette, White200 g",$2.99ea,$1.50/ 100g
bakery,Frontier BakeryWhole Wheat Greek Pitas425 g,$1.59ea,$0.37/ 100g
bakery,Old MillCracked Wheat Bread675 g,$2.79ea,$0.41/ 100g
bakery,Chocolate Dip Donut 2 Pack2x170.0 g,$3.49ea,$2.05/ 100g
bakery,PC Blue MenuEverything Bagels 6 Bagels336 g,$4.49ea,$1.23/ 100g
bakery,"Instore Made Cinnamon Buns, Glaze and Icing 4 pack612 g",$4.99ea,$0.82/ 100g
bakery,President's ChoiceMultigrain Pizza Crusts440 g,$3.49ea,$0.76/ 100g
bakery,"President's ChoiceTramezzini Crustless Bread, Whole Wheat250 g",$2.39ea,$0.96/ 100g
bakery,DItalianoHamburger Buns Brizzolio Extra Soft528 g,$3.99ea,$0.76/ 100g
bakery,DimpflmeierRye Bread With Sunflower Seeds454 g,$4.49ea,$0.99/ 100g
bakery,"Caramel Apple Pie, 8 Inch680 g",$5.99ea,$0.88/ 100g
bakery,"Farmer's MarketLoaf Cake, Cinnamon Swirl390 g",$5.99ea,$1.54/ 100g
bakery,VachonJos Louis The Original Cakes324 g,$4.09ea,$1.26/ 100g
bakery,President's ChoiceEverything Naan Dippers Club Size410 g,$5.79ea,$1.41/ 100g
bakery,"Sesame Egg Bread, Sliced450 g",$3.89ea,$0.86/ 100g
bakery,"Farmer's MarketTea Biscuits, Raisin315 g",$6.29ea,$2.00/ 100g
bakery,"6"" Chocolate Brownie Cheesecake600 g",$18.99ea,$3.17/ 100g
bakery,Pumpernickel Sesame Bagels600 g,$4.29ea,$0.72/ 100g
bakery,RudolphsBavarian Multi-grain Bread500 g,$4.29ea,$0.86/ 100g
bakery,CharlottesReal Chocolate Brownie Bites290 g,$4.99ea,$1.72/ 100g
bakery,President's ChoiceAppetizer Flatbreads220 g,$2.79ea,$1.27/ 100g
bakery,Farmer's MarketCake Cookies And Crème1.2 kg,$22.99ea,$1.92/ 100g
bakery,Texas Hot Dogs Sesame Buns528 g,$3.00ea,$0.57/ 100g
bakery,No NameWhite Dinner Roll420 g,$3.49ea,$0.83/ 100g
bakery,President's ChoiceMini Naan Traditional 4 Flatbreads180 g,$3.49ea,$1.94/ 100g
bakery,Farmer's MarketApple Crumble Pie1 kg,$9.99ea,$1.00/ 100g
bakery,Farmer's MarketApple Pie 10 Inch1 kg,$9.99ea,$1.00/ 100g
bakery,Farmer's MarketMuffins Variety Pack590 g,$6.99ea,$1.18/ 100g
bakery,"Casa Mendosa6 Medium Tortillas, 50-50 Corn Wheat Mix204 g",$4.29ea,$2.10/ 100g
bakery,Corn Popped Grains120 g,$4.99ea,$4.16/ 100g
